URL,text,page_title,page_label,metadata
https://www.juriafrica.com/lex/decision-004-051-mincult-cab-26-juil-2004-16697.htm,"LE MINISTRE D'ETAT CHARGE DE LA CULTURE
Vu la constitution ;
Vu la loi n°2000/11 du 19 décembre 2000 relative au droit d'auteur et aux droits voisins ;
Vu le décret n°2001/956/PM du 1er novembre 2001 fixant les modalités d'application de la loi n° 2000/011 du 19 décembre 2000 relative au droit d'auteur et aux droits
Vu la décision n° 004/017/MINCULT/CAB du 03 juin 2004 portant création, organisation et fonctionnement de la Commission Permanente de Médiation et de Contrôle des Organismes de Gestion Collective;
Vu la décision n° 004/018/MINCULT/CAB du 03 juin 2004 portant nomination des membres de la Commission sus visée ;
Vu le procès verbal de la réunion de concertation du 13 juillet 2004 en vue de la fixation du montant de la redevance annuelle due au titre du droit d'auteur et des droits voisins par les cybercafés et secrétariats informatiques présenté par la Commission Permanente de Médiation et de Contrôle des Organismes de Gestion Collective du droit d'auteur et des droits voisins ;
Vu les nécessités de service;
DECIDE :
Art. 1er —  Les cybercafés et secrétariats informatiques de plus de 20 machines sont considérés comme des grands utilisateurs de logiciels.
Art. 2 —  Le montant de la redevance annuelle due au titre du droit d'auteur et des droits voisins par les cybercafés et secrétariats informatiques est fixé au taux forfaitaire de :
Quarante mille francs CFA (40 000 FCFA) pour les cybercafés et secrétariats de une (01) neuf (09) machines
Soixante mille francs CFA (60 000 FCFA) pour les cybercafés et secrétariats de dix (10) à dix-neuf machines (19).
Art. 4 —  La présente décision est applicable pendant une durée de trois (3) ans à compter du premier jour du mois suivant sa signature. A l'expiration de ce délai, les taux et montants arrêtés par la présente décision demeureront applicables jusqu'à leur révision.
Art. 5 —  La présente décision sera enregistrée, puis insérée au journal officiel en français et en anglais.",DECISION_N_004_051_MINCULT_CAB_DU_26_JUILLET_2004_FIXANT_LE_MONTANT_DE_LA_REDEVANCE_ANNUELLE_DUE_AU_TITRE_DU_DROIT_D_AUTEUR_ET_DES_DROITS_VOISINS_PAR_LES_CYBERCAFES_ET_SECRETARIATS_INFORMATIQUES,0,
