URL,text,page_title,page_label,category,metadata
https://www.juriafrica.com/lex/ordonnance-72-19-18-octobre-1972-17837.htm,"ORDONNANCE N° 72/19 DU 18 OCTOBRE 1972 AUTORISANT LE GOUVERNEMENT DE LA RÉPUBLIQUE UNIE DU CAMEROUN À CONCLURE UNE CONVENTION D'ÉTABLISSEMENT AVEC LA\SOCIÉTÉ CAMEROUNAISE DE SACHERIE.

LE PRESIDENT DE LA REPUBLIQUE,
VU la Constitution du 2 Juin 1972 ;
ORDONNE:
Art. 1er —  Le Gouvernement de la République Unie du Cameroun est autorisé, dans le cadre des dispositions du titre II, Sections 3 et 4 de la Loi n° 60/64 du 27 juin 1960 portant Code des Investissements, modifiée par les Lois n°s 64/LF/6 du 6 avril 1964 et 66/LF/5 du 10 juin 1966, à conclure une Convention d'Etablissement avec la Société Camerou-naise de Sacherie.
Art. 2 —  La présente Ordonnance dont le texte sera publié en Français et en Anglais au Journal Officiel de la République Unie du Cameroun, sera exécutée comme Loi de la République Unie du Cameroun./-",ORDONNANCE_N_72_19_DU_18_OCTOBRE_1972_AUTORISANT_LE_GOUVERNEMENT_DE_LA_REPUBLIQUE_UNIE_DU_CAMEROUN_A_CONCLURE_UNE_CONVENTION_D_ETABLISSEMENT_AVEC_LA_SOCIETE_CAMEROUNAISE_DE_SACHERIE,0,autres,
