URL,text,page_title,page_label,metadata
https://www.juriafrica.com/lex/ordonnance-61-of-18-27-decembre-1961-17800.htm,"LE PRESIDENT DE LA REPUBLIQUE FÉDÉRALE
VU la Constitution, et notamment son article 36,
ORDONNE:
TITRE I
COMPOSITION DE LA HAUTE COUR FEDERALE DE JUSTICE
Art. 1 —  La Haute Cour Fédérale de Justice siège à Yaoundé.
Elle se compose de 9 juges titulaires ; elle com-prend en outre 6 juges suppléants. Elle est assistée d'une Commission d'instruction.
Art. 2 —  Au début de chaque législature et dans les 20 jour, de la première session, l'Assemblée Fédérale élit les juges de la haute Cour.
Six juges titulaires ainsi que 3 juges suppléants sont choisis dans l'Assemblée Fédérale, au scrutin secret, et à la majorité absolue des membres la composant.
Art. 3 —  Trois juges titulaires et 3 juges suppléants sont choisis par l'Assemblée Fédérale hors de son sein, au scrutin à secret et à la majorité absolue des membres la composant. Les candidatures sont présentées par les membres de l'Assemblée. Les candidats doivent remplir les conditions prévues pour l'éligibilité à l'Assemblée Fédérale.
Art. 4 —  La Commission d'instruction comprend un Président élu dans son sein par l'Assemblée Fédérale, dans les mêmes formes et délai que ci-dessus et, 2 magistrats de la Cour Fédérale de Justice, désignés chaque année par l'Assemblée de la Cour Fédérale, hors de la présence des membres du Parquet.
Art. 5 —  Le Ministère Public prés la Haute Cour Fédérale est exercé par le Procureur Général prés la Cour Fédérale as-sisté de l'avocat général prés la même cour et le cas échéant» d'un avocat général prés d'une cour d'appel.
Art. 6 —  Le Greffier en chef de la cour fédérale est de croit greffier de la haute cour fédérale de justice ; il prête serment en cette dernière qualité à l'audience publique de la haute cour fédérale.
Art. 7 —  Dans les 10 jours suivant leur élection, les juges de la haute cour fédérale titulaires et suppléants, le président de la commission d'instruction prêtent, devant l'Assemblée Fédérale le serment suivant :
"" je jure et promets de bien et fidèlement remplir mes fonctions, de garder religieusement le secret des délibérations et des votes et de me conduire en tout comme un digne et loyal' magistrat.""
Art. 8 —  Dans le même délai, la haute cour fédérale procè-de a l'élection de son président et d'un vice-président, pris parmi les juges titulaires, membres de l'Assemblée Fédérale, scrutin secret et h la majorité absolue des membres la compo-sant.
Art. 9 —  Les membres de la haute cour fédérale sont tenus d'assister aux audiences et aux délibérations auxquels ils sont convoqués. 1 cas d'absence non justifiée par un motif gave, ils sont déclarés démissionnaires par la haute cour fé-dérale, statuant soit d'office, soit à la requête du Ministère public. Le président de l'Assemblée Fédérale en est avisé et fait immédiatement procéder à leur remplacement.
Art. 10 —  La démission volontaire d'un membre de la haute cour fédérale est adressée au président qui la transmet à l'Assemblée fédérale ; la démission prend effet à la date de l'élection du remplaçant.
Art. 11 —  Tout membre titulaire ou suppléant choisi dans l'Assemblée fédérale et qui cesse d'appartenir à ladite Assemblée cesse en même temps d'appartenir à la haute cour. Il est pourvu à son remplacement ; il en est de même du président de la commission d'instruction.
Art. 12 —  Les fonctions de membre du Gouvernement de l'Etat Fédéral ou d'un des Etats fédérés sont incompatibles avec les fonctions de juges titulaires ou suppléants à la haute cour ou de président de la commission d'instruction, et entraînent la démission d'office de ces dernières fonctions.
Art. 13 —  Il est procédé dans les mêmes formes que pour l'é-lection au remplacement des membres titulaires ou suppléants de la haute cour ainsi pue du président de la commission d'ins-truction dont les fonctions ont pris fin avant leur terme nor-mal, pour quelque cause que ce soit.
TITRE II
SAISINE DE LA HAUTE COUR
Art. 14 —  ,Le président de la République ne peut être mis en accusation que par un vote de l'Assemblée Fédérale émis au scrutin secret à la majorité absolue des membres la composant. La résolution de l'Esse -blée contient l'énoncé sommaire des faits qui lui sont reprochés.
Art. 15 —  ,Les juges titulaires et suppléants et le président de la commission d'instruction ne prennent part ni au débats ni au vote sur la mise en accusation.
Art. 16 —  Le président de l'Assemblée communique sans délai la résolution au procureur général qui en accuse immédiatement réception.
Art. 17 —  Dans les 24 heures de la réception de la résolu-tion, le procureur général notifie la mise en accusation au président de la haute cour et au président de la commission d'instruction ; celui-ci convoque sans délai la commission.
Art. 18 —  Le vice-président de l'Etat fédéral, les Ministères de l'Etat fédéral, les premiers Ministres et les Secrétaires d'Etat fédérés prévenus de complot contre la sûreté de l'Etat sont déférés à la haute cour par décret du Président de la République Fédérale.
La même procédure peut être appliquée à leurs coau-teurs et complices : lorsqu'une instruction est commencée par la justice ordinaire contre ces derniers le décret saisissant la haute cour peut être rendu jusqu'à la décision de renvoi. Tous les pièces de l'information sont adressées au procureur général sur ses réquisitions et par celui-ci transmises à la commission d'instruction.
Le complot contre la sûreté de l'Etat aux termes de l'article 36 de la Constitution s'entend de tous les crimes et délits contre la sûreté intérieure ou extérieure de l'Etat tels qu'ils sont définis par le code pénal.)
Art. 19 —  Le décret contient les noms des accusés, l'énoncé sommaire de faits reprochés et le visa des dispositions de la loi pénale en vertu desquelles la poursuite est exercée. Il est communiqué sans délai au procureur général et il est procédé ainsi qu'il est dit aux articles 17 et 13 ci-dessus.
TITRE III
INSTRUCTION
Art. 20 —  Jusqu'à la réunion de la commission d'instruction» son président peut accomplir tous les actes d'information utile à la manifestation de la vérité et peut décernér mandat de dépôt:: contre les accusés. Dés sa première réunion la commission confirme, le cas échéant, les mandats décernés Dar son président.
Art. 21 —  La commission d'instruction procède à tous les actes qu elle juge utiles à la manifestation de la vérité selon les règles de la procédure pénale et spécialement celles qui a assurent la garantie de la défense.
Art. 22 —  En cas de nécessité, la commission peut se faire assister d'un ou plusieurs magistrats qui reçoivent délégation pour instruire sur une ou plusieurs affaires, pour procéder à des commissions rogatoires ; ces magistrats sont désignés par ) l'Assemblée de la cour fédérale de justice hors de la présence b) des magistrats du parquet. Toutefois dans le cas prévu à l'article 13, 2° alinéa, la commission peut déléguer d'office le magistrat précédemment saisi à l'effet de continuer à recueil-lir les indices et les preuves.
Art. 23 —  Les actes de la commission d'instruction ne sont susceptibles d'aucun recours. La commission statue sur les incidents de procédure, notamment sur les nullités d'instruction; toute nullité non invoquée avant la décision de renvoi est couverte.
Art. 24 —  Dans le cas prévu à l'article 14 de la présente ordonnance, la commission d'instruction rend une décision de ren-voi qui apprécie s'il y a preuve suffisante de l'existence des faits éhontés dans la résolution de mise en accusation, mais non pas la qualification, Si l'instruction fait apparaître des faits d'un autre ordre que ceux énoncés dans la résolution de mise eh accu-sation, la commission ordonne la communication du dossier au Procureur général qui saisit l'Assemblée fédérale.
Si celle-ci dans les 15 jours suivant la communica-tion n'a pas adoptée une motion étendant la mise en accusation la commission reprend l'information sur les derniers errements de la procédure.
Art. 25 —  Dans le cas prévu à l'article 13 de la présente ordonnance, la commission d'instruction n'est saisie que des seu-les personnes désignées dans le décret, mais se saisit d'office de tous les crimes et délits de droit commun que l'informa-tion révèle à leur charge et oui sont connexes avec les crimes et délits contre la sûreté de l'Etat sui leur sort reprochés..
Lorsque la procédure, lui paraît complète, la commission ordonne s'il y a lieu le renvoi devant la haute cour an visant les dispositions de la loi pénale applicables aux faits retenus contre les accusés.
TITRE IV
PROCEDURE DEVANT LA HAUTE COUR
Art. 26 —  A la requête du procureur général, le président la haute cour fixe la date d'ouverture des débats.
Art. 27 —  A la diligence du procureur général, les accusés reçoivent 8 jours au glus tard avant leur comparution devant haute cour signification de l'ordonnance de renvoi.
Art. 28 —  Les membres de la haute cour, juges titulaires et juges suppléants sont convoqués par le greffier sur ordre du président 3 jours au moins avant l'ouverture de la session.
Art. 29 —  Tout membre de la haute cour peut être récusé :
s'il est parent ou allié de l'accusé jusqu'au sixième degré inclusivement;
s'il a été entendu ou s'il est cité comme témoin, Le ministère public ou un accusé ne peuvent citer comme témoin un membre de la haute cour qu'avec l'autorisation de la commission d'instruction;
s'il y a un motif d'inimitié capitale entre lui et l'accusé.
Art. 30 —  Tout juge qui sait une cause de récusation en sa personne même en dehors des cas prévus à l'article 20 est tenu de le déclarer à la haute cour qui décide s'il doit s'abstenir
Art. 31 —  Tout juge de la haute cour empêché de siéger pour quelque cause que ce soit est remplacé par un juge suppléant, ce dernier est tiré au sort dans la catégorie à laquelle appartient le juge empêché. Il est procédé publiquement au tirage a sort.
Art. 32 —  Les débats de la haute cour sont publics, la haut cour peut exceptionnellement ordonner le huis clos.
Art. 33 —  Les règles Je la procédure pénale en vigueur au Cameroun Oriental et relatives aux débats et aux jugements en matière correctionnelle sont applicables devant la haute cour sous réserve des dispositions ci-après :
Art. 34 —  Tout incident élevé au cours des débats de la haute cour peut sur décision du président être joint au fonds, sauf en ce qui concerne l'exception de prescription.
Art. 35 —  La haute cour après clôture des débats, retirée de chambre du conseil statue sur la culpabilité des accusés. Il est voté séparément Pour chacun des accusés sur chaque chef d'accusation et sur la question de savoir s'il y a des circonstances atténuantes. Le vote a lieu par bulletins secrets à la majorité des 6 voix au moins. Les bulletins blancs ou déclarés nuls sont comptés comme favorables à l'accusé.
Art. 36 —  Si l'accusé est déclaré coupable, il est voté sans désemparer sur l'application de la peine.
Toutefois après deux votes dans lesquels aucune peine n'ai obtenue la majorité simple des voix, la peine la plus forte proposée sera écartée pour le vote suivant, et ainsi de suite en écartant chaque fois la peine la plus forte proposée, jusqu'à ce Qu'une peine soit prononcée par la majorité simple.
La haute cour prononce les peines prévues par les lois pénales ordinaires qu'elle peut atténuer par application des circonstances atténuantes dans les termes de la loi.
L'arrêt est lu en audience publique par le prési-dent.
Art. 37 —  Les arrêts de la haute cour ne sont susceptibles ni d'appel ni de pourvoi en cassation.
Art. 38 —  Les régies de la contumace sont applicables de-vant la haute cour.
Art. 39 —  La constitution de partie civile est recevable devant la haute cour.
TITRE V
DISPOSITIONS DIVERSES
Art. 40 —  Les crédits nécessaires au fonctionnement de la haute cour de justice sont inscrits au budget de l'Assemblée fédérale.
Les fonctions de juge, de président et membres de la commission d'instruction et de ministère public sont gratuites.
Leur exercice ne donne droit qu'à des remboursements de frais.
Les indemnités allouées au greffier et au personnel mis à la disposition du président de la haute cour et de la commission d'instruction sont fixées par décret du prési-dent de la République Fédérale.
Art. 41 —  Les archives de la haute cour de justice seront déposées a la fin de chaque session aux archives nationales.
Art. 42 —  La présente ordonnance qui sera enregistrée et publiée au Journal Officiel de la République Fédérale du Cameroun en français et en anglais, le texte français faisant foi, sera exécutée comme loi organique de la République Fédérale du Cameroun,",ORDONNANCE_N_61_OF_18_DU_27_DECEMBRE_1961_PORTANT_ORGANISATION_DE_LA_HAUTE_COUR_FEDERALE_DE_JUSTICE,0,
