URL,text,page_title
Elle délibère valablement si les sociétaires présents, représentés ou ayant fait usage de la faculté de vote par correspondance, forment la majorité.
A défaut, elle ne peut prendre qu'une délibération provisoire; dans ce cas, une nouvelle assemblée générale est convoquée. Deux avis, publiés à huit jours d'intervalle, au moins un mois à l'avance, dans l'un des journaux habilités à recevoir les annonces légales, font connaître aux sociétaires les résolutions provisoires adoptées par la première assemblée, et ces résolutions deviennent définitives si elles sont approuvées par la nouvelle assemblée qui délibère valablement si le nombre des sociétaires présents, représentés ou ayant fait usage de la faculté de vote par correspondance, atteint au moins le cinquième du nombre total des sociétaires.
Art. 330-25 —  Assemblée générale, modification des statuts, augmentation des engagements des sociétaires
L'assemblée générale délibérant comme il est dit ci-après peut modifier les statuts dans toutes leurs dispositions. Elle ne peut, toutefois, ni changer la nationalité de la société, ni réduire ses engagements, ni augmenter les engagements des sociétaires résultant des contrats en cours, sauf en cas d'accroissement des impôts et taxes dont la récupération sur les sociétaires n'est pas interdite et sous réserve des dispositions de l'alinéa suivant.
Les modifications statutaires tendant à remplacer la cotisation fixe par une cotisation variable sont applicables aux contrats en cours, nonobstant toute clause contraire, un mois au moins après la notification faite aux assurés dans les formes prévues à l'article 330-26. Toutefois, dans le mois qui suit cette notification, l'assuré a le droit de résilier les contrats qu'il a souscrits auprès de la société, dans les conditions fixées par les deuxième et troisième alinéas de l'article 23 du Livre 1 du présent Code.
L'assemblée générale délibère valablement si le nombre des sociétaires présents, représentés ou ayant fait usage de la faculté de vote par correspondance, représente les deux tiers au moins du nombre total des sociétaires.
Si une première assemblée n'a pas réuni le quorum précédent, une nouvelle assemblée peut être convoquée. La convocation reproduit l'ordre du jour indiquant la date et le résultat de la précédente assemblée.
La seconde assemblée délibère valablement si le nombre des sociétaires présents, représentés ou ayant fait usage de la faculté de vote par correspondance, atteint la moitié du nombre total des sociétaires.
Si cette seconde assemblée ne réunit pas le quorum prévu à l'alinéa précédent, il peut être convoqué une troisième assemblée qui délibère valablement si le nombre des sociétaires présents, représentés ou ayant fait usage de la faculté de vote par correspondance, atteint le tiers du nombre total des sociétaires.
A défaut de quorum, cette troisième assemblée peut être prorogée à une date ultérieure de deux mois au plus à partir du jour auquel elle avait été convoquée.
Cette assemblée délibère valablement si le nombre des sociétaires présents, représentés ou ayant fait usage de la faculté de vote par correspondance, atteint le tiers du nombre total des sociétaires.
Dans les assemblées générales mentionnées au présent article, les résolutions, pour être valables, doivent toujours réunir les deux tiers au moins des voix des sociétaires présents ou représentés ou ayant fait usage de la faculté de vote par correspondance.
Art. 330-26 —  Statuts, modification, notification
Toute modification des statuts est portée à la connaissance des sociétaires, soit par remise du texte contre reçu, soit par pli recommandé, soit au plus tard avec le premier avis d'échéance ou récépissé de cotisation qui leur est adressé. Cette modification est également mentionnée sur les avenants aux contrats en cours.
Les modifications des statuts non notifiées à un sociétaire dans les formes prévues au précédent alinéa, ne lui sont pas opposables.
Art. 330-27 —  Commissaires aux comptes, nomination
L'assemblée générale nomme pour six exercices un ou plusieurs commissaires aux comptes.
Ne peuvent être nommés commissaires aux comptes d'une société régie par la présente section:
les fondateurs et administrateurs de la société, ainsi que leurs parents et alliés jusqu'au quatrième degré inclusivement;
les personnes et les conjoints des personnes qui reçoivent de celles mentionnées au 1° ci-dessous ou de la société un salaire ou une rémunération quelconque à raison de fonctions autres que celle de commissaire aux comptes ;
les sociétés de commissaires dont l'un des associés se trouve dans une des situations prévues au 1° et 2° ci-dessus.
Les commissaires aux comptes ne peuvent être nommés administrateurs ou directeurs des sociétés qu'ils contrôlent moins de cinq années après la cessation de leurs fonctions. La même interdiction est applicable aux associés d'une société de commissaires aux comptes.
Art. 330-28 —  Commissaires aux comptes, récusation Expertise de« minorité»
Le contrôle des sociétés d'assurance mutuelles est exercé par un ou plusieurs commissaires aux comptes conformément aux dispositions correspondantes de la loi sur les sociétés commerciales.
Le droit de récuser un ou plusieurs commissaires aux comptes et le droit de demander en justice la désignation d'un expert chargé de présenter un rapport sur une ou plusieurs opérations de gestion sont ouverts aux sociétaires admis à faire partie de l'assemblée générale et représentant au moins le dixième de ceux-ci.
Le président du tribunal de grande instance statue en référé sur les requêtes en justice des sociétaires relatives au contrôle des commissaires aux comptes.
Art. 330-29 —  Commissaires aux comptes, convocation
Les commissaires aux comptes sont convoqués, en même temps que les administrateurs, à la réunion du Conseil d'administration qui arrête les comptes de l'exercice écoulé. Ils sont également convoqués, au plus tard lors de la convocation des sociétaires, à toutes les assemblées générales.
Les commissaires aux comptes ne peuvent convoquer l'assemblée générale qu'après avoir vainement requis sa convocation du Conseil d'administration par lettre recommandée avec demande d'avis de réception. Si les commissaires aux comptes sont en désaccord sur l'opportunité de convoquer l'assemblée, l'un deux peut demander au président du tribunal de grande instance, statuant en référé, l'autorisation de procéder à cette convocation, les autres commissaires et le président du Conseil d'administration dûment appelés.
La communication aux commissaires aux comptes de documents détenus par des tiers qui ont accompli des opérations pour le compte de la société est autorisée par le président du tribunal de grande instance statuant en référé.
Art. 330-30 —  Commissaires aux comptes, honoraires
Le montant des honoraires des commissaires aux comptes est fixé d'un commun accord entre ceux-ci et la société.
Le président du tribunal de grande instance du lieu du siège social, statuant en référé, est compétent pour connaître tout litige tenant à la fixation du montant des honoraires.
Paragraphe III
Obligations des sociétaires et de la société
Art. 330-31 —  Sociétaires, limitation des engagements
Le sociétaire ne peut être tenu en aucun cas, sauf par application des dispositions du premier alinéa de l'article 330-25, ni au-delà de la cotisation inscrite sur sa police dans le cas d'une société à cotisations fixes, ni au-delà du montant maximal de cotisation indiqué sur sa police dans le cas d'une société à cotisations variables.
Le montant maximal de cotisation prévu dans ce dernier cas ne peut être inférieur à une fois et demie le montant de la cotisation normale nécessaire pour faire face aux charges probables résultant des sinistres et aux frais de gestion.
Le montant de la cotisation normale doit être indiqué sur les polices délivrées à leurs sociétaires par les sociétés à cotisations variables.
Les fractions du montant maximal de cotisation que les assurés des sociétés à cotisations variables peuvent, le cas échéant, avoir à verser en sus de la cotisation normale, sont fixées par le Conseil d'administration.
Les dispositions du présent article ne s'appliquent pas aux sociétés pratiquant une ou plusieurs des branches mentionnées aux 20 à 23 de l'article 328.
Art. 330-32 —  Tarification
Le Conseil d'administration décide de l'admissibilité et de la tarification de tout risque prévu par les statuts, sous réserve de l'application des lois et règlements en vigueur. Aucun traitement préférentiel ne peut être accordé à un sociétaire.
Art. 330-33 —  Mutuelles, emprunts
Les sociétés d'assurance mutuelles ne peuvent contracter d'emprunts que pour constituer:
le fond d'établissement qu'elles peuvent avoir à constituer aux termes de l'article 3305 ;
les nouveaux fonds d'établissement qu'elles peuvent avoir à constituer, aux termes de l'article 330-5 précité, lorsqu'elles sollicitent l'agrément pour de nouvelles branches ;
les fonds qui peuvent être nécessaires en vue du développement de leurs opérations et du financement de la production nouvelle;
le fonds social complémentaire.
Tous les emprunts destinés à former les fonds mentionnés aux 2° et 3° du précédent alinéa doivent être autorisés préalablement par l'assemblée générale délibérant comme il est dit à l'article 330-25.
Tout emprunt destiné à la constitution et, éventuellement, à l'alimentation du fonds social complémentaire doit être autorisé par l'assemblée générale délibérant comme il est dit à l'article 330-23 et faire l'objet d'une résolution spéciale dont la teneur doit être préalablement soumise à l'approbation de la Commission de contrôle des assurances, qui se prononcera au vu de l'un des plans mentionnés à l'article 330-7. Ce plan doit être obligatoirement joint au texte de la résolution. A l'expiration d'un délai de deux mois à dater du dépôt du texte de la résolution et du document mentionné ci-dessus, et en l'absence de décision expresse de la Commission, l'autorisation est considérée comme accordée. La résolution déterminera quels sociétaires devront souscrire à l'emprunt, sans que cette obligation puisse porter sur les sociétaires dont les contrats étaient en cours au moment où les statuts ont été modifiés. La participation des sociétaires déjà adhérents de la société au moment où celle-ci décide d'émettre un emprunt ne pourra être supérieure à 10 % de leur cotisation annuelle.
Dans tous les prospectus, affiches, circulaires, notices, annonces ou documents quelconques relatifs aux emprunts des sociétés, il doit être rappelé de manière explicite qu'un privilège est institué au profit des assurés par l'article 332 et indiqué que le prêteur, même s'il est assuré, ne bénéficie d'aucun privilège pour les intérêts et le remboursement de cet emprunt. Cette mention doit figurer également en caractères apparents sur les titres d'emprunts.
Art. 330-33 bis —  Mutuelles, emprunts et titres subordonnés
(Décision du Conseil des Ministres du 04/04/2000)
I- Les emprunts et titres subordonnés, entrant dans les éléments constitutifs de la marge de solvabilité, visés à l'article 337-1, doivent répondre aux conditions suivantes:
Dans l'hypothèse d'une liquidation de l'entreprise d'assurance débitrice, ces titres ou emprunts ne peuvent être remboursés qu'après règlement de toutes les autres dettes existant à la date de la liquidation ou contractées pour les besoins de celle-ci
Le contrat d'émission ou d'emprunt ne comporte pas de clause prévoyant que, dans des circonstances déterminées autres que la liquidation de l'entreprise d'assurance débitrice, la dette devra être remboursée avant l'échéance convenue
Le contrat d'émission ou d'emprunt prévoit qu'il ne pourra être modifié qu'après que la Commission aura déclaré, après avoir vérifié que le contrat modifié continuera de remplir les conditions fixées au présent article, ne pas s'opposer à la modification envisagée
Le contrat d'émission ou d'emprunt doit prévoir une échéance de remboursement des fonds au moins égale à cinq ans ou, lorsque aucune échéance n'est fixée, un préavis d'au moins cinq ans pour tout remboursement.
II- Au plus tard un an avant la date prévue pour le remboursement de tout ou partie des fonds visés au paragraphe 1 ci-dessus, l'entreprise d'assurance débitrice soumet à la Commission un plan indiquant comment la marge de solvabilité sera maintenue, après le remboursement, au niveau requis par la réglementation. Ce plan n'est pas exigé si la part des fonds incluse dans la marge de solvabilité est progressivement et régulièrement ramenée à zéro par l'entreprise d'assurance au cours des cinq dernières années au moins avant l'échéance de remboursement.
III- Les fonds provenant des emprunts et titres subordonnés à durée déterminée entrant dans la composition de la marge de solvabilité peuvent être remboursés par anticipation à l'initiative de l'entreprise d'assurance débitrice si la Commission a préalablement autorisé un tel remboursement, après s'être assurée que la marge de solvabilité ne risquait pas d'être ramenée en dessous du niveau nécessaire pour garantir durablement le respect de la marge requise par la réglementation.
Dans les mêmes conditions, la Commission peut autoriser le remboursement des fonds provenant des emprunts et titres subordonnés à durée indéterminée entrant dans la composition de la marge de solvabilité sans application du préavis prévu au 4° du paragraphe 1 du présent article.
Dans les cas visés au présent paragraphe, l'entreprise d'assurance débitrice soumet au moins six mois à l'avance à la Commission Régionale de contrôle des assurances, à l'appui de sa demande d'autorisation, un plan indiquant comment la marge de solvabilité sera maintenue, après le remboursement, au niveau requis par la réglementation. L'absence de décision notifiée à l'entreprise à l'expiration d'un délai de six mois vaut autorisation.
Sont notamment soumis aux dispositions du présent paragraphe l'amortissement anticipé par offre publique d'achat ou d'échange et le rachat en Bourse de titres cotés ; toutefois, un émetteur peut racheter en Bourse sans autorisation préalable jusqu'à 5% des titres émis, à condition d'informer la Commission des rachats effectués.
IV - Les contrats d'émission concernant des emprunts et titres à durée indéterminée qui prévoient formellement que tout remboursement est subordonné à autorisation préalable de la Commission n'ont pas à prévoir le délai de préavis minimum visé au 4° du paragraphe 1 du présent article.
Art. 330-34 —  Emprunt Titre représentatif
Le titre remis à tout sociétaire ayant souscrit à un emprunt pour constitution ou alimentation du fonds social complémentaire doit être établi dans la forme prévue par le Secrétariat général de la Conférence.
Art. 330-35 —  Excédents de recettes, répartition
Il ne peut être procédé à des répartitions d'excédents de recettes qu'après constitution des réserves et provisions prescrites par les lois et règlements en vigueur, après amortissement intégral des dépenses d'établissement et après que les dispositions réglementaires concernant la marge de solvabilité aient été satisfaites.
La Commission de contrôle peut s'opposer à une affectation d'excédents aux réserves libres.
Art. 330-36 —  Excédents distribuables
Les excédents distribuables en application de l'article 330-25 sont affectés par priorité à des remboursements anticipés de l'emprunt mentionné à l'article 330-7 proportionnels aux souscriptions de chaque sociétaire.
Lorsque la société prend l'initiative de radier un sociétaire, celui-ci peut demander à être immédiatement remboursé de sa contribution à cet emprunt. Il en est de même lorsque le sociétaire fait usage du droit prévu au deuxième alinéa de l'article 23 du Livre 1 du présent Code.
Art. 330-37 —  Force majeure, règlements partiels
En cas de force majeure résultant d'intempéries et d'épizooties d'un caractère exceptionnel, un décret pris sur le rapport de la Commission de contrôle des assurances et du Ministre de l'Agriculture de l'Etat membre, peut autoriser une ou plusieurs sociétés régies par la présente section, après épuisement de leurs ressources disponibles, à n'effectuer immédiatement qu'un règlement partiel des sinistres dus à ces causes. Les sociétés qui ont obtenu cette autorisation doivent affecter par priorité tous les excédents de recettes constatés ultérieurement, au paiement du solde de l'indemnité restant dû à chaque ayant droit.
Les dispositions du présent article ne s'appliquent pas aux sociétés pratiquant une ou plusieurs des branches mentionnées aux 20 à 23 de l'article 328.
Art. 330-38 —  Pertes atteignant la moitié des emprunts contractés
Dans le cas où, du fait de pertes constatées dans les documents comptables, l'actif net devient inférieur à la moitié du montant du fonds d'établissement, le Conseil d'administration est tenu de provoquer la réunion de l'assemblée générale délibérant comme il est dit à l'article 330-25, à l'effet de statuer sur la question de savoir s'il y a lieu de prononcer la dissolution de la société.
Art. 330-39 —  Sociétés d'assurance mutuelles, dissolution, excédent d'actif
En cas de dissolution non motivée par un retrait d'agrément d'une société d'assurance mutuelle, l'excédent de l'actif net sur le passif est dévolu, par décision de l'assemblée générale, soit à d'autres sociétés d'assurance mutuelles, soit à des associations reconnues d'utilité publique.
Paragraphe IV
Sociétés de réassurance mutuelles
Art. 330-40 —  Sociétés de réassurance mutuelles
Il peut être formé, entre sociétés régies par la présente section, des sociétés de réassurance mutuelles ayant pour objet la réassurance des risques garantis directement par les sociétés qui en font partie.
Ces sociétés de réassurance sont soumises aux dispositions de la présente section. Toutefois, elles sont valablement constituées lorsqu'elles réunissent au moins sept sociétés adhérentes; leurs statuts fixent, sans condition de montant minimal, le montant de leur fonds d'établissement; l'assemblée générale est composée de toutes les sociétés adhérentes.
Paragraphe V
Publicité
Art. 330-41 —  Sociétés d'assurance mutuelles, constitution, formalités
Dans le mois de la constitution de toute société d'assurance mutuelle, une expédition de l'acte constitutif, de ses annexes et une copie certifiée des délibérations prises par l'assemblée générale prévue à l'article 330-10 sont déposées en double exemplaire au greffe du tribunal de grande instance du siège social.
Ces mêmes documents doivent être déposés, dans le même délai, au ministère en charge du secteur des assurances dans l'Etat membre.
Art. 330-42 —  Publicité, extrait
Dans le même délai d'un mois, un extrait des documents mentionnés à l'article 330-41 est publié dans l'un des journaux habilités à recevoir les annonces légales. Il est justifié de l'insertion par un exemplaire du journal certifié par l'imprimeur et enregistré dans les trois mois de sa date.
Art. 330-43 —  Extrait
L'extrait doit contenir la dénomination adoptée par la société et l'indication du siège social, la désignation des personnes autorisées à gérer, administrer et signer pour la société et, en outre, le nombre d'adhérents, le montant des cotisations versées au dessous duquel la société ne pouvait être valablement constituée, l'époque où la société a été constituée, celle où elle doit finir et la date du dépôt au greffe du tribunal de grande instance.
Il indique également le montant et le mode de constitution du fonds d'établissement et s'il y a lieu, le montant du droit d'entrée.
L'extrait des actes et pièces déposées est signé, pour les actes publics, par le notaire.
Art. 330-44 —  Modification des statuts, dissolution
Sont soumis aux formalités ci-dessus prescrites, tous actes et délibérations ayant pour objet la modification des statuts ou la continuation de la société au-delà du terme fixé pour sa durée, ou la dissolution de la société avant ce terme.
Art. 330-45 —  Pièces déposées au greffe, communication
Toute personne a le droit de prendre communication des pièces déposées au greffe du tribunal de grande instance ou même de s'en faire délivrer à ses frais expédition ou extrait par le greffier ou par le notaire détenteur de la minute.
Toute personne peut également exiger qu'il lui soit délivré, au siège de la société, une copie certifiée des statuts, moyennant paiement d'une somme qui ne peut excéder 500 F.CFA.
Paragraphe VI
Nullités
Art. 330-46 —  Nullité de constitution
Toute société mentionnée à la présente section constituée en violation des articles 330-4 à 330-24 est nulle.
Toutefois, ni la société ni les sociétaires ne peuvent se prévaloir vis-à-vis des tiers de bonne foi des nullités ci-dessus prévues.
Art. 330-47 —  Nullités, effets
Lorsque la société est ainsi annulée, les fondateurs auxquels la nullité est imputable et les administrateurs en fonction au moment où elle a été encourue sont responsables solidairement envers les tiers et envers les sociétaires du dommage résultant de cette annulation.
Si, pour couvrir la nullité, une assemblée générale devait être convoquée, l'action en nullité n'est plus recevable à partir de la date de la convocation régulière de cette assemblée.
L'action en nullité de la société ou des actes et délibérations postérieurs à sa constitution est éteinte lorsque la cause de la nullité a cessé d'exister avant l'introduction de la demande ou, en tout cas, du jour où le tribunal statue sur le fond en première instance.
Nonobstant la régularisation, les frais des actions en nullité intentées antérieurement sont à la charge des défendeurs.
Le tribunal saisi d'une action en nullité peut, même d'office, fixer un délai pour couvrir les nullités.
L'action en responsabilité, pour les frais dont la nullité résultait, cesse également d'être recevable, lorsque la cause de la nullité a cessé d'exister, soit avant l'introduction de la demande, soit au jour où le tribunal statue sur le fond en première instance, soit dans un délai imparti pour couvrir la nullité, et, en outre, que trois ans se sont écoulés depuis le jour où la nullité était encourue.
Les actions en nullité ci-dessus mentionnées sont prescrites par cinq ans.
Art. 330-48 —  Agrément, action en nullité, restriction
A partir du jour où a été notifié à une société régie par la présente section l'arrêté de la Commission de contrôle des assurances lui accordant l'agrément mentionné à l'article 326, l'action en nullité prévue à l'article 330-47 ne peut être intentée que par la Commission de contrôle des assurances.
Section IV
Sociétés tontinières
Art. 331 —  Sociétés tontinières, définition
Les sociétés tontinières sont des sociétés d'assurance mutuelles qui réunissent leurs adhérents en groupes distincts dénommés associations et répartissent, à l'expiration de chacune de ces associations, les fonds provenant de la capitalisation en commun de leurs cotisations, déduction faite de la partie affectée aux frais de gestion, entre les survivants des associations en cas de vie ou entre les ayants droit des décédés des associations en cas de décès, en tenant compte de l'âge des adhérents et de leurs versements.
Les sociétés régies par la présente section doivent faire figurer à la suite de leur dénomination, dans leurs statuts, contrats ou titres émis par elles et autres documents de toute nature destinés à être distribués au public ou publiés, la mention ci-après en caractères uniformes: «société à forme tontinière ».
A l'exception du 3° de l'article 330-5, des articles 330-31, 330-35 à 330-38 et 330-40, les dispositions de la section 3 du présent chapitre sont applicables aux sociétés à forme tontinière, sous réserve des dérogations prévues à la présente section.
Art. 331-1 —  Souscriptions, prélèvements
Les fonds provenant des souscriptions doivent être intégralement versés aux associations sous la seule déduction des frais de gestion statutaires.
Les frais de gestion ne peuvent être prélevés sur les versements afférents à chaque souscription que dans une proportion uniforme pendant toute leur durée. Toutefois, pour faire face aux dépenses d'acquisition des contrats et dans la limite de ces dépenses, les sociétés peuvent prélever sur les premiers versements afférents à chaque souscription, si les statuts le stipulent, 3,50% au plus du montant de la souscription, sans pouvoir dépasser en aucun cas la moitié du prélèvement statutaire total.
Les fonds de chaque association doivent être gérés séparément et ne peuvent se confondre à aucun égard avec ceux des autres associations.
Art. 331-2 —  Nombre de membres des associations
Les associations en cas de survie ou en cas de décès que créent les sociétés à forme tontinière ne peuvent être valablement constituées que si elles comprennent au moins deux cents membres.
Art. 331-3 —  Durée
