URL,text,page_title
Tout conducteur d'un véhicule mentionné à l'article 200 doit, dans les conditions prévues aux articles de la présente section, être en mesure de présenter un document faisant présumer que l'obligation d'assurance a été satisfaite.
Cette présomption résulte de la production, aux fonctionnaires ou agents chargés de constater les infractions à la police de la circulation, d'un des documents dont les conditions d'établissement et de validité sont fixées par le présent Code.
Ces documents se composent d'une attestation d'assurance conservée par le propriétaire du véhicule et, détachable de cette attestation, d'un certificat d'assurance obligatoirement apposé sur le véhicule automoteur.
A défaut de ces documents, la justification est fournie aux autorités judiciaires par tous moyens.
Les documents prévus au présent article n'impliquent pas une obligation de garantie de la part de l'assureur.
Section I
L'attestation d'assurance
Art. 214 —  Mentions de l'attestation
Pour l'application de l'article 213, l'entreprise d'assurance doit délivrer, sans frais, un document justificatif pour chacun des véhicules couverts par la police.
Si la garantie du contrat s'applique à la fois à un véhicule à moteur et à ses remorques ou semi-remorques, un seul document justificatif peut être délivré, à la condition qu'il précise le type de remorques ou semi-remorques qui peuvent être utilisées avec le véhicule ainsi que, le cas échéant, leur numéro d'immatriculation.
Pour les contrats d'assurance concernant les personnes mentionnées à l'article 201, le document justificatif doit être délivré par l'entreprise d'assurance en autant d'exemplaires qu'il est prévu par le contrat.
Le document justificatif doit mentionner:
la dénomination et l'adresse de l'entreprise d'assurance;
les nom, prénoms et adresse du souscripteur du contrat;
le numéro de la police d'assurance ;
la période d'assurance correspondant à la prime ou portion de prime payée;
les caractéristiques du véhicule, notamment son numéro d'immatriculation ou, à défaut, et s'il y a lieu, le numéro du moteur;
dans le cas prévu au troisième alinéa du présent article, la profession du souscripteur ;
les noms des pays sur le territoire desquels la garantie contractuelle s'applique.
Art. 215 —  Valeur probante de l'attestation
La présomption qu'il a été satisfait à l'obligation d'assurance est établie par le document justificatif pour la période mentionnée sur ce document.
Art. 216 —  Délivrance des documents justificatifs : attestation provisoire
Le document justificatif mentionné à l'article 214 est délivré dans un délai maximal de quinze jours à compter de la souscription du contrat et renouvelé lors du paiement des primes ou portions de primes subséquentes.
Faute d'établissement immédiat de ce document, l'entreprise d'assurance délivre sans frais, à la souscription du contrat ou en cours de contrat, une attestation provisoire qui établit la présomption d'assurance pendant la période qu'elle détermine, dont la durée ne peut excéder un mois.
Cette attestation, qui est éventuellement établie en autant d'exemplaires que le document justificatif correspondant, doit mentionner:
la dénomination et l'adresse de l'entreprise d'assurance;
les nom, prénoms et adresse du souscripteur du contrat;
la nature et le type du véhicule ou, en ce qui concerne les contrats d'assurance mentionnés à l'article 201, la profession du souscripteur;
la période pendant laquelle elle est valable.
Art. 217 —  Forme de l'attestation
Les dimensions et la couleur de l'attestation d'assurance mentionnée à l'article 214 et de l'attestation provisoire d'assurance mentionnée à l'article 216 seront définies par la Commission de contrôle des assurances.
Art. 218 —  Véhicules non assujettis à l'obligation d'assurance
Pour l'utilisation des véhicules appartenant à l'Etat ou mis à sa disposition, non couverts par un contrat d'assurance et n'ayant pas fait l'objet d'une immatriculation spéciale, il est établi une attestation de propriété par l'autorité administrative compétente.
Art. 219 —  Vol ou perte de documents
En cas de perte ou de vol de l'attestation, l'assureur ou l'autorité compétente en délivre un duplicata sur la simple demande de la personne au profit de qui le document original a été établi.
Section II
Le certificat d'assurance détachable
Art. 220 —  Obligation
Tout souscripteur d'un contrat d'assurance prévu par l'article 200 doit apposer sur le véhicule automoteur assuré un certificat d'assurance qui est une partie détachable de l'attestation d'assurance.
Art. 221 —  Mentions du certificat
Toute entreprise d'assurance agréée dans un pays membre de la CIMA doit délivrer sans frais un certificat pour chacun des véhicules couverts par le contrat, à l'exception toutefois des remorques.
Le certificat doit mentionner :
la dénomination de l'entreprise d'assurance ;
un numéro permettant l'identification du souscripteur ;
le numéro d'immatriculation du véhicule;
le numéro du moteur lorsque le véhicule n'est pas soumis à immatriculation ;
les dates de début et de fin de validité.
Par dérogation au deuxième alinéa, le certificat délivré aux personnes mentionnées à l'alinéa 1er de l'article 201 ne doit comporter que les indications a), b) et e) ainsi qu'en termes apparents le mot « garage».
Tout conducteur d'un véhicule sur lequel est apposé le certificat décrit à l'alinéa précédent doit en outre être en mesure de justifier aux autorités chargées du contrôle des documents justificatifs que la conduite du véhicule lui a été confiée par une des personnes mentionnées à l'alinéa 1er de l'article 201.
Art. 222 —  Certificat provisoire
Le certificat mentionné à l'article 221 est délivré par l'entreprise d'assurance dans un délai maximal de quinze jours à compter de la souscription du contrat et renouvelé lors du paiement des primes ou portions de primes subséquentes.
Faute d'établissement immédiat de ce document, l'entreprise d'assurance délivre, sans frais, à la souscription du contrat ou en cours de contrat, un certificat provisoire.
Les dates de validité portées sur le certificat provisoire sont les mêmes que celles portées sur l'attestation et l'attestation provisoire.
En cas de perte ou de vol du certificat, l'assureur en délivre un double sur la demande justifiée du souscripteur du contrat.
Art. 223 —  Durée
La garantie de l'assureur prend fin à la date fixée dans les conditions particulières du contrat.
Art. 224 —  Véhicules non assujettis à l'obligation d'assurance
Les véhicules utilisés par l'Etat doivent être équipés, lorsqu'ils ne font pas l'objet d'une immatriculation spéciale, d'un certificat d'assurance spécifique dont les caractéristiques sont fixées par le Ministre en charge du secteur des assurances.
Chapitre IV
Indemnisation des victimes
Section I
Champ d'application
Art. 225 —  Dispositions générales
Les dispositions du présent Code s'appliquent, même lorsqu'elles sont transportées en vertu d'un contrat, aux victimes d'un accident causé par un véhicule terrestre à moteur ainsi que ses remorques ou semi-remorques.
Elles s'appliquent soit lors de la transaction, soit lors de la procédure judiciaire.
Section II
Régime juridique de l'indemnisation
Art. 226 —  Inopposabilité de la force majeure et du fait du tiers
Les victimes, y compris les conducteurs ne peuvent se voir opposer la force majeure ou le fait d'un tiers par le conducteur ou le gardien d'un véhicule mentionné à l'article 225.
Art. 227 —  Incidences de la faute du conducteur et impossibilité d'apprécier les fautes commises
(Décision du Conseil des Ministres du 22/04/1999)
La faute commise par le conducteur du véhicule terrestre à moteur a pour effet de limiter ou d'exclure l'indemnisation des dommages corporels ou matériels qu'il a subis. Cette limitation ou cette exclusion est opposable aux ayants droit du conducteur et aux personnes lésées par ricochet.
Lorsque les circonstances d'une collision entre deux ou plusieurs véhicules ne permettent pas d'établir les responsabilités encourues, chacun des conducteurs ne reçoit de la part du ou des autres conducteurs que la moitié de l'indemnisation du dommage corporel ou matériel qu'il a subi.
Lorsque le conducteur d'un véhicule terrestre à moteur n'en est pas le propriétaire, la faute de ce conducteur peut être opposée au propriétaire pour l'indemnisation des dommages causés à son véhicule. Le propriétaire dispose d'un recours contre le conducteur sous réserve des dispositions prévues à l'article 42.
Art. 228 —  Victimes n'ayant pas la qualité de conducteur
Les victimes, hormis les conducteurs de véhicules terrestres à moteur, sont indemnisées des dommages résultant des atteintes à leur personne qu'elles ont subis, sans que puisse leur être opposée leur propre faute à l'exception du cas où elles ont volontairement recherché les dommages subis.
Les fournitures et appareils délivrés sur prescription médicale donnent lieu à indemnisation selon les mêmes règles.
La faute commise par la victime a pour effet de limiter ou d'exclure l'indemnisation des dommages aux biens qu'elle a subis.
Art. 229 —  Lésés à la charge effective de la victime
Le préjudice subi par les personnes physiques qui établissent être en communauté de vie avec la victime directe de l'accident peut ouvrir droit à réparation dans les limites ci-après:
en cas de blessures graves réduisant totalement la capacité de la victime directe, seu1(s) le(les) conjoint(s) sont admis à obtenir réparation du préjudice moral subi, et ce dans la limite de deux SMIG annuels, pour l'ensemble des bénéficiaires ;
en cas de décès de la victime directe, la personne lésée par ricochet est assimilée, selon son age, à un enfant majeur ou mineur. A ce titre elle entre parmi les bénéficiaires énumérés aux articles 265 et 266 du présent code.
La réparation à laquelle elle peut prétendre entre dans la limite des plafonds fixés par ces textes.
Section III
Procédure d'offre
Art. 230 —  Communication des procès-verbaux
Un exemplaire de tout procès-verbal relatif à un accident corporel de la circulation doit être transmis, automatiquement aux assureurs impliqués dans ledit accident par les officiers ou agents de la police judiciaire ayant constaté l'accident. Le délai de transmission est de 3 mois à compter de la date de l'accident.
La forme et le contenu des procès-verbaux sont harmonisés à l'intérieur des Etats membres de la CIMA.
Art. 231 —  Délai de présentation de l'offre
(Décision du Conseil des Ministres du 22/04/1999)
Indépendamment de la réclamation que peut faire la victime, l'assureur qui garantit la responsabilité civile du fait d'un véhicule terrestre à moteur est tenu de présenter dans un délai maximum de douze mois à compter de l'accident une offre d'indemnité à la victime qui a subi une atteinte à sa personne. En cas de décès de la victime, l'offre est faite à ses ayants droit tels qu'ils sont définis aux articles 265 et 266 dans les huit mois du décès.
L'offre comprend tous les éléments indemnisables du préjudice, y compris les éléments relatifs aux dommages aux biens lorsqu'ils n'ont pas fait l'objet d'un règlement préalable.
Elle peut avoir un caractère provisionnel lorsque l'assureur n'a pas, dans les six mois de l'accident, été informé de la consolidation de l'état de la victime. L'offre définitive d'indemnisation doit alors être faite dans un délai de six mois suivant la date à laquelle l'assureur a été informé de cette consolidation.
En cas de pluralité de véhicules, et s'il y a plusieurs assureurs, l' offre est faite par l'assureur désigné dans la convention d'indemnisation pour compte d'autrui visée aux articles 267 et suivants.
Les dispositions qui précèdent ne sont pas applicables aux victimes à qui l'accident n'a occasionné que des dommages aux biens (véhicules et objets transportés).
Art. 232 —  Modalités de la communication du procès-verbal
A l'occasion de sa première correspondance avec la victime, l'assureur est tenu, à peine de nullité relative de la transaction qui pourrait intervenir, d'informer la victime qu'elle peut obtenir de sa part, sur simple demande, la copie du procès-verbal d'enquête de la force publique et de lui rappeler qu'elle peut à son libre choix, et à ses frais, se faire assister du conseil de son choix.
Art. 233 —  Offre tardive: pénalité
Lorsque l'offre n'a pas été faite dans les délais impartis à l'article 231, le montant de l'indemnité produit intérêt de plein droit au double du taux de l'escompte dans la limite du taux de l'usure à compter de l'expiration du délai et jusqu'au jour de l'offre devenue définitive. Cette pénalité est réduite, ou annulée, en raison de circonstances non imputables à l'assureur et notamment lorsqu'il ne dispose pas de l'adresse de la victime.
Art. 234 —  Protection des mineurs et des incapables
(Décision du Conseil des Ministres du 22/04/1999)
L'assureur doit soumettre au juge des tutelles ou au conseil de famille, compétent suivant les cas pour l'autoriser, tout projet de transaction concernant un majeur sous tutelle ou un mineur. Il doit également donner avis sans formalité au juge des tutelles ou au conseil de famille, quinze jours au moins à l'avance, du paiement du premier arrérage d'une rente ou de toute somme devant être versée à titre d'indemnité au représentant légal de la personne protégée.
Le paiement qui n'a pas été précédé de l'avis requis ou la transaction qui n'a pas été autorisée peut être annulée à la demande de tout intéressé ou du ministère public à l'exception de l'assureur.
Toute clause par laquelle le représentant légal se porte fort de la ratification par le mineur ou le majeur en tutelle de l'un des actes mentionnés à l'alinéa premier du présent article est nulle.
Art. 235 —  Faculté de dénonciation de la transaction
La victime peut, par lettre recommandée avec demande d'avis de réception, dénoncer la transaction dans les quinze jours de sa conclusion pour des motifs de non respect du présent code.
Toute clause de la transaction par laquelle la victime abandonne son droit de dénonciation est nulle.
Les dispositions ci-dessus doivent être reproduites en caractères très apparents dans l'offre de transaction et dans la transaction à peine de nullité relative à cette dernière.
Art. 236 —  Délai de paiement et intérêts de retard
Le paiement des sommes convenues doit intervenir dans un délai d'un mois après l'expiration du délai de dénonciation fixé à l'article 235.
Dans le cas contraire, les sommes non versées produisent de plein droit, intérêt au taux d'escompte majoré de moitié durant deux mois, puis, à l'expiration de ces deux mois, au double du taux d'escompte.
Art. 237 —  Exception de garantie: règlement pour compte
(Décision du Conseil des Ministres du 20 avril 1995)
Lorsque l'assureur invoque une exception de garantie légale ou contractuelle prévue à l'article 210 ci-dessus, il est tenu de satisfaire aux prescriptions des articles 231 à 236 pour le compte de qui il appartiendra; la transaction intervenue pourra être contestée, devant le juge par celui pour le compte de qui elle aura été faite, sans que soit remis en cause le montant des sommes allouées à la victime ou à ses ayants droit.
Art. 238 —  Véhicules de l'Etat
Pour l'application des articles 231 à 236 l'Etat est assimilé à un assureur.
Art. 239 —  Règlement contentieux: délais
(Décision du Conseil des Ministres du 22/04/1999)
Lorsque l'assureur qui garantit la responsabilité civile et la victime ne sont pas parvenus à un accord dans le délai prévu à l'article 231, l'indemnité due par l'assureur est calculée suivant les modalités fixées aux articles 258 et suivants.
Le litige entre l'assureur et la victime ne peut être porté devant l'autorité judiciaire qu'à l'expiration du délai de l'article 231.
Le juge fixe l'indemnité suivant les modalités fixées aux articles 258 et suivants.
Art. 240 —  Production de documents à la charge de la victime
La victime est tenue, à la demande de l'assureur, de lui donner les renseignements ci-après:
ses nom et prénoms;
ses date et lieu de naissance;
son activité professionnelle et l'adresse de son ou de ses employeurs;
le montant de ses revenus professionnels avec les justificatifs utiles;
la description des atteintes à sa personne accompagnée d'une copie du certificat médical initial et autres pièces justificatives en cas de consolidation;
la description des dommages causés à ses biens ;
les nom, prénoms et adresses des personnes à sa charge au moment de l'accident;
la liste des tiers payeurs appelés à lui verser des prestations;
le lieu où les correspondances doivent être adressées.
La victime est tenue, à la demande de l'assureur, de produire les documents suivants :
carte d'identité;
extrait d'acte de naissance;
acte de mariage.
Art. 241 —  Production de documents par les ayants droit de la victime
Lorsque l'offre d'indemnité doit être présentée aux ayants droit de la victime, à son (ses) conjoint (s) ou aux personnes mentionnées à l'article 265, chacune de ces personnes est tenue, à la demande de l'assureur de lui donner les renseignements ci-après :
ses nom et prénoms;
ses date et lieu de naissance;
ses nom et prénoms, date et lieu de naissance de la victime ;
ses liens avec la victime ;
son activité professionnelle et l'adresse de son ou de ses employeurs;
le montant de ses revenus avec les justifications utiles ;
la description de son préjudice, notamment les frais de toute nature qu'elle a exposés du fait de l'accident;
la liste des tiers payeurs appelés à lui verser des prestations, ainsi que leurs adresses;
Le lieu où les correspondances doivent être adressées.
A la demande de l'assureur, les mêmes personnes sont tenues de produire les documents suivants:
certificat de décès de la victime ;
jugement d'hérédité non frappé d'appel;
certificat de vie des ayants droit
le certificat de genre de mort
les actes civils des ayants droit et leurs pièces d'identité.
Art. 242 —  Mentions à apposer sur les correspondances
La correspondance adressée par l'assureur en application des articles 231 et 240 mentionne, outre les informations prévues à l'article 232, le nom de la personne chargée de suivre le dossier de l'accident. Elle rappelle à l'intéressé les conséquences d'un défaut de réponse ou d'une réponse incomplète. Elle indique que la copie du procès verbal d'enquête de la force publique qu'il peut demander en vertu de l'article 232 lui sera délivrée sans frais.
Art. 243 —  Contenu de l'offre
L'offre d'indemnité doit indiquer, outre les mentions exigées par l'article 231, l'évaluation de chaque chef de préjudice et les sommes qui reviennent au bénéficiaire.
L'offre précise, le cas échéant, les limitations ou exclusions d'indemnisation, retenues par l'assureur, ainsi que leurs motifs. En cas d'exclusion d'indemnisation, l'assureur n'est pas tenu, dans sa notification, de fournir les indications et documents prévus au premier alinéa.
Art. 244 —  Avis donné à la victime de l'examen médical
En cas d'examen médical pratiqué en vue de l'offre d'indemnité mentionnée à l'article 231, l'assureur ou son mandataire avise la victime, quinze jours au moins avant l'examen, de l'identité et des titres du médecin chargé d'y procéder, de l'objet, de la date et du lieu de l'examen, ainsi que du nom de l'assureur pour le compte duquel il est fait. Il informe en même temps la victime qu'elle peut se faire assister, à ses frais, d'un médecin de son choix.
Art. 245 —  Communication du rapport médical
Dans un délai de vingt jours à compter de l'examen médical, le médecin adresse un exemplaire de son rapport à l'assureur, à la victime et, le cas échéant, au médecin qui a assisté celle-ci.
Art. 246 —  Indication à la victime des recours des tiers payeurs
L'offre d'indemnité doit indiquer, outre les mentions exigées par l'article 231, les créances de chaque tiers payeur et les sommes qui reviennent au bénéficiaire. Elle est accompagnée de la copie des décomptes produits par les tiers payeurs.
Si la victime ou ses ayants droit n'a pas communiqué à l'assureur la liste des tiers payeurs, le paiement effectué est libératoire, les tiers payeurs devront adresser leurs recours à la victime ou ses ayants droit bénéficiaires de l'indemnité.
Section IV
Allongement et suspension des délais
Art. 247 —  Retard dans la déclaration de l'accident à l'assureur
Lorsque l'assureur qui garantit la responsabilité civile du fait d'un véhicule à moteur n'a pas été avisé de l'accident de la circulation dans le mois de l'accident, le délai prévu au premier alinéa de l'article 231 pour présenter une offre d'indemnité est suspendu à l'expiration du délai d'un mois jusqu'à la réception par l'assureur de cet avis.
Art. 248 —  Cas du décès postérieur à l'accident
Lorsque la victime d'un accident de la circulation décède plus d'un mois après le jour de l'accident, le délai prévu à l'article 231 pour présenter une offre d'indemnité aux héritiers et, s'il y a lieu, au conjoint de la victime est prorogé du temps écoulé entre la date de l'accident et le jour du décès.
Art. 249 —  Retard dans la communication des documents justificatifs
Si, dans un délai de six semaines à compter de la présentation de la correspondance, par laquelle l'assureur demande les renseignements qui doivent lui être adressés conformément aux articles 240 ou 241 ci-dessus, l'assureur n'a reçu aucune réponse ou qu'une réponse incomplète, le délai prévu au premier alinéa de l'article 231 est suspendu à compter de l'expiration du délai de six semaines et jusqu'à la réception de la lettre contenant les renseignements demandés.
Art. 250 —  Absence de réponse ou réponse incomplète de la victime
Si l'assureur n'a reçu aucune réponse ou qu'une réponse incomplète dans les six semaines de la présentation de la correspondance par laquelle, informé de la consolidation de l'état de la victime, il a demandé à cette dernière ceux des renseignements mentionnés à l'article 240 qui lui sont nécessaires pour présenter l'offre d'indemnité, le délai prévu au premier alinéa de l'article 231 est suspendu à compter de l'expiration du délai de six semaines jusqu'à la réception de la réponse contenant les renseignements demandés.
Art. 251 —  Nouvelle demande de l'assureur: délai de l'offre en cas de réponse incomplète
Lorsque la victime, ou ses ayants droit ne fournissent qu'une partie des renseignements demandés par l'assureur dans sa correspondance et que la réponse ne permet pas, en raison de l'absence de renseignements suffisants, d'établir l'offre d'indemnité, l'assureur dispose d'un délai d'un mois à compter de la réception de la réponse incomplète pour présenter à l'intéressé une nouvelle demande par laquelle il lui précise les renseignements qui font défaut.
Dans le cas où l'assureur n'a pas respecté ce délai, la suspension des délais prévus aux articles 249 et 250 cesse à l'expiration d'un délai d'un mois à compter de la réception de la réponse incomplète, lorsque celle-ci est parvenue au-delà du délai de six semaines mentionné aux mêmes articles ; lorsque la réponse incomplète est parvenue dans le délai de six semaines mentionné aux articles 249 et 250 et que l'assureur n'a pas demandé dans un délai de quinze jours à compter de sa réception les renseignements nécessaires, il n'y a pas lieu à suspension des délais prévus à l'article 231.
Art. 252 —  Refus d'examen médical ou contestation du choix du médecin
Lorsque la victime ne se soumet pas à l'examen médical mentionné à l'article 244 ci-dessus ou lorsqu'elle élève une contestation sur le choix du médecin sans qu'un accord puisse intervenir avec l'assureur, la désignation, à la demande de l'assureur, d'un médecin à titre d'expert d'un commun accord entre le médecin de l'assureur et le médecin de la victime, proroge d'un mois le délai imparti à l'assureur pour présenter l'offre d'indemnité.
Art. 252 bis —  Divergences sur les conclusions de l'expertise
S'il y a divergence sur les conclusions de l'examen médical, l'expert de l'assureur et l'expert désigné par la victime désignent un tiers expert d'un commun accord. L'avis de ce dernier s'impose.
Le délai imparti à l'assureur pour présenter l'offre d'indemnité est prorogé d'un mois.
Art. 253 —  Délais supplémentaires en cas de résidence à l'étranger
Lorsque la victime réside à l'étranger, les délais qui lui sont impartis en vertu des articles 249 et 250 ci-dessus sont augmentés d'un mois. Le délai imparti à l'assureur pour présenter l'offre d'indemnité est prorogé de la même durée.
Section V
Recours des tiers payeurs
Art. 254 —  Prestations ouvrant droit à recours
Ouvrent droit à un recours contre la personne tenue à réparation les prestations à caractère indemnitaire énumérées ci-dessous:
En cas de décès :
les capitaux décès versés par les organismes sociaux quels qu'ils soient;
les rentes et pensions de reversions servies par ces organismes ou par les débiteurs divers au profit du ou des conjoints survivants ainsi que des enfants de la victime.
En cas de blessure:
les prestations versées par les organismes sociaux au titre ;
des frais de traitement médical et de rééducation ;
des prestations en espèces pour incapacité temporaire ou permanente;
