URL,text,page_title,page_label,metadata
https://www.juriafrica.com/lex/arrete-conjoint-419-sg-pr-minefi-13-juil-2000-16308.htm,"LE MINISTRE D'ETAT, SECRETAIRE GENERAL DE LA PRESIDENCE DE LA REPUBLIQUE,
LE MINISTRE DE L'ECONOMIE ET DES FINANCES,
VU la Constitution ;
VU la loi n° 99/016 du 22 décembre 1999 portant statut général des établissements publics et des entreprises du secteur public et parapublic ;
VU le décret n° 98/273 du 22 octobre 1998 portant organisation de la Présidence de la République ;
VU le décret n° 2001/048 du 23 février 2001 portant création, organisation et fonctionnement de l'Agence de Régulation des Marchés Publics, notamment en son article 31
VU le décret n° 2004/320 du 08 décembre 2004 portant organisation du Gouvernement ;
VU le décret n° 2004/322 du 08 décembre 2004 portant formation du Gouvernement ;
VU le décret n° 2004/323 du 08 décembre 2004 portant nomination du Secrétaire Général de la Présidence de la République,
ARRETENT:
CHAPITRE I
DISPOSITIONS GENERALES
Art. 1er —  Il est créé, à compter de la date de signature du présent arrêté, un Comité Ad Hoc chargé de l'apurement du passif de l'ex-Direction Générale des Grands Travaux du Cameroun (DGTC), ci-après désigné le Comité.
Art. 2 —  (1) Le Comité est chargé d'inventorier, puis de classer par ordre de privilèges, les dettes exigibles en vue de leur apurement.
(2) Toutes les contestations relatives aux créances se feront conformément aux dispositions légales et réglementaires en vigueur.
(3) La Caisse Autonome d'Amortissement est chargée de désintéresser les créanciers dont les créances auront été validées par le Comité, conformément à la réglementation en vigueur.
CHAPITRE II
ORGANISATION ET FONCTIONNEMENT
Art. 3 —  (1) Le Comité est composé ainsi qu'il suit :
Président : Une personnalité désignée par le Ministre chargé des finances.
Membres :
un représentant du Secrétariat Général de la Présidence de la République ;
un représentant des Services du Premier Ministre;
un représentant du Ministère chargé des finances;
un représentant de la Commission des Privatisations et des Liquidations ;
un représentant du Ministère chargé du travail;
un représentant de la Caisse Autonome d'Amortissement (CAA) ;
un représentant du personnel de l'ex-DGTC.
(2) Le secrétariat du Comité est assuré par la Commission des Privatisations et des Liquidations.
(3) Les membres du Comité sont désignés par les chefs des administrations auxquelles ils appartiennent. Toutefois, en ce qui concerne le représentant du personnel de l'ex-DGTC, il est désigné par le Directeur Général de l'Agence de Régulation des Marchés Publics.
(4) La composition du Comité est constatée par décision du Ministre chargé des finances.
(5) Le Président du Comité peut faire appel à toute personne, en raison de ses compétences ou de ses connaissances sur les questions à examiner.
Art. 4 —  La durée du mandat du Comité est de six (06) mois, éventuellement renouvelable une fois.
Art. 5 —  Le Comité rend compte de l'avancement de ses travaux, par des rapports trimestriels adressés au Secrétaire Général de la Présidence de la République et au Ministre chargé des finances.
Art. 6 —  Les frais de fonctionnement du Comité sont imputés sur le budget du Ministère chargé des finances. A cet effet, le Comité élabore un projet de budget, qui est soumis à l'approbation du Ministre chargé des finances.
CHAPITRE III
DISPOSITIONS DIVERSES ET FINALES
Art. 7 —  (1) A l'achèvement effectif et définitif des opérations d'apurement, le Comité établit un rapport définitif qu'il adresse au Secrétaire Général de la Présidence de la République et au Ministre chargé des finances.
(2) Le Comité est dissous de plein droit, dès le dépôt de son rapport.
Art. 8 —  Les fonctions de Président et de membre du Comité sont gratuites. Toutefois, ceux-ci perçoivent une indemnité et éventuellement des frais de déplacement, dont les montants sont fixés par décision du Ministre chargé des finances.
Art. 9 —  Le présent arrêté sera enregistré et publié suivant la procédure d'urgence, puis inséré au Journal Officiel en français et en anglais. /-",ARRETE_CONJOINT_N_419_SG_PR_MINEFI_DU_13_JUILLET_2000_PORTANT_CREATION_ORGANISATION_ET_FONCTIONNEMENT_DU_COMITE_AD_HOC_CHARGE_DE_L_APUREMENT_DU_PASSIF_DE_L_EX_DIRECTION_GENERALE_DES_GRANDS_TRAVAUX_DU_CAMEROUN,0,
