URL,text,page_title,page_label,category,metadata
https://www.juriafrica.com/lex/arrete-conjoint-0293-minat-minefi-27-dec-1996-16307.htm,"ARRÊTE CONJOINT N°0293/MINAT/MINEFI DU 27 DÉCEMBRE 1996 MODIFIANT L'ARRÊTÉ N° 036/MINAT/MINEFI DU 13 MARS 1996 PORTANT MODALITÉS D'ASSIETTE, DE RECOUVREMENT, ET DE REVERSEMENT D'IMPÔTS ET TAXES DESTINÉS AUX COMMUNES ET AU FEICOM

LE VICE-PREMIER MINISTRE CHARGE DE L'ADMINISTRATION TERRITORIALE
LE MINISTRE D'ETAT CHARGE DE L'ÉCONOMIE ET DES FINANCES
VU la constitution ;
VU le code général des impôts;
VU le code de l'enregistrement, du timbre et de la curatelle;
VU la loi n° 74/23 du 5 décembre 1974 portant organisation communale;
VU la loi n° 87/015 du 15 juillet 1987 portant création des communautés urbaines;
VU l'ordonnance n° 62/OF/4 du 7 février 1962 portant régime financier du Cameroun;
VU le décret n° 92/245 du 26 novembre 1992 portant organisation du gouvernement et ses modificatifs subséquents;
VU le décret n° 92/248 du 27 novembre 1992 portant formation du gouvernement et ses modificatifs subséquents;
VU le décret 94/232 du 5 décembre 1994 précisant le statut et les attributions des receveurs municipaux;
VU le décret n° 95/690/PM du 26 décembre 1995 fixant les modalités de répartition du produit des centimes additionnels communaux ;
VU le décret n° 77/85 du 22 mars 1977 fixant les modalités de fonctionnement et de gestion du FEICOM et ses modificatifs subséquents
VU l'arrêté n° 081/CAB/PM du 04 juin 1996 fixant les attributions, l'organisation et les modalités de fonctionnement de l'Agence Comptable du FEICOM:
VU l'arrêté n° 036/MINAT/MINEFI du 13 mars 1996 portant modalités d'assiette de recouvrement, et de reversement d'impôts et taxes destinés aux communes et au FEICOM
ARRETENT:
CHAPITRE I
PRINCIPES
Art. 1er —  L'assiette, le recouvrement et le reversement des impôts et taxes destinés en partie ou en totalité aux communes et au FEICOM sont assurés par les services de la Direction des Impôts, de la Direction du Trésor, de la Direction des Douanes, des Collectivités locales décentralisées et du FEICOM suivant les modalités définies par le présent arrêté.
Art. 2 —  Sont visés par le présent arrêté les impôts et taxes ci-après:
Les centimes additionnels communaux à l'impôt sur le revenu des personnes physiques, à l'impôt sur les sociétés, à la taxe sur le chiffre d'affaires et aux taxes sur les jeux ; ils sont émis par la Direction des Impôts, recouvrés et centralisés par la Direction du Trésor, puis reversés aux Collectivités locales et au FEICOM
Les patentes et licences, l'impôt libératoire, les taxes communales directes, la taxe additionnelle à la taxe foncière et la part des droits de mutations immobilières revenant aux collectivités locales ; ils sont émis par la Direction des Impôts pour le compte des collectivités locales et/ou du FEICOM et recouvrés directement par les receveurs municipaux et l'agent comptable du FEICOM
La taxe douanière municipale ; elle est émise par les services des douanes pour le compte du FEICOM
La taxe de stationnement, la taxe de transit et la taxe de transhumance ; elles sont émises par le service d'assiette des collectivités locales et recouvrés par les receveurs municipaux et l'agent comptable du FEICOM.
Article 3.- Chaque collectivité locale doit créer un service d'assiette placé sous la responsabilité du magistrat municipal ordonnateur des recettes et distinct du service comptable relevant du Receveur municipal. Il a notamment la charge de toutes les opérations d'assiette et d'émission des taxes communales indirectes et suit les émissions et les recouvrements effectués par la chaîne fiscale de l'État pour le compte de la commune.
Art. 4 —  Le Conseil municipal délibérant en session budgétaire fixe le tarif des différents impôts et taxes conformément à la loi.
Les responsables compétents des services de la Direction des Impôts et de la Direction du Trésor assistent aux délibérations à titre consultatif. L'autorité de tutelle requiert leur avis, le cas échéant, avant de rendre exécutoire les délibérations sus-citées.
Art. 5 —  Les impôts locaux doivent, autant que possible, être recouvrés sans recourir à l'émission de rôles.
CHAPITRE II
PROCEDURES
Art. 6 —  Les procédures d'émission de recouvrement et reversement relatives aux centimes additionnels communaux à l'impôt sur le revenu des personnes physiques, à l'impôt sur les sociétés, à la taxe sur le chiffre d'affaires et aux taxes sur es jeux sont les suivantes:
L'assiette, l'émission et le contrôle se font suivant les procédures actuellement en vigueur
Un compte de recettes à répartir est ouvert auprès du Trésorier Payeur Général de Yaoundé, pour les opérations comptables relatives à la centralisation et à la redistribution de cette recette.
Une instruction de la Direction du Trésor fixe les modalités pratiques de fonctionnement du compte des recettes à répartir.
Art. 7 —  En cours d'exercice et dans le mois qui suit la fin de chaque trimestre, l'ordonnancement de la quote-part destinée à l'Etat, aux communes et au FEICOM est fait par arrêté conjoint des Ministres chargés de l'Administration Territoriale et des Finances, sur la base à la fois des taux de répartition fixés par le décret et du montant des centimes centralisés pour la période par le Trésorier Payeur Général de Yaoundé.
Sur la base de cet arrêté, le ministre chargé de l'Administration territoriale établit une décision de paiement accompagné d'un état de répartition pour le montant alloué à chaque commune. Le Directeur du FEICOM établit un ordre de retrait pour la part revenant à son organisme.
L'arrêté conjoint, la décision de paiement et l'ordre de retrait du FEICOM sont adressés au Trésorier Payeur Général de Yaoundé. Celui-ci procède aussitôt au règlement de la quote-part revenant aux communes et au FEICOM et impute celle de l'État dans un compte approprié.
Art. 8 —  Les procédures d'émission et de recouvrement relatives aux patentes et licences, à l'impôt libératoire, aux taxes communales directes, à la taxe additionnelle communale sur la taxe foncière, et à la part communale des droits de mutation immobilière sont précisées ainsi qu'il suit
1. Assiette et émission - Les services compétents des Impôts établissent des bulletins d'émission distincts et successifs pour les parts revenant respectivement à l'État, à la commune et au FEICOM.
2. Recouvrement - Le paiement relatif aux différents droits est effectue à la caisse du comptable compétent au vu du bulletin d'émission approprié.
Toutefois, en l'absence de structures locales du FEICOM, le Comptable du Trésor de la localité encaisse la part de la recette de cet organisme, et en opère le transfert auprès du Trésorier-Paveur Général de Yaoundé.
Art. 9 —  Les procédures d'émission, de recouvrement et de reversement relatives aux impôts et taxes sus-citées, lorsqu'ils sont retenus à la source ou émis par voie de rôle, se font conformément à la réglementation en vigueur.
Art. 10 —  Le produit de l'impôt libératoire est destiné aux communes rurales, aux communes urbaines et aux communes urbaines d'arrondissement, à l'exclusion des communautés urbaines
Art. 11 —  Les procédures d'émission, de recouvrement et de reversement relatives à la taxe douanière municipale sont précisées ainsi qu'il suit
1 Assiette et émission - Les services de douane font ressortir sur le bulletin de liquidation Douanière (BLD) le montant de la taxe douanière municipale.
2 Recouvrement - La procédure est la suivante:
A Douala, la taxe douanière municipale est recouvrée par le Trésorier Payeur Général de Douala et reversée dans un compte de dépôt ouvert au nom du FEICOM dans le même poste comptable ;
Dans les autres localités, le recouvrement est assuré par un agent du FEICOM ou à défaut par le comptable du Trésor de la localité.
Art. 12 —  Les procédures d'émission et de recouvrement relatives aux taxes de stationnement, de transit et de transhumance sont précisées ainsi qu'il suit:
1. Assiette et émission - Le service d'assiette de la commune établit deux bulletins d'émission distincts et successifs pour les parts respectives de la commune et du FEICOM.
2 Recouvrement - Le paiement relatif aux différents droits est effectué à la caisse du comptable compétent au vu du bulletin d'émission approprié.
CHAPITRE III
COMITES DE SUIVI DES IMPÔTS LOCAUX
Art. 13 —  Par décision conjointe des Ministres chargés de l'administration Territoriale et des Finances, il est créé un Comité Interministériel ayant pour mission la mise en œuvre et le suivi de la fiscalité locale.
Art. 14 —  II est créé dans chaque département un comité chargé du suivi de la fiscalité locale, composé ainsi qu'il suit :
Le Préfet, Président;
Le Chef de Centre départemental des impôts ou le Chef de centre provincial des impôts pour les départements du Mfoundi et du Wouri, Vice-Président;
Le Trésorier Payeur Général ou le Receveur départemental des finances, membre
Le Délégué du Gouvernement, membre ;
Le(s) Maire(s) du chef-lieu du département, membre;
- Le Receveur des impôts, membre;
- Les Receveurs municipaux du chef-lieu du département, membre;
- Le Chef d'Agence régionale du FEICOM, membre.
Le Président du Comité peut inviter toute personne autre en raison de ses compétences.
Art. 15 —  Le Comité a pour mission de:
suivre l'application des instructions relatives aux impôts locaux et en particulier au transfert des centimes additionnels communaux;
suivre les opérations de recensement, d'émission et de recouvrement relatives aux différents impôts locaux ;
relever les difficultés d'application des différents textes relatifs aux impôts locaux et en proposer les solutions.
Le Comité local adresse à la fin de chaque trimestre, un compte-rendu de ses activités au Comité interministériel de suivi des impôts locaux.
Art. 16 —  Les fonctions de président et de membre du Comité local sont gratuites. Cependant, les frais de fonctionnement du Comité local sont à la charge des communes concernées.
Art. 17 —  Les Autorités Administratives et les Chefs Traditionnels apportent leur appui aux opérations de recensement et de recouvrement relatives aux impôts locaux.
CHAPITRE IV
DISPOSITIONS DIVERSES
Art. 18 —  La fourniture des imprimés nécessaires au fonctionnement des recettes municipales et de l'Agence comptable du FEICOM est à leur charge respective.
Art. 19 —  Le présent arrêté, qui abroge toutes dispositions antérieures contraires, sera enregistré, publié suivant la procédure d'urgence, puis inséré au journal officiel en français et en anglais.
Yaoundé, le 27 DEC.1996",ARRETE_CONJOINT_N_0293_MINAT_MINEFI_DU_27_DECEMBRE_1996_MODIFIANT_L_ARRETE_N_036_MINAT_MINEFI_DU_13_MARS_1996_PORTANT_MODALITES_D_ASSIETTE_DE_RECOUVREMENT_ET_DE_REVERSEMENT_D_IMPOTS_ET_TAXES_DESTINES_AUX_COMMUNES_ET_AU_FEICOM,0,arrete,
