URL,text,page_title
https://www.juriafrica.com/lex/arrete-019-mtps-sg-cj-26-mai-1993-25770.htm,"CHAPITRE PREMIER
Dispositions générales
Art. 1er —  Des délégués du personnel sont obligatoirement élus dans tous les établissements installés sur le territoire national quelle qu'en soit la nature et quel que soit l'employeur, public ou privé, laïc ou religieux, civil ou militaire, où sont habituellement occupés au moins vingt travailleurs relevant du Code du Travail.
Art. 2 —  (1) Au sens du présent arrêté, l'établissement s'entend d'un groupe de personnes travaillant en commun, en un lieu déterminé sous l'autorité d'un ou plusieurs représentants d'une même autorité directrice (personne physique ou privée). L'établissement est donc caractérisé par l'exercice d'une activité collective en un lieu donné, le mot lieu étant employé dans le sens d'usine ou de local et non dans le sens de ville ou de circonscription.
(2) L'entreprise est une organisation économique de forme juridique déterminée (propriété individuelle ou collective) constituée par une production de biens destinés à la vente ou la fourniture de service rémunérés ou non.
(3) Une entreprise peut comprendre un ou plusieurs établissements. Un établissement donné relève toujours d'une entreprise. Un établissement unique et indépendant constitue à la fois une entreprise et un établissement.
Art. 3 —  (1) L'effectif à prendre en considération est celui des travailleurs occupés habituellement dans l'établissement, qu'ils soient ou non inscrits au registre de l'employeur. Sont considérés notamment comme occupés habituellement dans l'établissement :
les apprentis et les travailleurs engagés à l'essai ;
les travailleurs temporaires, occasionnels et saisonniers quand ils ont totalisé l'équivalent de six mois précédent l'établissement de la liste des électeurs.
(2) Les travailleurs collaborant à plusieurs établissements dépendant ou non de la même entreprise sont considérés comme appartenant au personnel de l'établissement auquel ils consacrent la plus
grande partie de leur activité et subsidiairement de celui où ils perçoivent le salaire le plus élevé.
(3) Lorsque le Chef d'établissement a la qualité de travailleur, il fait partie de l'effectif à prendre en considération.
Art. 4 —  Lorsque plusieurs établissements d'une même entreprise appartenant à la même branche d'activité et situés dans une localité ou dans un rayon de dix kilomètres de l'établissement considéré comme central ne comportent pas chacun séparément le nombre minimum de travailleurs exigés ci-dessus pour procéder aux élections de délégués, les effectifs de ces établissements sont réunis pour la détermination de ce nombre.
Art. 5 —  Le nombre de délégués du personnel à élire est fixé comme suit :
de vingt à cinquante travailleurs : deux délégués titulaires et deux délégués suppléants ;
de cinquante et un à cent travailleurs : trois délégués titulaires et trois délégués suppléants ;
de 101 à deux cent cinquante travailleurs : quatre délégués titulaires et quatre suppléants ;
de 251 à 500 travailleurs : cinq délégués titulaires et cinq délégués suppléants ;
de 501 à mille travailleurs : six délégués titulaires et six délégués suppléants ;
plus un délégué titulaire et un suppléant par tranche supplémentaire de cinq cent travailleurs.
CHAPITRE II
Modalités de l'élection
Art. 6 —  (1) L'élection des délégués du personnel a lieu tous les deux ans sur l'ensemble du territoire à une période fixée par le Ministre chargé du travail.
(2) Les délégués en poste conservent leurs fonctions jusqu'à la prise d'effet du mandat des nouveaux délégués ;
Art. 7 —  (1) En cas d'ouverture ou de remise en activité d'un établissement ou d'extension dans l'intervalle compris entre deux périodes d'élections générales il peut être procédé à des élections des délégués du personnel, sous la double condition suivante :
l'élection ne peut avoir lieu dans les six mois précédant te début de la période d'élection générale à venir ;
une demande doit être adressée à l'Inspecteur du Travail du ressort, soit par l'employeur, soit par une organisation syndicale intéressée, soit par la majorité des travailleurs en service dans l'établissement.
(2) Des dérogations aux conditions d'électorat et d'éligibilité, telles que prévues à l'article 123 du Code du Travail, sont dans ce cas accordées par l'Inspecteur du Travail. Les délégués du personnel ainsi investis exercent leur mandat des délégués élus au cours de la période d'élections générales suivantes.
Art. 8 —  (1) Quarante jours au moins avant la date prévue pour les élections, le Chef d'établissement dresse la liste des travailleurs remplissant les conditions d'électorat exigées.
(2) Les électeurs sont répartis dans les deux collèges suivants : manœuvres, ouvriers, employés (catégories I à VI) ;
- agents de maîtrise, techniciens et assimilés, cadres, catégories VII à XII
(3) La répartition des sièges des délégués entre ces deux collèges est effectuée au prorata des effectifs que comporte chacun d'eux.
(4) Le Chef d'établissement communique la liste ainsi établie aux organisations syndicales les plus représentatives des travailleurs. En cas de divergence entre celle-ci et le Chef d'établissement sur la répartition du personnel dans les collèges électoraux et sur la répartition des sièges entre les collèges, l'Inspecteur du Travail du ressort décide de cette répartition.
Art. 9 —  Ne sont éligibles pour un collège électoral déterminé que les travailleurs inscrits comme électeurs dans ce même collège.
Art. 10 —  (1) Quand la répartition indiquée ci-dessus est devenue définitive et au moins vingt jours avant la date du scrutin, le Chef d'établissement affiche la liste des électeurs répartis en collèges, aux emplacements habituellement réservés aux communications destinées au personnel. A cette liste est joint un avis précisant le jour, le lieu, les heures d'ouverture et de fermeture du scrutin. Le Chef d'établissement adresse sans délai copie de cet avis à l'Inspecteur du Travail du ressort d'une part et aux organisations syndicales les plus représentatives des travailleurs d'autre part, en invitant ces dernières à lui faire parvenir les listes des candidats qu'elles présentent.
(2) Pour être recevables ces listes doivent être déposées au moins six jours francs avant la date fixée pour le scrutin, sous réserve que la liste visée à l'article 8 ci-dessus ait été reçus dans les délais par l'organisation syndicale intéressée. Elles doivent être établies par collège électoral, séparément pour les délégués titulaires et pour les délégués suppléants. Elles ne peuvent comprendre un nombre de candidats supérieur à celui des sièges à pourvoir.
(3) Les listes de candidats doivent être affichées six jours francs au moins avant la date du scrutin par les soins du Chef d'établissement ou son représentant, aux mêmes emplacements que la liste des électeurs et l'avis de scrutin. Elles doivent faire connaître les noms, prénoms, âge et durée des services des candidats ainsi que les syndicats qui les représentent. Nul ne peut figurer en qualité de candidat sur deux ou plusieurs listes différentes.
Art. 11 —  Si aucune des organisations syndicales n'a fait parvenir la liste des candidats dans les conditions et délais prévus à l'article 10 ci-dessus, le Chef d'établissement fait constater cette carence par l'Inspecteur du Travail. Celui-ci après enquête, autorise le vote pour des candidats non présentés par une organisation syndicale.
Art. 12 —  (1) Le scrutin est de liste majoritaire à deux tours.
(2) A l'issue du premier tour, si aucune liste n'obtient la majorité absolue des suffrages exprimés, il est procédé dans un délai de 15 jours à un second tour entre les deux premières listes ayant le plus grand nombre de voix.
Est élue la liste qui obtient la majorité simple à l'issue du second tour.
(3) En cas d'égalité de voix entre les deux listes, les sièges à pourvoir sont attribués à la liste dont la moyenne d'ancienneté des candidats dans l'entreprise est la plus élevée.
Art. 13 —  Le vote a lieu dans un établissement, un jour ouvrable pendant les heures de travail.
Art. 14 —  Sont admis à voter par correspondance ; sous double enveloppe adressée au Chef d'établissement :
- les travailleurs en congé et ceux dont le contrat est suspendu pour l'une des causes énumérées aux paragraphes c, d, e, f, g, i et k de l'article 32 du code du Travail, et qui ne peuvent se rendre sur les lieux du scrutin ; les travailleurs que leurs occupations professionnelles hors d'établissement empêchant de prendre part au scrutin.
Art. 15 —  (1) L'élection a lieu au scrutin secret sous enveloppe, l'introduction du bulletin dans l'enveloppe s'effectuant dans un isoloir.
(2) Il a procédé dans chaque collège à des votes séparés pour les délégués titulaires et les délégués suppléants.
Art. 16 —  (1) Seuls sont valables les votes allant aux listes en présence.
(2) Sont considérés comme nul, outre les bulletins de vote surchargés ou multiples dans une enveloppe, ceux qui
- comportent des noms barrés ;
- comportent des noms barrés et remplacés par des noms de personnes non-candidates ;
- et d'une manière générale comportent tout signe quelconque permettant l'identification de l'électeur.
Art. 17 —  Le Chef d'établissement ou son représentant, est chargé de l'organisation du déroulement régulier des élections, notamment de la constitution du bureau de vote qu'il préside, assisté de deux travailleurs non-candidats désignés par les organisations syndicales les plus représentatives et qui jouent le rôle des scrutateurs. Des travailleurs qui doivent faire partie du personnel de l'établissement, prennent place au bureau, assistent au vote et participent au dépouillement des votes.
Art. 18 —  (1) Les opérations de vote et de dépouillement font l'objet d'un procès-verbal conforme au modèle joint au présent arrêté. Ce procès-verbal est établi en trois exemplaires au moins par le président du bureau de vote, signé par lui et par les représentant du personnel membre du bureau.
(2) Dans les vingt-quatre heures qui suivent la rédaction du procès-verbal, le Chef d'établissement est tenu d'en adresser deux exemplaires à l'Inspecteur du Travail du ressort. Il doit délivrer une copie de ce document aux organisations ayant participé aux élections et aux représentants des listes élues.
Art. 19 —  Le Chef d'établissement ou son représentant doit, immédiatement après la proclamation des résultats, afficher aux même lieux que l'avis du scrutin et les candidatures, les noms, prénoms des délégués élus titulaires et suppléants.
CHAPITRE III
Exercice des fonctions de délégués du personnel
Art. 20 —  (1) Le Chef d'établissement est tenu de laisser aux délégués du personnel, dans les limites d'une durée qui, sauf circonstances exceptionnelles et sauf convention contraire, ne peut excéder quinze heures par mois, le temps nécessaire à l'exercice de leurs fonctions. Ce temps leur est payé comme temps de travail. Il doit être utilisé exclusivement aux tâches afférentes à l'activité du délégué du personnel telles qu'elles sont déterminées par la législation en vigueur.
(2) Le temps non utilisé ne peut être reporté sur un mois suivant ni faire l'objet d'une quelconque indemnité.
(3) Les délégués suppléants bénéficient des dispositions édictées ci-dessus quand ils sont appelés à remplacer un délégué titulaire dans les cas prévus par la législation en vigueur et quand ils participent avec les délégués titulaires aux réunions prévues à l'article 23 ci-après.
Art. 21 —  Le Chef d'établissement est tenu de mettre à la disposition des délégués du personnel le local nécessaire pour leur permettre de remplir leur mission et notamment de se réunir. Sur les chantiers où il n'existe pas de locaux le Chef d'entreprise facilitera dans la mesure du possible les réunions des délégués du personnel.
Art. 22 —  Les délégués du personnel peuvent faire afficher, à l'exclusion de tout autre document de quelque ordre que ce soit, les renseignements qu'ils ont pour rôle de porter à la connaissance du personnel dans le cadre de leur mission telle qu'elle est définie par la législation en vigueur. Ces renseignements sont avant l'affichage, soumis au visa du Chef d'établissement. L'affichage ainsi prévu doit être effectivement assuré aux portes d'entrée des lieux de travail et également sur des emplacements obligatoires prévus et destinés aux communications syndicales.
Art. 23 —  (1) Les délégués du personnel titulaires et suppléants sont reçus collectivement par la Chef d'établissement au moins une fois par mois. Ils sont, en outre, reçus sur leur demande en cas de circonstances exceptionnelles telles que définies à l'article 24 ci-après (soit collectivement, soit individuellement, soit par catégorie, atelier, chantier, service ou spécialité professionnelle, selon les questions qu'ils ont traiter).
(2) Si le Chef d'établissement ne peut se prononcer dans les trois jours sur les réclamations et suggestions présentées par les délégués, il doit les transmettre au Chef d'entreprise ou à son représentant (en cas d'établissements multiples) qui est tenu de se prononcer dans les quinze jours suivant la transmission.
(3) S'il s'agit d'une entreprise en société anonyme et qu'il ne peut être donné suite aux réclamations et suggestions qu'après délibération du conseil d'administration de la société, les délégués doivent être reçus par celui-ci sur leur demande. S'il n'est pas prévu de réunion du conseil d'administration dans les quatre jours suivant la demande des délégués, ou si le conseil d'administration se réunit habituellement dans un lieu autre que celui du siège de l'établissement en cause, les délégués peuvent saisir par lettre recommandée avec accusé de réception le Président du conseil d'administration. Celui-ci est tenu d'envoyer sa réponse dans un délai de trois semaines à compter de la réception de la lettre recommandée.
(4) Les délégués suppléants peuvent assister avec les délégués titulaires aux réunions avec les employeurs et leurs représentants.
Art. 24 —  Les circonstances exceptionnelles visées à l'article 23 ci-dessus doivent s'entendre :
Soit d'une demande urgente d'installation d'un dispositif de sécurité après un accident du travail par exemple ;
Soit de circonstances intéressant le climat social dans l'établissement telle que l'imminence d'un trouble grave ou la nécessité de rétablir l'entente entre employeur et travailleurs.
Art. 25 —  (1) Il est tenu au siège de l'établissement un registre spécial destiné à recueillir les réclamations et suggestions formulées par les délégués du personnel et les réponses faites à celles-ci par le Chef d'établissement.
(2) Ce registre doit être tenu à la disposition des travailleurs de l'établissement qui désirent en prendre connaissance, chaque jour ouvrable de la semaine.
Art. 26 —  (1) Tout délégué du personnel peut être révoqué en cours de mandat, soit sur proposition de l'organisation syndicale qui l'a présenté, soit sur pétition écrite signée de la majorité du collège électoral auquel il appartient, adressée à l'Inspecteur du Travail du ressort.
(2) Cette proposition, ou cette pétition, doit être confirmée au scrutin secret par la majorité du collège auquel appartient le délégué.
Art. 27 —  Les infractions aux dispositions du présent arrêté sont passibles des peines prévues à l'article 168 paragraphe 4 du Code du Travail et à l'article R. 370 (2) du code pénal.
Art. 28 —  Est abrogé l'arrêté n° 09/MTPS/SG/CJ du 25 avril 1991 portant application des articles 131 et 132 du Code du Travail relatif aux délégués du personnel.
Art. 29 —  Le présent arrêté qui prend effet à compter de la date de la signature, sera enregistré et publié au Journal Officiel en français et en anglais.",ARRETE_N°019_MTPS_SG_CJ_DU_26_MAI_1993_FIXANT_LES_MODALITES_DE_L_ELECTION_ET_LES_CONDITIONS_D_EXERCICE_DES_FONCTIONS_DES_DELEGUES_DU_PERSONNEL
