URL,text,page_title
https://www.juriafrica.com/lex/arrete-00116-minefi-dce-6-10-juin-1997-16205.htm,"LE MINISTRE D'ETAT CHARGE DE L'ECONOMIE ET DES FINANCES,
VU la Constitution
VU la loi n° 67/LF/22 du 12 juin 1967 relative aux relations financières entre la République du Cameroun et l'Etranger, son décret d'application n° 67/DF/365 du 21 août 1967 et l'arrêté d'application n°38/MINCI du 06 janvier 1968 ;
VU la loi n° 91/023 du 16 Décembre 1991, relative aux recensements et enquêtes statistiques, son décret d'application n° 93/407/PM du 07 mai 1993 ;
VU le décret n° 92/245/ du 26 novembre 1992 portant organisation du Gouvernement et ses modificatifs subséquents ;
VU le décret n° 94/138 du 21 juillet 1994 portant création du Ministère de l'Economie et des Finances ;
VU le décret n° 95/168 du 16 août 1995 portant organisation du Ministère de l'Economie et des Finances ;
VU le décret n° 96/203 du19 septembre 1996 portant réaménagement du Gouvernement ;
VU les nécessités de service.
A R R E T E :
Art. 1 —  Sous réserve des Conventions Internationales, le Ministère de l'Economie et des Finances et la Direction Nationale de la Banque des Etats de l'Afrique Centrale sont habilités chacun en ce qui le concerne à recueillir soit directement, soit par l'intermédiaire des banques commerciales, de l'Administration des postes ou du Ministère des Relations Extérieures, tout renseignement nécessaire à l'établissement de la balance des paiements, auprès de toute personne physique ou morale ayant sa résidence au Cameroun, ou sa résidence à l'Etranger pour l'activité de son établissement au Cameroun.
Art. 2 —  Les renseignements ainsi collectés sont transmis au Ministère de l'Economie et des Finances (Direction des Contrôles Economiques) et/ou à la Direction de la BEAC suivant les périodicités ci-après :
hebdomadairement pour les déclarations bancaires (f1, f2, f3, f4) ;
trimestriellement pour les questionnaires des entreprises et sociétés, des établissements d'hébergement et de restauration, des compagnies maritimes, aériennes et d'assurance, des banques commerciales ;
semestriellement pour les questionnaires des Missions Diplomatiques et Postes Consulaires, des Organisations Internationales représentées au Cameroun, des Missions Diplomatiques et Postes Consulaires du Cameroun à l'Etranger, les ONG.
Art. 3 —  Les personnes morales susvisées et soumises aux différents types de questionnaire d'entreprise, sont tenues de communiquer à la Direction Nationale de la BEAC ou auprès de ses agences locales et à la Direction des Contrôles Economiques et des Finances Extérieures, les noms, numéro de téléphone et de télécopie des responsables en charge des statistiques de la Balance des Paiements ainsi que les banques commerciales domiciliataires de leurs comptes.
Art. 4 —  A l'exception des Missions Diplomatiques, des Postes Consulaires et Représentations des Organisations Internationales, les personnes morales visées à l'article 1 disposent d'un délai de quarante-cinq (45) jours à compter de la fin de chaque période, pour fournir les renseignements contre récépissé de dépôt. Toutefois, ce délai est ramené à sept (07) jours pour les établissements bancaires en ce qui concerne les opérations de leur clientèle.
Art. 5 —  A l'expiration de ce délai et sans autre injonction, les contrevenants qui n'auront pas produit les renseignements nécessaires seront passibles des peines d'amende ci-après :
a) - Etablissements bancaires en ce qui concerne les opérations de la clientèle objet des déclarations f1, f2, f3 et f4
Astreinte de 10 000 francs par jour de retard pour les 15 premiers jours et 20 000 francs par jour de retard à partir du 16ème jour, le tout à compter du 1er jour de retard constaté.
b) Personnes morales soumises à la déclaration trimestrielle.
Astreinte de 30 000 francs par jour de retard pour les 15 premiers jours et 60 000 francs à partir du 16ème jour, le tout à compter du 1er jour de retard constaté.
Art. 6 —  Les amendes afférentes aux infractions des différentes périodes se cumulent sans toutefois excéder 50% du montant des déclarations.
Art. 7 —  Lorsque les questionnaires d'entreprise ou tous les autres documents statistiques sont retournés au déclarant pour la correction ou complément d'informations, ce dernier dispose de 12 jours à compter de la date de notification pour retourner le document dûment corrigé ; passé ce délai, l'intéressé est soumis, selon le cas, aux sanctions susvisées à l'article 5.
Art. 8 —  a) Le défaut de réponse se constate quatre-vingt-dix (90) jours après la fin de la période sous revue.
Les contrevenants après mise en demeure à eux régulièrement notifiée, sont passibles des peines d'amende dont le maximum ne peut excéder 500 000 francs pour une première infraction ;
b) A l'issue de la première notification et en cas de récidive, le contrevenant qui ne se sera pas exécuté est puni d'une amende de 60 00 francs par jour de retard à compter de la date de notification.
Art. 9 —  Les notifications des sanctions et des pénalités sont assurées soit par la Direction Nationale de la BEAC, soit par la Direction des Contrôles Economiques et des Finances Extérieures.
a) Le compte chez la BEAC de l'établissement bancaire pénalisé est débité du montant total des amendes après notification de la sanction à ladite banque ;
b) Pour les entreprises et autres sociétés n'ayant pas de compte à la BEAC, les retards sont constatés et notifiés par la Direction des Contrôles Economiques qui charge alors la BEAC de procéder au recouvrement des pénalités à travers le compte de leur banque domiciliataire ; ou invite les contrevenants à payer lesdites astreintes par chèque certifié émis à l'ordre du Trésorier Payeur de leur localité de résidence pour le compte de la Direction des Contrôles Economiques.
Art. 10 —  Les sommes dues au titre de l'astreinte sont reversées au compte du Trésor Public auprès de la Banque des Etats de l'Afrique Centrale, avec notification au Ministre de l'Economie et des Finances (Direction des Contrôles Economiques et des Finances Extérieures).
Les Services de la Balance des Paiements de la Direction des Contrôles Economiques et de la Direction Nationale de la BEAC bénéficieront d'une prime correspondant à 15% du montant des amendes recouvrées.
Art. 11 —  Le Directeur des Contrôles Economiques et des Finances Extérieures, le Directeur National de la Banque des Etats de l'Afrique Centrale, sont chargés chacun en ce qui le concerne de l'application des présentes dispositions.
Art. 12 —  Le présent arrêté qui prend effet pour compter de sa date de signature, sera publié en français et en anglais./
Yaoundé, le 10 JUIN 1997
Edouard AKAME MFOUMOU",ARRETE_N°_00116_MINEFI_DCE_6_DU_10_JUIN_1997_-_RELATIF_AUX_SANCTIONS_APPLICABLES_A_TOUTES_PERSONNES_PHYSIQUES_ET_MORALES_SOUMISES_A_LA_DECLARATION_DE_LA_BALANCE_DES_PAIEMENTS
