URL,text,page_title,page_label,metadata
https://www.juriafrica.com/lex/arrete-79-cab-pm-11-oct-1999-16158.htm,"LE PREMIER MINISTRE, CHEF DU GOUVERNEMENT,
VU la Constitution;
VU la loi n° 92/006 du 14 août 1992 relative aux sociétés coopératives et aux groupes d'initiative commune ;
VU le décret n° 92/089 du 9 mai 1992 précisant les attributions du Premier Ministre, modifié et complété par le décret n° 95/145 du 4 avril 1995;
VU le décret n° 96/229 portant organisation du Ministère de l'Agriculture;
VU le décret n° 97/205 du 7 décembre 1997 portant organisation du Gouvernement, modifié et complété par le décret n° 98/067 du 28 avril 1998 ;
VU le décret n° 97/206 du 7 décembre 1997 portant nomination d'un Premier Ministre,
ARRETE:
Art. 1er —  Il est créé auprès du ministère chargé de l'agriculture, un comité d'organisation de la 13è session de la Conférence panafricaine coopérative de l'an 2000 à Yaoundé, ci-après désigné « le Comité ».
Art. 2 —  Le Comité assiste le Gouvernement dans la préparation et l'organisation de la Conférence visée à l'article 1 ci-dessus. A ce titre, il est chargé notamment:
de la définition des orientations générales et de la coordination de toutes les activités relatives à la préparation et à l'organisation de la Conférence ;
de l'adoption et de l'exécution du budget de la Conférence.
Art. 3 —  (1) Le Comité est composé ainsi qu'il suit: Président: le ministre chargé de l'agriculture;
Membres :
le Directeur du génie rural et du développement communautaire;
le Chef de la Cellule des sociétés coopératives et des groupes d'initiative commune;
un représentant du ministère chargé des relations extérieures;
un représentant du ministère chargé de l'économie et des finances;
le Directeur de la production agricole ;
le Chef de la Division des études et projets agricoles;
un représentant de l'Association des Professionnels de l'Epargne et du Micro-crédit.
(2) Le Directeur du génie rural et du développement communautaire assure le secrétariat du Comité.
Art. 4 —  Le ministre chargé de l'agriculture peut en tant que de besoin, inviter les représentants des bailleurs de fonds et des organisations non-gouvernementales intervenant dans le secteur coopératif à participer aux réunions du Comité.
Art. 5 —  (1) Le Comité se réunit aussi souvent que nécessaire sur convocation de son président.
(2) Le Comité rend régulièrement compte au Premier Ministre de l'avancement de ses travaux.
Art. 6 —  Les frais d'organisation de la Conférence et ceux de fonctionnement du Comité sont pris en charge par le budget du ministère de l'agriculture.
Art. 7 —  Les fonctions de Président et des membres du Comité sont gratuites. Toutefois, le Comité prend en charge les frais de déplacement de ses membres lorsqu'ils sont appelés à effectuer des missions hors de leur lieu de résidence.
Art. 8 —  Le Comité adresse au Premier Ministre, Chef du Gouvernement un rapport final dans un délai de trente (30) jours après la clôture des travaux de la Conférence. Il est dissout de plein droit dès la transmission dudit rapport.
Art. 9 —  Le Présent arrêté sera enregistré et publié partout où besoin sera. /-",ARRETE_N_79_CAB_PM_DU_11_OCTOBRE_1999_PORTANT_CREATION_D_UN_COMITE_D_ORGANISATION_DE_LA_13E_SESSION_DE_LA_CONFERENCE_PANAFRICAINE_COOPERATIVE_DE_L_AN_2000_A_YAOUNDE,0,
