URL,text,page_title
Art. 47 —  1Avant la mise en service du Système de Transport par Pipeline, le Titulaire doit obtenir un Certificat de Conformité de son ouvrage aux spécifications autorisées, délivré par le Ministre chargé des mines. Le Certificat de Conformité tient lieu d'autorisation de mise en service du Système de Transport par Pipeline.
2- Pour obtenir un Certificat de Conformité, le Titulaire doit adresser au Ministre chargé des mines, un dossier constitué de :
une demande de Certificat de Conformité en trois exemplaires, dont l'original est timbré au tarif en vigueur ;
les procès-verbaux attestant-de la conformité des ouvrages aux normes techniques indiquées par l'arrêté visé à l'article 41 alinéa 2 du-présent décret, dressés et signés par le Service d'Inspection des Pipelines à l'issue des essais et tests, des contrôles techniques et des épreuves prescrits par ledit arrêté et effectués aux différentes étapes de la construction ;
Le procès-verbal de conformité du Système de Télécommunications du Titulaire signé par le Comité de Pilotage et de Suivi des Pipelines.
Art. 48 —  1Le Ministre chargé des mines dispose d'un délai de quinze (15) jours à compter du jour de dépôt du dossier complet pour délivrer au Titulaire le Certificat de Conformité. Passé ce délai, l'autorisation de mise en service est réputée acquise, et le Certificat de Conformité est toutefois délivré dans un délai raisonnable.
2- Dans un délai de six (06) mois après la délivrance du Certificat de Conformité, le Titulaire est tenu d'adresser au Ministre chargé des mines, le plan ""as built"" du Système de Transport par Pipeline. A défaut, et après qu'une mise en demeure du Ministre chargé des mines soit restée sans effet pendant un (01) mois, il y est pourvu aux frais du Titulaire qui ne peut s'opposer à l'exécution de ce travail, et est tenu de fournir toutes les informations techniques nécessaires.
3- La mise en service d'un Système de Transport par Pipeline avant la délivrance du Certificat de Conformité, et avant l'expiration du délai de quinze (15) jours visé à l'alinéa 1 du présent article est arrêtée par décision du Ministre chargé des mines après une mise en demeure restée sans effet de se conformer aux dispositions de l'article 47 du présent décret et des alinéas 1 et 2 du présent article, dans un délai de trente (30) jours au maximum à compter de la date de notification de la mise en demeure.
Art. 49 —  En conformité avec les dispositions de l'arrêté visé à l'article 41 alinéa 2 du présent décret et les règles de l'art, le Titulaire de l'Autorisation de Transport par Pipeline assure sous sa responsabilité la surveillance régulière de son Système de Transport par Pipeline. A ce titre, il communique avant le 31 octobre de chaque année au Service d'Inspection des Pipelines le planning prévisionnel pour l'année suivante des contrôles et visites techniques réglementaires. En conséquence, il prend toutes les dispositions techniques requises le moment venu en vue d'exécuter lesdits contrôles et visites ou de les faire exécuter par un expert ou un organisme agréé par le Ministre chargé des mines. Le Titulaire tient à cet effet un registre général et un registre des appareils à pression de vapeur d'eau pour les contrôles et interventions effectués dans ce cadre. Le registre des appareils à pression de vapeur d'eau est obtenu auprès des services du Ministre chargé des mines et conservé par le Titulaire.
Dans le cas où le Titulaire n'exécute pas les inspections obligatoires indiquées sur le planning prévisionnel, le Ministre chargé des mines commet d'office, aux frais du Titulaire, un expert ou un organisme agréé pour effectuer lesdites opérations.
Le Service d'Inspection des Pipelines peut assister auxdites opérations.
Le Titulaire surveille les effets de la nature sur son ouvrage et les effets de toutes les activités qu'il autorise ou auxquelles il se livre pour s'assurer que lesdites activités ne sont pas dangereuses pour les populations et ne polluent ni l'environnement ni le milieu marin.
Le Titulaire établit et entretient à ses frais, toutes les lignes téléphoniques et télégraphiques supplémentaires, ainsi que les signaux et installations radioélectriques nécessaires pour assurer la sécurité de l'exploitation. Les projets de ces installations sont préalablement approuvés par le Comité de Pilotage et de Suivi des Pipelines après avis conforme du Ministre chargé des télécommunications, et sont exécutés conformément à la réglementation en vigueur en la matière.
Art. 50 —  Le Titulaire modifie librement les volumes d'hydrocarbures transportés à travers le Système de Transport par Pipeline, dans les conditions fixées dans sa Convention d'Etablissement et à condition que ni la pression d'exploitation maximale ni la capacité maximale fixées par l'Autorisation de Transport par Pipeline ne soient dépassées. Le Titulaire est tenu, avant la mise en service du Système de Transport par Pipeline, de communiquer au Ministre chargé des mines la capacité de service pour le transport des hydrocarbures à travers le Système de Transport par Pipeline et de l'informer par la suite de toute modification de cette capacité de service ; en précisant, le cas échéant, s'il y a eu adjonction d'équipements supplémentaires. Cette capacité de service, qui est la capacité à la pression d'exploitation maximale et pour une qualité d'hydrocarbures donnée, n'excèdera pas la capacité maximale visée ci-dessus.
L'exploitation du Système de Transport par Pipeline au-delà de cette capacité maximale et/ou toute modification du Système de Transport par Pipeline entraînant une augmentation de ladite capacité maximale nécessitent une modification du décret octroyant l'Autorisation de Transport du Titulaire. A cet effet, le Titulaire adresse au Ministre chargé des mines et en trois (03) exemplaires, le dossier suivant :
une demande de modification de la capacité maximale de transport du pipeline timbrée au tarif en vigueur, et mentionnant l'objet et la nature des opérations à entreprendre ;
les pièces visées à l'article 11, paragraphes 1.3 b), c), f), h) et k) du présent décret et relatifs aux équipements et ouvrages principaux concernés par l'adjonction ou la modification et la nouvelle pression d'exploitation maximale ;
une note sur la compatibilité technique des tubes et accessoires en place avec la nouvelle pression d'exploitation maximale.
Art. 51 —  Toute modification de la capacité de transport autorisée du pipeline par extension du Système de Transport par Pipeline due à la construction d'ouvrages supplémentaires est soumise à l'autorisation préalable du Ministre chargé des mines et à la modification subséquente de l'Autorisation de Transport par Pipeline du Titulaire. A cet effet, le Titulaire adresse au Ministre chargé des mines le dossier visé à l'article 11 du présent décret en trois (03) exemplaires modifié et complété comme indiqué ci-dessous :
une demande d'extension du Système de Transport par Pipeline timbrée au tarif en vigueur, et mentionnant l'objet et la nature des opérations à entreprendre ;
les pièces visées aux paragraphes e) à k) de l'article 11 alinéa 1.1 du présent décret, et se rapportant à l'objet de l'extension ;
toutes les pièces du dossier foncier se rapportant, le cas échéant, à la nature de l'opération à réaliser ;
toutes les pièces du dossier technique se rapportant, le cas échéant, à la nature de l'opération à réaliser.
Art. 52 —  1Le Titulaire peut demander à raccorder le pipeline d'un autre transporteur ou expéditeur à son Système de Transport par Pipeline. Les conditions et modalités commerciales du transport des hydrocarbures liées à un tel raccordement sont convenues entre le Titulaire et les expéditeurs de ces hydrocarbures, conformément aux dispositions de la Convention d'Etablissement du Titulaire. Il adresse au Ministre chargé des mines pour examen de conformité aux normes techniques applicables une demande de raccordement accompagnée d'un dossier constitué des pièces suivantes :
une déclaration conjointe de raccordement à son Système de Transport par Pipeline du pipeline de l'autre transporteur ou expéditeur, timbrée au tarif en vigueur ;
l'acte d'autorisation de l'autre transporteur ou expéditeur mentionnant notamment la raison sociale du propriétaire du pipeline à raccorder, et l'origine des hydrocarbures transporter ;
une note technique précisant la durée des travaux de raccordement, la nouvelle capacité de transport qui en résulte, le type d'installations provisoires dûment approuvées mises en place pour assurer la sécurité et la continuité de l'exploitation ;
les plans de détail et d'ensemble du raccordement.
Le Ministre chargé des mines accorde par décision, l'autorisation de raccordement. Les travaux de raccordement sont soumis aux règles de sécurité édictées conjointement par les deux transporteurs et conformes aux dispositions du présent décret et de l'arrêté visé à l'article 41 alinéa 2 ci-dessus.
2- Le Titulaire de l'Autorisation de Transport par Pipeline ne peut s'opposer au raccordement à son pipeline d'un autre pipeline demandé par le Ministre chargé des mines en application des dispositions de l'article 42 de la Loi N° 96/14 du 05 août 1996 et de celles de sa Convention d'Etablissement. Le Ministre chargé des mines transmet au Titulaire le dossier préparé par le bénéficiaire du raccordement qui mentionne la raison sociale dudit bénéficiaire, les caractéristiques et les volumes d'hydrocarbures à transporter, et la justification du choix de l'emplacement du raccordement.
Dans les trois (03) mois qui suivent la réception du dossier, le Titulaire fait connaître au Ministre chargé des mines ses observations et, s'il y a lieu, les solutions alternatives qu'il préconise pour la réalisation du raccordement. Des concertations peuvent être organisées par le Ministre chargé des mines entre le Titulaire et le bénéficiaire du raccordement.
Le projet d'exécution du raccordement retenu fait l'objet d'un accord entre le Titulaire et le bénéficiaire du raccordement, indiquant :
les conditions et modalités du transport des hydrocarbures liés à ce raccordement, et notamment les dispositions convenues pour que le bénéficiaire supporte le coût des modifications des installations du Titulaire afférentes au transport desdits hydrocarbures et le tarif commercial arrêté pour ce transport ;
les règles générales et particulières applicables à la conduite des travaux.
Cet accord est transmis au Ministre chargé des mines avec en annexe un dossier technique précisant le lieu du raccordement, la durée des travaux, la nouvelle capacité de-transport qui en résulte, le type d'installations provisoires mises en place pour assurer la sécurité et la continuité de l'exploitation, les plans de détail et d'ensemble du raccordement. Dans le cas où la nouvelle capacité du Système de Transport par Pipeline excède la capacité maximale autorisée en vigueur au moment du raccordement, l'Autorisation de Transport par Pipeline du Titulaire est modifiée en conséquence, conformément aux dispositions du présent décret.
Art. 53 —  Le Titulaire définit l'organisation, les moyens et les méthodes à mettre en œuvre en cas d'incident, d'accident ou d'incendie ayant entraîné, ou pouvant entraîner à court terme, des dommages aux populations, aux biens ou à l'environnement et notamment un épandage des hydrocarbures ou en cas de circonstances pouvant faire craindre à brève échéance un tel incident, accident ou incendie.
Toutes ces données sont réunies dans le Plan Particulier d'intervention établi en liaison avec le Service d'Inspection des Pipelines et les pouvoirs publics, et qui comporte les mesures à prendre en liaison avec les autorités territoriales compétentes, conformément aux dispositions de l'Arrêté visé à l'article 41 alinéa 2 du présent décret.
Ce plan, ainsi que sa mise à jour, est diffusé suivant les indications du Service d'Inspection des Pipelines et adressé aux Préfets concernés, notamment en vue de l'établissement et la mise à jour des plans de secours spécialisés.
Le Plan Particulier d'Intervention est conservé par le Titulaire et peut être transmis aux autorités désignées par le Service d'Inspection des Pipelines.
Art. 54 —  1Dès que le Titulaire a connaissance d'un incident, d'un accident ou d'un incendie, ou d'un risque imminent d'incident, d'accident ou d'incendie il met en application les consignes internes appropriées et, le cas échéant, le Plan Particulier d'Intervention ; il alerte le Service d'Inspection des Pipelines et les autorités et organismes concernés répertoriés au Plan Particulier d'Intervention et déclenche l'acheminement de ses moyens d'intervention, qui sont mis en œuvre en tant que de besoin pour faire cesser l'épandage des hydrocarbures et pour arrêter, contenir et évacuer les hydrocarbures répandus.
2- Le Titulaire effectue dès que possible toutes les investigations nécessaire pour connaître l'origine de l'événement, ses causes, ses conséquences, notamment en évaluant les quantités d'hydrocarbures répandues et recueillies, et des mesures propres à réduire la probabilité d'occurrence de cet événement et à en limiter les effets.
3- La remise en état des installations endommagées est réalisée dans les conditions prévues pour les travaux sur les pipelines par l'arrêté visé-à l'article 41 alinéa 2 du présent décret.
4- Si un accident grave ou une catastrophe extérieure au pipeline risque de porter atteinte à la sécurité de ce dernier, le Titulaire prend immédiatement toutes les dispositions nécessaires prévues le cas échéant par le Plan Particulier d'Intervention, pour arrêter les transports en cours ou procéder à l'isolement des sections par fermeture des vannes, et mettre en alerte les moyens d'intervention. Il avise les autorités territoriales concernées dans les meilleurs délais.
Art. 55 —  Le Titulaire prend les dispositions nécessaires pour faire cesser les faits d'origine humaine susceptibles de nuire directement ou indirectement au bon fonctionnement et à l'entretien du Système de Transport par Pipeline, avec au besoin l'assistance des autorités et services publics compétents. Lorsque cette démarche n'aboutit pas, le Titulaire en saisit le Service d'Inspection des Pipelines aux fins de faire constater les faits sur procès-verbal dressé par ses soins ou par ceux des officiers de police judiciaire.
Ces procès-verbaux sont transmis au Ministre chargé des mines, au Préfet territorialement compétent, et au Procureur de la République pour mise en mouvement de l'action publique. En cas d'urgence, le Service d'Inspection des Pipelines ou les officiers de police judiciaire ayant constaté les faits peuvent décider de la suspension des travaux ou activités entrepris par les tiers dans le voisinage du Système de Transport par Pipeline. Ils font mention de la dite suspension dans leur procès-verbal.
TITRE VI
DU CONTROLE ET DE LA SURVEILLANCE ADMINISTRATIVE
Art. 56 —  1Dans le cadre des missions visées à l'article 3 alinéas 1 et 2 du présent décret :
le Comité de Pilotage et de Suivi des Pipelines :
conduit les négociations préalables à la signature de la Convention d'Etablissement ;
coordonne l'action des Administrations publiques pendant l'instruction du dossier de l'Autorisation de Transport par Pipeline ainsi que pendant les opérations immobilières ;
suit les travaux et les activités de tout titulaire de l'Autorisation des Etudes Préliminaires ;
conduit les concertations pour l'approbation du tracé ;
transmet pour avis aux administrations et organismes publics compétents les projets d'exécution des travaux ;
approuve en conformité avec les avis des administrations ou organismes publics compétents les projets d'exécution des travaux ;
assure la liaison entre le Titulaire et les services publics ou organismes publics intéressés pendant la construction, l'exploitation et l'entretien du Système de Transport par Pipeline.
Le Service d'Inspection des Pipelines :
assure la surveillance administrative et le contrôle technique pour le compte de l'Administration, et peut faire appel, en fonction des tâches spécifiques à des experts désignés ou agréés ;
émet des avis techniques sur les études préliminaires ;
coordonne l'action des autres administrations pour ce qui concerne les opérations d'inspection et de contrôles techniques qu'elles mènent ou les mesures qu'elles prennent se rapportant directement au Système de Transport par Pipeline ;
mène toutes enquêtes utiles et expertises en cas d'incident significatif ou d'accident dans un Système de Transport par Pipeline ;
centralise et exploite les informations techniques et statistiques sur le Système de Transport par Pipeline.
2-La surveillance administrative et le contrôle technique de l'Administration relatifs à la construction, à l'exploitation et à l'entretien d'un Système de Transport par Pipeline et aux activités liées au transport des hydrocarbures visent au suivi de l'application et du respect des règles administratives et des nonnes techniques se rapportant aux obligations légales et réglementaires du Titulaire, à la sécurité et à la protection de l'environnement et des populations.
Les fonctionnaires et agents de l'Etat, les experts désignés ou les organismes de contrôle agréés, mandatés pour la surveillance administrative et le contrôle technique de l'Administration sont soumis aux obligations du secret professionnel.
3- Dans le cadre de la surveillance administrative, y compris celle des opérations de chargement et du contrôle technique de l'Administration, et conformément aux dispositions de sa Convention d'Etablissement, le Titulaire prend en charge les frais de transport et les frais de séjour du personnel commis à cet effet, ainsi que les frais d'épreuves, de ré-épreuve, de contrôle des soudures et d'analyse des échantillons prélevés.
Conformément aux dispositions de sa Convention d'Etablissement, le Titulaire prend toutes les dispositions nécessaires pour faciliter l'accès des personnels aux sites et installations objet de leur inspection ou contrôle, y compris lors de toutes les opérations de chargement et de celles relatives à la surveillance de l'emprise foncière. Il leur fournit toutes les informations nécessaires à leur mission.
En cas d'accident et pour mener leur enquête ou procéder à toutes constatations utiles, ces personnels et ceux des services compétents ont accès aux lieux et locaux sinistrés, éventuellement par décision du juge des référés compétents en cas de refus du Titulaire, du propriétaire ou autres ayant droit. Ils obtiennent communication de tous documents utiles.
Toute inspection ou contrôle technique effectué dans le cadre de la surveillance administrative et du contrôle technique de l'Administration pendant la construction, l'exploitation et l'entretien d'un Système de Transport par Pipeline donne lieu à un rapport d'inspection. En cas d'infraction, un procès-verbal est dressé et fait foi jusqu'à preuve du contraire.
Art. 57 —  Avant de commencer les travaux de construction ou de réparations entraînant excavation sur l'emprise foncière, le Titulaire de l'Autorisation de Transport par Pipeline doit en donneravis quinze (15) jours ouvrables au moins à l'avance au Comité de Pilotage et de Suivi des Pipelines.
Dans chaque Département, le Comité de Pilotage et de Suivi des Pipelines est chargé de coordonner l'action des diverses autorités responsables du Domaine Public ou des ouvrages publics intéressés-par le Système de Transport par Pipeline.
Le Titulaire est dispensé de se conformer au préavis de quinze (15) jours ouvrables ci-dessus en cas d'incident, d'accident ou d'incendie exigeant une intervention immédiate. Dans ce cas, il peut exécuter sans délai, les travaux nécessaires, à charge d'en aviser dès que possible le Comité de Pilotage et de Suivi des Pipelines, et de justifier l'urgence dans un délai maximum de vingt-quatre (24) heures.
Art. 58 —  Le Titulaire de l'Autorisation de Transport par Pipeline est tenu, de déplacer ou de modifier le pipeline empruntant le Domaine Public, à toute demande du Ministre chargé des Mines qui peut être saisi par les autorités dont relève ledit domaine public, lorsque ladite demande a lieu dans l'intérêt de la protection de l'environnement, de la sécurité publique ou de l'utilisation du domaine public emprunté par le pipeline ou affecté par son fonctionnement. Le Ministre chargé des mines notifie sa décision au Titulaire avec un préavis de quatre (04) mois, sauf cas d'urgence, et lui transmet les coordonnées du tronçon à déplacer ou à modifier en indiquant les motifs de sa décision.
Le Ministre chargé des mines prend toutes les dispositions pour que les autorisations nécessaires soient données au Titulaire, et notamment le cas échéant, pour que les terrains nécessaires à ce déplacement ou à cette modification soient disponibles au démarrage des travaux et que l'emprise foncière visée au Titre III, y compris tous les droits y afférents, soit modifiée en conséquence, sans frais pour le Titulaire. Sous réserve de ce qui précède et des dispositions de l'article 27 alinéas b) de la Loi N° 96/14 du 05 août 1996, le déplacement ou la modification des installations sont exécutés aux frais du Titulaire.
Toutefois, lorsque le déplacement ou la modification des installations sont requis dans l'intérêt des installations qui n'existaient pas sur le Domaine Public au moment de la construction du pipeline, les dépenses liées à l'exécution de ce déplacement ou de cette modification sont remboursées au Titulaire.
Si le Titulaire n'exécute pas le déplacement ou les modifications prescrites, il y est pourvu d'office et à ses frais, après mise en demeure infructueuse par les soins du Ministre chargé des mines. Le plan "" as built"" du tronçon du pipeline déplacé ou modifié dans le cas ci-dessus est adressé au Titulaire.
Art. 59 —  1Le Service d'Inspection des Pipelines assure la surveillance administrative et le contrôle technique de l'administration conformément à la réglementation en vigueur pour s'assurer du bon fonctionnement technique du Système de Transport par Pipeline, et pour veiller à l'application et au respect des dispositions du présent décret et de l'arrêté visé à l'article 41 alinéa 2 ci-dessus. A ce titre, les fonctionnaires et agents du Service d'Inspection des Pipelines, ou les experts désignés ou les organismes de contrôle agréés par le Ministre chargé des mines, dûment habilités :
pendant la construction ou l'entretien entraînant excavation du Système de Transport par Pipeline :
agréent les modes opératoires des soudures et vérifient leur contrôle effectué par le Titulaire ;
assistent et, en cas de non respect par le Titulaire de ses obligations dans le cadre de l'article 49, effectuent ou font effectuer les opérations de vérification, les essais et tests, et les prélèvements des échantillons pour analyse ;
se font représenter ou assistent à toutes les épreuves en usine au Cameroun. Lorsque les épreuves en usine se déroulent hors du Cameroun, le Titulaire fait signer ou contresigner les procès-verbaux desdites opérations par un organisme compétent en la matière, reconnu sur le plan international et agréé par la République du Cameroun, puis il les communique au Service d'Inspection des Pipelines trente (30) jours au moins avant le montage de l'élément concerné sur le pipeline
assistent aux épreuves sur site, et en dressent procès-verbaux.
pendant l'exploitation du Système de Transport par Pipeline :
vérifient deux (02) fois par an la forme et la cohérence des rapports établis à la suite des contrôles réglementaires effectués par le Titulaire et paraphent les registres institués pour lesdits contrôles ;
assistent au moins une (01) fois par an, ou selon la périodicité des opérations si celle-ci est supérieure à un an, aux contrôles effectués par le Titulaire ou, pour le compte du Titulaire, par des tiers choisis par le Titulaire parmi des organismes agréés par l'Etat, et notamment aux opérations suivantes :
l'inspection de l'état des vannes et soupapes de sécurité et du système de protection cathodique ;
le contrôle de la corrosion interne ;
l'inspection et l'essai des moyens de lutte contre l'incendie ;
l'analyse des effluents ;
l'épreuve et la ré-épreuve des appareils à pression et la ré-épreuve du pipeline.
iii. assistent à l'étalonnage et au réétalonnage des instruments de mesure pour le chargement des pétroliers.
Les vérifications des rapports visées ci-dessus peuvent donner lieu à des contrôles techniques ou des prélèvements des échantillons pour confirmer les résultats stipulés dans lesdits rapports et dans les registres.
2- Les conditions d'agrément des personnes physiques ou morales habilitées à faire des essais et tests, des inspections et des contrôles techniques pendant la construction, l'exploitation et l'entretien du Système de Transport par Pipeline sont fixées par arrêté du Ministre chargé des mines.
