URL,text,page_title
https://www.juriafrica.com/lex/decret-96-098-7-mai-1996-16639.htm,"LE PRESIDENT DE LA REPUBLIQUE,
VU la Constitution;
VU la loi n° 74/23 du 5 décembre 1974 portant organisation communale, ensemble ses divers modificatifs;
VU la loi n° 87/015 du 15 juillet 1987 portant création des communautés urbaines;
VU le décret n° 77/85 du 22 mars 1977 fixant les modalités de fonctionnement et de gestion du Fonds Spécial d'Equipement et d'Intervention Intercommunale, ensemble ses divers modificatifs;
VU le décret n° 92/245 du 25 novembre 1992 portant organisation du Gouvernement, ensemble ses divers modificatifs
DECRETE
Art. 1er —  Les dispositions des articles 3, 4, 5, 7, 10, 12, 13, 14 et 15 du décret n°77/35 du 22 mars 1977 fixant les modalités de fonctionnement et de gestion du Fonds Spécial d'Equipement et d'Intervention Intercommunale sont modifiées ainsi qu'il suit :
Art. 3 (nouveau)  —  Le Fonds Spécial d'Equipement et d'Intervention Intercommunale, en abrégé « FEICOM », et ci-après désigné le « Fonds », est alimenté par:
les cotisations des communes, à raison de 10% du produit de l'impôt libératoire, des contributions des patentes et licences et de la taxe sur le bétail,
les ristournes sur la vente des produits de base, conformément à la loi
la totalité de la taxe douanière municipale
20% du produit des centimes additionnels communaux provenant
de l'impôt sur le revenu des personnes physiques;
de l'impôt sur les sociétés;
des taxes sur les jeux;
de la taxe sur chiffre d'affaires
50% de la taxe de stationnement; 50% de la taxe de transhumance; -les subventions de l'Etat.
Art. 4 (nouveau)  —  (1) Le Comité de gestion est chargé de l'administration du Fonds. Il comprend:
le ministre chargé des collectivités locales ….Président
le ministre des Finances………………….Membre
- le ministre chargé de l'Urbanisme ..............Membre;
le représentant de la Présidence de la République...Membre;
- le représentant du Service du Premier ministre……………..Membre.
(2) Le Président du Comité de gestion est ordonnateur du budget du Fonds. A ce titre
- il émet les titres de recettes du Fonds ;
- il engage, liquide et ordonnance les dépenses dans le cadre des budgets approuvés,
- il autorise l'ouverture des comptes bancaires ou postaux au nom du Fonds, destinés à enregistrer les opérations de recettes et de dépenses ;
- il veille à l'application des décisions du Comité de gestion en fonction des circonstances, à charge de s'en référer à ce dernier lorsqu'il l'estime nécessaire
- il peut déléguer certaines de ses attributions au Directeur Administratif ».
Art. 5 (nouveau)  —  Le Comité de gestion :
il arrête annuellement le programme d'action du Fonds,
fixe les modalités pratiques d'intervention et de concours financiers aux projets communaux ou intercommunaux ;
recrute et licencie le personnel du Fonds de la 10e catégorie, sur proposition du Directeur Administratif
adopte le budget du Fonds
peut à tout moment faire procéder au contrôle du fonctionnement et de la gestion du Fonds;
suit l'utilisation des fonds accordés et reçoit périodiquement à cet effet des comptes rendus du Directeur Administratif ;
approuve l'organigramme du Fonds et ses modifications éventuelles, la nomination et la révocation des responsables des Services, les décisions étant prises par le Président du Comité de gestion,
approuve les rapports sur le fonctionnement du Fonds ainsi que le compte de gestion »
Art. 7 (nouveau)  —  (1) Le Comité de gestion ne peut valablement délibérer qu'en présence de trois de ses membres au moins.
(2) Le budget du Fonds est rendu exécutoire par décret du Président de la République.
Art. 10 (nouveau)  —  (1) Le Directeur Administratif:
propose l'organisation des Services du Fonds ;
prépare et, en sa qualité d'ordonnateur délégué, exécute le budget du Fonds;
prépare les réunions du Comité de gestion et en assure le secrétariat;
exécute les décisions du Comité de gestion;
assure la conservation des documents et archives du Fonds;
recrute et licencie le personnel jusqu'à la 9e catégorie;
représente le Fonds dans tous les actes de la vie civile et en justice ».
Art. 12 (nouveau)  —  (1) L'exercice financier du Fonds englobe, pour une période de douze (12) mois allant du 1er juillet au 30 juin de l'année suivante, la totalité des dépenses et des ressources prévisibles.
(2) La comptabilité obéit aux règles de la comptabilité publique.
(3) Les ressources du fonds sont des deniers publics ».
Art. 13 (nouveau)  —  (1) Il est créé au sein du Fonds une Agence Comptable placée sous l'autorité d'un Agent Comptable nommé par le Comité de gestion sur proposition du Ministre chargé des finances parmi les comptables du Trésor et ayant rang de Sous-directeur de l'Administration centrale.
(2) Les attributions, l'organisation ou le fonctionnement de l'Agence Comptable sont par un arrêté du Premier Ministre.
(3) Le Fonds est un correspondant du Trésor. A ce titre, les comptables du Trésor peuvent assurer le recouvrement de la quote-part des centimes additionnels communaux revenant au Fonds et en imputer le produit à son compte ouvert dans les écritures du Trésor ».
Art. 14 (nouveau)  —  (1) Le rapport sur le fonctionnement du Fonds établi par le Directeur Administratif ainsi que le compte de gestion de l'Agent Comptable sont soumis à l'approbation du Comité de gestion.
(2) L'apurement des comptes du Fonds est assuré par l'organe compétent pour contrôler et statuer sur les comptes publics et ceux des entreprises publiques et parapubliques.
Art. 15 (nouveau)  —  (1) Un commissaire aux comptes, désigné par le Ministre chargé des finances, vérifie et certifie les comptes du Fonds.
(2) Il exerce sa mission conformément aux lois et règlements en vigueur.
(3)La rémunération du commissaire aux comptes et les modalités de paiement de cette rémunération sont fixées par le Ministre chargé des finances.
(4) Une copie du rapport du commissaire aux comptes est remise au Comité de gestion, au Ministre chargé des collectivités locales et au Ministre chargé des finances ».
Art. 2 —  Sont et demeurent abrogées toutes dispositions antérieures contraires à celles du présent décret.
Art. 3 —  Le présent décret sera enregistré, publié suivant la procédure d'urgence, puis inséré au Journal Officiel en français et en anglais. /-",DECRET_N°96_098_DU_07_MAI_1996_MODIFIANT_CERTAINES_DISPOSITIONS_DU_DECRET_N°_77_87_DU_22_MARS_1977_FIXANT_LES_MODALITES_DE_FONCTIONNEMENT_ET_DE_GESTION_DU_FONDS_SPECIAL_D_EQUIPEMENT_ET_D_INTERVENTION
