URL,text,page_title,page_label,metadata
https://www.juriafrica.com/lex/decret-2020-632-19-octobre-2020-49030.htm,"LE PRESIDENT DE LA REPUBLIQUE,
Vu la Constitution ;
Vu la loi n°2010/002 du 13 avril 2010 portant protection et promotion des personnes handicapées ;
Vu la loi n°2017/010 du 12 juillet 2017 portant statut général des établissements publics;
Vu la loi n°2018/012 du 11 juillet 2018 portant régime financier de l'Etat et des autres entités publiques
Vu le décret n°2011/408 du 09 décembre 2011 portant organisation du Gouvernement, modifié et complète par le décret n°2018/190 du 02 mars 2018,
DECRETE:
CHAPITRE I
DISPOSITIONS GENERALES
Art. 1er —  Le présent décret porte création, organisation et fonctionnement du Centre de Réhabilitation des Personnes Handicapées de Maroua, en abrégé « CRPH-Maroua »-, ci-après désigné « le Centre».
Art. 2 —  (1) Le Centre est un établissement public à caractère social, doté de la personnalité juridique et de l'autonomie financière.
(2) Son siège est fixé à Maroua.
(3) Ce siège peut être transféré dans toute autre localité du territoire national par résolution du Conseil d'Administration.
(4) Sur proposition du Directeur Général, des annexes peuvent être créés en tant que de besoin, sur l'étendue du territoire national, par délibération du Conseil d'Administration.
Art. 3 —  Le Centre est placé sous la tutelle technique du Ministère en charge des affaires sociales et sous la tutelle financière du Ministère en charge des finances.
Art. 4 —  Le Centre est investi d'une mission de mise en œuvre de la politique gouvernementale en matière de réhabilitation des personnes handicapées.
A ce titre, ii est notamment chargé :
de l'encadrement en internat des personnes handicapées ;
de la prise en charge médico-sanitaire des personnes handicapées ;
de la prise en charge psychosociale des personnes handicapées et de leurs familiers;
de la promotion et de la recherche, en vue de l'amélioration de l'intervention en matière de réhabilitation ;
de l'apprentissage, de la formation et de la reconversion socioprofessionnelle des personnes handicapées en vue de leur réinsertion socioéconomique ;
de la fabrication locale des appareillages pour les personnes handicapées ;
de la coopération technique avec d'autres centres nationaux ou étrangers de réhabilitation des personnes handicapées, ainsi qu'avec des organisations ou les associations à but humanitaire ;
de la participation a toute activité ou opération en rapport avec ses missions et susceptible d'assurer le développement des personnes handicapées.
CHAPITRE II
DE L'ORGANISATION ET DU FONCTIONNEMENT
Art. 5 —  Le Centre est administré par les organes ci-après :
le Conseil d'Administration ;
la Direction Générale.
SECTION I
DU CONSEIL D'ADMINISTRATION
Art. 6 —  (1) Le Conseil d'Administration dispose des pouvoirs les plus étendus pour définir, orienter la politique générale et évaluer la gestion du Centre, dans les limites fixées par ses missions, conformément à la réglementation en vigueur.
A ce titre, le Conseil d'Administration est chargé :
de fixer les objectifs et d'approuver les projets de performance du Centre, conformément aux objectifs sociaux de la réhabilitation, de la réadaptation et de l'insertion socioéconomique et professionnelle des personnes handicapées ;
d'adopter le budget assorti du projet de performance du Centre et d'arrêter de manière définitive les comptes ;
d'approuver les rapports annuels de performance ;
d'adopter, sur proposition du Directeur General, l'organigramme et le Règlement intérieur ;
d'autoriser le recrutement de tout le personnel, conformément au plan de recrutement proposé par le Directeur Général et validé par le Conseil d'Administration ;
d'autoriser le licenciement du personnel, sur proposition du Directeur Général ;
de nommer, sur proposition du Directeur Général aux rangs de Sous-Directeurs, de Directeurs et assimilés ;
d'accepter tous dons, legs et subventions ;
d'approuver les contrats de performance ou toutes autres Conventions, y compris les emprunts, préparés par le Directeur Général et ayant une incidence sur le budget ;
d'autoriser toute aliénation de biens meubles ou immeubles, corporels ou incorporels, conformément a la réglementation en vigueur ;
de s'assurer du respect des règles de gouvernance et commet des audits afin de garantir la bonne gestion du Centre ;
de fixer les rémunérations et les avantages du personnel, dans le respect des lois et règlements en vigueur, du Règlement intérieur et des prévisions budgétaires ;
de fixer les rémunérations mensuelles et les avantages du Directeur Général et du Directeur Général-Adjoint dans le respect des lois et règlements et des prévisions budgétaires ;
de fixer le montant de l'allocation et les avantages du Président du Conseil d'Administration, ainsi que le montant des indemnités des membres dudit Conseil, conformément a la réglementation en vigueur.
(2) Le Conseil d'Administration peut déléguer au Directeur Général certains de ses pouvoirs.
Art. 7 —  (1) Le Conseil d'Administration du Centre est présidé par une personnalité nommée par décret du Président de la République.
(2) Il comprend en outre les membres ci-après :
un (01) représentant de la Présidence de la République ;
un (01) représentant des Services du Premier Ministre ;
un (01) représentant du Ministère en charge des affaires sociales ;
un (01) représentant du Ministère en charge des finances ;
un (01) représentant du Ministère en charge de la santé publique ;
un (01) représentant du Ministère en charge de la formation professionnelle ;
un (01) représentant du Ministère en charge de la promotion de la famille;
un (01) représentant du Ministère en charge de l'économie ;
un (01) représentant des organisations locales des personnes handicapées ;
le Maire de la Commune du ressort du Centre ;
un (01) représentant du personnel élu par ses pairs.
(3) Le Président du Conseil d'Administration peut, en tant que de besoin, faire appel à toute autre personne physique ou morale, en raison de son expertise ou de sa compétence sur l'un des points inscrits à l'ordre du jour, pour prendre part aux travaux du Conseil, avec voix consultative.
Art. 8 —  (1) Le Président du Conseil d'Administration du Centre est nommé par décret du Président de la République, pour un mandat de trois (03) ans, renouvelable une (01) fois.
(2) Les membres du Conseil d'administration du Centre sont nommés par décret du Président de la République, pour un mandat de trois (03) ans, éventuellement renouvelable une (01) fois.
(3) Le mandat d'Administrateur prend fin :
par décès ou par démission ;
à la suite de la perte de la qualité ayant motivé la nomination ;
par révocation à la suite d'une faute grave ou des agissements incompatibles avec la fonction d'Administrateur ;
à l'expiration normale de sa durée.
(4) Dans les cas prévus à l'alinéa 3 ci-dessus, il est pourvu au remplacement de l'Administrateur dans les mêmes formes que sa désignation.
Art. 9 —  (1) Pour l'accomplissement de ses missions, le Conseil d'Administration peut créer en son sein des Comites ou des Commissions charges d'étudier des questions spécifiques.
(2) Les membres de ces Comités ou Commissions bénéficient des facilites de travail et des indemnités, dans la limite des plafonds fixés par la réglementation en vigueur.
Art. 10 —  (1) Le Président du Conseil d'Administration bénéficie d'une allocation mensuelle, ainsi des avantages. Le montant de l'allocation mensuelle, ainsi que les avantages sont fixes par le Conseil d'Administration conformément à la réglementation en vigueur.
(2) Les Administrateurs bénéficient d'une indemnité de session fixée par une résolution du Conseil d'Administration, dans la limite des plafonds définis par la réglementation en vigueur. Ils peuvent prétendre au remboursement des dépenses occasionnées par les sessions, sur présentation des pièces justificatives.
Art. 11 —  (1) Sur convocation de son Président, le Conseil d'Administration se réunit obligatoirement au moins deux (02) fois par an en session ordinaire dont:
une session consacrée à l'examen du projet de performance et l'adoption du budget, qui se tient avant le début de l'exercice budgétaire suivant;
une session pour l'arrêt des comptes, qui se tient au plus tard le 30 juin.
(2) Les convocations accompagnées des dossiers à examiner sont adressées aux membres du Conseil par tout autre moyen laissant trace écrite quinze (15) jours au moins avant la date prévue pour la session.
(3) En cas d'urgence, le délai prévu à l'alinéa 2 ci-dessus peut être ramené à cinq (05) jours.
Art. 12 —  (1) Le Président du Conseil d'Administration est défaillant lorsqu'il ne convoque pas au moins deux (02) sessions du Conseil par an.
(2) En cas de refus de convoquer une session du Conseil, ou d'incapacité permanente du Président constatée par le Conseil, les deux tiers (2/3) des membres saisissent le Ministre de tutelle financière qui convoque le Conseil, sur un ordre du jour déterminé.
Art. 13 —  Le Conseil d'Administration peut être convoqué en session extraordinaire par le Président ou à la demande de deux tires (2/3) de ses membres, sur un ordre du jour précis.
Art. 14 —  Le Conseil d'Administration ne peut valablement délibérer sur toute question inscrite à son ordre du jour que si les deux tiers (2/3) au moins de ses membres sont présents ou représentés. Si le quorum n'est pas atteint lors de la première convocation, il est, pour la convocation suivante, ramène à la moitié des membres du Conseil d'Administration. En cas d'égalité des voix, celle du Président est prépondérante.
Art. 15 —  (1) Tout membre du Conseil d'Administration empêché peut se faire représenter aux sessions du Conseil par un autre membre. Toutefois, aucun Administrateur ne peut, au cours d'une même session, représenter plus d'un Administrateur.
(2) Tout membre présent ou représenté à une session du Conseil d'Administration, est considéré comme ayant été dûment convoqué.
(3) En cas d'empêchement du Président, le Conseil élit en son sein un Président de séance, à la majorité simple des membres présents ou représentés.
Art. 16 —  (1) Le secrétariat des sessions du Conseil d'Administration est assuré par le Directeur Général.
(2) Les procès-verbaux des séances sont consignés dans un registre spécial tenu au siège, et sent signés par le Président et le Secrétaire de séance. Ils font mention des membres présents ou représentés. Ils sont lus et approuvés par le Conseil d'Administration à l'occasion d'une session du Conseil.
Art. 17 —  (1) Les décisions du Conseil d'Administration prennent la forme des résolutions. Elles sont signées séance tenante par le Président du Conseil d'Administration ou le Président de séance, le cas échéant, et un Administrateur.
(2) Les décisions du Conseil d'Administration prennent effet à compter de leur adoption, sous réserve des dispositions contraires aux lois et règlements en vigueur.
Art. 18 —  (1) Le Président et les membres du Conseil d'Administration sont soumis aux mesures restrictives et incompatibilités prévues par la réglementation en vigueur.
(2) Le Président et les membres du Conseil d'Administration, ainsi que toute personne invitée à prendre part à une session du Conseil d'Administration sont astreints à l'obligation de discrétion pour les informations, faits et actes dont ils ont connaissance dans l'exercice de leurs fonctions.
SECTION II
DE LA DIRECTION GENERALE
Art. 19 —  (1) La Direction Généra le du Centre est placée sous l'autorité d'un Directeur Général, éventuellement assisté d'un Directeur Général-Adjoint, tous deux nommes par décret du Président de la République pour un mandat de trois (03) ans, éventuellement renouvelable deux (02) fois.
(2) Le Directeur Général et le Directeur Général-Adjoint sent soumis aux mesures restrictives et incompatibilités prévues par la réglementation en vigueur.
Art. 20 —  (1) Sous le contrôle du Conseil d'Administration, le Directeur Général est charge de la gestion et de l'application de la politique générale du Centre.
A ce titre, il est chargé notamment :
de préparer le projet de budget et performance, de produire le compte administratif, ainsi que le rapport annuel de performance ;
de préparer les résolutions du Conseil d'Administration, d'assister avec voix consultative aux sessions du Conseil et de veiller à leur exécution;
d'assurer la direction technique, administrative et financière du Centre ;
de proposer un plan de recrutement du personnel au Conseil d'Administration ;
de nommer le personnel, sous réserve des prérogatives dévalues au Conseil d'Administration ;
de gérer les biens meubles, immeubles, corporels et incorporels du Centre, dans le respect de ses missions et sous le contrôle du Conseil d'Administration ;
de représenter le Centre dans tous les actes de la vie civile et en justice.
(2) Le Directeur Général peut déléguer une partie de ses pouvoirs.
Art. 21 —  (1) Le Directeur General ou le Directeur General-Adjoint éventuellement est responsable devant le Conseil d'Administration, qui peut le sanctionner en cas de faute grave de gestion ou de comportement susceptible de nuire à la bonne marche ou à l'image du Centre.
(2) Dans les cas prévus à l'alinéa 1 ci-dessus, le Président du Conseil d'Administration est tenu de convoquer une session extraordinaire au cours de laquelle le Directeur Général ou le Directeur Général-Adjoint est entendu, dans le cadre d'un débat contradictoire.
(3) Le Conseil d'Administration ne peut valablement délibérer qu'en présence d'au moins deux tiers (2/3) de ses membres. Aucune représentation n'est admise dans ce cas.
(4) Le dossier comprenant les griefs est transmis au Directeur Général ou au Directeur Général-Adjoint dix (10) jours au moins avant la date du Conseil.
Art. 22 —  (1) Le Conseil d'Administration peut prendre à l'encontre du Directeur General ou du Directeur General-Adjoint, les sanctions suivantes :
suspension de certains pouvoirs ;
suspension de ses fonctions pour une période limitée, avec effet immédiat;
suspension de ses fonctions, avec effet immédiat, assortie d'une demande de révocation adressée à l'autorité investie du pouvoir de nomination.
(2) Les décisions sont transmises pour information au Ministre de tutelle technique et au Ministre de tutelle financière, à la diligence du Président du Conseil d'Administration.
(3) En cas de suspension des fonctions du Directeur Général ou du Directeur Général-Adjoint, le Conseil d'Administration prend des dispositions nécessaires pour assurer la bonne marche du Centre.
Art. 23 —  (1) En cas d'empêchement temporaire du Directeur General, l'intérim est assuré par le Directeur Général-Adjoint.
(2) En cas de vacance du poste de Directeur Général pour cause de décès, de démission ou de mandat arrivé à échéance, le Conseil d'Administration prend toutes les dispositions nécessaires pour le bon fonctionnement du Centre, en attendant la nomination d'un nouveau Directeur Général par l'autorité investie du pouvoir de nomination.
(3) En cas de sanction du Directeur Général ou du Directeur Général-Adjoint, en application de l'article 22 ci-dessus, le Conseil d'Administration prend les dispositions nécessaires pour la bonne marche du Centre.
CHAPITRE III
DU PERSONNEL
Art. 24 —  Le Centre peut employer :
le personnel recrute par le Centre ;
les fonctionnaires en détachement et les agents de l'Etat relevant du Code du Travail mis à disposition ;
le personnel occasionnel, saisonnier et temporaire dont les modalités de recrutement, de rémunération et de rupture du contrat sont fixées par le statut du personnel ;
les coopérants.
Art. 25 —  (1) Les fonctionnaires en détachement et les Agents de l'Etat relevant du Code du Travail mis à la disposition du Centre relèvent pendant la durée de leur emploi, de la législation du travail, sous réserve des dispositions du Statut General de la Fonction Publique et des statuts spécifiques relatifs à la retraite, à l'avancement et à la fin du détachement.
(2) Les fonctionnaires en détachement et les agents de l'Etat relevant du Code du Travail mis à la disposition du Centre sont, quel que soit leur statut d'origine, pris totalement en charge par le Centre, en ce qui concerne le salaire et ses accessoires, les indemnités, les primes et les autres avantages servis par le Centre.
Art. 26 —  (1) La responsabilité civile et/ou pénale du personnel du Centre soumise aux règles de droit commun.
(2) L'acte de nomination du Directeur Général et du Directeur General-Adjoint ne leur confère pas la qualité d'employé du Centre, à moins d'être préalablement dans une relation contractuelle avec le Centre.
CHAPITRE IV
DES DISPOSITIONS FINANCIERES
SECTION I
DES RESSOURCES
Art. 27 —  Les ressources financières du Centre sont constituées par :
les subventions de l'Etat, des Collectivités Territoriales Décentralisées et des organismes publics ;
le produit des prestations ;
les ressources issues de la coopération internationale ;
le produit de l'aliénation des biens ;
les dons et legs ;
les emprunts ;
les contributions diverses ;
toutes autres ressources qui pourraient lui être affectées, conformément à la réglementation en vigueur.
Art. 28 —  (1) Les ressources financières du Centre sont des deniers publics gérés suivant les règles prévues par le régime financier de l'État.
(2) Les fonds verses au titre de la coopération internationale sont portées au chapitre des ressources conformément à la nomenclature en vigueur. Ils doivent être employés suivant les stipulations des Conventions signées à cet effet.
SECTION II
DU BUDGET ET DES COMPTES
Art. 29 —  (1) Le projet de budget annuel, assorti du projet de performance y compris les plans d'investissement du Centre sont prépares par le Directeur Général et adoptes par le Conseil d'Administration et transmis, pour approbation, au Ministre chargé des finances, avant le début de l'exercice budgétaire.
(2) Les budgets du Centre sont prépares sous forme de sous-programmes cohérents, avec des objectifs de politiques publiques.
(3) Le budget du Centre doit être équilibre en recettes et en dépenses.
Art. 30 —  (1) Le Centre tient trois (03) types de comptabilité :
une comptabilité budgétaire des recettes et des dépenses ;
une comptabilité générale ;
une comptabilité analytique.
(2) Ces comptes doivent être réguliers, sincères et donner une image fidèle de son patrimoine et de sa situation financière.
Art. 31 —  (1) Le Directeur Général présente au Conseil d'Administration les comptes administratifs et de gestion, ainsi que les rapports annuels de performance dans les six (06) mois qui suivent la clôture de l'exercice.
(2) L'exercice budgétaire du Centre court du 1er janvier au 31 décembre.
(3) Une fois adoptés, les comptes administratifs et de gestion, ainsi que les rapports annuels de performance sont transmis aux Ministres chargés des affaires sociales et des finances.
Art. 32 —  Le Directeur Général est l'ordonnateur principal du budget du Centre.
SECTION III
DU CONTROLE ET DU SUIVI DE LA GESTION
Art. 33 —  (1) Un Agent Comptable est nommé auprès du Centre, par arrêté du Ministre chargé des finances.
(2) L'Agent Comptable enregistre toutes les recettes et toutes les dépenses du Centre. Il contrôle la régularité des autorisations des recettes, des mandatements et des paiements ordonnés par le Directeur Général.
(3) Le paiement des dépenses autorisées s'effectue uniquement auprès de l'Agent Comptable du Centre.
Art. 34 —  (1) Un Contrôleur Financier est désigne auprès du Centre par arrête du Ministre chargé des finances.
(2) Le Contrôleur Financier Spécialise est charge du contrôle des actes générateurs des recettes et des dépenses pris soit par le Directeur Général, soit par les ordonnateurs secondaires. Il est chargé, d'une manière générale, du contrôle de l'exécution du budget.
(3) Le Contrôleur Financier a mandat de vérifier les valeurs, la régularité et la sincérité des états financiers, ainsi que des informations contenues dans les rapports des organes statutaires du Centre.
Art. 35 —  (1) Le Contrôleur Financier et l'Agent Comptable présentent au Conseil d'Administration leurs rapports respectifs sur l'exécution du budget du Centre dans les six (06) mois suivant la clôture de l'exercice budgétaire.
(2) Les copies de ces rapports sont transmises à la Chambre des Comptes, du Ministre chargé des finances, au Ministre chargé des affaires sociales et au Directeur Général du Centre.
Art. 36 —  (1) Le suivi de la gestion et des performances du Centre est assuré par le Ministre charge des finances.
A cet effet, le Centre lui adresse tous les documents et informations relatifs à la vie de l'établissement qui doivent être tenus, en vertu du droit commun, à la disposition des Administrateurs et, notamment, les rapports d'activités, les rapports du Contrôleur Financier Spécialise, ainsi que les états financiers annuels.
(2) Le Ministre charge des finances peut demander la production d'états financiers pour une périodicité inferieure à un (01) exercice.
(3) Des audits indépendants peuvent être demandés par le Conseil d'Administration, ainsi que le Ministre charge des finances.
Art. 37 —  Le Ministre charge des affaires sociales adresse au Président de la République un rapport annuel sur la situation de Centre.
CHAPITRE V
DISPOSITIONS DIVERSES ET FINALES
Art. 38 —  Les collectivités publiques ou privées apportent, dans le cadre de la coopération, leur concours, leur assistance et leur appui aux activités du Centre, dans les conditions prévues par la règlementation en vigueur.
Art. 39 —  Le présent décret sera enregistré et publie suivant la procédure d'urgence, puis insère au Journal Officiel, en français et en anglais. /-",DECRET_N_2020_632_DU_19_OCTOBRE_2020_PORTANT_CREATION_ORGANISATION_ET_FONCTIONNEMENT_DU_CENTRE_DE_REHABILITATION_DES_PERSONNES_HANDICAPEES_DE_MAROUA,0,
