URL,text,page_title
https://www.juriafrica.com/lex/decret-2019-136-13-mars-2019-29131.htm,"LE PRESIDENT DE LA REPUBLIQUE,
VU la Constitution ;
VU l'ordonnance n° 72/11 du 26 août 1972 relatif à la publication des lois, ordonnances, décrets et actes réglementaires ;
VU la loi n° 2017/021 du 20 décembre 2017 portant loi de finances de la République du Cameroun pour l'exercice 2018 ;
VU le décret n° 77/4 du 06 janvier 1977 portant réglementation de la publication des actes au Journal Officiel de la République du Cameroun,
DECRETE :
Art. 1er —  Est ordonnée, la publication au Journal Officiel du texte de l'Accord d'indemnité relatif à l'octroi des garanties de paiement et de couverture à hauteur de 300 millions de dollars US, soit environ 257 millions d'euros, équivalent à 169 milliards de francs CFA, conclu le 12 décembre 2018 entre la République du Cameroun et la Banque Internationale pour la Reconstruction et le Développement (BIRD), au titre du financement du Projet de construction de l'aménagement hydroélectrique de Nachtigal-amont.
Art. 2 —  Le présent décret sera enregistré, publié suivant la procédure d'urgence, puis inséré au Journal Officiel en français et en anglais./-",DECRET_N°_2019_136_DU_13_MARS_2019_ORDONNANT_LA_PUBLICATION_AU_JOURNAL_OFFICIEL_DU_TEXTE_PORTANT_ACCORD_D'INDEMNITE_RELATIF_À_L'OCTROI_DES_GARANTIES_DE_PAIEMENT_ET_DE_COUVERTURE_À_HAUTEUR_DE_300
