URL,text,page_title,page_label,metadata
https://www.juriafrica.com/lex/decret-2002-252-31-oct-2002-15995.htm,"LE PRESIDENT DE LA REPUBLIQUE,
Vu la Constitution ,
Vu le décret n° 77/4 du 6 janvier 1977 portant réglementation de la publication des actes au Journal Officiel
Vu le décret 97/207 du 7 décembre 1997 portant formation du Gouvernement et ses divers modificatifs
Vu le décret n° 2002/216 du 24 août 2002 portant réorganisation du Gouvernement,
DECRETE:
Art. 1 —  e,.Est ordonnée la publication au Journal Officiel de la République du Cameroun l'Accord conclu le 1er août 2002 entre la République du Cameroun et le Fonds OPEP pour le Développement International, relatif à la promotion et à la protection des investissements.
Art. 2 —  Le présent décret qui sera enregistré et publié suivant la procédure d'urgence, puis inséré au Journal Officiel en français et en anglais./-",DECRET_N_2002_252_DU_31_OCTOBRE_2002_ORDONNANT_LA_PUBLICATION_AU_JOURNAL_OFFICIEL_DU_TEXTE_DE_L_ACCORD_CONCLU_LE_01_AOUT_2002_ENTRE_LA_REPUBLIQUE_DU_CAMEROUN_ET_LE_FONDS_OPEP_POUR_LE_DEVELOPPEMENT_INTERNATIONAL,0,
