URL,text,page_title,page_label,metadata
https://www.juriafrica.com/lex/decret-73-252-22-mai-1973-16275.htm,"LE PRESIDENT DE LA REPUBLIQUE,
Vu la Constitution de la République unie du Cameroun du 2 juin 1972 ;
Vu le décret n° 72-281 du 8 juin 1972 portant organisation du gouvernement de la République unie du Cameroun ;
Vu le décret n° 72-349 du 21 juillet 1972 portant organisation administrative de la République unie du Cameroun ;
Vu le décret n° 72-567 du 18 octobre 1972 portant organisation du ministère des finances ;
Vu le code des douanes ;
Vu l'arrêté n° 3829 du 16 novembre 1948 fixant le mode de répartition du produit des amendes et cotisations en matière de douanes au Cameroun,
Décrète :
I. - Dispositions générales
Art. premier —  Le produit des amendes et confiscations pour infraction au code des douanes sera réparti ainsi qu'il suit :
Trésor public ............................................... 50%
Saisissants et intervenants ........................... 20%
Mutuelles de la direction des douanes ........ 13%
Fonds commun des douanes ........................ 8%
Fonds spécial de lutte contre la fraude ........ 5%
Chefs ............................................................ 4%
Art. 2 —  (1) Les saisissants sont tous les fonctionnaires ou agents qui procèdent à la saisie de marchandises ou à la capture des contrevenants ou qui rapportent les preuves de l'infraction au code des douanes.
(2) Est réputé intervenant le fonctionnaire ou l'agent qui participe ou accompagne ou suit les opérations de saisie des marchandises ou de capture des contrevenants.
(3) La qualité de saisissant ou d'intervenant est établie par un acte authentique ou un procès-verbal dressé par un chef de service, un chef de bureau et approuvé par le directeur des douanes.
(4) Le maximum des sommes revenant aux intervenants et saisissants pour une même affaire est fixé ainsi qu'il suit :
Saisissants ........ 20.000 francs
Intervenants ..... 10.000 francs
(5) Ces rémunérations peuvent être majorées en cas de contrebande avec capture de contrevenant ou de saisies accompagnées de voies de fait ou de rébellion.
(6) Le partage entre les saisissants préposés et saisissants étrangers à l'administration des douanes, a lieu par tête et sous distinction de grade. Toutefois, lorsqu'une même fonction est remplie successivement par deux ou plusieurs ayants droit, il ne leur est attribué qu'une part.
(7) Les mêmes dispositions sont applicables en ce qui concerne les intervenants.
(8) Les agents des brigades qui sont appelés régulièrement à coopérer aux saisies effectuées dans les bureaux, ont droit à une part d'intervenant. Dans le cas où la constatation de l'infraction résulte de l'initiative ou des investigations personnelles d'un agent de brigade, celui-ci perçoit une part de saisissant.
(9) Dans les affaires constatées à l'aide de chiens de service, l'agent maître de l'animal, dont l'intervention aura été efficace, reçoit en plus de sa part de saisissant, une part d'intervenant.
Art. 3 —  (1) La quote-part à verser au fonds commun peut s'augmenter éventuellement :
des parts des chefs et des saisissants lorsqu'il n'y a ni chefs, ni saisissant admissibles au partage ;
des parts de saisissants, lorsque la découverte de la fraude est due à des instructions précises de la direction des douanes ou des services extérieurs (saisies de bureau seulement) ;
des parts des chefs, des saisissants et des intervenants lorsque des circonstances de la saisie révèlent à leur charge des fautes de service ou de graves négligences ou lorsque le produit net n'atteint pas 1.000 francs ;
des sommes qui n'auront pas été attribuées aux chefs, saisissants, et intervenants.
(2) Le produit du fonds commun est réparti chaque année par décision du ministre des finances aux personnels de tous grades qui auront utilement contribué :
à la perception des droits et à la sauvegarde des intérêts du Trésor ;
le plus efficacement à la répression de la fraude.
Art. 4 —  (1) Le montant des sommes revenant pour une même affaire aux chefs est fixé à 10.000 francs.
(2) Par chefs, il faut entendre les chefs hiérarchiques des saisissants, c'est-à-dire :
Pour les saisies de bureau :
Le chef de bureau ;
L'adjoint au chef de bureau ;
Eventuellement, le chef de service et
L'adjoint au chef de service.
Pour les saisies de campagne :
Le chef de bureau ;
L'adjoint au chef de bureau ;
Le chef de subdivision active ;
L'adjoint au chef de subdivision active ;
Le chef de brigade ;
Le chef de poste.
Pour les affaires constatées par la brigade des enquêtes et recherches :
Le sous-directeur des contrôles et de la répression de la fraude ;
Le chef de la brigade des enquêtes et recherches ;
Le chef de bureau des douanes poursuivant.
Pour les affaires portées en justice :
Le sous-directeur des contrôles et de la répression de la fraude ;
Le chef de service du contrôle et du contentieux ;
le chef de bureau de la répression et du contentieux ;
Les ayants droit au bureau de constatation de l'infraction.
(3) Le chef de bureau a droit à une part s'il est, à la fois poursuivant et dépositaire.
Si les attributions sont divisées, il est accordé une demi-part au poursuivant et une demi-
part au dépositaire. Lorsqu'il y aura plusieurs poursuivants, il se partageront par portions égales la demi-part y afférente.
Lorsqu'il y a plusieurs dépositaires, ils se partagent la demi-part en proportion de la valeur des objets et de la durée du dépôt.
(4) La quote-part non attribuée faute d'ayants droit augmente celle des autres chefs.
(5) L'agent qui a des droits à la répartition comme chef, saisissant ou intervenant reçoit les parts qui lui reviennent à ce double titre.
Art. 5 —  1) Dans le partage des amendes prononcées pour rébellion, la part des chefs et celle du fonds commun sont réunies à la masse des saisissants et elle est exclusivement réservées à ceux qui subissent les violences et les voies de faits.
2) Les agents qui portent secours à ceux qui souffrent de la rébellion perçoivent une part d'intervenant.
II. - De la répartition des amendes prononcées dans les affaires suivies à la demande d'autres administrations
Art. 6 —  La répartition du produit des amendes prononcées dans les affaires suivies par la direction des douanes à la demande d'autres administrations s'effectue ainsi qu'il suit quand les administrations poursuivantes n'y ont pas elles-mêmes procédé :
Trésor public ou collectivité bénéficiaire des amendes ............... 50%
Saisissants, intervenants .............................................................. 20%
Mutuelles de la direction des douanes ........................................ 13%
Fonds commun des douanes ........................................................ 8%
Fonds spécial de lutte contre les fraudes fiscales ....................... 5%
III. - Des saisies auxquelles participent les membres des forces armées
Art. 7 —  (1) Les membres des forces armées qui participent aux saisies sont admis à la répartition.
(2) Les chefs qui dirigent les opérations ont droit à la part de saisissant, et à celle de chef conformément à l'article 1er du présent décret.
IV. - De la répartition des amendes pour infraction au régime des acquits-à-caution
Art. 8 —  (1) La répartition des amendes pour infraction au régime des acquits-à-caution ou autres soumissions contractuelles est soumise aux règles suivantes :
Il n'y a pas de saisissants admissibles au partage si l'infraction résulte uniquement du défaut du rapport du certificat de décharge ou du défaut d'accomplissement dans les délais des engagements souscrits ;
Seuls les 4% représentant la part des chefs sont répartis par proportion égales au chef de service, à l'adjoint au chef de service, au chef de bureau, à l'adjoint au chef de bureau, à l'agent chargé de la poursuite des acquits-à-caution et autres soumissions contractuelles.
(2) Lorsqu'il s'agit d'autres infractions, la répartition s'effectue conformément aux dispositions des parties précédents.
V. - Dispositions diverses
Art. 9 —  Les droits et taxes afférents aux marchandises étrangères saisies et remises aux contrevenants, moyennant le versement d'une somme forfaitaire ne distinguant pas ces droits et taxes des pénalités, reversés au Trésor à 100% ne sont pas considérés comme infraction au code des douanes.
Art. 10 —  Aucun versement n'est effectué aux ayants droit sur les sommes provenant des confiscations et amendes dont les transactions en jugement n'ont pas encore acquis force de la chose jugée.
Art. 11 —  Des régies de recettes pour la perception du produit des amendes et confiscations et des régies d'avances pour le paiement des sommes revenant à certains ayants droit seront créées en tant que de besoin par des arrêtés du ministre des finances.
Art. 12 —  La répartition du produit du fonds commun des douanes et du fonds de lutte contre la fraude fiscale par décision du ministre des finances.
Art. 13 —  Le présent décret qui abroge l'arrêté n° 3829 du 16 novembre 1948 sera enregistré et publié au Journal officiel de la République unie du Cameroun en français et en anglais, et communiqué partout où besoin sera.
Yaoundé, le 22 mai 1973.
El Hadj Ahmadou AHIDJO.",DECRET_N_73_252_DU_22_MAI_1973_FIXANT_LE_MODE_DE_REPARTITION_DU_PRODUIT_DES_AMENDES_ET_CONFISCATIONS_POUR_INFRACTION_AU_CODE_DES_DOUANES,0,
