URL,text,page_title,page_label,metadata
https://www.juriafrica.com/lex/decret-77-90-25-mars-1977-16572.htm,"LE PRESIDENT DE LA REPUBLIQUE,
Vu la Constitution du 2 juin 1972, modifiée et complétée par loi n° 75-1 du 9 mai 1975 ;
Vu la loi n° 76-3 du 8 juillet 1976 fixant les frais d'inspection et de contrôle des établissements dangereux, insalubres ou incommodes,
Décrète :
Art. premier —  La répartition des frais d'inspection et de contrôle des établissements dangereux, insalubres ou incommodes, prévus par la loi n° 76-3 du 8 juillet 1976 s'effectue conformément aux dispositions du présent décret.
Art. 2 —  Le montant total des quotes-parts attribuées trimestriellement aux personnels chargés du contrôle des établissements visés à l'article 1er ci-dessus correspond à 30% des frais d'inspection et de contrôle versés au trésor au cours du trimestre considéré.
Art. 3 —  Pour l'attribution des quotes-parts visés à l'article 2 ci-dessus, les personnels chargés de l'inspection et du contrôle des établissements dangereux, insalubres ou incommodes sont répartis en trois catégories :
les inspecteurs des établissements classés : fonctionnaires de la catégorie A de la fonction publique et agents contractuels de la 10e à la 12e catégorie ;
les inspecteurs adjoints des établissements classés : fonctionnaires de la catégorie B de la fonction publique et agents contractuels de la 7e à la 9e catégorie ;
les personnels associés : fonctionnaires des catégories C et D de la fonction publique et autres agents contractuels et décisionnaires.
Un arrêté du ministre chargé des établissements dangereux, insalubres ou incommodes fixera les conditions de désignation des inspecteurs et des inspecteurs-adjoints.
Art. 4 —  (1) Les quotes-parts sont versés aux inspecteurs, inspecteurs-adjoints et personnels associés, en fonction d'une cote personnelle, donnée trimestriellement par le ministre chargé des établissements dangereux, insalubres ou incommodes, suivant le rendement de chacun.
(2) Elles sont payables trimestriellement, à terme échu, sur décision du ministre chargé des établissements dangereux, insalubres ou incommodes.
(3) Elles peuvent être diminuées ou supprimées par décision de l'autorité visée aux alinéas 1 et 2 ci-dessus, si le rendement de l'agent bénéficiaire s'est avéré faible ou nul au cours du trimestre considéré.
Art. 5 —  (1) Les quotes-parts sont calculées sur la solde indiciaire ou catégorielle mensuelle brute, par application des taux ci-après :
inspecteurs des établissements classés : 45% ;
inspecteurs-adjoints des établissements classés 35% ;
personnels associés : 25%.
(2) La quote-part maximale pouvant être attribuée à chaque bénéficiaire au cours d'un trimestre correspond à trois fois la prime mensuelle, calculée comme prévu à l'alinéa 1 ci-dessus.
Art. 6 —  (1) Au cas où le montant total des quotes-parts à distribuer serait supérieur au total des frais de contrôle à répartir entre les agents chargés du contrôle, elles sont multipliées par un coefficient de correction, calculé selon la formule a = D/M, tel que prévu en annexe au présent décret.
(2) Au cas où le total des frais de contrôle qui reviennent aux agents chargés du contrôle serait supérieur au montant total des quotes-parts calculées de ces derniers, le reliquat est reversé au trésor.
Art. 7 —  Les crédits nécessaires au paiement des quotes-parts ne sont pas budgétisés. Ils sont prélevés au trésor au vu des états de versement correspondants, effectués par l'agent intermédiaire du ministère chargé des établissements dangereux, insalubres ou incommodes au cours de chaque trimestre, et certifiés par le trésorier-payeur.
Art. 8 —  Sont abrogées toutes dispositions antérieures, et notamment l'arrêté du 5 août 1937 réglementant l'inspection des établissements classés.
Art. 9 —  Le présent décret sera enregistré et publié au Journal officiel en français et en anglais.
Yaoundé, le 25 mars 1977.
AHMADOU AHIDJO.",DECRET_N_77_90_DU_25_MARS_1977_DETERMINANT_LE_MODE_DE_REPARTITION_DES_FRAIS_D_INSPECTION_ET_DE_CONTROLE_DES_ETABLISSEMENTS_DANGEREUX_INSALUBRES_OU_INCOMMODES,0,
