URL,text,page_title,page_label,category,metadata
https://www.juriafrica.com/lex/decret-2014-268-24-juillet-2014-27035.htm,"DECRET N° 2014/268 DU 24 JUILLET 2014 HABILITANT LE MINISTRE DE L'ECONOMIE, DE LA PLANIFICATION ET DE L'AMÉNAGEMENT DU TERRITOIRE, À SIGNER AVEC L'ASSOCIATION INTERNATIONALE DE DÉVELOPPEMENT (IDA), UN ACCORD DE PRÊT D'UN MONTANT DE 45,9 MILLIONS DE DROITS DE TIRAGE SPÉCIAUX (DTS), CORRESPONDANT À 71 MILLIONS DE DOLLARS US, SOIT ENVIRON 35,5 MILLIARDS DE FRANCS CFA, POUR LE FINANCEMENT DU PROJET MULTIMODAL DE TRANSPORT.

LE PRESIDENT DE LA REPUBLIQUE,
Vu la Constitution ;
Vu la loi n° 2013/017 du 16 décembre 2013 portant loi de finances de la
République du Cameroun pour l'exercice 2014 ;
Vu le décret n° 2011/408 du 9 décembre 2011 portant organisation du Gouvernement,
DECRETE :
Art. 1er  —  Le Ministre de l'Economie , de la Planification et de l'Aménagement du Territoire est habilité, avec faculté de délégation, à signer avec l'Association Internationale de Développement (IDA), un Accord de prêt d'un montant de 45,9 millions de Droits de Tirage Spéciaux (DTS), correspondant à 71 millions de dollars US, soit environ 35,5 milliards de Francs CFA, pour k financement du projet multimodal de transport.
Art. 2 —  Le présent décret sera enregistré, publié scion la procédure d'urgence, puis inséré au Journal Officiel en français et en anglais/-",DECRET_N_2014_268_DU_24_JUILLET_2014_HABILITANT_LE_MINISTRE_DE_L_ECONOMIE_DE_LA_PLANIFICATION_ET_DE_L_AMENAGEMENT_DU_TERRITOIRE_A_SIGNER_AVEC_L_ASSOCIATION_INTERNATIONALE_DE_DEVELOPPEMENT_IDA_UN_ACCORD_DE_PRET_D_UN_MONTANT_DE_45_9_MILLIONS_DE_DROITS_DE_TIRAGE_SPECIAUX_DTS_CORRESPONDANT_A_71_MILLIONS_DE_DOLLARS_US_SOIT_ENVIRON_35_5_MILLIARDS_DE_FRANCS_CFA_POUR_LE_FINANCEMENT_DU_PROJET_MULTIMODAL_DE_TRANSPORT,0,decret,
