URL,text,page_title
https://www.juriafrica.com/lex/decret-2018-006-08-janvier-2018-49235.htm,"LE PRESIDENT DE LA REPUBLIQUE,
Vu la Constitution ;
Vu la Convention relative à l'Aviation Civile Internationale signée à Chicago le 7 décembre 1944, ratifiée le 15 janvier 1960 ;
Vu la Convention relative aux infractions et à certains autres actes survenant à bord des aéronefs, signée le 14 septembre 1963 à Tokyo, ratifiée le 24 mars 1988 ;
Vu la Convention pour la répression de la capture illicite d'aéronef signée le 16 décembre 1970 à la Haye, ratifiée le 14 avril 1988 ;
Vu la Convention portant modification de la Convention relative à l'Agence pour la Sécurité de la Navigation Aérienne en Afrique et à Madagascar (ASECNA) signée le 25 octobre 1974 à Dakar, ensemble ses modificatifs subséquents ;
Vu la Convention sur le marquage des explosifs plastiques et en feuilles aux fins de détection, signée le 1er mars 1991 à Montréal, ratifiée le 2 août 1998 ;
Vu la Convention sur la répression des actes illicites dirigés contre l'aviation civile internationale signée à Beijing le 10 septembre 2010, et ratifiée le 25 octobre 2011 ;
Vu la Convention pour la répression d'actes illicites dirigés contre la sécurité de l'aviation civile signée le 23 septembre 1971 à Montréal, ensemble ses modificatifs subséquents, ratifiée le 22 décembre 1999 ;
Vu le Règlement n°07/12-UEAC-006-CM-23 du 22 juillet 2012 portant adoption du Code de l'aviation civile des Etats membres de la CEMAC ;
Vu la loi n°2013/010 du 24 juillet 2013 portant régime de l'aviation civile au Cameroun ;
Vu la loi n°2017/013 du 12 juillet 2017 portant répression des infractions relatives à la sûreté de l'aviation civile ;
Vu le décret n°2011/408 du 09 décembre 2011 portant organisation du Gouvernement ;
Vu le décret n°2015/241 du 29 mai 2015 approuvant et rendant exécutoire le Programme National de Sûreté de l'Aviation Civile du Cameroun ;
Vu le décret n°2015/232 du 25 Mai 2015 portant organisation et fonctionnement de l'Autorité Aéronautique,
DECRETE :
Art. 1er —  Le présent décret approuve et rend exécutoire le Programme National de Sûreté de l'Aviation Civile du Cameroun, en abrégé « PNSAC ».
Art. 2 —  Le Programme National de Sûreté de l'Aviation Civile ci-joint en annexe, édicte des mesures visant à protéger les passagers, les équipages, les personnes au sol, les aéronefs, les installations et services d'aéroports ou servant à l'aviation civile, contre les actes d'intervention illicite.
Art. 3 —  Les dispositions du Programme National de Sûreté de l'Aviation Civile s'appliquent à tous les aérodromes camerounais ouverts à la circulation aérienne publique, à toutes les administrations publiques, ainsi qu'aux organismes et entreprises publics, parapublics et privés qui interviennent dans la chaine du transport aérien.
Art. 4 —  Le Programme National de Sûreté de l'Aviation Civile est amendable suivant les procédures en vigueur, pour tenir compte de l'évolution de là menace.
Art. 5 —  Sont abrogées, toutes les dispositions antérieures contraires, notamment celles du décret n°2015/241 du 29 mai 2015 susvisé, ensemble le Programme National de Sûreté de l'Aviation Civile y annexé.
Art. 6 —  Le présent décret sera enregistré, publié suivant la procédure d'urgence, puis inséré au Journal Officiel en français et anglais/.",DECRET_N°2018_006_DU_08_JANVIER_2018_APPROUVANT_ET_RENDANT_EXECUTOIRE_LE_PROGRAMME_NATIONAL_DE_SÛRETE_DE_L'AVIATION_CIVILE_DU_CAMEROUN.-
