URL,text,page_title,page_label,metadata
https://www.juriafrica.com/lex/decret-2013-274-12-aout-2013-18061.htm,"Le Président de la République,
Vu la Constitution;
Vu la loi n° 2012/014 du 21 décembre 2012 portant loi de Finances de la République du Cameroun pour l'exercice 2013;
Vu le décret n° 2011/408 du 9 décembre 2011 portant organisation du gouvernement,
Décrète:
Art. 1er —  Le Ministre de l'Economie, de la Planification et de l'Aménagement du Territoire est habilité, avec faculté de délégation, à signer avec l'Association Internationale de Développement (IDA), un accord de prêt d'un montant de 71,6 millions de droits de tirage spéciaux (DTS) correspondant à 108 millions de dollars US, soit environ 54 milliards de francs CFA, pour le financement du projet d'intervention d'urgence contre les inondations dans la région de l'Extrême-Nord.
Art. 2 —  Le présent décret sera enregistré, publié suivant la procédure d'urgence, puis inséré au Journal Officiel en français et en anglais.",DECRET_N_2013_274_DU_12_AOUT_2013_PORTANT_HABILITATION_DU_MINEPAT_A_SIGNER_UN_ACCORD_DE_PRET_POUR_LE_FINANCEMENT_DU_PROJET_D_INTERVENTION_D_URGENCE_CONTRE_LES_INONDATIONS_DANS_LA_REGION_DE_L_EXTREME_NORD,0,
