URL,text,page_title
https://www.juriafrica.com/lex/decret-2019-144-21-mars-2019-49963.htm,"LE PRESIDENT DE LA REPUBLIQUE,
VU la Constitution ;
VU la loi n°2018/022 du 11 décembre 2018 portant loi de finances de la République du Cameroun pour l'exercice 2019 ;
VU le décret n°2011/408 du 9 décembre 2011 portant organisation du Gouvernement, modifié et complété par le décret n°2018/190 du 2 mars 2018,
DECRETE :
Art. 1er —  Le Ministre des Finances est habilité, avec faculté de délégation, à signer avec ECOBANK Cameroun, une convention de crédit d'un montant de vingt-cinq milliards (25 000 000 000) de francs CFA, avec option pour une augmentation jusqu'à soixante milliards (60 000 000 000) de francs CFA, en vue du financement partiel du Plan d'Urgence Triennal pour l'Accélération de la Croissance Economique.
Art. 2 —  Le présent décret sera enregistré, publié suivant la procédure d'urgence, puis inséré au Journal Officiel en français et en anglais./-","DECRET_N°2019_144_DU_21_MARS_2019_HABILITANT_LE_MINISTRE_DES_FINANCES_À_SIGNER_AVEC_ECOBANK_CAMEROUN,_UNE_CONVENTION_DE_CREDIT_D'UN_MONTANT_DE_VINGT-CINQ_MILLIARDS_(25_000_000_000)_DE_FRANCS_CFA,"
