URL,text,page_title,page_label,category,metadata
https://www.juriafrica.com/lex/decret-2006-378-31-oct-2006-17018.htm,"DECRET N° 2006/378 DU 31 OCTOBRE 2006 PORTANT NOMINATION DES HUISSIERS DE JUSTICE DANS LE RESSORT DE LA COUR D'APPEL DE L'EXTRÊME-NORD.

LE PRESIDENT DE LA REPUBLIQUE,
Vu la Constitution
Vu le Décret n°79/488 du 5 novembre 1979 portant réglementation des fonctions et fixant le Statut des Huissiers, modifié et complété par les décrets n°s 85/238 du 22 février 1985 et 98/170 du 27 août 1998 ;
Vu le décret n°98/018 du 25 février 1998 portant création de charges d'Huissier de Justice
Vu les dossiers constitués par les intéressés
DECRETE:
Art. 1 —  Sont, pour compter de la date de signature du présent décret, nommés huissiers de justice dans le ressort de la Cour d'Appel de l'Extrême-Nord :
Monsieur NGAINSOM Denis à la 9ème charge du Tribunal de Première Instance de MAROUA
Monsieur NTJAM Christophe à la 4ème charge du Tribunal de Première Instance de KOUSSERI
Monsieur TEKAHFO Dieudonné à la lère charge du Tribunal de Première Instance de WAZA
Monsieur DONGMO Appolinaire à la 4ème charge du Tribunal de Première Instance de YAGOUA
Monsieur NTENE Raymond à la 4ème charge du Tribunal de Première Instance de MOKOLO.
Art. 2 —  Avant leur entrée en fonction les intéressés devront justifier de la souscription de la police d'assurance, du versement du cautionnement, d'une installation décente et prêter le serment prévu par la réglementation en vigueur.
Art. 3 —  Le Vice-Premier Ministre, Ministre de la Justice, Garde des Sceaux, est chargé de l'exécution du présent décret qui sera enregistré, puis publié au Journal Officiel, en anglais et en français.",DECRET_N_2006_378_DU_31_OCTOBRE_2006_PORTANT_NOMINATION_DES_HUISSIERS_DE_JUSTICE_DANS_LE_RESSORT_DE_LA_COUR_D_APPEL_DE_L_EXTREME_NORD,0,decret,
