URL,text,page_title,page_label,metadata
https://www.juriafrica.com/lex/decret-2014-017-20-janvier-2014-18081.htm,"LE PRESIDENT DE LA REPUBLIQUE,
Vu la Constitution;
Vu la loi n° 2013/017 du 16 décembre 2013 portant loi de finances de la République du Cameroun pour l'exercice 2014 ;
Vu le décret n° 2011/408 du 9 décembre 2011 portant organisation du Gouvernement,
DECRETE
Art. 1er —  Le Ministre de l'Economie, de la Planification et de l'Aménagement du Territoire est habilité, avec faculté de délégation, à signer avec l'Agence Française de Développement (AFD) un Acte de substitution de débiteur d'un montant de 10 438 717,78 Euros, soit environ 6 837 360 145,9 Francs CFA, pour le financement du secteur de l'eau urbaine au Cameroun.
Art. 2 —  Le présent décret sera enregistré, publié selon la procédure d'urgence, puis inséré au Journal Officiel en français et en anglais.-",DECRET_N_2014_017_DU_20_JANVIER_2014_HABILITANT_LE_MINISTRE_DE_L_ECONOMIE_DE_LA_PLANIFICATION_ET_DE_L_AMENAGEMENT_DU_TERRITOIRE_A_SIGNER_AVEC_L_AGENCE_FRANCAISE_DE_DEVELOPPEMENT_AFD_UN_ACTE_DE_SUBSTITUTION_DE_DEBITEUR_D_UN_MONTANT_DE_10_438_717_78_EUROS_SOIT_ENVIRON_6_837_360_145_9_FRANCS_CFA_POUR_LE_FINANCEMENT_DU_SECTEUR_DE_L_EAU_URBAINE_AU_CAMEROUN,0,
