URL,text,page_title,page_label,category,metadata
https://www.juriafrica.com/lex/decret-2024-334-24-juillet-2024-56000.htm,"DECRET N°2024/334 DU 24 JUILLET 2024 PORTANT RATIFICATION DU PROTOCOLE PORTANT AMENDEMENT DE L'ACCORD DE MARRAKECH INSTITUANT L'ORGANISATION MONDIALE DU COMMERCE (OMC), PAR L'INSERTION DE L'ACCORD SUR LES SUBVENTIONS À LA PÊCHE DANS L'ANNEXE 1A DU 17 JUIN 2022.

LE PRESIDENT DE LA REPUBLIQUE,
Vu la Constitution ;
Vu la loi n°2024/007 du Juillet 2024 autorisant le Président de la République à ratifier le Protocole portant amendement de l'Accord de Marrakech instituant l'Organisation Mondiale du Commerce (OMC), par l'insertion de l'Accord sur les subventions à la pêche dans l'Annexe 1A du 17 juin 2022,
DECRETE :
Art. 1er —  Est ratifié, le Protocole portant amendement de l'Accord de Marrakech instituant l'Organisation Mondiale du Commerce (OMC), par l'insertion de l'Accord sur les subventions à la pêche dans l'Annexe 1A du 17 juin 2022.
Art. 2 —  Le présent décret sera enregistré, publié suivant la procédure
d'urgence, puis inséré au Journal Officiel en français et en anglais./-",DECRET_N_2024_334_DU_24_JUILLET_2024_PORTANT_RATIFICATION_DU_PROTOCOLE_PORTANT_AMENDEMENT_DE_L_ACCORD_DE_MARRAKECH_INSTITUANT_L_ORGANISATION_MONDIALE_DU_COMMERCE_OMC_PAR_L_INSERTION_DE_L_ACCORD_SUR_LES_SUBVENTIONS_A_LA_PECHE_DANS_L_ANNEXE_1A_DU_17_JUIN_2022,0,decret,
