URL,text,page_title
https://www.juriafrica.com/lex/decret-2020-130-18-mars-2020-49128.htm,"LE PRESIDENT DE LA REPUBLIQUE,
Vu la Constitution ;
Vu la loi n°2019/023 du 24 décembre 2019 portant loi de finances de la République du Cameroun pour l'exercice 2020 ;
Vu le décret n°2011/408 du 09 décembre 2011 portant organisation du Gouvernement, modifié et complété par le décret n°2018/190 du 02 mars 2018,
DECRETE:
Art. 1er —  Le Ministre de l'Economie, de la Planification et de l'Aménagement du Territoire est habilité, avec faculté de délégation, à signer avec le Fonds Africain de Développement (FAD), un Accord de Prêt d'un montant de 6 000 000 d'Unités de Compte, soit environ 4 923 810 000 de francs CFA, pour le financement partiel du Programme Intégré de Développement et d'Adaptation au Changement Climatique dans le Bassin du Niger.
Art. 2 —  Le présent décret sera enregistré, publié suivant la procédure d'urgence, puis inséré au Journal Officiel en français et en anglais. /-","DECRET_N°2020_130_DU_18_MARS_2020_HABILITANT_LE_MINISTRE_DE_L'ECONOMIE,_DE_LA_PLANIFICATION_ET_DE_L'AMENAGEMENT_DU_TERRITOIRE_À_SIGNER_AVEC_LE_FONDS_AFRICAIN_DE_DEVELOPPEMENT_(FAD),_UN_ACCORD_DE_PRET"
