URL,text,page_title,page_label,metadata
https://www.juriafrica.com/lex/decret-2002-216-24-aout-2002-15935.htm,"LE PRESIDENT DE LA REPUBLIQUE,
VU la Constitution;
VU le décret n° 97/205 du 07 décembre 1997 portant organisation du Gouvernement et ses modificatifs subséquents ;
DECRETE:
Art. 1er —  (1) Le Président de la République, Chef de l'État, nomme le Premier Ministre, et, sur proposition de celui-ci, les autres Membres du Gouvernement. Il met fin à leurs fonctions.
(2) Le Premier Ministre dirige l'action du Gouvernement.
(3) Le Gouvernement est chargé de la mise en œuvre de la politique de la Nation telle que définie par le Président de la République.
(4) Les Ministres sans portefeuille et les Ministres Chargés de Mission sont placés sous l'autorité directe du Président de la République pour l'accomplissement de missions spécifiques.
(5) Les Ministres Délégués sont placés sous l'autorité du Président de la République, du Premier Ministre ou de Ministres pour l'accomplissement de tâches spécifiques permanentes.
(6) Les Secrétaires d'Etat assistent les Ministres dans leurs tâches et peuvent être chargés, sous l'autorité de ces derniers, de la gestion de secteurs particuliers ; des textes particuliers fixent, en tant que de besoin, leurs attributions propres.
Art. 2 —  Le Gouvernement comprend:
le Premier Ministre;
les Vice-Premiers Ministres, le cas échéant;
les Ministres d'Etat, le cas échéant;
les Ministres;
les Ministres sans portefeuille;
les Ministres Chargés de Mission;
les Ministres Délégués;
les Secrétaires d'Etat.
Art. 3 —  (1) L'organisation des Services du Premier Ministre et des Départements Ministériels fait l'objet de textes particuliers.
(2) Sont rattachés aux Services du Premier Ministre:
la Haute Autorité de la Fonction Publique;
le Comité National des Droits de l'Homme et des Libertés;
le Conseil National de la Communication.
Art. 4 —  (1) Les Départements Ministériels sont, par ordre alphabétique:
le Ministère de l'Administration Territoriale et de la Décentralisation;
le Ministère des Affaires Economiques, de la Programmation et de l'Aménagement du Territoire;
le Ministère des Affaires Sociales
le Ministère de l'Agriculture;
le Ministère chargé du Contrôle Supérieur de l'Etat, placé sous l'autorité d'un Ministre Délégué à la Présidence de la République;
le Ministère chargé des Relations avec les Assemblées, placé sous l'autorité d'un Ministre Délégué à la Présidence de la République;
le Ministère de la Communication;
le Ministère de la Condition Féminine; - le Ministère de la Culture;
le Ministère de la Défense, placé sous l'autorité d'un Ministre Délégué à la Présidence de la République;
le Ministère du Développement Industriel et Commercial;
le Ministère de l'Education Nationale;
le Ministère de l'Elevage, des Pêches et des Industries Animales;
le Ministère de l'Emploi, du Travail et de la Prévoyance Sociale;
le Ministère de l'Enseignement Supérieur;
le Ministère de l'Enseignement Technique et de la Formation Professionnelle;
le Ministère de l'Environnement et des Forêts;
le Ministère des Finances et du Budget;
le Ministère de la Fonction Publique et de la Réforme Administrative;
le Ministère de la Jeunesse et des Sports
le Ministère de la Justice;
le Ministère des Mines, de l'Eau et de l'Energie ;
le Ministère des Postes et Télécommunications;
le Ministère de la Recherche Scientifique et Technique;
le Ministère des Relations Extérieures;
le Ministère de la Santé Publique;
le Ministère du Tourisme;
le Ministère des Transports;
le Ministère des Travaux Publics;
le Ministère de l'Urbanisme et de l'Habitat;
le Ministère de la Ville.
(2) Des Ministres Délégués assistent le Ministre de l'Administration Territoriale et de la Décentralisation, le Ministre des Affaires Economiques, de la Programmation et de l'Aménagement du Territoire, le Ministre des Finances et du Budget et le Ministre des Relations Extérieures;
(3) Des Secrétaires d'Etat assistent les Ministres dans les Départements Ministériels ci-après:
Ministère de l'Administration Territoriale et de la Décentralisation - Ministère des Affaires Economiques, de la Programmation et de l'Aménagement du Territoire;
Ministère de l'Agriculture;
Ministère de la Défense;
Ministère du Développement Industriel et Commercial;
Ministère de l'Education Nationale;
Ministère de la Jeunesse et des Sports;
Ministère de la Santé Publique;
Ministère des Transports;
Ministère des Travaux Publics;
Ministère de l'Urbanisme et de l'Habitat.
Art. 5 —  Les attributions des Ministres sont fixées comme suit:
1 - LE MINISTRE DELEGUE A LA PRESIDENCE CHARGE DE LA
DEFENSE .
Est chargé:
de l'étude du plan de défense;
de la mise en œuvre de la politique de défense;
de la coordination et du contrôle des forces de défense;
de l'organisation et du fonctionnement des tribunaux militaires.
Il est assisté d'un Secrétaire d'Etat, chargé spécialement de la Gendarmerie.
2 - LE MINISTRE DELEGUE A LA PRESIDENCE CHARGE DU CONTROLE SUPERIEUR DE L'ETAT
Est chargé du contrôle supérieur de la gestion des finances publiques dans les services publics, les établissements et les organismes publics et parapublics sur les plans administratif, financier et comptable.
3 - LE MINISTRE DELEGUE A LA PRESIDENCE CHARGE DES RELATIONS AVEC LES ASSEMBLEES
assure la liaison entre le Gouvernement et l'Assemblée Nationale, le Sénat et le Conseil Economique et Social.
4- LE MINISTRE DE L'ADMINISTRATION TERRITORIALE ET DE LA DECENTRALISATION
Est chargé:
de l'organisation et du fonctionnement des services locaux de l'Administration Territoriale ;
de l'organisation et du contrôle des consultations électorales à caractère national, local ou référendaire dans les conditions prévues par les lois et règlements;
de l'organisation des collectivités territoriales décentralisées et des chefferies traditionnelles;
de l'administration pénitentiaire;
de la protection civile;
du suivi des activités des associations à but non lucratif et des cultes ;
du maintien de l'ordre public en rapport avec les forces spécialisées;
de la mise en œuvre de la politique nationale en matière de décentralisation;
Il assure la tutelle du Fonds Spécial d'Equipement et d'Intervention Intercommunale, du Centre de Formation pour l'Administration Municipale et de l'Ecole Nationale de l'Administration Pénitentiaire.
Il est assisté d'un Ministre Délégué chargé des Collectivités Territoriales décentralisées et d'un Secrétaire d'Etat chargé de l'Administration Pénitentiaire.
5- LE MINISTRE DES AFFAIRES ECONOMIQUES, DE LA PROGRAMMATION ET DE L'AMENAGEMENT DU TERRITOIRE
Est chargé de l'élaboration et de la mise en œuvre de la politique économique de la Nation ainsi que de l'Aménagement du Territoire.
A ce titre, il est responsable:
de la prospective et des orientation économiques à court, moyen et long termes;
de la cohérence et de la coordination des actions engagées dans le cadre du plan de stabilisation et de relance économique;
des programmes économiques et des programmes d'appui à l'ajustement structurel ;
de la confection des statistiques, des comptes économiques et de la balance des paiements de la Nation;
de l'élaboration du programme d'investissement pluriannuel de l'Etat;
de la préparation, du suivi et du contrôle de l'exécution du budget de l'Etat en ce qui concerne les l'investissement public;
de la promotion des investissements publics et privés;
de la coopération économique et technique internationale;
du suivi, en ce qui concerne les affaires économiques et les projets d'investissements, des affaires de la Communauté Economique et Monétaire de l'Afrique Centrale et de la Communauté Economique des Etats de l'Afrique Centrale;
du suivi, en ce qui concerne les affaires économiques et les projets d'investissements, des affaires du Fonds Monétaire International, de la Banque Mondiale, du Programme des Nations Unies pour le Développement, de l'Union Européenne, de la Banque Islamique de Développement , de la Banque Africaine de Développement, de la Commission Economique des Nations Unies pour l'Afrique;
de l'élaboration et de la mise en couvre de la politique nationale de la population;
de la planification des ressources humaines;
de l'élaboration des projets et programmes relatifs à la mise en oeuvre de la politique d'aménagement du territoire.
Le Ministre des Affaires Economiques, de la Programmation et de l'Aménagement du Territoire préside le Comité Interministériel de Supervision des Programmes économiques et le Comité Interministériel de la Mission de Réhabilitation des Entreprises Publiques. Lui sont rattachés le Comité Technique de Préparation et de suivi des Programmes Economiques ainsi que la Mission de Réhabilitation des Entreprises Publiques.
Il assure la tutelle de l'Institut Sous-Régional de la Statistique et de l'Economie Appliquée, des Missions d'Aménagement du Territoire à l'exception de la Mission d'Aménagement et de Gestion des Zones Industrielles, de l'Institut Panafricain pour le Développement et, au plan administratif, de l'Institut de Formation et de Recherche Démographiques.
Le Ministre des Affaires Economiques, de la Programmation et de l'Aménagement du Territoire est assisté d'un Ministre Délégué chargé du Plan de Relance Economique et d'un Secrétaire d'État chargé de l'Aménagement du Territoire.
6- LE MINISTRE DES AFFAIRES SOCIALES
Est responsable de l'élaboration et de la mise en oeuvre de la politique de prévention et d'assistance sociales, ainsi que de la protection sociale de l'individu et de la promotion de la famille.
A ce titre, il est chargé:
de la protection sociale de l'enfance, des familles, des personnes âgées et des handicapés;
de la prévention et du traitement de la délinquance juvénile et de l'inadaptation sociale;
de la facilitation de la réinsertion sociale, de l'insertion des jeunes et de la lutte contre l'exclusion;
de la solidarité nationale;
du contrôle des écoles de formation des personnels sociaux;
de l'animation, de la supervision et du contrôle des établissements et des institutions concourant à la mise en oeuvre de la politique de protection sociale.
Il assure la liaison avec le Fonds des Nations Unies pour l'Enfance, ainsi que la tutelle des organismes de protection et d'encadrement de l'enfant, à l'exclusion des établissements d'enseignement relevant du Ministère de l'Education Nationale.
7- LE MINISTRE DE L'AGRICULTURE
Est chargé:
de la promotion de la production agricole;
de l'élaboration et de la réalisation des programmes gouvernementaux relatifs à l'agriculture;
de l'enseignement agricole et coopératif et du contrôle de l'enseignement agricole privé en liaison avec le Ministère de l'Enseignement Technique et de la Formation Professionnelle;
de l'encadrement des producteurs et de la vulgarisation agricoles;
de l'aménagement de l'espace rural, du développement communautaire et du génie rural;
de l'organisation des foires et comices agricoles;
de la collecte des statistiques agricoles.
Il assure la tutelle des structures de développement en milieu rural, des sociétés publiques ou parapubliques intervenant dans son domaine de compétence ainsi que celle de la Chambre d'Agriculture, de l'Elevage et des Forêts.
Il assure la liaison avec l'Organisation des Nations Unies pour l'Alimentation et l'Agriculture, le Fonds International pour le Développement de l'Agriculture et le Programme Alimentaire Mondial.
Il est assisté d'un Secrétaire d'Etat chargé de l'Aménagement de l'Espace Rural, du Génie Rural et du Développement Communautaire.
8- LE MINISTRE DE LA COMMUNICATION
Est chargé :
de l'élaboration et de la mise en œuvre de la politique de communication du Gouvernement;
du suivi des questions relatives à la publicité.
Il assure la tutelle des organes de presse et de publicité, notamment, l'Imprimerie Nationale, la Société de Presse et d'Edition du Cameroun et l'Office de Radio-Télévision du Cameroun.
9- LE MINISTERE DE LA CONDITION FEMINIME :
Est chargé de l'élaboration et de la mise en œuvre des mesures relatives au respect des droits de la femme camerounaise dans la société, à la disparition de toute discrimination à l'égard de la femme et à l'accroissement des garanties d'égalité dans les domaines politique, économique, social et culturel.
A ce titre:
il étudie et soumet au Gouvernement les conditions facilitant l'insertion de la femme dans l'administration, l'agriculture, le commerce et l'industrie;
il assure la liaison avec les organisations politiques nationales et internationales de promotion de la femme;
il assure la tutelle des organismes de formation féminine, à l'exclusion des établissements d'enseignement relevant du Ministère de l'Education Nationale et du Ministère de l'Enseignement Technique et de la Formation Professionnelle.
10 - LE MINISTRE DE LA CULTURE
Est chargé:
de la définition et de la mise en œuvre de la politique culturelle;
du développement et de la diffusion de la culture;
de la cinématographie;
de la protection, de la conservation, de l'enrichissement et de la promotion du patrimoine culturel, artistique et cinématographique national ;
de la préservation des sites et monuments historiques ;
des musées, des bibliothèques, des cinémathèques et des archives nationales.
Il exerce la tutelle du Palais des Congrès et assure la liaison entre les pouvoirs publics et les organisations de droits d'auteur.
11 - LE MINISTRE DU DEVELOPPEMENT INDUSTRIEL ET COMMERCIAL
Est chargé du développement industriel, commercial et artisanal harmonieux du pays.
A ce titre, il est responsable:
de la définition et de la mise en œuvre des politiques industrielle et commerciale;
du développement des petites et moyennes entreprises;
de la lutte contre l'inflation et, à ce titre, de la définition et de la mise en œuvre de la politique des prix et des mesures;
de la normalisation en rapport avec les Départements ministériels concernés;
de la transformation locale des produits agricoles; - du développement de l'artisanat;
du suivi des affaires de l'Organisation Mondiale du Commerce, de l'Organisation Mondiale de la Propriété Intellectuelle et de l'Organisation des Nations Unies pour le Développement Industriel;
du suivi, en qui concerne les activités industrielles et commerciales, de la Communauté Economique et Monétaire de l'Afrique Centrale et de la Communauté des Etats de l'Afrique Centrale.
Il assure la tutelle de la Société Nationale d'Investissement, de l'Office National du Cacao et du Café, de l'Office National des Zones Franches Industrielles, de la Mission d'Aménagement et de Gestion des Zones Industrielles, de la Chambre de Commerce, de l'Industrie et des Mines et de l'Artisanat, des Sociétés industrielles publiques ou parapubliques intervenant dans son secteur de compétence, de la Caisse de Stabilisation des Prix des Hydrocarbures et des organismes d'intervention et d'assistance aux industries et aux petites et moyennes entreprises.
Le Ministre du Développement Industriel et Commercial est assisté d'un Secrétaire d'Etat.
12 - LE MINISTRE DE L'EDUCATION NATIONALE
Est chargé:
de l'organisation et du fonctionnement de l'enseignement secondaire général;
de l'organisation, du fonctionnement et du contrôle de l'enseignement primaire public et privé, de la conception des programmes d'études et de la recherche des méthodes de cet enseignement;
de la formation morale, civique et intellectuelle des élèves des cycles maternel, primaire et secondaire;
de la liaison avec l'Organisation des Nations Unies pour l'Education, la Science et la Culture.
Il est assisté de deux Secrétaires d'Etat.
13 - LE MINISTRE DE L'ELEVAGE,_ DES PECHES ET DES INDUSTRIES ANIMALES
Est chargé de l'élaboration et de la mise en œuvre de la politique du Gouvernement en matière d'élevage, de pêche et de développement des industries animales.
Dans le cadre de ses attributions, il est chargé, en liaison avec les autres départements ministériels intéressés:
de l'application de toutes mesures visant à la conservation, au développement et à l'exploitation des animaux domestiques et de leurs produits;
de la salubrité des denrées alimentaires d'origine animale;
de la formation et de l'encadrement technique en matière d'élevage ;
de la formation des pêcheurs, de la protection des ressources maritimes et fluviales, de l'amélioration de la production et du contrôle sanitaire et statistique en matière de pêche maritime, fluviale et piscicole;
des études et recherches en vue du renouvellement des ressources halieutiques et piscicoles en liaison avec le Ministère chargé de la Recherche Scientifique.
Il assure la tutelle de la Société de Développement et d'Exploitation des Productions Animales et de la Mission de Développement de la Pêche Maritime Artisanale.
14 - LE MINISTRE DE L'EMPLOI, DU TRAVAIL ET DE LA PREVOYANCE SOCIALE
Est chargé de la préparation, de l'animation, de la mise en oeuvre de la politique gouvernementale de l'emploi, de la coordination des actions menées en faveur du dialogue social, de la protection du statut des travailleurs et du développement de la prévoyance sociale.
A ce titre il est responsable:
de la définition de la politique de l'emploi;
de la promotion de l'emploi;
de l'orientation et du placement de la main d'œuvre;
du contrôle des actions de formation professionnelle des travailleurs en relation avec le Ministre de l'Enseignement Technique et de la Formation Professionnelle;
du contrôle de l'application du Code du travail et des conventions internationales ratifiées par le Cameroun et ayant trait au travail;
de l'élaboration et de la mise en œuvre de la politique de prévoyance sociale;
de la liaison avec les institutions du système des Nations-Unies et de l'Union Africaine spécialisées dans le domaine du travail.
Il assure la tutelle de la Caisse Nationale de Prévoyance Sociale, du Fonds National de l'Emploi et des organismes de promotion de l'emploi.
15 - LE MINISTRE DE L'ENSEIGNEMENT SUPERIEUR
Est chargé de l'élaboration et de la mise en œuvre de la politique du Gouvernement en matière d'enseignement supérieur, de l'organisation, du fonctionnement et du contrôle pédagogique de l'enseignement supérieur.
A ce titre:
il étudie et propose au Gouvernement les voies et moyens visant à l'adaptation en permanence du système d'enseignement supérieur aux réalités économiques et sociales nationales, particulièrement en ce qui concerne l'adéquation de l'enseignement supérieur aux besoins de l'économie nationale;
il assure une liaison permanente avec tous les secteurs de la vie nationale (administrations publiques, sociétés du secteur public ou parapublic, secteur privé) en vue de la professionnalisation de l'enseignement supérieur.
II assure la tutelle des universités et la supervision des Institutions de formation supérieure.
16 - LE MINISTERE DE L'ENSEIGNEMENT TECHNIQUE ET DE LA FORMATION PROFESSIONNELLE
Est chargé:
de la définition de la politique en matière d'Enseignement Technique et Professionnel ainsi que de la détermination des orientations et du soutien des actions en vue du développement de la formation professionnelle;
de l'organisation et du fonctionnement de l'enseignement technique et professionnel)
du contrôle des programmes d'études et de recherche des méthodes de l'enseignement technique;
du suivi des actions de formation professionnelle des travailleurs;
de la coordination et de la gestion des programmes de formation professionnelle;
de la formation civique des élèves de l'enseignement technique;
du contrôle des établissements d'enseignement technique.
Il assure la tutelle des Instituts de Formation Professionnelle.
17 - LE MINISTRE DE L'ENVIRONNEMENT ET DES FORETS'
Est chargé:
en matière d'environnement:
de l'élaboration, de la coordination et du suivi de l'exécution de la politique nationale d'environnement;
de la coordination et du suivi des interventions des organismes de coopération régionale ou internationale en matière d'environnement;
de la définition des mesures de gestion rationnelle des ressources naturelles en liaison avec les ministères et organismes spécialisés concernés;
de l'information du public en vue de susciter sa participation à la gestion, à la protection et à la restauration de l'environnement;
de l'élaboration des plans directeurs sectoriels de protection de l'environnement en liaison avec les départements ministériels intéressés;
de la négociation des accords et conventions internationaux relatifs à la protection de l'environnement.
en matière de forêt:
de la gestion et de la protection des forêts du domaine national ;
de la mise au point et du contrôle de l'exécution des programmes de régénération, de reboisement, d'inventaire et d'aménagement des forêts ;
du contrôle de l'exploitation forestière
de la liaison avec les organismes professionnels du secteur forestier; - de l'aménagement et de la gestion des jardins botaniques ;
de l'élaboration et de la mise en œuvre de la politique du Gouvernement en matière de faune et de chasse.
Il assure la tutelle de l'Agence Nationale des Forêts, ainsi que fa liaison avec l'Organisation des Nations Unies pour l'Alimentation et l'Agriculture en ce qui concerne la forêt et les autres organisations intervenant dans le secteur.
18 - LE MINISTERE DES FINANCES ET DU BUDGET
Est chargé de l'élaboration et de la mise en œuvre de la politique budgétaire et fiscale et de la politique monétaire et financière de l'Etat.
En matière de politique budgétaire et fiscale, il est responsable :
de l'élaboration, du suivi et du contrôle de l'exécution du budget de l'Etat en ce qui concerne le fonctionnement;
de la stabilisation des finances publiques et de l'ajustement structurel, en ce qui concerne les finances publiques;
des Impôts et des Douanes;
du contrôle financier des organismes dotés d'un budget annexe et des établissements publics autonomes suivant les règlements propres à chaque organisme ;
du suivi et du contrôle de la gestion des créances et des participations publiques, de l'endettement des personnes morales de droit public et de l'emploi des subvention;
de l'ordonnancement des soldes et pensions;
de la gestion et du contrôle du parc automobile de l'Etat
En matière de politique monétaire et financière, il assure:
la gestion de la dette publique intérieure et extérieure;
la gestion du Trésor et de la Trésorerie
la promotion de l'épargne et de son emploi pour le développement économique et dans le sens de l'équilibre financier;
le contrôle des finances extérieures, de la monnaie et de la réglementation des changes ;
le contrôle des établissements de crédit, des compagnies d'assurances des marchés financiers ;
la coopération financière;
le suivi des affaires du Fonds Monétaire International
le suivi, en ce qui concerne les questions monétaires et financières, de la Communauté économique des Etats de l'Afrique Centrale et de la Communauté Economique et Monétaire des Etats de l'Afrique Centrale.
Il est en outre responsable de la politique de l'informatique et de la téléinformatique.
Il assure la tutelle de l'institut d'Emission, des Etablissements de crédit et des compagnies d'assurances, de la Caisse Autonome d'Amortissement, de la Société de Recouvrement des Créances du Cameroun, du Centre National de Développement Informatique.
II préside le Comité Interministériel pour le programme d'Ajustement Structurel en ce qui concerne les finances publiques et le Comité Interministériel de Privatisation des Entreprises publiques. Lui est rattaché la Mission de Privatisation des Entreprises publiques.
Le Ministre des Finances et du Budget est assisté d'un Ministre délégué chargé du Budget.
19 - LE MINISTRE DE LA FONCTION PUBLIQUE ET DE LA REFORME ADMINISTRATIVE
Est chargé:
de la gestion des fonctionnaires et agents de l'Etat, exception faite des agents de la Sûreté Nationale et des Forces Armées, des Magistrats et des personnels de l'Administration Pénitentiaire;
de la préparation des mesures législatives ou réglementaires relatives au statut des agents de l'Etat;
de la coordination des actions de formation des agents de l'Etat et des fonctionnaires;
de la diligence des actions disciplinaires contre les fonctionnaires et agents de l'Etat dans les conditions déterminées par les textes réglementaires;
de toutes les études relatives à l'évolution des besoins et ressources en agents de l'Etat;
du contentieux de la Fonction Publique.
Il est le Conseil du Gouvernement en matière d'organisation et de réforme administrative. A ce titre, il étudie et propose à celui-ci toute mesure visant à améliorer le rapport coût-rendement dans les services publics et l'accélération du processus de traitement des dossiers administratifs.
Il assure la tutelle de l'Ecole Nationale d'Administration et de Magistrature et de l'Institut Supérieur de Management Public.
20 - LE MINISTRE DE LA JEUNESSE ET DES SPORTS
Est chargé:
de la définition et de la mise en œuvre de la politique de jeunesse, d'animation et de sport;
de la coordination de l'action des associations et mouvements de jeunesse;
de l'éducation populaire;
de l'organisation, de la promotion et de la vulgarisation des activités sportives;
de l'éducation physique dans tous les établissements publics et privés d'enseignement;
du contrôle des instituts et établissements d'enseignement d'éducation physique et sportive.
Il assure la tutelle de l'institut National de la Jeunesse et des Sports et des organismes relevant de son domaine de compétence.
Il est assisté d'un Secrétaire d'Etat chargé de la Jeunesse.
21- LE MINISTRE DE LA JUSTICE GARDE DES SCEAUX
Est chargé:
de la préparation des textes législatifs et réglementaires relatifs à la nationalité, aux règles concernant les conflits des lois, au statut des magistrats, à l'organisation et au fonctionnement de la Haute Cour de Justice, de la Cour Suprême, du Conseil Supérieur de la Magistrature et à l'organisation judiciaire;
de la préparation des textes législatifs et réglementaires relatifs au statut des personnes et des biens, au régime des obligations et contrats en matière civile et commerciale (législation civile et commerciale), aux règles de procédure et de compétence devant toutes les juridictions civiles, au droit pénal général et spécial, à l'organisation des professions d'avocat et d'auxiliaire de justice;
de l'instruction des dossiers de recours en grâce et de libération conditionnelle;
de la conservation et de l'apposition des sceaux de la République du Cameroun.
Il préside les commissions de réforme législative judiciaire et assure le fonctionnement des juridictions et la discipline des magistrats, greffiers et fonctionnaires relevant de son autorité. Il veille à la discipline des avocats et des auxiliaires de justice.
22 - LE MINISTRE DES MINES, DE L'EAU ET DE L'ÉNERGIE
a pour mission de veiller à la prospection et à l'exploitation rationnelle des ressources naturelles en minerais, en eau et en énergie.
Il est chargé :
de la prospection géologique et des activités minières;
de la recherche et de l'exploitation des eaux dans les villes et les campagnes ;
de la production de l'énergie et de la promotion des énergies nouvelles en liaison avec le Ministère chargé de la Recherche Scientifique;
de la conception et de l'exécution de la politique d'assainissement dans les villes de moins de 100.000 habitants, en relation avec les départements ministériels intéressés;
des carrières.
Il assure la tutelle des organismes publics et para-publics relevant de son domaine de compétence et des sociétés intervenant dans le secteur minier.
23- LE MINISTRE DES POSTES ET TELECOMMUNICATIONS
Est chargé de l'organisation des relations postales et des télécommunications à l'intérieur et à l'extérieur du Cameroun.
A ce titre :
il étudie, réalise ou fait réaliser les équipements et infrastructures correspondants;
il assure ou fait assurer la formation des personnels de son secteur.
II assure la tutelle de la Caisse d'Epargne Postale, de l'École Nationale Supérieure des Postes et Télécommunications et de la Société des Télécommunications Internationales du Cameroun.
24 - LE MINISTRE DE LA RECHERCHE SCIENTIFIQUE ET TECHNIQUE,
Est responsable de l'élaboration et de la mise en œuvre de la politique de recherche scientifique, technique et technologique.
A ce titre, il est chargé:
de l'animation, de la coordination et du contrôle des activités de recherche scientifique sur toute l'étendue du territoire, en vue de la promotion du développement économique, social et culturel;
de la valorisation, de la vulgarisation et de l'exploitation des résultats de la recherche, en liaison permanente avec tous les opérateurs des secteurs de l'économie nationale et avec les départements ministériels et organismes intéressés.
Il assure la tutelle de l'Institut de la Recherche Agronomique pour le Développement et des Instituts de Recherche.
25- LE MINISTRE DES RELATIONS EXTÉRIEURES
a pour mission d'assurer la mise en œuvre de la politique des relations extérieures arrêtée par le Président de la République.
A ce titre, il est chargé:
des relations avec les Etats étrangers, les organisations internationales et les autres membres de la communauté internationale;
de la protection des ressortissants et des intérêts camerounais à l'étranger ;
de l'élaboration et de la mise en œuvre de la politique gouvernementale en matière du tourisme;
de l'élaboration et de la réalisation des programmes gouvernementaux relatifs à la promotion du tourisme, de l'hôtellerie et des loisirs;
A ce titre, il est chargé:
de l'inventaire et de la mise en valeur des sites touristiques;
de la formation en matière touristique et hôtelière;
de la promotion du tourisme camerounais à l'échelle internationale;
Il assure la tutelle des sociétés hôtelières à capital public et des établissements de formation touristique et hôtelière.
28- LE MINISTRE DES TRANSPORTS
Est responsable du développement coordonné de tous les modes de transport.
A ce titre :
il assure ou contrôle l'organisation et le fonctionnement des transports aérien, ferroviaire, routier, maritime et fluvial;
il étudie et participe à l'élaboration et à la mise en oeuvre des mesures législatives ou réglementaires relatives aux transports, à la sécurité et à la prévention routière;
il est responsable de l'aviation civile, des navigations fluviale et maritime, des transports routier et ferroviaire et de la météorologie;
il élabore et contrôle la mise en œuvre des projets et programmes gouvernementaux en matière de transports et celle du plan sectoriel des transports;
il concourt à la formation professionnelle des personnels des transports en relation avec le Ministre de l'Enseignement technique et de la formation professionnelle ;
il suit les affaires de l'Agence pour la Sécurité de la Navigation Aérienne et toutes celles relatives à la sécurité aérienne et assure la liaison avec l'Organisation de l'Aviation Civile Internationale et l'Organisation Mondiale de la Météorologie.
Il assure la tutelle des organismes publics et parapublics relevant de son secteur.
Il est assisté d'un Secrétaire d'État.
29- LE MINISTRE DES TRAVAUX PUBLICS
Est chargé de la création, de l'entretien et de la protection du réseau routier, ainsi que de la construction des bâtiments et édifices publics.
A ce titre:
il effectue toutes études nécessaires à l'adaptation aux écosystèmes locaux de ces infrastructures en liaison avec le Ministère chargé de la Recherche Scientifique, les institutions de recherche ou d'enseignement et de tout autre organisme compétent;
il apporte son concours à la construction et à l'entretien des routes, y compris les voiries dans les villes de moins de 100.000 habitants, en liaison avec les départements ministériels et organismes compétents;
il concourt à la formation professionnelle des personnels des travaux publics en relation avec les Ministres concernés;
il contrôle l'exécution des travaux de construction des bâtiments et édifices publics conformément aux normes établies.
Il assure la tutelle de l'École Nationale Supérieure des Travaux Publics, du Parc National de Matériel de Génie Civil et du Laboratoire National de Génie Civil.
Il est assisté d'un Secrétaire d'Etat chargé des Routes.
30-LE MINISTRE DE L'URBANISME ET DE L'HABITAT
Est chargé:
de la mise en œuvre de la politique générale du Gouvernement en matière d'urbanisme et d'habitat dans les villes de moins de 100.000 habitants ;
de la politique domaniale, foncière et cadastrale du pays;
des études et recherches relatives aux matériaux et techniques de construction adaptées aux conditions des écosystèmes nationaux en liaison avec le Ministère chargé de la Recherche Scientifique
de la gestion et du contrôle des locations administratives
de la gestion du mobilier public et de l'entretien des propriétés administratives.
Il assure la tutelle de la Mission d'Aménagement et d'Équipement des Terrains Urbains et Ruraux.
Il est assisté d'un Secrétaire d'Etat chargé des Domaines et du Cadastre.
31- LE MINISTRE DE LA VILLE
dont la compétence s'étend à tous les chefs-lieux de province ainsi qu'à toutes les villes d'au moins 100.000 habitants, est responsable, dans ces villes:
de l'aménagement et de la restructuration;
de l'assainissement et du drainage;
de l'organisation harmonieuse de la vie sociale dans les quartiers; - de l'hygiène et de la salubrité publiques;
du suivi et de la coordination des opérations de collecte, d'enlèvement et de traitement des déchets, en liaison avec les collectivités territoriales décentralisées;
de l'encadrement des jeunes en difficulté et de leur insertion sociale; - des voiries urbaines;
de la prévention de la délinquance, de l'alcoolisme et de la toxicomanie en liaison avec les Ministères et organismes compétents
de l'embellissement des centres urbains, en liaison avec les départements ministériels intéressés et les collectivités territoriales décentralisées ;
du développement des transports urbains;
de l'encadrement des associations et groupements du secteur informel;
de la liaison avec les organisations internationales concernées par le développement des grandes villes.
Il assure la tutelle de la Société Immobilière du Cameroun, des Projets et des Organismes concourant à l'aménagement des villes relevant de sa compétence.
Art. 6 —  (1) Le Président de la République nomme aux emplois civils et militaires et, notamment:
le Premier Ministre, les autres Membres du Gouvernement et Assimilés
le Grand Chancelier des Ordres Nationaux;
les Conseillers Spéciaux et les Ambassadeurs Itinérants;
les Gouverneurs de Province;
les ambassadeurs et Représentants Permanents;
les Conseillers Techniques, les Chargés de Mission, les Attachés, les Directeurs et Assimilés de la Présidence de la République et des Services du Premier Ministre;
les Secrétaires Généraux des Ministères et Assimilés;
les Recteurs des Universités et leurs Adjoints;
les Inspecteurs et Contrôleurs d'Etat ;
les Directeurs et Assimilés des services rattachés à la Présidence de la République;
les Secrétaires Généraux de Province;
les Préfets, Sous-Préfets et Chefs de District;
les Présidents des Conseils d'Administration, Directeurs Généraux et Directeurs-Généraux Adjoints, Directeurs et Directeurs-Adjoints des Entreprises Publiques et Para-publiques et des Etablissements Publics, lorsque les textes organiques en disposent ainsi.
b - par arrêté présidentiel
- Les Directeurs-Adjoints et Assimilés de la Présidence de la République et des Services rattachés.
(2) Le Premier Ministre nomme:
a - par décret du Premier Ministre:
les Directeurs et Assimilés des Administrations Centrales placées sous son autorité, après approbation du Président de la République;
les Conseillers en Organisation Administrative, après approbation du Président de la République;
b - par arrêté du Premier Ministre :
les Directeurs-Adjoints et Assimilés des Services du Premier Ministre;
les Collaborateurs des Gouverneurs de Province, les Adjoints Préfectoraux et les Adjoints d'Arrondissement, après approbation du Président de la République;
les Chefs traditionnels du Premier Degré, après approbation du Président de la République.
(3) Les Ministres compétents nomment par arrêté, après visa du Premier Ministre, les Directeurs-Adjoints, les Sous-Directeurs et Assimilés, les Délégués Provinciaux, les Chefs de. Services Centraux et Provinciaux, les Conseillers Assistants en Organisation Administrative, les Chefs de Services Adjoints et les chefs de Bureau, sauf si le décret portant organisation du Département Ministériel en dispose autrement.
(4) L'approbation du Président de la République, prévue par le présent article, est expresse et revêt la forme d'un visa.
Art. 7 —  (1) Dans l'exercice de leurs fonctions, les Ministres disposent d'un Secrétariat Général dirigé par un Secrétaire Général, d'un Secrétariat Particulier, d'une administration centrale et, le cas échéant, des services extérieurs.
(2) Les Secrétaires d'État et Assimilés peuvent éventuellement disposer d'un Secrétariat Particulier.
Art. 8 —  (1) Les administrations centrales des ministères comprennent un Secrétariat Général et des services.
(2) Le Secrétariat Général est placé sous l'autorité d'un Secrétaire Général, principal collaborateur du Ministre, qui suit l'instruction des affaires du Département et reçoit du Ministre les délégations de signature nécessaires.
Il coordonne l'action des services centraux et extérieurs du Département Ministériel et tient à cet effet des réunions de coordination dont il adresse le procès-verbal au Ministre.
En cas d'absence ou d'empêchement du Secrétaire Général, le Ministre désigne un Directeur Pour assurer l'intérim.
(3) Le Secrétaire Général définit et codifie les procédures internes au Ministère.
(4) Le secrétaire Général veille à la formation permanente du personnel et organise, sous l'autorité du Ministre, des séminaires et des stages de recyclage, de perfectionnement ou de spécialisation.
Il veille à la célérité dans le traitement des dossiers, centralise les archives et gère la documentation du Ministère.
(5) Les Inspecteurs Généraux, les Inspecteurs et les Conseillers Techniques sont directement rattachés au Ministre.
Lorsque l'Inspection Générale comprend deux ou plusieurs Inspecteurs Généraux, la coordination est assurée par l'Inspecteur Général le plus ancien dans le grade le plus élevé.
(6) Les Services de Traduction institués dans les Ministères s'occupent de la traduction courante. La traduction officielle est réservée à la Direction des Services Linguistiques de la Présidence de la République.
(7) Les services de communication institués dans les Ministères sont placés sous l'autorité du Secrétaire Général et ont pour tâche d'assurer l'information permanente du public sur les activités du Ministère en relation avec le Ministère de la Communication.
Art. 9 —  Sont abrogées toutes dispositions antérieures au présent décret.
Art. 10 —  Le présent décret sera enregistré, publié selon la procédure d'urgence, puis inséré au Journal Officiel en français et en anglais./-",DECRET_N_2002_216_DU_24_AOUT_2002_PORTANT_REORGANISATION_DU_GOUVERNEMENT,0,
