URL,text,page_title
https://www.juriafrica.com/lex/decret-2013-377-11-oct-2013-18151.htm,"LE PRESIDENT DE LA REPUBLIQUE,
Vu la Constitution ;
Vu la loi n° 2012/014 du 21 décembre 2012 portant loi de finances de la République du Cameroun pour l'exercice 2013 ;
Vu le décret n° 2011/408 du 9 décembre 2011 portant organisation du Gouvernement,
DECRETE :
Art. 1er —  Le Ministre de l'Economie, de la Planification et de l'Aménagement du Territoire est habilité, avec faculté de délégation, à signer avec le Fonds Africain de Développement (FAD), un Accord de prêt d'un montant de 0,25 millions d'unités de compte, soit environ 191 millions de francs CFA, pour le financement partiel du Programme de Conservation de la Biodiversité en Afrique Centrale Sauvegarde des Eléphants d'Afrique Centrale.
Art. 2 —  Le présent décret sera enregistré, publié suivant la procédure d'urgence, puis inséré au Journal Officiel en français et en anglais./¬","DECRET_N°_2013_377_DU_11_OCTOBRE_2013_HABILITANT_LE_MINISTRE_DE_L'ECONOMIE,_DE_LA_PLANIFICATION_ET_DE_L'AMENAGEMENT_DU_TERRITOIRE_À_SIGNER_AVEC_LE_FONDS_AFRICAIN_DE_DEVELOPPEMENT_(FAD),_UN_ACCORD_DE"
