URL,text,page_title,page_label,metadata
https://www.juriafrica.com/lex/decret-2009-223-30-juin-2009-25961.htm,"LE PRESIDENT DE LA REPUBLIQUE,
VU la Constitution ;
VU le décret n° 2004/320 du 08 décembre 2004 portant organisation du Gouvernement, modifié et complété par le décret n° 2007/268 du 07 septembre 2007 ;
VU le décret n° 2009/222 du 30 juin 2009 portant nomination d'un Premier Ministre, Chef du Gouvernement ;
VU le décret n° 2004/322 du 08 décembre 2004 portant formation du Gouvernement ;
VU le décret n° 2006/308 du 22 septembre 2006 portant réaménagement du Gouvernement ;
VU le décret n° 2007/269 du 07 septembre 2007 portant réaménagement du Gouvernement ;
SUR proposition du Premier Ministre, Chef du Gouvernement,
DECRETE
Art. 1er —  Sont, à compter de la date de signature du présent décret, nommés aux postes ministériels ci-après :
Ministre d'Etat, Ministre des Transports :
M. BELLO BOUBA MAIGARI
Ministre délégué à la Présidence de la République chargé de la défense :
M. MEBE NGO'O Edgard Alain
Ministre des Postes et Télécommunications :
M. BIYITI BI ESSAM Jean Pierre
Ministre des Domaines et des Affaires Foncières :
M. BALEOKEN Jean-Baptiste
Ministre de la Communication :
M. ISSA TCHIROMA BAKARY
Ministre de la Promotion de la Femme et de la Famille :
Mme ABENA ONDOA née OBAMA Marie Thérèse
Ministre de l'Education de Base :
Mme YOUSSOUF née ADIDJA ALIM
Ministre de l'Eau et de l'Energie :
M. NGAKO TOMDIO Michel
Ministre des Sports et de l'Education Physique :
M. ZOAH Michel
Ministre délégué auprès du Ministre de l'Agriculture et du Développement Rural :
Mme ANANGA MESSINA née BEYENE Clémentine Antoinette
Secrétaire d'Etat auprès du Ministre des Enseignements Secondaires :
M. MOUNOUNA FOUTSOU
Le reste sans changement.
Art. 2 —  Le présent décret sera enregistré, publié suivant la procédure d'urgence, puis inséré au Journal Officiel en français et en anglais./-",DECRET_N_2009_223_DU_30_JUIN_2009_PORTANT_REAMENAGEMENT_DU_GOUVERNEMENT,0,
