URL,text,page_title,page_label,category,metadata
https://www.juriafrica.com/lex/decret-2017-11323-pm-14-novembre-2017-48249.htm,"DECRET N°2017/11323/PM DU 14 NOVEMBRE 2017 PORTANT CLASSEMENT, EN COMPENSATION, AU DOMAINE DU PARC NATIONAL DE LA BÉNOUÉ, D'UNE PARCELLE DE TERRAIN DE 04 HA 62 A 26 CA SISE AU VILLAGE MAYO-SALAH, À LA PÉRIPHÉRIE DE LA ZONE D'INTÉRÊT CYNÉGÉTIQUE N°7, DÉNOMMÉE « CAMPEMENT DES ELÉPHANTS », ARRONDISSEMENT DE TCHOLLIRÉ, DÉPARTEMENT DU MAYO-REY, RÉGION DU NORD.-

LE PREMIER MINISTRE, CHEF DU GOUVERNEMENT,
Vu la Constitution ;
Vu la loi n°94/01 du 20 janvier 1994 portant régime des forêts, de la faune et de la pêche, ensemble ses modificatifs subséquents ;
Vu le décret n°92/089 du 04 mai 1992 précisant les attributions du Premier Ministre, modifié et complété par le décret n° 95/145 bis du 04 août 1995 ;
Vu le décret n°2011/408 du 09 décembre 2011 portant organisation du Gouvernement ;
Vu le décret n°2011/409 du 09 décembre 2011 portant nomination d'un Premier Ministre, chef du Gouvernement ;
Vu le décret n°95/466/PM du 20 juillet 1995 fixant les modalités d'application du régime de la faune ;
Vu le dossier technique y afférent,
DECRETE:
Art. 1er —  .- Est, à compter de la date de signature du présent décret, classée au domaine du Parc National de la Bénoué, la parcelle de terrain d'une superficie de 04 ha 62 a 26 ca sise au village Mayo-Salah, à la périphérie de la zone d'Intérêt Cynégétique n° 7, dénommée « Campement des Eléphants », Arrondissement de Tcholliré, Département du Mayo-Rey, Région du Nord.
Art. 2 —  La parcelle de terrain concernée, qui est située sur la rive gauche de la rivière Mayo-Salah, à une distance de 140 mètres en aval de l'ancien pont, est délimitée par les points BI, B2, B3, B4, B5, B6, B7, B8 et B9, ainsi qu'il suit :
A L'OUEST :
Du point de base B3 (UTM 33 ; N 940 756 m : 351 807 m) situé à la lisière des cultures derrière le village Mayo-Salah, suivre l'azimut 64 degrés sur une distance de 139,617 mètres pour atteindre le point B4 (N 940 814 m : 351 934 m) ;
Du point B4, suivre l'azimut 5 degrés sur une distance de 45,100 mètres pour atteindre le point B5 (N 940 859 m : 351 937 m) ;
Du point B5, suivre l'azimut 350 degrés sur une distance de 48,662 mètres pour atteindre le point B6 (N 940 907 m : 351 929 m) ;
Du point B6, suivre l'azimut 345 degrés sur une distance de 59,203 mètres pour atteindre le point B7 (N 940 964 m : 351 913 m) ;
Du point B7, suivre l'azimut 7 degrés sur une distance de 56,321 mètres pour atteindre le point B8 (N 941 020 m ; 351 919 m).
AU NORD :
Du point B8, suivre l'azimut 90 degrés sur une distance de 66 mètres pour atteindre le point B9 (N 941 019 m : 351 985 m) ;
Du point B9, suivre l'azimut 81 degrés sur une distance de 85, 843 mètres pour atteindre le point B1 (N 941 031 m : 352 070 m).
A L'EST :
- Du point BI, remonter le cours de la rivière Mayo-Salah sur environ 436 mètres pour atteindre le point B2 (N 940 609 m : 351 962 m) situé en bordure de ladite rivière.
AU SUD :
- Du point B2, suivre l'azimut 313 degrés sur une distance de 213, 816 mètres pour atteindre le B3 de base.
Art. 3 —  Le présent décret sera enregistré, puis publié au Journal Officiel en français et en anglais. /-",DECRET_N_2017_11323_PM_DU_14_NOVEMBRE_2017_PORTANT_CLASSEMENT_EN_COMPENSATION_AU_DOMAINE_DU_PARC_NATIONAL_DE_LA_BENOUE_D_UNE_PARCELLE_DE_TERRAIN_DE_04_HA_62_A_26_CA_SISE_AU_VILLAGE_MAYO_SALAH_A_LA_PERIPHERIE_DE_LA_ZONE_D_INTERET_CYNEGETIQUE_N_7_DENOMMEE_CAMPEMENT_DES_ELEPHANTS_ARRONDISSEMENT_DE_TCHOLLIRE_DEPARTEMENT_DU_MAYO_REY_REGION_DU_NORD,0,decret,
