URL,text,page_title
https://www.juriafrica.com/lex/decret-2006-377-31-oct-2006-17017.htm,"LE PRESIDENT DE LA REPUBLIQUE,
Vu la Constitution;
Vu le Décret n°79/488 du 5 novembre 1979 portant réglementation des fonctions et fixant le statut des huissiers, modifié et complété par les décrets n°s 85/238 du 22 février 1985 et 98/170 du 27 août 1998 ;
Vu le décret n°98/018 du 25 février 1998 portant création de charges d'Huissier de Justice ;
Vu les dossiers constitués par les intéressés
DECRETE:
Art. 1 —  Sont, pour compter de la date de signature du présent décret, nommés huissiers de justice dans le ressort de la Cour d'Appel de l'Adamaoua :
Monsieur NJANKOUO ABOUBAKAR à la 5ème charge du Tribunal de Première Instance de MEIGANGA
Monsieur FOSSO Michel à la lère charge du Tribunal de Première Instance de BANYO
Monsieur NKANA NGUE Théodore Gilbert à la 5ème charge du Tribunal de Première Instance de BANYO.
Art. 2 —  Avant leur entrée en fonction les intéressés devront justifier de la souscription de la police d'assurance, du versement du cautionnement, d'une installation décente et prêter le serment prévu par la réglementation en vigueur,
Art. 3 —  Le Vice-Premier Ministre, Ministre de la Justice, Garde des Sceaux, est chargé de l'exécution du présent décret qui sera enregistré, puis publié au Journal Officiel, en anglais et en français.",DECRET_N°_2006_377_DU_31_OCTOBRE_2006_PORTANT_NOMINATION_DES_HUISSIERS_DE_JUSTICE_DANS_LE_RESSORT_DE_LA_COUR_D_APPEL_DE_L_ADAMAOUA.
