URL,text,page_title,page_label,metadata
https://www.juriafrica.com/lex/decret-2020-322-22-juin-2020-49018.htm,"LE PRESIDENT DE LA REPUBLIQUE,
Vu la Constitution ;
Vu la loi n°2019/023 du 24 décembre 2019 portant loi de finances de la République du Cameroun pour l'exercice 2020 ;
Vu le décret n°2011/408 du 09 décembre 2011 portant organisation du Gouvernement, modifié et complété par le décret n°2018/190 du 02 mars 2018 ;
Vu le décret n°2020/131 du 18 mars 2020 habilitant le Ministre de l'Economie, de la Planification et de l'Aménagement du Territoire à signer avec la Banque Africaine de Développement (BAD), un Accord de Prêt d'un montant de 84 millions d'euros, soit environ 55 100 388 000 de francs CFA, pour le financement du Projet de Développement des Chaînes de Valeurs de l'Elevage et de la Pisciculture,
DECRETE:
Art. 1er —  Est ratifié, l'Accord de Prêt n°2000200003001 d'un montant de 84 000 000 d'euros, soit environ 55 100 388 000 de francs CFA, conclu le 03 avril 2020 entre la République du Cameroun et la Banque Africaine de Développement (BAD), pour le financement partiel du Projet de Développement des Chaînes de Valeurs de l'Elevage et de la Pisciculture.
Art. 2 —  Le présent décret sera enregistré, publié suivant la procédure d'urgence, puis inséré au Journal Officiel en français et en anglais. /-",DECRET_N_2020_322_DU_22_JUIN_2020_RATIFIANT_L_ACCORD_DE_PRET_N_2000200003001_D_UN_MONTANT_DE_84_000_000_D_EUROS_SOIT_ENVIRON_55_100_388_000_DE_FRANCS_CFA_POUR_LE_FINANCEMENT_PARTIEL_DU_PROJET_DE_DEVELOPPEMENT_DES_CHAINES_DE_VALEURS_DE_L_ELEVAGE_ET_DE_LA_PISCICULTURE,0,
