URL,text,page_title,page_label,category,metadata
https://www.juriafrica.com/lex/decret-2003-158-24-juin-2003-16065.htm,"DECRET N° 2003/158 DU 24 JUIN 2003 HABILITANT LE MINISTRE DES AFFAIRES ECONOMIQUES, DE LA PROGRAMMATION ET DE L'AMÉNAGEMENT DU TERRITOIRE À SIGNER AVEC LE FONDS INTERNATIONAL DE DÉVELOPPEMENT AGRICOLE (FIDA), UN ACCORD DE PRÊT D'UN MONTANT 9,6 MILLIONS DE DROITS DE TIRAGES SPÉCIAUX (DTS), SOIT 13,1 MILLIONS DE DOLLARS AMÉRICAINS, POUR LE FINANCEMENT PARTIEL DU PROGRAMME NATIONAL DE DÉVELOPPEMENT DES RACINES ET TUBERCULES AU CAMEROUN.

LE PRESIDENT DE LA REPUBLIQUE,
Vu la Constitution
Vu le décret n° 2002/216 du 24 août 2002 portant réorganisation du Gouvernement;
Vu le décret n° 2002/217 du 24 août 2002 portant réaménagement du Gouvernement;
DECRETE:
Art. 1er —  Le Ministre des Affaires Economiques, de la Programmation et de l'Aménagement du Territoire est habilité, avec faculté de délégation, à signer avec le Fonds International de Développement Agricole (FIDA), un accord de prêt d'un montant de 9,6 millions de Droits de Tirages Spéciaux (DTS), (13,1 millions de dollars américains), soit environ 9,17 milliards de FCFA, destiné au financement partiel du programme national de développement des racines et tubercules au Cameroun.
Art. 2 —  Le présent décret sera enregistré et publié suivant la procédure d'urgence, puis inséré au Journal Officiel en français et en anglais.",DECRET_N_2003_158_DU_24_JUIN_2003_HABILITANT_LE_MINISTRE_DES_AFFAIRES_ECONOMIQUES_DE_LA_PROGRAMMATION_ET_DE_L_AMENAGEMENT_DU_TERRITOIRE_A_SIGNER_AVEC_LE_FONDS_INTERNATIONAL_DE_DEVELOPPEMENT_AGRICOLE_FIDA_UN_ACCORD_DE_PRET_D_UN_MONTANT_9_6_MILLIONS_DE_DROITS_DE_TIRAGES_SPECIAUX_DTS_SOIT_13_1_MILLIONS_DE_DOLLARS_AMERICAINS_POUR_LE_FINANCEMENT_PARTIEL_DU_PROGRAMME_NATIONAL_DE_DEVELOPPEMENT_DES_RACINES_ET_TUBERCULES_AU_CAMEROUN,0,decret,
