URL,text,page_title,page_label,category,metadata
https://www.juriafrica.com/lex/decret-2005-283-29-juillet-2005-48216.htm,"DÉCRET N° 2005/283 DU 29 JUILLET 2005 HABILITANT LE MINISTRE DE L'ECONOMIE ET DES FINANCES À SIGNER AVEC LE ROYAUME DE BELGIQUE

un Accord de prêt d'un montant de 4.320.000 Euros, soit environ 2.833.920.000 francs CFA, pour le financement du projet de construction d'un nouveau pont sur le fleuve Moungo
Le Président de la République,
Vu la Constitution ;
Vu la loi N° 2004/026 du 30 décembre 2004 portant loi de finances de la République du Cameroun pour l'exercice 2005 ;
Vu le décret N° 2004/320 du 08 décembre 2004 portant organisation du gouvernement ;
Vu le décret N° 2004/322 du 08 décembre 2004 portant formation du gouvernement,
Décrète :
Art. 1er —  Le ministre de l'Economie et des Finances est habilité, avec faculté de délégation, à signer avec le Royaume de Belgique un Accord de prêt .d'un montant de 4.320.000 Euros, soit environ 2.833.920.000 francs CFA, pour le financement du projet de construction d'un nouveau pont sur le fleuve Moungo.
Art. 2 —  Le présent décret sera enregistré et publié suivant la procédure d'urgence, puis inséré au journal officiel en français et en anglais.",DECRET_N_2005_283_DU_29_JUILLET_2005_HABILITANT_LE_MINISTRE_DE_L_ECONOMIE_ET_DES_FINANCES_A_SIGNER_AVEC_LE_ROYAUME_DE_BELGIQUE,0,decret,
