URL,text,page_title
https://www.juriafrica.com/lex/decret-2023-334-04-aout-2023-56058.htm,"LE PRESIDENT DE LA REPUBLIQUE,
Vu la Constitution ;
Vu la loi n°2022/020 du 27 décembre 2022 portant loi de finances de la République du Cameroun pour l'exercice 2023 ;
Vu le décret n°2011/408 du 09 décembre 2011 portant organisation du Gouvernement, modifié et complété par le décret n°2018/190 du 02 mars 2018 ;
DECRETE:
Art. 1er  —  __ Le Ministre de l'Economie, de la Planification et de l'Aménagement du Territoire est habilite, avec faculté de délégation, à signer, avec la Banque Islamique de Développement (BID), un Accord de financement de Vente a Tempérament d'un montant de 64,450 millions d'euros, soit environ 42 220 000 000 de francs CFA, pour le financement partiel du Projet de Développement de la Chaine de Valeur du riz au Cameroun.
Art. 2 —  Le présent décret sera enregistré, publié suivant la procédure d'urgence, puis inséré au Journal Officiel en français et en anglais. /-
Yaoundé, le 04 Août 2023
LE PRESIDENT DE LA REPUBLIQUE,
PAUL BIYA","DECRET_N°2023-334_DU_04_AOÛT_2023_HABILITANT_LE_MINISTRE_DE_L'ECONOMIE,_DE_LA_PLANIFICATION_ET_DE_L'AMENAGEMENT_DU_TERRITOIRE,_À_SIGNER_AVEC_LA_BANQUE_LSLAMIQUE_DE_DEVELOPPEMENT_(BID),_UN_ACCORD_DE"
