URL,text,page_title,page_label,metadata
https://www.juriafrica.com/lex/decret-2020-188-14-avril-2020-49134.htm,"LE PRESIDENT DE LA REPUBLIQUE,
Vu la Constitution ;
Vu la loi n°2019/023 du 24 décembre 2019 portant loi de finances de la République du Cameroun pour l'exercice 2020 ;
Vu le décret n°2011/408 du 09 décembre 2011 portant organisation du Gouvernement, modifié et complété par le décret n°2018/190 du 02 mars 2018,
Vu le décret n°2019/540 du 11 octobre 2019, habilitant le Ministre de l'Economie, de la Planification et de l'Aménagement du Territoire, à signer avec la Banque Africaine de Développement (BAD), un Accord de Prêt d'un montant de 17,96 millions d'euros, soit environ 12 milliards de francs CFA, pour le financement partiel du projet d'aménagement de la Route Nationale N°11, la « Ring Road »,
DECRETE:
Art. 1er —  Est ratifié, l'Accord de Prêt d'un montant de 17,96 millions d'euros, soit environ 12 milliards de francs CFA, conclu le 28 octobre 2019 avec la Banque Africaine de Développement (BAD), pour le financement du Programme d'Appui au Secteur des Transports, Phase III : Aménagement de la Route Nationale n°11, la « Ring Road ».
Art. 2 —  Le présent décret sera enregistré, publié suivant la procédure d'urgence, puis inséré au Journal Officiel en français et en anglais./-",DECRET_N_2020_188_DU_14_AVRIL_2020_PORTANT_RATIFICATION_DE_L_ACCORD_DE_PRET_D_UN_MONTANT_DE_17_96_MILLIONS_D_EUROS_SOIT_ENVIRON_12_MILLIARDS_DE_FRANCS_CFA_SIGNE_LE_28_OCTOBRE_2019_AVEC_LA_BANQUE_AFRICAINE_DE_DEVELOPPEMENT_BAD_POUR_LE_FINANCEMENT_DU_PROGRAMME_D_APPUI_AU_SECTEUR_DES_TRANSPORTS_PHASE_III_AMENAGEMENT_DE_LA_ROUTE_NATIONALE_N_11_LA_RING_ROAD,0,
