URL,text,page_title,page_label,category,metadata
https://www.juriafrica.com/lex/decret-2000-071-28-mars-2000-16910.htm,"DECRET N° 2000/071 DU 28 MARS 2000 HABILITANT LE MINISTRE DES INVESTISSEMENTS PUBLICS ET DE L'AMÉNAGEMENT DU TERRITOIRE À SIGNER AVEC L'ASSOCIATION INTERNATIONALE DE DÉVELOPPEMENT (IDA) UN ACCORD DE CRÉDIT D'UN MONTANT DE 4 300 000 DTS POUR LE FINANCEMENT DU PROJET DE RENFORCEMENT DES CAPACITÉS DE GESTION ENVIRONNEMENTALE DANS LE SECTEUR PÉTROLIER AU CAMEROUN.

LE PRESIDENT DE LA REPUBLIQUE,
VU la Constitution ;
VU la loi n°99/007 du 30 juin 1999 portant loi de Finances de la République du Cameroun pour l'exercice 1999-2000;
VU le décret n°97/205 du 7 décembre 1997 portant organisation du Gouvernement, modifié et complété par le décret n°98/067 du 28 avril 1998;
VU le décret n°97/207 du 07 décembre 1997 portant formation du Gouvernement, modifié et complété par le décret n°99/199 du 1er Septembre 1999 et le décret n°2000/051 du 18 mars 2000 ;
DECRETE:
Art. 1er —  Le Ministre des Investissements Publics et de l'Aménagement du Territoire est habilité, avec faculté de délégation, à signer avec l'Association Internationale de Développement (IDA), un accord de crédit d'un montant de 4 300 000 DTS correspondant à 5 700 000 $ US, soit environ 3 420 000 000 de FCFA, pour le financement du Projet de Renforcement des Capacités dans le Secteur Pétrolier au Cameroun.
Art. 2 —  Le présent décret sera enregistré, publié suivant la procédure d'urgence, puis inséré au Journal Officiel en français et en anglais.",DECRET_N_2000_071_DU_28_MARS_2000_HABILITANT_LE_MINISTRE_DES_INVESTISSEMENTS_PUBLICS_ET_DE_L_AMENAGEMENT_DU_TERRITOIRE_A_SIGNER_AVEC_L_ASSOCIATION_INTERNATIONALE_DE_DEVELOPPEMENT_IDA_UN_ACCORD_DE_CREDIT_D_UN_MONTANT_DE_4_300_000_DTS_POUR_LE_FINANCEMENT_DU_PROJET_DE_RENFORCEMENT_DES_CAPACITES_DE_GESTION_ENVIRONNEMENTALE_DANS_LE_SECTEUR_PETROLIER_AU_CAMEROUN,0,decret,
