URL,text,page_title
https://www.juriafrica.com/lex/decret-2018-087-02-fevrier-2018-49234.htm,"LE PRESIDENT DE LA REPUBLIQUE,
VU la Constitution ;
VU la loi n°2017/021 du 20 décembre 2017 portant loi de finances de la République du Cameroun pour l'exercice 2018 ;
VU le décret n°2011/408 du 9 décembre 2011 portant organisation du Gouvernement,
DECRETE :
Art. 1er —  Le Ministre de l'Economie, de la Planification et de l'Aménagement du Territoire est habilité, avec faculté de délégation, à signer avec l'Association Internationale de Développement (IDA), un Accord de prêt d'un montant de 19,9 millions de droits de tirage spéciaux (DTS), soit environ 16,6 milliards de francs CFA, pour le financement additionnel du Projet de Renforcement des Capacités du Secteur Minier (PRECASEM).
Art. 2 —  Le présent décret sera enregistré, publié suivant la procédure d'urgence, puis inséré au Journal Officiel en français et en anglais./-","DECRET_N°2018_087_DU_02_FEVRIER_2018_HABILITANT_LE_MINISTRE_DE_L'ECONOMIE,_DE_LA_PLANIFICATION_ET_DE_L'AMENAGEMENT_DU_TERRITOIRE_À_SIGNER_AVEC_L'ASSOCIATION_INTERNATIONALE_DE_DEVELOPPEMENT_(IDA),_UN"
