URL,text,page_title
https://www.juriafrica.com/lex/decret-98-009-pm-23-janv-1998-15894.htm,"LE PREMIER MINISTRE, CHEF DU GOUVERNEMENT
VU la Constitution ;
VU l'ordonnance n° 62/OF/4 du 7 février 1962 réglant le mode de présentation, les conditions d'exécution du budget de l'Etat, de ses recettes, de ses dépenses et de toutes les opérations s'y rattachant ;
VU la loi n° 94/01 du 20 janvier 1994 portant régime des forêts, de la faune et de la pêche;
VU la loi n° 97/014 du 17 juillet 1997 portant loi de Finances de la République du Cameroun pour l'exercice 1997/1998, notamment en son article douzième ;
VU le décret n° 97/205 du 07 décembre 1997 portant organisation du Gouvernement ;
VU le décret n° 97/206 du 07 décembre 1997 portant nomination d'un Premier Ministre, Chef du Gouvernement ;
D E C R E TE
CHAPITRE I
DES DISPOSITIONS GENERALES
Art. 1er —  Le présent décret fixe l'assiette et les modalités de recouvrement des droits, redevances, taxes et prix de vente relatifs à l'activité forestière.
Art. 2 —  (1) L'assiette et le recouvrement de la redevance forestière, de la taxe d'abattage, de la taxe de transfert et du prix de vente des produits” forestiers sont assurés par la Direction des Impôts.
(2) L'assiette du prélèvement à l'exportation des grumes et des bois débités est assurée par la Direction des Douanes. Le_ recouvrement dudit prélèvement est assuré par les services compétents de la Direction du Trésor.
CHAPITRE II
DE L'ASSIETTE ET DU RECOUVREMENT
Art. 3 —  Pour chacun des droits, le fait générateur est constitué par :
la détention d'une concession, d'une vente de coupe et/ou, le cas échéant, d'une licence, en ce qui concerne la redevance forestière ;
l'abattage d'un arbre, en ce qui concerne la taxe d'abattage et le prix de vente ;
la cession de concession, en ce qui concerne la taxe de transfert ;
la détention d'un permis d'exploitation, d'une autorisation de coupe ou de vente de produits forestiers en ce qui concerne le prix de vente des produits forestiers
Art. 4 —  Les droits sont liquidés ainsi qu'il suit :
- en ce qui concerne la redevance forestière, la taxe de transfert et le prix de vente des produits forestiers par la Direction des Impôts et après notification du titre d'exploitation par l'Administration des forêts dont la Direction des Impôts reçoit ampliation.
A cet effet, il est tenu à la Direction des Forêts un registre spécial de notification des titres d'exploitation forestière, coté et paraphé par la Direction des Impôts :
en ce qui concerne la taxe d'abattage, par la Direction des Impôts au vu des DF 10 et des déclarations mensuelles de production ;
en ce qui concerne les prélèvements à l'exportation, par la Direction des Douanes. Article 5.- (1) Les déclarations visées à l'article 4 ci-dessus doivent mentionner :
les noms, prénom ou raison sociale ;
l'adresse de l'exploitant ;
le numéro d'immatriculation du contribuable ;
la période d'imposition ;
le numéro de la vente de coupe, du permis de coupe, de la concession et/ou, le cas échéant, de la licence, du permis d'exploitation, de l'autorisation personnelle de coupe ainsi que 14 zone et le lieu d'exploitation ;
la superficie exploitée ainsi que la superficie du titre d'exploitation ;
les résultats de l'inventaire d'exploitation approuvés par l'Administration chargée des forêts ;
le numéro de l'assiette de coupe dans le cas d'une concession ou, éventuellement, d'une licence ;
le volume des essences abattues par essence et par titre d'exploitation ;
le volume des essences vendues localement par essence avec indication des nom et adresse et du numéro de contribuable des acheteurs ;
le volume des essences exportées par essence et titre d'exploitation en conformité avec les bulletins de spécification établis par l'Administration des Forêts ;
le volume des essences achetées par essence avec indication des nom et adresse du fournisseur et des références, le cas échéant, de son titre d'exploitation ;
le volume des essences transformées localement par essence et titre d'exploitation ; la nature et le montant des taxes dues ;
(2) Ces déclarations doivent être certifiées, datées et signées par le redevable ou son mandataire. Elles doivent être accompagnées des photocopies des DF 10 correspondants et des lettres de voiture.
Art. 6 —  Les déclarations visées à l'article 5 ci-dessus sont établies en deux exemplaires au profit respectivement des Directions des Impôts et des Forêts dans les dix (10) jours suivant le mois d'activité.:
Art. 7 —  En vue de la liquidation de la taxe d'abattage et du prix de vente, l'exploitant doit fournir à la Direction des Impôts et à la Direction des Forêts le pian d'opérations et les résultats de recollement. Les déclarations visées à l'article 5 doivent avoir un lien avec le plan d'opérations communiqué aux Administrations concernées.
Art. 8 —  (1) La taxe d'abattage et le prix de vente sont liquidés mensuellement par les services compétents de la Direction des Impôts sur base des déclarations mensuelles de production souscrites par les redevables visés à l'article 5 ci-dessus.
(2) La taxe d'abattage et le prix de vente sont acquittés par le redevable au plus tard le 10 du mois qui suit le mois d'activité.
(3) Pour les ventes de coupe, les concessions, les licences ou tout autre titre exploité par tiers interposé le concessionnaire est solidairement responsable du paiement de la taxe d'abattage ou du prix de vente dû par le détenteur du titre d'exploitation.
(4) La taxe d'abattage ou le prix de vente est retenu à la source par toute personne physique ou morale lors du règlement par celle-ci des factures d'achat local du bois en grumes provenant d'une vente de coupe ou de tout autre titre d'exploitation, sur la base de la lettre de voiture remplie par le vendeur qui reste tenu responsable de l'exactitude des informations portées sur ladite lettre.
Dans ce cas, les volumes indiquées sur la lettre de voiture sont d'office majorés de 20 %.
Art. 9 —  (1) La redevance forestière est assise sur la superficie du titre d'exploitation forestière.
(2) Les taux plancher de la redevance forestière s'appliquent aux titres d'exploitation forestière attribués de gré à gré.
(3) Pour les licences et les concessions, la redevance forestière est acquittée par le redevable en trois versements égaux aux dates limites ci-après :
premier versement : le 30 septembre ;
deuxième versement : le 31 décembre ;
troisième versement : le 31 mars.
(5) Pour les titres d'exploitation octroyés après le 31 décembre, la redevance est liquidée au prorata temporis et acquittée dans les quarante cinq (45) jours qui suivent leur notification.
(6) Pour les ventes de coupe, les concessions et les licences exploitées par tiers interposé, le concessionnaire est solidairement responsable du paiement de la redevance forestière due par le détenteur du titre d'exploitation en cause.
Art. 10 —  (1) Pour la liquidation de la redevance forestière, il est émis trois (03) bulletins de liquidation destinés l'un au paiement de la part due à l'Etat, l'autre au paiement de la part due aux communes et le troisième pour la fart due aux communautés villageoises riveraines.
(2) Les titres de paiement de la part de la redevance forestière due aux communes sont émis au nom de chaque Receveur Municipal compétent.
(3) Lorsqu'une commune ne dispose pas de recette municipale autonome, le Receveur des Impôts ouvre un compte de passage destiné à recevoir les payements dus à cette commune.
(4) La part de la redevance due aux communautés villageoises riveraines est inscrite dans un compte d'attente dans les livres du Receveur des Impôts. Un arrêté conjoint des Ministres chargés du Trésor et de l'administration territoriale fixe les modalités d'emploi des sommes correspondantes.
CHAPITRE III
DE LA SURTAXE PROGRESSIVE
Art. 11 —  Conformément à la loi n° 94/01 du 20 janvier 1994 portant régime des forêts, de la faune et de la pêche, le minimum de transformation directe ou indirecte du volume des bois en grumes issues des titres d'exploitation d'un même exploitant est de 70 %.
Art. 12 —  Le non respect des dispositions de l'alinéa (1) ci-dessus expose le titulaire de la vente de coupe, de la concession ou de la licence en cours de validité à_ l'application de la surtaxe progressive.
Art. 13 —  Pour les ventes de coupe, les concessions, les licences exploitées par tiers interposé, le concessionnaire est solidairement responsable du payement de la surtaxe progressive due par le détenteur du titre d'exploitation.
Art. 14 —  (1) Le contrôle de l'obligation de transformation des bois en grumes est effectué par la Direction des Forêts en relation avec la Direction des Impôts.
(2) La surtaxe progressive est recouvrée par la Direction des Impôts après notification par l'Administration des Forêts.
(3) Le produit de la surtaxe progressive est réparti de la manière suivante :
40 % au Fonds de Développement des Forêts ;
35 % au Trésor Public ;
12,5 % au personnel intervenant de la Direction des Forêts ;
12,5 % au personnel intervenant de la Direction des Impôts.
CHAPITRE IV
DES DISPOSITIONS DIVERSES ET FINALES
Art. 15 —  (1) Sous réserve des dispositions de la loi n° 94/01 du 20 janvier 1994 portant régime des forêts, de la faune, de la pêche, les sanctions prévues par la législation fiscale et douanière en vigueur s'appliquent mutatis mutandis en matière d'assiette et de recouvrement des redevances et taxes forestières.
(2) Les administrations d'assiette et de recouvrement jouissent pour le recouvrement forcé des redevances et taxes forestières, des prérogatives qui leur sont reconnues par la législation fiscale et douanière pour le recouvrement des impôts directs, de la taxe sur le chiffre d'affaire, des droits et taxes de douane.
(3) Nonobstant ce qui précède, des contrôles mixtes regroupant les personnels des services d'assiette et ceux de la Direction des Forêts sont organisés en tant que de besoin pour s'assurer de la sincérité des déclarations des redevables.
(4) La Direction des Forêts concourt à la détermination de l'assiette et au recouvrement des redevances, droits et taxes visés à l'article 2 (1) ci-dessus en communiquant à la Direction des Impôts toutes les informations utiles à la maîtrise de ces deux opérations ainsi que tous les actes de gestion à incidence fiscale.
Art. 16 —  Le présent décret abroge les dispositions du décret n°96/642/PM du 17 Septembre 1996 fixant l'assiette et les modalités de recouvrement des droits, redevances et taxes relatifs à l'activité forestière et toutes autres dispositions antérieures contraires.
Art. 17 —  Le Ministre d'Etat chargé de l'Economie et des Finances et le Ministre de l'Environnement et des Forêts sont, chacun en ce qui le concerne, responsables de l'application des dispositions du présent décret qui sera enregistré, publié suivant la procédure d'urgence, puis inséré au Journal Officiel en français et en anglais.","DECRET_N°98_009_PM_DU_23_JANVIER_1998_FIXANT_L_ASSIETTE_ET_LES_MODALITES_DE_RECOUVREMENT_DES_DROITS,_REDEVANCES_ET_TAXES_RELATIFS_A_L_ACTIVITE_FORESTIERE"
