URL,text,page_title,page_label,metadata
https://www.juriafrica.com/lex/decret-99-201-17-sept-1999-16891.htm,"LE PRESIDENT DE LA REPUBLIQUE,
VU la Constitution;
VU le décret n°74/358 du 17 avril 1974 portant création du Conseil de l'Enseignement Supérieur et de la Recherche Scientifique et Technique;
VU le décret n° 93/026 du 19 janvier 1993 portant création des Universités;
VU le décret n° 96/228 du 1er octobre 1996 portant organisation du Ministère de la Recherche Scientifique et Technique
VU le décret n° 97/205 du 7 décembre 1997 portant organisation du Gouvernement, modifié et complété par le décret n° 981067 du 28 avril 1998;
VU le décret n° 98/231 du 28 septembre 1998 portant organisation du Ministère de l'Enseignement Supérieur;
DECRETE:
CHAPITRE I
DISPOSITIONS GENERALES
Art. 1er —  Le présent décret organise et fixe les modalités de fonctionnement du Conseil de l'Enseignement Supérieur et de la Recherche Scientifique et Technique, ci-après désigné le « Conseil ».
Art. 2 —  Le Conseil a pour missions d'assister le Gouvernement dans l'élaboration et la mise en œuvre de la politique de l'enseignement supérieur, de la recherche scientifique et technique, et du développement technologique.
A ce titre, il émet des avis et formule des recommandations sur:
la définition et l'orientation de la politique du Gouvernement en matière d'enseignement supérieur, de recherche scientifique et technique et de développement technologique;
la définition et l'orientation des programmes de formation des cadres supérieurs au niveau de l'enseignement supérieur et de la recherche scientifique et technique;
la coordination de l'ensemble des activités relatives à J'enseignement supérieur et à la recherche scientifique et technique;
l'harmonisation des activités entre les institutions universitaires, d'une part, et les organismes chargés de la recherche scientifique et technique, d'autre part;
le développement, le suivi et le contrôle de l'enseignement supérieur privé;
la participation des opérateurs économiques au développement de
l'enseignement supérieur et de la recherche scientifique et technique.
CHAPITRE II
DE L'ORGANISATION
Art. 3 —  (1) Le Conseil est présidé par le Président de la République.
(2) Le Premier Ministre en assure la vice-présidence.
(3) Sont membres de droit du Conseil:
le Ministre chargé de l'Enseignement Supérieur;
le Ministre chargé de la Recherche Scientifique et Technique;
le Ministre chargé de l'Education Nationale;
le Ministre chargé de la Culture;
le Ministre chargé de la Communication;
le Ministre de la Jeunesse et des Sports;
le Ministre chargé de la Défense;
le Ministre chargé de l'Economie et des Finances;
le Ministre chargé du Développement Industriel et Commercial;
le Ministre chargé de I 'Agriculture;
le Ministre chargé de la Santé Publique;
le Ministre chargé de l'Elevage, des Pêches et des Industries Animales;
le Ministre chargé des Investissements Publics et de l'Aménagement du Territoire;
le Ministre chargé des Travaux Publies;
le Ministre chargé de l'Urbanisme et de l'Habitat;
le Ministre chargé de la Ville;
le Ministre chargé de l'Emploi, du Travail et de la Prévoyance Sociale;
le Ministre chargé des Affaires Sociales;
le Ministre chargé de la Condition Féminine;
le Ministre chargé des Mines, de l'Eau et de l'Energie;
le Ministre chargé de la Fonction Publique et de la Réforme Administrative;
le Ministre chargé de la Justice;
le Ministre chargé du Contrôle Supérieur de l'Etat ;
le Ministre chargé des Relations Extérieures;
le Ministre chargé de l'Administration Territoriale;
le Ministre chargé des Relations avec les Assemblées;
le Ministre chargé du Tourisme;
le Ministre chargé de l'Environnement et des Forêts;
le Ministre chargé des Postes et Télécommunications;
le Ministre chargé des Transports;
le Délégué Général à la Sûreté Nationale;
les Recteurs des universités d'Etat ;
dix (10) Députés désignés par le bureau de l'Assemblée Nationale;
dix (10) Sénateurs désignés par le bureau du Sénat;
quatre (4) représentants du Conseil Economique et Social;
dix (10) représentants des opérateurs économiques ;
six (6) professeurs à raison d'un (1) par université d'Etat ;
six (6) représentants des maîtres de conférences à raison d'un (1) par université d'Etat ;
six (6) représentants des maîtres de recherches;
six (6) représentants des directeurs de recherches;
six (6) représentants des chargés de cours à raison d'un (1) par université d'Etat;
six (6) représentants des chargés de recherches;
six (6) représentants d'étudiants à raison d'un (un) par université d'Etat;
un (1) représentant de chaque institution universitaire privée reconnue.
(4) Siègent au Conseil avec voix consultative:
un (1) représentant de la Présidence de la République;
un (1) représentant des Services du Premier Ministre;
les vice-recteurs des universités d'Etat chargés de l'enseignement, de la recherche, de la coopération et de l'inspection;
les Inspecteurs Généraux et les Conseillers techniques des ministères chargés de l'Enseignement Supérieur et de la Recherche Scientifique;
l'Inspecteur Général du Ministère chargé de la Culture;
les doyens des facultés, les directeurs des grandes écoles et les directeurs des Instituts Universitaires de Technologie;
les directeurs des Instituts de Recherches;
le directeur du développement de l'enseignement supérieur;
le chef de la division de la prospective, de la recherche et de la coopération du ministère chargé de l'Enseignement Supérieur;
le directeur de l'assistance et de l'orientation universitaire du ministère chargé de l'Enseignement Supérieur;
le chef de la division des politiques scientifiques et de la planification du ministère chargé de la Recherche Scientifique et Technique;
le chef de la division de la valorisation et du développement technologique du ministère chargé de la Recherche Scientifique et Technique;
les directeurs de la planification, de la programmation, des ressources humaines et de la coopération du ministère chargé des Investissements Publics ;
le Secrétaire Permanent du Comité National de Développement des Technologies;
le directeur du budget du ministère chargé de l'Economie et des Finances;
le Secrétaire Permanent à l'environnement du ministère de l'Environnement et des Forêts;
le directeur de l'industrie du ministère du Développement Industriel et Commercial.
(5) Le Président peut inviter toute personne à prendre part aux travaux du Conseil en raison de sa compétence sur les points inscrits à l'ordre du jour.
Art. 4 —  (1) Le Conseil est doté d'un Secrétariat Permanent placé sous l'autorité conjointe du ministère chargé de l'Enseignement Supérieur et du ministère chargé de la Recherche Scientifique et Technique.
Il est chargé notamment :
du secrétariat des réunions du Conseil ;
de la mise en état des dossiers soumis à l'examen du Conseil;
du suivi de l'exécution des décisions prises par le Conseil;
de la préparation des différents rapports dans les délais qui lui sont impartis par le Conseil;
de la tenue et de la conservation des documents et des archives du Conseil ;
de toutes autres missions qui lui sont confiées par le Conseil.
(2) La coordination du Secrétariat Permanent est assurée par un Secrétaire Permanent, assisté de quatre (4) Chargés d'Etudes.
(3) Le Secrétaire Permanent est nommé par décret du Président de la République, sur proposition du Premier Ministre. Les Chargés d'Etudes sont nommés par arrêté du Premier Ministre, sur proposition des ministres chargés de l'Enseignement Supérieur et de la Recherche Scientifique et Technique.
CHAPITRE III
DU FONCTIONNEMENT
Art. 5 —  (1) Le Conseil se réunit en session ordinaire au moins une (1) fois tous les 5 ans, et en session extraordinaire chaque fois que cela est nécessaire, sur convocation de son Président.
(2) Les convocations, accompagnées de l'ordre du jour et des autres documents à soumettre à l'examen du Conseil, doivent être adressées aux membres au moins quinze (15) jours avant la date de la réunion du Conseil.
Art. 6 —  Les charges de fonctionnement du Conseil et du Secrétariat Permanent sont supportées par:
les budgets du ministère chargé de l'Enseignement Supérieur et du ministère chargé de la Recherche Scientifique et Technique;
toute autre ressource mise à leur disposition par l'Etat, les opérateurs économiques ou les mécènes.
Art. 7 —  (1) Il est créé un Comité d'organisation ad hoc ayant pour mission d'assurer l'organisation et le déroulement du Conseil de l'Enseignement Supérieur et de la Recherche Scientifique et Technique.
(2) L'organisation et les modalités de fonctionnement du Comité d'organisation ad hoc visé à l'alinéa (1) ci-dessus sont fixées par arrêté du Premier Ministre.
CHAPITRE IV
DES DISPOSITIONS DIVERSES ET FINALES
Art. 8 —  Le Secrétaire Permanent et les Chargés d'Etudes ont respectivement rang et prérogatives de directeur et de sous-directeur de l'Administration centrale.
Art. 9 —  Sont abrogées toutes dispositions antérieures contraires au présent décret.
Art. 10 —  Le Ministre de l'Enseignement Supérieur et le Ministre de la Recherche Scientifique et Technique sont chargés, chacun en ce qui le concerne, de l'exécution du présent décret qui sera enregistré et publié suivant la procédure d'urgence, puis inséré au Journal Officiel en français et en anglais.",DECRET_N_99_201_DU_17_SEPTEMBRE_1999_PORTANT_ORGANISATION_ET_FONCTIONNEMENT_DU_CONSEIL_DE_L_ENSEIGNEMENT_SUPERIEUR_ET_DE_LA_RECHERCHE_SCIENTIFIQUE_ET_TECHNIQUE,0,
