URL,text,page_title,page_label,category,metadata
https://www.juriafrica.com/lex/decret-2008-2115-pm-24-juin-2008-25943.htm,"DECRET N° 2008/2115/PM DU 24 JUIN 2008 PORTANT REVALORISATION DU SALAIRE MINIMUM INTERPROFESSIONNEL GARANTI (SMIG)

Le Premier Ministre, Chef du Gouvernement,
Décrète :
Art. 1er  —  Le salaire minimum interprofessionnel garanti en abrégé « SMIG » est, à compter de la date de signature du présent décret, fixé à 28.216 Fcfa par mois, sur l'ensemble du territoire national, quelle que soit la branche d'activité.
Art. 2 —  Sont abrogées, toutes dispositions antérieures contraires.
Art. 3 —  Le ministre du Travail et de la Sécurité Sociale est chargé de l'application du présent décret qui sera enregistré, publié suivant la procédure d'urgence, puis inséré au Journal officiel en français et en anglais.",DECRET_N_2008_2115_PM_DU_24_JUIN_2008_PORTANT_REVALORISATION_DU_SALAIRE_MINIMUM_INTERPROFESSIONNEL_GARANTI_SMIG,0,decret,
