URL,text,page_title
https://www.juriafrica.com/lex/decret-97-148-pm-08-avr-1997-15889.htm,"LE PREMIER MINISTRE,
VU la Constitution ;
VU le décret n°92/245 du 26 novembre 1992 portant organisation du Gouvernement ;
VU le décret n°96/202 du 19 septembre 1996 portant nomination d'un Premier Ministre, Chef du Gouvernement ;
VU les recommandations du Sommet Mondial des Premières Dames tenu à Genève en Février 1992 ;
VU les résolutions de la Conférence des Premières Dames d'Afrique réunies à Yaoundé le 08 juillet 1996 ;
VU la politique du Gouvernement en matière de promotion féminine ;
DECRETE:
CHAPITRE I
CREATION ET MISSIONS
Art. 1er —  II est créé pour compter de la date de signature du présent décret un Comité Directeur National chargé de la promotion économique de la femme rurale et de l'amélioration des conditions de vie des femmes , ci-après désigné le Comité.
Art. 2 —  Placé sous le parrainage de la Première Dame Camerounaise et sous la coordination du Ministre chargé de la Promotion Féminine, le Comité est chargé de :
mettre en oeuvre et de suivre les recommandations issues des travaux du Comité Directeur International des Premières Dames du Monde et des résolutions des Conférences des Premières Dames Africaines ;
traduire en actes toute initiative de la Première Dame Camerounaise en direction des femmes en général et des femmes rurales en particulier ;
sensibiliser et mobiliser l'opinion publique sur la cause féminine ;
mobiliser les ressources pour la mise en oeuvre des projets du Comité.;
promouvoir l'amélioration des conditions de vie des femmes et le développement de la femme rurale ;
Adopter et exécuter des programmes spécifiques en faveur des femmes rurales ;
évaluer les actions entreprises en faveur des femmes par le Comité.
CHAPITRE II
ORGANISATION ET FONCTIONNEMENT
Art. 3 —  Le Comité Directeur National comprend :
- un bureau national disposant en son sein d'un secrétariat permanent ;
- des bureaux décentralisés au niveau provincial ou régional, départemental, d'arrondissement et de district.
SECTION 1
Du Bureau National
Art. 4 —  - Le Bureau National est composé :
d'une Présidente honoraire : l'épouse du Chef de l'Etat ;
de deux Vice-présidentes :
l'épouse du Président de l'Assemblée Nationale
l'épouse du Premier Ministre.
d'un Coordinateur : le Ministre chargé de la Promotion Féminine
des membres suivants :
un représentant du Cabinet Civil de la Présidence de la République ;
un représentant du Cabinet du Président de l'Assemblée Nationale ;
un représentant du Cabinet du Premier Ministre ;
un représentant du Ministère chargé de la Promotion Féminine ;
un représentant du Ministère chargé de la Communication ;
un représentant du Ministère de l'Economie et des Finances ;
un représentant du Ministère de l'Agriculture ;
un représentant du Ministère de l'Elevage, des Pêches et des Industries Animales ;
un représentant du Ministère de la Santé Publique ;
un représentant du Ministère de l'Education Nationale ;
un représentant du Ministère de l'Environnement et des Forêts ;
un représentant du Ministère de la Recherche Scientifique et Technique ;
un représentant du Ministère de la Jeunesse et des Sports ;
un représentant du Ministère des Mines, de l'Eau et de l'Energie ;
un représentant du Ministère du Travail et de la Prévoyance Sociale ;
un représentant du Ministère de la Culture ;
un représentant du Ministère de l'Administration Territoriale ;
un représentant du Ministère du Développement Industriel et Commercial ;
un représentant du Ministère du Tourisme ;
un représentant du Ministère de la Justice ;
trois (03) représentants des ONG de promotion féminine lès plus représen-tatives ;
trois (03) représentants des Confessions Religieuses (catholique, protes-tante, musulmane) ;
Art. 5 —  Le Coordinateur peut inviter toute personne ou toute structure à prendre part aux travaux du Comité en raison de ses compétences sur les questions à débattre.
Art. 6 —  Sur convocation du Coordinateur, le Bureau National se réunit une fois par semestre en session ordinaire. Des réunions extraordinaires peuvent être convoquées par la Présidente honoraire en cas de besoin.
Art. 7 —  Le Bureau National adopte au cours de sa première session annuelle le budget de fonctionnement du Comité.
Art. 8 —  (1) Le Bureau National dispose d'un Secrétariat Permanent chargé de l'exécution de ses décisions. Il assure principalement :
la coordination de ses activités ;
la collecte des données ;
le suivi et l'évaluation des projets ;
la liaison avec les organes internationaux poursuivant les mêmes objectifs ;
l'élaboration du budget du Comité
(2) - Le Secrétariat Permanent est assuré par des personnes ressources du Ministère chargé de la promotion féminine. Il comprend :
un Secrétaire Permanent ayant rang et prérogative de Sous-directeur de l'Administration Centrale ;
trois (03) responsables dont un représentant du Cabinet civil de la Présidence de la République ayant rang et prérogative de Chef de Service de l'Administration Centrale.
(3) - Le Secrétaire Permanent et les responsables visés au paragraphe ci-dessus sont nommés par arrêté du Ministre chargé de la promotion féminine après avis du Cabinet Civil.
SECTION II
Des Bureaux Décentralisés
Art. 9 —  Le Comité Directeur National comprend au niveau décentralisé :
le Comité Provincial ou Régional ;
le Comité Départemental ;
le Comité d'Arrondissement ;
le Comité de District.
Art. 10 —  Le Comité Provincial ou Régional est composé :
d'une Présidente Honoraire : l'épouse du Gouverneur ;
d'un Coordinateur : le Délégué Provincial du Ministère chargé de la pro-motion féminine ;
des Membres suivants :
le Conseiller aux Affaires Economiques du Gouverneur ;
un représentant de chacun des Ministères siégeant au Bureau National ;
un représentant par ONG et Association de Promotion Féminine les plus représentatives au niveau provincial ;
un représentant de chaque confession religieuse siégeant au Bureau National.
Art. 11 —  Le Comité Départemental est composé :
d'une Présidente Honoraire : l'épouse du Préfet ;
d'un Coordinateur : le Délégué Départemental du Ministère chargé de la promotion féminine ;
des membres suivants :
un représentant de chacun des Ministères siégeant au Bureau National ;
un représentant par ONG et Association de Promotion Féminine les plus représentatives au niveau départemental ;
un représentant de chaque confession religieuse siégeant au niveau national ;
un représentant de la Mairie ;
les chefs traditionnels de 1er degré.
Art. 12 —  Le Comité d'Arrondissement ou de District est composé :
d'une Président Honoraire : l'épouse du Sous-préfet ou du Chef de District
d'un Coordinateur : le Chef du Service d'Arrondissement du Ministère chargé de la promotion féminine ;
des membres suivants :
un représentant de chacun des Ministères siégeant au Bureau National
un représentant par ONG, Association, GIC, GIE reconnu au niveau de l'Arrondissement ou du District ;
un représentant de chaque confession religieuse siégeant au bureau national ;
un représentant de la Mairie ;
les Chefs traditionnels de 2e degré.
Art. 13 —  (1) Les membres du Bureau National sont nommés par arrêté du Ministre chargé de la promotion féminine, sur proposition des structures qu'ils représentent.
(2) - Dans les mêmes conditions les membres des bureaux décentralisés sont nommés par décision du Gouverneur.
Art. 14 —  Les organes provinciaux ou régionaux, départementaux, d'arrondissement ou de district jouent le rôle de relais entre le Bureau National et les femmes rurales. En dehors des mission dévolues au Bureau National, ils sont en outre chargé de :
recueillir les aspirations des femmes rurales et de les acheminer au Secrétariat Permanent ;
mobiliser à leur niveau les fonds pour le financement des projets féminins et rendre compte au Secrétariat Permanent.
Art. 15 —  Sur convocation du Coordinateur Local, les bureaux décentralisés se réunissent une fois par trimestre. Toutefois dans le cadre du suivi de projets spécifiques des réunions ponctuelles peuvent être convoquées.
CHAPITRE III
DISPOSITIONS FINANCIERES ET FINALES
Art. 16 —  Les ressources nécessaires au fonctionnement du Comité proviennent :
des crédits inscrits annuellement au budget du Ministère chargé de la promotion féminine ;
des contributions des organisations internationales, gouvernementales ou non gouvernementales ;
des contributions des sponsors privés, personnes physiques ou morales ;
des dons et des legs.
Art. 17 —  Les fonctions de membre du Comité Directeur National pour la Promotion Economique de la Femme Rurale sont gratuites.
Toutefois, les membres du Bureau National et des bureaux décentralisés peuvent prétendre au remboursement de leurs frais de déplacement à l'occasion des sessions.
Art. 18 —  Le Ministre de la promotion féminine est chargé de l'application du présent décret qui sera enregistré, publié selon la procédure d'urgence, puis inséré au journal officiel en français et en anglais.",DECRET_N°97_148_PM_DU_08_AVRIL_1997_PORTANT_CREATION_D_UN_COMITE_DIRECTEUR_NATIONAL_POUR_LA_PROMOTION_ECONOMIQUE_DE_LA_FEMME_RURALE_ET_L_AMELIORATION_DES_CONDITIONS_DE_VIE_DES_FEMMES.-
