URL,text,page_title
https://www.juriafrica.com/lex/decret-2023-502-08-novembre-2023-53729.htm,"LE PRESIDENT DE LA REPUBLIQUE,
Vu la Constitution ;
Vu l'ordonnance n°72/11 du 26 août 1972 relative à la publication des lois, ordonnances, décrets et actes réglementaires;
Vu la loi n°2022/020 du 27 décembre 2022 portant loi de finances de la République du Cameroun pour l'exercice 2023 ;
Vu le décret n°77/4 du 06 janvier 1977 portant règlementation de la publication des actes au Journal Officiel de la République Unie du Cameroun ;
Vu le décret n°2023/335 du 04 août 2023 habilitant le Ministre de l'Economie, de la Planification et de l'Aménagement du Territoire, à signer avec Banque Islamique de Développement, un Accord de Prêt d'un montant de 12 050 000 Dinars Islamiques, correspondant à 14 990 000 euros, soit environ 9,819 milliards de francs CFA, pour le financement du Projet de Développement de la Chaîne de Valeur du riz au Cameroun (PDCVRC),
DECRETE:
Art. 1er —  Est ordonnée la publication au Journal Officiel du texte portant Accord de Prêt du Projet n°1027, d'un montant de 12 050 000 Dinars Islamiques, correspondant à 14 990 000 euros, soit environ 9,819 milliards de francs CFA, conclu le 10 septembre 2023 entre la République du Cameroun et la Banque Islamique de Développement (BID), pour le financement du Projet de Développement de la Chaîne de Valeur du riz au Cameroun (PDCVRC).
Art. 2 —  Le présent décret sera enregistré, publié suivant la procédure d'urgence, puis inséré au Journal Officiel en français et en anglais. /-","DECRET_N°2023_502_DU_08_NOVEMBRE_2023_ORDONNANT_LA_PUBLICATION_AU_JOURNAL_OFFICIEL_DU_TEXTE_PORTANT_ACCORD_DE_PRET_DU_PROJET_N°1027,_D'UN_MONTANT_DE_12_050_000_DINARS_ISLAMIQUES,_CORRESPONDANT_À_14"
