URL,text,page_title,page_label,metadata
https://www.juriafrica.com/lex/decret-2002-319-13-dec-2002-16032.htm,"LE PRESIDENT DE LA REPUBLIQUE,
VU la Constitution ;
VU la loi n°67/8 du 12 juin 1967 portant organisation de la prévoyance Sociale
VU le décret n° 75/607 du 1er septembre 1975 fixant les règles relatives aux opérations financières et comptables de la Caisse Nationale de Prévoyance Sociale;
VU le décret du 30 décembre 1994 portant titrisation de la dette intérieure de l'Etat ;
VU le mandat en date du 11 novembre 2002 donné à M. Jean-Claude GALLET et Maîtres Jean-Paul NGALLE MIANO et NTIMBANE BOMO Christian
DECRETE
Art. 1er —  Il est ordonné le gel-séquestre immédiat de tous les avoirs finan-ciers de la Caisse Nationale de Prévoyance Sociale qui ont été détournés à l'étranger au préjudice de cet Etablissement Public, de l'Etat et des citoyens, par toutes personnes physiques ou morales et leurs complices.
Art. 2 —  Le privilège du trésor en matière d'impôts directs et taxes est accordé à la poursuite du recouvrement ou bien à la mobilisation refinancement desdits avoirs. Le privilège afférent à ces avoirs, assimilés à des créances d'Etat, s'exerce à compter du jour où les agents de poursuites de la République du Cameroun ont identifié l'Etablissement de crédit ou assimilé, et tiers détenteur desdits avoirs.
Art. 3 —  Les agents de recouvrement Mandatés devront apprécier la valeur des différents instruments, supports de la mobilisation au profit du Trésor de République du Cameroun et représentant la contre-valeur de certains avoirs bloqués.
Art. 4 —  Les Agents de Poursuites constitués et agréés que sont M. Jean-Claude GALLET, Conseiller, Maîtres Jean-Paul NGALLE MIANO et Christian B. NTIMBANE BOMO, Avocats au Barreau du Cameroun, Mandataires Plénipotentiaires à la Présidence de la République du Cameroun, sous la supervision de Monsieur Jean FOUMAN AKAME, Conseiller Juridique à la Présidence, ont qualité pour initier, dans tous pays et en respect du droit national et international, des mesures judiciaires conservatoires, négocier des refinancements correspondant pour tout ou partie des avoirs bloqués et faciliter l'application des traités d'entraide judiciaire.
Ils devront tenir un répertoire servant à l'inscription de tous les actes de leur ministère et informer les Ambassades de la République du Cameroun sises dans les pays où ils instrumentent de tout obstacle mis à l'exécution de leur mission qui aura été initiée après information préalable du ministère de la Justice du pays détenteur précaire des avoirs détournés.
Art. 5 —  Le présent Décret qui prend effet à compter de sa date de signature sera enregistré et publié selon la procédure d'urgence, puis inséré au Journal officiel de la République du Cameroun./",DECRETN_2002_319_DU_PORTANT_GEL_SEQUESTRE_DES_AVOIRS_FINANCIERS_DE_LA_CAISSE_NATIONALE_DE_PREVOYANCE_SOCIALE_CNPS_FRAUDULEUSEMENT_DETOURNES_A_L_ETRANGER_ET_ACCORDANT_LE_PRIVILEGE_DU_TRESOR_EN_MATIERE_DE_RECOUVREMENT_DE_CES_FONDS,0,
