URL,text,page_title
https://www.juriafrica.com/lex/decret-2004-207-30-juil-2004-15973.htm,"LE PRESIDENT DE LA REPUBLIQUE,
Vu la Constitution ;
Vu la loi n°2003/017 du 22 décembre 2003 portant loi de finances de la République du Cameroun pour l'exercice 2004;
Vu le décret n° 97/2007 portant formation du Gouvernement et ses divers modificatifs ;
Vu le décret n° 2002/216 du 24 août 2002 portant réorganisation du Gouvernement,
DECRETE:
Art. 1 —  ef.Le Ministre des Affaires Economiques, de la Programmation et de l'Aménagement du Territoire est habilité, avec faculté de délégation, à signer avec L'Agence Française de Développement (AFD), une Convention d'ouverture de crédit d'un montant de 9 millions d'Euros, soit environ 5,9 milliards de francs CFA, pour le financement du Fonds d'Etudes et de Préparation des Projets.
Art. 2 —  Le présent décret sera enregistré et publié suivant la procédure d'urgence, puis inséré au Journal Officiel en français et en anglais./-","DECRET_N°_2004_207_DU_30_JUILLET_2004_HABILITANT_LE_MINISTRE_DES_AFFAIRES_ECONOMIQUES,_DE_LA_PROGRAMMATION_ET_DE_L_AMENAGEMENT_DU_TERRITOIRE_À_SIGNER_AVEC_L_AGENCE_FRANÇAISE_DE_DEVELOPPEMENT_(AFD),"
