URL,text,page_title
https://www.juriafrica.com/lex/decret-2019-306-18-juin-2019-49250.htm,"LE PRESIDENT DE LA REPUBLIQUE,
Vu la Constitution ;
Vu la loi n°2018/022 du 11 décembre 2018 portant loi de finances de la République du Cameroun pour l'exercice 2019
Vu le décret n°2011/408 du 11 décembre 2011 portant organisation du Gouvernement, modifié et complété par le décret n°2018/190 du 02 mars 2018 ;
Vu le décret n°2018/802 du 20 décembre 2018 habilitant le Ministre de l'Economie, de la Planification et de l'Aménagement du Territoire à signer avec l'Association Internationale de Développement (IDA), un Accord de crédit d'un montant de 20,8 millions d'Euros, équivalent à 25,36 millions de dollars US, soit environ 13,6 milliards de francs CFA, pour le financement additionnel du Projet Filets Sociaux,
DECRETE:
Art. 1er  —  Est ratifié, l'Accord de crédit n°6223-CM d'un montant de 20,8 millions d'Euros, soit environ 13,6 milliards de francs CFA, conclu le 09 avril 2019 entre la République du Cameroun et l'Association Internationale de Développement (IDA), pour le financement additionnel du Projet Filets Sociaux.
Art. 2 —  Le présent décret sera enregistré, publié suivant la procédure d'urgence, puis inséré au Journal Officiel en français et en anglais. /-","DECRET_N°2019_306_DU_18_JUIN_2019_PORTANT_RATIFICATION_DE_L'ACCORD_DE_CREDIT_N°6223-CM_D'UN_MONTANT_DE_20,8_MILLIONS_D'EUROS,_SOIT_ENVIRON_13,6_MILLIARDS_DE_FRANCS_CFA,_CONCLU_LE_09_AVRIL_2019_ENTRE"
