URL,text,page_title,page_label,metadata
https://www.juriafrica.com/lex/decret-2014-164-12-mai-2014-29126.htm,"Vu la Constitution ;
Vu la loi n° 2013/017 du 16 décembre 2013 portant loi de finances de la République du Cameroun pour l'exercice 2014 ;
Vu le décret n° 2011/408 du 9 décembre 2011 portant organisation du Gouvernement,
DECRETE :
Art. 1er —  Le Ministre de l'Economie, de la Planification et de l'Aménagement du Territoire est habilité, avec faculté de délégation, à signer avec la République .de Corée du Sud un Accord de prêt d'un montant de 57,457 millions de dollars US, soit 28,7 milliards de FCFA environ, pour le financement du projet de construction et d'équipement de l'hôpital de référence de Garoua.
Art. 2 —  Le présent décret sera enregistré, publié selon la procédure d'urgence, puis inséré au Journal Officiel en français et en anglais. /-",DECRET_N_2014_164_DU_12_MAI_2014_HABILITANT_LE_MINISTRE_DE_L_ECONOMIE_DE_LA_PLANIFICATION_ET_DE_L_AMENAGEMENT_DU_TERRITOIRE_A_SIGNER_AVEC_LA_REPUBLIQUE_DE_COREE_DU_SUD_UN_ACCORD_DE_PRET_D_UN_MONTANT_DE_57_457_MILLIONS_DE_DOLLARS_US_SOIT_28_7_MILLIARDS_DE_FCFA_ENVIRON_POUR_LE_FINANCEMENT_DU_PROJET_DE_CONSTRUCTION_ET_D_EQUIPEMENT_DE_L_HOPITAL_DE_REFERENCE_DE_GAROUA,0,
