URL,text,page_title,page_label,metadata
https://www.juriafrica.com/lex/decret-2002-158-23-juin-2002-15944.htm,"LE PRESIDENT DE LA REPUBLIQUE,
VU la Constitution;
VU la loi n°91/20 du 16 Décembre 1991 fixant les conditions d'élection des députés à 'Assemblée Nationale, modifiée par le loi n°97-13 du 19 Mars 1997 ;
Vu la loi n°92/002 du 14 Août 1992 fixant les conditions d'élection des Conseillers Municipaux;
VU la loi n°92/003 du 14 Août 1992 modifiant certaines dispositions de la loi n° 74/23 du 5 Décembre 1974 portant organisation communale, ensemble ses modificatifs subséquents
VU le décret n°2001/390 du 6 Décembre 2001 portant prorogation du mandat des Conseillers Municipaux ;
VU le décret n°2002/120 du 9 Mai 2002 portant convocation du Corps Électoral en vue de l'élection des députés à l'Assemblée Nationale et des Conseillers Municipaux,
DECRETE:
Art. 1er —  Les dispositions de l'Article 1 du décret n°2002/120 du 9 Mai 2002 susvisé sont modifiées ainsi qu'il suit:
Art. 1er —  (Nouveau) :
""Les électeurs sont convoqués le Dimanche 30 Juin 2002 à l'effet de procéder à l'élection des députés à l'Assemblée Nationale et des Conseillers Municipaux"".
Le reste sans changement.
Art. 2 —  Le présent décret sera enregistré et publié suivant la procédure d'urgence, puis inséré au Journal Officiel en français et en anglais.",DECRET_N_2002_158_DU_23_JUIN_2002_MODIFIANT_CERTAINES_DISPOSITIONS_DU_DECRET_N_2002_120_DU_09_MAI_2002_PORTANT_CONVOCATION_DU_CORPS_ELECTORAL_EN_VUE_DE_L_ELECTION_DES_DEPUTES_A_L_ASSEMBLEE_NATIONALE_ET_DES_CONSEILLERS_MUNICIPAUX,0,
