URL,text,page_title,page_label,category,metadata
https://www.juriafrica.com/lex/decret-99-023-8-fev-1999-16862.htm,"DECRET N° 99/023 DU 08 FÉVRIER 1999 RATIFIANT L'ACCORD DE PRÊT N° 478-CM D'UN MONTANT DE 7,9 MILLIONS DE DTS, SOIT ENVIRON 6,3 MILLIARDS DE F CFA, CONCLU LE 11 NOVEMBRE 1998 ENTRE LE FONDS INTERNATIONAL DE DÉVELOPPEMENT AGRICOLE ET LA RÉPUBLIQUE DU CAMEROUN.

LE PRESIDENT DE LA REPUBLIQUE,
VU la Constitution ;
VU la loi n° 98/009 du 1er juillet 1998 portant loi des Finances de la République du Cameroun pour l'exercice 1998/1999 ;
VU le décret n° 97/205 du 07 décembre 1997 portant organisation du Gouvernement, modifié et complété par le décret n° 98/067 du 28 avril 1998
VU le décret n° 98/277 du 27 octobre 1998 habilitant le Ministre des Investissements Publics et de l'Aménagement du Territoire à signer avec le Fonds International de Développement Agricole, l'accord de prêt n° 478-CM d'un montant de 7, 9 Millions de DTS ;
DECRETE:
Art. 1er —  Est ratifié l'accord de prêt n° 478-CM d'un montant de 7,9 Millions de DTS, soit environ 6,3 Milliards de CFA, conclu le 11 novembre 1998 entre le Fonds International de Développement Agricole et la République du Cameroun, en vue du financement du projet d'Appui au Programme National de Vulgarisation et de Recherche Agricoles.
Art. 2 —  Le présent décret sera enregistré, puis publié au Journal Officiel en français et en anglais. /-",DECRET_N_99_023_DU_08_FEVRIER_1999_RATIFIANT_L_ACCORD_DE_PRET_N_478_CM_D_UN_MONTANT_DE_7_9_MILLIONS_DE_DTS_SOIT_ENVIRON_6_3_MILLIARDS_DE_F_CFA_CONCLU_LE_11_NOVEMBRE_1998_ENTRE_LE_FONDS_INTERNATIONAL_DE_DEVELOPPEMENT_AGRICOLE_ET_LA_REPUBLIQUE_DU_CAMEROUN,0,decret,
