URL,text,page_title,page_label,category,metadata
https://www.juriafrica.com/lex/decret-2002-175-10-juil-2002-16045.htm,"DECRET N° 2002/175 DU 10 JUILLET 2002 HABILITANT LE MINISTRE DES INVESTISSEMENTS PUBLICS ET DE L'AMÉNAGEMENT DU TERRITOIRE AVEC FACULTÉ DE DÉLÉGATION, À SIGNER AVEC L'ASSOCIATION INTERNATIONALE DE DÉVELOPPEMENT (IDA), UN ACCORD DE CRÉDIT DE DÉVELOPPEMENT D'UN MONTANT DE DIX SEPT MILLIONS DEUX CENT MILLE DROITS DE TIRAGE SPÉCIAUX (DTS) (17,20 MILLIONS DE DTS) DESTINÉ AU FINANCEMENT DU PROJET D'APPUI À LA CONCESSION FERROVIAIRE.-

LE PRESIDENT DE LA REPUBLIQUE,
VU la Constitution
VU la loi n° 2001/008 du 30 juin 2001 portant loi de finances de la République du Cameroun pour l'exercice budgétaire 2001 /2002 ;
VU le décret n°97/205 du 07 décembre 1997 portant organisation du Gouvernement, modifié et complété par le décret n°98/067 du 28 avril 1998 ;
VU le décret n° 97/207 du 07 décembre 1997 portant formation du Gouvernement, ensemble ses modificatifs subséquents
DECRETE:
Art. 1er —  Le Ministre des Investissements Publics et de l'Aménagement du Territoire est habilité avec faculté de délégation à signer avec l'Association Internationale de Développement (IDA), un Accord de Crédit de Développement d'un montant de dix sept millions deux cent mille de Droits de Tirage Spéciaux (DTS) (17,20 millions de DTS), soit environ 16,08 milliards de Francs CFA, destiné au financement du Projet d'Appui à la Concession Ferroviaire.
Art. 2 —  Le présent décret sera enregistré, publié suivant la procédure d'urgence, puis inséré au Journal Officiel en Français et en Anglais.-",DECRET_N_2002_175_DU_10_JUILLET_2002_HABILITANT_LE_MINISTRE_DES_INVESTISSEMENTS_PUBLICS_ET_DE_L_AMENAGEMENT_DU_TERRITOIRE_AVEC_FACULTE_DE_DELEGATION_A_SIGNER_AVEC_L_ASSOCIATION_INTERNATIONALE_DE_DEVELOPPEMENT_IDA_UN_ACCORD_DE_CREDIT_DE_DEVELOPPEMENT_D_UN_MONTANT_DE_DIX_SEPT_MILLIONS_DEUX_CENT_MILLE_DROITS_DE_TIRAGE_SPECIAUX_DTS_17_20_MILLIONS_DE_DTS_DESTINE_AU_FINANCEMENT_DU_PROJET_D_APPUI_A_LA_CONCESSION_FERROVIAIRE,0,decret,
