URL,text,page_title,page_label,metadata
https://www.juriafrica.com/lex/decret-78-547-28-decembre-1978-16505.htm,"Le Président de la République,
Vu la constitution du 2 juin 1972, modifiée et complétée par la loi n° 75-1 du 9 mai 1975 ;
Vu la loi n° 77-11 du 13 juillet 1977 portant réparation et prévention des accidents du travail et des maladies professionnelles et notamment ses articles 18, 36 et 54 ;
Vu l'ordonnance n° 73-17 du 22 mai 1973 portant organisation de la prévoyance sociale ;
Vu l'avis émis par le conseil national du travail en sa séance du 11 mai 1978,
Décrète :
Chapitre I
dispositions générales.
Art. 1 —  (1) Les prestations en nature accordées aux victimes d'accidents du travail ou de maladies professionnelles sont prises en charge par la Caisse nationale de prévoyance sociale conformément aux dispositions du présent décret.
(2) La Caisse nationale de prévoyance sociale verse directement le montant de ces prestations aux médecins, aux dentistes, aux pharmaciens, aux fournisseurs, aux auxiliaires médicaux, aux formations sanitaires ou hospitalières, publiques ou privées ou aux centres médicaux d'entreprises.
(3) Au cas où les prestations ont été supportées soit par la victime d'un accident du travail ou de maladie professionnelle, soit par l'employeur ou toute autre personne, la Caisse nationale de prévoyance sociale en rembourse le montant à la personne qui aura engagé la dépense sur présentation des pièces justificatives.
chapitre II
frais d'hospitalisation, de transport et de déplacement.
Art. 2 —  (1) Les travailleurs victimes d'accidents du travail ou de maladies professionnelles sont, en matière d'hospitalisation, admis dans les formations sanitaires publiques ou parapubliques ou dans les établissements privés agréés par le Ministre de la santé publique.
(2) Lorsque la victime d'un accident du travail ou d'une maladie professionnelle est hospitalisée dans un établissement public, le tarif d'hospitalisation est le tarif applicable aux malades ; il en est de même en ce qui concerne le tarif des honoraires et tous les accessoires dus aux médecins, techniciens, experts et aux auxiliaires médicaux de cet établissement à l'occasion de soins donnés à la victime.
(3) En cas d'hospitalisation de la victime dans une formation sanitaire privée, la Caisse nationale de prévoyance sociale est tenue :
au paiement des frais d'hospitalisation aux taux fixés par les textes particuliers ;
au paiement des honoraires et frais accessoires dûs aux médecins, dentistes, techniciens, experts et aux auxiliaires médicaux tels que définis par les textes en vigueur fixant dans le secteur privé la valeur des lettres clefs correspondant aux actes médicaux, chirurgicaux ou de spécialistes ainsi qu'aux analyses biologiques figurant à la nomenclature générale des actes professionnels.
(4) Nonobstant les différents taux de prestations prévus aux paragraphes précédents, la Caisse nationale de prévoyance sociale peut négocier les tarifs préférentiels de remboursement des prestations en nature avec les formations sanitaires ou hospitalières, les praticiens, les fournisseurs et les pharmaciens.
Art. 3 —  (1) Au cas où la victime se trouve dans l'obligation de se déplacer sur le territoire national pour suivre un traitement approprié, pour répondre aux réquisitions ou aux contrôles médicaux, la Caisse nationale de prévoyance sociale supporte les frais de transport compte tenu de la catégorie de l'agent et de l'état de santé de la victime apprécié par le médecin traitant. Sauf cas de force majeure dûment constaté préalablement au déplacement, une prise en charge doit être demandée à la Caisse nationale de prévoyance sociale.
Si la victime ne respecte pas le moyen de transport prescrit par le médecin traitant, la Caisse nationale de prévoyance sociale supporte les frais conformément aux prescriptions médicales.
Lorsque le salaire n'est pas maintenu au cours du déplacement, la victime bénéficie de l'indemnité journalière prévue à l'article 24de la loi n°77-11 du 13 juillet 1977.
(2) Sont également à la charge de la Caisse nationale de prévoyance sociale :
les frais de transport d'un accompagnateur si l'état de la victime nécessite une telle assistance ;
ses frais de séjour au taux de l'indemnité de déplacement allouée aux chefs de service de la Caisse nationale de prévoyance sociale et dans la limite des délais de route nécessaire par l'évacuation.
(3) Un arrêté conjoint du Ministre du travail et de la prévoyance sociale et du Ministre de la santé publique fixe la procédure d'évacuation sanitaire hors du territoire national en cas d'accident du travail ou de maladie professionnelle.
chapitre III
appareil de prothèse et d'orthopédie.
Art. 4 —  En cas d'accident de travail ou de maladie professionnelle, la victime a droit à la fourniture, à la réparation, au remplacement et au renouvellement des appareils de prothèse et d'orthopédie.
Art. 5 —  (1) L'appareillage comporte outre les appareils de prothèse et d'orthopédie, leur système d'attache et tous autres accessoires nécessaires à leur fonctionnement y compris notamment les chaussures adaptées aux membres inférieurs artificiels.
(2) L'appareillage de la prothèse dentaire comprend notamment la prothèse maxillaire et faciale.
(3) Les mutilés de travail atteints de lésions graves et incurables du système locomoteur ont droit à une voiturette ou à un fauteuil roulant ou tout autre moyen de locomotion approprié.
(4) La victime d'un accident du travail ou d'une maladie professionnelle a droit à un appareil de secours en attendant la livraison d'un définitif sans pour autant que cet appareil provisoire remplace le définitif.
Art. 6 —  (1) Les appareils susceptibles d'être fournis aux mutilés doivent figurer sur une liste approuvée par le Ministre du travail et de la prévoyance sociale sur proposition de la commission nationale d'appareillage visé à l'article 13 ci-dessous.
(2) Si la victime choisit un appareil plus coûteux, la Caisse nationale de prévoyance sociale rembourse le prix correspondant sur la base du tarif de l'appareil standard figurant sur la liste d'appareillage visée à l'alinéa précédent.
Art. 7 —  Lorsque la commission d'appareillage saisie par le médecin traitant décide de la fourniture, de la réparation, du renouvellement et du remplacement d'un appareil de prothèse ou d'orthopédie, la Caisse nationale de prévoyance sociale verse le montant du prix de l'appareil au fournisseur ou à toute personne qui a engagé la dépense sur production des pièces justificatives.
Art. 8 —  (1) Lorsqu'il a été décidé qu'un appareil de prothèse ou d'orthopédie doit être fourni, réparé, renouvelé ou remplacé, la victime a le droit de choisir l'appareil convenant à son infirmité parmi les types d'appareils figurant sur la liste d'appareils visée à l'article 14 ci-dessous.
(2) La victime peut se faire appareiller :
soit par elle-même en s'adressant à un organisme privé ;
soit par un centre public ou parapublic.
Art. 9 —  (1) Toutes les opérations de livraison ou de réparation, de renouvellement ou de remplacement d'appareils doivent être portées sur un livret fourni par le centre d'appareillage et tenu en double par la victime et le centre ou à défaut de celui-ci par la Caisse nationale de prévoyance sociale. Ce livret doit porter notamment toutes les indications sur le type d'appareil, la nature des réparations effectuées.
Art. 10 —  Lorsqu'un accident du travail entraîne la détérioration d'un appareil que la victime portait antérieurement elle doit prouver que cet accident a rendu l'appareil inutilisable. Sauf cas d'impossibilité dûment établi, elle est tenue de présenter ledit appareil à la Caisse nationale de prévoyance sociale, aux fins de réparation ou de remplacement.
Art. 11 —  (1) Les appareils et leurs accessoires ne peuvent être ni cédés, ni vendus ; sauf cas d'impossibilité dûment établi, tout appareil non présenté ne sera pas remplacé.
(2) Le mutilé du travail appareillé est responsable de la garde, de l'usage et de l'entretien de son appareillage ; les conséquences de détérioration ou perte intentionnellement provoquée demeurant à sa charge.
(3) Lors de la livraison d'un appareil fourni, réparé, remplacé ou renouvelé, ledit appareil doit être présenté au médecin traitant pour s'assurer qu'il convient à l'infirmité ou à a mutilation présentée par la victime.
(4) Si l'appareil fourni ne convient plus à l'infirmité ou à la mutilation présentée par ma victime, il peut être changé ou retiré par décision de la commission nationale d'appareillage. L'initiative appartient concurremment à la Caisse nationale de prévoyance sociale et au mutilé du travail.
Art. 12 —  Sans préjudice des poursuites judiciaires et de tous dommages et intérêts le mutilé qui, par de fausses déclarations, obtient un appareil, est tenu au remboursement du prix de l'appareil indûment ou frauduleusement reçu.
Art. 13 —  (1) Il est créé auprès du Ministre du travail et de la prévoyance sociale une commission nationale d'appareillage composée de représentants qualifiés des ministères et organismes suivants :
le représentant du Ministre du travail et de la prévoyance sociale, président ;
le directeur de la prévoyance sociale assurant le secrétariat ;
un représentant du Ministre de la santé publique ;
un représentant du Ministre des affaires sociales ;
un représentant de la Caisse nationale de prévoyance sociale ;
le médecin traitant du travailleur ;
les directeurs des centres d'appareillage.
(2) La commission peut se faire assister, à titre consultatif d'experts ou techniciens.
Art. 14 —  La commission nationale d'appareillage a pour but :
d'établir la liste d'appareils susceptibles d'être remboursés ;
de faire des recommandations ou propositions en matière de réglementation sur l'appareillage ;
d'établir la liste des centres et établissements d'appareillage.
Art. 15 —  (1) Des commissions d'appareillage sont également créées au chef lieu de chaque province et composée ainsi qu'il suit :
le médecin inspecteur du travail, président ;
l'inspecteur provincial du travail du ressort, secrétaire ;
un représentant du Ministre de la santé publique ;
un représentant du Ministre des affaires sociales ;
un représentant de la Caisse nationale de prévoyance sociale ;
un représentant d'un centre d'appareillage ;
le médecin traitant.
(2) Par dérogation aux dispositions de l'alinéa précédent, la compétence d'une commission provinciale peut s'étendre sur plusieurs provinces.
Art. 16 —  Les commissions provinciales ont pour mission :
de réceptionner les demandes d'appareillage ;
de reconnaître la réalité de la mutilation ou de l'infirmité et de faire des recommandations sur les types d'appareils à fournir aux malades ;
de reconnaître la nécessité de fournir, de réparer, de renouveler ou de remplacer les appareils ;
d'effectuer le contrôle médical de l'appareillage.
Art. 17 —  (1) Les membres de la commission nationale et des commissions provinciales sont nommés pour une durée de cinq ans par arrêté du Ministre du travail et de la prévoyance sociale sur proposition des ministères et organismes dont ils relèvent.
(2) Lorsqu'au cours d'un mandat, un membre démissionne, décède ou perd la qualité qui avait motivé sa nomination, il est pourvu à son remplacement par la nomination d'un nouveau membre pour la durée du mandat restant à courir.
(3) Chaque commission se réunit sur convocation de son président. Elle ne peut valablement siéger que si la moitié au moins des membres sont présents. Ses délibérations sont consignées dans un procès-verbal signé du président et du secrétaire et notifié aux parties dans les quinze (15) jours qui suivent la date de la réunion. En cas de partage de voix, celle du président est prépondérante.
(4) Le secrétaire assure la conservation et la garde des archives de la commission.
(5) Les techniciens et les experts appelés en consultation bénéficient à l'occasion de chaque réunion et aux frais de l'Etat des mêmes avantages et dans les mêmes conditions que les membres du conseil national du travail.
chapitre IV
traitement, rééducation fonctionnelle, réadaptation et reconversion professionnelle.
Art. 18 —  La victime d'un accident du travail ou d'une maladie professionnelle bénéficie à la charge de la Caisse nationale de prévoyance sociale, d'un traitement en vue de sa rééducation fonctionnelle. La décision de ce traitement est prise d'un commun accord entre le médecin traitant et la Caisse nationale de prévoyance sociale.
Art. 19 —  Le traitement prévu à l'article précédent est effectué dans une formation sanitaire publique ou parapublique ou dans un établissement privé agréé par la Caisse nationale de prévoyance sociale.
Art. 20 —  (1) Le bénéficiaire des dispositions des articles précédents est tenu :
de se soumettre au traitement et mesures de toutes natures qui lui ont été prescrits par le médecin traitant et le cas échéant après avis du médecin de la Caisse nationale de prévoyance sociale, à l'exception des interventions chirurgicales qui ne sauraient se pratiquer sans son accord préalable;
de se soumettre aux visites médicales et contrôles prescrits par la Caisse nationale de prévoyance sociale ;
d'accomplir les exercices et travaux prescrits en vue de favoriser sa rééducation ou sa reconversion professionnelle.
(2) En cas d'inobservation de ces obligations, la Caisse nationale de prévoyance sociale peut suspendre le paiement de l'indemnité journalière ou en réduire le montant.
Art. 21 —  Si, à la suite d'un accident du travail ou d'une maladie professionnelle, la victime devient inapte à exercer sa profession ou ne peut la faire qu'après une nouvelle adaptation, elle a droit, qu'elle ait ou non bénéficié de la rééducation fonctionnelle prévue au présent chapitre :
soit d'être admise sous contrôle médical dans un établissement public ou privé de rééducation ou d'enseignement professionnel ;
soit d'être réintégrée après examen psychotechnique et médical préalable dans son entreprise pour y apprendre l'exercice d'une profession ou de son choix sous réserve de présenter les conditions d'aptitude requises.
Art. 22 —  Pendant la période de rééducation fonctionnelle ou de réadaptation, la victime a droit à l'indemnité journalière ou au maintien de sa rente.
chapitre V
frais funéraires.
Art. 23 —  (1) En cas d'accident du travail ou de maladie professionnelle mortels, les frais funéraires sont supportés par la Caisse nationale de prévoyance sociale.
(2) Au cas où le travailleur décédé bénéficie de ces prestations dans le cadre d'une disposition conventionnelle ou contractuelle, la Caisse nationale de prévoyance sociale verse les frais en espèces à ses ayants cause.
Art. 24 —  (1) Les frais funéraires visés à l'article précédent comprennent :
la fourniture d'un cercueil ordinaire ou zingué selon que le lieu du décès se confond ou non avec celui de sépulture ;
le transport de la dépouille mortelle du lieu du décès du travailleur, soit au lieu de résidence habituelle, soit au lieu de recrutement, soit à tout autre lieu d'inhumation choisi par la famille. En tout état de cause, les frais assurés par la Caisse nationale de prévoyance sociale ne peuvent excéder ceux qui résulteraient du transport des restes mortels au lieu de résidence habituelle ;
le transport de la famille et des bagages du lieu du décès au lieu de résidence habituelle.
Art. 25 —  Un arrêté du Ministre du travail et de la prévoyance sociale fixe en tant que de besoin, les modalités d'application du présent décret.
Art. 26 —  Sont abrogées toutes dispositions antérieures contraires au présent décret et notamment :
le décret n° 61-158 du 30 septembre 1961 fixant les conditions de fourniture, de réparation et de remplacement des appareils de prothèse et d'orthopédie aux accidentés du travail ;
le décret n° 61-159 du 30 septembre 1961 fixant les modalités de calcul et de remboursement des frais funéraires en cas d'accident du travail ;
l'arrêté n° 131 du 1er juin 1962 fixant les modalités d'application du chapitre I du titre V de l'ordonnance 59-100 du 31 décembre 1959 en ce qui concerne la réadaptation fonctionnelle et le reclassement des victimes d'accident du travail.
Art. 27 —  Le présent décret qui prend effet pour compter de sa date de signature sera enregistré et publié selon la procédure d'urgence, puis inséré au journal officiel en français et en anglais.",DECRET_N_78_547_DU_28_DECEMBRE_1978_FIXANT_LES_MODALITES_DE_PRISE_EN_CHARGE_DES_PRESTATIONS_EN_NATURE_AUX_VICTIMES_D_ACCIDENTS_DU_TRAVAIL_OU_DE_MALADIES_PROFESSIONNELLES,0,
