URL,text,page_title,page_label,metadata
https://www.juriafrica.com/lex/decret-2014-434-31-octobre-2014-18123.htm,"Le Président de la République,
Vu la Constitution;
Vu la loi N°2013/017 du 16 décembre 2013 portant loi de Finances de la République du Cameroun pour l'exercice 2014 ;
Vu le décret N°2011/408 du 9 décembre 2011 portant organisation du gouvernement,
Décrète:
Art. 1er —  . - Le Ministre de l'Economie, de la Planification et de l'Aménagement du territoire, est habilité, avec faculté de délégation, à signer avec l'International Islamic Trade Finance Corporation (ITFC), filiale du groupe de la banque islamique de développement (BID), un accord de prêt d'un montant de 13 millions d'euros, soit environ 8,527 milliards de F CFA, pour le financement de la campagne cotonnière 2014-2015 au Cameroun.
Art. 2 —  Le présent décret sera enregistré, publié selon la procédure d'urgence, puis inséré au Journal Officiel en français et en anglais.",DECRET_N_2014_434_DU_31_OCTOBRE_2014_HABILITANT_LE_MINISTRE_DE_L_ECONOMIE_DE_LA_PLANIFICATION_ET_DE_L_AMENAGEMENT_DU_TERRITOIRE_A_SIGNER_AVEC_L_INTERNATIONAL_ISLAMIC_TRADE_FINANCE_CORPORATION_ITFC_FILIALE_DU_GROUPE_DE_LA_BANQUE_ISLAMIQUE_DE_DEVELOPPEMENT_BID_UN_ACCORD_DE_PRET_D_UN_MONTANT_DE_13_MILLIONS_D_EUROS_SOIT_ENVIRON_8_527_MILLIARDS_DE_FCFA_POUR_LE_FINANCEMENT_DE_LA_CAMPAGNE_COTONNIERE_2014_2015_AU_CAMEROUN,0,
