URL,text,page_title,page_label,metadata
https://www.juriafrica.com/lex/decret-2017-367-12-juillet-2017-48261.htm,"LE PRESIDENT DE LA REPUBLIQUE,
VU la Constitution ;
VU la loi n°2016/018 du 14 décembre 2016 portant loi de finances de la République du Cameroun pour l'exercice 2017 ;
VU le décret n°2016/510 du 09 décembre 2016 habilitant le Ministre de l'Economie, de la Planification et de l'Aménagement du Territoire, à signer avec la Banque Islamique de Développement (BID), un Accord de Vente à Tempérament d'un montant de 10,76 millions de dollars US, soit environ 5,380 milliards de francs CFA, pour le financement du Projet d'appui à la santé maternelle, néonatale et infantile au Cameroun,
DECRETE :
Art. 1er —  .- Est ratifié, l'Accord de Vente à Tempérament d'un montant de 10,76 millions de dollars US, soit environ 5,380 milliards de francs CFA, signé le 27 décembre 2016 entre la République du Cameroun et la Banque Islamique de Développement, pour le financement du Projet d'appui à la santé maternelle, néonatale et infantile au Cameroun.
Art. 2 —  Le présent décret sera enregistré, publié suivant la procédure d'urgence, puis inséré au Journal Officiel en français et en anglais. /-",DECRET_N_2017_367_DU_12_JUILLET_2017_PORTANT_RATIFICATION_DE_L_ACCORD_DE_VENTE_A_TEMPERAMENT_D_UN_MONTANT_DE_10_76_MILLIONS_DE_DOLLARS_US_SOIT_ENVIRON_5_380_MILLIARDS_DE_FRANCS_CFA_SIGNE_LE_27_DECEMBRE_2016_ENTRE_LA_REPUBLIQUE_DU_CAMEROUN_ET_LA_BANQUE_ISLAMIQUE_DE_DEVELOPPEMENT_POUR_LE_FINANCEMENT_DU_PROJET_D_APPUI_A_LA_SANTE_MATERNELLE_NEONATALE_ET_INFANTILE_AU_CAMEROUN,0,
