URL,text,page_title
https://www.juriafrica.com/lex/decret-2003-101-14-mai-2003-16063.htm,"LE PRESIDENT DE LA REPUBLIQUE,
VU la Constitution
VU le décret n° 2002/110 du 24 avril 2002 portant nomination d'un Administrateur provisoire à la Société Nationale des Eaux du Cameroun;
VU le décret n° 2002/216 du 24 août 2002 portant réorganisation du Gouvernement;
DECRETE:
Art. 1er —  Le mandat de Monsieur ATANGANA KOUNA Basile, nommé Administrateur provisoire de la Société Nationale des Eaux du Cameroun par décret n° 2002/110 du 24 avril 2002 susvisé, est prorogé jusqu'au 31 décembre 2003.
Art. 2 —  Le présent décret sera enregistré et publié suivant la procédure d'urgence, puis inséré au Journal Officiel en français et en anglais.",DECRET_N°2003_101_DU_14_MAI_2003_PORTANT_PROROGATION_DU_MANDAT_DE_L_ADMINISTRATEUR_PROVISOIRE_DE_LA_SOCIETE_NATIONALE_DES_EAUX_DU_CAMEROUN.
