URL,text,page_title,page_label,category,metadata
https://www.juriafrica.com/lex/decret-2004-343-29-dec-2004-16042.htm,"DECRET N°2004/343 DU HABILITANT LE MINISTRE DE L'ECONOMIE ET DES FINANCES À SIGNER AVEC LA RÉPUBLIQUE POPULAIRE DE CHINE, UN ACCORD DE PRÊT SANS INTÉRÊT D'UN MONTANT DE 30 MILLIONS DE YUANS RENMINBI, SOIT ENVIRON 2,4 MILLIARDS DE FRANCS CFA.-

LE PRESIDENT DE LA REPUBLIQUE,
Vu la Constitution ;
Vu la loi n° 2003/017 du 22 décembre 2003 portant loi de finances de la République du Cameroun pour l'exercice 2004 ;
Vu le décret n° 2004/320 du 8 décembre 2004 portant organisation du Gouvernement;
Vu le décret n° 2004/322 du 8 décembre 2004 portant formation du Gouvernement,
DECRETE:
Art. 1er —  Le Ministre de l'Economie et des Finances est habilité, avec faculté de délégation, à signer avec la République Populaire de Chine, un Accord de prêt sans intérêt d'un montant de 30 millions de Yuans RENMINBI, soit environ 2,4 milliards de francs CFA.
Art. 2 —  Le présent décret sera enregistré et publié suivant la procédure d'urgence, puis inséré au Journal Officiel en français et en anglais./-",DECRET_N_2004_343_DU_HABILITANT_LE_MINISTRE_DE_L_ECONOMIE_ET_DES_FINANCES_A_SIGNER_AVEC_LA_REPUBLIQUE_POPULAIRE_DE_CHINE_UN_ACCORD_DE_PRET_SANS_INTERET_D_UN_MONTANT_DE_30_MILLIONS_DE_YUANS_RENMINBI_SOIT_ENVIRON_2_4_MILLIARDS_DE_FRANCS_CFA,0,decret,
