URL,text,page_title,page_label,metadata
https://www.juriafrica.com/lex/decret-2014-184-04-juin-2014-27079.htm,"Le Président de la République, décrète:
Art. 1er  —  Sont à compter de la date de signature du présent décret, nommés aux postes ci-après:
Gouverneur de la région du Centre :
Monsieur Otto Joseph Wilson, administrateur civil principal, précédemment gouverneur de la région du Nord, en remplacement de Monsieur Eyene Nlom Roger Moïse, admis à faire valoir ses droits à la retraite.
Gouverneur de la région de l'Extrême-Nord :
Monsieur Midjiyawa Bakari, administrateur civil principal, précédemment gouverneur de la Région de l'Ouest, en remplacement de Monsieur Awa Fonka Augustine, muté.
Gouverneur de la région du Nord:
Monsieur Abate Edi'i Jean, administrateur civil principal, précédemment préfet du département de la Sanaga Maritime, en remplacement de Monsieur OUo Joseph Wilson,muté.
Gouverneur de la région de l'Ouest :
Monsieur Awa Fonka Augustine, administrateur civil principal, précédemment gouverneur de la région de l'Extrême-Nord, en remplacement de Monsieur Midjiyawa Bakari, muté.
Art. 2 —  Les intéressés auront droit aux avantages de toute nature prévus par la réglementation en vigueur.
Art. 3 —  Le présent décret sera enregistré, publié suivant la procédure d'urgence, puis inséré au journal officiel en français et en anglais.",DECRET_N_2014_184_DU_04_JUIN_2014_PORTANT_NOMINATION_DE_GOUVERNEURS_DE_REGION,0,
