URL,text,page_title
https://www.juriafrica.com/lex/decret-2011-0005-pm-13-janvier-2011-48228.htm,"LE PREMIER MINISTRE, CHEF DU GOUVERNEMENT,
Vu la Constitution
Vu la loi n° 98/006 du 24 avril 1998 relative à l'activité touristique
Vu la loi n° 2004/017 du 22 juillet 2004 d'orientation de la décentralisation ;
Vu la loi n° 2004/018 du 22 juillet 2004 fixant les règles applicables aux communes ;
Vu la loi n° 2009/011 du 10 juillet 2009 portant régime financier des collectivités territoriales décentralisées ;
Vu la loi n° 2010/015 du 21 décembre 2010 portant loi de finances de la République du Cameroun pour l'exercice 2011;
Vu le décret n° 92/089 du 04 mai 1992 précisant les attributions du Premier Ministre, modifié et complété par le décret n° 95/145-bis du 04 août 1995,
Vu le décret n° 99/443/PM du 25 mars 1999 fixant les modalités d'application de la loi n° 98/006 du 14 avril 1998 relative à l'activité touristique ;
Vu le décret n° 2004/320 du 08 décembre 2004 portant organisation du Gouvernement, modifié et complété par le décret n° 2007{268 du 07 septembre 2007
Vu le décret n° 2005/450 du 09 novembre 2005 portant organisation du Ministère du tourisme ;
Vu le décret n° 2008/013 du 17 janvier 2008 portant organisation et fonctionnement du Conseil National de la Décentralisation ;
Vu le décret n° 2008/014 du 17 janvier 2008 portant organisation et fonctionnement du Comité Interministériel des Services Locaux ;
Vu le décret n° 2009/222 du 30 juin 2009 portant nomination d'un Premier Ministre, Chef du Gouvernement,
DECRETE :
CHAPITRE I
DISPOSITIONS GENERALES
Art. 1er —  .- Le présent décret fixe les modalités suivant lesquelles les Communes exercent, à compter de l'exercice budgétaire 2011, les compétences ci-après transférées par l'Etat en matière de mise en valeur des sites touristiques communaux :
l'aménagement des sites touristiques d'intérêt local ;
l'exploitation des sites touristiques d'intérêt local.
Art. 2 —  Est considéré comme sites touristiques communaux, ceux classés d'intérêt local, à savoir tout paysage naturel ou tout élément artificiel du patrimoine national présentant une valeur universelle exceptionnelle du point de vue culturel, esthétique, historique, scientifique, légendaire, artistique, et qui est exploité et préservé pour l'intérêt du tourisme dans le ressort d'une commune.
Art. 3 —  Les Communes exercent les compétences transférées en matière de mise en valeur des sites touristiques communaux, sans préjudice des prérogatives et responsabilités ci-après reconnues à l'Etat :
l'élaboration et la mise en œuvre de la politique nationale en matière de promotion du tourisme ;
la mise en valeur des sites touristiques d'intérêt national et régional ;
la détermination des conditions et des modalités techniques d'aménagement et d'exploitation des sites touristiques d'intérêt local ;
la définition et le contrôle des normes de mise en valeur des sites touristiques communaux.
Art. 4 —  (1) Les compétences transférées par l'Etat en matière d'aménagement et d'exploitation des sites touristiques d'intérêt local, sont exercées par les Communes dans le strict respect des dispositions légales et réglementaires en vigueur.
(2) L'exécution des dépenses y relatives obéit aux dispositions du Code des Marchés Publics.
CHAPITRE II
DE L'AMENAGEMENT DES SITES TOURISTIQUES D'INTERÊT LOCAL
Art. 5 —  L'aménagement des sites touristiques d'intérêt local, concerne les activités ci-après :
l'inventaire des ressources qui rendent attractifs lesdits sites ;
la délimitation et la sécurisation desdits sites ;
la réalisation des voies d'accès, des pistes de vision et de randonnées auxdits sites :
la réalisation des infrastructures de base dons lesdits sites ;
la fourniture et l'installation des équipements de base ;
la signalisation interne ;
la viabilisation desdits sites par la réalisation des infrastructures et l'acquisition des équipements destinés à l'accueil et à l'hébergement des visiteurs.
CHAPITRE III
DE L'EPLOITATION DES SITES TOURISTIQUES D'INTERÊT LOCAL
Art. 6 —  L'exploitation des sites touristiques d'intérêt focal concerne les activités ci-après :
la promotion des sites touristiques d'intérêt local ;
la gestion durable desdits sites ;
l'attraction, l'accueil et l'encadrement des visiteurs ;
la création des meilleures conditions de séjour ;
la préservation de l'authenticité et des caractéristiques naturelles l'implication, la formation et l'encadrement des populations riveraines ;
la mise en place d'un système de gestion des déchets et un plan de gestion environnementale ;
la collecte des données statistiques relatives à l'activité touristique dans lesdits sites ;
la création des circuits touristiques ;
la prise de toutes mesures nécessaires à la sécurité, l'hygiène et la salubrité publiques dans l'enceinte et autour desdits sites.
Art. 7 —  - (1) Dans le cadre de l'aménagement des sites touristiques, la Commune recrute et met à leur disposition, en tant que de besoin, le personnel d'appoint.
(2) Le personnel d'appoint est constitué de l'ensemble des personnels chargés de l'exécution des tâches courantes.
(3) La commune prend en charge les solaires dudit personnel.
CHAPITRE IV
DU TRANSFERT DES RESSOURCES
Art. 8 —  Le transfert par l'Etat des compétences en matière de mise en voleur des sites touristiques communaux, s'accompagne du transfert concomitant des ressources nécessaires à leur exercice normal par les Communes.
Art. 9 —  La loi de finances de l'Etat prévoit chaque année les ressources nécessaires à l'exercice des compétences transférées aux Communes en matière de mise en valeur des sites touristiques communaux.
Art. 10 —  Outre les ressources transférées par l'Etat, la commune peut bénéficier de concours provenant des partenaires pour l'exercice des compétences transférées en matière de mise en valeur des sites touristiques communaux,
Art. 11 —  (1) Les ressources financières transférées par l'Etat sont exclusivement réservées ô l'exercice des compétences correspondantes.
(2) Lesdites ressources sont inscrites au budget de la commune.
(3) Leur gestion obéit aux principes budgétaires et comptables en vigueur.
CHAPITRE V
DISPOSITIONS DIVERSES ET FINALES
Art. 12 —  Les conditions et modalités d'exercice des compétences transférées par l'Etat en matière d'aménagement et d'exploitation des sites touristiques d'intérêt local, ainsi que d'utilisation des ressources correspondantes, sont précisées par un cahier de charges arrêté par le Ministre chargé du Tourisme.
Art. 13 —  L'Etat assure le suivi, le contrôle et l'évaluation de l'exercice des compétences transférées aux Communes en matière de mise en valeur des sites touristiques communaux.
Art. 14 —  (1) La Commune et les services déconcentrés de l'Etat compétents dressent semestriellement un rapport sur l'état de mise en œuvre des compétences transférées en matière de mise en valeur des sites touristiques communaux,
(2) ledit rapport est adressé au Ministre chargé de la décentralisation et au Ministre chargé du Tourisme.
Art. 15 —  Les Ministres chargés de la décentralisation, du tourisme, des finances et des investissements publics sont, chacun en ce qui le concerne, chargés de l'application du présent décret qui sera enregistré, publié suivant la procédure d'urgence, puis inséré au Journal Officiel en français et en anglais./-
YAOUNDÉ, le 13 JANVIER 2011
LE PREMIER MINISTRE,
CHEF DU GOUVERNEMENT,
Philémon YANG",DECRET_N°2011_0005_PM_DU_13_JANVIER_2011_FIXANT_LES_MODALITES_D'EXERCICE_DE_CERTAINES_COMPETENCES_TRANSFEREES_PAR_L'ETAT_AUX_COMMUNES_EN_MATIERE_DE_MISE_EN_VALEUR_DES_SITES_TOURISTIQUES_COMMUNAUX.-
