URL,text,page_title
un périmètre de protection interdisant à toute personne d'entreprendre des activités susceptibles de nuire à la construction, à l'exploitation et à l'entretien du Système de Transport par Pipeline, y compris à l'intérieur d'une zone de protection maritime, et dont le type et les dimensions repris dans le décret octroyant l'Autorisation de Transport par Pipeline, sont déterminés par la Convention d'Etablissement. Les activités interdites comprennent le fait de traîner des objets sur le fond de la mer dans ladite zone de protection maritime ;
le droit d'utiliser toutes les installations du Système de Transport par Pipeline et les infrastructures construites ou améliorées ;
le droit de couper les arbres et d'essarter les terrains moyennant le paiement des droits, taxes et redevances prévus par la législation en vigueur lorsque les arbres et arbustes sont utilisés pour les besoins de ses travaux ;
le droit d'utiliser les eaux souterraines et les eaux de surface y compris les chutes d'eau et les sources non exploitées ni réservées et de les aménager pour les besoins de ses travaux ;
le droit d'enlever et d'utiliser la latérite pour les besoins de ses travaux ;
le droit d'entreprendre les travaux nécessaires à la construction, à l'exploitation et à l'entretien du Système de Transport par Pipeline et les activités, travaux et industries qui s'y rattachent.
2- Les décrets affectant l'emprise foncière à la construction, à l'exploitation et à l'entretien du Système de Transport par Pipeline, précisent également que :
les terrains qui constituent l'emprise foncière sont et demeurent la propriété de l'Etat et que ces terrains ne peuvent en aucune circonstance être aliénés pendant la durée de l'Autorisation de Transport par Pipeline ou devenir la propriété du Titulaire ;
nonobstant le fait que le Système de Transport par Pipeline soit situé sur le Domaine Public ou sur le Domaine Privé de l'Etat, ou traverse des terrains déjà concédés ou affectés, le Système de Transport par Pipeline demeure la propriété du Titulaire.
Art. 31 —  Le Titulaire procède à ses frais au bornage de l'emprise foncière dans les six (06) mois qui suivent la publication du dernier décret affectant ladite emprise. Le Ministre chargé des domaines, dûment-averti de la date de l'exécution du bornage, est représenté et suit les opérations par un délégué.
Le bornage est effectué sous la direction d'un géomètre assermenté qui en dresse procès-verbal, avec plan à l'appui, transmis sans délai, pour vérification et contrôle par le Ministre chargé du Cadastre Les travaux de vérification et de contrôle, auxquels prend part un représentant du Titulaire sont à la charge de celui-ci.
Passé le délai prévu ci-dessus et si après mise en demeure restée sans effet, le bornage n'a pas été effectué dans un délai de trente (30) jours, il y sera procédé d'office aux frais du Titulaire.
Les bornages rectificatifs des propriétés privées affectées par la constitution de l'emprise foncière, sont exécutés à la charge du Titulaire.
Art. 32 —  1L'emprise du Système de Transport par Pipeline est constituée par les terrains de l'emprise foncière qui demeurent affectés à l'exploitation et à l'entretien du Système de Transport par Pipeline, conformément à l'article 29 alinéa c) de la Loi N° 96/14 du 05 août 1996.
L'emprise du Système de Transport par Pipeline correspond à :
une bande de terrain dont la largeur est déterminée par la Convention d'Etablissement;
des emplacements supportant les installations annexes ;
2- Les décrets affectant l'emprise foncière à la construction, à l'exploitation et à l'entretien du Système de Transport par Pipeline fixent le délai dans lequel le Titulaire communique au Ministre chargé des mines les coordonnées des terrains qui constituent l'emprise du Système de Transport par Pipeline.
3- Dans un délai de deux (02) mois suivant la communication de ces coordonnées, le Ministre chargé des mines soumet à la signature le projet de décret modifiant ceux mentionnés à l'article 29 alinéa 3 du présent décret conformément à l'article 29 alinéa c) de la Loi N° 96/14 du 05 août 1996, pour maintenir l'affectation des terrains identifiés dans le cadre de l'alinéa 2 ci-dessus à l'exploitation et à l'entretien de ce Système de Transport par Pipeline, et instituer les périmètres de protection y afférents.
Ce décret précise que les terrains, situés dans l'emprise foncière et qui, à l'achèvement des travaux de construction, ne sont pas inclus dans l'emprise du Système de Transport par Pipeline sont grevés de servitudes d'utilisation au profit des travaux d'entretien entraînant excavation et peuvent être affectés à d'autres usages.
Le Titulaire est tenu de procéder à ses frais et selon les règles de l'art, à la remise en état des lieux de l'emprise foncière utilisée par ses travaux conformément à l'étude d'impact sur l'environnement visée à l'article 11 alinéa 1.3.e) du présent décret.
Art. 33 —  1Le décret modifiant l'affectation de l'emprise visé à l'article 32 alinéas 3) du présent décret restreint, sur la partie de l'emprise foncière qui n'est pas incluse dans l'emprise du Système de Transport par Pipeline, les droits conférés au Titulaire en vertu de l'article 30 alinéa 1) du présent décret à des servitudes d'utilisation constituée par la continuation des droits suivants :
le droit de jouissance des terrains pour entreprendre des travaux d'entretien entraînant une excavation ;
le droit de libre accès aux terrains et aux installations du Système de Transport par Pipeline ;
pendant les travaux, un périmètre de protection interdisant à toute personne non autorisée par le Titulaire, l'accès aux terrains sur lesquels se déroulent les travaux, à l'exception des fonctionnaires et agents de l'Etat chargés de la surveillance et du contrôle administratifs ou des services compétents chargés de la surveillance ou de la protection du territoire ;
le droit de couper les arbres et d'essarter les terrains, moyennant le paiement des droits, taxes et redevances prévus par la législation en vigueur et sous réserve des dispositions de l'article 29 alinéa 1.c) du présent décret, lorsque les arbres et arbustes sont utilisés pour les besoins de ses travaux ;
le droit d'utiliser les eaux souterraines et les eaux de surface y compris les chutes d'eau et les sources non exploitées ni réservées et de les aménager pour les besoins d'entretien du Système de Transport par Pipeline ;
le droit d'entreprendre les travaux d'entretien du Système de Transport par Pipeline entraînant une excavation et les activités, travaux et industries qui s'y rattachent.
2- Les travaux d'entretien entraînant une excavation sont réalisés par le Titulaire après notification au Comité de Pilotage et de Suivi des Pipelines. A cet effet, le Titulaire adresse à ce comité, le dossier technique des travaux à réaliser, ainsi qu'une note indiquant l'emplacement choisi et désignant les mises en valeur des tiers qui seront concernées par les travaux projetés. Dans ce cas, le Titulaire est tenu d'indemniser les victimes des destructions.
L'indemnité due en raison de l'utilisation des servitudes mentionnées ci-dessus correspond à la destruction des mises en valeur réalisées par des tiers en conformité avec les dispositions de l'article 32 de la Loi N° 96/14 du 05 août 1996, et est à la charge du Titulaire.
Art. 34 —  Dans les six (06) mois qui suivent la publication du décret de modification de l'emprise foncière, le Titulaire entreprend à ses frais, la matérialisation sur le terrain de l'emprise du Système de Transport par Pipeline en procédant à son bornage et au piquetage de l'axe du pipeline pour prendre en compte l'emplacement effectif du Système de Transport par Pipeline.
Le Ministre chargé des domaines, dûment averti de la date de l'exécution du bornage et du piquetage, est représenté et suit les opérations par un délégué.
Le bornage et le piquetage sont effectués sous la direction d'un géomètre assermenté qui en dresse procès-verbal, avec plan à l'appui, transmis sans délai, pour vérification et contrôle par le Ministre chargé du Cadastre. les travaux de vérification et de contrôle, auxquels prend part un représentant du Titulaire sont à la charge de-celui-ci.
Passé le délai prévu ci-dessus et si après mise en demeure, la matérialisation n'a pas été effectuée dans un délai trente (30) jours, il y sera procédé d'office aux frais du Titulaire.
Art. 35 —  1Les décrets mentionnés aux articles 29 alinéas 3 et 32 alinéa 3 du présent décret constituent le titre conférant au Titulaire les droits fonciers visés aux articles 30 et 33 du présent décret.
2- L'inscription dans les registres fonciers des droits du Titulaire sur l'emprise foncière et sur l'emprise du Système de Transport par Pipeline est initiée et prise en charge selon les dispositions de sa Convention d'Etablissement, et effectuée conformément aux procédures administratives. La demande d'inscription est accompagnée d'un exemplaire du décret d'incorporation au Domaine Privé de l'Etat et du plan certifié de ladite emprise.
Tout changement d'ordre administratif concernant l'emprise foncière et l'emprise du Système de Transport par Pipeline fait l'objet d'une inscription dans les registres fonciers effectuée dans les mêmes conditions.
3- Les droits du Titulaire de l'Autorisation de Transport par Pipeline sur l'emprise foncière et l'emprise du Système de Transport par Pipeline sont opposables aux tiers après publication du décret d'affectation de ces emprises et leur inscription dans les registres fonciers conformément à la Convention d'Etablissement.
Art. 36 —  1Pour l'exercice des droits fonciers conférés au Titulaire par les décrets affectant l'emprise foncière à la construction, à l'exploitation et à l'entretien du Système de Transport par Pipeline, les terrains de l'emprise sont mis à la disposition du Titulaire en l'état, et en temps utile suivant les procédures administratives et dans les délais déterminés conformément à sa Convention d'Etablissement.
Les décrets affectant les terrains nécessaires de l'emprise foncière, aux travaux de construction, d'exploitation et d'entretien du Système de Transport par Pipeline sont pris après indemnisation des victimes de l'expropriation et des libérations, et rendent effective l'expropriation des terrains concernés. Si l'expropriation effective n'intervient pas au plus tard deux (02) ans après la date de signature de l'Arrêté de déclaration d'utilité publique, celui-ci devient caduc sous réserve d'une prorogation accordée conformément à la législation en vigueur.
2- Le Titulaire est tenu d'engager les travaux objet de la demande de mise à disposition des terrains dans les délais fixés par sa Convention d'Etablissement, et de respecter la destination de ces terrains.
Dans le cas où, sans justification valable, les travaux prévus n'ont pas démarré dans les délais impartis, ou sont arrêtés pendant plus de douze (12) mois, le Titulaire est tenu de rembourser à l'Etat les sommes engagées pour la mise à disposition des terrains. Le Titulaire devra présenter au Comité de Pilotage et de Suivi des Pipelines une note exposant son intention d'exécuter lesdits travaux dans de nouveaux délais arrêtés d'accord parties.
Dans le cas où le Titulaire change la destination des terrains mis à sa disposition, la désaffectation des terrains concernés est prononcée par décret sur rapport du Ministre chargé des domaines saisi par le Comité de Pilotage et de Suivi des Pipelines.
Les conditions et modalités d'application des dispositions du présent article sont déterminées par la Convention d'Etablissement applicable.
Art. 37 —  1Les terrains privés des particuliers situés à l'extérieur de l'emprise foncière font l'objet de négociations à l'amiable entre le Titulaire et les propriétaires en vue de leur utilisation pour les activités de construction, d'exploitation ou d'entretien du Système de Transport par Pipeline ou pour accéder à ce Système de Transport par Pipeline.
A défaut d'accord amiable, et lorsque sa demande est jugée fondée, le Titulaire peut, moyennant juste rémunération, être autorisé à occuper temporairement les terrains concernés, conformément à l'article 33 de la Loi N°96/14 du 05 Août 1996. A cet effet, le Titulaire adresse une demande d'occupation temporaire au Ministre chargé des mines, accompagnée d'un dossier comprenant :
une note décrivant les activités à mener et exposant les motifs pour lesquels les terrains sollicités sont nécessaires pour les besoins d'exécution de ces activités ;
les preuves de l'échec des négociations avec le ou les propriétaires des terrains
les propositions du Titulaire relatives à la durée d'occupation et à l'indemnité ;
un plan indiquant les coordonnées des terrains sollicités.
2- L'autorisation d'occupation temporaire est accordée par arrêté du Ministre chargé des domaines, sur avis favorable du Ministre chargé des mines. Ledit arrêté constate le bien-fondé de la demande, désigne les terrains concernés, précise les droits et obligations des parties, notamment ceux qui sont limités dans la mesure où cette limitation est compatible avec l'exécution normale des activités prévues, et autorise l'occupation temporaire pour une durée au plus égale à une (01) année. Aucune procédure d'occupation temporaire ne peut être poursuivie si elle doit conduire à une occupation de terrains privés supérieure à une (01) année.
L'autorisation d'occupation temporaire ne confère pas au Titulaire la pleine propriété des sols et terrains concernés.
3- L'occupation temporaire du Domaine National, du Domaine Public et du Domaine Privé de l'Etat à l'extérieur de l'emprise foncière peut être autorisée dans les mêmes conditions que celles visées à l'alinéa 1) ci-dessus, à l'exception des dispositions relatives à l'indemnisation qui, dans le cas de cette occupation obéit aux dispositions de l'article 33.2 du présent décret.
Art. 38 —  Les décrets affectant l'emprise foncière à la construction, à l'exploitation et à l'entretien du Système de Transport par Pipeline autorisent le Titulaire à occuper le Domaine Public aux emplacements où le pipeline le traverse.
Les occupations du Domaine Public sont strictement limitées à celles qui sont nécessaires. Elles ont lieu à titre onéreux, la redevance étant supportée par le Titulaire conformément aux dispositions de sa Convention d'Etablissement. Les occupations du Domaine Public sont soumises aux dispositions de la législation domaniale en vigueur, à celles fixant les conditions techniques applicables à la construction, à l'exploitation et à l'entretien des Systèmes de Transport par Pipeline, et aux règlements spécifiques et dispositions administratives régissant le Domaine Public concerné.
Les travaux de construction d'un Système -de Transport par Pipeline qui se réalisent sur le Domaine Public ou sur les ouvrages relevant de l'Etat, des Collectivités Publiques locales ou Organismes et Services publics, sont soumis au respect des normes et règlements spécifiques du Domaine ou ouvrages concernés. Lorsque le pipeline occupe une partie du Domaine Public artificiel ou naturel, le Titulaire se conforme aux mesures particulières régulièrement édictées par l'autorité chargée de la gestion de ce Domaine et aux dispositions de l'arrêté visé à l'article 41 alinéas 2 du présent décret.
Les travaux de construction ou de modification de toute nature qui sont à effectuer sur le Domaine Public ou les ouvrages publics préexistants ou en construction et les dommages résultant pour tout tiers du fait de ces travaux, ou du fait de l'emprunt du Domaine Public par le pipeline, sont à la charge du Titulaire.
Art. 39 —  En cas d'urgence, et en particulier en cas de danger imminent pour les personnes ou pour l'environnement, le Titulaire est autorisé, sous sa seule responsabilité, à accéder à tout terrain privé ou public, quel que soit son statut et son-emplacement, dans le but d'examiner les causes ou de remédier à la situation d'urgence ou de danger, sans autorisation préalable, et avec l'assistance éventuelle des services d'urgence publics ou privés.
Art. 40 —  1Dans le cas de l'utilisation du Domaine Public, aucun recours ne peut être exercé contre l'Etat ou les Collectivités Publiques Locales par le Titulaire de l'Autorisation de Transport par Pipeline:
soit à raison de dommages que l'utilisation du Domaine Public, pourrait occasionner à ses installations ;
soit, et sauf en cas de négligence grave, à raison de travaux exécutés sur le Domaine Public dans l'intérêt national ou pour la sécurité publique.
Le Titulaire conserve son droit de recours contre les tiers.
2- Pour l'application du présent article, est qualifié négligence grave tout acte accompli en violation dûment établie des règles de l'art, des normes techniques et de sécurité, entraînant des dommages matériels ou corporels importants.
TITRE V
DE LA CONSTRUCTION, DE L'EXPLOITATION ET DE L'ENTRETIEN
Art. 41 —  1La construction, l'exploitation et l'entretien d'un Système de Transport par Pipeline sont soumis à des règles administratives, des normes techniques et à une réglementation de sécurité, de protection de l'environnement et des populations, sur toute l'étendue du territoire camerounais.
2- Un arrêté du Ministre chargé des mines portant règlement de sécurité définit les normes techniques et les conditions de sécurité à respecter pour la construction, l'exploitation, et l'entretien des Systèmes de Transport par Pipeline, y compris les travaux de grosse réparation ou de modification des ouvrages. Ledit an-été est applicable également aux pipelines visés par la législation minière camerounaise, nonobstant toute disposition contraire antérieure pour les pipelines à construire à l'extérieur d'un titre minier et selon les modalités fixées par des arrêtés particuliers pour les pipelines existants. Toutefois, les mises en conformité des pipelines existants qui exigeraient des déplacements ou des modifications de gros œuvre ne sont pas imposées.
3- Des arrêtés du Ministre chargé de mines, après avis conforme des autres Ministères concernés, précisent les conditions restrictives ou les interdictions à respecter lors de la construction et de l'exploitation des Systèmes de Transport par Pipeline dans les périmètres de protection définis à l'article 27 a) de la Loi N°96/14 du 05 Août 1996.
Art. 42 —  L'Arrêté visé à l'article 41 alinéa 2) ci-dessus précise notamment :
les types de matériaux à utiliser et leurs spécifications
les catégories des emplacements où le pipeline peut être implanté, et les distances relatives à ces emplacements ;
les normes d'implantation du pipeline, les profondeurs minimales d'enfouissement admises, et les conditions dans lesquelles le pipeline longe ou croise des ouvrages souterrains, ou traverse des régions instables ;
les modes et procédures d'assemblage des tubes et de protection du pipeline ;
les dispositions particulières applicables pour l'implantation et pour la protection des installations annexes ;
l'établissement des consignes et instructions ;
les normes de construction des installations provisoires ;
les dispositions applicables en cas de travaux sur le pipeline ou d'interruption prolongée de l'exploitation ;
la nature et la périodicité des vérifications et entretien du pipeline et des installations annexes ;
les mesures de protection contre les risques et les nuisances, en rapport avec la législation sur les établissements classés.
Art. 43 —  Le choix du tracé et la détermination des caractéristiques du pipeline par le postulant à l'Autorisation de Transport par Pipeline doivent tenir compte de l'environnement naturel, industriel et humain, ainsi que des contraintes particulières affectant les zones traversées qui peuvent être d'ordre administratif ou propre à la structure des sols. A cet effet, le postulant détermine les zones où la présence d'un pipeline entraîne un accroissement anormal des risques mutuels de voisinage entre celui-ci et son environnement, et définit les mesures les mieux adaptées aux situations locales, et notamment adopte un tracé évitant les zones en cause et propose dés aménagements techniques spécifiques visant à prévenir toute action dommageable au pipeline.
Art. 44 —  Sous réserve des dispositions de l'article 24 de la Loi N° 96/14 du 05 août 1996, dans le cadre des opérations de construction, d'exploitation et d'entretien du Système de Transport par Pipeline, ainsi que des activités, travaux et industries s'y rapportant, le Titulaire est tenu de ne pratiquer aucune discrimination de quelque nature que ce soit au détriment de la main d'œuvre, de laformation et de l'emploi du personnel camerounais, des équipements et matériaux locaux et des services des entreprises camerounaises.
Art. 45 —  1Le Titulaire de l'Autorisation de Transport par Pipeline procède, conformément à sa Convention d'Etablissement à la construction, à l'amélioration et à l'entretien des infrastructures, notamment les routes, ponts, ports, canaux, rigoles, chemins de fer ou pistes d'atterrissage nécessaires à la construction, à l'exploitation et à l'entretien de son Système de Transport par Pipeline. Pour cela, il est tenu de se conformer aux règles de l'art, à la législation applicable à ces activités sans préjudice des dispositions de sa Convention d'Etablissement.
Les projets de construction ou d'amélioration de ces infrastructures sont approuvés par le Comité de Pilotage et de Suivi des Pipelines, qui obtient des Ministres compétents la délivrance des ordres de service nécessaires pour autoriser l'exécution de ces travaux.
2- Le Comité de Pilotage et de Suivi des Pipelines définit avec les autorités responsables de ces domaines et le Titulaire, les règles générales et particulières applicables pour la conduite des travaux et les responsabilités des uns et des autres, y compris, le cas échéant, celles du maître d'ouvrage délégué. Ces règles et responsabilités sont établies en tenant compte du droit de surveillance et de contrôle des travaux qui relèvent des prérogatives de l'Etat, des Collectivités Publiques locales ou Organismes et Services publics intéressés, en ce qui concerne les infrastructures publiques et de la responsabilité technique du Titulaire en ce qui concerne la conception, les matériaux et équipements utilisés. Les règles et responsabilités ainsi définies sont consignées dans un document annexé à la Convention d'Etablissement.
Lorsque le Titulaire confie les travaux à un contractant, il s'assure que les règles susvisées sont reprises dans ses contrats avec les contractants. Les contrats pour des travaux sur les infrastructures liés à la construction, à l'exploitation et à l'entretien d'un Système de Transport par Pipeline ne sont pas soumis à la réglementation sur les marchés publics, et en particulier aux dispositions du décret N° 95/101 du 9 juin 1995. Le Titulaire communique au Comité de Pilotage et de Suivi des Pipelines une copie des appels d'offres et du contrat final, pour information.
L'approbation des projets d'exécution des travaux par le Comité de Pilotage et de Suivi des Pipelines ne dégage pas le Titulaire de sa responsabilité technique, pas plus qu'elle ne le décharge de sa responsabilité pour toutes les conséquences qui pourraient se présenter dans l'exécution de ces travaux, qui sera dans tous les cas régie par le droit commun.
Ces infrastructures sont ouvertes au public.
Art. 46 —  1Nonobstant les restrictions du périmètre de protection visées à l'article 30 alinéas 1.e) et 1.f) du présent décret, peuvent croiser le pipeline, les ouvrages, notamment les voies de communication et les ouvrages souterrains, sous réserve des dispositions de l'arrêté visé à l'article 41 alinéa 2 du présent décret. Le Titulaire est invité à soumettre ses observations sur les projets de ces ouvrages et sur leur réalisation pour prise en compte, mais ne peut s'opposer à leur exécution.
Les projets d'exécution des ouvrages à établir sur la partie de l'emprise foncière qui n'est pas incluse dans l'emprise du Système de Transport par Pipeline, et avoisinant le pipeline ou le suivant en parallèle à une distance de moins de huit (08) mètres, sont soumis à l'examen préalable du Titulaire pour ce qui concerne les dispositions techniques relatives à la sécurité et aux interférences.
Le maître d'ouvrage garantit que tout dommage au Système de Transport par Pipeline et/ou tout retard ou autre empêchement dans sa construction, son exploitation ou son entretien qui serait causé par l'exécution des travaux visés dans le présent article sera réparé et/ou que le Titulaire sera dûment indemnisé.
2- Les périmètres de protection visés à l'article 30 alinéa 1.d) du présent décret et destinés à la protection des installations annexes sont matérialisés par le Titulaire par des signalisations ou des clôtures implantées autour de ces installations, dans les conditions fixées par l'arrêté visé à l'article 41 alinéa 2 du présent décret.
