URL,text,page_title,page_label,metadata
de la coordination de la participation du Cameroun aux sommets, aux conférences ministérielles ainsi qu'aux autres rencontres techniques du Commonwealth; en liaison avec les administrations concernées ;
du suivi de l'application des décisions, déclarations et recommandations adoptées ainsi que de l'évaluation des résultats obtenus.
(2) Elle comprend :
la Sous-Direction de la Coopération Politique et Juridique
la Sous-Direction de la Coopération Économique, Technique, Sportive et Culturelle ;
la Sous-Direction de la Coopération Sociale et Non-Gouvernementale.
(3) Le Directeur en charge des relations avec le Commonwealth est le Point Focal du Commonwealth.
SECTION I
DE LA SOUS-DIRECTION DE LA COOPERATION POLITIQUE ET JURIDIQUE
Art. 104 —  (1) Placée sous l'autorité d'un Sous-Directeur, la Sous-Direction de la Coopération Politique et Juridique est chargée :
de la coopération Politique et Juridique entre le Cameroun et le Commonwealth ;
du suivi des activités à caractère politique et juridique ;
de la coordination de la participation du Cameroun aux travaux des organes et des instances politiques et juridiques ;
de la mise en application des résolutions et recommandations adoptées et de l'évaluation des résultats obtenus.
(2) Elle comprend :
le Service de la Coopération Politique ;
le Service de la Coopération Juridique.
Art. 105 —  (1) Placé sous L'autorité d'un Chef de Service, le Service de la Coopération Politique est chargé :
de la coopération Politique entre le Cameroun et le Commonwealth ;
du suivi des activités à caractère politique du Commonwealth ;
de la coordination de la participation du Cameroun aux travaux des organes et des instances à caractère politique ;
der suivi de l'application des décisions, déclarations et recommandations adoptées ainsi que de l'évaluation des résultats obtenus.
(2) Il comprend :
le Bureau des Sommets des Chefs d'État et de Gouvernement ;
le Bureau des Conférences Ministérielles.
Art. 106 —  (1) Placé sous l'autorité d'un Chef de Service, le Service de la Coopération Juridique est chargé :
de la coopération Juridique entre le Cameroun et le Commonwealth ;
du suivi des activités à caractère juridique du Commonwealth ;
de la coordination de la participation du Cameroun aux travaux des organes et des instances à caractère juridique ;
du suivi de l'application des décisions, déclarations et recommandations adoptées ainsi que de l'évaluation des résultats obtenus.
(2) Il comprend :
le Bureau de la Coopération Juridique ;
le Bureau du Suivi de la Coopération Judiciaire.
SECTION II
DE LA SOUS-DIRECTION DE LA COOPERATION ECONOMIQUE, TECHNIQUI SPORTIVE ET CULTURELLE
Art. 107 —  (1) Placée sous l'autorité d'un Sous-Directeur, la Sous-Direction de la Coopération Economique, Technique, Sportive et Culturelle est chargée :
de la coopération économique, technique, sportive et culturelle entre le Cameroun et le Commonwealth ;
du suivi des activités à caractère économique, technique, sportif et culturel du Commonwealth ;
de la coordination de la participation du Cameroun aux organes et aux instances économiques, techniques, sportifs et culturels ;
du suivi de l'application des décisions, déclarations et recommandations adoptées ainsi que de l'évaluation des résultats obtenus.
(2) Elle comprend :
le Service de la Coopération Economique ;
le Service de la Coopération Technique, Sportive et Culturelle.
Art. 108 —  (1) Placé sous l'autorité d'un Chef de Service, le Service de la Coopération Economique est chargé :
de la Coopération Economique entre le Cameroun et le Commonwealth ;
du suivi des activités à caractère économique du Commonwealth ;
de la coordination de la participation du Cameroun aux travaux des instances et des organes à caractère économique ;
du suivi de l'application des décisions, déclarations et recommandations adoptées ainsi que de l'évaluation des résultats obtenus.
(2) Il comprend:
le Bureau de la Coopération Financière ;
le Bureau de la Coopération Economique.
Art. 109 —  (1) Placé sous l'autorité d'un Chef de Service, le Service de la Coopération Technique, Sportive et Culturelle est chargé :
de la Coopération Technique, Sportive et Culturelle entre le Cameroun et le Commonwealth
du suivi des activités à caractère technique, sportif et culturel du Commonwealth ;
de la coordination de la participation du Cameroun aux travaux des instances et des organes à caractère technique, sportif et culturel ;
du suivi de l'application des décisions, déclarations et recommandations adoptées ainsi que de l'évaluation des résultats obtenus.
(2) IL comprend :
le Bureau de la Coopération Technique ;
le Bureau de la Coopération Sportive et Culturelle.
SECTION III
DE LA SOUS-DIRECTION DE LA COOPERATION SOCIALE ET NONGOUVERNEMENTALE
Art. 110 —  (1) Placée sous l'autorité d'un Sous-Directeur, la Sous-Direction de la Coopération Sociale et non-Gouvernementale est chargée :
de la Coopération Sociale et non-Gouvernementale entre le Cameroun et le Commonwealth
du suivi des activités à caractère social du Commonwealth et des activités des organisations et des instances non-gouvernementales du Commonwealth ;
de la coordination de la participation du Cameroun aux organes et instances à caractère social
du suivi de l'application des décisions, déclarations et recommandations adoptées ainsi que de l'évaluation des résultats obtenus
(2) Elle comprend:
le Service de la Coopération Sociale ;
le Service de la Coopération Non-Gouvernementale.
Art. 111 —  Placé sous l'autorité d'un Chef de Service, le Service de la Coopération Sociale est chargé :
de la coopération sociale entre le Cameroun et le Commonwealth ;
du suivi des activités à caractère social du Commonwealth ;
de la coordination de la participation du Cameroun aux travaux des instances et des organes à caractère social
du suivi de l'application des décisions, déclarations et recommandations adoptées ainsi que de l'évaluation des résultats obtenus
Art. 112 —  Placé sous l'autorité d'un Chef de Service, le Service de la Coopération Non-Gouvernementale est chargé, en liaison avec les administrations concernées :
de la coopération Non-Gouvernementale avec le Commonwealth ;
du suivi de la participation des organisations non-gouvernementales nationales aux instances du Commonwealth.
CHAPITRE IX
DE LA DIRECTION DE L'INFORMATION DE LA DOCUMENTATION ET DES ARCHIVES DIPLOMATIQUES
Art. 113 —  (1) Placée sous l'autorité d'un Directeur, la Direction de l'Information, de la Documentation et des Archives Diplomatiques est chargée, en liaison avec les administrations concernées :
de la collecte et de la diffusion auprès des départements ministériels des informations relatives aux Etats étrangers et aux organisations internationales qui pourraient faciliter l'action des services publics ;
de l'information des gouvernements étrangers et de leur opinion publique, ainsi que des organisations internationales sur le développement politique, économique, social et culturel du Cameroun ;
de l'alimentation et de la mise à. jour du site internet du Ministère, en relation avec la Cellule Informatique ;
de la promotion permanente de l'image de marque du Cameroun ;
de la mise en œuvre d'une politique concertée d'échange de visites d'agrément avec les agences de presse des pays étrangers.
En outre, elle est chargée :
de l'information régulière des services extérieurs sur les événements nationaux d'actualité ;
de la coordination de la rédaction et de la publication du bulletin d'informations et/ou de toutes autres publications intéressant le Ministère ;
de la prise de vue et de la conservation des images photographiques et audiovisuelles ;
de l'abonnement aux différentes revues et publications intéressant le Ministère ;
de la gestion et du fonctionnement de la bibliothèque du Ministère ;
de la conservation des archives diplomatiques.
(2) Elle comprend :
la Sous-Direction de l'Information ;
la Sous-Direction de la Documentation et des Archives Diplomatiques.
SECTION I
DE LA SOUS-DIRECTION DE L'INFORMATION
Art. 114 —  (1) Placée sous l'autorité d'un Sous-Directeur, la Sous-Direction de l'Information est chargée :
de l'information des missions diplomatiques et des postes consulaires du Cameroun à l'étranger sur les événements nationaux d'actualité ;
de la coordination au niveau du Département des activités visant à la promotion de l'image du Cameroun à l'étranger, en liaison avec les administrations concernées ;
de la production des supports écrits et audiovisuels d'information sur les activités du Délardement.
(2) Elle comprend :
le Service de l'Information et de la Presse
le Service des Activités Promotionnelles
le Service de l'Edition et de la Diffusion
Art. 115 —  (1) Placé sous l'autorité d'un Chef de Service, le Service de l'information et de la Presse est chargé :
de l'information régulière des services extérieurs sur les événements nationaux d'actualité ;
de la collecte et de la diffusion auprès des administrations intéressées, des informations relatives aux Etats étrangers et aux organisations internationales ;
de la coordination, de la rédaction et de la publication du bulletin d'informations et/ou de toutes autres publications intéressant le Ministère.
(2) Il comprend :
le Bureau de l'Information ;
le Bureau des Publications.
Art. 116 —  (1) Placé sous l'autorité d'un Chef de Service, le Service des Activités Promotionnelles est chargé :
de la promotion de l'image de marque du Cameroun, en liaison avec les autres administrations concernées
de la mise en œuvre d'une politique concertée d'échange de visites d'agrément avec les organes de presse des pays étrangers, en liaison avec les administrations concernées ;
du suivi des dossiers de demande de publications intéressant le Cameroun.
(2) Il comprend :
le Bureau des Relations Publiques ;
le Bureau des Activités Promotionnelles.
Art. 117 —  (1) Placé sous l'autorité d'un Chef de Service, le Service de l'Edition et de la Diffusion est chargé :
de la coordination des activités de production et de diffusion des supports d'information sur le Département ;
des prises d'images photographiques sur les activités du Département ;
des publications du Département et de leur diffusion ;
de la constitution, de la gestion et de la conservation d'une filmothèque du Ministère
de l'instruction des dossiers d'acquisition et de maintenance des équipements y afférents.
(2) Il comprend :
le Bureau de la Photographie ;
le Bureau de la Production et de la Diffusion ;
le Bureau de l'Acquisition et de la Maintenance des Equipements.
SECTION II
DE LA SOUS-DIRECTION DE LA DOCUMENTATION ET DES ARCHIVES DIPLOMATIQUES
Art. 118 —  (1) Placée sous l'autorité d'un Sous-Directeur, la Sous-Direction de la Documentation et des Archives Diplomatiques est chargée :
de la collecte, de la centralisation et de la conservation de la documentation diplomatique intéressant le Département ;
de la mise en place d'un système de classement de la documentation diplomatique ;
de l'organisation et du fonctionnement de la bibliothèque du Département ;
de l'acquisition et de la conservation des ouvrages ;
de l'abonnement aux différentes revues et publications intéressant le Ministère ;
du traitement et de la conservation des archives diplomatiques du Ministère ;
de la collecte et du versement des archives des missions diplomatiques et consulaires du Cameroun aux Archives Nationales
des relations avec les Archives Nationales.
(2) Elle comprend :
le Service de la Documentation et de la Bibliothèque ;
le Service des Archives Diplomatiques.
Art. 119 —  (1) Placé sous l'autorité d'un Chef de Service, le Service de la Documentation et de la Bibliothèque est chargé :
de l'organisation et de la mise en place d'un système de classement de la documentation administrative, diplomatique et technique ;
de la diffusion de la documentation technique pouvant faciliter l'action des services publics ;
de la gestion de ra bibliothèque du Ministère ;
de l'acquisition, de la gestion et de la conservation des ouvrages.
(2) Il comprend :
le Bureau de la Documentation ;
le Bureau de la Bibliothèque.
Art. 120 —  (1) Placé sous l'autorité d'un Chef de Service, le Service des Archives Diplomatiques est chargé :
de la collecte, de la centralisation et de la conservation des archives et des documents du Ministère ;
de la gestion et de la mise en forme des archives ;
des relations avec les Archives Nationales.
(2) Il comprend :
le Bureau des Fichiers;
le Bureau du Classement.
CHAPITRE X
DE LA DIRECTION DU PROTOCOLE ET DES AFFAIRES CONSULAIRES
Art. 121 —  (1) Placée sous l'autorité d'un Directeur, la Direction du Protocole et des Affaires Consulaires est chargée :
du protocole et du cérémonial diplomatiques au Ministère des Relations Extérieures;
de l'accueil et de l'encadrement des hôtes de marque du Ministère des Relations Extérieures
de l'accueil, de l'information et de l'orientation des usagers du Ministère ;
de la gestion et de l'encadrement protocolaire du corps diplomatique ;
de la protection consulaire des nationaux et de leurs intérêts à l'étranger ;
de l'instruction des dossiers relatifs aux passeports diplomatiques et de service, conformément à la réglementation en vigueur ;
de l'instruction des demandes de visas et de cartes diplomatiques, conformément à la réglementation en vigueur ;
de la protection consulaire des étrangers au Cameroun ;
des propositions de distinctions honorifiques à décerner aux personnalités étrangères séjournant ou en visite au Cameroun, en liaison avec la Grande Chancellerie des Ordres Nationaux ;
du suivi des questions liées aux réfugiés, aux activités du Haut Commissariat des Nations Unies pour les Réfugiés (HCR) et de l'Organisation Internationale pour les Migrations (OIM) ;
des questions de survol et d'atterrissage des aéronefs ; des mouvements des bâtiments et navires,
(2) Elle comprend :
la Sous-Direction du Protocole et du Cérémonial Diplomatiques ;
la Sous-Direction des Affaires Consulaires et des Réfugiés des Antennes Protocolaires et Consulaires.
SECTION I
DE LA SOUS-DIRECTION DU PROTOCOLE ET DU CEREMONIAL DIPLOMATIQUES
Art. 122 —  (1) Placée sous l'autorité d'un Sous-Directeur, la Sous-Direction du Protocole et du Cérémonial Diplomatiques est chargée :
de la conception, de l'organisation, de l'ordonnancement des cérémonies et des réceptions officielles ainsi que des conférences ;
de l'accueil des envoyés spéciaux et autres plénipotentiaires, en liaison avec les administrations concernées ;
de la tenue et de la mise à jour de la liste diplomatique ;
de l'organisation des audiences diplomatiques, en liaison avec les autres services compétents du Département ;
de l'encadrement du corps diplomatique à l'occasion des cérémonies auxquelles ne participe pas le Chef de l'Etat ;
de la liaison avec le corps diplomatique et les organisations internationales accréditées au Cameroun ;
de la rédaction des messages protocolaires ;
des propositions de distinctions honorifiques à décerner aux personnalités étrangères séjournant ou en visite au Cameroun, en liaison avec la Grande Chancellerie des Ordres Nationaux.
(2) Elle comprend :
le Service des Audiences Diplomatiques ;
le Service des Cérémonies et des Conférences ;
le Service des Invitations et de l'Etiquette ;
le Service de l'Accueil et de l'Orientation des Usagers ;
Art. 123 —  (1) Placé sous l'autorité d'un Chef de Service, le Service des Audiences Diplomatiques est chargé :
de toutes questions liées à l'accueil et à l'organisation des audiences diplomatiques, en liaison avec les administrations concernées ;
des propositions de décorations et de distinctions honorifiques à décerner aux personnalités étrangères, en liaison avec la Grande Chancellerie des Ordres Nationaux.
(2) Il comprend :
le Bureau de l'Accueil des Hôtes de Marque
le Bureau des Audiences Diplomatiques ;
le Bureau de Liaison avec les Services de la Grande Chancellerie des Ordres Nationaux.
Art. 124 —  (1) Placé sous l'autorité d'un Chef de Service, le Service des Cérémonies et des Conférences est chargé des questions relatives à l'organisation et au déroulement harmonieux des cérémonies et des conférences.
(2) Il comprend :
le Bureau des Cérémonies ;
le Bureau des Conférences.
Art. 125 —  (1) Placé sous l'autorité d'un Chef de Service, le Service des Invitations et de l'Étiquette est chargé :
de l'élaboration et de la mise à jour de la liste diplomatique ;
de la centralisation et de la distribution des invitations officielles.
(2) Il comprend :
le Bureau de la Liste Diplomatique et de l'Etiquette ;
le Bureau des Invitations Officielles.
Art. 126 —  (1) Placé sous l'autorité d'un Chef de Service, le Service de l'Accueil et de l'Orientation des Usagers est chargé de l'accueil, de l'information et de l'orientation des usagers.
(2) II comprend :
le Bureau des Huissiers ;
le Bureau de l'Orientation et de l'Information des Usagers
SECTION II
DE LA SOUS-DIRECTION DES AFFAIRES CONSULAIRES
Art. 127 —  (1) Placée sous l'autorité d'un Sous-Directeur, la Sous-Direction des Affaires Consulaires est chargée :
des questions consulaires ;
des privilèges et des immunités diplomatiques ;
du suivi des questions de sécurité des membres du corps diplomatique, en liaison avec les administrations concernées ;
de l'instruction des dossiers des passeports diplomatiques et de service, des visas et des cartes diplomatiques, conformément à la réglementation en vigueur ;
de l'encadrement consulaire des étrangers au Cameroun ;
du suivi des déplacements des diplomates étrangers à l'intérieur du Cameroun ;
de la protection consulaire des nationaux et de leurs intérêts à l'étranger.
(2) Elle comprend :
le Service des Affaires Consulaires ;
le Service des Etrangers au Cameroun ;
le Service des Réfugiés et des Migrants.
Art. 128 —  (1) Place sous l'autorité d'un Chef de Service, le Service des Affaires Consulaires est chargé :
des privilèges diplomatiques et consulaires, conformément aux conventions et à la réglementation en vigueur ;
du suivi des déplacements des diplomates et assimilés à intérieur du Cameroun ;
de l'instruction des dossiers des passeports diplomatiques et de service, des visas et des cartes diplomatiques ;
des litiges à caractère consulaire ;
des demandes relatives aux autorisations de survol et d'atterrissage des aéronefs camerounais et étrangers ainsi que des mouvements de bâtiments et navires camerounais et étrangers, en liaison avec les administrations concernées.
(2) Il comprend :
le Bureau des Privilèges et des Immunités Diplomatiques ;
le Bureau des Affaires Consulaires ;
le Bureau de Survol, d'Atterrissage des Aéronefs et des Mouvements des Bâtiments et Navires.
Art. 129 —  (1) Placé sous ['autorité d'un Chef de Service, le Service des Etrangers au Cameroun est chargé :
de l'assistance consulaire des Etrangers résidant au Cameroun, en liaison avec les administrations concernées ;
de la tenue et de la mise à jour du fichier des étrangers au Cameroun, en liaison avec les administrations concernées.
(2) Il comprend :
le Bureau de l'Assistance Consulaire des Etrangers au Cameroun ;
le Bureau du Fichier des Etrangers au Cameroun.
Art. 130 —  (1) Placé sous l'autorité d'un Chef de Service, le Service des Réfugiés et des Migrants est chargé :
du suivi des questions liées aux réfugiés et aux migrants ;
du suivi des activités du Haut Commissariat des Nations Unies pour les Réfugiés (HCR) et de l'Organisation Internationale des Migrations (OIM), en liaison avec les administrations concernées.
(2) Il comprend :
le Bureau des Réfugiés et des Migrants ;
le Bureau du Suivi des Activités du HCR et de l'OIM.
SECTION III
DES ANTENNES PROTOCOLAIRES ET CONSULAIRES
Art. 131 —  (1) Les Antennes Protocolaires et ou Consulaires sont des services déconcentrés de la Direction du Protocole et des Affaires Consulaires. Elles ont pour missions d'assurer, dans leur circonscription de compétence, l'accueil des hôtes du gouvernement et de l'encadrement protocolaire des corps consulaires et des représentants des organisations internationales installées dans Leur ressort de compétence.
(2) Elles sont créées par décret du Président de la République qui en fixe les attributions et le ressort de compétence.
SECTION IV
DE L'ANTENNE PROTOCOLAIRE ET CONSULAIRE DE DOUALA
Art. 132 —  (1) Placée sous l'autorité d'un Chef d'Antenne, l'Antenne Protocolaire et Consulaire de Douala est chargée :
de l'accueil des hôtes du Gouvernement en transit à Douala en liaison avec la Présidence de la République et les Services du Gouverneur de la Province du Littoral ;
de l'encadrement protocolaire du corps consulaire et des représentants des organisations internationales installées à. Douala ;
de la préparation des programmes d'accueil et de séjour des délégations étrangères officielles dans la province du Littoral, en liaison avec les administrations concernées ;
de l'instruction au premier degré des questions administratives et consulaires dans le ressort de compétence ;
de la délivrance éventuelle des visas de courtoisie, conformément à la réglementation en vigueur.
(2) Elle comprend :
le Service des Affaires Protocolaires ;
le Service des Affaires Consulaires ;
le Bureau des Affaires Générales.
Art. 133 —  (1) Places sous l'autorité d'un Chef de Service, le Service, des Affaires Protocolaires est chargé :
de l'accueil des hôtes du Gouvernement en transit à Douala, en liaison avec les administrations concernées et les Services du Gouverneur de la Province du Littoral ;
de la préparation des programmes d'accueil et de séjour des délégations étrangères officielles dans la province du Littoral, en liaison avec les services du Gouverneur ;
de l'encadrement protocolaire du corps consulaire et. des représentants des organisations internationales installées Douala.
(2) Il comprend :
le Bureau de l'Accueil des Hôtes de Marque ;
le Bureau de l'Encadrement Protocolaire.
Art. 134 —  (1) Placé sous l'autorité d'un Chef de Service, le Service des Affaires Consulaires est chargé :
de l'instruction des affaires consulaires ;
du suivi de la délivrance des visas de courtoisie, conformément à la réglementation en vigueur.
(2) Il comprend :
le Bureau des Affaires Consulaires ;
le Bureau du Visas,
CHAPITRE XI
DE LA DIRECTION DES AFFAIRES GENERALE.S
Art. 135 —  (1) Placée sous l'autoritéd'un Directeur, la Direction des Affaires Générales est chargée :
de la mise en œuvre de la politique de gestion des ressources humaines du Ministère, sans préjudice des dispositions de l'article 16 du présent décret ;
de l'instruction des dossiers relatifs à la gestion des carrières: à la formation continue du personnel ainsi qu'à l'organisation de séminaires et stages de perfectionnement ;
de l'élaboration et de l'exécution du Budget ;
du suivi de l'exploitation des applications informatiques du Système Intégré de Gestion Informatique des Personnels de l'Etat et de la Solde (SIGIPES) ;
de la gestion et de la maintenance des biens meubles et immeubles du Département, en liaison avec les administrations concernées.
(2) Elle comprend :
La Cellule de Gestion du Projet SIGIPES (Système Intégré de Gestion Informatique des Personnels de 1:Etat et de la Solde)
la Sous-Direction des Personnels et de la Solde ;
la Sous-Direction du Budget, du Matériel et de la Maintenance.
SECTION I
DE LA CELLULE DE GESTION DU PROJET SIGIPES
Art. 136 —  (1) Placée sous l'autorité d'un Chef de Cellule, la Cellule de Gestion du Projet SIGIPES est chargée :
de la centralisation et la mise à jour permanente des fichiers du personnel et de la solde ;
de l'édition des documents de la solde;
de l'exploitation et de la maintenance des applications informatiques de la Sous-Direction des Personnels et de la Solde.
(2) Elle comprend, outre le Chef de Cellule, deux On) Chargés d' Etudes-Assistants.
SECTION II
DE LA SOUS-DIRECTION DES PERSONNELS ET DE LA SOLDE
Art. 137 —  (1) Placée sous l'autorité d'un Sous-Directeur, la Sous-Direction des Personnels et de la Solde est chargée :
de la gestion du personnel sans préjudice des dispositions de l'article 16 du présent décret ;
de la mise à jour systématique du fichier du personnel ;
de la gestion prévisionnelle des effectifs, en liaison avec le Ministère chargé de la fonction publique ;
de l'exploitation des applications informatiques du projet SIGIPES ;
de la préparation des éléments de la solde et des accessoires de solde ;
de la préparation des actes de gestion des personnels ; de la gestion des postes de travail ; de la formation continue du personnel ;
de l'action sociale et de l'appui à la vie associative et culturelle ;
de l'instruction des dossiers de récompenses, de décorations et de distinctions honorifiques ;
de la préparation et de l'instruction des dossiers disciplinaires.
(2) Elle comprend :
le Service du Personnel des Services Centraux ;
le Service du Personnel des Services Extérieurs le Service de la Solde
le Service de la Formation et des Stages ;
le Service de l'Action Sociale et de la Vie Associative et Culturelle
Art. 138 —  (1) Placé sous l'autorité d'un Chef de Service, le Service du Personnel des Services Centraux est chargé :
de la préparation des actes relatifs à la gestion des personnels des services centraux ;
de la gestion prévisionnelle des effectifs en liaison avec les administrations compétentes ;
de la gestion des postes de travail ;
