URL,text,page_title,page_label,category,metadata
https://www.juriafrica.com/lex/decret-2003-325-27-nov-2003-16088.htm,"DECRET N° 2003/325 DU 27 NOVEMBRE 2003 HABILITANT LE MINISTRE DES AFFAIRES ECONOMIQUES, DE LA PROGRAMMATION ET DE L'AMÉNAGEMENT DU TERRITOIRE À SIGNER AVEC LE FONDS DE L'OPEP POUR LE DÉVELOPPEMENT INTERNATIONAL UN ACCORD DE PRÊT D'UN MONTANT DE 6,7 MILLIONS DE DOLLARS US SOIT ENVIRON 4,02 MILLIARDS DE FRANCS CFA POUR LE FINANCEMENT PARTIEL DU PROJET DE L'HÔPITAL DE SANGMÉLIMA.

LE PRESIDENT DE LA REPUBLIQUE,
Vu la Constitution
Vu la loi n° 2002/014 du 30 décembre 2002 portant loi de Finances de la République du Cameroun pour l'exercice 2003;
Vu le décret n° 2002/216 du 24 août 2002 portant réorganisation du Gouvernement;
Vu le décret n° 2002/217 du 24 août 2002 portant réaménagement du Gouvernement;
DECRETE:
Art. 1er —  Le Ministre des Affaires Economiques, de la Programmation et de l'Aménagement du Territoire est habilité, avec faculté de délégation, à signer avec le Fonds de l'OPEP pour le Développement International, un Accord de prêt d'un montant de 6,7 millions de dollars US soit environ 4,02 milliards de francs CFA pour le financement partiel du projet de l'Hôpital de Sangmélima.
Art. 2 —  Le présent décret sera enregistré et publié suivant la procédure d'urgence, puis inséré au Journal Officiel en français et en anglais.",DECRET_N_2003_325_DU_27_NOVEMBRE_2003_HABILITANT_LE_MINISTRE_DES_AFFAIRES_ECONOMIQUES_DE_LA_PROGRAMMATION_ET_DE_L_AMENAGEMENT_DU_TERRITOIRE_A_SIGNER_AVEC_LE_FONDS_DE_L_OPEP_POUR_LE_DEVELOPPEMENT_INTERNATIONAL_UN_ACCORD_DE_PRET_D_UN_MONTANT_DE_6_7_MILLIONS_DE_DOLLARS_US_SOIT_ENVIRON_4_02_MILLIARDS_DE_FRANCS_CFA_POUR_LE_FINANCEMENT_PARTIEL_DU_PROJET_DE_L_HOPITAL_DE_SANGMELIMA,0,decret,
