URL,text,page_title
https://www.juriafrica.com/lex/decret-2020-319-22-juin-2020-49015.htm,"LE PRESIDENT DE LA REPUBLIQUE,
Vu la Constitution ;
Vu la loi n°2019/023 du 24 décembre 2019 portant loi de finances de la République du Cameroun pour l'exercice 2020 ;
Vu le décret n°2011/408 du 09 décembre 2011 portant organisation du Gouvernement, modifié et complété par le décret n°2018/190 du 02 mars 2018 ;
Vu le décret n°2020/126 du 17 mars 2020 habilitant le Ministre de l'Economie, de la Planification et de l'Aménagement du Territoire à signer avec la Banque Africaine de Développement (BAD), un Accord de Prêt d'un montant de 217,9 millions d'euros, soit environ 142,93 milliards de francs CFA, pour le financement partiel du Projet d'Interconnexion des Réseaux Electriques du Cameroun et du Tchad,
DECRETE:
Art. 1er —  Est ratifié, l'Accord de Prêt n°2000200002101 d'un montant de 217,9 millions d'euros, soit environ 142,93 milliards de francs CFA, conclu le 03 avril 2020 entre la République du Cameroun et la Banque Africaine de Développement (BAD), pour le financement partiel du Projet d'Interconnexion des Réseaux Electriques du Cameroun et du Tchad.
Art. 2 —  Le présent décret sera enregistré, publié suivant la procédure d'urgence, puis inséré au Journal Officiel en français et en anglais. /-","DECRET_N°2020_319_DU_22_JUIN_2020_RATIFIANT_L'ACCORD_DE_PRET_N°2000200002101_D'UN_MONTANT_DE_217,9_MILLIONS_D'EUROS,_SOIT_ENVIRON_142,93_MILLIARDS_DE_FRANCS_CFA,_POUR_LE_FINANCEMENT_PARTIEL_DU_PROJET"
