URL,text,page_title,page_label,category,metadata
https://www.juriafrica.com/lex/decret-2003-350-13-dec-2003-16093.htm,"DECRET N° 2003/350 DU 13 DECEMBRE 2003 HABILITANT LE MINISTRE DES AFFAIRES ECONOMIQUES, DE LA PROGRAMMATION ET DE L'AMÉNAGEMENT DU TERRITOIRE À SIGNER AVEC LA BANQUE ISLAMIQUE DE DÉVELOPPEMENT UN ACCORD DE PRÊT D'UN MONTANT DE 7 MILLIONS DE DINARS ISLAMIQUES SOIT ENVIRON 6,363 MILLIARDS DE FRANCS CFA, POUR LE FINANCEMENT DU PROJET DE CONSTRUCTION ET D'ÉQUIPEMENT DES HÔPITAUX DE DISTRICT ET DES CENTRES DE SANTÉ DANS QUATRE PROVINCES DU CAMEROUN.

LE PRESIDENT DE LA REPUBLIQUE,
Vu la Constitution ;
Vu la loi n° 2002/014 du 30 décembre 2002 portant loi de Finances de la République du Cameroun pour l'exercice 2003 ;
Vu le décret n° 2002/216 du 24 août 2002 portant réorganisation du Gouvernement
Vu le décret n° 2002/217 du 24 août 2002 portant réaménagement du Gouvernement ;
DECRETE
Art. 1er —  Le Ministre des Affaires Economiques, de la Programmation et de l'Aménagement du Territoire est habilité, avec faculté de délégation, à signer avec la Banque Islamique de Développement un Accord de prêt d'un montant de 7 millions de Dinars Islamiques soit environ 6,363 milliards de francs CFA, pour le financement du projet de construction et d'équipement des hôpitaux de district et des centres de santé dans quatre provinces du Cameroun.
Art. 2 —  Le présent décret sera enregistré et publié suivant la procédure d'urgence, puis inséré au Journal Officiel en français et en anglais.",DECRET_N_2003_350_DU_13_DECEMBRE_2003_HABILITANT_LE_MINISTRE_DES_AFFAIRES_ECONOMIQUES_DE_LA_PROGRAMMATION_ET_DE_L_AMENAGEMENT_DU_TERRITOIRE_A_SIGNER_AVEC_LA_BANQUE_ISLAMIQUE_DE_DEVELOPPEMENT_UN_ACCORD_DE_PRET_D_UN_MONTANT_DE_7_MILLIONS_DE_DINARS_ISLAMIQUES_SOIT_ENVIRON_6_363_MILLIARDS_DE_FRANCS_CFA_POUR_LE_FINANCEMENT_DU_PROJET_DE_CONSTRUCTION_ET_D_EQUIPEMENT_DES_HOPITAUX_DE_DISTRICT_ET_DES_CENTRES_DE_SANTE_DANS_QUATRE_PROVINCES_DU_CAMEROUN,0,decret,
