URL,text,page_title,page_label,category,metadata
https://www.juriafrica.com/lex/decret-87-1872-16-decembre-1987-16373.htm,"DECRET N° 87/1872 DU 16 DÉCEMBRE 1987 - PORTANT APPLICATION DE LA LOI N° 85-9 DU 04 JUILLET 1985 RELATIVE A L'EXPROPRIATION POUR CAUSE D'UTILITE PUBLIQUE ET AUX MODALITES D'INDEMNISATION

Le Président de la République,
Vu la constitution ;
Vu l'ordonnance n° 74-1 du 6 juillet 1974 fixant le régime foncier ;
Vu la loi n° 85-9 du 4 juillet 1985 relative à l'expropriation pour cause d'utilité publique et aux modalités d'indemnisation,
Décrète :
Art. premier —  Le Président décret fixe les modalités d'application de loi n° 85-9 du 4 juillet 1985 susvisée, notamment en ce qui concerne la procédure d'expropriation et celle d'indemnisation.
TITRE I
De la procédure d'expropriation.
Chapitre I
De l'expropriation engagée à la demande des services publics
Section I
Du déclenchement de la procédure
Art. 2 —  Tout département ministériel désireux d'entreprendre une opération d'utilité publique saisit le Ministre chargé des domaines d'un dossier préliminaire en deux exemplaires comprenant :
une demande assortie d'une note d'explicative indiquant l'objet de l'opération ;
une fiche dégageant les caractéristiques principales des équipements à réaliser et précisant notamment :
la superficie approximative du terrain sollicité dûment justifiée,
l'appréciation sommaire du coût du projet y compris les frais d'indemnisation,
la date approximative de démarrage des travaux,
la disponibilité des crédits d'indemnisation avec indication de l'imputation budgétaire ou de tous autres moyens d'indemnisation.
Art. 3 —  (1) Dès réception du dossier, le ministre chargé des domaines apprécie le bien fondé des justifications du projet.
(2) Lorsqu'il juge le projet d'utilité publique, il prend un arrêté déclarant d'utilité publique les travaux projetés et définissant le niveau de compétence de la commission chargée de l'enquête d'expropriation dite commission de constat et d'évaluation.
Section 2
De la commission de constat et d'évaluation
Art. 4 —  La commission de constat et d'évaluation est chargée au niveau national provincial ou départemental sur décision du Ministre de l'urbanisme et de l'habitat :
de choisir de faire borner les terrains concernés, aux frais du bénéficiaire ;
de constater les droits et d'évaluer les biens mis en cause,
d'identifier leurs titulaires et propriétaires ;
de faire poser les panneaux indiquant le périmètre de l'opération, aux frais du bénéficiaire.
Art. 5 —  La commission de constat et d'évaluation comprend :
(1) Au niveau départemental :
Président : le préfet ou son représentant
Secrétaire : le responsable du service départemental des domaines
Membres :
le responsable du service départemental du cadastre
Le responsable du service local de l'urbanisme et de l'habitat
Le responsable compétent des mines et de l'énergie
Le responsable du service département de l'agriculture
Le responsable du service départemental des routes
Le représentant du service ou l'organisme demandeur
Le ou les député (s) concerné (s)
Le ou les magistrat (s) municipal (aux) concerné (s)
La ou les autorité (s) traditionnelle (s) concernée (s).
(2) Au niveau provincial :
Président : Le gouverneur ou son représentant
Secrétaire des domaines
Membres : le ou les préfet (s) concerné (s) ou leur représentants
le responsable service provincial du cadastre
le responsable service provincial de l'agriculture
le responsable service provincial de l'urbanisme et de l'habitat
le responsable service provincial chargé des mines
le responsable service provincial des routes
le responsable service ou de l'organisme demandeur
le ou les député (s) concerné (s)
le ou les magistrat(s) municipal (aux)concerné (s) - la ou les autorité (s) traditionnelle (s) concernée (s).
(3) Au niveau national :
Président : le ministre chargé des domaines ou son représentant
Secrétaire le directeur des domaines ou son représentant
Membres :
le ou les préfet (s) concerné (s)
le directeur du cadastre ou son représentant
un représentant du ministre de l'agriculture
un représentant du ministre des mines
le directeur de l'habitat ou son représentant
le représentant du service ou de l'organisme demandeur
le ou les député (s) concerné (s)
la ou autorité (s) traditionnelle (s) concernée (s)
Art. 6 —  Ces commissions sont nommées :
au niveau de département, par arrêté préfectoral,
au niveau provincial, par arrêté du gouverneur,
au niveau national, par arrêté du ministre chargé des domaines.
Art. 7 —  (1) La commission se réunit en tant que besoin sur convocation de son président.
(2) La convocation et l'ordre du jour doivent être adressés à chaque membre au moins 15 jours avant la date de la réunion
(3) Le quorum est de 2/3 des membres.
(4) Les décisions sont prises à la majorité simple des membres présents.
(5) En cas de partage de voix celle du présent est prépondérante.
Art. 8 —  Les fonctions de membres de commission de constat et d'évaluation sont gratuites. Toutefois, il peut en cas de disponibilités budgétaires être alloué aux intéressés une indemnité de session fixée par arrêté du ministre chargé des domaines.
Les frais de fonctionnement de cette commission sont inscrits dans le budget du ministre chargé des domaines.
La fourniture et la pose des bornes et des panneaux sont à la charge du service ou de l'organisme demandeur.
Section 3
De l'enquête
Art. 9 —  Dès réception de l'arrêté déclarant les travaux d'utilité publique, le président de la commission de constat et d'évaluation le notifie aux préfets (s) et magistrat (s) municipal (aux) de la localité concernée.
Une fois saisi, le préfet, en assure la publicité par voie d'affichage à la préfecture, au service départemental des domaines à la mairie, à la sous-préfecture, au chef-lieu du district et à la chefferie du lieu de situation du terrain, ainsi que par tous les autres moyens jugés nécessaires en raison de l'importance de l'opération.
Art. 10 —  En vue de leur participation à toutes les phases de l'enquête, les populations concernées sont informées au moins 30 (trente) jours à l'avance du jour et de l'heure de l'enquête par convocations adressées aux chefs et notables et par les moyens indiqués à l'article précédent.
Art. 11 —  L'enquête est menée dans toutes les phases en présence des propriétaires du fonds et des biens qu'il supporte, ainsi que des notabilités du lieu et des populations, par l'ensemble de la commission, sous réserve des règles de quorum fixées à l'article 7 ci-dessus.
Toutefois la commission peut après avoir au préalable arrêté elle-même la liste exhaustive des propriétaires des biens à détruire, constituer une sous-commission technique de 3 (trois) membres au moins à l'effet d'expertiser une catégorie de ces biens.
Le travail de la sous-commission est exécuté sous la responsabilité et le contrôle de la commission entière qui en contresigne les documents.
Art. 12 —  A la fin de l'enquête, la commission de constat et d'évaluation produit :
un procès-verbal d'enquête relatant tous les incidents éventuels ou observations des personnes évincées signé de tous les membres présents ;
un procès-verbal de bornage et de plan parcellaire du terrain retenu, établis par le géomètre membre de la commission ;
un état d'expertise des cultures signé de tous les membres de la commission ;
un état d'expertise des constructions et de toute autre mise en valeur signé des tous les membres de la commission.
Pour la préparation du décret d'expropriation, le Président de la commission de constat et d'évaluation transmet au ministre chargé des domaines dès fin des travaux d'enquête un dossier comprenant :
l'arrêté désignant nommément les membres de la commission,
les différentes pièces ci-dessus énumérées.
Art. 13 —  L'arrêté de déclaration d'utilité publique devient caduc, si, dans un délai de 2 (deux) ans à compter de la date de sa notification au service ou organisme bénéficiaire, il n'est pas suivi d'expropriation effective.
Toutefois, sa validité peut être prorogée une seule fois par arrêté du ministre chargé des domaines pour une durée n'excédant pas un (1) an.
Les arrêtés de déclaration d'utilité publique en vigueur à la date de publication du présent décret resteront en vigueur pendant une période de deux ans non susceptible de prorogation.
Art. 14 —  Conformément aux dispositions de l'article 5 de la loi n° 85-9 du 4 juillet 1985, l'arrêté de la déclaration d'utilité publique est suspensif de toute transaction, de toute mise en valeur, et de toute délivrance de permis de construire.
Toutefois il ne fait pas obstacle à la poursuite des procédures d'immatriculation du domaine national de première catégorie au profit de leurs occupants ou de leurs exploitants.
Chapitre II
De l'expropriation engagée à la demande d'autres personnes morales de droit public
Art. 15 —  Avant le recours à l'expropriation pour cause d'utilité publique en faveur des collectivités publiques locales, des établissements publics, des concessionnaires de services publics ou de sociétés d'Etat en vue de la réalisation des travaux d'intérêt général ces derniers doivent procéder aux négociations préalables avec les propriétaires ou ayant-droits concernés.
En cas de désaccord, les résultats desdites négociations sont soumis à l'arbitrage du ministre chargé des domaines.
En cas d'arbitrage infructueux, il est procédé à l'expropriation aux frais du bénéficiaire dans les conditions prévues ci-dessus.
Art. 16 —  Les personnes morales de droit public visées à l'article précédent doivent en cas d'aboutissement des négociations se conformer aux règles d'acquisition de droit commun.
TITRE II
De la procédure d'indemnisation
Art. 17 —  Outre le montant des indemnités d'expropriation fixé conformément aux dispositions de l'article 3 (2) de la loi n° 85-9 susvisée le décret d'expropriation désigne l'autorité chargée de prendre la décision de mandatement des crédits correspondants.
Art. 18 —  Les indemnités d'expropriation sont supportées par la personne morale de droit public, bénéficiaire de l'opération.
En ce qui concerne l'Etat, elles sont supportées par le budget du département ministériel ayant sollicité l'expropriation.
Art. 19 —  En cas d'omission, les personnes intéressées saisissent le préfet, le gouvernement ou le ministre chargé des domaines, selon les règles de compétence fixées à l'article 6 ci-dessus lequel soumet la réclamation à l'examen de la commission de constat et d'évaluation.
Art. 20 —  Le présent décret sera enregistré, puis publié au journal officiel en français et en anglais.",DECRET_N_87_1872_DU_16_DECEMBRE_1987_PORTANT_APPLICATION_DE_LA_LOI_N_85_9_DU_04_JUILLET_1985_RELATIVE_A_L_EXPROPRIATION_POUR_CAUSE_D_UTILITE_PUBLIQUE_ET_AUX_MODALITES_D_INDEMNISATION,0,decret,
