URL,text,page_title,page_label,metadata
https://www.juriafrica.com/lex/decret-98-005-9-janv-1998-16744.htm,"LE PRESIDENT DE LA REPUBLIQUE,
Vu la Constitution;
Vu la loi n° 97/014 du 18 juillet 1997 portant Loi de Finances de la République du Cameroun pour l'exercice 1997/1998 ;
Vu le décret n°97/205 du 07 décembre 1997 portant organisation du Gouvernement;
Vu le décret n° 97/207 du 07 décembre 1997 portant nomination des membres du Gouvernement;
DECRETE:
Art. 1er —  Le Ministre des Investissements Publics et de l'Aménagement du Territoire est habilité, avec faculté de délégation, à signer avec le Fonds Africain de Développement un accord de prit d'un montant de 14,10 millions UC, soit environ 11,280 Milliards de F.CFA, destiné au financement du Projet de Réduction de la Pauvreté et d'Action en Faveur des Femmes.
Art. 2 —  Le présent décret sera enregistré, publié selon la procédure d'urgence, puis inséré au Journal Officiel en anglais et en français.",DECRET_N_98_005_DU_09_JANVIER_1998_HABILITANT_LE_MINISTRE_DES_INVESTISSEMENTS_PUBLICS_ET_DE_L_AMENAGEMENT_DU_TERRITOIRE_A_SIGNER_AVEC_LE_FONDS_AFRICAIN_DE_DEVELOPPEMENT_UN_ACCORD_DE_PRET_DE_14_10_MILLIONS_UC_SOIT_ENVIRON_11_280_MILLIARDS_DE_FCFA_POUR_LE_FINANCEMENT_DU_PROJET_DE_REDUCTION_DE_LA_PAUVRETE_ET_D_ACTION_EN_FAVEUR_DES_FEMMES,0,
