URL,text,page_title,page_label,metadata
https://www.juriafrica.com/lex/decret-2013-297-09-septembre-2013-18020.htm,"Le président de la République, décrète:
Art. 1er —  Les dispositions de l'article 3 du décret n°2013/092 du 3 avril 2013 susvisé sont modifiées et complétées ainsi qu'il suit:
Art. 3 (nouveau).-  —  (1) L'Agence est chargée, en liaison avec les administrations et les organismes publics et privés concernés, de :
la mise en oeuvre de la stratégie sectorielle en matière de promotion et de développement des petites et moyennes entreprises;
la facilitation des formalités de création d'entreprises;
l'assistance et le conseil des porteurs d'idées et de projets en matière de création d'entreprises;
l'encadrement des entreprises dans la mise en place d'outils de gestion adaptés à leurs besoins organisationnels, techniques, financiers, commerciaux ou technologiques;
le renforcement des compétences managériales des responsables des petites et moyennes entreprises par l'information, la formation, le parrainage et le compagnonnage;
la mise en place d'une banque de données de projets à la disposition des promoteurs de petites et moyennes entreprises;
la promotion, en relation avec les institutions et organismes concernés, de l'innovation technologique, de l'usage par les petites et moyennes entreprises des résultats de la recherche et des actifs de la propriété intellectuelle;
la mise en place d'un observatoire des petites et moyennes entreprises; - l'établissement des relations de partenariat avec les structures nationales ou internationales intervenant en faveur des petites et moyennes entreprises ;
la facilitation de l'accès des petites et moyennes entreprises au financement de leurs activités;
la réalisation des études de marché et des choix stratégiques pour le développement des petites et moyennes entreprises;
la facilitation de la création et du développement des réseaux de petites et moyennes entreprises;
la promotion des structures publiques d'incubation des petites et moyennes entreprises;
l'assistance aux petites et moyennes entreprises dans la mise en oeuvre des investissements;
la facilitation de l'accès des petites et moyennes entreprises aux marchés; la facilitation des relations de partenariat entre les petites et moyennes entreprises et les grandes entreprises.
(2) L'Agence assure également pour les petites et moyennes entreprises locales, d'une part, les services publics auxquels ont droit les entreprises qui sollicitent ou ont obtenu le bénéfice d'un des régimes de la charte des investissements et, d'autre part, le suivi des entreprises bénéficiaires des avantages de ladite charte et de la loi fixant les incitations à l'investissement privé en République du Cameroun.
A cet effet, l'Agence est notamment chargée:
de recevoir les dossiers de demande d'agrément à l'un des régimes prévus par la charte des investissements;
d'instruire les dossiers reçus et de les transmettre au Ministre chargé des finances pour avis, dans les délais prévus par la loi ;
d'obtenir les visas nécessaires à l'exécution des programmes d'investissement proposés par l'entreprise pour la période de validité de l'acte d'agrément;
d'obtenir les visas nécessaires pour le personnel étranger pendant la durée de validité de l'acte d'agrément;
d'assister les entreprises agréées dans les démarches nécessaires à l'exécution des programmes d'investissement, y compris l'accès aux installations publiques y afférentes ;
d'établir, en liaison avec les services techniques compétents, des procédures administratives simplifiées par type d'activité.
L'Agence assure en outre l'exécution des programmes élaborés avec le concours des bailleurs de fonds, ainsi que le suivi-et le contrôle des petites et moyennes entreprises bénéficiaires des crédits ou d'appuis des pouvoirs publics dans le cadre du développement des entreprises.
Pour l'accomplissement des missions visées à l'alinéa 2 ci-dessus, l'Agence dispose d'un Guichet Unique dont l'organisation et le fonctionnement sont fixés par arrêté du Ministre chargé des petites et moyennes entreprises. »
Art. 2 —  Le présent décret sera enregistré, publié suivant la procédure d'urgence, puis inséré au Journal Officiel en français et en anglais.",DECRET_N_2013_297_DU_09_SEPTEMBRE_2013_MODIFIANT_ET_COMPLETANT_CERTAINES_DISPOSITIONS_DU_DECRET_N_2013_092_DU_03_AVRIL_2013_PORTANT_ORGANISATION_ET_FONCTIONNEMENT_DE_L_AGENCE_DE_PROMOTION_DES_PETITES_ET_MOYENNES_ENTREPRISES,0,
