URL,text,page_title,page_label,category,metadata
https://www.juriafrica.com/lex/decret-2022-109-04-mars-2022-50844.htm,"DECRET N°2022/109 DU 04 MARS 2022 RATIFIANT L'ACCORD DE PRÊT D'UN MONTANT DE 42,60 MILLIONS D'EUROS, SOIT ENVIRON 27,95 MILLIARDS DE FRANCS CFA, CONCLU LE 30 DÉCEMBRE 2021 ENTRE LA RÉPUBLIQUE DU CAMEROUN ET LA BANQUE AFRICAINE DE DÉVELOPPEMENT (BAD), POUR LE FINANCEMENT PARTIEL DU PROJET D'AMÉNAGEMENT DE LA ROUTE NATIONALE N°11, LA « RING ROAD ».-

LE PRESIDENT DE LA REPUBLIQUE,
Vu la Constitution ;
Vu la loi n°2021/026 du 16 décembre 2021 portant loi de finances de la République du
Cameroun pour l'exercice 2022 ;
Vu le Décret n°2011/408 du 09 décembre 2011 portant organisation du Gouvernement, modifié et complété par le décret n°2018/190 du 02 mars 2018 ;
Vu le décret n°2021/749 du 28 décembre 2021 habilitant le Ministre de l'Economie, de la Planification et de l'Aménagement du Territoire, à signer avec la Banque Africaine de Développement (BAD), un Accord de Prêt d'un montant de 42,60 millions d'euros, soit environ 27,95 milliards de francs CFA, pour le financement partiel du Projet d'aménagement de la Route Nationale N°11, la « Ring Road »,
DECRETE:
Art. 1er  —  Est ratifié, l'Accord de Prêt d'un montant de 42,60 millions d'euros, soit environ 27,95 milliards de francs CFA, conclu le 30 décembre 2021 entre la République du Cameroun et la Banque Africaine de Développement (BAD), mobilisés avec le concours de Africa Growing Together Fund (AGTF), pour le financement partiel du Projet d'aménagement de la Route Nationale N°11, la « Ring Road ».
Art. 2 —  Le présent décret sera enregistré, publié suivant la procédure d'urgence, puis inséré au Journal Officiel en français et en anglais. /-",DECRET_N_2022_109_DU_04_MARS_2022_RATIFIANT_L_ACCORD_DE_PRET_D_UN_MONTANT_DE_42_60_MILLIONS_D_EUROS_SOIT_ENVIRON_27_95_MILLIARDS_DE_FRANCS_CFA_CONCLU_LE_30_DECEMBRE_2021_ENTRE_LA_REPUBLIQUE_DU_CAMEROUN_ET_LA_BANQUE_AFRICAINE_DE_DEVELOPPEMENT_BAD_POUR_LE_FINANCEMENT_PARTIEL_DU_PROJET_D_AMENAGEMENT_DE_LA_ROUTE_NATIONALE_N_11_LA_RING_ROAD,0,decret,
