URL,text,page_title
https://www.juriafrica.com/lex/decret-2002-161-24-juin-2002-15945.htm,"LE PRESIDENT DE LA REPUBLIQUE,
VU la Constitution
VU la loi n°2001/008 du 30 juin 2001 portant loi de finances de la République du Cameroun pour I'exercice budgétaire 2001/2002
VU le décret n°97/205 du 07 décembre 1997 portant organisation du Gouvernement. modifié et complété par le décret n°98/067 du 28 avril 1998 :
VU le décret n° 97/207 du 07 décembre 1997 portant formation du Gouvernement et ses divers modificatifs
DECRETE:
Art. 1er —  Le Ministre des Investissements Publics et de l'Aménagement du Territoire est habilité, avec faculté de délégation. à signer avec la Banque Arabe pour le Développement Economique en Afrique un accord de prêt d'un montant de 14.000.000 (quatorze millions) de dollars US. soit environ 10.5 milliards de francs CFA. pour le financement partiel du projet de route Ayos-Bonis.
Art. 2 —  Le présent décret sera enregistré et publié suivant la procédure d urgence. puis au Journal Officiel en français et en anglais./-",DECRET_N°_2002_161_DU_24_JUIN_2002_HABILITANT_LE_MINISTRE_DES_INVESTISSEMENTS_PUBLICS_ET_DE_L_AMENAGEMENT_DU_TERRITOIRE_À_SIGNER_AVEC_LA_BANQUE_ARABE_POUR_LE_DEVELOPPEMENT_ECONOMIQUE_EN_AFRIQUE_UN
