URL,text,page_title
Dans ce cas, après approbation des parties concernées de l'emprise foncière par le Comité de Pilotage et de Suivi des Pipelines, celui-ci invite le postulant à procéder, pendant l'instruction de son dossier et conformément aux dispositions de l'article 31 du présent décret, au bornage des parties de l'emprise foncière approuvée, et l'enquête d'expropriation est effectuée à l'issue dudit bornage. Le décret d'incorporation des terrains dans le Domaine Privé de l'Etat et le décret d'affectation des terrains ainsi incorporés sont alors pris par département ou groupe de départements le cas échéant, et il est fait recours à la procédure d'urgence pour l'envoi en possession. Ces décrets sont ensuite modifiés pour incorporer et pour affecter les autres parties de l'emprise foncière approuvée au fur et à mesure des mises à disposition des terrains. Sous réserve du respect des délais d'envoi en possession, les décrets d'incorporation et d'affectation relatifs aux premiers départements concernés peuvent être pris dans les meilleurs délais après la publication du décret octroyant l'Autorisation de Transport par Pipeline ou, le cas échéant, en même temps que celui-ci.
2. Dans le cadre des opérations visées à l'article 14.2 du présent décret et pour l'application des dispositions du Décret N° 87/1872 du 16 décembre 1987 relatif à l'expropriation pour cause d'utilité publique, la compétence de la Commission de constat et d'évaluation se limite au niveau national et au niveau départemental. Au niveau national, le Comité de Pilotage et de Suivi des Pipelines, représentant le Ministre chargé des domaines préside la Commission, et au niveau départemental, un représentant dudit Comité assure la représentation de l'Organisme demandeur.
3. En cas de retrait de la demande ou de rejet du dossier avant l'octroi de l'Autorisation de Transport par Pipeline, ou de renonciation à ou de retrait de l'Autorisation de Transport par Pipeline avant la mise en service du Système de Transport par Pipeline, le Ministre chargé des mines notifie sans délai au postulant ou au Titulaire et au Ministre chargé des domaines lequel rapporte immédiatement l'arrêté de déclaration d'utilité publique et ordonne l'arrêt des procédures d'expropriation pour cause d'utilité publique.
Dans les cas visés au paragraphe précédent, le postulant ou le Titulaire ne peut prétendre à aucun remboursement ni à aucune indemnisation. Les frais dûment justifiés engagés par l'Etat en relation avec l'instruction du dossier ou la réalisation du projet sont remboursés par le postulant ou le Titulaire.
Art. 16 —  Le décret accordant l'Autorisation de Transport par Pipeline fixe :
les droits octroyés au Titulaire en vertu de l'article 17 du présent décret ;
les caractéristiques principales du Système de Transport par Pipeline, et notamment la longueur totale du pipeline, le diamètre, la pression d'exploitation maximale ;
les coordonnées de l'emprise foncière à affecter, déterminées selon les modalités définies dans la Convention d'Etablissement ;
la capacité maximale de transport autorisée du Système de Transport par Pipeline basée sur le transport d'un fluide ayant les mêmes caractéristiques que l'eau à la pression d'exploitation maximale.
En outre ce décret mentionne :
les droits fonciers qui seront exercés par le Titulaire en vertu des décrets d'affectation de l'emprise foncière et de l'emprise du Système de Transport par Pipeline ;
les autorisations, objet de l'instruction visée aux articles 13 et 14 du présent décret ou découlant des dispositions de la Loi N° 96/14 du 05 août 1996 ou de la Convention d'Etablissement du Titulaire, qui sont conférées d'office au Titulaire par l'Autorisation de Transport par Pipeline.
Art. 17 —  1Le Titulaire de l'Autorisation de Transport par Pipeline a le droit, sous réserve du respect des lois et règlements en la matière et de sa Convention d'Etablissement :
d'entreprendre toutes études, et de réaliser tous travaux, en vue de la construction, de l'exploitation et de l'entretien du Système de Transport par Pipeline ;
de construire, d'exploiter et d'entretenir un Système de Transport par Pipeline et de mener toutes les activités liées au transport d'hydrocarbures par le Système de Transport par Pipeline ;
de transporter, stocker et charger des hydrocarbures pour son propre compte ou pour celui des expéditeurs de son choix ;
de modifier librement les volumes d'hydrocarbures transportés à travers le Système de Transport par Pipeline jusqu'à la capacité maximale fixée par l'Autorisation de Transport par Pipeline sans dépasser la pression d'exploitation maximale mentionnée dans ladite autorisation.
2- La construction, l'exploitation et l'entretien du Système de Transport par Pipeline comprennent également les activités, industries et travaux suivants et s'y rattachant, lorsqu'ils sont entrepris par le Titulaire ou pour son compte :
l'établissement et l'exploitation des centrales, des postes et des lignes électriques;
l'établissement et l'exploitation des systèmes de télécommunications ;
la construction des ouvrages de secours ;
le stockage et la mise en dépôt des matériaux, des équipements, des produits et des déchets, ainsi que les installations destinées au ballastage et à l'élimination de la pollution ;
les constructions destinées au logement, à l'hygiène, aux soins et à la formation du personnel, ainsi qu'aux infrastructures sportives et scolaires ;
la construction ou l'amélioration de toutes voies de communication et notamment les routes, ponts, chemins de fer, rigoles, canaux, ports fluviaux ou maritimes, terrains d'atterrissage ;
l'établissement des bornes repères et des bornes de délimitation.
CHAPITRE II
TRANSFERT ET SUSPENSION DES DROITS - RENONCIATION, SUSPENSION, RETRAIT ET FIN DE L'ATP
Art. 18 —  1Les droits et obligations conférés par l'Autorisation de Transport par Pipeline et la Convention d'Etablissement peuvent être cédés (y compris à titre de garantie), nantis ou transférés par le Titulaire. La cession, la réalisation du nantissement ou le transfert des droits découlant de l'Autorisation de Transport par Pipeline et de la Convention d'Etablissement, emporte de plein droit, sauf prescription contraire dans l'acte de cession, de transfert ou de nantissement, le transfert au profit du nouveau Titulaire, des pipelines, constructions, ouvrages et installations de toute nature compris dans le Système de Transport par Pipeline, ainsi que du bénéfice des droits sur l'emprise foncière, y compris le bénéfice de toute autorisation ou convention d'occupation du Domaine Public.
2- En outre, le Titulaire peut accorder toute autre sûreté (y compris des cessions à titre de garantie) sur ses actifs ou propriétés, situés tant au Cameroun qu'en dehors du Cameroun, y compris toute garantie sur le fonds de commerce, sur tout droit de propriété intellectuelle et sur
Tout compte bancaire, étant entendu néanmoins que conformément aux dispositions de la Loi N° 96/14 du 05 août 1996, les pipelines, constructions, ouvrages et installations de toute nature compris dans le Système de Transport par Pipeline ne peuvent faire l'objet d'une hypothèque ou autre sûreté ni de mesures conservatoires ou d'exécution forcée.
3- Toute cession ou nantissement, lorsqu'il intervient en garantie d'une pluralité de créanciers, peut être consenti à l'un d'entre eux ou à un représentant ou fiduciaire pour compte commun de tous les créanciers concernés. Tout transfert des droits conférés au Titulaire par l'Autorisation de Transport par Pipeline et sa Convention d'Etablissement découlant d'une cession à titre de garantie ou de la réalisation d'une sûreté au profit des préteurs doit être notifié par la société au Ministre chargé des mines au plus tard quinze (15) jours après ladite transaction.
4- Toute convention qui aurait pour effet le transfert à un tiers des droits découlant de l'Autorisation de Transport par Pipeline et de la Convention d'Etablissement, à l'exclusion du transfert réalisé dans les cas prévus à l'alinéa 3 ci-dessus, est soumise par notification du Titulaire à l'approbation préalable du Ministre chargé des mines. Le Ministre chargé des mines notifie son approbation ou son objection au Titulaire dans un délai de six (06) mois. Tout silence gardé au-delà de ce délai vaut approbation, et le transfert des droits-est réputé accepté.
Art. 19 —  1Sous réserve du paragraphe suivant, tout transfert ou émission d'actions au profit de toute personne autre qu'un actionnaire existant ou une de ses affinées, est soumis par notification du Titulaire à l'approbation préalable du Ministre chargé des mines à l'exception de l'attribution d'actions de garantie à un administrateur du Titulaire de l'Autorisation de Transport par Pipeline. Le Ministre chargé des mines notifie son approbation ou son objection au Titulaire dans un délai de trois (03) mois. Tout silence gardé au-delà de ce délai vaut approbation, et le transfert ou l'émission d'actions est réputé accepté.
Tout transfert des actions du Titulaire découlant d'une cession à titre de garantie ou de la réalisation d'une sûreté au profit des prêteurs doit être notifié au Ministre chargé des mines au plus tard quinze (15) jours après ladite transaction.
2- Les actions du Titulaire peuvent être librement nanties ou faire l'objet de saisie ou de mesures d'exécution forcée au profit des prêteurs et, conformément à l'article 15 de la Loi N° 96/14 du 05 août 1996 ceux-ci peuvent, à leur choix, se substituer ou substituer une entité légale qu'ils contrôlent au Titulaire dans les droits et obligations résultant de l'Autorisation de Transport par Pipeline et de la Convention d'Etablissement. Cette entité est substituée de plein droit au Titulaire. La substitution s'impose avec plein effet.
3- A compter de la date d'entrée en vigueur d'une telle substitution, l'entité visée à l'alinéa 2 du présent article bénéficie de tous les droits et assume toutes les obligations du Titulaire prévus dans la Convention d'Etablissement et l'Autorisation de Transport par Pipeline.
A cet effet, la substitution emporte dévolution à ladite entité desdits droits et obligations ainsi que de tous biens meubles et immeubles compris dans le Système de Transport par Pipeline, nonobstant toute disposition contraire notamment en cas de faillite ou de liquidation judiciaire.
4- La substitution prend fin avec l'extinction de la dette du Titulaire par le remboursement des sommes dues en principal et intérêts ainsi que de toutes les autres sommes dues par le Titulaire en vertu de ses contrats avec les prêteurs, et, les droits conférés par la Convention d'Etablissement et l'Autorisation de Transport par Pipeline ou qui résultent de leur application sont transférés de plein droit au Titulaire par l'entité susvisée qui ne pourra s'y opposer. Si dans les trois (03) mois qui suivent l'extinction de ladite dette, le Titulaire n'a pas repris l'exploitation et n'a pas satisfait à ses obligations découlant de la Convention d'Etablissement et l'Autorisation de Transport par Pipeline, et après qu'une mise en demeure du Ministre chargé des mines soit restée sans effet pendant un (01) mois, l'Autorisation de Transport par Pipeline est retirée dans les conditions prévues par la Convention d'Etablissement du Titulaire, et ce retrait est constaté par décret.
5- Les conditions et modalités dans lesquelles la substitution et le transfert des droits s'effectuent sont convenues entre les prêteurs et le Titulaire ainsi qu'entre les prêteurs et l'Etat. Cette substitution est notifiée dans un délai de quinze (15) jours au Ministre chargé des mines.
Art. 20 —  1. Le Titulaire a le droit de renoncer à son Autorisation de Transport par Pipeline avant la mise en exploitation du Système de Transport par Pipeline. Il notifie sa décision au Ministre chargé des mines. La renonciation ne devient définitive qu'après la réalisation des conditions visées à l'alinéa 2 du présent article, et constatée sur procès-verbal conjointement signé par le Titulaire et le Service d'Inspection des Pipelines, ainsi qu'après la liquidation des droits, redevances et impôts dus par le Titulaire dans le cadre de son activité couverte par l'Autorisation de Transport par Pipeline. La renonciation définitive est constatée par décret que rapportent les décrets octroyant l'Autorisation de Transport par Pipeline et affectant l'emprise foncière, et libère son Titulaire de ses obligations en application des dispositions du présent décret.
2. La renonciation à l'Autorisation de Transport par Pipeline n'emporte aucune obligation pour, ni aucun dédommagement par l'Etat, et le Titulaire ne peut prétendre à aucun remboursement ni à aucune indemnisation.
Dans le délai d'un (01) an â compter de la notification au Ministre chargé des mines de sa décision de renoncer à l'Autorisation de Transport par Pipeline, le Titulaire est tenu de remettre en état les lieux conformément à l'article 19 alinéa b) de la Loi N° 96/14 du 05 août 1996, et de rembourser les dépenses dûment justifiées encourues par l'Etat, et les sommes dues à l'Etat en relation avec la demande d'Autorisation de Transport par Pipeline et, le cas échéant de la mise à disposition de l'emprise foncière conformément aux dispositions de sa Convention d'Etablissement. Passé ce délai, et après une misé en demeure restée sans effet pendant trois (03) mois, il est procédé d'office à ladite remise en état, aux frais du Titulaire, ainsi qu'au recouvrement forcé des sommes dues.
Art. 21 —  1Le Titulaire peut renoncer à l'exploitation d'une partie du Système de Transport par Pipeline. Il notifie sa décision au Ministre chargé des mines en tenant compte de ce que la date de prise d'effet de cette renonciation ne peut intervenir qu'après un délai de six (06) mois â compter de la date de réception de sa notification par ledit Ministre.
Le Titulaire peut renoncer à l'exploitation de la totalité du Système de Transport par Pipeline. Il notifie sa décision au Ministre chargé des mines en tenant compte de ce que la date de prise d'effet de cette renonciation ne peut intervenir qu'après un délai de vingt quatre (24) mois à compter de la date de réception de sa notification par ledit Ministre.
Dans les deux cas, le Ministre chargé des mines prend acte de la renonciation qui prend effet aux dates susvisées.
Sous réserve des dispositions de l'article 23 du présent décret, le Titulaire est tenu de remettre en état les lieux conformément à l'article 19 alinéa b) de la Loi 96/14 du 05 Août 1996, et de rembourser les dépenses encourues par, et les sommes dues à l'Etat conformément à sa Convention d'Etablissement.
2- La renonciation ne devient définitive qu'après la réalisation des conditions visées à l'alinéa 1 ci-dessus et de la liquidation des droits, redevances et impôts dus par le Titulaire. Un procès-verbal constatant la réalisation desdites conditions est dressé par le Service d'Inspection des Pipelines et conjointement signé avec le Titulaire. La renonciation définitive est constatée par décret, lequel rapporte les décrets octroyant l'Autorisation de Transport par Pipeline et affectant l'emprise foncière, et libère son Titulaire de ses obligations en application des dispositions du présent décret.
La renonciation à l'exploitation d'une partie ou de la totalité du Système de Transport par Pipeline n'emporte aucune obligation pour, ni aucun dédommagement par l'Etat, et le Titulaire ne peut prétendre à aucun remboursement ni à aucune indemnisation.
Art. 22 —  La suspension ou le retrait de l'Autorisation de Transport par Pipeline pendant l'exploitation du Système de Transport par Pipeline est prononcée par décret selon les conditions et modalités de la Convention d'Etablissement du Titulaire.
La suspension de l'Autorisation de Transport par Pipeline entraîne celle des droits conférés par l'Autorisation de Transport par Pipeline 'conformément aux conditions et modalités de la Convention d'Etablissement du Titulaire.
Le décret prononçant le retrait d'Autorisation de Transport par Pipeline rapporte lés dispositions des décrets affectant l'emprise foncière à la construction, à l'exploitation et à l'entretien du Système de Transport par Pipeline.
La Convention d'Etablissement peut prévoir le délai dans lequel le Ministre chargé des mines peut notifier à la société sa décision d'acquérir ou non, au nom de l'Etat, tout ou partie du Système de Transport par Pipeline.
Art. 23 —  1Lorsque le Ministre chargé des mines ne souhaite pas-acquérir au nom de l'Etat en partie ou en totalité le Système de Transport par Pipeline, il notifie sa décision dans un délai de deux (02) mois pour partie et de six (06) mois pour la totalité du Système de Transport par Pipeline, à compter de la date de réception de la notification de renonciation, et communique au Titulaire la liste des installations de surface que celui-ci doit enlever. Le Titulaire, qui conserve alors la propriété de ces installations, procède à leur enlèvement dans des délais et des conditions approuvés par le Ministre chargé des mines.
Dans le cas prévu au paragraphe précédent, le Titulaire est responsable, conformément aux dispositions de la Loi N° 96/14 du 05 août 1996, des dommages causés par l'enlèvement des installations et prend en charge la réparation de ces dommages.
2- Dans les mêmes délais, et s'il souhaite acquérir au nom de l'Etat en partie ou en totalité le Système de Transport par Pipeline, le Ministre chargé des mines notifie sa décision au Titulaire, et applique les procédures d'acquisition indiquées au paragraphe suivant. Dans ce cas, l'Etat prend possession de la partie concernée ou de la totalité du Système de Transport par Pipeline à la date de publication du décret constatant la renonciation définitive ou plus tôt si le Titulaire et le Ministre chargé des mines en conviennent ainsi.
Dans le cas où le Ministre chargé des mines décide d'acquérir au nom de l'Etat en partie ou en totalité le Système de Transport par Pipeline, l'acquisition est effectuée par les soins du Ministre chargé des domaines dans les conditions fixées d'un commun accord entre le Titulaire et le Ministre chargé des mines.
Au cas où aucun accord ne serait intervenu entre le Titulaire et le Ministre chargé des mines, la détermination du prix d'acquisition est renvoyée à dire d'expert, selon les modalités de la Convention d'Etablissement du Titulaire.
TITRE IV
DISPOSITIONS FONCIERES ET DOMANIALES
CHAPITRE I
PERIMETRES DE PROTECTION
Art. 24 —  Les périmètres de protection visés à l'article 27 alinéa a) de la Loi N°96/14 du 05 Août 1996 sont institués pour la protection de l'environnement et des populations. Le postulant à l'Autorisation de Transport par Pipeline prédise dans le dossier de sa demande, les zones concernées par les périmètres de protection dont il a connaissance et qui seront traversées par le pipeline, ainsi que les mesures et les dispositions qu'il prévoit, conformes aux restrictions et interdictions fixées par voie réglementaire.
Art. 25 —  1Aucune indemnisation n'est due au postulant lorsque, du fait de l'existence de périmètres de protection, il doit modifier son projet, notamment en ce qui concerne le tracé du pipeline, ou doit prendre de nouvelles mesures.
2- Lorsqu'un périmètre de protection est institué de telle sorte que le Titulaire doit modifier, démolir ou abandonner des travaux ou des installations régulièrement effectués à l'intérieur de ce périmètre antérieurement à son institution, notification lui est adressée par le Ministre chargé des mines. Dans le mois qui suit la réception de la notification, le Titulaire propose au Ministre chargé des mines un délai raisonnable au cours duquel les travaux de modification, de démolition ou d'abandons nécessaires peuvent être réalisés. Une fois accepté par le Ministre chargé des mines, le Titulaire doit effectuer ces travaux et se conformer au délai ainsi prescrit.
3- Pour déterminer l'indemnité due par l'Etat au Titulaire en vertu de (l'article 27 alinéa b) de la Loi 96/14 du 05 Août 1996, ce dernier adresse au Ministre chargé des mines les justificatifs des dépenses afférentes à la modification, à la démolition ou à l'abandon des travaux effectués.
Dans le mois suivant la réception des justificatifs de ces dépenses, les services du Ministre chargé des mines vérifient ces justificatifs, constatent et consignent sur procès-verbal la modification, la démolition ou la mise en sécurité en cas d'abandon des travaux ou des installations, et font procéder, dans les six (06) mois suivant ce procès verbal à l'indemnisation du Titulaire par l'Etat.
Art. 26 —  1Des périmètres de protection peuvent être, conformément à l'article 27 alinéa c) de la Loi N° 96/14 du 05 août 1996 institués à l'intérieur de l'emprise foncière pour les besoins de la construction, ou pour ceux de l'exploitation et de l'entretien du Système de Transport par Pipeline et sont pris en compte dans l'inscription de l'emprise foncière et de l'emprise du Système de Transport par Pipeline :
tous les autres terrains et zones destinés aux travaux et emplacements des installations annexes visées à l'article 4 de la Loi 96/14 du 05 Août 1996, ou se rapportant à toute modification, ajout ou extension du Système de Transport par Pipeline et qui seront mis à la disposition du Titulaire à sa demande, selon les mêmes procédures et dans les conditions de sa Convention d'Etablissement ;
le droit de libre accès aux terrains et installations du Système de Transport par Pipeline ainsi que le droit d'accès aux infrastructures construites ou améliorées ;
Art. 29 —  1Pour la constitution de l'emprise foncière à affecter à la construction, â l'exploitation et à l'entretien du Système de Transport par Pipeline :
les terrains du Domaine National et les terrains qui sont la propriété des particuliers, destinés à la construction, à l'exploitation et à l'entretien du Système de Transport par Pipeline, sont incorporés conformément à l'article 29 alinéa a) de la Loi N° 96/14 du 05 août 1996, dans le Domaine Privé de l'Etat, après expropriation si nécessaire ;
les terrains et zones offshore du Domaine Public, nécessaires à la construction, à l'exploitation et à l'entretien du Système de Transport par Pipeline, font l'objet d'une autorisation d'occupation ;
les terrains nécessaires à la construction, à l'exploitation et à l'entretien du Système de Transport par Pipeline et qui font déjà l'objet d'une affectation, d'une concession ou d'un bail, sont utilisés par le Titulaire dans les conditions et modalités prévues par la Convention d'Etablissement, notamment en ce qui concerne la prise en charge de l'indemnisation y afférente.
2- Le décret qui octroie l'Autorisation de Transport par Pipeline indique également les coordonnées de l'emprise foncière à affecter à la construction, à l'exploitation et à l'entretien du Système de Transport par Pipeline, déterminées selon les modalités définies dans la Convention d'Etablissement.
3- L'emprise foncière constituée, comme indiqué à l'article 29 alinéa 1 du présent décret, est provisoirement affectée par décret à la construction, à l'exploitation et à l'entretien du Système de Transport par Pipeline, conformément à l'article 29 alinéa b) de la Loi N° 96/14 du 05 août 1996.
Art. 30 —  1Les décrets affectant l'emprise foncière à la construction, à l'exploitation et à l'entretien du Système de Transport par Pipeline, confèrent au Titulaire, sous réserve des dispositions du présent décret, de la Convention d'Etablissement et du respect le cas échéant, des réglementations spécifiques en la matière, les droits suivants sur l'emprise foncière :
le droit d'occupation des terrains ;
le droit de jouissance des terrains pour construire, exploiter et entretenir le Système de Transport par Pipeline ainsi que pour construire ou améliorer les infrastructures nécessaires à cette fin ;
un périmètre de protection interdisant à toute personne non autorisée par le Titulaire, à
L'exception des fonctionnaires et agents de l'Etat chargés de la surveillance et du
Contrôle administratifs ou des services compétents chargés de la surveillance ou de la
Protection du territoire, l'accès :
aux parties de l'emprise foncière sur lesquelles se déroulent les travaux, pendant la période des travaux de construction ;
aux installations annexes du pipeline pendant l'exploitation et l'entretien du Système de Transport par Pipeline ;
un périmètre de protection interdisant à toute personne d'entreprendre la construction de toute structure et de planter tout arbre et arbuste dans les limites de l'emprise du Système de Transport par Pipeline, et de labourer ou de creuser à .une profondeur de plus de soixante centimètres (0,60 mètre). Sous réserve de ces restrictions, les terrains situés à l'intérieur de la zone ainsi protégée, peuvent être affectés à d'autres usages à condition toutefois que cette utilisation n'entraîne ni ne constitue un obstacle au bon fonctionnement et à l'entretien du Système de Transport par Pipeline ;
