URL,text,page_title
https://www.juriafrica.com/lex/decret-2013-296-09-septembre-2013-18019.htm,"Le président de la République, décrète:
Art. 1er —  Les dispositions de l'article 4 du décret n°2005/310 du 1er septembre 2005 susvisé sont modifiées et complétées ainsi qu'il suit :
Art. 4 (nouveau).-  —  (1) L'Agence a pour mission, en liaison avec les administrations et les organismes publics et privés concernés, de contribuer à l'élaboration et à la mise en oeuvre de la politique du Gouvernement dans le domaine de la promotion des investissements au Cameroun.
Ace titre, elle est chargée notamment :
de promouvoir l'image de marque du Cameroun à l'étranger ;
de participer à l'établissement et à l'amélioration d'un environnement incitatif et favorable aux investissements au Cameroun ;
de proposer toutes mesures susceptibles d'attirer les investisseurs au Cameroun;
de collecter des informations relatives aux diverses opportunités d'investissement au Cameroun et de les diffuser auprès des milieux d'affaires ;
de mettre en place une banque de données de projets à la disposition des investisseurs;
d'accueillir, d'assister et d'orienter les investisseurs dans toutes les étapes de la mise sur pied des projets d'investissement;
de proposer toutes mesures susceptibles d'améliorer la mise en oeuvre des codes sectoriels.
(2) L'Agence assure également, pour les investisseurs étrangers et locaux, à l'exception des petites et moyennes entreprises locales, les services publics auxquels ont droit les entreprises qui sollicitent ou ont obtenu le bénéfice d'un des régimes de la charte des investissements, d'une part, et le suivi des entreprises bénéficiaires des avantages de ladite charte et de la loi fixant les incitations à l'investissement privé en République du Cameroun, d'autre part. A cet effet, l'Agence est notamment chargée :
de recevoir les dossiers de demande d'agrément à l'un des régimes prévus par la charte des investissements ;
d'instruire les dossiers reçus et de les transmettre au Ministre chargé des finances pour avis, dans les délais prévus par la loi ;
d'obtenir les visas nécessaires à l'exécution des programmes d'investissement proposés par l'entreprise pour la période de validité de l'acte d'agrément ;
d'obtenir les visas nécessaires pour le personnel étranger pendant la durée de validité de l'acte d'agrément ;
d'assister les entreprises agréées dans les démarches nécessaires à l'exécution des programmes d'investissement, y compris l'accès aux installations publiques y afférentes ;
d'établir, en liaison avec les services techniques compétents, des procédures administratives simplifiées par type d'activité.
L'Agence assure, en outre, l'accueil, l'information et l'orientation des investisseurs à leur arrivée sur le territoire national. A cet effet, elle met en place dans chaque aéroport international sur le territoire national, un Guichet d'Accueil des Investisseurs.
Pour l'accomplissement des missions visées à l'alinéa 2 ci-dessus, l'Agence dispose d'un Guichet Unique dont l'organisation et le fonctionnement sont fixés par arrêté du Ministre chargé des investissements privés.
Art. 2 —  Le présent décret sera enregistré, publié suivant la procédure d'urgence, puis inséré au Journal Officiel en français et en anglais.",DECRET_N°2013_296_DU_09_SEPTEMBRE_2013_MODIFIANT_ET_COMPLETANT_CERTAINES_DISPOSITIONS_DU_DECRET_N°2005_310_DU_01_SEPTEMBRE_2005_PORTANT_ORGANISATION_ET_FONCTIONNEMENT_DE_L'AGENCE_DE_PROMOTION_DES
