URL,text,page_title,page_label,category,metadata
https://www.juriafrica.com/lex/decret-2018-378-28-juin-2018-24558.htm,"DÉCRET N°2018/378 DU 28 JUIN 2018 RATIFICATION DE L'ACCORD DE PRÊT N°2100150038644 D'UN MONTANT DE 9 739 000 UNITÉS DE COMPTE, SOIT ENVIRON 7,790 MILLIARDS DE FRANCS CFA, CONCLU LE 24 MAI 2018 ENTRE LA RÉPUBLIQUE DU CAMEROUN ET LE FONDS AFRICAIN DE DÉVELOPPEMENT (FAD), POUR LE FINANCEMENT PARTIEL DU PROJET DE CONSTRUCTION DU PONT SUR LE FLEUVE LOGONE ENTRE LES VILLES DE YAGOUA AU CAMEROUN ET BONGOR AU TCHAD

Le président de la République,
Vu la Constitution ;
Vu la loi N°2017/021 du 20 décembre 2017 portant loi de finances de la République du Cameroun pour l'exercice 2018 ;
Vu l'ordonnance N° 2018/002 du 4 juin 2018 modifiant et complétant certaines dispositions de la loi N°2017/021 du 20 décembre 2017 portant loi de finances de la République du Cameroun pour l'exercice 2018 ;
Vu le décret n°2018/247 du 13 avril 2018 habilitant le ministre de l'Economie, de la Planification et de l'Aménagement du territoire (MINEPAT), à signer avec le Fonds Africain de Développement (FAD), un Accord de prêt d'un montant de 9 739 000 unités de compte, soit environ 7,790 milliards de francs CFA, pour le financement partiel du projet de construction du pont sur le fleuve Logone entre les villes de Yagoua au Cameroun et Bongor au Tchad.
décrète :
Art. 1er —  Est ratifié, l'Accord de prêt N°2100150038644 d'un montant de 9 739 000 unités de compte, soit environ 7,790 milliards de francs CFA, conclu le 24 mai 2018 entre la République du Cameroun et le Fonds Africain de Développement (FAD), pour le financement partiel du projet de construction du pont sur le fleuve Logone entre les villes de Yagoua au Cameroun et Bongor au Tchad.
Art. 2 —  Le présent décret sera enregistré, publié suivant la procédure d'urgence, puis inséré au Journal officiel en français et en anglais.",DECRET_N_2018_378_DU_28_JUIN_2018_RATIFICATION_DE_L_ACCORD_DE_PRET_N_2100150038644_D_UN_MONTANT_DE_9_739_000_UNITES_DE_COMPTE_SOIT_ENVIRON_7_790_MILLIARDS_DE_FRANCS_CFA_CONCLU_LE_24_MAI_2018_ENTRE_LA_REPUBLIQUE_DU_CAMEROUN_ET_LE_FONDS_AFRICAIN_DE_DEVELOPPEMENT_FAD_POUR_LE_FINANCEMENT_PARTIEL_DU_PROJET_DE_CONSTRUCTION_DU_PONT_SUR_LE_FLEUVE_LOGONE_ENTRE_LES_VILLES_DE_YAGOUA_AU_CAMEROUN_ET_BONGOR_AU_TCHAD,0,decret,
