URL,text,page_title,page_label,metadata
https://www.juriafrica.com/lex/decret-2017-365-12-juillet-2017-48260.htm,"LE PRESIDENT DE LA REPUBLIQUE,
Vu la Constitution ;
Vu la loi n° 2017/008 du 12 JUIN 2017 autorisant le Président de la République à ratifier l'Accord de coopération technique en matière foncière entre le Gouvernement de la République du Cameroun et le Gouvernement de la République Tunisienne, signé le 24 mars 2016 à Tunis,
DECRETE:
Art. 1er —  .- Est ratifié, l'Accord de coopération technique en matière foncière entre le Gouvernement de la République du Cameroun et le Gouvernement de la République Tunisienne, signé le 24 mars 2016 à Tunis.
Art. 2 —  Le présent décret sera enregistré, publié suivant la procédure d'urgence, puis inséré au Journal Officiel en français et en anglais. /-",DECRET_N_2017_365_DU_12_JUILLET_2017_PORTANT_RATIFICATION_DE_L_ACCORD_DE_COOPERATION_TECHNIQUE_EN_MATIERE_FONCIERE_ENTRE_LE_GOUVERNEMENT_DE_LA_REPUBLIQUE_DU_CAMEROUN_ET_LE_GOUVERNEMENT_DE_LA_REPUBLIQUE_TUNISIENNE_SIGNE_LE_24_MARS_2016_A_TUNIS,0,
