URL,text,page_title,page_label,metadata
https://www.juriafrica.com/lex/decret-2003-038-4-fev-2003-16050.htm,"LE PRESIDENT DE LA REPUBLIQUE,
VU la Constitution;
VU la loi n°2002/009 du 30 décembre 2002 autorisant le Président de la République à ratifier la Convention pour l'Unification de certaines règles relatives au transport aérien international, adoptée à Montréal le 28 mai 1999 ;
DECRETE:
Art. 1er —  Est ratifiée la Convention pour l'Unification de certaines règles relatives au transport aérien international, adoptée à Montréal le 28 mai 1999.
Art. 2 —  Le présent décret sera enregistré et publié suivant la procédure d'urgence, puis inséré au Journal Officiel en français et en anglais.",DECRET_N_2003_038_DU_04_FEVRIER_2003_PORTANT_RATIFICATION_DE_LA_CONVENTION_POUR_L_UNIFICATION_DE_CERTAINES_REGLES_RELATIVES_AU_TRANSPORT_AERIEN_INTERNATIONAL_ADOPTE_A_MONTREAL_LE_28_MAI_1999,0,
