URL,text,page_title,page_label,category,metadata
https://www.juriafrica.com/lex/decret-2014-005-10-janvier-2014-18079.htm,"DÉCRET N°2014/005 DU 10 JANVIER 2014 PORTANT NOMINATION D'UN CHEF DE DIVISION ET D'UN CHEF DE DIVISION ADJOINT DANS LE CORPS SPÉCIALISÉ D'OFFICIERS DE POLICE JUDICIAIRE DU TRIBUNAL CRIMINEL SPÉCIAL.

Le Président de la République, décrète:
Art. 1er —  Sont, pour compter de la date de signature du présent décret, nommés aux fonctions ci-après dans le corps spécialisé d'officiers de police judiciaire du Tribunal criminel spécial :
Division des enquêtes
Chef de Division: M. Enyegue Mbolong, (Mle: 145 241-L), Commissaire Divisionnaire, poste créé.
Chef de Division Adjoint : M. Atangana Fiacre Kisito (MIe: 552 144-T), Lieutenant-Colonel de gendarmerie, poste créé.
Art. 2 —  Les intéressés auront droit aux avantages de toute nature prévus par la réglementation en vigueur.
Art. 3 —  Le présent décret sera enregistré, publié suivant la procédure d'urgence, puis inséré au Journal Officiel en français et en anglais.",DECRET_N_2014_005_DU_10_JANVIER_2014_PORTANT_NOMINATION_D_UN_CHEF_DE_DIVISION_ET_D_UN_CHEF_DE_DIVISION_ADJOINT_DANS_LE_CORPS_SPECIALISE_D_OFFICIERS_DE_POLICE_JUDICIAIRE_DU_TRIBUNAL_CRIMINEL_SPECIAL,0,decret,
