URL,text,page_title,page_label,category,metadata
https://www.juriafrica.com/lex/decret-93-572-pm-15-juillet-1993-16418.htm,"DECRET N° 93/572/PM DU 15 JUILLET 1993 - RELATIF AUX ENTREPRISES DE TRAVAIL TEMPORAIRE

Le Premier Ministre, Chef du Gouvernement décrète :
Art. premier —  Le présent décret fixe :
les modalités d'ouverture d'une entreprise de travail temporaire, ci-après désignée "" Entreprise "" et de conclusion d'un contrat de mise à disposition ; ainsi que
les conditions d'emploi du travailleur temporaire recruté dans le cadre d'une entreprise, pour l'exécution des tâches non durables et dans les seuls cas prévus à l'article 25, alinéa (4) a) du code du travail, ci-après désigné "" le code "".
CHAPITRE I
DE L'OUVERTURE D'UNE ENTREPRISE
Art. 2 —  (1) L'ouverture d'une entreprise est subordonnée à l'obtention d'un agrément délivré par arrêté du ministre chargé du Travail ;
(2) Le dossier en vue de l'obtention de l'agrément visé à l'alinéa (1) comprend :
une demande timbrée au tarif en vigueur, indiquant la raison sociale, le siège, ainsi que l'adresse de l'entreprise ;
une attestation de garantie financière pour le paiement des salaires et des charges sociales, souscrite auprès d'un établissement financier agréé par le ministre chargé des finances.
Art. 3 —  (1) Le dossier visé à l'article 2, alinéa (2) est adressé sous pli recommandé à l'inspecteur du travail et de la prévoyance sociale du ressort du siège de l'entreprise. Il est tenu de la transmettre, assorti d'un avis motivé, au ministre chargé du Travail, dans un délai de quinze (15) jours à compter de la date de réception ;
(2) Le ministre compétent se prononce dans un délai de trente (30) jours à compter de la transmission du dossier à l'inspecteur du travail et de la prévoyance sociale. Passé ce délai, l'agrément est réputé accordé ;
(3) Tout refus d'accorder l'agrément doit être motivé et notifié à l'entreprise ;
(4) L'agrément est personnel et incessible.
Art. 4 —  (1) En cas de violation de la législation et /ou de la réglementation en vigueur, le ministre chargé du Travail peut, par arrêté, prononcer à l'encontre de l'entreprise, l'une des sanctions suivantes :
la suspension temporaire des activités régies par le présent décret, pour une durée ne pouvant excéder trois (3) mois ;
le retrait de l'agrément ;
(2) Les sanctions prévues à l'alinéa (1) sont prononcées au vu d'un rapport d'enquête ou d'inspection initiée par les services compétents du ministère chargé du Travail.
Elles sont précédées d'une mise en demeure adressée par l'inspecteur du travail du ressort à l'entreprise de se conformer, dans les délais qu'il fixe, aux dispositions législatives et/ou réglementaires en vigueur ;
(3) En cas de faute grave ou lorsque le fonctionnement d'une entreprise soumise au présent décret porte atteinte à l'ordre public, le ministre chargé du travail peut, à titre de mesure conservatoire, procéder à la suspension provisoire de l'entreprise en cause.
Art. 5 —  La reprise des activités d'une entreprise, après interruption à la suite de la sanction de suspension prévue à l'article 4, est prononcée dans les mêmes formes, dès que l'administration chargée du Travail constate que l'entreprise concernée a remédié à la cause de la suspension.
CHAPITRE II
DU CONTRAT DE MISE A DISPOSITION
Art. 6 —  Le contrat de mise à disposition entre l'entreprise et un utilisateur doit prévoir un terme précis dès sa conclusion et ne peut excéder, renouvellement compris, une durée maximale de douze (12) mois entre ladite entreprise et le même utilisateur.
Art. 7 —  (1) Conformément à l'article 26, alinéa (6) du code, un contrat écrit de mise à disposition doit être conclu, pour chaque travailleur, entre l'entreprise et l'utilisateur ;
(2) Il doit comporter les mentions suivantes :
le motif du recours au travail temporaire ;
le terme de la mise à disposition assorti, en tant que de besoin, d'une clause prévoyant la possibilité de modifier ce terme ;
la description du poste à occuper précisant ses caractéristiques et la qualification professionnelle requise ; et
le lieu d'exécution et l'horaire.
Art. 8 —  Les conditions du renouvellement visé à l'article 6 sont prévues dans le contrat ou font l'objet d'un avenant soumis au salarié préalablement à l'arrivée du terme initialement fixé.
CHAPITRE III
DES CONDITIONS D'EMPLOI DU TRAVAILLEUR TEMPORAIRE
SECTION I
DE LA CONCLUSION DU CONTRAT DU TRAVAIL
Art. 9 —  (1) Conformément à l'article 26, alinéa (5) du code, le contrat de travail conclu entre le responsable de l'entreprise, ci-après désigné "" l'entrepreneur "", et le travailleur mis à la disposition d'un utilisateur, doit être écrit. Il est assigné par les deux parties ;
(2) Outre les mentions inscrites dans le contrat de mise à disposition et prévues à l'alinéa 7, ce contrat doit notamment indiquer :
la qualification du salarié ;
les éléments des rémunération et les modalités de paiement ; et
la possibilité pour l'utilisateur d'embaucher le salarié au terme de l'exécution du contrat du travail.
Art. 10 —  (1) Le contrat de travail :
cesse de plein droit à l'expiration du terme prévu ; sa suspension ne fait pas obstacle à l'échéance dudit terme ;
ne peut être rompu que suivant les conditions fixées à l'article 38 du code du travail ;
(2) A son expiration, le travailleur a droit à une indemnité compensatrice de congé, conformément à la législation en vigueur;
SECTION II
DE L'EXECUTION DU CONTRAT DE TRAVAIL
Art. 11 —  Le travailleur est rémunéré suivant les modalités fixées à l'article 68 du code.
Art. 12 —  L'application au travailleur de la condition d'ancienneté dans l'entreprise, conformément aux textes en vigueur, s'effectue en additionnant les périodes pendant lesquelles le travailleur concerné a été à la même entreprise par un contrat.
Art. 13 —  (1) Sauf cas de faute lourde ou des force majeure, le contrat de travail peut être rompu avant le terme prévu ;
(2) En cas de rupture du contrat de travail avant le terme prévu, l'entrepreneur est tenu de proposer au travailleur un nouveau contrat, dans un délai de quinze (15) jours à compter de la date de notification de ladite rupture. Le cas échéant, l'entrepreneur est tenu de verser au travailleur une rémunération équivalente à celle des l'intégralité de celle qu'il aurait perçu jusqu'au terme de son contrat ;
(3) Une rupture anticipée du fait du travailleur ouvre droit au versement à l'entreprise de dommages et intérêts, conformément à la législation en vigueur ;
(4) La rupture du contrat de mise en disposition entre l'entreprise et l'utilisateur ne constitue pas un cas de force majeure au sens de l'article 38 du Code.
Art. 14 —  (1) Le travailleur bénéficie de toutes les mesures de protection sociale prévues par la législation sur la sécurité sociale. Les cotisations y afférentes sont à la charge de l'entreprise ;
(2) Les obligations se rapportant à la médecine du travail sont à la charge de l'entreprise ;
(3) En cas d'accident de travail, la déclaration incombe à la l'entreprise. A cet effet, l'utilisateur doit communiquer à l'entrepreneur dans les délais prévus par la législation sur la réparation et la prévention des accidents de travail et des maladies professionnelles, tout accident dont la survenance a été portée à sa connaissance.
SECTION III
DE LA SITUATION DU TRAVAILLEUR DANS L'ETABLISSEMENT DE L'UTILISATEUR
Art. 15 —  (1) Le travailleur mis à la disposition n'est pas salarié de l'utilisateur ;
(2) Pendant la durée de la mise à disposition, le travailleur est soumis aux conditions d'exécution du travail fixées par la législation et la réglementation en vigueur, ainsi que les conventions collectives applicables au lieu de travail.
Art. 16 —  (1) Le travailleur ne peut être inscrit sur les listes électorales établies en vue de l'élection des délégués du personnel dans l'établissement de l'utilisateur ;
(2) Il peut toutefois recourir audits délégués en vue de présenter ses réclamations relatives aux conditions d'exécution du travail prévues à l'article 15.
CHAPITRE IV
DES DISPOSITIONS DIVERSES ET FINALES
Art. 17 —  Toute entreprise ayant cessé ses activités est tenue d'en faire la déclaration par écrit à l'inspecteur du travail et de la prévoyance sociale du ressort.
Art. 18 —  Sans préjudice des sanctions administratives, les infractions aux dispositions du présent décret sont passibles des peines prévues aux articles 168 et 170 du Code.
Art. 19 —  Le Ministre du Travail et de la Prévoyance sociale est chargé de l'application du présent décret qui sera enregistré, publié suivant la procédure d'urgence, puis inséré au Journal Officiel en français et en anglais.",DECRET_N_93_572_PM_DU_15_JUILLET_1993_RELATIF_AUX_ENTREPRISES_DE_TRAVAIL_TEMPORAIRE,0,decret,
