URL,text,page_title,page_label,category,metadata
https://www.juriafrica.com/lex/decret-2006-230-17-juil-2006-16980.htm,"DECRET N° 2006/230 DU 17 JUILLET 2006 INSTITUANT UN PASSEPORT ORDINAIRE À TITRE TRANSITOIRE EN RÉPUBLIQUE DU CAMEROUN.

LE PRESIDENT DE LA REPUBLIQUE,
Vu la Constitution
Vu le Règlement n°1/00-CEMAC-042-CM-04 du 21 juillet 2000 portant institution et conditions d'attribution du passeport CEMAC
Vu la loi n°74/21 du 05 décembre 1974 portant répression de l'émigration et l'immigration irrégulières ;
Vu le décret n°90/1245 du 24 août 1990 fixant les conditions d'établissement des passeports et de sortie des nationaux modifié par le décret n°91/263 du 31 mai 1991 ;
Vu le décret n°98/273 du 22 octobre 1998 portant réorganisation de la Présidence de la République ;
Vu le décret n°2002/003 du 04 janvier 2002 portant organisation de la Délégation Générale à la Sûreté Nationale ;
Vu le décret n° 2004/320 du 8 décembre 2004 portant organisation du Gouvernement;
Vu le décret n°2005/286 du 30 juillet 2005 portant organisation du Ministère des Relations Extérieures,
DECRETE:
Art. 1er —  Le présent décret institue, à titre transitoire, un passeport ordinaire pour les ressortissants camerounais.
Art. 2 —  (1) Le passeport ordinaire ainsi institué, se présente sous la forme d'un carnet de 125 millimètres de long et de 88 millimètres de large, de couleur vert sombre, comprenant 32 pages numérotées.
(2) Il porte sur la couverture les inscriptions suivantes en or industriel :
en haut de la page, « COMMUNAUTE ECONOMIQUE ET MONETAIRE DE L'AFRIQUE CENTRALE» « REPUBLIQUE DU CAMEROUN » en français et en anglais ;
au milieu de la page, le sceau de la République du Cameroun ;
au bas de la page, « PASSEPORT - PASSPORT ».
(3) Les armoiries de la République du Cameroun se trouvent sur la deuxième page de couverture.
(4) La page 1 comporte, en plus des inscriptions portées sur la première page de couverture, la mention « passeport » en français, anglais, espagnol et arabe ainsi que le numéro du passeport en caractère perforé en haut de la page et en caractère d'imprimerie en bas de la page.
(5) La page 31 comporte, en français et en anglais les mentions obligatoires d'identification relatives aux noms, prénoms, nationalité, sexe, date et lieu de naissance, domicile, code personnel, taille, signature du titulaire et une bande de lecture optique. Sur la même page, figurent :
la date et le lieu de délivrance ainsi que la date d'expiration du passeport ;
une photographie numérique du titulaire, vue de face, avec une image fantôme de l'intéressé sans coiffure, ni déguisement, ni lunettes teintées
le type de passeport;
le code pays ;
les mentions « passeport » et « République du Cameroun » ;
le numéro du passeport;
une reproduction du monument de la réunification en médaillon à côté de l'image fantôme ;
la désignation de l'autorité ayant délivrée le passeport;
une ligne dorée serpentant sous la photographie et portant la mention « République du Cameroun ».
(6) Les pages 2 à 28 sont réservées à l'apposition des visas.
(7) La page 32 faits corps avec la page d'identité.
(8) La 3ème page de couverture comporte le sceau de la République du Cameroun ainsi que la gravure de toiture des cases en forme conique.
Art. 3 —  - Tout camerounais qui sollicite la délivrance d'un passeport ordinaire transitoire doit en faire la demande au Délégué Général à la Sûreté Nationale ou aux Chefs de missions diplomatiques ou de postes consulaires du Cameroun à l'étranger, selon le cas. A cet effet, il doit fournir :
une photocopie certifiée conforme de l'acte de naissance ;
une photocopie certifiée conforme de l'acte de mariage pour la femme mariée
une photocopie certifiée de la carte nationale d'identité ;
le décret de naturalisation ou de réintégration, le cas échéant;
le justificatif de la profession ou de la fonction
le certificat de perte de passeport s'il y a lieu.
Art. 4 —  La demande de passeport pour l'enfant mineur est introduite par l'un des parents ou, le cas échéant, par le tuteur légal. Elle est appuyée en plus des pièces constitutives du dossier énumérées à l'article 3 ci-dessus, de la photocopie certifiée conforme de la carte nationale d'identité du demandeur, et selon le cas, de l'autorisation parentale légalisée des deux (02) parents pour le voyage envisagé.
Art. 5 —  La validité du passeport ordinaire transitoire est de cinq ans pour compter de sa date de délivrance.
Art. 6 —  La délivrance dudit passeport donne lieu à l'acquittement de droits de timbre dont le montant est fixé par la loi.
Art. 7 —  Le passeport ordinaire transitoire est valable pour tous pays, sauf décision contraire, générale ou individuelle prise, selon le cas, par le Délégué Général à la Sûreté Nationale ou par le Ministre des Relations Extérieures.
Art. 8 —  Le Délégué Général à la Sûreté Nationale et les Chefs de missions diplomatiques ou de postes consulaires sont habilités à délivrer le présent passeport pendant une période de six (06) mois éventuellement renouvelable, à compter de la date de signature du présent décret.
Art. 9 —  Les passeports ordinaires régis par le décret n°90/1245 du 24 août 1990 fixant les conditions d'établissement des passeports et de sortie des nationaux et son modificatif subséquent conservent leur validité et continueront d'être délivrés le cas échéant, par le Délégué Général à la Sûreté Nationale ou par les Chefs des missions diplomatiques ou des postes consulaires du Cameroun à l'étranger pendant la période transitoire susvisée.
Art. 10 —  Le Ministre des Relations Extérieures et le Délégué Général à la Sûreté Nationale sont, chacun en ce qui le concerne, chargés de l'exécution du présent décret qui sera enregistré, puis publié selon la procédure d'urgence, et inséré au Journal Officiel en français et en anglais.",DECRET_N_2006_230_DU_17_JUILLET_2006_INSTITUANT_UN_PASSEPORT_ORDINAIRE_A_TITRE_TRANSITOIRE_EN_REPUBLIQUE_DU_CAMEROUN,0,decret,
