URL,text,page_title
https://www.juriafrica.com/lex/decret-2003-039-4-fev-2003-16051.htm,"LE PRESIDENT DE LA REPUBLIQUE,
VU la Constitution ;
VU la loi n°2002/010 du 30 décembre 2002 autorisant le Président de la République à ratifier la convention portant création de l'Organisation Internationale des Télécommunications Mobiles par Satellites, telle que modifiée ;
DECRETE:
Art. 1er —  Est ratifiée la Convention portant création de l'Organisation Internationale des Télécommunications Mobiles par Satellites, telle que modifiée à la douzième session de l'Assemblée des Parties tenue du 20 au 24 avril 1998 à Londres.
Art. 2 —  Le présent décret sera enregistré et publié suivant la procédure d'urgence, puis inséré au Journal Officiel en français et en anglais.","DECRET_N°_2003_039_DU_04_FEVRIER_2003_PORTANT_RATIFICATION_DE_LA_CONVENTION_PORTANT_CREATION_DE_L_ORGANISATION_INTERNATIONALE_DES_TELECOMMUNICATIONS_MOBILES_PAR_SATELLITES,_TELLE_QUE_MODIFIEE."
