URL,text,page_title
https://www.juriafrica.com/lex/decret-96-227-01-octobre-1996-16659.htm,"LE PRESIDENT DE LA REPUBLIQUE,
Vu la Constitution,
Vu le Décret n° 92/245 du 26 Novembre 1992 portant organisation du Gouvernement, ensemble ses divers modificatifs;
DECRETE:
TITRE I
DES DISPOSITIONS GENERALES
Art. 1er —  Le Ministère des Mines, de l'Eau et de l'Energie est placé sous l'autorité d'un Ministre.
Art. 2 —  Pour l'exécution de ses missions, le Ministre des Mines, de l'Eau et de l'Energie dispose:
d'un Secrétariat Particulier;
de deux (2) Conseillers Techniques;
d'une Cellule de Communication;
d'une Inspection Générale;
d'une Administration Centrale;
des Services Extérieurs.
TITRE II
DU SECRETARIAT PARTICULIER
Art. 3 —  (1) Placé sous l'autorité d'un Chef de Secrétariat Particulier, le Secrétariat Particulier est chargé des affaires réservées du Ministre.
(2) Le Chef de Secrétariat Particulier a rang et prérogatives de chef de service de l'administration centrale.
TITRE III
DES CONSEILLERS TECHNIQUES
Art. 4 —  (1) Les Conseillers Techniques effectuent toutes missions qui leur sont confiées par le Ministre.
(2) Ils ont rang et prérogatives de directeur de l'administration centrale.
TITRE IV
DE LA CELLULE DE COMMUNICATION
Art. 5 —  (1) Placée sous l'autorité d'un Chef de Cellule, la Cellule de Communication est chargée :
de la mise en œuvre de la stratégie de communication gouvernementale au sein du Ministère ;
de la conception et de la mise en forme des messages spécifiques du Ministre;
de la collecte, de la conservation et de l'analyse de la documentation journalistique et audio-visuelle du Ministère;
des synthèses d'actualité;
de l'organisation des conférences de presse et autres actions de communication du Ministre;
des relations avec les médias et autres services de communication et, d'une manière générale, des relations publiques du Ministère.
(2) Elle comprend, outre le Chef de Cellule, deux (2) Chargés d'Etudes Assistants.
TITRE V
DE L'INSPECTION GENERALE
Art. 6 —  (1) Placée sous l'autorité d'un Inspecteur Général ayant rang et prérogatives de secrétaire général de ministère, l'Inspection Générale est chargée:
du contrôle interne et de l'évaluation du fonctionnement des services centraux et extérieurs, des établissements sous-tutelle, ainsi que des organismes et projets rattachés ;
de l'information du Ministre et du Secrétaire Général sûr la qualité du fonctionnement et du rendement des services;
de la conception, de la conduite, de la mise en œuvre et de l'évaluation régulière, en liaison avec les services compétents de la Réforme Administrative, de l'application des techniques d'organisation et méthodes et de simplification du travail administratif.
(2) Elle comprend, outre l'inspecteur Général, deux (2) Inspecteurs ayant rang et prérogatives de directeur de l'administration centrale.
Art. 7 —  (1) Dans l'accomplissement de leurs missions, l'Inspecteur Général et les Inspecteurs ont accès à tous les documents des services contrôlés. A ce titre, ils peuvent :
demander par écrit des informations, explications ou documents aux responsables des services contrôlés qui sont tenus de répondre dans les délais impartis par l'inspecteur Général ou l'inspecteur;
sur leur demande, et à titre ponctuel, disposer du personnel nécessaire relevant d'autres directions ou services du Ministère.
(2) Ils peuvent en outre, en cas de nécessité, requérir la force publique en vue de leur prêter main forte ou constater par écrit les atteintes à la fortune publique.
(3) Chaque mission d'inspection ou de contrôle donne lieu à la rédaction d'un rapport adressé au Ministre, avec copie au Secrétaire Général.
TITRE VI
DE L'ADMINISTRATION CENTRALE
Art. 8 —  L'Administration Centrale comprend:
le Secrétariat Général;
la Direction des Mines et de la Géologie;
la Direction de l'Eau ;
la Direction de l'Energie;
la Direction des Affaires Générales.
CHAPITRE I
DU SECRETARIAT GENERAL
Art. 9 —  (1) Le Secrétariat Général est placé sous l'autorité d'un Secrétaire Général, principal collaborateur du Ministre, qui suit l'instruction des affaires du Ministère et reçoit à cet effet les délégations de signature nécessaires.
A ce titre, il :
coordonne l'action des services centraux et extérieurs du département et tient à cet effet des réunions de coordination dont il adresse le procès-verbal au Ministre;
s'occupe de l'organisation matérielle des services;
définit et codifie les procédures internes du Ministère;
veille à la formation permanente du personnel;
veille à la célérité dans le traitement des dossiers;
centralise les archives et gère la documentation du Ministère.
(2) En cas d'absence ou d'empêchement du Secrétaire Général, le Ministre désigne un directeur pour assurer l'intérim.
Art. 10 —  Sont rattachés au Secrétariat Général:
la Cellule Juridique ;
la Cellule de l'Informatique et des Statistiques;
la Cellule de Suivi;
le Centre des Analyses et des Essais;
le Service du Courrier et de Liaison;
le Service de la Traduction;
le Service de la Documentation et des Archives.
SECTION 1
DE LA CELLULE JURIDIQUE
Art. 11 —  (1) Placée sous l'autorité d'un Chef de Cellule, la Cellule Juridique est chargée :
de la préparation et de la mise en forme de tous les projets de textes de nature législative ou réglementaire initiés par le Ministère ou soumis à la signature du Ministre;
des avis juridiques sur les questions importantes relevant du Ministère;
de la régularité juridique des engagements du Ministère;
de la défense des intérêts de l'Etat en justice chaque fois que le Ministère est impliqué dans une affaire.
(2) Elle comprend, outre le chef de Cellule, deux (2) Chargés d'Etudes Assistants.
SECTION 2
DE LA CELLULE DE L'INFORMATIQUE ET DES STATISTIQUES
Art. 12 —  (1) Placée sous l'autorité d'un Chef de Cellule, la Cellule de l'Informatique et des Statistiques est chargée :
de la conception, de la mise en place et du suivi du système informatique du Ministère;
du développement des applications informatiques du Ministère;
de la collecte, du traitement, de la conservation et de la diffusion des données statistiques.
(2) Elle comprend, outre le Chef de Cellule, deux (2) Chargés d'Etudes Assistants.
SECTION 3
DE LA CELLULE DE SUIVI
Art. 13 —  (1) Placée sous l'autorité d'un Chef de Cellule, la Cellule de Suivi est chargée:
du suivi des activités des services centraux et extérieurs du Ministère;
de la synthèse des programmes d'action, des notes de conjoncture et de l'exploitation des rapports d'activités transmis par les services centraux et extérieurs du Ministère.
(2) Elle comprend, outre le Chef de Cellule, deux (2) Chargés d'Etudes Assistants.
SECTION 4
DU CENTRE DES ANALYSES ET DES ESSAIS
Art. 14 —  (1) Placé sous l'autorité d'un Chef de Centre, le Centre des Analyses et des Essais est chargé :
des études et analyses chimiques, géochimiques et physiques;
de l'analyse physique et chimique des eaux superficielles, souterraines, thermales et thermominérales;
de l'analyse des rejets liquides, solides et des effluents gazeux des établissements industriels et commerciaux;
de l'analyse des minerais, roches et métaux;
de l'exécution des travaux de fonte, de titrage et d'affinage des matières précieuses;
du contrôle des ouvrages en or ou en d'autres pierres précieuses fabriqués localement, ainsi que de leur expertise;
de la délivrance des attestations de qualité.
(2) Il comprend :
le Service de l'Analyse Hydrochimique et Géochimique;
le Service de l'Analyse Minéralogique et des Essais;
le Service de l'Analyse des Produits Pétroliers.
Art. 15 —  Placé sous l'autorité d'un Chef de Service, le Service de l'Analyse Hydrochimique et Géochimique est chargé :
de la préparation physico-chimique des échantillons;
de l'analyse physique et de la détermination quantitative et qualitative des constituants des eaux résiduaires et non résiduaires;
de la détermination de la composition chimique des échantillons; - de la délivrance des attestations de qualité.
Art. 16 —  Placé sous l'autorité d'un Chef de Service, le Service de l'Analyse Minéralogique et des Essais est chargé :
de l'étude des fonds de batée ;
de l'analyse des roches et des minéraux;
des essais de traitement des minerais;
de l'étude optique et spectrale des roches et minéraux;
de la confection des lames minces;
des travaux de fonte, de titrage et d'affinage des substances précieuses;
du contrôle des titres des bijoux en or et en d'autres pierres précieuses fabriqués localement;
de l'établissement des attestations de qualité des articles de joaillerie.
Art. 17 —  Placé sous l'autorité d'un Chef de Service, le Service de l'Analyse des Produits Pétroliers est chargé :
de l'analyse de la qualité des produits pétroliers en procédant au contrôle de la couleur du produit, à la mesure de sa densité, à la détermination du taux de pollution et à l'identification de la nature des éléments polluants et de leur quantité;
de l'établissement des attestations de qualité des produits pétroliers; - de toutes prestations requises.
SECTION 5
DU SERVICE DU COURRIER ET DE LIAISON
Art. 18 —  Placé sous l'autorité d'un Chef de Service, le Service du Courrier et de Liaison est chargé :
de la réception, du traitement et de la ventilation du courrier;
de la relance des services pour le traitement des dossiers ;
du classement et de la conservation des actes signés.
SECTION 6
DU SERVICE DE LA TRADUCTION
Art. 19 —  (1) Placé sous l'autorité d'un Chef de Service, le Service de la Traduction est chargé de la traduction courante pour le compte du Ministère.
(2) Il comprend :
le Bureau de la Traduction en Langue Française;
le Bureau de la Traduction en Langue Anglaise.
SECTION 7
DU SERVICE DE LA DOCUMENTATION ET DES ARCHIVES
Art. 20 —  (1) Placé sous l'autorité d'un Chef de Service, le Service de la Documentation et des Archives est chargé :
de la conception et de la mise en place d'un système de classement de la documentation administrative;
de la collecte, de la centralisation, de la conservation, de la multiplication et de la diffusion des documents du ministère;
de la mise à la disposition du public des documents des secteurs des mines, de l'eau et de l'énergie;
de l'abonnement aux publications à caractère technique relatives aux mines à l'eau et à l'énergie;
de la conservation des archives.
(2) Il comprend :
le Bureau de la Documentation;
le Bureau des Archives ;
le Bureau de la Reprographie.
CHAPITRE II
DE LA DIRECTION DES MINES ET DE LA GEOLOGIE
Art. 21 —  (1) Placée sous l'autorité d'un Directeur, la Direction des Mines et de la Géologie est chargée :
de la formulation des politiques et des stratégies dans le secteur des mines et de la géologie;
de la promotion des activités minières et géologiques;
de la production des cartes géologiques, en relation avec les institutions spécialisées ;
de la prospection géologique, minière et hydrogéologique en cas de besoin;
de la coordination des activités de prospection géologique, minière et hydrogéologique confiées à des partenaires;
de l'identification des risques naturels, de l'élaboration de la carte nationale des risques naturels et de la mise en œuvre des mesures de surveillance et protection des personnes et des biens, en liaison avec les départements ministériels concernés par les questions relatives aux risques et catastrophes naturels;
du contrôle de l'exploitation minière, pétrolière, saline, des carrières et des aux minérales et thermominérales;
du contrôle des installations industrielles et commerciales sous l'angle de la pollution, de la sécurité, de l'hygiène et des nuisances industrielles;
du contrôle des substances explosives et détonantes;
de la participation à la détermination de la fiscalité minière;
de la conservation de la documentation géologique et minière.
(2) Elle comprend :
le Centre de la Documentation Géologique et Minière;
la Cellule des Etudes et de la Normalisation ;
la Sous-Direction de la Géologie, des Risques et Catastrophes Naturels,
la Sous-Direction des Activités Minières et des Installations Classées.
SECTION 1
DU CENTRE DE LA DOCUMENTATION GEOLOGIQUE ET MINIERE
Art. 22 —  (1) Placé sous l'autorité d'un Chef de Centre, le Centre de la Documentation Géologique et Minière est chargé :
de la collecte et de la conservation des rapports géologiques, miniers et pétroliers, des cartes géologiques et des cartes de risques naturels;
de l'acquisition et de la conservation des manuels et revues scientifiques ayant trait au secteur des mines et de la géologie;
de la collecte et de la conservation des échantillons de roches et des minerais.
(2) Il comprend:
- le Bureau de la Banque des Données et de la Cartothèque; - le Bureau de la Bibliothèque.
SECTION 2
DE LA CELLULE DES ETUDES ET DE LA NORMALISATION
Art. 23 —  (1) Placée sous l'autorité d'un Chef de Cellule, la Cellule des Etudes et de la Normalisation est chargée :
de l'élaboration du cadre juridique régissant le secteur des mines et de la géologie;
de l'élaboration des plans, programmes et projets visant la prospection et la valorisation des ressources minérales et des hydrocarbures;
de la promotion des activités géologiques, minières et pétrolières visant à susciter un partenariat opérationnel aussi bien avec les opérateurs économiques nationaux qu'étrangers;
de la définition et de la publication des normes de qualité des articles de joaillerie;
de l'établissement des normes et des mesures à respecter en matière de nuisances industrielles visant la protection contre la pollution ainsi que des normes et des mesures de sécurité à respecter dans l'utilisation des engins à vapeur et à pression et des substances explosives ,
de la participation aux études en vue de la tarification des substances minérales.
(2) Elle comprend, outre le Chef de Cellule, trois (3) Chargés d'Etudes Assistants.
SECTION 3
DE LA SOUS-DIRECTION DE LA GEOLOGIE DES RISQUES ET CATASTROPHES NATURELS
Art. 24 —  (1) Placée sous l'autorité d'un Sous-Directeur, la Sous-Direction de la Géologie, des Risques et Catastrophes Naturels est chargée :
de la reconnaissance du sous-sol en vue de déceler des substances utiles, notamment les minerais, les hydrocarbures, les combustibles, les fertilisants, les matériaux de construction;
de la prospection et de l'évaluation des réserves des gisements minéraux, des nappes aquifères, des eaux minérales et thermominérales, des hydrocarbures;
de l'application des programmes de travaux d'identification des risques naturels;
de la mise en œuvre des mesures de surveillance des risques naturels et de protection des personnes et des biens en cas de catastrophes naturelles, en relation avec les administrations compétentes;
du contrôle des activités de prospection attribuées aux tiers.
(2) Elle comprend:
le Service de la Reconnaissance du Sol et du Sous-Sol;
le Service de la Cartographie et des Risques Naturels;
le Service du Suivi des Prospections Attribuées.
Art. 25 —  Placé sous l'autorité d'un Chef de Service, le Service de la Reconnaissance du Sol et du Sous-Sol est chargé:
de l'identification et de l'évaluation des substances minérales, des nappes aquifères et des matériaux de construction;
des autorisations d'exportation des échantillons de roches;
de l'établissement des statistiques géologiques et minières.
Art. 26 —  Placé sous l'autorité d'un Chef de Service, le Service de la Cartographie et des Risques Naturels est chargé:
du levé et de l'établissement des cartes géologiques, hydrogéologiques, thématiques et d'indices minéraux;
de l'établissement et de la mise à jour des cartes de matériaux de construction décelés dans le sous-sol;
des sondages et des mesures physiques et chimiques pour l'identification et le contrôle des risques naturels;
de l'élaboration et de la mise à jour de la carte nationale des risques naturels;
de l'établissement des avis et préavis géologiques exigibles préalablement à tous travaux de génie civil, de bâtiment et à tous aménagements des sites;
de l'application des mesures de surveillance des risques naturels et de protection des personnes et des biens.
Art. 27 —  Placé sous l'autorité d'un Chef de Service, le Service du Suivi des Prospections Attribuées est chargé:
de la préparation des actes et titres administratifs attribuant aux partenaires la prospection géologique et l'exploration minière, pétrolière, des eaux minérales et thermominérales ainsi que de leur renouvellement;
de la tenue des registres et fichiers des prospections attribuées et des attributaires;
de l'exploitation des rapports de prospection et d'exploration des partenaires;
de l'établissement des statistiques relatives aux activités de prospection et d'exploration géologique et minière;
du calcul des taxes et redevances réglementaires de prospection minière;
du calcul la rente minière.
SECTION 4
DE LA SOUS-DIRECTION DES ACTIVITÉS MINIÈRES ET DES INSTALLATIONS CLASSÉES
Art. 28 —  (1) Placée sous l'autorité d'un Sous-Directeur, la Sous-direction des Activités Minières et des Installations Classées est chargée :
du contrôle de la production, du transport, de la transformation, et de la commercialisation des substances et eaux minérales, des hydrocarbures et des produits des carrières;
du contrôle des conditions d'implantation et d'exploitation des établissements classés dangereux, insalubres ou incommodes;
du contrôle de l'application des normes de pollution industrielle;
du contrôle administratif et technique des appareils à vapeur et à pression;
du contrôle des substances explosives et détonantes ;
de la participation à la détermination de la fiscalité minière.
(2) Elle comprend:
le Service du Contrôle de l'Exploitation des Substances Minérale;
le Service du Contrôle de l'Exploitation des Hydrocarbures;
le Service du Contrôle des Nuisances Industrielles et des Installations Classées.
Art. 29 —  Placé sous l'autorité d'un Chef de Service, le Service du Contrôle de l'Exploitation des Substances Minérales est chargé :
du contrôle de l'exploitation, de la transformation, du transport et de la commercialisation des substances minérales;
de la préparation des actes et titres administratifs conférant aux tiers l'exploitation, la transformation, le transport et la commercialisation des substances minérales non fossiles et des eaux minérales ainsi que de leur renouvellement;
du contrôle de spécialisation des substances explosives et détonantes dans l'exploitation des carrières ;
de l'exploitation des rapports de déclaration des productions des exploitants;
de l'établissement des statistiques de production, de consommation et de commercialisation des substances minérales, des eaux minérales et thermominérales;
du calcul des taxes et redevances réglementaires d'exploitation et de commercialisation des substances minérales;
du calcul de vente minière.
Art. 30 —  Placé sous l'autorité d'un Chef de Service, le Service du Contrôle de l'Exploitation des Hydrocarbures est chargé :
du contrôle de l'exploitation des hydrocarbures exécutée par les partenaires agréés;
de la comptabilité et des statistiques des hydrocarbures produites;
du contrôle des instruments et équipements des mesures et de leur étalonnage;
de l'échantillonnage et du contrôle de la qualité des hydrocarbures produites;
du suivi des enlèvements et expéditions des stocks de produits pétroliers;
des taxes et des redevances liées à l'exploitation des hydrocarbures;
du calcul de la rente minière.
Art. 31 —  Placé sous l'autorité d'un Chef de Service, le Service des Nuisances Industrielles et des Installations Classées est chargé :
du contrôle technique des conditions d'implantation et d'exploitation des établissements classés dangereux, insalubres ou incommodes, en relation avec les départements ministériels compétents;
de la préparation des actes et titres administratifs autorisant l'exercice des activités d'exploitation des installations classées et de la vérification des appareils à vapeur et à pression;
du contrôle des appareils à vapeur et à pression donnant lieu à l'établissement des certificats de visite ou d'épreuve;
des audits de pollution industrielle en vue du contrôle des rejets solides, liquides et des effluents gazeux des établissements industriels et commerciaux;
du contrôle technique des engins motorisés de levage et de manutention sous l'angle de la pollution et de la sécurité;
de l'homologation des engins motorisés et des dispositifs anti-pollution et de la protection contre l'explosion et l'incendie dans les installations et équipements industriels.
CHAPITRE III
DE LA DIRECTION DE L'EAU
Art. 32 —  (1) Placée sous l'autorité d'un Directeur, la Direction de l'Eau est chargée:
de la formulation des politiques et des stratégies d'alimentation en eau potable des agglomérations urbaines et rurales;
de la gestion des ressources en eau;
de l'alimentation en eau potable des agglomérations urbaines et rurales;
de l'application des programmes d'assainissement urbain et rural en relation avec les départements ministériels concernés.
(2) Elle comprend :
la Cellule des Etudes et de la Normalisation;
la Sous-Direction de la Gestion de l'Eau;
la Sous-Direction des Adductions d'Eau;
la Sous-Direction de l'Assainissement.
SECTION 1
DE LA CELLULE DES ETUDES ET DE LA NORMALISATION
Art. 33 —  (1) Placée sous l'autorité d'un Chef de Cellule, la Cellule des Etudes et de la Normalisation est chargée :
de l'élaboration du cadre juridique régissant les secteurs de l'eau et de l'assainissement;
de l'élaboration des plans, programmes et projets d'adduction d'eau;
de l'élaboration des plans, programmes et projets d'assainissement;
de la définition et de la publication des normes de qualité de l'eau;
de l'établissement des normes et des mesures à respecter en matière d'assainissement;
de la participation aux études en vue de la tarification de l'eau.
(2) Elle comprend, outre le chef de Cellule, deux (2) Chargés d'Etudes Assistants.
SECTION 2
DE LA SOUS-DIRECTION DE LA GESTION DE L'EAU
Art. 34 —  (1) Placée sous l'autorité d'un Sous-Directeur, la Sous-Direction de la Gestion de l'Eau est chargée:
de l'inventaire et de la protection des ressources en eau ;
du contrôle technique des exploitations des concessionnaires;
du contrôle du respect de la réglementation en matière d'utilisation de l'eau;
de la tarification des prélèvements d'eau à usage non domestique.
(2) Elle comprend:
le Service de l'Inventaire des Ressources en Eau;
le Service du Contrôle de la Qualité des Eaux;
le Service des Redevances et Taxes.
Art. 35 —  Placé sous l'autorité d'un Chef de Service, le Service de l'Inventaire des Ressources en Eau est chargé :
de l'inventaire des ressources en eau et de l'évaluation des réserves sur le plan national;
des synthèses des statistiques de production et de consommation;
des bilans des ressources en eau;
du contrôle de l'application des normes, mesures et principes prescrits en vue des économies de l'eau.
Art. 36 —  Placé sous l'autorité d'un Chef de Service, le Service du Contrôle de la Qualité des Eaux est chargé :
des prélèvements réguliers des eaux livrées à la consommation et à d'autres usages, en vue d'un contrôle de qualité ;
du contrôle de l'application des mesures de protection des ressources en eau contre la pollution ;
de l'application des pénalités prévues en cas d'inobservation des mesures prescrites contre la pollution des ressources en eau.
Art. 37 —  Placé sous l'autorité d'un Chef de Service, le Service des Redevances et Taxes est chargé :
de l'élaboration des états de recouvrement des redevances et taxes des prélèvements d'eau à usage non domestique ;
de l'élaboration des états de recouvrement des redevances et taxes des activités à impact polluant et d'investissement à l'assainissement.
SECTION 3
DE LA SOUS-DIRECTION DES ADDUCTIONS D'EAU
Art. 38 —  (1) Placée sous l'autorité d'un Sous-Directeur, la Sous-Direction des Adductions d'Eau est chargée:
de l'application des programmes d'adduction d'eau urbaine ;
de l'application des programmes d'hydraulique rurale;
de la mise à jour des fichiers des réseaux d'adduction d'eau rurale;
du contrôle et de la maintenance des ouvrages d'adduction d'eau urbaine et d'hydraulique rurale.
(2) Elle comprend:
le Service du Contrôle des Adductions d'Eau Urbaines;
le Service du Contrôle des Points et Adductions d'Eau Ruraux; - le Service du Contrôle et de la Maintenance des Ouvrages.
Art. 39 —  Placé sous l'autorité d'un Chef de service, le Service du Contrôle des Adductions d'Eau Urbaines est chargé:
de la préparation des dossiers d'appel d'offres, des conventions et contrats relatifs aux projets d'adduction d'eau;
de la préparation des dossiers d'expropriation et d'indemnisation pour cause d'utilité publique, en liaison avec les départements ministériels concernés;
du contrôle technique des grands travaux d'adduction d'eau;
de la vérification et du visa des décomptes;
de la réception des travaux.
Art. 40 —  Placé sous l'autorité d'un Chef de Service, le Service du Contrôle des Points et Adductions d'Eau Ruraux est chargé :
du suivi des programmes d'hydraulique rurale initiés sur l'ensemble du territoire;
de la préparation des dossiers d'appel d'offres relatifs aux travaux, conformément à la réglementation sur les marchés publics;
du contrôle technique des grands travaux d'adduction d'eau en milieu rural;
de la mise à jour du fichier national des réseaux d'adduction d'eau en milieu rural;
du visa de construction des puits et forages.
Art. 41 —  Placé sous l'autorité d'un Chef de Service, le Service du Contrôle et de la Maintenance des Ouvrages est chargé :
de la mise à jour des fichiers des ouvrages, des forages et puits;
de l'organisation du système de maintenance des ouvrages, forages et puits à usage communautaire;
de l'animation et de la formation des communautés villageoises à la maintenance des ouvrages.
SECTION 4
DE LA SOUS-DIRECTION DE L'ASSAINISSEMENT
Art. 42 —  (1) Placée sous l'autorité d'un Sous-Directeur, la Sous-Direction de l'Assainissement est chargée :
de l'application des programmes d'assainissement urbain et rural;
du contrôle et de la maintenance des ouvrages d'assainissement.
(2) Elle comprend:
le Service du Contrôle de l'Assainissement Urbain;
le Service du Contrôle de l'Assainissement Rural;
le Service du Contrôle et de la Maintenance des ouvrages.
Art. 43 —  Placé sous l'autorité d'un Chef de Service, le Service du Contrôle de l'Assainissement Urbain est chargé :
de la préparation des dossiers d'appel d'offres pour la réalisation des projets d'assainissement urbain ;
du contrôle technique et de la réception des travaux;
de l'approbation des projets initiés par les tiers ;
du contrôle du respect des normes techniques et des règles de l'art.
Art. 44 —  Placé sous l'autorité d'un Chef de Service, le Service du Contrôle de l'Assainissement Rural est chargé :
des opérations préparatoires à l'exécution des projets d'assainissement en milieu rural ;
du contrôle d'exécution des ouvrages d'assainissement en milieu rural;
du contrôle de l'application des règles et des mesures d'assainissement prescrites en milieu rural.
Art. 45 —  Placé sous l'autorité d'un Chef de Service, le Service du Contrôle et de la Maintenance des Ouvrages est chargé:
de la tenue et de la mise à jour du fichier des ouvrages d'assainissement;
de l'organisation du système de maintenance en relation avec les administrations et les organismes intéressés par les questions d'assainissement;
de la sensibilisation et de la formation des communautés villageoises à la maintenance des ouvrages d'assainissement et d'épuration des eaux et déchets.
CHAPITRE IV
DE LA DIRECTION DE L'ENERGIE
Art. 46 —  (1) Placée sous l'autorité d'un Directeur, la Direction de l'Energie est chargée :
de la formulation des politiques et des stratégies dans le secteur de l'énergie;
de la promotion des activités du secteur de l'énergie;
du contrôle des activités de prospection, de production, de transformation, de transport, de stockage, de distribution, d'importation et d'exportation de l'énergie;
de l'application des programmes de conservation et du développement des énergies nouvelles et renouvelables;
de l'élaboration et de la publication des monographies et des bilans énergétiques;
de l'élaboration et de la publication des normes et des mesures de sécurité à respecter dans l'utilisation des différentes sources d'énergie.
(2) Elle comprend:
le Service des Bilans et des Economies d'Energie;
la Cellule des Etudes et de la Normalisation;
la Sous-Direction de l'Electricité;
la Sous-Direction des Produits Pétroliers.
SECTION 1
DU SERVICE DES BILANS ET DES ECONOMIES D'ENERGIE
Art. 47 —  Placé sous l'autorité d'un Chef de Service, le Service des Bilans .t des Economies d'Energie est chargé:
de l'inventaire des ressources énergétiques nationales;
de la synthèse des statistiques de production et de consommation; - des bilans énergétiques;
du contrôle d'application dans les services publics des normes, des mesures et des principes prescrits dans le cadre des économies d'énergie;
de l'application des pénalités et sanctions prévues.
SECTION 2
DE LA CELLULE DES ETUDES ET DE LA NORMALISATION
Art. 48 —  (1) Placée sous l'autorité d'un Chef de Cellule, la Cellule des Etudes et de la Normalisation est chargée:
de l'élaboration du cadre juridique régissant les secteurs de l'électricité et des produits pétroliers;
de l'élaboration des plans, programmes et projets visant la prospection et la valorisation des ressources énergétiques;
de la promotion des activités du secteur de l'énergie;
de la définition et de la publication des normes de qualité en matière des produits pétroliers;
de l'établissement des normes et des mesures de sécurité à respecter en matière d'électricité;
de la participation aux études en vue de la tarification de l'énergie.
(2) Elle comprend, outre le chef de Cellule, trois (3) Chargés d'Etudes Assistants.
SECTION 3
DE LA SOUS-DIRECTION DE L'ELECTRICITÉ
Art. 49 —  (1) Placée sous l'autorité d'un Sous-Directeur, la Sous-direction de l'Electricité est chargée:
du contrôle des projets d'exécution des ouvrages d'électrification;
du contrôle de la production, du transport et de la distribution de l'énergie électrique;
du contrôle de l'application des prescriptions relatives à la réalisation des travaux et à l'utilisation des installations électriques dans le cadre de la sécurité publique;
du contrôle du développement des énergies nouvelles.
(2) Elle comprend :
le Service du Contrôle des Travaux Neufs;
le Service du Contrôle des Installations Electriques;
le Service du Contrôle des Implantations des Energies Nouvelles et des Micro-Centrales.
Art. 50 —  Placé sous l'autorité d'un Chef de Service, le Service du Contrôle des Travaux Neufs est chargé :
des enquêtes réglementaires préalables à l'aménagement des installations de production, de transport et de distribution d'énergie électrique;
du contrôle des travaux exécutés dans le cadre des projets d'électrification;
de la préparation des appels d'offres, des conventions et des contrats relatifs aux projets d'électrification;
de l'élaboration des actes et titres administratifs autorisant l'exercice des activités de prospection et d'exploitation de l'énergie électrique.
Art. 51 —  Placé sous l'autorité d'un Chef de Service, le Service du Contrôle des Installations Electriques est chargé :
du contrôle des installations de production, de transport et de distribution de l'énergie électrique;
contrôle de l'application des règlements et normes prescrits;
de l'élaboration des actes et titres administratifs autorisant l'exercice à titre privé des activités de contrôle des installations électriques.
Art. 52 —  Placé sous l'autorité d'un Chef de Service, le Service du Contrôle des Implantations des Energies Nouvelles et des Micro-Centrales est chargé:
de l'élaboration des actes ou titres administratifs autorisant la production et l'exploitation des énergies nouvelles ainsi que l'implantation et l'exploitation des micro-centrales électriques ;
du contrôle de l'application des normes et règlements relatifs à l'implantation et à l'exploitation des énergies nouvelles et des micro-centrales.
SECTION 4
DE LA SOUS-DIRECTION DES PRODUITS PÉTROLIERS
Art. 53 —  (1) Placée sous l'autorité d'un Sous-Directeur, la Sous-Direction des Produits Pétroliers est chargée :
du contrôle des conditions de stockage et de distribution des produits pétroliers;
du contrôle des stocks de sécurité des produits pétroliers;
du contrôle de la qualité des produits pétroliers.
(2) Elle comprend :
le service du Contrôle des Approvisionnements;
le service du Contrôle de la Distribution;
le service du Contrôle de la Qualité.
Art. 54 —  Placé sous l'autorité d'un Chef de Service, le Service du Contrôle des Approvisionnements est chargé:
de l'examen des conditions générales de développement et d'ouverture des dépôts pétroliers;
du contrôle des installations de stockage des produits pétroliers;
du suivi du ravitaillement, des mouvements des produits pétroliers dans les dépôts ainsi que des questions relatives à l'importation et à l'exportation desdits produits;
de l'établissement et de la mise à jour des statistiques sur le stockage des produits pétroliers;
de l'élaboration des actes ou titres administratifs autorisant l'exercice des activités de stockage des produits pétroliers;
Art. 55 —  Placé sous l'autorité d'un Chef de Service, le Service du Contrôle de la Distribution est chargé:
du contrôle des conditions générales d'ouverture des points de distribution des produits pétroliers;
- du contrôle du développement des points de distribution des produits pétroliers;
- du contrôle de l'application de la réglementation relative au transport et à la distribution des produits pétroliers ;
- de la préparation des actes ou titres administratifs autorisant l'exercice des activités de distribution des produits pétroliers;
- de l'établissement et de la mise à jour des statistiques sur le transport et la distribution des produits pétroliers.
Art. 56 —  Placé sous l'autorité d'un Chef de Service, le Service du Contrôle de la Qualité est chargé :
des prélèvements des produits pétroliers dans les raffineries, dépôts pétroliers et points de distribution;
de l'élaboration des actes ou titres administratifs autorisant l'exercice des activités de contrôle des produits pétroliers;
du recouvrement des taxes et amendes;
de l'établissement des statistiques sur le contrôle des produits pétroliers.
SECTION 5
DE DIRECTION DES AFFAIRES GENERALES
Art. 57 —  (1) Placée sous l'autorité d'un Directeur, la Direction des Affaires Générales est chargée:
de la gestion du personnel du Ministère;
de la gestion de la formation du personnel;
de l'élaboration et du suivi de l'exécution du budget;
de la gestion des biens meubles et immeubles.
(2) Elle comprend:
le Service du Personnel;
le Service de la Formation et des Stages; - le Service du Budget;
le Service du Matériel et de la Maintenance.
Art. 58 —  (1) Placé sous l'autorité d'un Chef de Service, le Service du Personnel est chargé :
de la gestion du personnel;
de la discipline générale;
de la gestion prévisionnelle des effectifs en liaison avec le Ministère chargé de la Fonction Publique;
de la mise à jour systématique du fichier du personnel;
des récompenses et distinctions honorifiques.
(2) Il comprend :
le Bureau du Personnel Fonctionnaire ;
le Bureau du Personnel non Fonctionnaire.
Art. 59 —  Placé sous l'autorité d'un Chef de Service, le Service de la Formation et des Stages est chargé:
de l'évaluation des besoins et de la programmation des activités de formation et de perfectionnement, en liaison avec le Ministère chargé de la Fonction Publique;
de l'organisation de la formation, du recyclage et du perfectionnement du personnel en liaison avec le Ministère chargé de la Fonction Publique.
Art. 60 —  (1) Placé sous l'autorité d'un Chef de Service, le Service du Budget est chargé:
de l'élaboration de l'avant projet de budget;
de l'exécution du budget;
de l'approvisionnement des services en matériels et fournitures.
(2) Il comprend :
le Bureau du Budget;
le Bureau des Approvisionnements.
Art. 61 —  (1) Placé sous l'autorité d'un Chef de Service, le Service du Matériel et de la Maintenance est chargé:
de la maintenance des équipements et de l'entretien des bâtiments;
de la propreté des locaux et de leurs abords.
(2) Il comprend :
le Bureau du Matériel;
le Bureau de l'Entretien et de la Maintenance.
TITRE VII
DES SERVICES EXTERIEURS
Art. 62 —  Les Services Extérieurs du Ministère des Mines, de l'Eau et de l'Energie comprennent :
les Délégations Provinciales;
les Délégations Départementales;
CHAPITRE I
DE LA DELEGATION PROVINCIALE DES MINES, DE L'EAU ET DE DEL'ENERGIE
Art. 63 —  (1) Placée sous l'autorité d'un Délégué, la Délégation Provinciale des Mines, de l'Eau et de l'Energie est chargée :
de la coordination des activités des délégations départementales
de la préparation des projets de programmes d'action et de budget ainsi que de la mise en œuvre des opérations retenues;
du contrôle technique des projets exécutés dans la province; - du contrôle de l'exécution des programmes d'action;
de la gestion des ressources humaines, financières et matérielles.
(2) Elle comprend:
le Bureau du Courrier;
le Service des Mines et de la Géologie;
le Service de l'Eau et de l'Assainissement;
le Service de l'Energie;
le Service des Affaires Générales.
Art. 64 —  Placé sous l'autorité d'un chef de Service, le Service Provincial des Mines et de la Géologie est chargé :
de la préparation des titres et actes administratifs relevant des secteurs des mines et de la géologie;
du contrôle technique des projets d'intérêt provincial;
du contrôle de l'exécution des programmes d'action dans le secteur des mines et de la géologie;
du contrôle des ouvrages en or fabriqués dans la Province et de l'expertise des pierres précieuses;
de la préparation et de la mise à jour de la carte provinciale des risques naturels;
Art. 65 —  Placé sous l'autorité d'un Chef de Service, le Service Provincial de l'Eau et de l'Assainissement est chargé:
du contrôle de l'exécution des programmes d'action dans les domaines de l'eau et de assainissement;
de la synthèse des statistiques départementales en matière d'inventaire de l'eau;
des bilans des ressources en eau;
de l'élaboration des états de recouvrement des redevances et des taxes de prélèvements d'eau à usage non domestique au niveau de la province;
de la mise à jour des fichiers des réseaux d'adduction et des points d'eau ruraux;
de la mise à jour des fichiers des ouvrages d'assainissement.
Art. 66 —  Placé sous l'autorité d'un Chef de Service, le Service Provincial de l'Energie est chargé:
du contrôle de l'exécution des programmes d'action dans le domaine de l'énergie;
du contrôle des installations de production, de transport et de distribution de l'énergie;
du suivi de l'application des programmes d'économies d'énergie; - du contrôle de la qualité des produits pétroliers;
de l'instruction des dossiers d'ouverture des dépôts et des points de distribution des produits pétroliers.
Art. 67 —  (1) Placé sous l'autorité d'un Chef de Service, le Service des Affaires Générales est chargé:
de la gestion du personnel;
de la préparation et de l'exécution du budget;
de la gestion du matériel;
de la documentation et des archives.
(2) Il comprend :
le Bureau du Personnel;
le Bureau du Budget;
le Bureau de la Documentation et des Archives.
CHAPITRE II
DE LA DELEGATION DEPARTEMENTALE DES MINES DE L'EAU ET DE L'ENERGIE
Art. 68 —  (1) Placée sous l'autorité d'un Délégué, la Délégation Départementale des Mines, de l'Eau et de l'Energie est chargée:
du contrôle des activités du Ministère dans le département;
des études de faisabilité des projets d'hydraulique et d'électrification; - du contrôle technique des projets;
de la gestion du personnel;
de la préparation des actes et titres administratifs relevant des secteurs des mines, de l'eau et de l'énergie;
de la formation des communautés villageoises à la maintenance des ouvrages et aux techniques d'assainissement;
de la gestion du matériel;
de la tenue de la documentation et des archives.
(2) Elle comprend:
le Bureau des Mines et de la Géologie;
le Bureau de l'Eau et de Assainissement;
le Bureau de l'Energie ;
le Bureau des Affaires Générales.
TITRE VIII
DES DISPOSITIONS DIVERSES ET FINALES
Art. 69 —  Dans le chef-lieu de province, le Délégué Provincial cumule ses fonctions avec celles de Délégué Départemental.
Art. 70 —  (1) La réalisation de certains projets importants relevant du Ministère des Mines, de l'Eau et de l'Energie peut être placée, par voie réglementaire, sous la responsabilité d'un ingénieur, Chef de projet.
(2) L'acte réglementaire précise les rang et prérogatives des différents responsables du projet.
Art. 71 —  Les nominations aux postes de responsabilité prévus dans le présent décret se font conformément aux profils retenus dans le cadre organique ci-annexé.
Art. 72 —  Ont rang et prérogatives de:
Sous-directeur de l'administration centrale:
les Chefs de Cellule; - le Chef du Centre des Analyses et des Essais;
les Délégués Provinciaux.
Chef de service de l'administration Centrale:
les Chargés d'Etudes Assistants;
le Chef du Centre de la Documentation Géologique et Minière;
les Délégués Départementaux.
Art. 73 —  Sont abrogées, toutes les dispositions antérieures contraires, notamment celles du décret n° 088/1350 du 30 Septembre 1988 portant organisation du Ministère des Mines, de l'Eau et de l'Energie.
Art. 74 —  Le présent décret sera enregistré, publié selon la procédure d'urgence, puis inséré au Journal Officiel en Français et en Anglais.","DECRET_N°_96_227_DU_0_01_OCTOBRE_1996_PORTANT_ORGANISATION_DU_MINISTERE_DES_MINES,_DE_L_EAU_ET_DE_L_ENERGIE."
