URL,text,page_title,page_label,metadata
https://www.juriafrica.com/lex/decret-2021-557-16-septembre-2021-49912.htm,"LE PRESIDENT DE LA REPUBLIQUE,
Vu la Constitution ;
Vu la loi n°2020/018 du 17 décembre 2020 portant loi de finances de la République du Cameroun pour l'exercice 2021 ;
Vu la loi n°2021/010 du 21 juin 2021 portant ratification de l'ordonnance n°2021/002 du 26 mai 2021 modifiant et complétant certaines dispositions de la loi n°2020/018 du 17 décembre 2020 portant loi de finances de la République du Cameroun pour l'exercice 2021 ;
Vu la loi n°2021/016 du 09 juillet 2021 portant ratification de l'ordonnance n°2021/003 du 07 juin 2021 modifiant et complétant certaines dispositions de la loi n°2020/018 du 17 décembre 2020 portant loi de finances de la République du Cameroun pour l'exercice 2021 ;
Vu le décret n°2011/408 du 09 décembre 2011 portant organisation du Gouvernement, modifié et complété par le décret n°2018/190 du 02 mars 2018,
DECRETE:
Art. 1er —  .- Le Ministre de l'Economie, de la Planification et de l'Aménagement du Territoire est habilité, avec faculté de délégation, à signer avec l'Association Internationale de Développement (IDA), un Accord de Prêt d'un montant de 68,5 millions d'euros, soit environ 44,9 milliards de francs CFA, pour le financement du Projet Régional sur l'Autonomisation de la femme et le Dividende Démographique, volet Cameroun (SWEDD2).
Art. 2 —  Le présent décret sera enregistré, publié suivant la procédure d'urgence, puis inséré au Journal Officiel en français et en anglais. /-",DECRET_N_2021_557_DU_16_SEPTEMBRE_2021_HABILITANT_LE_MINISTRE_DE_L_ECONOMIE_DE_LA_PLANIFICATION_ET_DE_L_AMENAGEMENT_DU_TERRITOIRE_A_SIGNER_AVEC_L_ASSOCIATION_INTERNATIONALE_DE_DEVELOPPEMENT_IDA_UN_ACCORD_DE_PRET_D_UN_MONTANT_DE_68_5_MILLIONS_D_EUROS_SOIT_ENVIRON_44_9_MILLIARDS_DE_FRANCS_CFA_POUR_LE_FINANCEMENT_DU_PROJET_REGIONAL_SUR_L_AUTONOMISATION_DE_LA_FEMME_ET_LE_DIVIDENDE_DEMOGRAPHIQUE_VOLET_CAMEROUN_SWEDD2,0,
