URL,text,page_title,page_label,category,metadata
https://www.juriafrica.com/lex/decret-2024-638-02-decembre-2024-56213.htm,"DECRET N°2024/638 DU 02 DÉCEMBRE 2024 HABILITANT LE MINISTRE DE L'ECONOMIE, DE LA PLANIFICATION ET DE L'AMÉNAGEMENT DU TERRITOIRE À SIGNER, AVEC LE FONDS KOWEITIEN POUR LE DÉVELOPPEMENT ECONOMIQUE ARABE (FKDEA), UN ACCORD DE FINANCEMENT D'UN MONTANT DE 3 MILLIONS DE DINARS KOWEITIENS, REPRÉSENTANT ENVIRON 9,9 MILLIONS USD, SOIT ENVIRON 5,9 MILLIARDS FCFA, POUR LE FINANCEMENT DU PROJET DE DÉVELOPPEMENT DE LA CHAÎNE DE VALEUR DU RIZ AU CAMEROUN (PDCVRC).

LE PRESIDENT DE LA REPUBLIQUE
Vu la Constitution ;
Vu la loi n° 2023/019 du 19 décembre 2023 portant loi de finances de la République du Cameroun pour l'exercice 2024, modifiée et complétée par l'Ordonnance n°2024/001 du 20 juin 2024 ;
Vu le décret n°2011/408 du 09 décembre 2011 portant organisation du Gouvernement, modifié et complété par le décret n°2018/190 du 02 mars 2018,
DECRETE:
Art. 1er —  .- Le Ministre de l'Economie, de la Planification et de l'Aménagement du Territoire est habilité, avec faculté de délégation, à signer avec le Fonds Koweitien pour le Développement Economique Arabe (FKDEA), un Accord de financement d'un montant de 3 millions de dinars koweitiens, représentant environ 9,9 millions USD, soit environ 5,9 milliards FCFA, pour le financement du Projet de Développement de la Chaîne de Valeur du Riz au Cameroun (PDCVRC).
Art. 2 —  Le présent décret sera enregistré, publié suivant la procédure d'urgence puis inséré au Journal Officiel en français et en anglais./-.
Yaoundé, le 02 Décembre 2024
LE PRESIDENT DE LA REPUBLIQUE,
PAUL BIYA.",DECRET_N_2024_638_DU_02_DECEMBRE_2024_HABILITANT_LE_MINISTRE_DE_L_ECONOMIE_DE_LA_PLANIFICATION_ET_DE_L_AMENAGEMENT_DU_TERRITOIRE_A_SIGNER_AVEC_LE_FONDS_KOWEITIEN_POUR_LE_DEVELOPPEMENT_ECONOMIQUE_ARABE_FKDEA_UN_ACCORD_DE_FINANCEMENT_D_UN_MONTANT_DE_3_MILLIONS_DE_DINARS_KOWEITIENS_REPRESENTANT_ENVIRON_9_9_MILLIONS_USD_SOIT_ENVIRON_5_9_MILLIARDS_FCFA_POUR_LE_FINANCEMENT_DU_PROJET_DE_DEVELOPPEMENT_DE_LA_CHAINE_DE_VALEUR_DU_RIZ_AU_CAMEROUN_PDCVRC,0,decret,
