URL,text,page_title,page_label,metadata
https://www.juriafrica.com/lex/decret-95-678-pm-18-decembre-1995-15884.htm,"LE PREMIER MINISTRE, CHEF DU GOUVERNEMENT,
VU la Constitution ;
VU l'ordonnance n° 74/1 du 06 juillet 1974 fixant le régime foncier, ensemble des divers modificatifs ;
VU l'ordonnance n° 74/02 du 06 juillet 1994 fixant le régime domanial, ensemble ses divers modificatifs, notamment en ses articles 10, 11, 12 et 13 ;
VU la loi n° 94/01 du 20 janvier 1994 portant régime des forêts, de la faune et de la pêche ;
VU le décret n° 76/166 du 27 avril 1976 fixant les modalités de gestion du domaine national ;
VU le décret n° 76/177 fixant les modalités de gestion du domaine privé de l'Etat ;
VU le décret n° 92/089 du 4 mai 1992 précisant les attributions du Premier Ministre ;
VU le décret n° 92/244 du 25 novembre 1992 portant nomination du Premier Ministre, Chef du Gouvernement ;
VU le décret n° 92/245 du 26 novembre 1992 portant organisation du Gouvernement, ensemble ses divers modificatifs ;
VU le décret n° 95/531/PM du 23 août 1995 fixant les modalités d'application du régime des forêts ;
DECRETE :
Art. 1er —  (1) Il est institué un cadre à caractère indicatif d'utilisation des terres en zone forestière méridionale du Cameroun.
(2) Ce cadre indicatif est destiné à servir d'outil de planification, d'orientation et d'exploitation des ressources naturelles à l'intérieur de la zone citée au (1) ci-dessus :
au nord par la limite théorique représentée par l'axe routier Douala-Edéa-Yaoundé-Ayos-Bertoua-Batouri-Gamboula ;
à l'est par la frontière avec la République Centrafricaine ;
au sud par la frontière avec le Congo, le Gabon et la Guinée Equatoriale ;
à l'ouest par la bordure maritime s'étendant entre Douala et la frontière continentale avec la Guinée Equatoriale.
Art. 3 —  Conformément à l'article 20 de la loi n° 94/01 du 20 janvier 1994 susvisée, la zone ainsi définie comprend :
le domaine forestier permanent ; et,
le domaine forestier non permanent.
Art. 4 —  (1) Conformément à l'article 21 de la loi n° 94/01 du 20 janvier 1994 précitée, le domaine forestier permanent est constitué de massifs forestiers ci-après :
Les forêts domaniales appartenant à l'Etat, notamment les réserves écologiques intégrales, les forêts de protection, les sanctuaires, les réserves de faune, les parcs nationaux, les forêts de récréation, les forêts d'enseignement et de recherche, ainsi que les forêts de production
Les forêts communales.
(2) Les modalités de matérialisation des limites des massifs forestiers visés au (2) ci-dessus sont fixées par le Ministre chargé du cadastre et des domaines, en liaison avec les autres administrations concernées.
Art. 5 —  Le domaine forestier non permanent comprend tous les massifs forestiers non visés à l'article 4 ci-dessus.
Art. 6 —  (1) Le domaine forestier permanent est délimité suivant le plan joint en annexe.
(2) Les limites et les caractéristiques des différentes catégories de forêts qui le composent seront précisées après découpage et consultation des populations.
Art. 7 —  (1) La gestion des domaines forestiers permanente et non permanente relève du Ministre chargé des forêts, suivant les modalités fixées par un décret particulier.
(2) Elle se fait sur la base d'un aménagement durable pour le domaine forestier permanent, et d'un aménagement d'attente ou spéculatif, ou à vocation multiples pour le domaine forestier non permanent.
(3) Toute activité susceptible d'entrer en conflit avec la vocation prioritaire arrêtée pour chaque domaine forestier est interdite.
Art. 8 —  Les Vice-premiers Ministres chargés de l'Administration Territoriale et de l'Urbanisme et de l'Habitat, ainsi que le Ministre de l'Environnement et des Forêts sont chargés, chacun en ce qui le concerne, de l'application du présent décret qui sera enregistré, publié suivant la procédure d'urgence, puis inséré au journal officiel en anglais et en français.",DECRET_N_95_678_PM_DU_INSTITUANT_UN_CADRE_INDICATIF_D_UTILISATION_DES_TERRES_EN_ZONE_FORESTIERE_MERIDIONALE,0,
