URL,text,page_title,page_label,metadata
https://www.juriafrica.com/lex/decret-2005-286-30-juillet-2005-27725.htm,"LE PRESIDENT DE LA REPUBLIQUE,
Vu la Constitution
Vu le Décret n° 2004/320 du 8 décembre 2004 portant organisation du Gouvernement,
DECRETE:
TITRE I
DISPQSITIONS GENERALES
Art. 1er —  Le Ministère des Relations Extérieures est placé sous l'autorité d'un Ministre, assisté :
d'un Ministre Délégué chargé de la Coopération avec les Etats membres du Commonwealth ;
d'un Ministre Délégué chargé de la Coopération avec le monde islamique.
Art. 2 —  Le Ministre des Relatons Extérieures a pour mission d'assurer la mise en œuvre de la politique des relations extérieures arrêtée par le Président de la République.
A ce titre, il est chargé :
des relations, avec les Etats étrangers, les organisations internationales et les autres sujets de la communauté internationale ;
de la protection des ressortissants et des intérêts camerounais à l'étranger,
En outre :
il rassemble et diffuse auprès des départements ministériels des informations relatives aux Etats étrangers et aux organisations internationales qui pourraient faciliter l'action des services publics ;
il concourt à l'information des gouvernements étrangers, de leur opinion publique, ainsi que des organisations internationales en ce qui concerne le développement politique, économique, social et culturel du Cameroun, en liaison avec Le Ministère de la Communication ;
de la gestion des carrières des personnels diplomatiques.
Art. 3 —  ,(1) Pour l'accomplissement de ses missions, le Ministre des Relations Extérieures dispose :
d'un Secrétariat Particulier ;
de cinq (05) Conseillers Techniques ;
d'une Inspection Générale ;
d'une Administration Centrale ;
de Services Extérieurs.
(2) Chaque Ministre Délégué dispose également d'un Secrétariat Particulier.
TITRE II
DES SECRETARIATS PARTICULIERS
Art. 4 —  ,Placés chacun sous l'autorité d'un Chef de Secrétariat Particulier, les Secrétariats Particuliers sont chargés des affaires réservées du Ministre et des Ministres Délégués,
TITRE III
DES CONSEILLERS TECHNIQUES
Art. 5 —  Les Conseillers Techniques effectuent toutes missions qui leur sont confiées par le Ministre et les Ministres Délégués.
TITRE IV
L'INSPECTIOIN GENERALE
Art. 6 —  (1) L'Inspection Générale veille sur le rendement et la qualité du service.
A ce titre, elle est chargée :
En liaison avec le Secrétaire Général :
de l'évaluation des performances et du contrôle interne du fonctionnement des services centraux et extérieurs par rapport aux objectifs fixés ;
du contrôle des services consulaires, des services administratifs et financiers et du patrimoine du Ministère ;
des questions d'éthique professionnelle ;
de la mise en œuvre de la stratégie de lutte contre la corruption au sein du Département, en liaison avec la Cellule de Lutte contre la Corruption du Ministère.
En liaison avec les services chargés de la réforme administrative :
de l'évaluation de l'application des techniques d'organisation et des méthodes de travail;
de la simplification du travail administratif.
(2) Elle comprend trois (03) Inspecteurs Généraux chargés respectivement :
des questions consulaires ;
des questions administratives, financières et d'éthique professionnelle ;
des questions relatives au patrimoine du Ministère.
(3) Chaque Inspecteur Général est assisté d'un (01) Inspecteur.
(4) La coordination des activités de l'inspection Générale est assurée par l'Inspecteur Général le plus ancien dans le grade le plus élevé.
Art. 7 —  (1) L'Inspection Générale assure le contrôle et l'évaluation des services extérieurs au moins une fois l'an et des services centraux au moins une fois par trimestre.
(2) Dans l'accomplissement de leurs missions, les Inspecteurs Généraux et les Inspecteurs ont accès à tous les documents des services contrôlés.
Dans ce cadre, ils peuvent :
demander des informations, des explications ou des documents aux responsables des services contrôlés qui sont tenus de répondre ou de les fournir dans les délais impartis
disposer, à titre ponctuel, du personnel nécessaire à leurs missions relevant des autres services du Ministère ;
constater par écrit les atteintes à la fortune publique et requérir, en cas de nécessité, après autorisation du Ministre et conformément à la loi, la force publique en vue de leur prêter main forte.
(3) Chaque mission d'inspection ou de contrôle interne donne lieu à la rédaction d'un rapport adressé au Ministre, qui transmet avec ses observations, copie dudit rapport au Premier Ministre, Chef du Gouvernement, au Secrétaire Général de la Présidence de la République, au Ministre chargé de la Réforme Administrative et au Ministre chargé du Contrôle Supérieur de l'Etat.
(4) L'Inspection Générale élabore annuellement un rapport d'activités. Le Ministre des Relations Extérieures adresse copie dudit rapport, assortie de ses observations, au Premier Ministre, Chef du Gouvernement et au Secrétaire Général de la Présidence de la République.
TITRE V
DE L'DAMINISTRATION CENTRALE
Art. 8 —  L'Administration centrale comprend :
le Secrétariat Général
la Direction des Affaires d'Afrique ;
la Direction des Affaires d'Europe
la Direction des Affaires d'Amérique et des Caraïbes ;
la Direction des Affaires d'Asie et des Relations avec l'Organisation de la Conférence Islamique ;
la Direction des Nations Unies et de la Coopération Décentralisée ;
la Direction des Relations avec l'Organisation Internationale de la Francophonie ;
la Direction des Relations avec le Commonwealth ;
la Direction de l'Information, de la Documentation et des Archives Diplomatiques ;
la Direction du Protocole et des Affaires Consulaires ;
la Direction des Affaires Générales.
CHAPITRE I
DU SECRETARIAT GENERAL
Art. 9 —  (1) Le Secrétariat Général est placé sous l'autorité d'un Secrétaire Général. Principal collaborateur du Ministre, le Secrétaire Général suit l'instruction des affaires du Département et reçoit du Ministre les délégations de signature nécessaires.
(2) Sous l'autorité du Ministre, le Secrétaire Général :
définit et codifie les procédures internes au Ministère ;
approuve les programmes d'action des services du Département ;
coordonne l'action des services centraux et tient à cet effet des réunions dont il adresse les comptes-rendus au Ministre ;
veille à la célérité dans le traitement des dossiers ;
suit la gestion des carrières des personnels diplomatiques et veille à la mise en œuvre du principe de rotation des personnels ;
assure et contrôle la conformité et l'authenticité des actes de gestion des carrières ;
suit l'action des services extérieurs dont il reçoit les rapports d'activités ;
du suivi des problèmes d'ordre culturel et social des camerounais à l'étranger, en liaison avec les administrations concernées ;
du suivi des questions d'évacuation sanitaire et de rapatriement des dépouilles mortelles, en liaison avec les administrations concernées ;
de l'élaboration des politiques et stratégies, en vue de la participation et de la contribution des camerounais de l'étranger au développement socio- économique de leur pays ;
de la tenue et de la mise à jour du fichier des camerounais à l'étranger, en liaison avec les services consulaires concernés.
(2) Elle comprend, outre le Chef de Division, trois (03) Chargés d'Etudes et trois (Os) Chargés d'Etudes-Assistants.
SECTION II
DE LA DIVISION DES AFFAIRES JURIDIQUES ET DES TRAITES
Art. 12 —  (1) Placée sous l'autorité d'un Chef de Division: la Division des Affaires Juridiques et des Traités est chargée :
du suivi du développement progressif du droit international ;
des questions relatives à la codification et à la conformité de la législation et de la réglementation internes aux engagements juridiques internationaux de la République du Cameroun ;
de la défense des intérêts de l'Etat en justice chaque fois que le Département est concerné ;
des avis sur les questions de droit international dont est saisi le Département et sur les aspects juridiques des questions traitées dans les autres services du Ministère ;
du règlement des litiges concernant les organismes ou les particuliers couverts par les immunités diplomatiques et les privilèges de juridiction ;
des procédures de ratification des Traités et des Conventions internationaux, ainsi que des autres procédures par lesquelles le Cameroun exprime son consentement ;
de la négociation et de la mise en forme définitive des Traités et des Conventions à caractère bilatéral et multilatéral ;
du suivi des problèmes d'ordre culturel et social des camerounais à l'étranger, en liaison avec les administrations concernées ;
du suivi des questions d'évacuation sanitaire et de rapatriement des dépouilles mortelles, en liaison avec les administrations concernées ;
de l'élaboration des politiques et stratégies, en vue de la participation et de la contribution des camerounais de l'étranger au développement socio- économique de leur pays ;
de la tenue et de la mise à jour du fichier des camerounais â l'étranger, en liaison avec les services consulaires concernés.
(2) Elle comprend, outre le Chef de Division, trois (03) Chargés l'Etudes et trois (03) Chargés d'Etudes-Assistants.
SECTION II
DE LA DIVISION DES AFFAIRES JURIDIQUES ET DES TRAITES
Art. 12 —  (1) Placée sous l'autorité d'un Chef de Division, la Division des Affaires Juridiques et des Traités est chargée:
du suivi du développement progressif du droit international ;
des questions relatives à la codification et à la conformité de la législation et de la réglementation internes aux engagements juridiques internationaux de la République du Cameroun ;
de la défense des intérêts de l'Etat en justice chaque fois que Département est concerné ;
des avis sur les questions de droit international dont est saisi le Département et sur les aspects juridiques des questions traitées dans les autres services du Ministère ;
du règlement des litiges concernant les organismes ou les particuliers couverts par les immunités diplomatiques et les privilèges de juridiction
des procédures de ratification des Traités et des Conventions internationaux, ainsi que des autres procédures par lesquelles le Cameroun exprime son consentement ;
de la négociation et de la mise en forme définitive des Traités et des Conventions à caractère bilatéral et multilatéral ;
du règlement des différends entre le Cameroun et les Etats tiers ou les organismes privés étrangers, en liaison avec les administrations concernées ;
des questions relatives aux frontières nationales et au droit de la mer, en liaison avec la Commission Nationale des Frontières et !es administrations concernées.
En outre, elle est chargée :
de la préparation et de la mise en forme des projets de textes à caractère législatif ou réglementaire initiés par le Ministère
de la préparation et de la confection des documents solennels.
(2) Elle comprend :
la Cellule des Accords, des Conventions et des Documents Solennels Internationaux ;
la Cellule des Affaires Législatives. Réglementaires et Contentieuses ;
la Cellule des Questions des Frontières et du Droit de la Mer.
Art. 13 —  (1) Placée sous l'autorité d'un Chef de Cellule, la Cellule des Accords, des Conventions et des Documents Solennels Internationaux est chargée :
de la collecte. du classement et de l'exploitation des textes conventionnels ;
de la tenue et la mise à jour du fichier des Accords et des Conventions ;
de la mise en forme définitive des Accords et Conventions internationaux ;
des procédures d'entrée en vigueur des Traités internationaux pour le Cameroun ;
de la préparation et de la confection des documents solennels notamment, les instruments de ratification, d'adhésion ou d'acceptation des Traités internationaux, les projets de décrets de ratification et de lois d'habilitation, les projets de lettres de créance et de rappel, les Exequatur et les Brevets consulaires, les projets de communiqués conjoints et les procès verbaux, les Pouvoirs et les pleins Pouvoirs.
(2) Elle comprend, outre le Chef de Cellule, trois (03) chargés d'Etudes-Assistants.
Art. 14 —  (1) Placée sous l'autorité d'un Chef de Cellule, la Cellule des Affaires Législatives, Réglementaires et Contentieuses est chargée :
de la préparation et de la mise en forme des projets de textes à caractère législatif et réglementaire initiés par le Ministère ou soumis à sa diligence ;
des avis juridiques.
Elle assure en outre, le suivi :
du règlement des litiges concernant les organismes et les particuliers couverts par les immunités diplomatiques ou les privilèges de juridiction ;
du règlement des différends entre le Cameroun et les Etats tiers ou les organismes privés étrangers ;
des questions domaniales intéressant les Missions diplomatiques et consulaires ainsi que les organisations internationales installées au Cameroun ;
de l'exécution des commissions rogatoires internationales ;
de l'instruction des dossiers d'extradition,
(2) Elle comprend, outre le Chef de Cellule, trois (03) chargés d'Etudes-Assistants.
Art. 15 —  (1) Placée sous l'autorité d'un Chef de Cellule, la Cellule des Questions des Frontières et du Droit de la Mer est chargée :
du suivi des questions touchant à la détermination et à la démarcation des frontières nationales terrestres, aériennes, maritimes et lacustres, en liaison avec la Commission Nationale des Frontières et les autres administrations concernées ;
des questions juridiques relatives à la circulation transfrontalière des personnes et des biens, en liaison avec les administrations concernées ;
des questions relatives au droit de la mer, notamment la centralisation des informations concernant les questions
juridiques maritimes, les travaux de l'Autorité Internationale des Fonds Marins et du Tribunal International du Droit de la Mer ;
du suivi de ['évolution de la codification du ciron de la ruer
du suivi de la négociation et de la mise en application des conventions bilatérales et multilatérales relatives à la gestion et à l'exploitation de l'espace maritime national.
(2) Elle comprend, autre le Chef de Cellule, trois (03) Chargés d'Etudes-Assistants.
SECTION III
DE LA CELLULE DE LA GESTION DES CARRIERES DES PERSONNELS DIPLOMATIQUES
Art. 16 —  (1) Placée sous l'autorité d'un Chef de Cellule, la Cellule de la Gestion des Carrières des Personnels Diplomatiques est chargée :
de la gestion des emplois et de la définition des modalités d'application et de planification du principe de rotation des personnels diplomatiques ;
de la conception, de l'élaboration et de la diffusion des outils et méthodes de gestion des carrières, en liaison avec les administrations concernées ;
de la tenue d'une banque de données sur les opportunités offertes par la fonction publique internationale et de la coordination de l'instruction des dossiers de préparation des profils subséquents ;
du suivi de la mise en. application du statut des personnels diplomatiques ;
du suivi de la carrière des camerounais dans la fonction publique internationale, en liaison avec les autres services compétents du Département et les administrations concernées.
(2) Elle comprend, outre le Chef de Cellule, deux (02) Chargés d'Etudes-Assistants.
SECTION IV
DE LA CELLULE DE SUIVI
Art. 17 —  (1) Placée sous l'autorité d'un Chef de Cellule, la Cellule de suivi est chargée :
de toutes missions que lui confie le Secrétaire Général, notamment la synthèse des programmes d'action et des notes de conjoncture ainsi que de l'exploitation des rapports d'activité transmis par les services centraux et extérieurs du Ministère ;
de la centralisation et de la synthèse des notes de prévision et de prospective
du suivi des activités et des programmes de formation de l'Institut des Relations Internationales du Cameroun (IRIC), en liaison avec les autres administrations concernées ;
de l'organisation d'un service de veille et de permanence au sein du Département.
(2) Elle comprend, outre le Chef de Cellule, trois (03) Chargés d'Etudes-Assistants.
SECTION V
DE LA CELLULE DE COMMUNICAT1ON
Art. 18 —  (1) Placée sous l'autorité d'un Chef de Cellule, la Cellule de Communication est chargée :
de la mise en œuvre de la stratégie de communication gouvernementale au sein du Ministère ;
de la conception et de la mise en forme des messages spécifiques du Ministre et des Ministres Délégués ;
de l'information du public sur les activités du Ministère ;
de la coordination des relations entre le Département et les médias,
(2) Elle comprend outre le Clef de Cellule, trois (03) Chargés d'Etudes-Assistants,
SECTION VI
DE LA CELLULE INFORMATIQUE
Art. 19 —  (1) Placée sous l'autorité d'un Chef de Cellule, la Cellule Informatique est chargée :
de la 'conception et de la mise en œuvre du schéma directeur informatique du Ministère ;
des études de développement, de l'exploitation et de la maintenance du réseau et des applications informatiques du Ministère ;
du développement et de l'exploitation des systèmes d'information et de communication du Département, notamment des réseaux intranet, Internet et des liaisons par satellite ;
de la coordination, de la réalisation, de la maintenance et du suivi des sites Internet, intranet et extranet du Ministère ;
de la mise en place des banques et des bases de données relatives aux différents sous-systèmes informatiques du Ministère ;
de la sécurisation, de la disponibilité et de l'intégrité du système informatique du Ministère ;
du traitement informatique et de la conservation des données ;
de la veille technologique en matière informatique.
(2) Elle comprend, outre le Chef de Cellule, trois (03) Chargés d'Etudes-Assistants.
SECTION VII
DE LA CELLULE DE TRADUCTION
Art. 20 —  (1) Placée sous l'autorité d'un Chef de Cellule, la Cellule de Traduction est chargée :
de la traduction courante des documents ;
du contrôle de la qualité de la traduction ;
de la constitution d'une banque de données terminologiques ;
de l'interprétariat dans le cadre des audiences et des entretiens accordés aux hôtes de marque du Département.
(2) Elle comprend, outre le Chef de Cellule, trois (03) Chargés d'Etudes-Assistants chargés respectivement de la traduction en langue anglaise, de la traduction en langue française et de la traduction dans les autres langues.
SECTION VIII
DE LA SOUS-DIRECTION DU COURRIER ET DE LIAISON
Art. 21 —  (1) Placée sous l'autorité d'un Sous-directeur, la Sous-direction du Courrier et de Liaison est chargée :
de la réception, du traitement et de la ventilation du courrier ;
de la valise diplomatique ;
du chiffre ;
de la relance des services pour le traitement des dossiers.
(2) Elle comprend :
le Service du Courrier, de la Liaison et du Chiffre ;
le Service de la Valise Diplomatique ;
le Service de la Relance.
Art. 22 —  (1) Placé sous l'autorité d'un Chef de Service, le Service du Courrier, de la Liaison et du Chiffre est chargé :
du traitement du courrier ;
du classement, de la conservation et de la confidentialité des correspondances ;
du chiffre ;
de la rédaction et de la transcription des messages codés.
(2) Il comprend :
le Bureau du Courrier ""Arrivée"" ;
le Bureau du Courrier ""Départ"" ;
le Bureau du Courrier Confidentiel ;
le Bureau du Chiffre.
Art. 23 —  (1) Placé sous l'autorité d'un Chef de Service, le Service de la Valise Diplomatique est chargé de la confection et de la ventilation de la valise diplomatique.
(2) Il comprend :
le Bureau de la Confection
le Bureau de la Ventilation.
Art. 24 —  (1) Placé sous L'autorité d'un Chef de Service, le Service de la Relance est chargé de :
l'enregistrement des requêtes des usagers ;
la relance automatique des services en cas de non respect des délais normatifs de traitement des dossiers.
(2) Il comprend :
le Bureau des Requêtes
le Bureau de la Relance.
CHAPITRE II
DE LA DIRECTION DES AFFAIRES D'AFRIQUE
Art. 25 —  (1) Placée sous l'autorité d'un Directeur, la Direction des Affaires d'Afrique est chargée :
des relations bilatérales entre le Cameroun et les pays d'Afrique ;
de la conduite des études de prévision et de prospective sur l'évolution des pays du ressort ;
de l'analyse des grands problèmes politiques, économiques, sociaux et culturels de la région en vue de déterminer les perspectives qui en découlent pour la politique extérieure du Cameroun ;
de la préparation et de la coordination des commissions mixtes, en liaison avec les services compétents du Département et les administrations concernées ;
de la coopération sous-régionale et régionale ;
des questions liées au processus d'intégration africaine, notamment de l'évolution de la situation politique, économique, sociale et culturelle en Afrique ;
des relations que le Cameroun entretient avec l'Union Africaine et ses Institution s Spécialisées ;
des programmes de l'Union Africaine, notamment le NEPAD, en liaison avec les administrations concernées ;
de la participation du Cameroun aux réunions ordinaires ou extraordinaires et aux sommets de l'Union Africaine et de ses institutions Spécialisées ;
des conférences Afrique-Europe, Afrique-France et Afrique-Asie, en liaison avec les services compétents du Département el les administrations concernées ;
du suivi de l'application des décisions, déclarations et recommandations adoptées ainsi que de l'évaluation des résultats obtenus.
(2) Elle comprend :
la Cellule de la Prévision et de la Prospective ;
la Sous-Direction des Relations avec les Pays d'Afrique Centrale ;
la Sous-Direction des Relations avec les Pays d'Afrique Occidentale ;
la Sous-Direction des Relations avec les Pays d'Afrique du Nord ;
la Sous-Direction des Relations avec les Pays d'Afrique Orientale et Australe ;
la Sous-Direction de l'Union Africaine.
SECTION I
DE LA CELLULE DE LA PREVISION ET DE LA PROSPECTIVE
Art. 26 —  (1) Placée sous l'autorité d'un Chef de Cellule, la Cellule de la Prévision et de la Prospective est chargée :
de la conduite des études de prévision et de prospective sur l'évolution des pays du ressort ;
de l'analyse des grands problèmes politiques, économiques, sociaux et culturels de la région en vue de déterminer les perspectives qui en découlent pour la politique extérieure du Cameroun.
(2) Elle comprend, outre le Chef de Cellule, trois (03) Chargés d'Etudes-Assistants.
SECTION II
DE LA SOUS-DIRECTION DES RELATIONS AVEC LES PAYS D'AFRIQUE CENTRALE
Art. 27 —  (1) Placée sous l'autorité d'un Sous-directeur, la Sous-Direction des Relations avec les Pays d'Afrique Centrale est chargée :
des relations bilatérales entre le Cameroun et les pays du ressort ;
de la préparation, de la coordination et du suivi des commissions mixtes, en liaison avec les services compétents du Département et les administrations concernées ;
de la coordination de la coopération entre le Cameroun et les pays du ressort, en liaison avec les administrations concernées ;
du suivi des activités des organisations sous-régionales et du processus d'intégration sous-régionale, notamment les projets de partenariat à caractère intégrateur avec les partenaires bilatéraux ou multilatéraux ;
de la coordination de la participation du Cameroun aux réunions ordinaires et extraordinaires, ainsi qu'aux sommets des organisations sous-régionales en liaison avec les administrations concernées ;
du suivi de l'application des décisions, déclarations et recommandations adoptées ainsi que de l'évaluation des résultats obtenus.
(2) Elle comprend :
Service des Relations Bilatérales ;
le Service des Institutions Sous-Régionales de Coopération et d'Intégration.
Art. 28 —  (1) Placé sous l'autorité d'un Chef de Service, le Service des Relations bilatérales est chargé :
des relations bilatérales entre le Cameroun et les pays du ressort ;
de la coordination de la coopération bilatérale entre le Cameroun et les pays de la sous-région, en liaison avec les administrations concernées.
(2) Il comprend :
le Bureau des Affaires Politiques ;
le Bureau de la Coopération Economique, Technique, Culturelle et Sportive.
Art. 29 —  (1) Placé sous l'autorité d'un Chef de Service, le Service des Institutions Sous-Régionales de Coopération et d'Intégration est chargé :
du suivi des activités des organisations sous-régionales
du suivi du processus d'intégration sous-régionale et des projets à caractère intégrateur, en liaison avec les autres administrations concernées ;
du suivi des projets de partenariat entre les organisations sous-régionales et les partenaires bilatéraux ou multilatéraux ;
de la coordination de la participation aux réunions ordinaires et extraordinaires, ainsi qu'aux sommets des organisations sous-régionales, en liaison avec les autres administrations concernées ;
du suivi de l'application des décisions, déclarations et recommandations adoptées ainsi que de l'évaluation des résultats obtenus.
(2) Il comprend :
le Bureau de la Communauté Economique et Monétaire de l'Afrique Centrale (CEMAC) et de la Communauté Economique des Etats de l'Afrique Centrale (CEEAC) ;
le Bureau de la Commission du Bassin du Lac Tchad (CBLT)
le Bureau des Autres Institutions de Coopération de la Sous-Région.
SECTION III
DE LA SOUS-DIRECTION DES RELATIONS AVEC LES PAYS D'AFRIQUE OCCIDENTALE
Art. 30 —  (1) Placée sous l'autorité d'un Sous-Directeur, la Sous-Direction des Relations avec les Pays d'Afrique Occidentale est chargée :
des relations bilatérales entre le Cameroun et les pays du ressort ;
