URL,text,page_title,page_label,metadata
https://www.juriafrica.com/lex/decret-2023-330-04-aout-2023-53714.htm,"LE PRESIDENT DE LA REPUBLIQUE,
Vu la Constitution ;
Vu la loi n°2022/020 du 27 décembre 2022 portant loi de finances de la République du Cameroun pour l'exercice 2023 ;
Vu le décret n°2011/408 du 09 décembre 2011 portant organisation du Gouvernement, modifié et complété par le décret n°2018/190 du 02 mars 2018 ;
Vu le décret n°2023/076 du 06 février 2023 habilitant le Ministre de l'Economie, de la Planification et de l'Aménagement du Territoire, à signer avec la Banque lslamique de Développement (BID), un Accord de Prêt d'un montant de 32,250 millions d'euros, soit environ 21,115 milliards de francs CFA, pour la mise en œuvre du Plan Présidentiel de Reconstruction et de Développement des Régions du Nord-Ouest et du Sud-Ouest du Cameroun,
DECRETE:
Art. 1er  —  Est ratifié l'Accord de Prêt d'un montant de 32,250 millions d'euros, soit environ 21,115 milliards de francs CFA, conclu le 10 mai 2023 entre la République du Cameroun et la Banque lslamique de Développement (BID), pour la mise en œuvre du Plan Présidentiel de Reconstruction et de Développement des Régions du Nord-Ouest et du Sud-Ouest du Cameroun.
Art. 2 —  Le présent décret sera enregistré, publie suivant la procédure d'urgence, puis inséré au Journal officiel en français et en anglais. /-",DECRET_N_2023_330_DU_04_AOUT_2023_RATIFIANT_L_ACCORD_DE_PRET_D_UN_MONTANT_DE_32_250_MILLIONS_D_EUROS_SOIT_ENVIRON_21_115_MILLIARDS_DE_FRANCS_CFA_CONCLU_LE_10_MAI_2023_ENTRE_LA_REPUBLIQUE_DU_CAMEROUN_ET_LA_BANQUE_ISLAMIQUE_DE_DEVELOPPEMENT_BID_POUR_LA_MISE_EN_E2UVRE_DU_PLAN_PRESIDENTIEL_DE_RECONSTRUCTION_ET_DE_DEVELOPPEMENT_DES_REGIONS_DU_NORD_OUEST_ET_DU_SUD_OUEST_DU_CAMEROUN,0,
