URL,text,page_title,page_label,category,metadata
https://www.juriafrica.com/lex/decret-2-df-201-17-avr-1972-16709.htm,"DECRET N° 2/DF/201 DU 17 AVRIL 1972 FIXANT L'ORGANISATION ET LES CONDITIONS DE FONCTIONNEMENT DE L'OFFICE NATIONAL DES PORTS.

LE PRESIDENT DE LA REPUBLIQUE FEDERALE,
VU la Constitution de la République Fédérale du Cameroun ;
VU la loi n° 71/LF/5 du 4 juin 1971 instituant l'Office National des Ports du Cameroun ;
VU le décret n° 70/DF/273 du 12 juin 1970 portant organisation du Gouvernement Fédéral de la République Fédérale du Cameroun
DECRETE:
CHAPITRE I
ATTRIBUTIONS DE L'OFFICE NATIONAL DES PORTS
Art. 1er —  L'Office National des Ports, ci-après désigné ""l'office"" est un établissement public à caractère industriel et commercial ayant pour objet d'assurer la gestion de l'ensemble des Ports du Cameroun,
Il est chargé, à l'intérieur de la circonscription de chaque port et dans les conditions définies par le présent décret :
1° - des travaux d'équipement, d'extension, d'amélioration, de renouvellement et de reconstruction des ports et de leurs dépendances ainsi que de la création et de l'aménagement des zones industrielles portuaires ;
A ce titre, dans les zones à vocation industrielle ou commerciale situées à proximité des limites de la circonscription de chaque port, l'Office devra être consulté à l'occasion de l'approbation des plans d'aménagement et de la délivrance des permis de bâtir,
2° - des opérations d'exploitation (pilotage, lamanage, remorquage, acconage et stockage), avec la possibilité si les circonstances le justifient de concéder avec ou sans sa participation à des sociétés nationales, privées ou d'économie mixte, certaines de ces activités ainsi que l'exploitation de l'outillage public, dans des conditions définies par un cahier des charges fixé par arrêté du Ministre des Transports pris après avis du Conseil d'Administration,
3° - de l'entretien et de la police des ports et de leurs dépendances ainsi que de la gestion du domaine immobilier qui leur est affecté,
4° - des services publics tels que éclairage, balisage, dispositifs d'aide à la navigation à l'intérieur du port ou pour ses accès, services d'incendie.
L'office peut également être chargé à l'intérieur de la circonscription de chaque port, après l'accord du Conseil d'Administration, de la gestion d'autres services publics connexes à ceux du port tels que : services sanitaires, phytosanitaires et de sauvetage.
Des arrêtés conjoints du Ministre des Transports et des Ministres intéressés fixent l'organisation de ces services et les conditions de leur fonctionnement.
L'Office peut en outre être autorisé, dans le cadre de la réglementation en vigueur, à créer ou à participer à la création et à l'aménagement des zones industrielles et d'entrepôts extérieurs à la circonscription portuaire.
Art. 2 —  A l'intérieur de chaque circonscription portuaire, l'Office assure la coordination générale des services et organismes publics ou privés qui concourent à l'activité du port ou en bénéficient.
Toutes les activités privées s'exerçant dans les limites de la circonscription de chaque port doivent faire l'objet d'une autorisation de la part de l'Office sous l'une des formes suivantes:
laissez-passer personnel donnant accès à l'intérieur des enceintes portuaires,
licence personnelle et intransmissible en vue de l'exercice de certaines activités,
location de terrains et de bâtiments,
concession de durée appropriée à leur objet.
Chaque autorisation devra être assortie d'un cahier de charges définissant les conditions de l'exercice de ces activités ainsi que les obligations auxquelles devront se conformer leurs bénéficiaires.
L'Office peut, par arrêté du Ministre de tutelle pris après avis du Conseil d'Administration, être autorisé à participer à des activités indispensables à la pleine exploitation des ports ou à en créer de nouvelles si les circonstances le justifient.
Art. 3 —  Dans la limite des circonscriptions portuaires, l'office jouit des prérogatives de puissance publique en matière de police de la circulation et de la sécurité de l'exploitation.
Un décret fixera les règles applicables en ces matières.
Art. 4 —  L'Etat peut, par décret pris après avis du Conseil d'Administration, confier à l Office, au titre de services annexes en dehors des circonscriptions portuaires, la gestion de services relevant du domaine public maritime et fluvial dont il définit la consistance et les règles de fonctionnement.
Art. 5 —  Un décret pris après enquête et sur proposition du Ministre de tutelle fixera la circonscription de chaque port et ses dépendances. La même procédure doit être suivie pour la révision des limites de chaque circonscription.
Art. 6 —  Toutes les infrastructures et tous les immeubles du domaine public, affectés à l'exploitation portuaire, notamment les terre-pleins, quais, jetées, plans d'eau, réseau portuaire de voies ferrées sont et demeurent propriété de l'Etat. Il en est de même de ceux qui, postérieurement à la mise en place de l'office, seront exécutés et affectés à l'exploitation portuaire. La gestion de ce domaine public est assurée par l'0ffice.
Les biens meubles et immeubles nécessaires à la gestion des installations visées à l'alinéa précédent et qui appartiennent au domaine privé de l'Etat, notamment les habitations, outillages, matériels et approvisionnements sont attribués en pleine propriété à l'Office.
Le décret visé à l'article 5 ci-dessus précisera, en tant que de besoin, la consistance de ces biens et installations qui seront remis à l'office, lors de l'installation de celui-ci, sur procès-verbal contradictoire entre le Ministre de Tutelle et le Directeur Général de l'Office,
Art. 7 —  En matière de domanialité et de travaux publics, l'Office est investi de tous les droits et avantages reconnus à l'Etat par les lois et règlements. Il est également soumis à toutes les obligations qui dérivent pour l'Etat des mêmes lois et règlements.
Art. 8 —  Une convention conclue entre l'Office et la Régie des Chemins de Fer du Cameroun fixera les conditions dans lesquelles :
les installations et outillages de la Régie des Chemins de Fer du Cameroun nécessaires à l'exploitation des ports seront mis à la disposition de l'Office,
des prestations de services seront fournies par la Régie des Chemins de Fer du Cameroun à l'Office,
les voies ferrées seront entretenues, exploitées dans la circonscription de chaque port.
CHAPITRE II
ADMINISTRATION ET FONCTIONNEMENT DE L'OFFICE
Art. 9 —  Les Organes de l'Office sont :
le Conseil d'Administration ;
la Direction Générale.
Art. 10 —  Le Conseil d' Administration comprend un Président et onze membres :
le Président est une personnalité nommée par décret
les Membres sont :
1 Représentant du Ministre des Transports
1 du Ministre des Finances
1 -""- du Ministre du Plan et de l'Aménagement du Territoire
1 -""- du Ministre du Développement Industriel et Commercial
1 -""- du Ministre du Travail et de la Prévoyance Sociale
le Directeur Général de la Régifercam ou son Représentant
1 Représentant de la Chambre de Commerce et de l'Industrie
2 Représentants des Professions Maritimes (acconage, transit, armement)
2 autres Personnalités nommées es qualité par le Gouvernement.
Les membres du Conseil d'Administration sont désignés pour quatre ans. Leur mandat est renouvelable.
Les représentants des départements ministériels sont désignés parmi les fonctionnaires en poste dans ces départements, après avis des Ministres intéressés.
Lorsqu'un Administrateur aura en cours de mandat perdu la qualité qui avait motivé sa désignation, il sera pourvu à son remplacement.
Les fonctions d'Administrateurs sont gratuites. Toutefois, le Président reçoit, compte tenu de ses sujétions, une indemnité de fonction fixée par le Conseil d'Administration. Les Administrateurs et les personnalités appelées en consultation perçoivent des jetons de présence dont le taux est également fixé par le Conseil ; de même, des frais de transport de ces derniers de leur lieu de résidence au lieu de réunion du Conseil sont à la charge de l'Office,
Art. 11 —  Le Conseil d'Administration peut être dessous sur le rapport du Ministre des Transports et du Ministre des Finances par un décret motivé. Il est dans ce cas, remplacé provisoirement par une délégation instituée par le même décret et chargée d'expédier les affaires courantes.
Les décisions du Conseil d'Administration deviennent exécutoires dans les conditions précisées à l'article 36.
Art. 12 —  Le Conseil d'Administration se réunit sur convocation de son Président au moins quatre fois par an, dont une fois au dernier trimestre de l'année budgétaire pour l'approbation du budget.
Le Conseil ne peut valablement délibérer que lorsque les deux tiers au moins des membres sont présents. Les délibérations sont adoptées à la majorité absolue des votants, En cas de partage des voix, celle du Président est prépondérante.
Les procès-verbaux des séances sont signés par le Président et par le Secrétaire de séance. Ils font mention des membres présents.
En cas d'absence ou d'empêchement du Président, le Conseil d'Administration désigne en son sein, un Président de séance.
Art. 13 —  Assistent aux réunions du Conseil:
le Directeur Général, les Directeurs Généraux Adjoints et le Commissaire aux Comptes de l'Office, avec voix consultative,
le Directeur des Transports au titre de représentant du Ministre des Transports prévu à l'article 10 avec un droit de veto suspensif,
les représentants d'autres Administrations ou des collectivités et établissements publics, chaque fois que l'ordre du jour comporte une question les concernant,
un représentant du personnel de l'0ffice en cas de besoin.
Le Conseil d'Administration peut, à la demande de son Président, entendre toute personne qualifiée sur les questions intéressant l'Office.
Art. 14 —  Le Conseil d'Administration assure la mise en œuvre de la politique générale de l'office définie par le Gouvernement, dans les conditions ci-après :
Il fixe la structure interne de l'Office et l'organisation particulière des différents ports du Cameroun ;
Il arrête :
les plans d'équipement et d'extension des ports ainsi que les modalités de leur exécution ;
les programmes de renouvellement et d'investissement.
Ces plans et programmes doivent être accompagnés des justifications techniques économiques et financières nécessaires.
Il approuve les projets de budget, les comptes d'exploitation, l'inventaire, le bilan et le compte des résultats.
Il arrêté les prévisions de dépenses sur les comptes hors budget et les prévisions de dépenses rectificatives.
Il fixe les tarifs généraux applicables dans tous les ports du Cameroun et prend toutes les mesures nécessaires pour la création des ressources destinées à couvrir les charges qui lui incombent, en veillant notamment à ce que les tarifs applicables aux services gérés puissent couvrir les charges totales correspondantes, y compris les amortissements et les intérêts du capital et une quote-part normale des frais généraux.
Il autorise :
toute acquisition de matériel et tous travaux dont le montant est supérieur à 50 millions ou dont la durée de réalisation est supérieure à deux années,
toutes acquisitions, toutes cessions et tous échanges de biens et droits immobiliers ne faisant pas partie du domaine public ou de ses dépendances.
Il approuve :
les procès-verbaux d'adjudication ou d'appel d'offres ayant donné lieu à réclamation;
les procès-verbaux de réforme de matériel d'une valeur supérieure à 20 millions de francs.
Il autorise, s'il y a lieu, toutes garanties mobilières ou immobilières notamment toutes hypothèques et tous nantissements sur les biens de l'Office ne faisant pas partie du domaine public ou de ses dépendances.
Il autorise les emprunts et détermine les conditions auxquelles l'Office participe à des opérations d'émission directement, par garantie ou autrement.
Il autorise la souscription, l'achat et la cession de toutes actions, obligations, parts d'intérêts et tous droits quelconques.
Il autorise le règlement de tout litige dont l'importance dépasse 20 millions de francs CFA.
Il autorise la fondation ou la participation à la fondation de toutes sociétés dont l'objet intéresse l'activité de l'Office.
Il fixe le statut du personnel et détermine, dans le cadre des lois et règlements :
les règles et les conditions de recrutement et d'embauche, d'avancement ou de licenciement;
les conditions et les taux de rémunération,
le régime de gratification et les indemnités professionnelles,
le régime de la main d'œuvre.
Il nomme sur proposition du Directeur Général, aux postes de direction.
Il arrête le tableau des emplois et effectifs maxima du personnel.
Il approuve le rapport d'activité annuel présenté par le Directeur Général de l'Office.
Art. 15 —  Le Président du Conseil d'Administration exerce un contrôle permanent sur l'ensemble de la gestion de l'Office. Il veille à l'exécution des décisions prises par le Conseil,
Il prépare à la fin de chaque année budgétaire, le rapport que le Conseil doit présenter sur la situation de l'Office.
Ce rapport accompagné d'un extrait du procès-verbal de la discussion est adressé au Ministre de tutelle et au Ministre des Finances.
Art. 16 —  Dans le cadre de ses attributions, le Conseil d'Administration peut constituer en son sein un Comité de Direction dont la composition, la nomenclature des affaires qui sont de sa compétence et pour lesquelles sa décision engage le Conseil ainsi que toutes les dispositions utiles à son fonctionnement sont fixées par le Conseil d'Administration.
Art. 17 —  Le Conseil peut déléguer certaines de ses attributions soit au Comité de direction visé à l'alinéa précédent, soit au Directeur Général de l'Office. Toutefois ne peuvent pas faire l'objet de délégation :
l'approbation du projet de budget,
l'approbation du plan d'organisation et de fonctionnement des services des différents ports,
l'approbation des plans d'équipement et d'extension des ports, - l'approbation des marchés d'un montant égal ou supérieur à cent millions de francs CFA,
la fixation des taxes et des tarifs d'usage des outillages gérés par l'Office dans les limites maxima autorisées
1'approbation des prises, cessions ou extensions des participations financières,
l'approbation des conditions des emprunts et des prêts.
Art. 18 —  La gestion administrative, technique et financière de l'Office est assurée sous le contrôle du Conseil d'Administration par la Direction Générale.
La Direction Générale est placée sous l'autorité d'un Directeur général assisté de deux Directeurs Généraux Adjoints, tous nommés par décret du Président de la République.
Art. 19 —  Le Directeur Général est chargé de l'exécution des décisions du Conseil d'Administration à qui il rend compte de sa gestion, du fonctionnement général de l'Office, de la sécurité de l'exploitation et du bon entretien des ports du Cameroun, des services annexes et des exploitations concédées. Dans le cadre de ses attributions, il prend toutes initiatives et toutes décisions nécessaires à la bonne marche des services notamment :
il propose au Conseil d'Administration l'organisation interne de 1'0ffice et des différents ports du Cameroun,
il recrute et nomme à tous emplois non visés à l'article 14 ci-dessus, affecte, avance et sanctionne tout le personnel de l'Office conformément aux règlements en vigueur,
il assure l'application des tarifs et prend à ce sujet toutes mesures provisoires pour sauvegarder les intérêts de l'Office en cas de besoin, à charge par lui d'en rendre compte par écrit au Conseil d'Administration,
il signe tous les contrats et conventions particulières
il approuve les projets techniques et fait procéder à l'exécution de tous travaux et à la réalisation de toutes commandes.
Par délégation permanente du Conseil d'Administration, le Directeur Général représente l'Office devant toute juridiction :
Il prend toutes mesures conservatoires et exerce toutes actions judiciaires, forme tous appels ou pourvois, s'en désiste, prend toutes les mesures nécessaires pour assurer l'exécution des jugements et arrêts ;
Il étudie toutes questions et propose des solutions à la décision du Conseil d'Administration
il exerce les attributions qui lui sont déléguées spécialement par le Conseil d'Administration
Il établit le rapport d'activité annuel qu'il soumet à l'approbation du Conseil d'Administration.
Pour les affaires rentrant dans les attributions des différents Ministères le Directeur Général de l'Office correspond directement avec les Ministres intéressés.
Il adresse les copies des correspondances échangées au Ministre des Transports.
Art. 20 —  Le Directeur Général est l'ordonnateur principal du budget de l'Office ; à ce titre :
il approuve les marchés et commandes dont le montant est égal ou inférieur à 50 millions de francs CFA ou comportent une durée de réalisation inférieure à deux années ;
il engage, liquide et paie les dépenses dans le cadre des budgets approuvés et procède à tous actes correspondants
il reçoit toutes quittances et décharges ;
il fait procéder au recouvrement de toutes créances de l'Office, et il donne tous reçus, quittances et décharges
il autorise, règle les litiges.
Il assure :
la réalisation des emprunts et la gestion des fonds
le fonctionnement de la Trésorerie ;
Il représente l'Office dans toutes opérations commerciales et auprès de toutes administrations et de tous services publics et privés ;
Il consent, cède ou résilie tous baux et locations sans promesse de vente ;
Il approuve les procès-verbaux de réforme du matériel et des approvisionnements lorsque leur montant n'excède pas 20 millions de francs CFA ;
Il autorise la vente du matériel réformé et en rend compte au Conseil d'Administration.
Des ordonnateurs secondaires peuvent être institués, sur la proposition du Directeur Général par décision conjointe du Ministre des Transports et du Ministre des Finances.
Art. 21 —  Sous l'autorité du Directeur Général, les Directeurs Généraux adjoints suivent, chacun, un ou plusieurs secteurs d'activité de l'Office.
Ils reçoivent à cet effet, délégation de signature du Directeur Général.
CHAPITRE III
DISPOSITIONS FINANCIERES
Art. 22 —  La gestion financière et comptable de 1'Office est soumise aux règles de la comptabilité industrielle et commerciale.
A cet effet, un plan comptable, approuvé par arrêté conjoint du Ministre des Transports et du Ministre des Finances déterminera les modalités d'après lesquelles seront effectuées les opérations financières et comptables de l'Office : notamment :
les règles applicables en matière d'évaluation et de réévaluation des immobilisations;
la nature des immobilisations amortissables qui devront être individualisées au bilan ;
les règles de calcul des amortissements et des provisions
méthodes d'évaluation des stocks ;
les normes d'élaboration de la comptabilité analytique d'exploitation de manière à assurer la connaissance des prix de revient sur des bases homogènes, de toutes les prestations fournies par l'Office.
Les opérations financières et comptables de chaque port feront l'objet d'une comptabilité distincte ; il sera toutefois établi un bilan financier général des activités de l'ensemble des ports.
Art. 23 —  Les recettes et les dépenses de l'Office sont prévues dans un budget comportant deux parties distinctes :
le programme d'exploitation (recettes et dépenses ordinaires) ou compte d'exploitation,
le programme d'investissement et de renouvellement ou compte d'opérations en capital.
Art. 24 —  Le projet de budget est préparé par le Directeur Général de l'Office. Il doit être en équilibre. 1l est approuvé et rendu exécutoire par le Conseil d'Administration.
Compte tenu du caractère industriel et commercial de la gestion de l'Office, ce budget ne présente qu'un caractère indicatif.
Lorsqu'il apparaît en cours d'exercice que les prévisions budgétaires ne pourront être réalisées par suite soit de l'augmentation des dépenses soit de la diminution des recettes, le Directeur Général saisit dans les meilleurs délais, le Conseil d'Administration, en vue de prendre toutes mesures susceptibles de rétablir l'équilibre financier de l'exercice.
Art. 25 —  Les ressources financières de l'Office sont constituées par :
Le produit des taxes sur les navires et sur les marchandises,
les revenus du domaine immobilier de l'office,
le produit des locations de matériel et d'outillage, des cessions et des prestations de service,
le produit des emprunts,
les participations éventuelles de l'Etat, les aides et les fonds de concours.
Les taxes et les tarifs de location sont fixés par décision du Conseil d'Administration. Leurs taux sont déterminés de manière à permettre à l'0ffice de faire face à toutes les missions qui lui incombent, notamment aux extensions nécessités par l'accroissement du trafic ainsi qu'à la constitution d'un fonds de réserve.
Les taxes et les tarifs doivent être appliqués d'une manière uniforme à tous les usagers, Toutefois, des tarifs spéciaux peuvent être institués pour certains trafics, en raison de leur nature et de leur volume.
L'Office ne pourra emprunter qu'en vue de couvrir les dépenses d'équipement ou de grosses réparations. Ces emprunts doivent être autorisés par le Gouvernement, s'ils bénéficient de la garantie de l'Etat.
L'Office peut faire face à ses besoins de trésorerie par des avances ou des découverts bancaires.
Art. 26 —  Le compte d'exploitation retrace toutes les charges et tous les produits se rapportant au fonctionnement de l'Office.
Y sont inscrits en particulier :
En recettes :
les produits des taxes sur les navires et sur les marchandises,
les revenus du domaine immobilier perçus par les ports
les produits de l'exploitation des services directement gérés par l'Office,
les produits des taxes et redevances de toute nature dont la perception aura été régulièrement autorisée,
les produits de la location des hangars et terre-pleins,
les prélèvements éventuels sur les provisions ou les fonds de réserve,
toutes autres recettes d'exploitation.
En dépenses :
toutes les dépenses concernant l'administration, l'exploitation, l'entretien,
l'amortissement des ouvrages, des outillages et du matériel,
les intérêts des emprunts contractés par l'Office,
les provisions et dotations du fonds de réserve,
et, d'une manière générale, toutes les dépenses de gestion des ports.
Si le solde du compte d'exploitation est bénéficiaire, il est versé pour moitié au fonds de réserve jusqu'à concurrence du plafond fixé à l'article 28 et le solde au fonds de renouvellement et d'investissement.
Dans le cas où le compte d'exploitation se révèle déficitaire à la fin de l'exercice, les mesures suivantes doivent être prises :
- Le déficit est comblé dans la mesure du possible par prélèvement sur le fonds de réserve,
- En cas d'insuffisance de l'actif du fonds de réserve, le déficit peut être reporté, s'il ne met pas en péril l'exploitation des parts. Mais si, au contraire, le Conseil d'Administration estime que ce déficit met en péril l'exploitation des ports, l'Office devra créer les ressources nécessaires pour y faire face.
Art. 27 —  L'Office est doté d'un fonds de renouvellement et d'investissement au compte d'opérations en capital destiné à financer :
toutes les dépenses de construction de renouvellement, d'amélioration et d'extension des installations et des ouvrages,
les dépenses d'acquisition et de renouvellement de matériel dont la valeur unitaire est supérieure à 1 million de francs CFA,
le remboursement du principal des emprunts contractés par l'Office.
Le fonds de renouvellement est alimenté par :
le produit des amortissements,
tout ou partie du solde bénéficiaire du compte d'exploitation,
les subventions et fonds de concours,
le produit des emprunts,
le produit de l'aliénation des biens mobiliers ou immobiliers ou d'outillages réformés.
Art. 28 —  L'Office est également doté d'un fonds de réserve destiné à faire face aux déficits éventuels d'exploitation. Son montant maxima est fixé à 10 %, du total des recettes d'exploitation de l'avant-dernier exercice.
Art. 29 —  L'Office est en outre doté d'un fonds de roulement destiné à couvrir ses besoins de trésorerie et à pourvoir à la constitution des stocks nécessaires à l'exploitation. Le montant initial de ce fonds est fixé à 100 millions de francs CFA,
En cas de nécessité, ce montant peut être complété par des avances ou des découverts bancaires prévus à l'article 25.
Art. 30 —  Les comptes de l'office sont arrêtés et approuvés chaque année par le Conseil d'Administration. Ils sont ensuite envoyés à l'Inspection Générale de l'Etat aux fins d'apurement.
Art. 31 —  Les marchés relatifs à des opérations donnant lieu à participation financière de l'Etat sont soumis à la réglementation des marchés de l'Etat.
Les marchés relatifs à d'autres opérations sont passés suivant les règles fixées par le Conseil d'Administration.
Ces règles s'inspirent des règles applicables aux marchés de l'Etat.
Art. 32 —  Sous l'autorité du Directeur Général, la comptabilité de l'Office, le maniement des titres, effets et espèces sont assurés par un agent comptable qui est tenu de verser un cautionnement dont le montant est fixé par le Conseil d'Administration.
Le Directeur Général émet les effets constituant les dettes exigibles et les créances réalisables. L'agent comptable assure leur paiement ou leur recouvrement.
Au cas où l'agent comptable est amené à refuser d'effectuer un règlement, le Ministre des Transports et le Ministre des Finances statueront après avis du Conseil d'Administration.
Art. 33 —  L'Agent comptable établit le compte d'exploitation, la balance générale ainsi que le bilan arrêté au 30 juin de chaque année et tous états annexes oui comprennent la situation de tous les comptes bancaires, comptes de dépôts, portefeuille, état des créances et des dettes, inventaires et résultats,
Art. 34 —  Un Commissaire aux comptes, nommé par arrêté conjoint du Ministre des Finances et du Ministre des Transports, est chargé de suivre toutes les opérations relatives à la gestion financière de l'Office.
En particulier, il vérifie la concordance du bilan et du compte d'exploitation avec les écritures et rend compte de ses observations dans un rapport sur les résultats de l'exercice joint à celui du Directeur Général.
Il peut prendre connaissance de toutes les pièces ou de tous documents concernant l'objet de sa mission.
Il présente chaque fois qu'il juge nécessaire, ses observations et son avis dans des rapports adressés au Directeur Général qui sont obligatoirement communiqués au Conseil d'Administration.
La rémunération du Commissaire aux Comptes est fixée par le Conseil d'Administration.
Art. 35 —  Les recettes et dépenses de gestion des services annexes confiés à l'Office au titre de l'article 4 du présent décret font l'objet de comptes distincts de ceux de l'Office.
CHAPITRE IV
TUTELLE ET CONTROLE DE L'OFFICE
Art. 36 —  Le Ministre chargé des Transports suit toutes les activités de l'Office dont il assure la tutelle conformément à l'article premier de la loi n° 71/LF/5 et de l'article 55 du décret n° 70/DF/273 du 12 juin 1970.
Après chaque séance du Conseil d'Administration, une ampliation du procès-verbal des délibérations doit être déposée au Cabinet du Ministre de tutelle pour approbation.
Le Ministre des Transports dispose de 10 jours à compter de la date de la réception des procès-verbaux des délibérations pour faire connaître son avis. Il peut avant l'expiration de ce délai, demander au Conseil un nouvel examen des décisions prises. Passé ce délai, son silence vaut acquiescement et les décisions prises deviennent immédiatement exécutoires.
Les décisions frappées de veto suspensif du Directeur des Transports deviennent exécutoires dans les mêmes conditions qu'à l'alinéa précédent.
CHAPITRE V
PERSONNEL DE L'OFFICE
Art. 37 —  Le personnel de l'Office est composé :
d'agents sous statut,
d'agents régis par une convention collective,
des agents sous contrats.
Art. 38 —  Les agents sous statut sont régis par le Statut du personnel de l'Office qui est approuvé par le Conseil d'Administration.
- Les agents auxiliaires relèvent de la convention collective établie conformément aux dispositions du Code du travail et approuvée par le Conseil d'Administration.
Les fonctionnaires mis à la disposition de l'Office sont placés en position de détachement. Ils peuvent à la fin de leur détachement, être intégrés dans les cadres du statut du personnel de l'Office.
Des mesures transitoires seront prises en faveur des agents de l'ex--Direction des Ports et Voies Navigables lors de leur intégration au statut du personnel de l'Office.
Il devra notamment être tenu compte des avantages acquis par ces agents préalablement à l'institution de l'Office.
Art. 39 —  En cas de nécessité, le Directeur Général de l'Office pourra recruter sur contrat des cadres techniques qualifiés ne remplissant pas les conditions requises pour être intégrés dans le statut du personnel de l'Office.
Art. 40 —  L'Office assurera en tant que de besoin la formation et le perfectionnement du personnel des Ports. II pourra, dans la limite des possibilités financières, contribuer aux programmes spécialisés de formation dispensés par d'autres services publics.
CHAPITRE VI
DISPOSITIONS DIVERSES
Art. 41 —  En raison des activités qu'il exerce, l'Office est exempté de tout impôt, des droits de timbre et d'enregistrement.
Toutefois, sous réserve de la contribution prévue à l'article 3 du décret n° 72/DF/______________ du _______________ l'Office supportera les charges afférentes à la gestion des services annexes maritimes et de navigation.
Art. 42 —  Un arrêté conjoint du Ministre des Transports et du Ministre du Travail devra réglementer le régime d'emploi des travailleurs chargés des opérations de manutentions portuaires.
L'Inspecteur du Travail est tenu d'informer le Directeur Général de l'Office de toutes les questions dont il a à connaître concernant ces travailleurs, notamment en matière d'organisation et de conditions de travail.
Art. 43 —  Les créances de l'Office sont assimilées aux créances de l'Etat. Le privilège y afférent prend rang immédiatement après le privilège du Trésor prévu par le Code Civil. Ce privilège s'exerce pendant une période de deux ans à compter du jour où la créance devient exigible.
En matière de détournements, soustractions de fonds ou d'effets mobiliers, faux et usages de faux, concussion et corruption, les agents de l'Office sont assimilés aux fonctionnaires de l'Etat, tant en ce qui concerne les juridictions compétentes que les peines encourues.
Art. 44 —  L'Office est tenu de se couvrir des risques de l'exploitation soit par une assurance, soit par un fonds spécial, soit par tout autre moyen approprié.
Art. 45 —  Le siège de l'Office est fixé à Douala ; il pourra être transféré par décision du Conseil d'Administration en tout autre endroit du territoire.
Art. 46 —  Sont et demeurent abrogées toutes dispositions contraires à celles du présent décret et de la loi n° 71/LF/5, notamment le décret n° 69/DF/531 du 5 décembre 1969 portant organisation et fonctionnement de la Direction des Ports et Voies Navigables.
Art. 47 —  Le Ministre des Transports est chargé de l'application du présent décret qui sera enregistré et publié au Journal Officiel de la République Fédérale du Cameroun en français et en anglais.",DECRET_N_2_DF_201_DU_17_AVRIL_1972_FIXANT_L_ORGANISATION_ET_LES_CONDITIONS_DE_FONCTIONNEMENT_DE_L_OFFICE_NATIONAL_DES_PORTS,0,decret,
