URL,text,page_title
https://www.juriafrica.com/lex/decret-2002-017-18-janv-2002-15849.htm,"LE PRESIDENT DE LA REPUBLIQUE,
VU la Constitution;
VU la loi n°2001/022 du 18 décembre 2001 autorisant le Président de la République à ratifier le Protocole de Cartagena du 29 janvier 2000 sur la Prévention des Risques Biotechnologiques, relatif à la Convention sur la Diversité Biologique ;
DECRETE:
Art. 1er —  Est ratifié, le Protocole de Cartagena du 29 janvier 2000 sur la Prévention des Risques Biotechnologiques, relatif à la Convention sur la Diversité Biologique.
Art. 2 —  Le présent décret sera enregistré, publié suivant la procédure d'urgence, puis inséré au Journal Officiel en français et en anglais./-","DECRET_N°2002_017_DU_18_JANVIER_2002_PORTANT_RATIFICATION_DU_PROTOCOLE_DE_CARTAGENA_DU_29_JANVIER_2000_SUR_LA_PREVENTION_DES_RISQUES_BIOTECHNOLOGIQUES,_RELATIF_À_LA_CONVENTION_SUR_LA_DIVERSITE"
