URL,text,page_title,page_label,metadata
https://www.juriafrica.com/lex/decret-2002-155-18-juin-2002-15938.htm,"LE PRESIDENT DE LA REPUBLIQUE,
VU la Constitution
VU la loi n° 94/01 du 20 janvier 1994 portant régime des forêts, de la faune et de la pêche, complétée par l'ordonnance n° 99/001 du 31 août 1999
VU la loi n° 99/016 du 22 décembre 1999 portant statut général des établissements publics et des entreprises du secteur public et parapublic
VU le décret n°90/397 du 23 février 1990 portant création de l'Office National de Développement des Forêts ;
VU le décret n°97/205 du 07 décembre 1997 portant organisation du Gouvernement, modifié et complété par le décret n°98/067 du 28 avril 1998 ;
DECRETE:
Art. 1er —  ,.L'Office National de Développement des Forêts prend, à compter de la date de signature du présent décret, la dénomination d'Agence Nationale d'Appui au Développement Forestier, en abrégé « ANAFOR ».
Art. 2 —  Le présent décret sera enregistré et publié suivant la procédure d'urgence puis inséré au Journal Officiel en français et en anglais.",DECRET_N_2002_155_DU_18_JUIN_2002_PORTANT_CHANGEMENT_DE_DENOMINATION_DE_L_OFFICE_NATIONAL_DE_DEVELOPPEMENT_DES_FORETS,0,
