URL,text,page_title
https://www.juriafrica.com/lex/decret-2021-246-27-avril-2021-47662.htm,"LE PRESIDENT DE LA REPUBLIQUE,
Vu la Constitution ;
Vu la loi n° 2021/006 du 16 avril 2021 autorisant le Président de la République à ratifier l'Accord entre le Gouvernement de la République du Cameroun et le Gouvernement des Emirats Arabes Unis tendant a éviter la double imposition et à prévenir l'évasion fiscale en matière d'impôts sur le revenu, signe le 13 juillet 2017 à Dubaï,
DECRETE:
Art. 1er —  __ Est ratifie, l'Accord entre le Gouvernement de la République du Cameroun et le Gouvernement des Emirats Arabes Unis tendant à éviter la double imposition et à prévenir !'évasion fiscale en matière d'impôts sur le revenu, signe le 13 juillet 2017 à Dubaï.
Art. 2 —  Le présent décret sera enregistré, publié suivant la procédure d'urgence, puis inséré au Journal Officiel en français et en anglais. /-",DECRET_N°_2021_246_DU_27_AVRIL_2021_PORTANT_RATIFICATION_DE_L'ACCORD_ENTRE_LE_GOUVERNEMENT_DE_LA_REPUBLIQUE_DU_CAMEROUN_ET_LE_GOUVERNEMENT_DES_EMIRATS_ARABES_UNIS_TENDANT_À_EVITER_LA_DOUBLE
