URL,text,page_title
https://www.juriafrica.com/lex/decret-94-197-pm-09-mai-1994-25797.htm,"Art. 1er —  Le présent décret:
détermine la quotité des fractions de salaire soumises à des prélèvements progressifs ainsi que les taux y afférents ; et
fixe la procédure applicable à la cession volontaire de salaire.
CHAPITRE 1
DES PRELEVEMENTS PROGRESSIFS SUR SALAIRE
Art. 2 —  (1) La quotité saisissable et/ou cessible du salaire à l'occasion de chaque paie est fixée suivant les modalités ci-dessous:
un dixième (1/10) sur la fraction au plus égale à dix huit mille sept cent cinquante (18.750) francs par mois ;
un cinquième (1/5) sur la fraction supérieure à dix huit mille sept cent cinquante (18.750) francs et inférieure ou égale-à trente sept mille cinq cents (37.500) francs par mois ;
un quart (114) sur la fraction supérieure à trente sept mille cinq cents (37.500) francs et inférieure ou égale à soixante quinze mille (75.000) francs par mois;
un tiers (1/3) sur la fraction supérieure à soixante quinze mille (75.000) francs et inférieur ou égale à cent douze mille cinq cents (112.500) francs par mois;
la moitié (1/2) sur la fraction supérieure à cent douze mille cinq cents (112.500) et inférieure ou égale à cent quarante deux mille quatre cent (142.400) francs par mois et ;
la totalité sur la fraction supérieure à cent quarante deux mille cinq cents (142.500) francs.
(2) En cas de prêt ou de location vente d'un ou de plusieurs immeuble(s) destinées) à l'habitation et consenti(s) par un établissement public ou un organisme du secteur para public intervenant dans le cadre de la promotion immobilière, la quotité saisissable et/ou cessible telle que prévue à alinéa(1) peut en vue du remboursement par le travailleur des prêts et/ou dettes résultant de la location-vente, être portée au quart (1/4) pour la fraction au plus égale et soixante quinze mille (75.000) francs par mois.
(3) En matière de paiement de dette(s) alimentaire(s) conformément à la législation en vigueur, par voie de cession volontaire du salaire ou de saisie arrêt sur le salaire, le mensuel courant de la pension alimentaire est, à chaque échéance prélevé intégralement sur la fraction insaisissable du salaire.
Le cas échéant, la fraction saisissable dudit salaire peut être retenue en sus:
pour sûreté des termes arriérés et des frais ; ou
au profit de créanciers ordinaires opposants ou cessionnaires.
Art. 3 —  (1) Sous réserve des dispositions de l'article 4, alinéa (1) est nulle et de nul effet la compensation effectuée par un employeur entre:
les salaires et indemnités qu'il doit au travailleur; et
les sommes que celui-ci pourrait lui devoir à quelque titre que ce soit.
(2) En cas de rupture du contrat sans préavis du fait du travailleur ou sans que le préavis ait été intégralement observé par celui-ci, l'employeur est admis à précompter sur les salaires et indemnités restant dus audit travailleur, jusqu'à due concurrence, remontant correspondant à la partie du préavis non effectué.
(3) Le remboursement à l'employeur d'une somme versée à titre d'avance au travailleur ne peut être réalisé que par retenues successives, conformément aux dispositions du présent décret relatives à la cession volontaire de salaire, et suivant les modalités fixées à l'article 2.
Art. 4 —  N'entrent pas dans le champ d'application des dispositions de l'article 3 alinéa (1) :
les prélèvements obligatoires, remboursements d'acompte(s) sur travail en cours, les consignations prévus par les conventions collectives et les contrats individuels ; et
les remboursements de prestations éventuellement fournies par l'employeur conformément aux dispositions de l'article 66, alinéa (3) du Code.
CHAPITRE Il
DE LA CESSION VOLONTAIRE DE SALAIRE
Art. 5 —  (1) La cession volontaire de salaire, ci-après désignée «la cession» est personnellement souscrite par le cédant. Elle est communiquée :
à l'Inspecteur du travail et de la Prévoyance Sociale du ressort lorsqu'il s'agit du remboursement d'avances consenties par l'employeur au travailleur;
au Président du Tribunal compétent dans les autres cas.
(2) La déclaration de cession se fait par écrit. Elle comprend:
les bulletins de salaire des trois (3) derniers mois faisant ressortir le montant mensuel dudit salaire;
une attestation dûment signée de l'employeur relative à l'absence de l'une quelconque des retenues prévues à l'article 75, alinéa (1) du Code, ou indiquant, dans le cas contraire, le montant détaillé des retenues subies dans ce cadre.
Art. 6 —  (1) Le Président du Tribunal statuant en matière sociale s'assure de la conformité de la cession consentie aux dispositions de l'article 2 alinéa (1), en tenant éventuellement compte des retenues déjà effectuées sur le salaire du cédant.
(2) Il demande au greffier de la juridiction compétente de notifier la déclaration de cession au débiteur du salaire ou à son représentant préposé au paiement dans le lieu de travail du cédant.
(3) La notification correspondante fait ressortir :
le montant mensuel du salaire du cédant ;
le montant de la quotité cessible ou saisissable mensuellement à l'occasion de chaque paie suivant la périodicité de celle-ci; et
le montant des retenues effectuées pour chaque paie au titre de la cession consentie.
(4) Le cessionnaire perçoit directement le montant des retenues entre les mains du débiteur du salaire, sur production d'une copie de la déclaration de cession, enregistrée conformément aux dispositions de l'alinéa (2).
CHAPITRE l
n DES DISPOSITIONS FINALES
Art. 7 —  (1) Sont abrogées toutes dispositions antérieures contraires, notamment celles du décret n°69/DF/289 du 30 juillet 1969 relatif aux saisies arrêts, cessions et retenues sur le salaire.
Art. 8 —  —Le ministre du travail et de la Prévoyance Sociale est chargé de l'exécution du présent décret qui sera enregistré, publié suivant la procédure d'urgence puis inséré au journal officiel en anglais et en français.",DECRET_N°94_197_PM_DU_09_MAI_1994_RELATIF_AUX_RETENUES_SUR_SALAIRE.
