URL,text,page_title,page_label,metadata
https://www.juriafrica.com/lex/decret-2003-061-3-avr-2003-16056.htm,"LE PRESIDENT DE LA REPUBLIQUE,
Vu la Constitution
Vu la loi n° 98/014 du 14 juillet 1998 régissant les télécommunications au Cameroun ;
Vu la loi n° 99/016 du 22 décembre 1999 portant statut général des Établissements publics et des entreprises du secteur public et parapublic
Vu le décret n° 2002/216 portant réorganisation du Gouvernement ;
Vu le décret n° 98/273 du 22 octobre 1998 portant réorganisation de la Présidence de la République ;
Vu le décret 2002/092 du 08 avril 2002 portant création, organisation et fonctionnement de l'Agence Nationale des Technologies de L'information et de la Communication,
DECRETE:
Art. 1er —  - Les dispositions de l'article 5 du décret n° 2002/092 susvisé sont modifiées et complétées ainsi qu'il suit :
Art. 5 (nouveau) —  ).(1) le Conseil d'Administration est composé ainsi qu'il suit :
Président : une personnalité nommée par décret du Président de la République ;
Membres :
un représentant de la Présidence de la République
un représentant des Services du Premier Ministre;
un représentant du Ministère chargé des Finances
un représentant du Ministère chargé des Postes et Télécommunications ;
un représentant du Ministère de la Recherche Scientifique et Technique ;
un représentant du Ministère chargé du Développement Industriel et Commercial ;
un représentant du Ministère de l'Enseignement Supérieur;
un représentant du Ministère de la Communication ;
deux opérateurs économiques du secteur désignés par le Président de la Chambre de Commerce, d'industrie, des Mines et de l'Artisanat
(2) Le Secrétariat du Conseil d'Administration est assuré par le Directeur Général de l'Agence ».
Art. 2 —  - Le présent décret sera enregistré et publié suivant la procédure d'urgence, puis inséré au Journal Officiel en français et en anglais.",DECRET_N_2003_061_DU_03_AVRIL_2003_MODIFIANT_ET_COMPLETANT_CERTAINES_DISPOSITIONS_DU_DECRET_N_2002_092_DU_08_AVRIL_2002_PORTANT_CREATION_ORGANISATION_ET_FONCTIONNEMENT_DE_L_AGENCE_NATIONALE_DES_TECHNOLOGIES_DE_L_INFORMATION_ET_DE_LA_COMMUNICATION,0,
