URL,text,page_title,page_label,metadata
https://www.juriafrica.com/lex/decret-2002-164-24-juin-2002-15947.htm,"LE PRESIDENT DE LA REPUBLIQUE,
VU la Constitution
VU la loi n° 98/021 du 24 décembre 1998 portant organisation du secteur portuaire.
VU la loi n° 99/016 du 22 décembre 1999 portant statut général des établissements publics et des entreprises du secteur public et parapublic
VU le décret n° 97/205 du 07 décembre 1997 portant organisation du Gouvernement, modifié et complété parle décret n° 98/067 du 28 avril 1998
VU le décret n°99/127 du 15 juin 1999 portant création des organismes portuaires autonomes
DECRETE:
Art. 1er —  Sont approuvés les statuts du Port Autonome de Limbé, joints en annexe du présent décret.
Art. 2 —  Sont abrogées toutes les dispositions antérieures contraires à celles des statuts vises à l'article 1er ci-dessus.
Art. 3 —  Le présent décret sera enregistré et publié suivant la procédure d urgence puis inséré au Journal Officiel en français et en anglais.",DECRET_N_2002_164_DU_24_JUIN_2002_PORTANT_APPROBATION_DES_STATUTS_DU_PORT_AUTONOME_DE_LIMBE,0,
