URL,text,page_title
https://www.juriafrica.com/lex/decret-2005-2869-pm-29-juil-2005-16101.htm,"LE PREMIER MINISTRE, CHEF DU GOUVERNEMENT,
VU la Constitution ;
VU la Convention sur le Commerce International des Espèces de Faune et de Flore Sauvages Menacées d'Extinction (CITES), ratifiée le 3 septembre 1981 ;
VU la loi n°90/031 du 10 Août 1990 régissant l'activité commerciale au Cameroun;
VU la loi n° 94/01 du 20 Janvier 1994 portant régime des forêts, de la faune et de la pêche, ensemble ses modificatifs subséquents;
VU la loi n° 96/12 du 05 Août 1996 portant loi cadre relative à la gestion de l'environnement;
VU la loi n°2000/017 du 19 Décembre 2000 portant réglementation de l'inspection sanitaire et vétérinaire;
VU le décret n°92/089 du 4 mai 1992 précisant les attributions du Premier Ministre, modifié et complété par le décret n°95/145 du 4 août 1995 ;
VU le décret n°2004/320 du 8 décembre 2004 portant organisation du Gouvernement ;
VU le décret n°2004/321 du 8 décembre 2004 portant nomination d'un Premier Ministre,
DECRETE;
CHAPITRE 1
DISPOSITIONS GENERALES
Art. 1er —  Le présent décret fixe les modalités d'application de certaines dispositions de la Convention sur le Commerce International des Espèces de Faune et de Flore Sauvages Menacées d'Extinction (CITES), ci-après désignée “ la Convention ”, notamment en matière de détention, de transport, de commerce international et domestique de toutes espèces de faune, de flore et de ressources halieutiques inscrites aux Annexes i, II, II) de ladite Convention.
Art. 2 —  Au sens de la Convention et du présent décret, les définitions ci-après sont admises:
“ Autorité scientifique ” : Corps scientifique national désigné conformément à l'article IX de la Convention et destiné à jouer le rôle de conseiller auprès de l'organe de Gestion ;
“ Centre de sauvegarde”: Institution désignée ou créée par un organe de gestion pour prendre soin des spécimens vivants, notamment ceux qui ont été confisqués ;
“ CITES ” : Convention sur le Commerce International des Espèces de Faune et de Flore Sauvages Menacées d'Extinction, adoptée à Washington, D.C, le 03 Mars 1973 ;
“ Commerce domestique ”: Toute activité commerciale des spécimens appartenant aux espèces inscrites aux Annexes I, Il, III de la Convention et se déroulant sur le territoire national ;
“ Commerce international ”: Toute activité d'exportation, de réexportation, de transit, d'importation ou d'introduction en provenance de la mer, des spécimens appartenant aux espèces inscrites aux Annexes I, II. III de la Convention ;
“ Conférence des Parties ”: Instance suprême qui regroupe tous les pays et organisations ayant adhéré à la Convention. Son organisation, ses attributions et son fonctionnement sont précisés à l'article XI de la Convention ;
“ Confiscation ”: Mesure ordonnée par une autorité compétente pouvant aboutir à la privation définitive du spécimen, partie ou produit objet de l'infraction ;
“ Contrôle à l'introduction, à l'exportation, à la réexportation et au transit ” : Vérification documentaire portant sur les permis et certificats prévus par le présent décret, y compris l'examen des spécimens, accompagnés éventuellement d'un prélèvement d'échantillons en vue d'une analyse ou d'un contrôle approfondi ;
“ Délivrance ”: Exécution de toutes les procédures nécessaires à la préparation et à la validation d'un permis ou d'un certificat et sa remise au demandeur ;
“ Élevé en captivité ” : Se réfère à la descendance, œufs y compris, née ou autrement produite en milieu contrôlé, soit de parents qui s'accouplent ou transmettent autrement leurs gamètes dans un milieu contrôlé en cas de reproduction sexuée), soit de parents vivants en milieu contrôlé au début du développement de la descendance (en cas de reproduction asexuée). La population parentale utilisée pour la reproduction doit être établie et maintenue de manière à ne pas compromettre la survie de l'espèce dans la nature ;
“ Elevage ” : Elevage en milieu contrôlé de spécimens prélevés dans la nature ;
“ Espèce ” : Ensemble d'individus animaux ou végétaux semblables par leur aspect, leur habitat, féconds entré eux mais ordinairement stériles avec tout individu d'une autre espèce ;
“ Exportation ” : Opération par laquelle un spécimen, partie ou produit, originaire d'un pays, appartenant à une des espèces inscrites aux Annexes I, Il, III de la Convention est envoyé hors de sa juridiction nationale ;
“ Importation ” : Opération par laquelle un spécimen, partie ou produit, appartenant à une des espèces inscrites aux Annexes I, II, III de la Convention est introduit dans la juridiction nationale en provenance d'un pays étranger ;
“ Introduction en provenance de la mer ” : Introduction directe dans le territoire national de tout spécimen prélevé dans le milieu marin n'étant pas sous la juridiction d'un Etat, y compris l'espace aérien situé au dessus de la mer, les fonds et le sous-sol marins ;
“ Milieu contrôlé ” : Milieu intensément manipulé par l'homme pour produire une espèce sélectionnée et qui comporte des barrières physiques empêchant que des animaux, des veufs ou des gamètes de cette espèce soient introduits dans le milieu contrôlé ou an ressortent ;
“ Mise en vente ”: Toute action pouvant raisonnablement être interprétée comme telle, y compris la publicité directe ou indirecte en vue de la vente, voire l'invitation à faire des offres ;
“ Objets personnels ou à usage domestique”: Les spécimens morts, les parties de spécimens et les produits dérivés appartenant à une personne et faisant partie ou devant faire partie de ses biens et effets courants et normaux ;
“ Organe de gestion ”: Autorité(s) administrative(s) nationale(s) désignée(s) au moment du dépôt des instruments de ratification, d'acceptation, d'approbation ou d'adhésion à la Convention. L'organe de Gestion est l'instance habilitée à communiquer avec les organes de gestion désignés par d'autres parties et le Secrétariat ;
“ Pays d'origine ” : Pays dans lequel un spécimen a été capturé ou prélevé de son milieu naturel, élevé en captivité ou reproduit artificiellement, ou introduit en provenance de la mer
“ Permis ou certificat ” : Document officiel délivré par l'organe de gestion afin d'autoriser l'importation, l'exportation, la réexportation ou l'introduction en provenance de la mer de spécimens d'espèces inscrites dans une des ;Annexes I, II, III ;
“Quota d'exportation ou contingent” : le quota ou contingent représente le nombre maximal de spécimens appartenant à une espèce et qui peut être exporté par le pays sur une période déterminée ;
“ Réexportation ”: Exportation de tout spécimen qui a été importé précédemment ;
“ Secrétariat” : Instance exécutive dont le statut et les attributions sont définis à l'article XII de la Convention ;
“ Spécimen ” : Tout animal ou plante, vivant ou mort appartenant aux espèces inscrites aux Annexes I, II, III de la Convention ou toute partie ou tout produit obtenu à partir de ceux-ci, incorporé ou non dans d'autres marchandises, ainsi que toute autre marchandise dans le cas où il ressort d'un document justificatif, de l'emballage ou d'une marque ou étiquette ou de tout autre élément, qu'il s'agisse de parties ou de produits d'animaux, ou de plantes de ces espèces ;
“ Spécimen sauvage ” : Spécimen d'origine sauvage ou produit dans un environnement contrôlé, qui n'est pas élevé en captivité comme défini par les résolutions de la Conférence des parties ;
“ spécimens pré-convention ” : Spécimens détenus par un tiers et dont il peut prouver qu'il les détient depuis une période antérieure à l'entrée en vigueur de la Convention sur le territoire concerné ;
“ Transbordement”: Transfert des spécimens entre deux véhicules tels que les navires, les avions, les trains, les camions amarrés à couple ou bien avec dépôt intermédiaire à terre ou sur un véhicule ;
“Transit”: Traversée d'un territoire médian par un spécimen expédié hors dudit territoire pour une destination située dans un troisième territoire. Le transport peut se faire par voie terrestre, maritime ou aérienne et les seules interruptions de la circulation étant celles liées aux arrangements ou formalités nécessaires ;
“ Vente ” : Toute forme d'activité de location, de troc, ou d'échange assimilée à la vente. Les expressions analogues sont interprétées dans le même sens.
Art. 3 —  La détention, l'importation, l'exportation, la réexportation, le transit, le transbordement et l'introduction en provenance de la mer d'espèces inscrites aux Annexes I,II, III sont assujettis aux dispositions légales et réglementaires en vigueur.
Art. 4 —  (1) Les modalités nationales de classification des espèces doivent respecter les principes fondamentaux relatifs à la classification des espèces prévus aux Annexes I, II, III, prévus à l'article II de la Convention.
(2) Les Ministres en charge de la faune, de la flore et des ressources halieutiques déterminent et mettent à jour la classification des espèces par arrêté.
(3) Les textes de classification cités à l'alinéa (2) ci-dessus doivent faire l'objet d'une diffusion auprès des administrations en charge du contrôle des espèces de faune et de flore menacées d'extinction, notamment auprès des services de la Douane et de ceux du maintien de l'ordre.
CHAPITRE Il
DES STRUCTURES CHARGEES DE LA GESTION ET DU SUIVI DE LA CITES
Art. 5 —  (1) Les Ministres en charge respectivement de la faune, de la flore et des ressources halieutiques représentent, chacun en ce qui le concerne, les organes de gestion CITES.
(2) Dans l'accomplissement de cette mission, les Ministres concernés déterminent par décision, les structures et les responsables appelés à examiner les dossiers CITES et précisent leurs modalités de fonctionnement.
Art. 6 —  (1) Les Ministres en charge de la faune, de la flore et des ressources halieutiques désignent, chacun en ce qui le concerne, une structure séparée et indépendante qui agira en qualité d'autorité scientifique.
(2) Les missions de l'autorité scientifique sont fixées par arrêté des Ministres concernés.
Art. 7 —  Les autorités et les administrations impliquées dans le contrôle du commerce international, de l'importation, de l'exportation, de la réexportation, de l'introduction des spécimens en provenance de la mer, du transbordement et du
Transit, ont l'obligation de coopérer avec l'organe de gestion dans la mise en application des dispositions du présent décret.
Art. 8 —  Les Ministres en charge de la faune, de la flore et des ressources halieutiques peuvent créer ou aménager des installations utilisables comme centres de sauvegarde ou de réintroduction en lieu jugé approprié.
Art. 9 —  (1) Il est créé, auprès du Ministère en charge de la faune et de la flore, un Comité interministériel de coordination et de suivi delà mise en oeuvre de la CITES.
(2) ('organisation et le fonctionnement du Comité interministériel cité à l'alinéa (1) sont fixés par arrêté du Premier Ministre.
CHAPITRE III
DES DOCUMENTS DELIVRES POUR LE COMMERCE INTERNATIONAL
Art. 10 —  L'importation, l'exportation, la réexportation, l'introduction en provenance de la mer de tout spécimen, partie ou produit appartenant à une espèce inscrite aux Annexes I, II, III est subordonnée à la présentation préalable des permis et/ou des certificats afférents à chaque cas, conformément à la législation ou la réglementation en vigueur.
Art. 11 —  (1) Le transit ou le transbordement de spécimen, partie ou produit d'espèces inscrites aux Annexes I et Il est subordonné à la présentation d'un permis d'exportation en cours de validité et/ou d'un certificat de réexportation, la dernière destination correspondant à la destination indiquée sur le permis.
(2) Le transit ou le transbordement de spécimen, partie ou produit d'espèces inscrites à l'Annexe III est soumis à la présentation d'un permis et/ou d'un certificat d'origine, la dernière destination correspondant à la destination indiquée sur le permis ou le certificat.
Art. 12 —  L'exportation, l'importation, la réexportation, le transit ou le transbordement de spécimen, partie ou produit des espèces inscrites aux Annexes Il et III, qui constituent des objets personnels ou à usage domestique sont subordonnés à la présentation de preuves attestant que ces spécimens sont une propriété individuelle à usage non commercial et ont été acquis légalement.
Art. 13 —  Des arrêtés des Ministres en charge de la faune, de la flore et des ressources halieutiques fixent les conditions de délivrance des permis et certificats d'exportation, de réexportation, d'importation, d'introduction en provenance de la mer, de transbordement ou de transit des espèces inscrites aux Annexes I, Il et III de la Convention.
CHAPITRE IV

Art. 14 —  (1) Les activités ci-dessous énumérées sont soumises à l'enregistrement auprès de l'organe de gestion compétent :
commerce de toute espèce inscrite aux Annexes CITES;
élevage ou production des animaux ou des ressources halieutiques en captivité, ou reproduction artificielle des plantes de toutes 'espèces inscrites aux Annexes CITES.
(2) L'organe de gestion compétent peut, à tout moment, inspecter les lieux et interroger les personnes enregistrées.
Art. 15 —  Les conditions d'enregistrement et d'exécution des diverses opérations commerciales ou de reproduction sont fixées par la réglementation en vigueur.
CHAPITRE V
DES DISPOSITIONS PARTICULIERES
Art. 16 —  Conformément aux dispositions de l'article VII de la Convention, les dispositions des articles 11 et 12 du présent décret peuvent ne pas s'appliquer au transit ou au transbordement dans les cas où :
les spécimens, partie ou produit, restent sous le contrôle de la douane l'organe de gestion a la preuve que le spécimen a été acquis avant le 3 septembre 1981, et délivre un certificat à cet effet;
les spécimens sont des objets personnels ou à usage domestique. Cette dérogation ne s'applique pas dans les cas des spécimens d'espèces inscrites aux Annexes I et II, acquis hors de l'Etat de résidence du propriétaire ou lorsque la réglementation du pays d'origine des spécimens exige un permis d'exportation pour les spécimens concernés,
les spécimens d'herbiers, de musées, conservés, desséchés ou sous inclusion et de plantes vivantes qui portent une étiquette délivrée par un organe de gestion sont l'objet de prêts, de donations ou d'échange à des fins non commerciales, entre hommes de science et institutions scientifiques enregistrées par un organe de gestion.
Art. 17 —  Les spécimens d'une espèce faunique ou halieutique inscrite à l'Annexe I, élevés en captivité à des fins commerciales, ou d'une espèce floristique inscrite en Annexe I, reproduite artificiellement à des fins commerciales, ne sont pas éligibles aux dérogations prévues à l'article 16 ci-dessus.
Art. 18 —  L'organe de gestion délivre un certificat à la place des permis s'il a la preuve qu'un spécimen d'une espèce animale ou halieutique inscrite à l'Annexe I a été élevé en captivité à des fins commerciales ou qu'une espèce de plante inscrite en Annexe I a été reproduite artificiellement à des fins commerciales, ou qu'il s'agit d'une partie ou produit d'un tel animal ou d'une telle plante.
Art. 19 —  L'organe de gestion peut accorder des dérogations aux obligations des articles III, IV et V de la Convention, dans le cas d'autorisation des mouvements de spécimens qui font partie d'un zoo, d'un cirque, d'une ménagerie, d'une exposition itinérante d'animaux de plantes ou de ressources halieutiques, à condition que les caractéristiques complètes des spécimens soient déclarés à l'organe de gestion, que les spécimens soient reconnus comme effets pré-convention ou qu'ils aient été élevés en captivité, et qu'ils soient traités et transportés selon les normes en vigueur.
Art. 20 —  Pour les institutions scientifiques, les documents exigés au chapitre III du présent décret ne sont pas exigés en cas de prêts, de donations et échanges à des fins non commerciales entre institutions scientifiques ou entre scientifiques enregistrés ou reconnus auprès de l'organe de gestion.
CHAPITRE VI
DES SANCTIONS
Art. 21 —  Les organes de gestion prennent toutes sanctions administratives conformément à leur pouvoir de police spéciale en la matière.
Art. 22 —  Les infractions dûment constatées sont punies conformément à la législation en vigueur.
CHAPITRE VII
DISPOSITIONS DIVERSES, TRANSITOIRES ET FINALES
Art. 23 —  L'entrée en vigueur du présent décret n'entame pas la validité des permis et certificats émis sous le régime antérieur.
Art. 24 —  Les Départements ministériels chargés de la gestion des ressources fauniques, floristiques et halieutiques sont, chacun en ce qui le concerne, chargés de la mise en application du présent décret en collaboration avec toutes les administrations en charge de la sécurité, du maintien de l'ordre et de la régulation des activités économiques et commerciales.
Art. 25 —  Le présent décret sera enregistré, publié selon la procédure d'urgence, puis inséré au Journal Officiel en français et en anglais.",DECRET_N°2005_2869_PM_DU_29_JUILLET_2005_FIXANT_LES_MODALITES_D_APPLICATION_DE_CERTAINES_DISPOSITIONS_DE_LA_CONVENTION_SUR_LE_COMMERCE_INTERNATIONAL_DES_ESPECES_DE_FAUNE_ET_DE_FLORE_SAUVAGES_MENACEES
