URL,text,page_title,page_label,category,metadata
https://www.juriafrica.com/lex/decret-2004-157-23-juin-2004-15943.htm,"DECRET N° 2004/157 DU 23 JUIN 2004 L'ACCORD DE PRÊT D'UN MONTANT DE SEPT CENT SOIXANTE SEPT MILLE CINQ CENTS (767.500) DINARS ISLAMIQUES, SOIT ENVIRON SIX CENT VINGT HUIT MILLIONS TROIS CENT QUATRE VINGT MILLE (628.380.000) FRANCS CFA, CONCLU LE 10 JANVIER 2004 ENTRE LA RÉPUBLIQUE DU CAMEROUN ET LA BANQUE ISLAMIQUE DE DÉVELOPPEMENT POUR LE FINANCEMENT DU PROJET DE MICRO-FINANCE DANS LE NORD-CAMEROUN.-

LE PRESIDENT DE LA REPUBLIQUE,
Vu la Constitution
Vu la loi n° 2003/017 du 22 décembre 2003 portant loi de Finances de la République du Cameroun pour l'exercice 2004 ;
Vu le décret n° 2002/216 du 24 août 2002 portant réorganisation du Gouvernement ;
Vu le décret n° 2003/349 du 13 décembre 2003 habilitant le Ministre des Affaires Economiques, de la Programmation et de l'Aménagement du Territoire à signer avec la Banque Islamique de Développement un Accord de prêt d'un montant de sept cent soixante sept mille cinq cents (767.500) dinars islamiques, soit environ six cent vingt-huit millions trois cent quatre vingt mille (628.380.000)francs CFA pour le financement de micro-finance dans le Nord-Cameroun,
DECRETE:
Art. 1er —  Est ratifié l'Accord de prêt d'un montant de sept cent soixante sept mille cinq cents (767.500) dinars islamiques, soit environ six cent vingt-huit millions trois cent quatre vingt mille (628.380.000) francs CFA, conclu entre la République du Cameroun et la Banque Islamique de Développement pour le financement de micro-finance dans le Nord-Cameroun.
Art. 2 —  Le présent décret sera enregistré et publié suivant la procédure d'urgence, puis inséré au Journal Officiel en français et en anglais./-",DECRET_N_2004_157_DU_23_JUIN_2004_L_ACCORD_DE_PRET_D_UN_MONTANT_DE_SEPT_CENT_SOIXANTE_SEPT_MILLE_CINQ_CENTS_767_500_DINARS_ISLAMIQUES_SOIT_ENVIRON_SIX_CENT_VINGT_HUIT_MILLIONS_TROIS_CENT_QUATRE_VINGT_MILLE_628_380_000_FRANCS_CFA_CONCLU_LE_10_JANVIER_2004_ENTRE_LA_REPUBLIQUE_DU_CAMEROUN_ET_LA_BANQUE_ISLAMIQUE_DE_DEVELOPPEMENT_POUR_LE_FINANCEMENT_DU_PROJET_DE_MICRO_FINANCE_DANS_LE_NORD_CAMEROUN,0,decret,
