URL,text,page_title
https://www.juriafrica.com/lex/decret-2022-110-04-mars-2022-50845.htm,"LE PRESIDENT DE LA REPUBLIQUE,
Vu la Constitution ;
Vu la loi n°1996/12 du 05 août 1996 portant loi-cadre relative à la gestion de l'environnement ;
Vu la loi n°2011 du 06 mai 2011 portant loi-cadre de protection du consommateur au Cameroun ;
Vu la loi n°2011/022 du 14 décembre 2011 réagissant le secteur de l'électricité ;
Vu loi n°2017/010 du 12 juillet 2017 portant Statut Général des Etablissements Publics ;
Vu loi n°2018/011 du 11 juillet 2018 portant Code de transparence et de bonne gouvernance dans la gestion des Finances Publiques au Cameroun ;
Vu loi n°2018/012 du 11 juillet 2018 portant Régime financier de l'Etat et des autres entités publiques ;
Vu loi n°2019/024 du 24 décembre 2019 portant Code Général des Collectivités Territoriales Décentralisées ;
Vu le Décret n°2011/408 du 09 décembre 2011 portant organisation du Gouvernement, modifié et complété par le décret n°2018/190 du 02 mars 2018,
Vu le Décret n°2018/366 du 20 juin 2018 portant Code des Marchés Publics ;
Vu le Décret n°2019/320 du 19 juin 2019 précisant les modalités d'application de certaines dispositions des lois n°2017/010 et 2017/011 du 12 juillet 2017 portant statut général des établissements publics et des entreprises publiques ;
Vu le Décret n°2019/322 du 19 juin 2019 fixant les catégories d'Etablissement Publics, la rémunération, les indemnités et les avantages de leurs dirigeants,
DECRETE:
CHAPITRE I
DISPOSITIONS GENERALES
Art. 1er  —  Le présent décret porte réorganisation et fonctionnement de l'Agence de l'Electrification Rurale, en abrégé « AER » et ci-après désigné « l'Agence ».
Art. 2 —  (1) L'Agence est un établissement public à caractère technique, dotée de la personnalité juridique et de l'autonomie financière.
(2) Son siège est fixé à Yaoundé. Il peut être transféré en tout autre lieu du territoire national par décret du Président de la République.
(3) Des antennes peuvent, en tant que de besoin, être créées à l'intérieur du territoire national par résolution du Conseil d'Administration.
Art. 3 —  (1) L'Agence est placée sous la tutelle technique du Ministère en charge de l'électricité et sous la tutelle financière du Ministère en charge des finances.
(2) La tutelle technique est chargée de s'assurer :
de la conformité des activités menées par l'Agence aux orientations des politiques publiques du Gouvernement dans le sous-secteur de l'électrification rurale, sous réserve des compétences reconnues au Conseil d'Administration ;
de la conformité des résolutions du Conseil d'Administration aux lois et règlements, ainsi qu'aux orientations des politiques sectorielles.
(3) La tutelle financière est chargé de s'assurer :
de la conformité des opérations de gestion à incidence financière de l'Agence à la réglementation sur les finances publiques d'une part, et de la régularité a posteriori des comptes, d'autre part ;
de la régularité des résolutions du Conseil d'Administration à incidence financière, de la soutenabilité des engagements financiers et de la cohérence générale des projets et plans de performance de l'Agence aux programmes sectoriels.
Art. 4 —  (1) Les tutelles technique et financière, en liaison avec le Conseil d'Administration, concourent au suivi de la performance de l'Agence.
(2) L'Agence adresse aux tutelles techniques et financière tous documents et informations relatifs à sa gestion, notamment les projets de performance, les rapports annuels de performance, le rapport du Contrôleur financier, les comptes administratif et de gestion, l'Etat à jour de la situation du personnel et la grille salariale.
(3) Les Ministres de tutelles technique et financière adressent, chacun en ce qui le concerne, au Président de la République, un rapport annuel sur la situation de l'Agence.
Art. 5 —  (1) L'Agence assure la promotion et le développement de l'électrification rurale sur l'ensemble du territoire national. Elle est chargée, en liaison avec les administrations, organismes publics et privés concernés, de contribuer à l'élaboration et à la mise en œuvre de la politique du Gouvernement dans le domaine de l'électrification rurale au Cameroun.
A ce titre, l'Agence a pour missions :
en matière de promotion de l'électrification rurale :
de collecter les informations relatives aux diverses opportunités d'investissements dans le domaine de l'électrification rurale et de les diffuser auprès des milieux intéressés, notamment :
les Collectivités Territoriales Décentralisées ;
les opérateurs privés et les investisseurs ;
les bailleurs de fonds et les organismes de financement ;
les administrations concernées ou intéressées par l'électrification rurale.
de participer à la vulgarisation de l'électrification rurale à partir de toute source d'énergie ;
de proposer toutes mesures d'attrait des investisseurs dans le domaine de l'électrification rurale au Cameroun ;
d'élaborer les mécanismes de gestion communautaire et de maintenance des installations d'électrification en milieu rural ;
d'encadrer les communautés rurales bénéficiaires des installations d'électrification en zone rurale et les opérateurs dans la gestion et la maintenance de celles-ci ;
d'accompagner l'Etat dans l'analyse, la modélisation et le contrôle des projets d'infrastructures dans le sous-secteur de l'électrification rurale.
en matière de développement de l'électrification rurale :
d'assister l'Etat dans l'élaboration des plans et des projets d'électrification rurale, en liaison avec les Administrations compétentes ;
d'accompagner les Collectivités Territoriales Décentralisées dans l'élaboration des plans et des projets d'électrification rurale ;
de mettre en place une banque de données de projets à la disposition des investisseurs concernés ;
de réaliser des enquêtes et des études débouchant sur des solutions techniques économiquement applicables en milieu rural dans le respect des standards et normes homologués ;
de construire les ouvrages de production et de distribution d'électricité en milieu rural ;
d'exploiter tous les centres d'électrification par systèmes solaires photovoltaïques.
(2) En outre, l'Agence est chargée d'assurer la conservation du patrimoine public en milieu rural dont la gestion lui est confiée par l'Etat.
(3) Nonobstant les dispositions prévues aux alinéas 1 et 2 ci-dessus, l'Agence peut négocier des contrats de partenariat dans le domaine technique pour la gestion et la maintenance des ouvrages, de production, de distribution et de raccordement des abonnés en milieu rural.
(4) L'Agence peut également exercer toute autre mission d'intérêt général, que pourrait lui confier l'Etat dans le cadre de l'électrification rurale.
Art. 6 —  L'Agence adresse au Gouvernement un rapport annuel et éventuellement des rapports circonstanciels sur le fonctionnement et la fiabilité du sous-secteur de l'électrification rurale. Ces rapports sont assortis de toute proposition susceptible d'améliorer ledit sous-secteur.
CHAPITRE II
DE L'ORGANISATION ET DU FONCTIONNEMENT
Art. 7 —  Les organes de gestion de l'Agence sont :
Le Conseil d'Administration ;
La Direction Générale.
SECTION I
DU CONSEIL D'ADMINISTRATION
PARAGRAPHE I
DE LA COMPOSITION DU CONSEIL D'ADMINISTRATION
Art. 8 —  Le Conseil d'Administration, composé de onze (11) membres, est présidé par une personnalité nommée par décret du Président de la République. Il comprend, outre le Président du Conseil, les membres ci-après :
un (01) représentant de la Présidence de la République ;
un (01) représentant des Services du Premier Ministre ;
un (01) représentant du Ministère en charge de l'électricité ;
un (01) représentant du Ministère en charge des finances ;
un (01) représentant du Ministère en charge de l'aménagement du territoire ;
un (01) représentant du Ministère en charge du développement local ;
deux (02) représentants des Collectivités Territoriales Décentralisées, désignés par leurs pairs dans les proportions suivantes : un (01) représentant des Communes et un (01) représentant des Régions ;
un (01) représentant du personnel ;
un (01) représentant des associations des consommateurs de l'énergie rurale.
Art. 9 —  (1) Le Président du Conseil d'Administration de l'Agence est nommé par décret du Président de la République pour un mandat de trois (03) ans, renouvelable une fois.
(2) L'acte nommant le Président du Conseil d'Administration confère d'office à celui-ci la qualité d'Administrateur.
(3) En cas d'expiration du mandat du Président du Conseil d'Administration, le Ministre de tutelle technique saisit l'autorité investie du pouvoir de nomination.
Art. 10 —  (1) Les Membres du Conseil d'Administration de l'Agence sont nommés par décret du Président de la République, sur proposition des administrations ou organismes qu'ils représentent, pour un mandat de trois (03) ans, éventuellement renouvelable une (01) fois.
(2) Le représentant du personnel est élu par ses pairs pour un mandat de trois (03) ans, éventuellement renouvelable une (01) fois.
(3) Le représentant des associations des consommateurs de l'énergie rurale est élu par ses pairs pour un mandat de trois (03) ans, éventuellement renouvelable une (01) fois, à la diligence du Ministre chargé de l'électricité.
(4) Le mandat d'Administrateur prend fin :
par décès ou par démission ;
à la suite de la perte de la qualité ayant motivé sa nomination ;
par révocation à la suite d'une faute grave ou des agissements incompatibles avec la fonction d'administrateur ;
à l'expiration normale de sa durée.
(5) Dans les cas prévus à l'alinéa 4 ci-dessus, il est pourvu au remplacement d'Administrateur dans les mêmes formes que sa désignation.
(6) Six (06) mois avant l'expiration du mandat d'un membre du Conseil d'Administration, le Président du Conseil d'Administration saisit la structure d'appartenance du membre concerné, en vue de son remplacement, avec copie aux tutelles technique et financière.
(7) Aucun membre ne peut siéger une fois son mandat expiré.
(8) En cas de décès en cours de mandat ou dans toutes les hypothèses où un Administrateur n'est plus en mesure d'exercer son mandat, l'administration ou l'organisme qu'il représente, désigne un autre administrateur pour la suite du mandat.
Art. 11 —  Le Président et les membres du Conseil d'Administration sont soumis aux mesures restrictives et aux incompatibilités prévues par la législation en vigueur.
Art. 12 —  (1) Le Président du Conseil d'Administration bénéficie d'une allocation mensuelle et des avantages. Le montant de l'allocation mensuelle, ainsi que les avantages sont fixés par le Conseil d'Administration, conformément à la règlementation en vigueur.
(2) Les administrateurs bénéficient d'une indemnité de session fixée par une résolution du Conseil d'Administration, dans la limite des plafonds définis par la réglementation en vigueur. Ils peuvent prétendre au remboursement des dépenses occasionnées par les sessions, sur présentation des pièces justificatives.
(3) Le Conseil d'Administration peut allouer à ses membres, des rémunérations exceptionnelles pour les missions et mandats qui leur sont confiés, ou autoriser le remboursement des frais de voyage, déplacements et dépenses engagées dans l'intérêt de l'Agence.
PARAGRAPHE II
DES POUVOIRS ET DU FONCTIONNEMENT DU CONSEIL D'ADMINISTRATION
Art. 13 —  (1) Le Conseil d'Administration à les pouvoirs de définir, d'orienter la politique générale de l'Agence et d'en évaluer la gestion, dans les limites fixées par son objet social, conformément à la législation et la réglementation en vigueur.
A ce titre, il :
fixe les objectifs et approuve les projets de performance de l'Agence ;
adopte le budget accompagné du projet de performance de l'Agence et arrête de manière définitive les comptes ;
approuve les rapports annuels de performance ;
adopte l'organigramme et le règlement Intérieur ;
autorise le recrutement de tout le personnel, conformément au plan de recrutement proposé par le Directeur Général et validé par le Conseil d'Administration ;
autorise le licenciement du personnel, sur proposition du Directeur Général ;
nomme sur proposition du Directeur Général aux postes de responsabilités à partir de Sous-directeurs, de Directeurs et assimilés ;
accepte tous dons, legs et subventions ;
approuve les contrats de performance ou toutes autres conventions préparés par le Directeur Général et ayant une incidence sur le budget ;
autorise toute aliénation de biens meubles ou immeubles, corporels ou incorporels, conformément aux dispositions de la loi portant statut général des établissements publics ;
s'assure du respect des règles de gouvernance et commet des audits afin de garantir la bonne gestion de l'Agence ;
fixe les rémunérations et les avantages du personnel, dans le respect des lois et règlements en vigueur, du règlement intérieur et de prévisions budgétaires ;
met à la disposition des tutelles, les rapports annuels d'activités et de gestion de l'Agence, y compris une analyse des résultats opérationnels et financiers ;
veille à l'atteinte des objectifs de performance, conformément aux lois et règlements en vigueur.
(2) Le plan de recrutement visé à l'alinéa 1 ci-dessus, comprend notamment l'expression des besoins en effectif, le profil et la qualification des postes à pourvoir, la description des postes de travail, le tableau prévisionnel des départs à la retraite, ainsi que les éléments d'information sur les postes vacants.
(3) Le Conseil d'Administration peut, en tant que de besoin, déléguer au Directeur Général certains de ses pouvoirs.
Art. 14 —  (1) Le Président du Conseil d'Administration convoque et préside les sessions du Conseil. Il veille à l'application de ses résolutions.
(2) A l'occasion des sessions du Conseil d'Administration, il est préalablement procédé à la vérification de la qualité des mandats des Administrateurs, et du quorum.
(3) Aucune session ne peut valablement se tenir si le quorum requis n'est pas atteint, ou s'il est établi que l'un des membres présent en a perdu la qualité.
Art. 15 —  (1) En cas de vacance de la Présidence du Conseil d'Administration suite au décès, à la démission ou à la défaillance du Président, les sessions du Conseil d'Administration sont convoquées par le Ministre de tutelle financière à la diligence du Directeur Général, ou de deux tiers (2/3) de membres du Conseil d'Administration.
(2) Lorsque l'initiative est prise par les deux tiers (2/3) des membres du Conseil d'Administration, ceux-ci adressent à l'autorité de tutelle financière une demande de convocation du Conseil d'Administration portant la signature de tous les demandeurs.
(3) Les sessions du Conseil d'Administration convoquées conformément à l'alinéa 1 ci-dessus, sont présidées par un membre du Conseil élu par ses pairs.
Art. 16 —  (1) Sur convocation de son Président, le Conseil d'Administration se réunit obligatoirement au moins deux (02) fois par an en session ordinaire dont :
une (01) session consacrée à l'examen du projet de performance et à l'adoption du budget, qui se tient avant le début de l'exercice budgétaire suivant ;
une (01) session consacrée à l'arrêt des comptes, qui se tient au plus tard le 30 juin de l'année en cours.
(2) Le Président du Conseil d'Administration est défaillant lorsqu'il ne convoque pas au moins deux (02) sessions du Conseil d'Administration par an.
(3) En cas de refus de convoquer une session du Conseil conformément à l'alinéa 1 ci-dessus, les deux tiers (2/3).
(4) Les convocations et les documents relatifs à la session, sont adressés aux membres du Conseil par lettre, fax, télégramme, courrier électronique, télécopie ou par tout moyen laissant trace écrite, au moins quinze (15) jours avant la date prévue pour la session. En cas d'urgence, ce délai peut être ramené à cinq (05) jours.
(5) Le Conseil d'Administration peut être convoqué en session extraordinaire sur un ordre du jour précis, à la demande de son Président ou des deux tiers (2/3) de ses membres.
(6) Les convocations indiquent l'ordre du jour, la date, le lieu et l'heure de la session.
Art. 17 —  (1) Tout membre du Conseil d'Administration empêché peut se faire représenter aux sessions du Conseil par un autre membre.
(2) Aucun administrateur ne peut, au cours d'une même session, représenter plus d'un administrateur.
(3) Tout membre présent ou représenté à une session du Conseil d'Administration est considéré comme ayant été dûment convoqué.
(4) En cas d'empêchement du Président, le Conseil d'Administration élit en son sein, à la majorité simple des membres présents ou représentés, un président de séance.
Art. 18 —  (1) Le Conseil d'Administration examine toute question inscrite à l'ordre du jour soit par le Président, soit à la demande de deux tiers (2/3) des administrateurs.
(2) Le secrétariat des sessions du Conseil d'Administration est assuré par le Directeur Général de l'Agence.
Art. 19 —  (1) Le Conseil d'Administration ne peut valablement délibérer sur toute question inscrite à l'ordre du jour de sa session que si les deux tiers (2/3) au moins de ses membres sont présents ou représentés. Si le quorum n'est pas atteint lors de la première convocation, il est, pour la convocation suivante, ramené à la moitié des membres du Conseil d'Administration.
(2) Chaque membre dispose d'une voix. Les décisions sont prises à la majorité simple des voix des membres présents ou représentés. En cas d'égalité des voix, celle du Président est prépondérante.
Art. 20 —  (1) Les décisions du Conseil d'Administration prennent la forme de résolutions. Elles sont signées séance tenante par le Président du Conseil d'Administration ou le Président de séance, le cas échéant, et un Administrateur.
(2) Les décisions du Conseil d'Administration prennent effet à compter de leur adoption.
Art. 21 —  (1) Lors de chaque séance, les délibérations du Conseil d'Administration font l'objet d'un procès-verbal co-signé par le Président et le secrétaire de séance. Le procès-verbal fait mention des membres présents ou représentés. Il est lu et approuvé par le Conseil d'Administration à l'occasion de chaque session du Conseil.
(2) Les procès-verbaux de séance sont consignés dans un registre spécial tenu au siège de l'Agence.
Art. 22 —  (1) Pour l'accomplissement de ses missions, le Conseil d'Administration peut créer en son sein et en tant que de besoin, des Comités et des Commissions.
(2) Ces Comités et/ou Commissions rendent uniquement des avis et recommandations.
(3) Les membres des Comités ou des Commissions bénéficient des facilités de travail et des indemnités dans la limite des plafonds est fixée par la réglementation en vigueur.
SECTION II
DE LA DIRECTION GENERALE
Art. 23 —  (1) L'Agence est placée sous l'autorité d'un Directeur Général, éventuellement assisté d'un Directeur Général Adjoint.
(2) Le Directeur Général et le Directeur Général Adjoint sont nommés par décret du Président de la République, pour un mandat de trois (03) ans éventuellement renouvelable deux (02) fois.
(3) Le renouvellement prévu à l'alinéa 2 ci-dessus est tacite.
(4) Dans tous les cas, les mandats cumulés du Directeur Général ou de son Adjoint, ne peuvent excéder neuf (09) ans.
Art. 24 —  Les fonctions de Membre du Gouvernement ou assimilé, de parlementaire, de magistrat exerçant auprès d'une juridiction ou de membre du Conseil Constitutionnel sont incompatibles avec celles de Directeur Général ou de Directeur Général Adjoint.
Art. 25 —  (1) Sous le contrôle du Conseil d'Administration, le Directeur Général est chargé de l'application de la politique générale et de la gestion de l'Agence.
A ce titre, il est chargé notamment :
d'assurer la direction technique, administrative et financière de l'Agence ;
de préparer les projets de budget et de performance, de produire le compte administratif, ainsi que le rapport annuel de performance ;
de préparer les résolutions du Conseil d'Administration, d'assister avec voix consultative à ses réunions et d'exécuter ses décisions ;
de proposer un plan de recrutement du personnel au Conseil d'Administration ;
de recruter et licencier le personnel temporaire, occasionnel et saisonnier, selon les nécessités de service et les besoins éventuels, conformément à la réglementation en vigueur ;
de recruter le personnel, conformément"" au plan de recrutement approuvé par le Conseil d'Administration ;
de noter et licencier le personnel, sous réserve des pouvoirs du Conseil d'Administration ;
de nommer aux postes de responsabilités, sous réserve des compétences dévolues au Conseil d'Administration ;
de procéder aux achats, passer et signer les marchés, contrats et conventions liés au fonctionnement de l'Agence, d'en assurer l'exécution et le contrôle, dans le strict respect du budget, conformément aux dispositions réglementaires en vigueur ;
d'étudier les dossiers de demande de financement des projets présentés par les tiers ou les Collectivités Territoriales Décentralisées et de les soumettre à l'approbation du Conseil d'Administration, avant leur transmission au Ministre en charge de l'électricité ;
de gérer les biens meubles, immeubles, corporels et incorporels de l'Agence, dans le respect de son objet social et des pouvoirs du Conseil d'Administration ;
de soumettre à l'adoption du Conseil d'Administration, les projets de plan d'organisation de l'Agence, de règlement intérieur, des statuts du personnel, de la grille des rémunérations et avantages du personnel.
(2) Le Plan de recrutement approuvé par le Conseil d'Administration, visé à l'alinéa 1 ci-dessus, est mis en œuvre à la diligence du Directeur Général.
(3) Le Directeur Général, dans les cas d'urgence, prend toutes les mesures conservatoires nécessaires, en vue d'assurer la bonne marche de l'Agence, dans la limite des pouvoirs dévolus au Conseil d'Administration.
(4) Le Directeur Général peut déléguer une partie de ses pouvoirs.
Art. 26 —  (1) Le Conseil d'Administration peut prendre à l'encontre du Directeur Général ou du Directeur Général Adjoint, les sanctions suivantes :
suspension de certains pouvoirs ;
suspension de ses fonctions pour une période limitée, avec effet immédiat ;
suspension de ses fonctions avec effet immédiat, assortie d'une demande de révocation adressée à l'autorité investie du pouvoir de nomination.
(2) Les décisions sont transmises pour information au Ministre de tutelle technique et au Ministre de tutelle financière à la diligence du Président du Conseil d'Administration.
Art. 27 —  En cas de suspension des fonctions, le Conseil d'Administration prend les dispositions nécessaires pour assurer la bonne marche de l'Agence.
Art. 28 —  (1) Le Directeur Général et le Directeur Général Adjoint sont responsables, chacun en ce qui le concerne, devant le Conseil d'Administration qui peut les sanctionner, en cas de faute grave de gestion ou de comportement susceptible de nuire à la bonne marche, ou à l'image de l'Agence.
(2) Dans les cas prévus à l'alinéa 1 ci-dessus, le Président du Conseil d'Administration est tenu de convoquer une session extraordinaire au cours de laquelle le Directeur Général ou son adjoint est entendu.
(3) Le dossier comprenant les griefs est transmis au Directeur Général ou à son Adjoint dix (10) jours au mois avant la date prévue de la session extraordinaire.
Art. 29 —  Le Directeur Général représente l'Agence dans tous les actes de la vie civile et en justice.
Art. 30 —  (1) En cas d'empêchement temporaire du Directeur Général, l'intérim est assuré par le Directeur Général Adjoint.
(2) En cas d'indisponibilité du Directeur Général Adjoint, l'intérim est assuré par un responsable ayant au moins rang de Directeur, désigné par le Directeur Général.
(3) En cas de vacance du poste de Directeur Général ou du Directeur Général Adjoint pour cause de décès, de démission ou de mandat arrivé à échéance, le Conseil d'Administration prend toutes les dispositions nécessaires pour le bon fonctionnement de l'Agence, en attendant la nomination d'un nouveau Directeur Général ou Directeur Général Adjoint par l'autorité investie du pouvoir de nomination.
CHAPITRE III
DU PERSONNEL
Art. 31 —  Peuvent faire partie du personnel de l'Agence, conformément à son statut :
le personnel recruté par l'Agence ;
les fonctionnaires en détachement ;
les agents de l'Etat relevant du Code du Travail mis à la disposition de l'Agence ;
le personnel occasionnel, saisonnier et temporaire, dont les modalités de recrutement, de rémunération et de rupture de contrat sont fixées par le statut du personnel.
Art. 32 —  Les fonctionnaires en détachement et les agents de l'Etat relevant du Code du Travail mis à la disposition de l'Agence relèvent, pendant toute la durée de leur emploi, de la législation du travail, sous réserve des dispositions du Statut Général de la fonction publique et des statuts spécifiques relatifs à la retraite, à l'avancement, et à la fin du détachement.
Art. 33 —  (1) Les fonctionnaires en détachement et les agents de l'Etat relevant du Code de Travail mis à la disposition de l'Agence sont, quel que soit leur statut d'origine, pris totalement en charge par l'Agence, conformément à la réglementation en vigueur.
(2) La prise en charge visée à l'alinéa 1 ci-dessus, concerne le salaire et ses accessoires, les indemnités, les primes et les autres avantages servis par l'Agence.
Art. 34 —  (1) La responsabilité civile et/ou pénale du personnel de l'Agence est soumise aux règles de droit commun.
(2) Les conflits entre le personnel et l'Agence relèvent de la compétence des juridictions de droit commun.
Art. 35 —  L'acte de nomination du Directeur Général et du Directeur Général Adjoint, ne leur confère pas la qualité d'employé de l'Agence, à moins que les intéressés ne soient préalablement dans une relation contractuelle avec l'Agence.
CHAPITRE IV
DES DISPOSITIONS FINANCIERES
SECTION I
DES RESSOURCES
Art. 36 —  Les ressources financières de l'Agence sont constituées :
de la quote-part de la redevance sur titre prélevée sur le chiffre d'affaires des opérateurs du secteur de l'électricité ;
des ressources mises à la disposition de l'agence par les partenaires au développement, en vertu des conventions et accords conclus avec le Gouvernement et destinés au développement de l'électrification rurale ;
des subventions et contreparties de l'Etat destinées au financement de l'électrification rurale ;
des contributions et dotations diverses ;
du produit de l'aliénation de ses biens ;
des excédents budgétaires du régulateur du Secteur de l'Electricité, affectés par le Conseil d'Administration dudit régulateur ;
des revenus ou des recettes de services issus, le cas échéant, de l'exploitation des ouvrages décentralisés dont la gestion lui est confiée par l'Etat ;
des dons et legs ;
de toute autre ressource qui pourrait lui être affectée, conformément à la réglementation en vigueur.
Art. 37 —  (1) Les ressources financières de l'Agence sont des deniers publics. Elles sont gérées selon les règles prévues par le Régime Financier de l'Etat et des autres entités publiques, ainsi que le Code de Transparence et de Bonne Gouvernance dans la gestion des Finances Publiques au Cameroun.
(2) Toutefois, les ressources issues de la coopération et des partenariats divers sont gérées suivant les modalités prévues par les Conventions et Accords y relatifs.
SECTION II
DU BUDGET ET DES COMPTES
Art. 38 —  L'exercice budgétaire de l'Agence commence le 1er janvier et se termine le 31 décembre de chaque année.
Art. 39 —  (1) Le Directeur Général est l'Ordonnateur principal du budget de l'Agence.
(2) Sur proposition du Directeur Général, des ordonnateurs délégués peuvent être désignés par le Conseil d'Administration.
Art. 40 —  (1) Le projet de budget annuel assorti du projet de performance, y compris les plans d'investissement de l'Agence sont préparés par le Directeur Général et adoptés par le Conseil d'Administration.
(2) Le budget est présenté sous forme de sous-programmes cohérents, avec les objectifs de politique publique nationale ou sectorielle.
(3) Le budget de l'Agence doit être équilibré en recettes et en recettes et en dépenses.
(4) Toutes les recettes et les dépenses de l'Agence sont inscrites dans le budget adopté par le Conseil d'Administration.
Art. 41 —  (1) Le budget de l'Agence est adopté par le Conseil d'Administration.
(2) Le budget est rendu ""exécutoire dès son adoption par le Conseil d'Administration, sous réserve des dispositions contraires des lois et règlements en vigueur.
Art. 42 —  Les comptes de l'Agence doivent être réguliers, sincères et donner une image fidèle de son patrimoine et de sa situation financière.
Art. 43 —  (1) L'Agence tient trois (03) types de compatibilité :
une compatibilité budgétaire des recettes et des dépenses ;
une compatibilité générale ;
une compatibilité analytique.
(2) L'Agence peut tenir, en sus, d'autres types de compatibilité.
Art. 44 —  (1) Les sommes indispensables à la couverture des dépenses de fonctionnement et, d'une manière générale, les ressources propres de l'Agence, peuvent être déposées dans un compte bancaire ouvert, après accord préalable du Ministre chargé des finances.
(2) L'engagement, la liquidation, le mandatement et le paiement des sommes déposées dans le compte visé à l'alinéa 1 ci-dessus, s'effectuent conformément aux règles de la compatibilité publique.
SECTION III
DU CONTROLE ET DU SUIVI DE LA GESTION
Art. 45 —  (1) Un Agent Comptable et un Contrôleur Financier Spécialisé sont nommés auprès de l'Agence, par arrêté du Ministre chargé des finances.
(2) L'Agent Comptable et le Contrôleur Financier Spécialisé exercent leurs missions conformément aux lois et règlements en vigueur, sauf dispositions contraires des conventions internationales dûment ratifiées par le Cameroun et publiées.
Art. 46 —  (1) L'Agent Comptable recouvre et enregistre toutes les recettes et effectue toutes les dépenses de l'Agence. Il s'assure de la régularité des autorisations des recettes, des mandatements et des paiements ordonnés par le Directeur Général de l'Agence.
(2) Le paiement des dépenses autorisées s'effectue uniquement auprès de l'Agent Comptable de l'Agence.
Art. 47 —  (1) Le Contrôleur Financier Spécialisé est chargé du contrôle des actes générateurs des recettes et des dépenses pris, soit par le Directeur Général, soit par les ordonnateurs délégués du budget de l'Agence. Il est chargé, d'une manière générale, du contrôle de l'exécution du budget.
(2) Le Contrôleur Financier Spécialisé n'est pas juge de l'opportunité des recettes et des dépenses, laquelle relève de la compétence de l'ordonnateur de l'Agence.
Art. 48 —  (1) Le Contrôleur Financier Spécialisé présente au Conseil d'Administration le rapport sur l'exécution du budget de l'Agence.
(2) Le rapport visé à l'alinéa 1 ci-dessus est transmis au Ministre chargé des finances, avec copie au Ministre de tutelle technique et au Directeur Général de l'Agence.
Art. 49 —  (1) L'Agent Comptable présente au Conseil d'Administration le compte de gestion de l'Agence.
(2) Le compte de gestion visé à l'alinéa 1 ci-dessus est transmis au Ministre chargé des finances, au Ministre de tutelle technique et au Directeur Général.
Art. 50 —  (1) Le Directeur Général établit à la fin de chaque exercice budgétaire tous les états relatifs à la situation de tous les comptes bancaires, des comptes de dépôt et de portefeuille. Il établit également les inventaires ainsi que l'état des créances et des dettes.
(2) Le Directeur Général présente au Conseil d'Administration et, selon le cas, au Ministre chargé des finances et au Ministre chargé de l'électricité, les comptes administratifs et de gestion ainsi que les rapports annuels de performance dans les six (06) mois qui suivent la clôture de l'exercice.
CHAPITRE V
DE LA GESTION DU PATRIMOINE
Art. 51 —  (1) Le patrimoine de l'Agence est constitué par les biens meubles, immeubles et ceux affectés ou rétrocédés par l'Etat et les Collectivités Territoriales Décentralisées.
(2) Le régime d'affectation des biens du patrimoine de l'Agence visés à l'alinéa 1 ci-dessus est établi ainsi qu'il suit :
les biens du domaine public, du domaine national, ainsi que ceux du domaine privé de l'Etat, transférés en jouissance à l'Agence conformément à la législation domaniale, conservent leur statut d'origine ;
les biens du domaine privé de l'Etat transférés en propriété à l'Agence, sont intégrés de façon définitive dans son patrimoine ;
les biens rétrocédés par les collectivités territoriales décentralisées transférés en propriété à l'Agence sont intégrés de façon définitive dans son patrimoine ;
les ouvrages de production, de distribution et de raccordement d'électricité en milieu rural construits par l'Agence ou rétrocédés par l'Etat, sont intégrés dans son patrimoine ;
les ouvrages issus de certains financements et transférés à l'Agence en propriété son intégrés de façon définitive dans son patrimoine ;
les biens faisant partie du domaine privé de l'Agence sont gérés conformément au droit commun.
Art. 52 —  (1) Sous le contrôle du Conseil d'Administration, la gestion du patrimoine de l'Agence relève de l'autorité du Directeur Général.
(2) La gestion du patrimoine visée à l'alinéa 1 ci-dessus, concerne l'acquisition des biens et leur aliénation.
Art. 53 —  (1) En cas d'aliénation d'un bien de l'Agence, le Directeur Général requiert l'autorisation préalable du Conseil d'Administration. Il tient à jour au Conseil d'Administration, la situation du patrimoine qui fait l'objet d'un examen à l'occasion d'une de ses sessions.
(2) L'autorisation du Conseil d'Administration se fait au moyen d'une résolution adoptée par au moins les deux tiers (2/3) de ses membres.
CHAPITRE VI
DES MARCHES PUBLICS
Art. 54 —  (1) L'Agence est assujettie aux dispositions du Code des marchés publics.
(2) Le Directeur Général est l'autorité contractante de tous les marchés publics de l'Agence.
(3) La Commission des marchés créée auprès de l'Agence s'assure des règles de transparence, de concurrence et de juste prix.
CHAPITRE VII
DISPOSITIONS DIVERSES ET FINALES
Art. 55 —  (1) Nonobstant les dispositions du présent décret, en cas de crise grave susceptible de mettre en péril les missions d'intérêt général, l'objet social ou les objectifs sectoriels du Gouvernement, un Administrateur Provisoire peut être désigné par décret du Président de la République, en lieu et place des organes dirigeants de l'Agence.
(2) L'acte portant nomination de l'Administrateur Provisoire précise ses attributions et la durée de son mandat, laquelle, en tout état de cause ne saurait excéder un (01) mois.
(3) Au terme de son mandat, l'Administrateur Provisoire est tenu de produire un rapport d'activités présentant tous ses actes de gestion.
Art. 56 —  Sont abrogées toutes les dispositions antérieures contraires, notamment le décret n°2013/204 du 28 juin 2013 portant organisation et fonctionnement de l'Agence de l'Electrification Rurale.
Art. 57 —  -Le présent décret sera enregistré et publié suivant la procédure d'urgence, puis inséré au Journal Officiel en français et en anglais. /-",DECRET_N°2022_110_DU_04_MARS_2022_PORTANT_REORGANISATION_ET_FONCTIONNEMENT_DE_L'AGENCE_DE_L'ELECTRIFICATION_RURALE_(AER).
