URL,text,page_title
https://www.juriafrica.com/lex/decret-97-116-7-juil-1997-16735.htm,"LE PRESIDENT DE LA REPUBLIQUE,
Vu la Constitution ;
Vu la Loi N° 96/14 du 05 août 1996 portant régime de Transport par pipeline des hydrocarbures en Provenance des pays tiers ;
DECRETE :
Art. 1 —  La construction, y compris les activités de conception se réalisant au Cameroun, l'exploitation et l'entretien des pipelines destinés au transport des hydrocarbures, liquides ou gazeux en provenance des pays tiers et évacués à travers le territoire Camerounais, ainsi que le transport des hydrocarbures au moyen de ces pipelines et les activités, travaux et industries y relatifs, sont soumis aux dispositions du présent décret.
TITRE I
GENERALITES
Art. 2 —  Les travaux relatifs à la construction, à l'exploitation et à l'entretien d'un Système de Transport par Pipeline sont déclarés d'utilité publique. Par des contrôles réguliers et périodiques, l'Etat s'assure de leur conformité aux règles de l'art, aux dispositions de la législation en la matière et à celles de la Convention d'Etablissement applicable.
Toutefois, l'activité de transport par pipeline des hydrocarbures liquides ou gazeux ne constitue pas un service public, quelle que soit la provenance de ces hydrocarbures et la forme ou le statut de la société propriétaire et exploitant du Système de Transport par Pipeline.
Art. 3 —  1. Il est créé un Comité de Pilotage et de Suivi des Pipelines, qui assure, comme indiqué à l'article 56 du présent décret, la coordination des interventions des administrations dans le cadre des travaux de construction, d'exploitation et d'entretien du Système de Transport par Pipeline. A ce titre, le Comité de Pilotage et de Suivi des Pipelines est le facilitateur des relations entre le postulant puis le Titulaire de l'Autorisation de Transport par Pipeline et lesdites administrations.
2. De même, il est créé un Service d'Inspection des Pipelines, placé sous la responsabilité du Ministre chargé des mines et qui assure, comme indiqué à l'article 56 du présent décret, la surveillance administrative et le contrôle technique de l'Administration se rapportant aux travaux de construction, d'exploitation et d'entretien du Système de Transport par Pipeline.
3. Des textes particuliers fixent l'organisation et le fonctionnement des organismes d'intervention visés aux alinéas 1 et 2 du présent article.
Art. 4 —  Les dispositions du présent décret portant sur les normes techniques et de sécurité ne s'appliquent pas, à la construction, à l'exploitation et à l'entretien des Systèmes de Transport par Pipeline conçus pour le transport des hydrocarbures gazeux, qui font l'objet d'un texte particulier.
TITRE II
DES ACTIVITES DE CONCEPTION
Art. 5 —  Tout investisseur potentiel qui juge utile de réaliser sur le territoire Camerounais des activités et travaux concourant à la réalisation des études préliminaires en vue de la conception et de la construction d'un Système de Transport par Pipeline, peut être autorisé par Arrêté du Ministre chargé des mines et après avis des Ministres chargés des domaines et de l'aménagement du territoire, à mener ces activités et travaux, conformément à la réglementation en vigueur en la matière. L'autorisation à mener des études préliminaires ne constitue pas une condition à la demande et à l'obtention de l'Autorisation de Transport par Pipeline.
Art. 6 —  La demande d'autorisation est établie en trois exemplaires, dont l'original est timbré au tarif en vigueur, puis adressé au Ministre chargé des mines, accompagné des pièces suivantes :
un exemplaire des statuts de l'investisseur potentiel ;
un résumé de son activité antérieure dans les études de conception d'un Système de Transport par Pipeline ou d'ouvrages similaires ;
une carte indiquant les limites du ou des couloir(s) dans lequel les activités et travaux seront menés ;
la nature et la programmation des activités à mener, la description des travaux qu'exigent ces activités ;
un engagement sur l'honneur à remettre les relevés de mesure effectués par un géomètre-expert et les résultats des études aux Administrations et Organismes qui lui seront désignés dans l'acte d'autorisation.
Art. 7 —  L'autorisation est accordée pour une durée n'excédant pas douze (12) mois, renouvelable par périodes de six (06) mois sans excéder trois (03) renouvellements.
L'arrêté accordant l'autorisation mentionne :
la durée de sa validité ;
la nature des activités et travaux autorisés ; et
les limites du ou des couloir(s) ouvert(s) à ces activités et travaux.
Art. 8 —  Le titulaire d'une autorisation à mener des activités et travaux concourant à la réalisation des études préliminaires en vue de la conception et de la construction d'un Système de Transport par Pipeline :
bénéficie pour ses démarches administratives, de la dispense des formalités visant à justifier les raisons de sa présence et de la non objection du Ministre chargé des mines auprès des administrations ou autorités chargées de l'application des réglementations concernées par ces activités et travaux ;
a droit, dans le couloir défini n'incluant pas les terrains Militaires et toutes autres zones jugées stratégiques ou protégées, à l'accès aux Domaine National et Domaine Privé de l'Etat et des autres collectivités publiques, au passage dans les propriétés privées des particuliers non bâties et non fermées par un mur, une haie, ou tout autre obstacle matérialisant les limites d'une propriété et au défrichement du minimum de végétation nécessaire, pour mener les activités et travaux autorisés. Toutefois, toute destruction d'une mise en valeur donne lieu à indemnisation de la victime par le titulaire ;
doit signaler sa présence ainsi que la durée probable de son séjour au chef de l'unité administrative territorialement compétent, et adresser un rapport trimestriel d'activités au Ministre chargé des mines auquel sont annexés les résultats des travaux techniques réalisés, notamment les relevés, les prises de vues, les résultats d'analyse des échantillons ;
mène ses activités en relation étroite avec le Comité de Pilotage et de Suivi des Pipelines qui, pour la réalisation de celles-ci, coordonne et supervise les actions des Administrations, Organismes et Sociétés publics ;
prend les dispositions nécessaires pour éviter que ses activités et travaux ne portent préjudice à la propriété d'autrui.
Art. 9 —  L'autorisation peut être retirée avant son terme par le Ministre chargé des mines, sans dédommagement de la part de l'Etat pour :
non respect des obligations du bénéficiaire ;
atteinte à la sécurité publique ;
exécution d'activités ou de travaux non autorisés, ou en violation de la législation en vigueur en la matière.
TITRE III
DE L'AUTORISATION DE TRANSPORT PAR PIPELINE
CHAPITRE 1
DE L'ATTRIBUTION DE L'AUTORISATION DE TRANSPORT PAR PIPELINE (ATP)
Art. 10 —  La construction, l'exploitation et l'entretien d'un Système de Transport par Pipeline, y compris le transport des hydrocarbures au moyen de ce pipeline, ne peuvent être entrepris que par une société de droit Camerounais ayant conclu une Convention d'Etablissement, et qu'en vertu d'une Autorisation de Transport par Pipeline accordée par décret.
Art. 11 —  1Une société de droit Camerounais ayant négocié les termes d'une Convention d'Etablissement et qui sollicite une Autorisation de Transport par Pipeline doit adresser au Ministre chargé des mines, un dossier en trois (03) exemplaires, dont un (01) original et deux (02) copies, comprenant trois (03) parties constituées des pièces suivantes :
(1.1). PARTIE 1-PRESENTATION GENERALE :
une demande d'Autorisation de Transport par Pipeline timbrée au tarif en vigueur. Elle mentionne outre l'objet de l'opération à entreprendre, la raison-sociale, les noms, prénoms et nationalité du Directeur Général ou des gérants, des actionnaires ou des associés de la société ;
un exemplaire des statuts ainsi que du procès-verbal de l'Assemblée Générale Constitutive de la société ;
le dernier bilan ou le cas échéant le bilan d'ouverture de ladite société ;
un résumé de l'activité antérieure de la société en matière de construction, d'exploitation et d'entretien des systèmes de transport, ou un document établissant que la société a accès à l'expertise technique et aux capacités financières nécessaires pour mener à bien les activités relatives à la construction, à l'exploitation et à l'entretien d'un Système de Transport par Pipeline ;
une certification des réserves d'hydrocarbures des champs à l'origine de la construction du Système de Transport par Pipeline et qui seront transportés par ledit système, établie par un organisme indépendant dont le choix a été approuvé par l'Etat ;
une copie de l'accord de transport des hydrocarbures visés au paragraphe e) ci-dessus ;
un résumé sur les investissements prévus pour la construction du Système de Transport par Pipeline ainsi que sur le mode prévu pour leur financement ;
une quittance attestant du versement au Trésor Public des droits fixes visés à l'article 64 du présent décret, ou, le cas échéant une preuve de l'exonération du paiement desdits droits ;
un engagement de paiement ou de remboursement des frais d'enquête publique dûment justifiés, d'instruction et de publication relatifs à l'examen de son dossier par l'Administration. Avant d'être payés, ces frais doivent faire l'objet d'une estimation arrêtée d'accord parties ;
un engagement à rembourser, en cas d'abandon du projet avant le début de l'exploitation, les dépenses dûment justifiées encourues par l'Etat et les sommes dues à l'Etat, en relation avec la demande d'Autorisation de Transport par Pipeline et la construction du Système de Transport par Pipeline selon les conditions et modalités de la Convention d'Etablissement, à l'exception des dépenses déjà couvertes en vertu des paragraphes h) et i) ci-dessus ;
les prévisions d'investissement, de dépenses et de recettes pour la durée de validité de la Convention d'Etablissement.
(1.2). PARTIE 2 :-ASPECTS FONCIERS :
un engagement à supporter en cas d'abandon du projet, la remise en état des lieux conformément à l'article 19 de la Loi N° 96/14 du 05 août 1996 ;
une série de plans du Système de Transport par Pipeline, à une échelle au moins égale à 1/10 000è, permettant de situer spatialement l'emprise foncière sollicitée, y compris : * le tracé prévu du pipeline :
les emplacements prévus pour les installations annexes ;
les emplacements où l'ouvrage est prévu franchir des points de repère importants notamment les routes, rivières, voies ferrées, villages et villes.
les coordonnées de l'emprise foncière sollicitée, rattachées à l'un des systèmes de coordonnées en vigueur au Cameroun accompagnées des équations de conversion entre les systèmes utilisés ;
un dossier comprenant les pièces suivantes à joindre à la demande de déclaration d'utilité publique visée à l'article 14 alinéas 1 du présent décret :
une description et un devis sommaires des études, activités et travaux projetés ;
une note précisant les dispositions, y compris contractuelles le cas échéant, prévues pour la libération des terrains et l'indemnisation des victimes éventuelles des expropriations, et notamment des indications sur la disponibilité des fonds pour le paiement de ces indemnités ;
les plans visés au paragraphe 1.2.b) ci-dessus.
la liste des départements à traverser par le Système de Transport par Pipeline.
(1.3). PARTIE 3 : -ASPECTS TECHNIQUES :
Les plans d'ensemble de l'ouvrage, à une échelle de 1/25 000è, faisant apparaître :
les emplacements de l'ouvrage susceptibles d'être classés en 1ère catégorie conformément aux critères définis par l'Arrêté visé à l'article 41 alinéas 2 du présent décret ;
les limites où le pipeline doit traverser les périmètres de protection visés à l'article 27.a) de la Loi N° 96/14 du 05 août 1996 dont le postulant a connaissance ;
les limites des périmètres de protection sollicités pour la construction en vertu de l'article 27.c) de la Loi N° 96/14 du 05 août 1996.
Les plans et les coupes des ouvrages principaux (stations de pompage, stations de décompression, installations de stockage permanent, systèmes de Télécommunication, centrales électriques) à une échelle comprise entre 1/50è et 1/1000è ;
Les plans, le cas échéant, des parties ou de la totalité des installations annexes qui répondent à la définition des établissements classés dangereux, insalubres ou incommodes du décret 76/372 du 02 Septembre 1976, à une échelle de 1/50è, accompagnés d'une note descriptive de ces installations, mentionnant les rubriques concernées par la nomenclature des établissements classés et la localisation desdites installations sur l'itinéraire du pipeline;
Le profil en long, la longueur totale du pipeline, les profils en travers types de l'ouvrage indiquant le ou les diamètres, et la pression d'exploitation maximale ;
une étude d'impact sur l'environnement conforme à la législation en vigueur prenant en compte les dispositions de l'article 43 du présent décret ;
une étude des dangers conforme à la Loi N° 96/12 du 05 Août 1996, et à ses textes d'application ;
une note sur le choix des tubes et accessoires ainsi que sur la nature et la localisation le long de la ligne des équipements et des aménagements (notamment les vannes de sectionnement en précisant celles qui sont télécommandées) nécessaires à la sécurité de l'ouvrage, à la protection de son environnement ou propre à atténuer les conséquences des incidents potentiels. Ladite note doit comporter également les renseignements sur l'assemblage et la protection des éléments du pipeline et le cas échéant, les dispositions spéciales prévues aux traversées des zones telles que définies par l'arrêté visé à l'article 41 alinéa 2 du présent décret ;
la capacité maximale basée sur le transport d'un fluide ayant les mêmes caractéristiques que l'eau à la pression d'exploitation maximale, en précisant le cas échéant, la capacité maximale résultant des différentes phases de réalisation s'il s'agit d'un Système de Transport par Pipeline réalisé en plusieurs phases ;
le programme d'occupation des terrains se rapportant aux travaux de construction ;
en général, les informations d'ensemble sur le matériel, l'équipement, et notamment sur les dispositifs et les installations prévus pour la sécurité et la protection de l'environnement ;
le plan des épreuves et des ré-épreuves hydrauliques conformément aux dispositions de l'arrêté prévu à l'article 41 alinéa 2 du présent Décret.
2- L'Autorisation de Transport par Pipeline ne peut être délivrée qu'après signature de la Convention d'Etablissement.
3- Dans le cas de modification de l'actionnariat par transfert ou cession d'actions avant l'octroi de l'Autorisation de Transport par Pipeline, notification en est faite au Ministre chargé des mines par le postulant, accompagnée de toutes les pièces du dossier de présentation générale ayant subi une modification.
Art. 12 —  1Dans un délai de quinze (15) jours après la réception d'un dossier de demande d'Autorisation de Transport par Pipeline, le Ministre chargé des mines notifie au postulant la recevabilité ou le rejet en la forme du dossier complet. En cas de silence du Ministre chargé des mines et passé ce délai, un dossier soumis dans le cadre de l'article 11 du présent décret est réputé reçu complet en la forme. Dans le cas d'une notification de rejet, le nouveau délai pour la notification de recevabilité ou de rejet est de dix (10) jours après la date de réception des nouvelles pièces.
2- Le Ministre chargé des mines fait instruire la demande comme indiqué aux articles 13 et 14 du présent décret, dans les meilleurs délais et dans tous les cas dans un délai maximum de huit (08) mois à compter du jour où la recevabilité en la forme du dossier complet, est notifiée ou réputée notifiée, et soumet à la signature le projet de décret octroyant l'Autorisation de Transport par Pipeline.
3- Un dossier complet relatif à l'Autorisation de Transport par Pipeline peut être rejeté par le Ministre chargé des mines pour :
fausses déclarations intentionnelles révélées par les enquêtes visées aux articles 13 et 14 du présent décret ;
refus du postulant de respecter les obligations des articles 13 et 14 du présent décret. Dans ce cas, le rejet ne sera prononcé qu'après une mise en demeure restée sans effet pendant quinze (15) jours après la réception de sa notification.
4- En cas de réaction du postulant à la mise en demeure visée à l'alinéa 3 ci-dessus, les délais visés aux articles 13.6 et 14.3 du présent décret sont prolongés d'une durée égale au temps qui se sera écoulé entre la date de notification de la mise en demeure et la date de la réaction à cette mise en demeure.
5- Une notification au Ministre chargé des mines d'un transfert ou d'une cession d'actions au profit des affiliées des actionnaires ou à titre de garantie pendant l'instruction de la demande d'Autorisation de Transport par Pipeline, ne rend pas le dossier non conforme ou incomplet, et ne donne lieu à aucune prolongation des délais.
Art. 13 —  1Dès la notification de la recevabilité en la forme du dossier visé à l'article 12 du présent décret, le Ministre chargé des mines adresse les deux copies du dossier complet au Comité de Pilotage et de Suivi des Pipelines. Le Ministre chargé des mines peut, dans le cadre de l'instruction du dossier, ordonner toute enquête sur l'identification, les capacités financières et techniques et l'expérience du ou des promoteurs ou du postulant. Il peut demander la production de tout renseignement complémentaire.
2- Dès la réception du dossier visée à l'alinéa 1 ci-dessus, le Comité de Pilotage et de Suivi des Pipelines provoque des concertations entre les Ministères et Organismes Publics intéressés aux fins d'apprécier le bien fondé du projet. Il invite aussi souvent que nécessaire le postulant à présenter ses observations et à faire de nouvelles propositions pour la réalisation de l'opération, dans le cas où des objections seraient formulées au cours de l'instruction. Il peut demander tout rectificatif motivé, prescrire une réévaluation des risques et des mesures préconisées à cet effet ou exiger tous renseignements complémentaires.
3- Le Comité de Pilotage et de Suivi des Pipelines transmet la pièce du dossier visée à l'article 11 alinéa 1.3 c) du présent décret au Ministre chargé des établissements classés dangereux, insalubres ou incommodes, qui fait procéder, conformément à la réglementation en vigueur, à l'enquête de commode et incommode pour celles des installations qui, au sens de la législation en vigueur, sont des établissements classés dangereux, insalubres ou incommodes. Le Ministre chargé desdits établissements classés dispose d'un délai maximum de trois (03) mois à compter de la réception du dossier pour transmettre au Comité de Pilotage et de Suivi des Pipelines son avis motivé sur l'implantation et l'exploitation des installations concernées. L'avis favorable du Ministre chargé des établissements classés vaut autorisation d'implantation et d'exploitation desdites installations pour la durée de l'Autorisation de Transport par Pipeline.
4- Le Comité de Pilotage et de Suivi des Pipelines transmet la pièce du dossier visée à l'article 11 alinéa 1.3 e) du présent décret au Ministre chargé de l'environnement, qui fait procéder à l'enquête publique s'y rapportant, conformément à la réglementation en vigueur. Le Ministre chargé de l'environnement dispose en outre d'un délai maximum de quatre (04) mois à compter de la réception du dossier pour transmettre au Comité de Pilotage et de Suivi des Pipelines son avis motivé concernant l'étude d'impact sur l'environnement
5- Le projet de tracé proposé par le postulant et contenu dans le dossier cité à l'article 11 du présent décret, fait l'objet, par le Comité de Pilotage et de Suivi des Pipelines, de toutes études et enquêtes préalables nécessaires, notamment en ce qui concerne les dispositions techniques envisagées par le postulant aux points spéciaux tels que la traversée du Domaine Public, des ouvrages d'intérêt général, des eaux, etc.. A cet effet, le Comité de Pilotage et de Suivi des Pipelines provoque les concertations des Administrations, Collectivités Publiques locales et Organismes Publics concernés et recueille toutes les remarques et observations présentées par ceux-ci, en considération des conditions énoncées dans le présent décret. Le Comité de Pilotage et de Suivi des Pipelines adresse ces remarques et observations au postulant pour prise en compte.
6- Pour la totalité de la procédure décrite au présent article, le Comité de Pilotage et de Suivi des Pipelines dispose d'un délai maximum de sept (07) mois à compter de la date de recevabilité visée à l'article 12 du présent décret, pour transmettre au Ministre chargé des mines le dossier du projet retenu assorti de son avis motivé.
Art. 14 —  1. Dans un délai de trente (30) jours suivant la réception du dossier; le Comité de Pilotage et de Suivi des Pipelines adresse au Ministre chargé des domaines une demande de déclaration d'utilité publique de l'opération projetée à laquelle est jointe la Partie 2 du dossier (Aspects Fonciers). A la réception de ce dossier, le Ministre chargé des domaines fait conduire et ouvrir en relation avec le Comité de Pilotage et de Suivi des Pipelines, conformément à la législation en vigueur et aux dispositions du présent décret, toutes études et enquêtes, et notamment l'enquête préalable à l'expropriation pour cause d'utilité publique, nécessaires à la constitution de l'emprise foncière à affecter au projet, ainsi que toutes procédures d'expropriation pour cause d'utilité publique, d'incorporation au Domaine Privé de l'Etat et d'affectation des terres ainsi incorporées à la construction, à l'exploitation et à l'entretien du Système de Transport par Pipeline concerné.
2. Pour la réalisation des opérations foncières relatives à la constitution de l'emprise foncière, le Comité de Pilotage et de Suivi des Pipelines coordonne et facilite les opérations, études et enquêtes relatives à l'expropriation et à la mise à disposition des terres. A cet effet, il provoque toutes concertations qu'il juge utiles avec les Administrations, Organismes publics ou Collectivités Publiques locales concernés.
A la demande du Comité de Pilotage et de Suivi des Pipelines, le postulant fournit, à ses frais, en un nombre suffisant d'exemplaires, les documents nécessaires à la constitution des dossiers en vue tant des enquêtes préalables et parcellaires que des concertations suscitées.
3. Le Ministre chargé des domaines dispose, pour la totalité de la procédure décrite au présent article, d'un délai maximum de cinq (05) mois à compter de la réception du dossier foncier, à la fin desquels il transmet au Comité de Pilotage et de Suivi des Pipelines les coordonnées retenues pour l'emprise foncière à affecter, ainsi que son avis motivé en ce qui concerne les expropriations et l'incorporation des terrains au Domaine Privé de l'Etat.
Art. 15 —  1. En application des dispositions de la Loi N°96/14 du 05 Août 1996, un Arrêté du Ministre chargé des domaines déclarant d'utilité publique les travaux relatifs à la construction, à l'exploitation et à l'entretien du Système de Transport par Pipeline est pris, conformément à la législation en vigueur, dès la réception du dossier foncier par ledit Ministre.
L'arrêté de déclaration d'utilité publique décrit les caractéristiques principales des travaux à réaliser à l'intérieur de l'emprise foncière sollicitée, désigne les terrains concernés par ces travaux et définit le niveau de compétence de la Commission de constat et d'évaluation.
L'arrêté de déclaration d'utilité publique fait l'objet d'une insertion au Journal Officiel de la République du Cameroun et d'un affichage aux Préfectures concernées, conformément à la législation foncière et domaniale en vigueur. Après la publication du décret octroyant l'Autorisation de Transport par Pipeline, un dossier comportant le tracé retenu de l'ouvrage et les plans parcellaires est déposé à chaque Préfecture, aux fins d'ouverture de l'enquête d'expropriation.
Toutefois, lorsque l'emprise foncière concerne un projet de plus de trois cents (300) kilomètres et que le processus lié à la constitution et à l'affectation de ladite emprise risque de retarder les travaux de construction du Système de Transport par Pipeline, et si le postulant en fait la demande lors de la soumission du dossier visé à l'article 11 du présent décret, l'affectation des terrains à la construction dudit système peut être faite après approbation séquentielle de l'emprise foncière sollicitée par département ou groupe de départements.
