URL,text,page_title,page_label,category,metadata
https://www.juriafrica.com/lex/decret-2018-109-07-fevrier-2018-24536.htm,"DÉCRET N° 2018/109 DU 07 FÉVRIER 2018 MODIFIANT ET COMPLÉTANT CERTAINES DISPOSITIONS DU DÉCRET N° 2017/485 DU 14 SEPTEMBRE 2017 HABILITANT LE MINISTRE DE L'ECONOMIE, DE LA PLANIFICATION ET DE L'AMÉNAGEMENT DU TERRITOIRE À SIGNER AVEC LA STANDARD CHARTERED BANK DE LONDRES, UNE CONVENTION DE CRÉDIT D'UN MONTANT DE 112 690 355 DOLLARS US, SOIT ENVIRON 62 552 697 155 FRANCS CFA, POUR LE FINANCEMENT DU PROJET DE RÉHABILITATION ET D'EXTENSION DU STADE DE LA RÉUNIFICATION À DOUALA, SON ANNEXE, AINSI QUE LES INFRASTRUCTURES CONNEXES, Y COMPRIS LES FRAIS FINANCIERS

Le président de la République,
Vu la Constitution ;
Vu la loi n° 2016/018 du 14 décembre 2016 portant loi de finances de la République du Cameroun pour l'exercice 2017 ;
Vu le décret n° 2011/408 du 9 décembre 2011 portant organisation du gouvernement,
Décrète :
Art. 1er —  Les dispositions de l'article 1er du décret n° 2017/485 du 14 septembre 2017 suscité sont modifiées et complétées ainsi qu'il suit :
« Au lieu de : Le ministre de l'Economie, de la Planification et de l'Aménagement du territoire est habilité, avec faculté de délégation, à signer avec la Standard Chartered Bank de Londres, une Convention de crédit d'un montant de 112 690 355 dollars US, soit environ 62 552 697 155 francs CFA, pour le financement du projet de réhabilitation et d'extension du Stade de la Réunification à Douala, son annexe, ainsi que les infrastructures connexes, y compris les frais financiers,
Lire : le ministre de l'Economie, de la Planification et de l'Aménagement du Territoire est habilité, avec faculté de délégation, à signer avec la Standard Chartered Bank de Londres et DeutshePfandbriefbank AG, une Convention de crédit d'un montant de 96 540 000 euros, soit environ 63 281 970 000 de francs CFA, pour le financement du projet de réhabilitation et d'extension du Stade de la Réunification à Douala, son annexe, ainsi que les infrastructures connexes, y compris les frais financiers ».
Art. 2 —  le présent décret sera enregistré, publié suivant la procédure d'urgence, puis inséré au Journal officiel en français et en anglais.",DECRET_N_2018_109_DU_07_FEVRIER_2018_MODIFIANT_ET_COMPLETANT_CERTAINES_DISPOSITIONS_DU_DECRET_N_2017_485_DU_14_SEPTEMBRE_2017_HABILITANT_LE_MINISTRE_DE_L_ECONOMIE_DE_LA_PLANIFICATION_ET_DE_L_AMENAGEMENT_DU_TERRITOIRE_A_SIGNER_AVEC_LA_STANDARD_CHARTERED_BANK_DE_LONDRES_UNE_CONVENTION_DE_CREDIT_D_UN_MONTANT_DE_112_690_355_DOLLARS_US_SOIT_ENVIRON_62_552_697_155_FRANCS_CFA_POUR_LE_FINANCEMENT_DU_PROJET_DE_REHABILITATION_ET_D_EXTENSION_DU_STADE_DE_LA_REUNIFICATION_A_DOUALA_SON_ANNEXE_AINSI_QUE_LES_INFRASTRUCTURES_CONNEXES_Y_COMPRIS_LES_FRAIS_FINANCIERS,0,decret,
