URL,text,page_title,page_label,metadata
https://www.juriafrica.com/lex/decret-83-410-29-aout-1983-16469.htm,"LE PRESIDENT DE LA REPUBLIQUE,
Vu la Constitution ;
Vu la loi n° 80/10 du 14 juillet 1980 portant réglementation de l'exercice de la profession de pharmacien ;
Vu la loi n° 80/11 du 14 juillet 1980 portant organisation de l'ordre des pharmaciens ;
DECRETE :
Art. 1er —  Le présent décret fixe les conditions de préparation, de détention, d'importation, d'exportation, de vente ou d'utilisation des radio-éléments artificiels.
CHAPITRE I
DE LA PREPARATION
Art. 2 —  Sont seuls habilités à se livrer à la préparation des radio-éléments artificiels : les radio-physiciens et pharmaciens dûment autorisés.
L'ouverture des établissements dans lesquels ces préparations sont effectuées est également soumise à autorisation.
Art. 3 —  Les autorisations visées à l'article 2 ci-dessus sont accordées par arrêté du Ministre de la Santé Publique, après avis d'une Commission composée ainsi qu'il suit :
Président : Le Ministre de la Santé Publique ou son représentant.
Membres : - Deux représentants du Ministre chargé des Mines et de l'Énergie ;
- Un médecin et un pharmacien militaire désigné par le Ministre chargé des Forces Armées ;
- Un représentant du Ministre chargé de l'Agriculture ;
- Un représentant du Ministre chargé de la Prévoyance Sociale ;
- Un représentant du Ministre chargé du Commerce ;
- Un représentant du Ministre chargé de l'Industrie ;
- Un représentant du Ministre chargé de la médecine vétérinaire ;
- Un représentant de la Délégation Générale à la Recherche Scientifique et Technique.
Art. 4 —  Pour obtenir les autorisations visées ci-dessus, les préparateurs et chefs d'établissements intéressés doivent adresser au Ministre chargé de la Santé Publique un dossier comprenant :
Pour les préparateurs :
une demande timbrée au tarif en vigueur ;
un extrait de casier judiciaire datant de moins de 3 mois ;
les pièces justificatives de leurs qualifications ;
des précisions sur la nature, la qualité et la quantité maximale des radio-éléments artificiels ainsi que l'objectif de la préparation.
Pour les établissements de préparation :
un plan de situation de l'établissement ;
une description des équipements ;
une description des mesures en vue de prévenir le vol, la perte, et toute utilisation non autorisée des substances ;
une description des mesures de sécurité dans la préparation, la détention et le transport des éléments.
Art. 5 —  Les préparateurs doivent, lorsqu'il s'agit de produits radiopharmaceutiques, s'assurer que :
Ceux injectables sont stérilisés et apyrogènes ;
Des précautions ont été prises pour éviter les interactions entre les éléments radio-actifs et les emballages ;
Les substances chimiques ou radio-actives utilisées pour préparer ces produits sont du plus haut niveau de pureté possible ;
L'eau et les autres excipients sont conformes aux normes de pureté vis à vis du PH, de la stérilité et de l'apyrogénéité ;
Les excipients utilisés pour améliorer ou sauvegarder la qualité du produit et la méthode de stérilisation adoptée sont de nature à maintenir l'action biologique de la préparation.
CHAPITRE II
DE LA DETENTION
Art. 6 —  Sont seules habilitées à détenir des radio-éléments artificiels les personnes dûment autorisées à préparer, à utiliser ou à importer ces substances.
Art. 7 —  Toute personne détentrice de radio-éléments artificiels doit en faire déclaration au Ministre chargé de la Santé Publique.
La déclaration est faite par lettre recommandée avec accusé de réception.
CHAPITRE III
DE L'IMPORTATION, DE L'EXPORTATION ET DE LA VENTE DES RADIO-ELEMENTS ARTIFICIELS
Art. 8 —  Sont seules habilitées à importer des radio-éléments artificiels les personnes autorisées à préparer et à utiliser ces substances, et les établissements pharmaceutiques.
Art. 9 —  Sont seules habilitées à exporter et à vendre les radio-éléments artificiels les personnes autorisées à préparer lesdits éléments, ainsi que les établissements pharmaceutiques.
Art. 10 —  Elles doivent déclarer leurs stocks au Ministre chargé de la Santé Publique en précisant le lieu d'implantation de ces stocks, par lettre recommandée avec accusé de réception.
Art. 11 —  La publicité relative à l'emploi de radio-éléments artificiels et de produits en contenant dans la médecine humaine ou vétérinaire n'est, sauf dérogation accordée par le Ministre chargé de la Santé Publique, autorisée qu'auprès des médecins, des pharmaciens, des vétérinaires ou des chirurgiens-dentistes.
Art. 12 —  Le visa de mise sur le marché des spécialités pharmaceutiques contenant des radio-éléments artificiels ne peut être donné que sous le nom commun ou la dénomination scientifique des radio-éléments artificiels entrant dans la composition desdites spécialités.
CHAPITRE IV
DE L'UTILISATION DES RADIO-ELEMENTS ARTIFICIELS
Art. 13 —  L'utilisation des radio-éléments artificiels à quelque fin que ce soit est soumise à l'autorisation du Ministre chargé de la Santé Publique après avis de la Commission visée à l'article 3 ci-dessus.
Toutefois, sont dispensés de cette autorisation les pharmaciens ainsi que les personnes ci-après ayant une spécialité en matière de substances radioactives :
les médecins ;
les chirurgiens-dentistes ;
les médecins vétérinaires ;
les ingénieurs agronomes ;
les radio-chimistes et les radio-physiciens.
Art. 14 —  L'utilisation des radiations ionisantes sur le corps humain ne peut être effectuée que par les médecins ou sous leur responsabilité et leur surveillance directes.
Art. 15 —  Pour obtenir l'autorisation visée à l'article 13 ci-dessus, les personnes intéressées doivent adresser au Ministre en charge de la Santé Publique un dossier comprenant :
une demande timbrée au tarif en vigueur, précisant la quantité, la nature des radio-éléments artificiels et les fins auxquelles ils sont destinés ;
les références relatives à la qualification des utilisateurs de ces substances ;
des précisions sur la méthode d'élimination des déchets radio-actifs envisagés.
Art. 16 —  Est interdite toute addition de radio-éléments artificiels et de produits en contenant aux aliments, produits hygiéniques ou de beauté.
CHAPITRE V
MESURES DE SECURITE
Art. 17 —  Les radio-éléments artificiels exposés au public dans un emballage, une enceinte ou une pièce doivent être signalés par la mention : "" RADIATION DANGER RAYONNEMENT "", portée sur l'emballage ou sur un panneau avertisseur, et suivie des indications sur la nature, la forme, la quantité des radio-éléments, et la date à laquelle ils ont été mesurés.
Art. 18 —  Les personnes qui détiennent ou utilisent ses radio-éléments artificiels à quelque fin que ce soit doivent observer les consignes suivantes :
prendre toutes les mesures nécessaires en vue de protéger les personnes et les biens contre les rayonnements ionisants, les blessures et les dommages ;
fournir les dispositifs de détection et de mesure des rayonnements ionisants ;
prendre les mesures nécessaires pour empêcher les fuites de matières radio-actives des locaux ;
dans le cas d'une telle fuite, prévenir toute personne pour qui elle constituerait un risque ou un danger ;
en cas d'accident, prévenir dans les 24 heures un Inspecteur de la pharmacie par un rapport circonstancié.
Art. 19 —  Il est interdit d'abandonner un radio-élément artificiel, de le jeter ou de le céder à une personne non habilitée à l'utiliser.
L'élimination des déchets radio-actifs ne peut s'effectuer que sous la surveillance d'un agent désigné par le Ministre chargé de la Santé Publique.
Les contenants et les espaces d'entreposage des déchets radio-actifs doivent porter les symboles de mise en garde contre les rayonnements, la date et la quantité des déchets.
Les déchets radio-actifs doivent être entreposés dans un endroit blindé, sous clé.
Art. 20 —  Les personnes exposées de par leur activité aux rayonnements ionisants doivent subir des contrôles tous les 3 mois en vue de s'assurer qu'elles n'ont pas absorbé des radiations supérieures aux doses maximales admissibles fixées à l'annexe du présent décret.
Ces doses ne peuvent être dépassées que sur autorisation du Ministre chargé de la Santé Publique.
CHAPITRE VI
CONTROLE ADMINISTRATIF ET SANCTIONS
Art. 21 —  La préparation, la détention, l'importation, l'exportation, la vente et l'utilisation des radio-éléments artificiels sont soumises au contrôle des services compétents du Ministre chargé de la Santé Publique.
Ce contrôle est assuré par les Inspecteurs de la pharmacie conformément aux dispositions des articles 14 et suivants de la loi n° 80/10 du 14 juillet 1980 portant réglementation de l'exercice de la profession de pharmacien, et par tous autres fonctionnaires assermentés désignés par le Ministre chargé de la Santé Publique.
Art. 22 —  Les particuliers et les chefs des établissements inspectés sont tenus de recevoir les inspecteurs, de leur faciliter la visite des lieux et de leur fournir tous documents nécessaires.
Art. 23 —  En cas d'infraction aux dispositions du présent décret, les fonctionnaires chargés du contrôle en dressent procès-verbaux qui sont transmis au Ministre chargé de la Santé Publique.
Dès réception des procès-verbaux, le Ministre chargé de la Santé Publique peut, soit prononcer des sanctions administratives, soit en saisir le Procureur de la République du ressort pour les poursuites pénales, soit en transmettre des copies au Conseil de l'Ordre des pharmaciens pour des poursuites disciplinaires éventuelles.
Art. 24 —  Outre les sanctions pénales prévues par la loi ou disciplinaires éventuelles, les infractions dûment constatées peuvent donner lieu soit à la suspension ou au retrait de l'autorisation, soit à la fermeture temporaire ou définitive de l'établissement.
Ces sanctions sont prononcées par arrêté du Ministre chargé de la Santé Publique.
CHAPITRE VII
MESURES DIVERSES ET TRANSITOIRES
Art. 25 —  Les autorisations prévues par le présent décret sont personnelles et incessibles.
Compte tenu de la nature des activités envisagées, le Ministre chargé de la Santé Publique peut en limiter la durée.
Art. 26 —  Les personnes exerçant actuellement les activités réglementées par le présent décret disposent d'un délai de six mois à compter de la date de sa publication pour se mettre en règle conformément aux nouvelles dispositions.
Art. 27 —  Des arrêtés du Ministre chargé de la Santé Publique préciseront en tant que de besoin les modalités d'application du présent décret, qui sera enregistré, puis publié au Journal Officiel en français et en anglais.",DECRET_N_83_410_DU_29_AOUT_1983_FIXANT_LES_CONDITIONS_DE_PREPARATION_DE_DETENTION_D_IMPORTATION_D_EXPORTATION_DE_VENTE_OU_D_INSTALLATION_DES_RADIO_ELEMENTS_ARTIFICIELS,0,
