URL,text,page_title,page_label,metadata
https://www.juriafrica.com/lex/decret-2002-039-04-fev-2002-16950.htm,"LE PRESIDENT DELA REPUBLIQUE,
VU la Constitution
VU la loi n° 99/016 du 22 décembre 1999 portant statut général des établissements publics et des entreprises du secteur public et parapublic
VU le décret n° 97/205 du 7 décembre 1997 portant organisation du Gouvernement, modifié et complété par le décret n° 98/067 du 28 avril 1998 ;
DECRETE:
CHAPITRE I
DISPOSITIONS GENERALES
Art. 1er —  Le présent décret porte changement de dénomination et réorganisation de la Mission d'Etudes pour l'Aménagement de la Vallée Supérieure de la Bénoué.
Art. 2 —  La Mission d'Etudes pour l'Aménagement de la Vallée Supérieure de la Bénoué prend, à compter de la date de signature du présent décret, la dénomination de Mission d'Etudes pour l'Aménagement et le Développement de la Province du Nord, en abrégé “ MEADEN ”.
(2) Son siège est fixé à Garoua.
(3) Des antennes peuvent, en tant que de besoin, être créées dans d'autres localités de la province du Nord, sur délibération du Conseil d'Administration.
Art. 4 —  La MEADEN est placée sous la tutelle technique du Ministère chargé de l'aménagement du territoire et sous la tutelle financière du Ministère chargé des finances.
Art. 5 —  (1) La MEADEN a pour objet le développement harmonieux de la province du Nord. A ce titre, elle est chargée :
de l'établissement du schéma d'aménagement régional et de ses volets sectoriels ;
du suivi de l'application effective de ce schéma ainsi que de son actualisation permanente de concert avec les différents partenaires du développement;
de la mise en place de la documentation nécessaire à la constitution de la banque de données et d'un système d'information géographique de base concernant l'ensemble de la province du Nord ;
de l'identification, de la définition et de l'étude générale des projets de développement dans la province du Nord et de la mise en cohérence avec le schéma d'aménagement régional de tout autre projet étudié par ailleurs ;
de la planification, de la programmation et du suivi évaluation de ces projets ;
de l'élaboration et de la mise en œuvre d'un cadre de coordination des interventions et initiatives de développement dans l'ensemble de la province du Nord ;
du suivi de la gestion du patrimoine issu des infrastructures d'aménagement dans les domaines agro-pastoral, piscicole et environnemental ;
de la supervision de l'utilisation des terroirs ;
de l'appui au développement du monde rural par la promotion et la mise en valeur des terres disponibles, en accord avec le schéma directeur d'aménagement provincial.
(2) Dans le cadre de l'accomplissement des missions citées à l'alinéa (1) ci-dessus, la MEADEN reçoit communication de tous rapports et de tous documents à caractère économique publiés par les services publics et parapublics ainsi que par les entreprises opérant dans la province du Nord.
Art. 6 —  Le patrimoine de la MEADEN est constitué des biens meubles et immeubles antérieurement affectés à la Mission d'Etudes pour l'Aménagement de la Vallée Supérieure de la Bénoué ainsi que ceux des anciens projets dont elle a été le maître d'œuvre.
Art. 7 —  (1) Les biens du domaine public et du domaine national ainsi que les biens du domaine privé de l'Etat, transférés en jouissance à la MEADEN conformément à la législation domaniale, conservent leur statut d'origine.
(2) Les biens du domaine privé de l'Etat transférés en propriété à la MEADEN, sont intégrés de façon définitive dans son patrimoine.
(3) Les biens faisant partie du domaine privé de la MEADEN sont gérés conformément au droit commun.
CHAPITRE II
DE L'ORGANISATION ET DU FONCTIONNEMENT
Art. 8 —  La MEADEN est administrée par deux organes :
le Conseil d'Administration ;
la Direction Générale.
SECTION I
DU CONSEIL D'ADMINISTRATION
Art. 9 —  (1) Le Conseil d'Administration comprend douze (12) membres. Il est composé ainsi qu'il suit :
Président: une personnalité nommée par décret du Président de la République. Membres:
un représentant du Ministre chargé de l'aménagement du territoire;
un représentant du Ministre chargé des finances ;
un représentant du Ministre chargé de l'agriculture ;
un représentant du Ministre chargé de l'élevage, des pêches et des industries animales ;
un représentant du Ministre chargé de l'environnement;
un représentant des collectivités territoriales décentralisées de la province ;
un représentant des services du Gouverneur;
un représentant des autorités traditionnelles de la province
un représentant des groupements d'agriculteurs;
un représentant des groupements d'éleveurs;
un représentant du personnel.
(2) Les membres du Conseil d'Administration sont nommés par décret du Président de la République, sur proposition des administrations et des organismes socio-professionnels auxquels ils appartiennent, à la diligence du Ministre chargé de l'aménagement du territoire.
Art. 10 —  (1) Le Président et les membres du Conseil d'Administration sont nommés pour un mandat de trois (3) ans renouvelable une (1) fois.
(2) Le mandat d'administrateur prend fin à l'expiration normale de sa durée, par décès ou par démission. Il prend également fin à la suite de la perte de la qualité qui avait motivé la nomination ou encore par révocation à la suite d'une faute grave ou des agissements incompatibles avec la fonction de membre du Conseil d'Administration.
(3) En cas de décès en cours de mandat ou dans toutes les hypothèses où un membre du Conseil d'Administration n'est plus en mesure d'exercer son mandat, il est procédé à son remplacement selon les mêmes modalités et formes que celles qui ont présidé à sa nomination pour la période du mandat restant à courir.
Art. 11 —  (1) Le président et les membres du Conseil d'Administration sont soumis aux mesures restrictives et incompatibilités prévues par la législation en vigueur.
(2) Le président et les membres du Conseil d'Administration ainsi que toute autre personne appelée à assister aux réunions du Conseil d'Administration, sont astreints à l'obligation de discrétion pour les informations, faits et actes dont ils ont connaissance dans l'exercice de leurs fonctions.
(3) En dehors des conventions de travail entre la MEADEN et le représentant du personnel désigné comme administrateur, toute convention entre l'établissement et l'un de ses administrateurs soit directement, soit par personne interposée doit être soumise à l'approbation préalable du Conseil d'Administration.
Il en est de même pour les conventions entre la MEADEN et une autre entreprise si l'un de ses administrateurs est propriétaire, associé en nom, gérant, administrateur ou directeur.
L'administrateur se trouvant dans l'un de ces cas est tenu d'en faire la déclaration au Conseil d'Administration qui doit se prononcer.
Les dispositions qui précèdent ne sont pas applicables aux conventions normales sur les opérations habituelles de la MEADEN avec les tiers.
Art. 12 —  (1) La fonction de membre du Conseil d'Administration est gratuite. Toutefois, les administrateurs peuvent bénéficier d'indemnités de session et prétendre au remboursement des dépenses occasionnées par les sessions, sur présentation des pièces justificatives.
(2) Le président du Conseil d'Administration bénéfice d'une allocation mensuelle.
(3) Le taux de l'indemnité de session ainsi que l'allocation mensuelle du président visés aux alinéas (1) et (2) ci-dessus sont fixés par le Conseil d'Administration, dans les limites des plafonds prévus par la réglementation en vigueur.
Art. 13 —  (1) Le Conseil d'Administration dispose des pouvoirs les plus étendus pour agir au nom de la MEADEN, définir et orienter sa politique générale et évaluer sa gestion dans les limites fixées par son objet social.
(2) En particulier, et sans que cette énumération soit limitative, le Conseil d'Administration a le pouvoir:
de fixer les objectifs et d'approuver les programmes d'action conformément aux objectifs globaux de la MEADEN ;
d'adopter sur proposition du Directeur Général l'organigramme, le règlement intérieur, le barème des salaires et les avantages du personnel ;
d'adopter le budget de la MEADEN et d'arrêter de manière définitive les comptes et états financiers annuels ;
de nommer, sur proposition du Directeur Général, aux postes de responsabilités à partir du rang de Directeur adjoint et assimilé;
de recruter et de licencier le personnel d'encadrement sur proposition du Directeur Général ;
d'accepter tous dons, legs et subventions ;
d'approuver les contrats de performances ou toutes autres conventions y compris les emprunts préparés par le Directeur Général et ayant une incidence sur le budget ;
d'autoriser les participations dans les associations, groupements ou autres organismes professionnels dont l'activité est nécessairement liée aux missions de la MEADEN
de nommer et de démettre de leurs fonctions sur proposition du Directeur Général, les représentants de la MEADEN aux assemblées générales et aux conseils d'administration d'autres entreprises ;
d'autoriser toute aliénation de biens meubles ou immeubles, corporels ou incorporels conformément à la législation en vigueur et après approbation du Ministre chargé des finances et du Ministre chargé de la tutelle technique, sous réserve de la législation en matière de privatisation.
(3) Le Conseil d'Administration peut déléguer tout ou partie de ses pouvoirs au Directeur Général, à l'exception de ceux énumérés ci-dessus.
Le Directeur Général rend compte, en tant que de besoin, de l'utilisation de cette délégation.
Art. 14 —  (1) Le président du Conseil d'Administration convoque et préside les réunions du Conseil. Il veille à l'application de ses résolutions.
(2) Le président du Conseil d'Administration peut inviter toute personne en raison de ses compétences sur une question inscrite à l'ordre du jour de la session, à prendre part aux travaux du Conseil avec voix consultative.
Art. 15 —  Le Secrétariat du Conseil d'Administration est assuré par le Directeur Général de la MEADEN.
Art. 16 —  (1) Le Conseil d'Administration se réunit en session ordinaire au moins deux (2) fois par an sur convocation de son Président, dont une fois pour le vote du budget et une fois pour arrêter les états financiers annuels et examiner la marche de l'Etablissement.
Il examine toute question' inscrite à l'ordre du jour soit par le président, soit à la demande de deux tiers (2/3) de ses membres.
(2) Toutefois, à l'initiative du Président ou à la demande d'un tiers (1(3) au moins des membres du Conseil d'Administration, celui-ci se réunit en session extraordinaire. En cas de refus ou de silence du Président dûment constaté, les membres concernés adressent une nouvelle demande au Ministre chargé des finances, qui procède à la convocation du Conseil d'Administration selon les mêmes règles de forme et de délai,
(3) Le président du Conseil d'Administration est défaillant lorsqu'il ne convoque pas au moins deux (2) séances du Conseil par an. Dans ce cas, le tiers (1/3) au moins de ses membres ou le Ministre chargé des finances peut prendre l'initiative de convoquer le Conseil d'Administration sur un ordre du jour déterminé.
Art. 17 —  (1) Les convocations sont faites par télex, télégramme, télécopie ou par tout autre moyen laissant traces écrites, et adressées aux membres quinze (15) jours au moins avant la date prévue pour la réunion. Les convocations indiquent la date, l'ordre du jour et le lieu de la réunion.
(2) Tout membre présent ou représenté à une séance du Conseil d'Administration est considéré comme ayant été dûment convoqué.
Art. 18 —  (1) Tout membre du Conseil d'Administration empêché peut se faire représenter aux réunions par un autre membre. Toutefois, aucun administrateur ne peut au cours d'une même session, représenter plus d'un administrateur.
(2) En cas d'empêchement du Président, le Conseil élit en son sein un président de séance à la majorité simple des membres présents ou représentés.
Art. 19 —  (1) L e Conseil d'Administration ne délibère valablement sur toute question inscrite à son ordre du jour que si les deux tiers (2/3) au moins de ses membres sont présent ou représentés. Si le quorum n'est pas atteint lors de la première convocation il est, pour la convocation suivante, ramené à la moitié des membres présents.
(2) Chaque membre dispose d'une voix.
(3) Les décisions du Conseil d'Administration sont prises à la majorité simple des voix des membres présents ou représentés. En cas d'égalité de voix, celle du président est prépondérante.
(4) Les délibérations du Conseil d'Administration font l'objet d'un procès-verbal signé parie président du Conseil ou de séance et le secrétaire. Le procès-verbal mentionne en outre le nom des membres présents ou représentés, ainsi que ceux des personnes invitées à titre consultatif. Il est lu et approuvé par le Conseil d'Administration lors de la session suivante.
(5) Les procès-verbaux des séances sont consignés dans un registre spécial tenu au siège de la MEADEN.
SECTION Il
DE LA DIRECTION GENERALE
Art. 20 —  (1) La Direction Générale de la MEADEN est placée sous l'autorité d'un Directeur Général, éventuellement assisté d'un Directeur Général Adjoint, tous deux nommés par décret du Président de la République, pour un mandat de trois (3) ans renouvelable deux (2) fois.
(2) Le Directeur Général et le Directeur Général Adjoint sont soumis aux mesures restrictives et incompatibilités prévues par la législation en vigueur.
Art. 21 —  (1) Le Directeur Général est chargé de la gestion et de l'application de la politique générale de la MEADEN sous le contrôle du Conseil d'Administration.
A ce titre, il :
prépare le budget, les états financiers annuels et les rapports d'activités ;
assure la direction technique, administrative et financière de la MEADEN;
prépare les délibérations du Conseil d'Administration, assiste avec voix consultative à ses réunions et exécute ses décisions ;
recrute, nomme, licencie et fixe la rémunération et les avantages du personnel, sous réserve des prérogatives reconnues au Conseil d'Administration et dans le respect des lois et règlements en vigueur, du règlement intérieur, des prévisions budgétaires et des délibérations du Conseil d'Administration ;
gère les biens meubles, corporels et incorporels de la MEADEN, dans le respect de son objet et des dispositions de l'article 13 ci-dessus ;
représente la MEADEN dans tous les actes de la vie civile et en justice.
(2) Le Directeur Général peut déléguer une partie de ses pouvoirs.
Art. 22 —  Le Directeur Général est responsable devant le Conseil d'Administration qui peut le sanctionner en cas de faute grave de gestion ou de comportement susceptible de nuire à la bonne marche ou à l'image de la MEADEN, suivant les modalités fixées par la législation en vigueur.
Art. 23 —  (1) En cas d'empêchement temporaire du Directeur Général pour une période n'excédant pas deux (2) mois, celui-ci prend toutes les dispositions pour assurer la bonne marche du service.
(2) En cas de vacance du poste de Directeur Général pour cause de décès, de démission ou d'empêchement définitif dûment constaté par le Conseil d'Administration et en attendant la nomination d'un nouveau Directeur Général par l'autorité. compétente, le Conseil d'Administration prend toutes les dispositions pour assurer la bonne marche de la MEADEN.
Art. 24 —  La rémunération et les avantages divers du Directeur Général et du Directeur Général Adjoint sont fixés par le Conseil d' Administration à la majorité des deux tiers (2/3) de ses membres, dans le respect des plafonds prévus par la réglementation en vigueur.
CHAPITRE III
DES DISPOSITIONS FINANCIERES
SECTION I
DES RESSOURCES
Art. 25 —  Les ressources financières de la MEADEN sont des deniers publics, gérés suivant les règles prévues par le régime financier de l'Etat.
Art. 26 —  Les ressources de la MEADEN sont constituées par:
les subventions et contributions de l'Etat ;
les redevances d'usage du patrimoine dont elle a la charge
les emprunts ;
les dons et legs
toutes autres ressources prévues par la loi.
SECTION II
DU BUDGET ET DES COMPTES
Art. 27 —  L'exercice budgétaire de la MEADEN commence le 1er juillet et se termine le 30 juin de l'année suivante.
Art. 28 —  Le Directeur Général est l'ordonnateur principal de la MEADEN. Sur sa proposition, des ordonnateurs secondaires peuvent être institués par le Conseil d'Administration.
Art. 29 —  Le projet de budget annuel et les plans d'investissement de la MEADEN sont préparés par le Directeur Général, adoptés par le Conseil d'Administration et transmis pour approbation au Ministre de tutelle technique et au Ministre chargé des finances avant le début de l'exercice budgétaire.
Art. 30 —  (1) Le budget de la MEADEN doit être équilibré en recettes et en dépenses.
(2) Toutes les recettes de la MEADEN et toutes les dépenses sont inscrites dans le budget adopté par le Conseil d'Administration.
(3) Les sommes indispensables à la couverture des dépenses de fonctionnement et d'une manière générale les ressources de la MEADEN peuvent être déposées dans un compte bancaire. Toutefois, l'engagement, la liquidation, le mandatement et le paiement des sommes déposées dans ce compte s'effectuent conformément aux règles de la comptabilité publique.
SECTION III
DU CONTROLE ET DU SUIVI DE LA GESTION
Art. 31 —  (1) Un agent comptable est nommé auprès de la MEADEN par arrêté du Ministre chargé des finances
(2) L'Agent comptable enregistre toutes les recettes et toutes les dépenses de la MEADEN. Il contrôle la régularité des autorisations des recettes, des mandatements et des paiements ordonnés par le Directeur Général.
(3) Le paiement des dépenses autorisées s'effectue uniquement auprès de l'agent comptable de la MEADEN.
Art. 32 —  (1) Un contrôleur financier est désigné auprès de la MEADEN par arrêté du Ministre chargé des finances.
(2) Le contrôleur financier est chargé du contrôle des actes générateurs des recettes et des dépenses pris soit par le Directeur Général, soit par ses subordonnés. Il est chargé, d'une manière générale, du contrôle de l'exécution du budget.
Art. 33 —  (1) Le Directeur Général établit à la fin de chaque exercice budgétaire tous les états relatifs à la situation de tous les comptes bancaires, des comptes de dépôt et de portefeuille. Il établit également les inventaires ainsi que l'état des créances et des dettes.
Il présente au Conseil d'Administration et selon le cas, au Ministre chargé des finances et au Ministre de tutelle technique, des situations périodiques et un rapport annuel d'activités.
Il leur présente également dans les six (6) mois suivant la clôture de l'exercice budgétaire les états financiers annuels, le rapport d'exécution du budget de l'exercice écoulé et un rapport sur l'état du patrimoine de la MEADEN.
(2) Le contrôleur financier et l'agent comptable présentent au Conseil d'Administration leurs rapports respectifs sur l'exécution du budget de la MEADEN.
(3) Les copies de ces rapports sont transmises au Ministre chargé des finances, au Ministre de tutelle technique et au Directeur Général de la MEADEN.
Art. 34 —  Le suivi de la gestion et des performances de la MEADEN est assuré par le Ministre chargé des finances.
A cet effet, la MEADEN adresse au Ministre chargé des finances tous les documents et informations relatifs à la vie de l'établissement qui doivent être tenus, en vertu du droit commun, à la disposition des administrateurs et, notamment, les rapports d'activités, les rapports des contrôleurs financiers, ainsi que les états financiers annuels.
En outre, la MEADEN est tenue de publier annuellement une note d'information présentant l'état de ses actifs et de ses dettes et résumant ses comptes annuels dans un journal d'annonces légales et dans la presse nationale.
Le Ministre chargé des finances peut également demander la production d'états financiers pour une périodicité inférieure à un exercice.
Des audits indépendants peuvent être demandés par le Conseil d'Administration ainsi que par le Ministre chargé des finances.
CHAPITRE IV
DU PERSONNEL
Art. 35 —  (1) La MEADEN peut employer:
le personnel recruté directement;
les fonctionnaires en détachement;
les agents de l'Etat relevant du Code du Travail qui lui sont affectés à la demande du Directeur Général.
(2) Les fonctionnaires en détachement et les agents de l'Etat affectés à la MEADEN relèvent pendant toute la durée de leur emploi en son sein, de la législation du travail et des textes particuliers dudit établissement, sous réserve, en ce qui concerne les fonctionnaires, des dispositions du statut général de la fonction publique relative à l'avancement, à la retraite et à la fin du détachement.
Art. 36 —  (1) La responsabilité civile et/ou pénale du personnel de la MEADEN est soumise aux règles de droit commun.
(2) Les conflits entre le personnel et la MEADEN relèvent de la compétence des juridictions de droit commun.
Art. 37 —  Les personnels de la MEADEN ne doivent en aucun cas être salariés, bénéficier d'une rémunération sous quelque forme que ce soit ou avoir un intérêt direct dans les opérations financées par l'établissement.
CHAPITRE V
DISPOSITIONS DIVERSES ET FINALES
Art. 38 —  La dissolution et la liquidation de la MEADEN s'effectuent conformément à la législation en vigueur.
Art. 39 —  La MEADEN est soumise aux textes régissant les marchés publics, sous réserve des dérogations prévues par des textes particuliers.
Art. 40 —  Sont abrogées toutes dispositions antérieures contraires, notamment celles du décret n° 72/332 du 17 juillet 1972 portant création de la Mission d'Etudes pour l'Aménagement de la Vallée Supérieure de la Bénoué, modifié par le décret n° 73/50 du 9 février 1973.
Art. 41 —  Le Ministre chargé de l'aménagement du territoire et le Ministre chargé des finances sont, chacun en ce qui le concerne, chargés de l'application du présent décret qui sera enregistré, publié suivant la procédure d'urgence, puis inséré au Journal Officiel en français et en anglais./-",DECRET_N_2002_039_DU_04_FEVRIER_2002_PORTANT_CHANGEMENT_DE_DENOMINATION_ET_REORGANISATION_DE_LA_MISSION_D_ETUDES_POUR_L_AMENAGEMENT_DE_LA_VALLEE_SUPERIEURE_DE_LA_BENOUE,0,
