URL,text,page_title,page_label,category,metadata
https://www.juriafrica.com/lex/decret-2020-389-16-juillet-2020-49027.htm,"DECRET N°2020/389 DU 16 JUILLET 2020 HABILITANT LE MINISTRE DE L'ECONOMIE, DE LA PLANIFICATION ET DE L'AMÉNAGEMENT DU TERRITOIRE À SIGNER AVEC LA BANQUE AFRICAINE DE DÉVELOPPEMENT (BAD), UN ACCORD DE PRÊT D'UN MONTANT DE 88 MILLIONS D'EUROS, SOIT ENVIRON 57,7 MILLIARDS DE FRANCS CFA, POUR LE FINANCEMENT PARTIEL DU PROGRAMME D'APPUI BUDGÉTAIRE EN RÉPONSE À LA CRISE COVID-19.-

LE PRESIDENT DE LA REPUBLIQUE,
Vu la Constitution ;
Vu l'ordonnance n°2020/001 du 03 juin 2020 modifiant et complétant certaines dispositions de la loi n°2019/023 du 24 décembre 2019 portant loi de finances de la République du Cameroun pour l'exercice 2020 ;
Vu le décret n°2011/408 du 09 décembre 2011 portant organisation du Gouvernement, modifié et complété par le décret n°2018/190 du 02 mars 2018,
DECRETE:
Art. 1er —  Le Ministre de l'Economie, de la Planification et de l'Aménagement du Territoire est habilité, avec faculté de délégation, à signer avec la Banque Africaine de Développement (BAD), un Accord de Prêt d'un montant de 88 millions d'euros, soit environ 57,7 milliards de francs CFA, pour le financement partiel du Programme d'Appui Budgétaire en Réponse à la crise COVID-19.
Art. 2 —  Le présent décret sera enregistré, publié suivant la procédure d'urgence, puis inséré au Journal Officiel en français et en anglais. /-",DECRET_N_2020_389_DU_16_JUILLET_2020_HABILITANT_LE_MINISTRE_DE_L_ECONOMIE_DE_LA_PLANIFICATION_ET_DE_L_AMENAGEMENT_DU_TERRITOIRE_A_SIGNER_AVEC_LA_BANQUE_AFRICAINE_DE_DEVELOPPEMENT_BAD_UN_ACCORD_DE_PRET_D_UN_MONTANT_DE_88_MILLIONS_D_EUROS_SOIT_ENVIRON_57_7_MILLIARDS_DE_FRANCS_CFA_POUR_LE_FINANCEMENT_PARTIEL_DU_PROGRAMME_D_APPUI_BUDGETAIRE_EN_REPONSE_A_LA_CRISE_COVID_19,0,decret,
