URL,text,page_title,page_label,metadata
https://www.juriafrica.com/lex/decret-76-363-21-aout-1976-16566.htm,"Le président de la république
Vu la constitution du 2 juin 1972, modifié et complétée par la loi n°75-1 du 9 mai 1975 ;
Vu le décret n°75-467 du 28 juin 1975 portant réorganisation du gouvernement ;
Vu le décret n°75-478 du 30 juin 1975 portant nomination des membres du gouvernement ;
Vu le décret n°75-DF-365 du 21 août 1967 relatif aux relations financières entre la république unie du Cameroun et l'Etranger.
DECRETE :
Art. premier —  Les dispositions de l'article 2 du décret n°67-DF-365 du 21 août 1967 sont modifiées et remplacées par les dispositions ci-après :
Art. 2 (nouveau).-  —  Toutefois, la loi n'est pas applicable aux relations du Cameroun avec l'Afrique du Sud et la Rhodésie.
Avec ces pays, ces relations demeurent régies par les décrets n°63-DF-212 du 2 juillet 1963 et n°65-DF-544 bis du 15 décembre 1965 ainsi que les arrêtés d'application correspondant.
Art. 2 —  Les relations financières entre la république unie du Cameroun et le Portugal sont désormais régis par dispositions du décret n°68-DF-460 du 3 décembre 1968 réglementant les relations financières entre le Cameroun et l'Etranger.
Art. 3 —  Les arrêtés du ministre des finances préciseront, en tant que de besoin, les modalités d'application du présent décret.
Art. 4 —  Le ministre des finances et le ministre de l'économie et du plan sont chargés de l'exécution du présent décret qui sera publié selon la procédure d'urgence et inséré au journal officiel de la république unie du Cameroun en français et en anglais.",DECRET_N_76_363_DU_21_AOUT_1976_MODIFIANT_LE_DECRET_N_67_DF_365_DU_21_AOUT_1967_FIXANT_LES_CONDITIONS_D_APPLICATION_DE_LA_LOI_N_67_LF_22_DU_12_JUIN_1967_RELATIVE_AUX_RELATIONS_FINANCIERES_ENTRE_LA_REPUBLIQUE_UNIE_DU_CAMEROUN_ET_L_ETRANGER,0,
