URL,text,page_title,page_label,metadata
https://www.juriafrica.com/lex/decret-2019-105-04-mars-2019-49887.htm,"LE PRESIDENT DE LA REPUBLIQUE,
VU la Constitution ;
VU la loi n°2018/022 du 11 décembre 2018 portant loi de finances de la République du Cameroun pour l'exercice 2019 ;
VU le décret n°2011/408 du 9 décembre 2011 portant organisation du Gouvernement, modifié et complété par le décret n°2018/190 du 2 mars 2018
VU le décret n°2018/417 du 20 juillet 2018 habilitant le Ministre de l'Economie, de la Planification et de l'Aménagement du Territoire, à signer avec la Banque Islamique de Développement (BID), un Accord de prêt d'un montant de 3,55 millions de Dinars Islamique, correspondant à 4,990 millions de Dollars US soit environ 3,22 milliards de francs CFA, pour le financement du Projet d'Infrastructure Agricole et de Développement des Chaînes de Valeurs au Cameroun.
DECRETE :
Art. 1er —  Est ratifié l'Accord de prêt d'un montant de 3,55 millions de Dinars Islamique, correspondant à 4,990 millions de Dollars US soit environ 3,22 milliards de francs CFA, pour le financement du Projet d'Infrastructure Agricole et de Développement des Chaînes de Valeurs au Cameroun,
Art. 2 —  Le présent décret sera enregistré, publié suivant la procédure d'urgence, puis inséré au Journal Officiel en français et en anglais./",DECRET_N_2019_105_DU_04_MARS_2019_PORTANT_RATIFICATION_DE_L_ACCORD_DE_PRET_D_UN_MONTANT_DE_3_55_MILLIONS_DE_DINARS_ISLAMIQUE_CORRESPONDANT_A_4_990_MILLIONS_DE_DOLLARS_US_SOIT_ENVIRON_3_22_MILLIARDS_DE_FRANCS_CFA_ENTRE_LA_REPUBLIQUE_DU_CAMEROUN_ET_LA_BANQUE_ISLAMIQUE_DE_DEVELOPPEMENT_BID_DESTINE_AU_FINANCEMENT_DU_PROJET_D_INFRASTRUCTURE_AGRICOLE_ET_DE_DEVELOPPEMENT_DES_CHAINES_DE_VALEURS_AU_CAMEROUN,0,
