URL,text,page_title
https://www.juriafrica.com/lex/decret-2022-170-23-mai-2022-50848.htm,"LE PRESIDENT DE LA REPUBLIQUE,
Vu la Constitution ;
Vu la loi n°2022/003 du 27 avril 2022 autorisant le Président de la République à ratifier l'Accord-cadre amendé, portant création de l'Alliance Solaire Internationale (ASI), signé le 02 octobre 2020 à Yaoundé,
DECRETE:
Art. 1er —  .- Est ratifié, l'Accord-cadre amendé, portant création de l'Alliance Solaire Internationale (ASI), signe le 02 octobre 2020 à Yaoundé.
Art. 2 —  Le présent décret sera enregistré, publié suivant la procédure d'urgence, puis inséré au Journal Officiel en français et en anglais. /-","DECRET_N°2022_170_DU_23_MAI_2022_PORTANT_RATIFICATION_DE_L'ACCORD-CADRE_AMENDE,_PORTANT_CREATION_DE_L'ALLIANCE_SOLAIRE_INTERNATIONALE_(ASI),_SIGNE_LE_02_OCTOBRE_2020_À_YAOUNDE"
