URL,text,page_title,page_label,metadata
https://www.juriafrica.com/lex/decret-2014-424-28-octobre-2014-18120.htm,"Le Président de la République,
Vu la Constitution;
Vu l'ordonnance n° 72/11 du 26 août 1972 relative à la publication des lois ordonnances, décrets et actes réglementaires;
Vu la loi n° 2013/017 du 16 décembre 2013 portant loi de finances de la République du Cameroun pour l'exercice 2014 ;
Vu le décret n° 77/4 du 6 janvier 1977 portant réglementation de la publication des actes au Journal Officiel de la République du Cameroun ;
Vu le décret n° 2011/408 du 9 décembre 2011 portant organisation du gouvernement,
DECRETE:
Art. 1er —  Est ordonnée, la publication au Journal officiel de la République du Cameroun, du texte de l'accord de crédit N°5422-CM, d'un montant de 5,21 millions de droits de tirage spéciaux (DTS), correspondant à 8 millions de dollars US, soit environ 4 milliards de FCFA, pour le financement du projet régional de développement des Centres d'excellence de l'enseignement supérieur en Afrique de l'Ouest et du Centre (CEA).
Art. 2 —  Le présent décret sera enregistré, publié suivant la procédure d'urgence, puis inséré au Journal officiel en français et en anglais.",DECRET_N_2014_424_DU_28_OCTOBRE_2014_ORDONNANT_LA_PUBLICATION_AU_JOURNAL_OFFICIEL_DU_TEXTE_DE_L_ACCORD_DE_CREDIT_N_5422_CM_D_UN_MONTANT_DE_5_21_MILLIONS_DE_DROITS_DE_TIRAGE_SPECIAUX_DTS_CORRESPONDANT_A_8_MILLIONS_DE_DOLLARS_US_SOIT_ENVIRON_4_MILLIARDS_DE_FCFA_CONCLU_LE_14_AOUT_2014_ENTRE_LA_REPUBLIQUE_DU_CAMEROUN_ET_L_ASSOCIATION_INTERNATIONALE_DE_DEVELOPPEMENT_IDA_POUR_LE_FINANCEMENT_DU_PROJET_REGIONAL_DE_DEVELOPPEMENT_DES_CENTRES_D_EXCELLENCE_DE_L_ENSEIGNEMENT_SUPERIEUR_EN_AFRIQUE_DE_L_OUEST_ET_DU_CENTRE_CEA,0,
