URL,text,page_title,page_label,category,metadata
https://www.juriafrica.com/lex/decret-2014-240-01-juillet-2014-18097.htm,"DÉCRET N° 2014/240 DU 01 JUILLET 2014 PORTANT NOMINATION DU PRÉSIDENT DU CONSEIL D'ADMINISTRATION DE LA SOCIÉTÉ D'EXPANSION ET DE MODERNISATION DE LA RIZICULTURE DE YAGOUA (SEMRY).

LE PRESIDENT DE LA REPUBLIQUE,
Vu la Constitution ;
Vu la loi n° 99/016 du 22 décembre 1999 portant statut général des établissements publics et des entreprises du secteur public et parapublic ;
Vu le décret n° 71/DF/74 du 24 février 1971 portant création de la Société d'Expansion et de Modernisation de la Riziculture de Yagoua (SEMRY) ;
Vu le décret n° 2011/408 du 09 décembre 2011 portant organisation du Gouvernement;
Vu le décret n° 2014/184 du 04 juin 2014 portant nomination de Gouverneurs de Région,
DECRETE:
Art. 1er —  Monsieur MIDJIYAWA BAKARI, Gouverneur de la Région de l'Extrême-Nord, est, à compter de la date de signature du présent décret, nommé Président du Conseil d'Administration de la Société d'Expansion et de Modernisation de la Riziculture de Yagoua (SEMRY).
Art. 2 —  L'intéressé aura droit aux avantages de toute nature prévus par la réglementation en vigueur.
Art. 2 —  Le présent décret sera enregistré, publié suivant la procédure d'urgence, puis inséré au Journal Officiel en français et en anglais.-",DECRET_N_2014_240_DU_01_JUILLET_2014_PORTANT_NOMINATION_DU_PRESIDENT_DU_CONSEIL_D_ADMINISTRATION_DE_LA_SOCIETE_D_EXPANSION_ET_DE_MODERNISATION_DE_LA_RIZICULTURE_DE_YAGOUA_SEMRY,0,decret,
