URL,text,page_title,page_label,category,metadata
https://www.juriafrica.com/lex/ordonnance-61-of-1-1er-octobre-1961-17785.htm,"ORDONNANCE N°61/OF/1 DU 01 OCTOBRE 1961 RELATIVE À LA PUBLICATION DES LOIS, ORDONNANCES, DÉCRETS ET ACTES RÉGLEMENTAIRES.

LE PRESIDENT DE LA REPUELIQUE FEDERALE,
VU les articles 5, 6, 12, 31, 45 et 50 de la Constitution
ORDONNE:
Art. 1 —  –
Le Président de la République Fédérale assure la pu-blication des lois promulguées de l'assemblée nationale fédérale et des assemblées législatives des Etats fédérés, ainsi que des décrets et arrêtés réglementaires émanant des autorités fédérales centrales.
Art. 2 —  –
La publication des actes fédéraux, législatifs ou réglementaires a lieu au Journal Officiel de la République Fédé-rale. Elle est effectuée en anglais et en français. Il pourra être stipulé dans toute loi ou acte réglementaire quel est le texte, français ou anglais, qui fera foi.
Art. 3 —  La publication des lois des Etats Fédérés aura lieu en anglais ou en Français suivant le cas, et sera effectuée soit dans le journal officiel du Cameroun Oriental, soit dans la Gazette du Cameroun Occidental.
Art. 4 —  Les lois, décrets, et actes règlementaires publiés au Journal Officiel de la République Fédérale et au Journal Officiel du Cameroun Oriental sont exécutoires à Yaoundé le jour même de leur publication. Les lois publiées à la Gazette du Cameroun Occi-dental seront exécutoires le jour même de leur publication à Buéa.
Dans les autres circonscriptions administratives les lois fédérales ou des Etats Fédérés et les actes réglementaires fédéraux sont exécutoires le lendemain du jour de l'arrivée du Journal Officiel intéressé ou de la Gazette au chef lieu de la circonscription.
Le jour de l'arrivée du Journal Officiel ou de la Gazette est constaté par le chef de la circonscription administrative.
Art. 5 —  Lorsque les circonstances l'exigent le Président de la République Fédérale peut décider que la loi ou l'acte réglementaire sera publié suivant la procédure d'urgence.
Dans ce cas, les dispositions nouvelles sont portées à la connaissance de la population par tous moyens, notamment par radio, et sont exécutoires immédiatement. Elles sont néanmoins publiées ensuite régulièrement suivant le cas au Journal Officiel de la République Fédérale, au Journal Officiel du Cameroun Orien-tal ou à la Gazette du Cameroun Occidental.
Art. 6 —  La publication des actes réglementaires des autorités administratives subordonnées sera effectuée à la diligence de celles-ci par tous moyens de publicité appropriés tels qu'affichage, an-nonce publique, notification, insertion dans la presse, lecture à la radio, etc ... Ces actes réglementaires sont exécutoires dès que leur publication a été effectuée.
La présente ordonnance sera exécutée comme loi de la République Fédérale.",ORDONNANCE_N_61_OF_1_DU_01_OCTOBRE_1961_RELATIVE_A_LA_PUBLICATION_DES_LOIS_ORDONNANCES_DECRETS_ET_ACTES_REGLEMENTAIRES,0,decret,
