URL,text,page_title,page_label,metadata
https://www.juriafrica.com/lex/arret-108-civ-28-avril-2011-8798.htm,"L'an deux mille onze et le vingt huit du mois d'avril ,
La Cour Suprême, Chambre Judiciaire, Section Civile, siégeant au Palais de Justice de Yaoundé
A rendu en audience publique ordinaire, l'arrêt dont la teneur suit .
ENTRE
Société Nationale d'Electricité (SONEL), demanderesse à la cassation, représentée par Maître DIKOUME WANGUE, Avocat à Douala ,
D'UNE PART
ET :
AZUKA Edwin, défendeur à la cassation, représenté par Maître BAYAGA Jules Aimé, Avocat à Douala ;
D'AUTRE PART
En présence de Monsieur Martin Hilman EGBE ACHUO, Avocat Général près la Cour Suprême ;
Statuant sur le pourvoi formé par Maître DIKOUME WANGUE, Avocat à Douala, agissant au nom et pour le compte de la SONEL, par déclaration faite le 7 janvier 2007 au greffe de la Cour d'Appel du Littoral, en cassation de l'arrêt n° 56/C rendu le 1er décembre 2005 par la susdite Cour statuant en matière civile dans l'instance opposant sa cliente à AZUKA Edwin ;
LA COUR
Après avoir entendu en la lecture du rapport Monsieur Dagobert BISSECK, Conseiller à la Cour Suprême ;
Vu les conclusions de Monsieur Martin RISSOUK à MOULONG, Procureur Général ;
Et après en avoir délibéré conformément à la loi ;
Vu le mémoire ampliatif déposé le 17 septembre 2009 par Me DIKOUME WANGUE, avocat à Douala ;
Sur le moyen de cassation soulevé d'office pris de la violation de la loi, violation de l'article 39 du code de procédure civile et commerciale ;
En ce que le jugement entrepris confirmé par l'arrêt attaqué a omis de reproduire l'exploit introductif d'instance, alors qu'aux termes de l'article 39 du code de procédure civile et commerciale, les jugements doivent contenir entre autres indications, l'acte introductif d'instance ;
Qu'il s'agit d'une formalité substantielle qui permet à la Cour Suprême d'exercer son contrôle sur l'étendue de la demande, formalité par ailleurs liée à l'obligation faite aux juges de motiver leurs décisions ;
Attendu en l'espèce que le jugement déféré énonce dans ses qualités
« Suivant exploit en date du 22 mars 2001 du ministère de Me BALENG MAAH, huissier de justice près la Cour d'appel et les Tribunaux de Douala, .sieur AZUKA Edwin a fait délivrer assignation à la Société Nationale d'Electricité (SONEL) d'avoir à retrouver et comparaître en audience et par devant le Tribunal de Grande Instance de Douala ....pour
« Par ces motifs
« Constater que l'incendie ayant détruit la boutique du requérant a été provoqué par un poteau électrique SONEL ,
« Dire et juger sieur AZUKA Edwin fondé en sa demande d'indemnisation ,
« Condamner la SONEL à lui payer les sommes suivantes... »
Attendu qu'en se contentant de ces énonciations sommaires sans reproduire l'exploit introductif d'instance, le premier juge a méconnu les dispositions légales susvisées ;
Qu'en confirmant cette décision, le juge d'appel a emprunté le vice dont elle est entachée, violant de ce fait le texte visé au moyen ;
D'où il suit que celui-ci est fondé et que l'arrêt attaqué encourt la cassation ;
Sur l'évocation
Attendu que l'affaire n'est pas en état au sens de l'article 67 alinéa 2 de la loi n° 2006/016 du 29 décembre 2006 fixant l'organisation et le fonctionnement de la Cour Suprême ,
Qu'il y a par conséquence lieu à renvoi ;
PAR CES MOTIFS
Casse et annule l'arrêt n° 56/C rendu le 1er décembre 2005 par la Cour d'Appel du Littoral ;
Remet en conséquence la cause et les parties au même et semblable état où elles étaient avant ladite décision et, pour être fait droit, les renvoie devant la même Cour d'Appel autrement composée ;
Réserve les dépens ;
Ordonne qu'à la diligence du Greffier en chef de la Chambre Judiciaire de la Cour Suprême, une expédition du présent arrêt sera transmise au Procureur Général près la Cour d'Appel du Littoral et une autre au Greffier en chef de ladite Cour pour mention dans leurs registres respectifs ;
Ainsi jugé et prononcé par la Cour Suprême en son audience publique ordinaire les mêmes jour, mois et an que dessus, en la salle des audiences de la Cour où siégeaient :
MM. : Alexis DIPANDA MOUELLE. Premier Président de la Cour Suprême, Président
Dagobert B1SSECK, Conseiller
Frédéric MOCHE, Conseiller
En présence de Monsieur EGBE ACHIJO Martin Hilman, Avocat Général occupant le banc du Ministère Public ,
Et avec l'assistance de Maître Edwige ESSAMA, Greffier ,
En foi de quoi le présent arrêt a été signé par le Président, les Conseillers et le Greffier ;
Approuvant mot rayé nul ,
LE PRESIDENT, LES CONSEILLERS, LE GREFFIER.-",ARRET_N_108_CIV_DU_28_AVRIL_2011,0,"{'Court': 'COUR SUPREME DU CAMEROUN', 'Chamber': 'CHAMBRE JUDICIAIRE', 'Section': 'SECTION CIVILE', 'Case': 'Dossier n° 111/CC/09', 'Appeal': 'Pourvoi n° 57du 29 janvier 2007', 'Claimant': 'SONEL', 'Against': 'C/', 'Defendant': 'AZUKA EDWIN', 'Judgment': 'ARRET N° 108/CIV DU 28 AVRIL 2011'}"
