URL,text,page_title,page_label,category,metadata
https://www.juriafrica.com/lex/arret-128-soc-05-decembre-2014-32791.htm,"ARRÊT N° 128/SOC DU 05 DÉCEMBRE 2014

L'an deux mille quatorze et le quatre décembre;
La Cour Suprême statuant en matière de droit social ;
En son audience publique ordinaire, a rendu l'arrêt dont la teneur suit :
ENTRE :
DEUTIA NOUMANGUE Michel, demandeur en cassation ;
D'UNE PART
ET
ABDOULAYE CISSOKO, défendeur à la cassation ;
D'AUTRE PART
En présence du Monsieur OUMAROU BAMANGA, Avocat Général près la Cour Suprême ;
Statuant sur le pourvoi formé par Maître KENGNI Christophe, Avocat à Yaoundé, agissant au nom et pour le compte du sieur DEUTIA NOUMANGUE Michel suivant lettre en date du 10 Octobre 2005 enregistrée le 04 Avril 2006 sous le n° 450 au greffe de la. Cour d'Appel du Centre, en cassation de l'arrêt n° 39/Soc rendu le 16 Novembre 2004 par la susdite Cour, statuant en matière sociale dans l'instance opposant sa client au nommé ABDOULAYE CISSOKO ;
LA COUR
Après avoir entendu en son rapport Madame Suzanne MENGUE, Conseiller à la Cour Suprême ;
Vu les conclusions de Monsieur le Procureur Général près la Cour Suprême, Martin RISSOUK à MOULONG ;
Et après avoir délibéré conformément à la loi ;
Vu le mémoire ampliatif déposé le 10 août 2010 par Maître KENGNI Christophe, avocat à Yaoundé ;
Sur le moyen de cassation soulevé d'office, pris de la violation de la loi, violation de l'article 133 alinéas 1, 3 et 4 du code du travail ;
En ce que la Cour d'Appel a confirmé le jugement rendu par le tribunal de première instance statuant en matière sociale qui était composé du seul président et du greffier sans aucune indication sur la convocation et la carence des assesseurs employeur et employé ;
Alors qu'aux termes de l'article 133 (1, 3 et 4) du code du travail ;
« (1) Les tribunaux statuant en matière sociale se composent :
-d'un magistrat, président
-d'un assesseur employeur et d'un assesseur travailleur
(3) Au cas où l'un ou les deux assesseurs dûment convoqués ne se présentent pas, le président leur adresse une seconde convocation. En cas de nouvelle carence de l'un ou des deux assesseurs, le Président statue seul ;
(4) Dans le cas visé à l'alinéa précédent, il est fait mention dans le jugement de la carence de l'un ou des deux assesseurs ;
Attendu en l'espèce que le jugement entrepris indique dans ses qualités que le tribunal de Première Instance de Yaoundé qui ra rendu était composé de :
« -M. TANKEU Mathieu ….. Président
-Me OBA Sylvain ……Greffier » ;
Attendu qu'en siégeant en une telle composition, sans aucune mention de la convocation ni de la carence des deux assesseurs employeur et employé, ledit tribunal ne test pas conformé aux exigences du texte sus-énoncé au moyen ;
D'où il suit que celui-ci est fondé et que l'arrêt attaqué encourt la cassation ;
Sur révocation
Attendu que cette affaire n'est pas en état au sens de l'article 67 de la loi n° 2006/016 du 29 décembre 2006 fixant l'organisation et le fonctionnement de la Cour Suprême, les juges du fond n'ayant pas régulièrement apprécié les faits dans les conditions prescrites par la loi :
Qu'il échet de la renvoyer devant la même Cour d'Appel autrement composée ;
PAR CES MOTIFS
Casse et annule l'arrêt n° 39/Soc rendu le 16 Novembre 2004 par la Cour d'Appel du Centre ;
Remet en conséquence la cause et les parties au même et semblable état où elles étaient avant ladite décision ;
Et pour être fait droit, les renvoie devant la même Cour d'Appel autrement composée ;
Ordonne qu'à la diligence du Greffier en chef de la Chambre Judiciaire de la Cour Suprême, une expédition du présent arrêt sera transmise au Procureur Général de la Cour d'Appel du Centre et un autre au greffier en chef de ladite cour, pour mention dans leurs registres respectifs ;
Ainsi jugé et prononcé par la Cour Suprême, en son audience publique ordinaire du quatre décembre Fan deux mille quatorze, en la salle des audiences de la Cour où siégeaient :
M. Dagobert BISSECK, Président de la section Sociale, PRESIDENT,
Mme Susanne MENGUE, CONSEILLER
M. Christophe YOSSA, CONSEILLER ;
En présence de Monsieur OUMAROU BAMANGA , Avocat Général occupant le banc du Ministère Public ;
Et avec rassistance de Madame Margaret MUSONGO, Greffier ;",ARRET_N_128_SOC_DU_05_DECEMBRE_2014,0,arret,"{'Court': 'COUR SUPREME DU CAMEROUN', 'Chamber': 'CHAMBRE JUDICIAIRE', 'Section': 'SECTION SOCIALE', 'Case': 'DOSSIER N° 52/S/2010', 'Appeal': 'POURVOI n° 67/GCAY du 04 avril 2006', 'Claimant': 'DEUTIA NOUMANGUE MICHEL', 'Against': 'C/', 'Defendant': 'ABDOULAYE CISSOKO', 'Judgment': 'ARRÊT N° 128/SOC DU 05 DÉCEMBRE 2014'}"
