URL,text,page_title,page_label,category,metadata
https://www.juriafrica.com/lex/arret-369-p-5-aout-1999-10227.htm,"ARRET N°369/P DU 5 AOUT 1999

LA COUR,
Vu le mémoire ampliatif déposé par Maître Muna, Avocat à Yaoundé ;
Sur le moyen unique de cassation ainsi formulé :
«...Pris de la violation de l'ordonnance n°72/4 du 26 août 1972 en son article 5, défaut de motifs ;
«L'arrêt attaqué a violé le texte visé au moyen ;
«En ce qu'il énonce simplement pour confirmer le jugement entrepris qu'il appert que le premier juge a fait une bonne appréciation des faits de la cause, une exacte application de la loi pénale et en a tiré toute les conséquences de droit ;
«Alors qu'il est constant que tout juge du fond a l'obligation de motiver sa décision ; cette obligation empêche le juge de se soustraire au contrôle de la Cour suprême ;
«Par une motivation aussi vague et évasive le juge a mis la Cour suprême dans l'impossibilité de vérifier si la décision attaquée est conforme au droit et l'inobservation de cette exigence entraîne cassation » ;
«Attendu qu'aux termes de l'article 5 de l'ordonnance n°72/4 du 26 août 1972 toute décision de justice doit à peine de nullité d'ordre public être motivée en fait et en droit ;
«Attendu en l'espèce que pour déclarer Njakou André coupable de vol, le premier juge énonce dans sa décision confirmée par adoption de motifs par la Cour d'Appel que :
«Attendu par contre qu'il résulte de l'examen des pièces du dossier et des débats publics à l'audience de ce jour preuve suffisante de culpabilité contre les accusés Njakou André et Kana Brigitte d'avoir à Dschang... ;
«Pour Njakou André, porté atteinte à la fortune d'autrui en soustrayant un poste radio et un lit au préjudice des nommés Zambou Bernadette, Tonfack Madeleine, Mbatigning Madeleine, Tsakeng Blaise, Me fenza Thomas et Dongmo Joseph avec cette circonstance aggravante que cette soustraction a été faite par effraction extérieure» ;
Attendu que cette motivation qui ne spécifie pas les circonstances du vol dont s'agit, et se borne à énoncer tout simplement que ladite soustraction a été faite par effraction extérieure sans pourtant spécifier la nature de ladite infraction, n'est en réalité qu'une reprise des termes de l'inculpation et est de ce fait largement insuffisante ;
Attendu qu'en adoptant purement et simplement les motifs du premier juge pour confirmer la décision entreprise, la Cour d'Appel a épousé les fautes qui lui sont reprochées, exposant ainsi sa décision à la censure de la Cour suprême ;
D'où il suit que le moyen est fondé ;
Sur le pourvoi du Procureur Général près la Cour d'Appel de Bafoussam ;
Attendu que le Procureur Général près la Cour d'Appel de Bafoussam n'a déposé aucun mémoire ampliatif pour soutenir son pourvoi ;
Attendu cependant que la pertinence du moyen ci-dessus examiné rend inopportune la nécessité de l'examen d'un moyen soulevé d'office, exigé par l'article 26 (2) de la loi n°75/16 du 8 décembre 1975 fixant la procédure et le fonctionnement de la Cour suprême ;
PAR CES MOTIFS
JOINT les pourvois ;
CASSE ET ANNULE l'arrêt n°29/crim rendu le 28 décembre 1987 par la Cour d'Appel de Bafoussam ;
REMET en conséquence la cause et les parties au même et semblable état où elles étaient avant ladite décision et, pour être fait droit, les renvoie devant la Cour d'Appel de Bafoussam autrement composée ;
RESERVE les dépens ;
ORDONNE qu'à la diligence de Monsieur le Procureur Général près la Cour suprême, le présent arrêt sera imprimé et transmis pour être transcrit sur les registres du Greffe de la Cour d'Appel de Bafoussam et que mention en sera faite en marge ou à la suite de la décision attaquée.",ARRET_N_369_P_DU_5_AOUT_1999,0,arret,"{'Court': 'COUR SUPRÊME DU CAMEROUN', 'Chamber': 'Chambre Pénale', 'Section': '', 'Case': '', 'Appeal': '', 'Claimant': ""PROCUREUR GÉNÉRAL PRÈS LA COUR D'APPEL DE BAFOUSSAM ET NJAKOU ANDRÉ"", 'Against': 'C/', 'Defendant': 'NJAKOU ANDRÉ, ZAMBOU BERNADETTE ET AUTRES', 'Judgment': 'ARRET N°369/P DU 5 AOUT 1999'}"
