URL,text,page_title,page_label,metadata
https://www.juriafrica.com/lex/arret-31-cc-20-janvier-2000-11281.htm,"LA COUR,
Vu le mémoire ampliatif déposé le 05 novembre 1991 par Maître Thomas Byll Ndengue, Avocat à Yaoundé ;
Sur le moyen de cassation soulevé d'office pris de la violation de la loi, violation de l'article 5 de l'ordonnance n°72/4 du 26 août 1972, insuffisance de motifs ;
En ce que,
Par conclusions du 3 juin 1986 déposées pour la première fois en cause d'appel, l'appelant demandait à la Cour :
«Dire et juger que cette procuration donnée par Barrieu au sieur Feutcheu avait délimité les pouvoirs de ce dernier en définissant la nature de l'acte qu'il devait accomplir, à savoir, vendre l'immeuble ;
«Dire et juger que cette procuration qui est un mandat spécial ne saurait en aucun cas servir de mandat de représentation en justice par sieur Feutcheu ;
«Dire et juger qu'aux termes de l'article 2 du code de procédure civile et commerciale, la représentation en justice exige un pouvoir écrit, exprès et agréé par le juge ;
«Dire et juger que cette fin non-recevoir tirée du défaut de qualité peut être invoquée en tout état de cause... ;
«En conséquence voir déclarer nul et de nul effet l'exploit introductif d'instance à la présente procédure...»;
Attendu que pour répondre à ce chef de demande, l'arrêt attaqué se borne à énoncer :
«Considérant que le problème du mandat spécial de Feutcheu pour représenter Barrieu encore qu'il est versé au dossier une procuration de Barrieu à Feutcheu, ne se pose pas dès lors que l'Etude de Maîtres Simon et Betayene est constituée pour Barrieu» ;
Attendu qu'aux termes de l'article 2 du code de procédure civile et commerciale «.... Les parties pourront se faire représenter devant la juridiction par un mandataire de leur choix, muni d'un pouvoir écrit et exprès et agréé par le juge» ;
Attendu qu'en l'espèce le mandat donné par Barrieu à Feutcheu fait ressortir ce qui suit : «Mandat de vente...» ;
Attendu que toute décision judiciaire doit comporter des motifs suffisants à la justifier, l'insuffisance de motifs équivalant à un défaut de motifs ;
Attendu qu'en se contentant des énonciations sommaires susvisées pour répondre à la demande précise qui lui était faite de statuer sur la nature et l'étendue du mandat donné par Barrieu à Feutcheu, et alors que les avocats constitués par Barrieu ne l'avaient été qu'en cause d'appel, la Cour d'Appel du Centre a insuffisamment motivé sa décision ;
D'où il suit que le moyen est fondé et que l'arrêt attaqué encourt la cassation ;
PAR CES MOTIFS
CASSE ET ANNULE l'arrêt n°42/c rendu le 4 novembre 1987 par la Cour d'Appel de Yaoundé ;
REMET en conséquence la cause et les parties au même et semblable état où elles étaient avant ledit arrêt et, pour être fait droit, les renvoie devant la même Cour d'Appel autrement composée ;
RESERVE les dépens ;
ORDONNE qu'à la diligence de Monsieur le Procureur Général près la Cour suprême, le présent arrêt sera imprimé et transmis pour être transcrit sur les registres du Greffe de la Cour d'Appel de Yaoundé et que mention en sera faite en marge ou à la suite de la décision annulée.",ARRET_N_31_CC_DU_20_JANVIER_2000,0,"{'Court': 'COUR SUPRÊME DU CAMEROUN', 'Chamber': 'Chambre Civile et Commerciale', 'Section': '', 'Case': '', 'Appeal': '', 'Claimant': 'ABENA ADA NICOLAS', 'Against': 'C/', 'Defendant': 'ALBERT BARRIEU', 'Judgment': 'ARRET N°31/CC DU 20 JANVIER 2000'}"
