URL,text,page_title,page_label,category,metadata
https://www.juriafrica.com/lex/arret-127-16-septembre-1999-37825.htm,"ARRET N° 127/S DU 16 SEPTEMBRE 1999

LA COUR,
Vu le mémoire ampliatif déposé le 16 août 1989 par Maître Mendouga Ndongo, Avocat à Yaoundé ;
Sur le moyen unique de cassation pris en ses deux branches de la violation de l'article 5 de l'ordonnance n°72/4 du )6 août 1972, dénaturation, défaut de motifs, manque de base légale, ensemble violation de l'article 39 alinéa 2 du Code du travail ;
En ce que d'une part,
« Il est reproché au juge du fond d'avoir retenu k licenciement abusif au moyen d'un argument créé et arrêté par eux, notamment en retenant que la rupture était intervenue à la suite d'une information pour le moins normale et logique donnée par Nekdem aux Inspecteurs d'Etat à leur demande lors d'un contrôle ;
«Alors que ni la décision n°408/DF/DAAFMSAM/Fonader portant licenciement de Nekdem ni les écritures ultérieures du Fonader ne mentionnent un tel motif » ;
En ce que d'autre part,
« Il y a contrariété de motifs en ce sens que le jugement confirmé par l'arrêt attaqué, après avoir affirmé que le motif du licenciement n'est spécifié ni dans la décision de licenciement ni par voie d'écritures ultérieures du Fonds national de développement rural soutient par contre dans l'évolution-de sa démarche que le Fonader a commis un abus en se contentant des motifs aussi fantaisistes que gratuits pour essayer de se justifier outre le fait que telle contrariété dans la motivation qui est habituellement sanctionnée par la haute juridiction équivaut à un défaut de motifs : voir à cet effet (CS arrêt n°114 du 09 janvier 1975 Bull. n°32 p. 4610 Betchem Jean Guillaume c/ M.P.) ;
«Les juges du fond ont également eu tort de rejeter le concept de fautes lourdes utilisées dans la décision de licenciement et qui est présent en droit positif camerounais (article 35 alinéa 2b, 39 alinéa 2 et jurisprudence constante alors que les malversations du salarié prises d'abord dans leur graduation ont été justifiées (conclusions du 12 novembre 1985 notamment) ;
«La haute juridiction retiendra en définitive pour en tirer toutes les conséquences que paradoxalement à leur raisonnement, les juges du fond ont écarté les autres demandes du salarié, notamment celles liées aux indemnités de préavis et de licenciement pour ne faire droit qu'aux dommages-intérêts pour licenciement abusif » ;
Attendu que sous le couvert de la violation de la loi, le moyen tend à inviter la Cour Suprême qui n'est pas un troisième degré de juridiction à un nouvel examen des faits de la cause dont l'appréciation souveraine réservée aux juges du fond échappe à son contrôle ;
Attendu au demeurant que pour tirer argument de ce que Nekdem a été licencié à la suite d'une information normale donnée aux Inspecteurs d'Etat à leur demande lors d'un contrôle, le Tribunal de Grande instance du Mfoundi et à sa suite la Cour d'Appel ayant confirmé le jugement entrepris se sont basés sur le procès-verbal de la réunion du Conseil de discipline de la société en date du 25 août 1982 versé au dossier et dont il convient de reproduire un des passages :
«Le Président donne lecture de la note établie à l'occasion de la réunion du Conseil de discipline... il a été amplement lait mention des informations données à la mission d'Inspection Générale de l'Etat au Fonader par M. Nekdem dans des notes, informations qui ont dénoté un manque de loyalisme de sa part à l'égard du Fonader » ;
Attendu qu'en statuant ainsi qu'ils l'ont fait, les juges du fond ont souverainement apprécié les éléments à leur disposition, justifié leur décision et répondu au moyen ;
D'où il suit que le moyen est autant irrecevable qu'il n'est pas fondé ;
Et attendu que l'arrêt est par ailleurs régulier ;
PAR CES MOTIFS
REJETTE le pourvoi ;
ORDONNE qu'à la diligence de Monsieur le Procureur Général près la Cour Suprême, le présent arrêt sera imprimé et transmis pour être transcrit sur les registres du Greffe de la Cour d'Appel de Yaoundé et que mention en sera faite en marge ou à la suite de la décision attaquée.",ARRET_N_127_S_DU_16_SEPTEMBRE_1999,0,arret,"{'Court': 'COUR SUPRÊME DU CAMEROUN', 'Chamber': 'Chambre sociale', 'Section': '', 'Case': '', 'Appeal': '', 'Claimant': 'FOND NATIONAL DE DE DÉVELOPPEMENT RURAL', 'Against': 'C/', 'Defendant': 'NEKDEM MAURICE', 'Judgment': 'ARRET N° 127/S DU 16 SEPTEMBRE 1999'}"
