URL,text,page_title,page_label,metadata
https://www.juriafrica.com/lex/arret-11-26-octobre-2000-37505.htm,"LA COUR,
Vu le mémoire ampliatif déposé le 24 juillet 1996. par Maître Mongue-Din Ebénézer, Avocat à Douala ;
Sur le moyen unique de cassation modifié, pris de la violation de la loi, violation de l'article 5 de l'ordonnance n°72/4 du 26 août 1972, non-réponse aux conclusions, défaut de motifs, manque de base légale ;
En ce que,
« Les conclusions du demandeur du 05 septembre 1991 citées par l'arrêt attaqué posait le problème de la nature du contrat litigieux qualifié de contrat d'entreprise par le demandeur parce que dame Ndzana était payée sur commission, alors que l'ADD retient la notion de contrat de travail sans justifier que les conditions de l'article 1er de la loi n°92/007 du 14 août 1992 portant Code du travail sont réunies cet effet ;
« En outre le demandeur soulève le problème de l'application des dispositions du Code du travail dans le cas d'une entreprise définitivement fermée comme Cami-Export en l'espèce ;
« Or, de l'analyse de l'arrêt, il appert qu'il n'a jamais été répondu à ces conclusions du 05 septembre 1991.
« Ce mutisme de l'arrêt est également remarquable au niveau de la narration des faits de la cause ;
« En effet, pour tout récit, l'arrêt énonce que les faits de la présente procédure sont exposés dans l'arrêt avant-dire-droit n°218/ADD/S rendu le 03 avril 1992 par la Chambre sociale de la Cour d'Appel de céans... ;
« Or, il est constant que cet ADD a ordonné une enquête dont le rapport ne figure pas dans les motifs de l'arrêt attaqué, lors qu'aux termes de l'article 5 de l'ordonnance n°72/4 du 26 août 1972, toute décision judiciaire est motivée en fait et n droit ;
« Cette amputation ne met pas la Cour Suprême en mesure l'exercer son contrôle sur la régularité de cette décision, étant donné qu'aucun élément de fait ni de droit n'est articulé dans les motifs de cet arrêt » ;
Attendu qu'il résulte des dispositions du texte visé au moyen que toute décision de justice doit comporter en ellemême des éléments propres à la justifier ;
Que la jurisprudence en a déduit que la non réponse aux conclusions des parties équivaut à l'absence de motifs ;
Et que l'inobservation de ces prescriptions légales entraîne nullité d'ordre public de la décision concernée ;
Attendu en l'espèce que le jugement du 25 mars 1990 pour tous motifs énonce :
« Attendu que la Société défenderesse bien que régulièrement convoquée n'a pas cru devoir comparaître et n'a présenté aucun motif valable pour justifier son absence ;
« Qu'il échet de donner défaut contre elle par le présent jugement et faire droit à la demande » ;
Qu'en cause d'appel, la société Cami-Export SA qui n'a pas du reste assisté à l'enquête ordonnée par arrêt ADD n°218/S, a par l'organe de son conseil Maître Iyodi Mawo, avocat à Douala, produit des écritures datées du 05 septembre 1991 dont le dispositif suit :
«Au principal,
« Dire et juger qu'en cas de fermeture définitive de l'entreprise comme c'est le cas de Cami-Export, les formalités édictées par le Code du travail n'ont plus de droit de cité ;
« Infirmer le jugement entrepris ;
« Débouter partant dame Ndzana de ses demandes non fondées ;
« Subsidiairement,
« Constater qu'il s'agit d'un contrat d'entreprise et non un contrat de travail dame Ndzana étant payée sur commission ; « La débouter en outre de ses demandes pour ce motif ; « Infirmer le jugement entrepris» ;
Attendu qu'en se contentant de confirmer ledit jugement sans faire allusion aux conclusions dont s'agit produites pour la première fois en cause d'appel, le second juge n'a pas motivé sa décision violant ainsi le texte visé au moyen ;
D'où il suit que celui-ci est fondé et que l'arrêt attaqué encourt la cassation ;
PAR CES MOTIFS
Et sans qu'il soit besoin d'examiner le reste du moyen,
CASSE ET ANNULE l'arrêt n°80/S rendu le 25 novembre 1992 par la Cour d'Appel du Littoral à Douala ;
REMET en conséquence la cause et les parties au même et semblable état où elles étaient avant ledit arrêt et, pour être fait droit, les renvoie devant la même Cour d'Appel autrement composée ;
ORDONNE qu'à diligence de Monsieur le Procureur Général près la Cour Suprême, le présent arrêt sera imprimé et transmis pour être transcrit sur les registres du Greffe de la Cour d'Appel du Littoral à Douala et que mention en sera faite en marge ou à la suite de la décision annulée.",ARRET_N_11_S_DU_26_OCTOBRE_2000,0,"{'Court': 'COUR SUPRÊME DU CAMEROUN', 'Chamber': 'Chambre sociale', 'Section': '', 'Case': '', 'Appeal': '', 'Claimant': 'CONCLUSIONS., SOCIÉTÉ CAMI-EXPORT SA', 'Against': 'C/', 'Defendant': 'DAME NDZANA NÉE NTOLO MARIE-LOUISE', 'Judgment': 'ARRET N° 11/S DU 26 OCTOBRE 2000'}"
