URL,text,page_title,page_label,category,metadata
https://www.juriafrica.com/lex/arret-114-5-aout-1999-37130.htm,"ARRET N° 114/S DU 5 AOUT 1999

LA COUR,
Vu le mémoire ampliatif déposé le 16 août 1989 par Maîtres Viazzi et autres, Avocats associés à Douala ;
Sur le moyen unique de cassation, pris de la violation et fausse application des articles 150 alinéa 3 et 162 alinéa 1er du Code du travail qui stipule que :
« Si le défendeur, bien que ne comparaissant pas, a présenté ses moyens sous forme de mémoire la cause est jugée par décision réputée contradictoire » ;
«Dans les 15 jours du prononcé du jugement s'il est contradictoire, ou de sa signification s'il est par défaut ou réputé contradictoire appel peut être interjeté dans les formes prévues à l'article 147 » ;
«Il résulte de l'exposé des faits ci-dessus que la Cicam n'a jamais comparu et a fait valoir ses moyens de défense par conclusions ;
«Le jugement ne pouvait donc pas être qualifié comme étant contradictoire, mais plutôt réputé contradictoire ;
«En cause d'appel, l'exposante a pris soin de le souligner à l'attention de la Cour notamment dans ses conclusions du 03 mars 1988 en produisant aux débats ;
«Dans son bordereau de pièces du 27 septembre 1989 comportant les arrêts du 16 juillet 1986 et 14 juillet 1983 de la Cour Suprême publiés au TPOM n°636 du 16 novembre 1986 page 504 et n°636 du 16 novembre 1985 page 501, lesquels rapellent que :
«Ce n'est pas parce que les premiers juges ont qualifié le jugement de contradictoire qu'il l'est forcément dès lors qu'il s'avère que l'une des parties a comparu par mémoire. Ayant comparu par mémoire cette partie dispose d'un délai de 15 jours après la notification pour faire appel » ;
«En l'espèce, les délais d'appel n'avaient pas encore commencé à courir puisque le jugement n'avait pas été signifié et celui-ci devait automatiquement être qualifié comme étant réputé contradictoire pour les raisons ci-dessus exposées et de plus, les juges d'appel ainsi que leur a demandé la concluante dans ses écritures, se devaient de requalifier le jugement ;
«En ne le faisant donc pas l'arrêt a violé les textes visés au moyen et encourt cassation » ;
Attendu que s'agissant de la représentation des parties devant le Tribunal, l'article 149 alinéa 1 du Code du travail dispose :
«Les parties sont tenues de se rendre devant le Tribunal, aux lieu, jour et heure fixés. Elles peuvent se faire assister ou représenter, soit conformément au droit commun, soit par un employeur ou travailleur appartenant à la même branche d'activité, soit encore par un représentant des organisations syndicales auxquelles elles sont affiliées...» ;
Attendu par ailleurs qu'aux termes de l'article 2 alinéa 1 du Code de procédure civile et commerciale les parties pourront devant toutes les juridictions, agir et se défendre elles-mêmes, verbalement ou par le ministère des avocats défenseurs ;
Attendu qu'il ressort du dossier que devant le premier juge, la Société Cicam a été régulièrement représentée par Maître Viazzi, Avocat-défenseur à Douala ;
Qu'ainsi la décision ne pouvait qu'être contradictoire à son égard ;
D'où il suit que le moyen n'est pas fondé ;
PAR CES MOTIFS
REJETTE le pourvoi ;
ORDONNE qu'à la diligence de Monsieur le Procureur Général près la Cour Suprême, le présent arrêt sera imprimé et transmis pour être transcrit sur les registres du Greffe de la Cour d'Appel de Douala et que mention en sera faite en marge ou à la suite de la décision attaquée.",ARRET_N_114_S_DU_5_AOUT_1999,0,arret,"{'Court': 'COUR SUPRÊME DU CAMEROUN', 'Chamber': 'Chambre sociale', 'Section': '', 'Case': '', 'Appeal': '', 'Claimant': 'SOCIÉTÉ CICAM', 'Against': 'C/', 'Defendant': 'YETGANG PIERRE', 'Judgment': 'ARRET N° 114/S DU 5 AOUT 1999'}"
