URL,text,page_title,page_label,category,metadata
https://www.juriafrica.com/lex/arret-56-23-juillet-1998-11554.htm,"ARRET N°56/L DU 23 JUILLET 1998

LA COUR,
Sur le mémoire ampliatif déposé le 20 février 1991 par Maître Mbeseha Timothy, Avocat à Buéa ;
Sur le moyen de cassation amendé, pris de la violation de la loi, violation de l'article 16 de l'ordonnance n°74/1 du 06 juillet 1974 fixant le régime foncier modifié par la loi n°19 du 28 novembre 1983, incompétence ratione materiae
En ce que la Cour d'Appel de Buéa a confirmé le jugement entrepris de la Bwenga Customary Court, qui a statué sur l'affaire opposant les parties alors qu'il s'agissait d'un différend portant sur la propriété des parcelles de terrain non immatriculées ;
En statuant ainsi, la susdite juridiction e violé les dispositions du texte susvisé exposant sa décision à la censure de la haute juridiction ;
Attendu qu'aux termes des dispositions de l'article 16 de l'ordonnance n°74/1 du 06 juillet 1974 fixant le régime foncier, modifiée par la loi n°19 du 26 novembre 1983, relève des commissions consultatives présidées par les autorités administratives, la revendication ou contestation d'un droit de propriété sur les terrains non immatriculés introduite par les collectivités ou les individus ;
Attendu en l'espèce qu'il ressort du dossier que Chief Paul Nango, défendeur en instance avait soulevé in limine bris, l'incompétence de la juridiction traditionnelle saisie en déclarant que «je ne veux avoir une affaire avec le demandeur devant ce Tribunal parce que j'ai déjà enregistré l'affaire devant la Commission Consultative de Tiko» et que pour statuer au fond le juge d'instance avait rejeté cette exception d'incompétence parce que le défendeur n'avait «pas produit des preuves qu'il a déjà saisi la Commission Consultative» ;
Attendu qu'en statuant ainsi sur ce litige portant sur la propriété d'un immeuble non immatriculé, le premier juge e violé le texte visé au moyen ;
Qu'il s'ensuit que s'a décision est nulle et de nul effet ;
Attendu qu'en confirmant purement et simplement le jugement entrepris sur ce point la Cour d'Appel de Buéa s'est appropriée les vices reprochés au premier juge, rendant ainsi sa décision également nulle et de nul effet ;
D'où il suit que le moyen est fondé et que l'arrêt querellé encourt l'annulation ;
PAR CES MOTIFS
CASSE ET ANNULE l'arrêt n° CASWP/CC/88 rendu le 16 mars 1989 par la Cour d'Appel de Buéa ;
REMET en conséquence la cause et les parties au même et semblable état où elles étaient avant ladite décision et, pour être fait droit, les renvoie devant la même Cour d'Appel autrement composée ;
RESERVE les dépens ;
ORDONNE qu'à la diligence de Monsieur le Procureur Général près la Cour Suprême, le présent arrêt sera imprimé et transmis pour être transcrit sur les registres du greffe de la Cour d'Appel de Buéa et que mention en sera faite en marge ou à la suite de la décision annulée.",ARRET_N_56_L_DU_23_JUILLET_1998,0,arret,"{'Court': 'COUR SUPRÊME DU CAMEROUN', 'Chamber': 'Chambre Traditionnelle', 'Section': '', 'Case': '', 'Appeal': '', 'Claimant': 'CHIEF PAUL NANGO', 'Against': 'C/', 'Defendant': 'RUTH NWANKO EFANDA TAMA', 'Judgment': 'ARRET N°56/L DU 23 JUILLET 1998'}"
