URL,text,page_title,page_label,category,metadata
https://www.juriafrica.com/lex/arret-18-cc-26-novembre-1998-11485.htm,"ARRET N°18/CC DU 26 NOVEMBRE 1998

LA COUR,
Vu la lettre en date du 25 novembre 1994 du Président de la Cour d'Appel d'Ebolowa ;
Vu les réquisitions en date du 5 décembre 1994 de Monsieur le Procureur Général près la Cour suprême ;
Attendu que par la lettre susvisée, le Président de la Cour d'Appel d'Ebolowa a saisi la Cour suprême aux fins de renvoi à une autre Cour d'Appel de l'affaire opposant la société Hevecam à dame veuve Waiz et autres ;
Attendu qu'il ressort du dossier que cette demande est régulière comme conforme aux dispositions combinées des articles 159(8), 171 du code de procédure civile et commerciale et 9(4) du statut de la magistrature ;
Attendu en effet que l'article 159(8) du code de procédure civile et commerciale dispose que tout juge peut être récusé «s'il a précédemment connu du différend comme juge ou comme arbitre» ;
Que par ailleurs, l'article 171 du même code ajoute que «tout magistrat qui saura qu'il existe en sa personne une cause de récusation sera tenu d'en saisir la Cour qui décidera s'il doit s'abstenir. Dans l'affirmative, l'affaire sera renvoyée à une autre juridiction» ;
Qu'enfin l'article 9(4) du statut de la magistrature prescrit «qu'aucun magistrat ne peut connaître des voies de recours intentées à l'encontre d'une décision rendue par un magistrat hiérarchiquement supérieur» ;
Attendu en l'espèce que le Tribunal de Grande instance de Kribi a rendu sous la présidence de Monsieur Ndeby Pondy, alors magistrat du 4e grade le jugement n°3/civ du 25 janvier 1985 qui a été frappé d'appel ;
Que statuant sur cet appel, la Cour d'Appel d'Ebolowa siégeant sous la présidence de Monsieur Youmsi Joseph a rendu l'arrêt de défaut n°16/civ/CAB du 8 mars 1991 frappé d'opposition ;
Que celle-ci encore pendante devant la même Cour d'Appel que préside Monsieur Ndeby Pondy, auteur du jugement appelé ne peut être jugée ni par ce magistrat, ni par aucun de ses vice-présidents, tous du troisième grade, conformément aux textes susvisés ;
Qu'il y a lieu en conséquence d'ordonner le renvoi demandé ;
PAR CES MOTIFS
ORDONNE le renvoi de l'affaire dont s'agit devant la Cour d'Appel du Centre à Yaoundé ;
RESERVE les dépens ;
ORDONNE qu'à la diligence de Monsieur le Procureur Général près la Cour suprême, le présent arrêt sera imprimé et transmis pour être transcrit sur les registres du Greffe de la Cour d'Appel du Sud à Ebolowa.",ARRET_N_18_CC_DU_26_NOVEMBRE_1998,0,arret,"{'Court': 'COUR SUPRÊME DU CAMEROUN', 'Chamber': 'Chambre Civile et Commerciale', 'Section': '', 'Case': '', 'Appeal': '', 'Claimant': 'HEVECAM', 'Against': 'C/', 'Defendant': 'DAME VEUVE WAIZ ET AUTRES', 'Judgment': 'ARRET N°18/CC DU 26 NOVEMBRE 1998'}"
