URL,text,page_title,page_label,metadata
https://www.juriafrica.com/lex/arret-67-soc-05-juin-2014-32822.htm,"L'an deux mille quatorze et le cinq juin;
La Cour Suprême statuant en matière Sociale ;
En son audience publique ordinaire a rendu l'arrêt dont la teneur suit ;
ENTRE
Société de SURVEILLANCE CAMEROUN, demanderesse en cassation, représentée par Maître Henri JOB, Avocat à Douala;
D'UNE PART
ET ;
NJI SALIFOU LAMARO MOFIRA, défendeur à la cassation, représenté par Maître MBAMI Augustin, Avocat à Douala ;
D'AUTRE PART
En présence de Monsieur OUMAROU BAMANGA.
Avocat Général près la Cour Suprême ;
Statuant sur le pourvoi formé par, Maître Henri, Avocat à Douala, agissant au nom et pour le compte de la société de SURVEILLANCE CAMEROUN , suivant déclaration faite en -date du 31- mars 2011, au Greffe de la Cour d'Appel du Littoral, en cassation contre l'arrêt N° 103/SOC rendu le 23 mars 2011 par cette même juridiction statuant en matière sociale dans la l'instance opposant sa cliente à NJI SALIFOU LAMARO MOFIRA ;
LA COUR
Après avoir entendu la lecture du rapport, Monsieur Christian MBALE GOETHE, substituant Monsieur NJIEMOUN MAMA, Conseiller à la Cour Suprême empêché ;
Vu les conclusions de Monsieur Martin RISSOUK à MOULONG, Procureur Général près la Cour Suprême ;
Et après en avoir délibéré conformément à la loi ;
Vu le mémoire ampliatif déposé le 1ER novembre 2011 par Maître Henri JOB, Avocat à Douala ;
Sur le premier moyen de cassation tiré de la violation de la loi, violation de l'article 133 de la loi N°92/007 du 14 août 1992 portant code du travail ensemble la violation de l'article 7 de la loi N°2006/015 du 29 décembre 2006 portant organisation judiciaire — violation des règles de composition des juridictions statuant en matière sociale ;
« En ce que l'article 7 de la loi N°2006/015 du 29 décembre 2006 dispose que :
« Toute décision judiciaire est motivée en fait et en droit. L'inobservation de la présente disposition entraîne nullité d'ordre public de la décision » ;
« Que quant à l'article 133 du code du travail également visé au moyen, il prévoit que :
« (1) les tribunaux statuant en matière sociale se composent :
« - d'un magistrat, président ;
« - d'un assesseur employeur et d'un assesseur employé choisis parmi ceux figurant sur les listes établies conformément à l'article 134 ci-dessous ;
« - d'un greffier » ;
« Que cet article 133 du code du travail impose donc la présence d'un assesseur employeur et d'un assesseur travailleur dans la composition de toute juridiction statuant en matière sociale, sauf dans l'hypothèse où ladite juridiction statue hors la présence de l'un ou des deux assesseurs après leur carence dûment justifiée, et après que deux convocations leur soient régulièrement adressées et restées sans suite ;
« Attendu qu'à la lecture de l'arrêt dont pourvoi rendu par la Cour d'Appel du Littoral en matière sociale, il apparaît dans ses qualités que celui a été rendu par :
« -Madame DORCAS MUKWADE NGANDO, Vice-président de la Cour d'Appel du Littoral: Président
« - Monsieur HAROUNA BAKO, Vice-président de la Cour d'Appel du Littoral Membre ;
« Monsieur BONNY Paul Vice-président de la Cour d'Appel du Littoral Membre :
« - avec l'assistance de Maître AMIDJANG NADEGE R, Greffier » ;
Qu'il ressort de cet arrêt que la cour d'appel du Littoral a statué en l'absence des assesseurs employeur et travailleur et sans qu'il soit fait été si les assesseurs ont été convoqués, et leur carence justifiée ;
« Or, aux termes d'une jurisprudence constante de la Cour Suprême de Céans dans les arrêts N°34/S du 24 janvier 1985, 56/s du 4 avril 1985, 74/ S du 6 juin 1985 et 8/S du 09 novembre 1992, la Cour Suprême exige des juridictions statuant en matière sociale de justifier les diligences prescrites pour la convocation des assesseurs ;
« Que l'arrêt dont pourvoi a donc été rendu sans la présence des assesseurs et sans mention de leur carence dûment justifiée, et en violation de l'article 133 du code du travail ;
« Qu'or toute décision de justice doit se suffire à elle-même, et pour ce faire être motivée en fait et en droit ;
« Que l'inobservation de ces dispositions comme c'est le cas en l'espèce, entraîne nullité d'ordre public, ainsi que prescrit par l'article 7 de la loi N°2006/015 du 29 décembre 2006 portant organisation judiciaire ;
« Que l'arrêt dont pourvoi rendu sans la présence des assesseurs et sans mention dans ses qualités de la carence dûment constatée de leur absence, ne contient pas les motifs propres à le rendre régulier, viole par voie de conséquence l'article 7 de la loi N° 2006/015 du 29 décembre portant organisation judiciaire visée au moyen, et encourt cassation de ce fait » ;
Alors qu'aux termes de l'article 133 du code de travail « les tribunaux statuant en matière sociale se composent :
« - d'un magistrat, président ;
« - d'un assesseur employeur et d'un assesseur employé choisis parmi ceux figurant sur les listes établies conformément à l'article 134 ci-dessous ;
« - d'un greffier » ;
Attendu qu'il en résulte que le terme tribunal utilisé par le texte susvisé est générique et désigne aussi bien les juridictions d'instance que celles des Cours d'Appel ;
Attendu que les règles relatives à la composition des juridictions étant d'ordre public, leur violation entraîne la nullité de la décision rendue ;
Attendu en l'espèce qu'il ressort des qualités de l'arrêt attaqué que la Cour d'Appel du Littoral statuant en matière sociale était composée de :
« -Madame DORCAS MUKWADE NGANDO,
Vice-président de la Cour d'Appel du Littoral: Président ;
« - Monsieur HAROUNA BAKO, Vice-président de la Cour d'Appel du Littoral Membre ;
« Monsieur BONNY Paul Vice-président de la Cour d'Appel du Littoral Membre ;
« - avec l'assistance de Maître AMIDJANG NADEGE R, Greffier » ;
D'où il suit que le moyen est fondé et que ledit arrêt encourt la cassation ;
Sur l'évocation :
Attendu que l'affaire n'est pas en état d'être jugée au fond au sens de l'article 67(2) de la loi N° 2006/016 du 29 décembre 2006 fixant l'organisation et le fonctionnement de la Cour Suprême ;
Qu'il n'y a a donc pas lieu à évocation, mais à renvoi devant la même Cour d'Appel autrement composée pour lui permettre de vider régulièrement sa saisine ;
PAR CES MOTTES
Sans qu'il y ait lieu d'examiner le deuxième moyen de pourvoi ;
Casse et annule l'arrêt N° l03/Soc rendu le 23 mars 2011 par la Cour d'Appel du Littoral ;
Remet en conséquence la cause et les parties au même et semblable état où elles étaient avant ledit arrêt ;
Et pour être fait droit les renvoie devant la même Cour autrement composée ;
Ordonne qu'à la diligence de Monsieur le Greffier en Chef de la Chambre Judiciaire de la Cour Suprême, une expédition du présent arrêt sera transmise au Procureur Général près la Cour d'Appel du Littoral et une autre au Greffier en Chef de ladite Cour pour mention dans leurs registres respectifs ;
Ainsi jugé et prononcé par la Cour Suprême en son audience publique ordinaire du cinq juin deux mille quatorze en la salle des audiences de la Cour où siégeaient :
MM:
Dagobert BISSECK, Président de la section Sociale, PRESIDENT
ZIBI NSOE Toussaint, CONSEILLER
Christian MBALE GOETHE, CONSEILLER
En présence de Monsieur OUMAROU BAMANGA, Avocat Général, occupant le banc du Ministère public ;
Et avec l'assistance de Maître Margaret MUSONGO, Greffier ;
En foi de quoi le présent arrêt a été signé par le Président, les Conseillers et le Greffier ;",ARRET_N_67_SOC_DU_05_JUIN_2014,0,"{'Court': 'COUR SUPREME DU CAMEROUN', 'Chamber': 'CHAMBRE JUDICIAIRE', 'Section': 'SECTION SOCIALE', 'Case': 'DOSSIER N° 77/S/2011', 'Appeal': 'POURVOI n° 50/GCA/Lit du 31 mars 2011', 'Claimant': 'SOCIÉTÉ DE SURVEILLANCE CAMEROUN', 'Against': 'C/', 'Defendant': 'NJI SALIFOU LAMARO MOFIRA', 'Judgment': 'ARRÊT N° 67/SOC DU 05 JUIN 2014'}"
