URL,text,page_title,page_label,category,metadata
https://www.juriafrica.com/lex/arret-289-p-24-aout-2000-9463.htm,"ARRET N°289/P DU 24 AOUT 2000

LA COUR,
Vu le mémoire ampliatif déposé le 27 avril 2000 par Maître Ndjana Ndjana, Avocat à Yaoundé ;
Sur le premier moyen de cassation pris en ses deux branches de l'insuffisance de motifs, violation de l'article 5 de l'ordonnance n°72/4 du 26 août 1972, ensemble l'article 1er de la loi n°58/203 du 26 décembre 1958 ;
En ce que, «D'une part,
«L'arrêt de la Cour relativement aux accusés notera ce qui suit :
«Ngambesso Jean, alias Longambes... appelant comparant assisté de Maître Efon Guy Huissier de justice stagiaire à Bertoua, désigné d'office, Adjaba André alias Liberot même assistance, Kombo Antoine Bernard quant à lui sera assisté de sieur Nyo'o Daniel, comptable à Bertoua ;
« Quant à Messelang dit Laurent, accusé de vol aggravé, détenu suivant mandat de dépôt du 07 décembre 1987 il sera dit : « intimé comparant plaidant par lui-même ;
« Cette démarcation entre les accusés a abouti à la violation de l'article 1er de la loi n°58/203 du 26 décembre 1958 laquelle, en matière criminelle exige que les accusés soient assistés de conseil ;
« La Cour d'Appel a opéré une discrimination n'ayant aucun justificatif légal pensant que parce qu'intimé Messelang Minkombe ne devait plus bénéficier de l'assistance d'un conseil » ;
En ce que d'autre part :
« L'arrêt de la Cour suite à la violation ci-dessus constatée aboutira inéluctablement à une autre violation grave ; statuer sur le sort de Messelang Minkombe alors même que l'arrêt était rendu contradictoirement à l'égard des parties ;
«Il 'y a ici insuffisance de motifs et par conséquent violation de l'article 5 de l'ordonnance n°72/4 du 26 août 1972 portant organisation judiciaire du Cameroun ;
« La Cour d'Appel infirmera la décision rendue par le Tribunal en ce qui concerne Kombo Antoine et Adjaba André, la confirmera, quant à Ngambesso, Quid de Messelang Minkombe, il y a un vide. La Cour suprême cassera et annulera l'arrêt de la Cour d'Appel et renverra les parties par devant autre Cour d'Appel » ;
Attendu qu'il n'apparaît nulle part du dossier de procédure que Messelang Minkombe a relevé appel du jugement d'instance ;
Qu'en ne relevant pas appel, ledit Messelang a acquiescé à cette décision ;
Qu'en appel nul n'était besoin de lui désigner un conseil, ni de statuer à nouveau sur son sort ;
D'où il suit que le moyen en ses deux branches n'est pas fondé ;
Sur le second moyen de cassation pris de « l'application de la loi la plus douce : l'article 320 du code pénal (nouveau) » ;
En ce que,
« Les données factuelles en cause font état d'une entente préalable des co-accusés, laquelle a abouti à la soustraction frauduleuse des biens, propriété de Mbesso Monique ;
« Les circonstances aggravantes du vol ici étant l'escalade et l'effraction extérieure iceux ayant choisi de casser une fenêtre à la hauteur ;
«L'article 320 nouveau tel disposé dans la loi n°90/061 du 19 décembre 1990 portant modification de certaines dispositions du code pénal de manière efficiente établit : « Les peines de l'article 318 sont doublées si le vol a été commis soit :
«a) à l'aide de violence,
«b) avec port d'arme,
«c) par effraction extérieure, par escalade ou à l'aide d'une fausse clé,
«d) à l'aide d'un véhicule automobile... » ;
« Le pourvoi étant une voie de recours, la cause étant encore pendante au regard de l'effet suspensif du pourvoi, la loi nouvelle étant intervenue après décision dont réexamen, . le demandeur au pourvoi sollicite cassation pour ce moyen » ;
Attendu que l'arrêt attaqué, étant rendu, le 6 avril 1989 et le texte de loi dont il est demandé application datant du 19 décembre 1990, le juge d'appel ne pouvait appliquer un texte de loi alors inexistant ;
D'où il suit que le moyen manque en fait ;
Et attendu que l'arrêt attaqué est régulier;
PAR CES MOTIFS
REJETTE le pourvoi ;
CONDAMNE le demandeur aux dépens ;
ORDONNE qu'à la diligence de Monsieur le Procureur Général près la Cour suprême, le présent 'arrêt sera imprimé et transmis pour être transcrit sur les registres du Greffe de la Cour d'Appel de l'Est et que mention en sera faite en marge ou à la suite de la décision attaquée.",ARRET_N_289_P_DU_24_AOUT_2000,0,arret,"{'Court': 'COUR SUPRÊME DU CAMEROUN', 'Chamber': 'Chambre Pénale', 'Section': '', 'Case': '', 'Appeal': '', 'Claimant': 'NGAMBESSO JEAN', 'Against': 'C/', 'Defendant': 'MINISTÈRE PUBLIC ET MBESSO MONIQUE', 'Judgment': 'ARRET N°289/P DU 24 AOUT 2000'}"
