URL,text,page_title,page_label,category,metadata
https://www.juriafrica.com/lex/arret-02-cj-cs-28-fevrier-2015-33277.htm,"ARRÊT N° 02/S/CJ/CS DU 28 FÉVRIER 2015

L'an deux mille dix neuf et le vingt huit février;
La Cour Suprême statuant en matière Sociale ;
En son audience publique ordinaire a rendu l'arrêt dont la teneur suit ;
ENTRE
AES SONEL, MANOU Jacques, demandeurs en cassation, ayant respectivement pour conseils Maître Jean Calvin BILONG, Avocat à Yaoundé et Maître KOUMAI OUBA, Avocat à Yaoundé ;
D'UNE PART
ET ;
MANOU Jacques, AES SONEL, défendeurs à la cassation, ayant respectivement pour conseils Maître KOUMAI BOUBA, Avocat à Yaoundé et Maître Jean Calvin BILONG, Avocat à Yaoundé ;
D'AUTRE PART
En présence de Monsieur SUH Alfred FUSI, Avocat Général près la Cour Suprême ;
Statuant sur le pourvoi formé par, Maître Jean Calvin BILONG, agissant au nom et pour le compte de la Société AES-SONEL, suivant déclaration faite par lettre en date du 19 mai 2006, enregistrée le 23 suivant au greffe de la Cour d'Appel du Centre sous le n° 563, en cassation de l'arrêt n° 121/SOC rendu le 10 Mai 2006 par ladite Cour statuant en matière sociale dans l'instance opposant sa cliente à MANOU Jacques;
Par une autre déclaration faite le 7 Août 2006, au greffe de la Cour d'Appel du Centre le nommé MANOU Jacques, agissant en son nom et pour son propre compte, s'est pourvu en cassation contre cette même décision ;
LA COUR
Après avoir entendu en la lecture de son rapport, Monsieur MAMAR PABA SALE, Conseiller à la Cour Suprême;
Vu les conclusions de Monsieur NDJODO Luc, Procureur Général près la Cour Suprême ;
Et après en avoir délibéré conformément à la loi ;
Vu le pourvoi formé le 19 mai 2006 ;
Vu le pourvoi formé le 07 août 2006 ;
Attendu que les pourvois étant connexes, il y a lieu de les joindre ;
Sur le pourvoi de MANOU Jacques ;
Attendu que par lettre n° 411/GCS/SS du 6 Mai 2014, le greffier en chef de la Cour Suprême a avisé Maître KOUMAI SOUSA conseil DE MANOU Jacques que conformément aux dispositions des articles 53 alinéa 1 et 54 alinéas 1 et 2 de la loi n° 2006/016 du 29 décembre 2006 fixant l'organisation et le fonctionnement de la Cour Suprême, il disposait d'un délai de trente (30) jours à compter de la date suivant la date de cette mise en demeure, à peine de déchéance, pour faire parvenir en autant d'exemplaires qu'il y a de parties plus cinq (5) audit greffier son mémoire ampliatif articulant et développant les moyens de droit produits à l'appui du pourvoi;
Attendu que la lettre dont s'agit a été notifiée le 10 Juin 2014 par exploit de même date de Maître NGONGANG SIME Alain, Huissier de Justice à Yaoundé, à Maître KOUMAI BOUBA qui n'a pas obtempéré jusqu'à ce jour, alors que le délai imparti a expiré le 11 juillet 2014 ;
D'où il suit que MANOU Jacques doit être déclaré déchu de son pourvoi pour défaut de mémoire ampliatif ;
Sur le pourvoi de la Société AES-SONEL :
Vu le mémoire ampliatif déposé le 10 janvier 2007 par Maître Jean Calvin BILONG, avocat à Yaoundé ;
Sur les deux moyens de cassation réunis présentés comme suit :
«1-Manque de base légale : Violation de l'article 7 de la loi n°2006/015 du 29 décembre 2006 portant organisation judiciaire.
« Attendu qu'aux termes de l'article 7 de la loi n° 2006/015 du 19 décembre 2006 portant organisation judiciaire « Toute décision judiciaire est motivée en fait et en droit. L'inobservation de la présente disposition entraine nullité d'ordre public de la décision » ;
« Que la jurisprudence constante de la Cour Suprême pose le principe selon lequel la contrariété entre les motifs équivaut à un défaut de motifs et donne droit à cassation ;
« Qu'il s'ensuit donc que toute décision motivée en fait et en droit ; selon l'exigence légale, ne doit pas comporter de contradiction ou contrariété dans les motifs ;
« Mais attendu que la Cour d'Appel du Centre pour rendre l'arrêt n° 121/Soc du 10 Mai 2006 a estimé que le vol d'un bidon de 12 litres d'huile qui était reproché à sieur MANOU ne saurait être qualifié de faute lourde comme l'a fait le premier juge, mais simplement de perte de confiance au regard de « la modicité de l'objet de la tentative de vol « ; (4e rôle verso, dernier paragraphe).
« Que pourtant, la Cour d'Appel du Centre a rappelé que la faute lourde est une faute grave qui rend intolérable le maintien du lien contractuel », mais paradoxalement refuse d'y intégrer le vol pour une prétendue « modicité de l'objet du vol » alors même qu'il est constant en droit positif que le vol au préjudice de l'employeur constitue une faute lourde et que la qualification juridique du vol comme « faute lourde » est indépendante de la valeur de la chose volée ;
« Attendu que la motivation de la Cour d'Appel comporte ainsi une contrariété dans les motifs en ce que la Cour ne peut en même temps qu'elle reconnait l'existence du vol ou de la tentative de vol constitutifs de faute lourde, prétendre en l'espèce que le vol reproché à sieur MANOU constitue plutôt une perte de confiance au regard de la modicité de l'objet du vol
« Qu'il s'ensuit donc que l'arrêt n° 121/Soc du 10 Mai 2006 rendu par la Cour d'Appel du Centre encourt cassation » ;
Attendu que pour annuler le jugement entrepris basé sur la qualification des faits reprochés au nommé MANOU Jacques, la Cour d'appel énonce dans l'arrêt attaqué:
« Qu'à la suite de ces faits MANOU Jacques a été licencié le 31 juillet 2003 pour perte de confiance ;
« --Mais considérant que le premier juge en qualifiant de vol les faits tels que relatés par la Société AES-SONEL et en affirmant qu'ils constituent une faute lourde les a mal appréciés, l'employeur ayant lui-même à cause du doute qui planait en la cause, évité de licencier l'appelant pour vol ;
« Que par ailleurs, l'intimée n'ayant pas indiqué dans la lettre de licenciement litigieux que la faute imputable à MANOU était lourde, il ne revenait pas au juge de le faire ;
Qu'en se comportant ainsi ce juge a mal motivé sa décision qui mérite annulation en application des dispositions de l'article 5 de l'Ordonnance n° 72/4 du 26 août portant organisation judiciaire et de ses textes modificatifs subséquent » ;
« Manque de base légale : Violation de l'article 7 de la loi n° 2006/015 du 29 décembre 2006 portant organisation judiciaire.
« Attendu qu'aux termes de l'article 7 de la loi n° 2006/015 du 29 décembre 2006 portant organisation judiciaire « Toute décision judiciaire est motivée en fait et en droit. L'inobservation de la présente disposition entraine nullité d'ordre public de la décision » ;
« Qu'il s'ensuit donc que toute décision judiciaire motivée doit se fonder sur les arguments de droit ou légaux ;
« Mais attendu que dans l'arrêt dont pourvoi, la Cour d'Appel relève qu'il n'appartenait pas au premier juge de préciser que la faute imputable à MANOU était lourde ; 4e rôle, dernier paragraphe et verso paragraphe) ;
« Que pourtant, il est de principe en droit positif que les juges de fond constatant l'existence des 'dits constituant la faute et en appréciant la gravité sous le contrôle de la Cour Suprême ; que le premier juge, au regard de ce principe avait donc la latitude d'apprécier la gravité de la faute de Mr. MANOU;
« Qu'en statuant donc comme elle l'a fait, la Cour d'Appel a violé ce principe, n'a pas légalement justifié sa décision et ne lui a donné aucune base légale en ce qu'elle ne précise pas le texte de loi ou le principe sur lequel elle se fonde ;
« Qu'il s'ensuit donc que l'arrêt n° 121/Soc du 10 Mai 2006 rendu par la Cour d'Appel du Centre encourt cassation »
Attendu Les deux moyens de cassation réunis sont inopérants
Attendu que l'arrêt attaqué ayant été rendu le 10 mai 2006, il ne saurait lui être fait grief d'avoir violé la loi n° 2006/015 du 29 décembre 2016 fixant l'organisation et le fonctionnement de la Cour Suprême qui n'était pas encore en vigueur ;
Qu'il s'ensuit que les deux moyens sont irrecevables et le pourvoi encourt le rejet ;
PAR CES MOTIFS
Joint les pourvois ;
Déclare MANOU Jacques déchu de son pourvoi pour défaut de mémoire ampliatif ;
Condamne Maître KOUMAI BOUBA à une amende civile de 50.000 (cinquante mille) francs ;
Rejette le pourvoi de la Société AES-SONEL ;
Ordonne qu'à la diligence du Greffier en Chef de la Chambre Judiciaire de la Cour Suprême, une expédition du présent arrêt sera transmise au Procureur Général près la Cour d'Appel du Centre et une autre au Greffier en Chef de ladite Cour pour mention dans leurs registres respectifs ;
Ainsi jugé et prononcé par la Cour Suprême en son audience publique ordinaire du vingt huit février deux mille dix neuf en la salle des audiences de la Cour où siégeaient :
MM:
JEATSA Jakob, Président de la section Sociale, Président
Francis Claude Michel MOUKOURY, Conseiller
MAMAR PABA SALE, Conseiller
ALIMETA Alain Sainclair, Greffier
En présence de Monsieur SUH Alfred FUSI, Avocat Général, occupant le banc du Ministère public ;
Et avec l'assistance de Maître ALIMETA Alain Sainclair, Greffier ;
En foi de quoi le présent arrêt a été signé par le Président, les Conseillers et le Greffier ;
En approuvant ligne(s) Mots)
rayé(s) nul(s) et renvoi(s) en marge ;
LE PRESIDENT, LES CONSEILLERS, LE GREFFIER",ARRET_N_02_S_CJ_CS_DU_28_FEVRIER_2015,0,arret,"{'Court': 'COUR SUPREME DU CAMEROUN', 'Chamber': 'CHAMBRE JUDICIAIRE', 'Section': 'SECTION SOCIALE', 'Case': 'DOSSIER N° 10/S/06-07', 'Appeal': 'Pourvoi n° du 2 mai 2006 et 07 août 2006', 'Claimant': 'AES-SONEL MANOU JACQUES', 'Against': 'C/', 'Defendant': 'MANOU JACQUES AES-SONEL', 'Judgment': 'ARRÊT N° 02/S/CJ/CS DU 28 FÉVRIER 2015'}"
