URL,text,page_title,page_label,metadata
https://www.juriafrica.com/lex/arret-198-civ-23-juin-2011-8796.htm,"L'an deux mille onze et le vingt-trois du mois de juin ;
La Cour Suprême, Chambre Judiciaire, Section Civile, siégeant au Palais de Justice de Yaoundé ;
A rendu en audience publique ordinaire, l'arrêt dont la teneur suit :
ENTRE :
Société SATOM, demanderesse à la cassation, représentée par la Société Civile Professionnelle VIAZZI Pierre Aubriet, Avocats à Douala ;
D'UNE PART
ET :
Commercial Bank of Cameroon (C.B.C.), défenderesse à la cassation, représentée par Me KAMGANG Jean Paul, Avocat à Douala ;
D'AUTRE PART
En présence de Monsieur Martin Hilman EGBE ACHUO, Avocat Général près la Cour Suprême ;
Statuant sur le pourvoi formé par Me VIAZZI, avocat associé à Douala, agissant au nom et pour le compte de la société SATOM, suivant lettre enregistrée le 23 septembre 2008 au greffe de la Cour d'Appel du Littoral sous le n° 1801, en cassation de l'arrêt n° 122/CC rendu le 19 septembre 2008 par la même Cour statuant en matière civile et commerciale dans l'instance opposant sa cliente à la C.B.C. ;
LA COUR
Après avoir entendu en la lecture de son rapport Monsieur Dagobert BISSECK, Conseiller à la Cour Suprême ;
Vu les conclusions de Monsieur Martin RISSOUK à MOULONG, Procureur Général ;
Et après en avoir délibéré conformément à la loi ;
Vu l'article 42 de la loi n° 2006/016 du 29 décembre 2006 fixant l'organisation e-L le fonctionnement de la Cour Suprême ;
Attendu qu'aux termes du texte susvisé : « En matière judiciaire, le pourvoi est formé, à peine d'irrecevabilité, par déclaration au greffe de la juridiction dont émane la décision » ;
Attendu que par lettre enregistrée le 23 septembre 2008 au greffe de la Cour d'appel du Littoral sous le n° 1801, Me VIAZZI, avocat associé à Douala, agissant au nom et pour le compte de la société SATOM, s'est pourvu en cassation contre l'arrêt n° 122/C rendu le 19 septembre 2008 par cette même juridiction dans l'instance civile opposant sa cliente à la C.B.C. ;
Attendu en l'espèce que le pourvoi dont s'agit ayant été fait par lettre, il y a lieu de le déclarer irrecevable ;
PAR CES MOTIFS
Déclare le pourvoi de la société SATOM irrecevable ;
La condamne aux dépens
Ordonne qu'à la diligence du Greffier en chef de la Chambre Judiciaire de la Cour Suprême, une expédition du présent arrêt sera transmise au Procureur Général près la Cour d'Appel du 3ème et dernier rôle
Littoral et une autre au Greffier en chef de ladite Cour pour mention dans leurs registres respectifs
Ainsi jugé et prononcé par la Cour Suprême en son audience publique ordinaire les mêmes jour, mois et an que dessus, en la salle des audiences de la Cour où siégeaient :
MM. Alexis DIPANDA MOUELLE, Premier Président de la Cour Suprême, Président
Dagobert BISSECK, Conseiller
Frédéric MOCHE, Conseiller
En présence de Monsieur EGBE ACHUO Martin Hilman, Avocat Général occupant le banc du Ministère Public ;
Et avec l'assistance de Maître BOUBA, Greffier ;
En foi de quoi le présent arrêt a été signé par le Président, les Conseillers et le Greffier ;
Approuvant mot rayé nul ;
LE PRESIDENT, LES CONSEILLERS, LE GREFFIER.-",ARRET_N_198_CIV_DU_23_JUIN_2011,0,"{'Court': 'COUR SUPREME DU CAMEROUN', 'Chamber': 'CHAMBRE JUDICIAIRE', 'Section': 'SECTION CIVILE', 'Case': 'Dossier n° 167/Civ/09', 'Appeal': 'Pourvoi n° 174 du octobre 2008', 'Claimant': 'SOCIÉTÉ SATOM', 'Against': 'C/', 'Defendant': 'C.B.C', 'Judgment': 'ARRET N° 198/CIV DU 23 JUIN 2011'}"
