URL,text,page_title,page_label,category,metadata
https://www.juriafrica.com/lex/arret-298-p-21-septembre-2000-9321.htm,"ARRET N°298/P DU 21 SEPTEMBRE 2000

LA COUR,
Vu le mémoire ampliatif déposé le 8 mars 1999 par Maîtres Nhanag et Tanyem, Avocats à Yaoundé ;
Sur le premier moyen de cassation pris de la violation de la loi, violation de l'article 9 de l'ordonnance n°72/4 du 26 août 1972 ;
En ce que le Tribunal de Grande Instance était composé de trois magistrats : Madame Eloundou ; Messieurs Mengang et Eyango ; le jugement ne précise pas s'il a été rendu à la majorité ou à l'unanimité ou s'il a été signé par les trois magistrats ou par ceux de la majorité ;
Alors que selon le texte visé au moyen, les expéditions des jugements et arrêts se terminent par la mention suivante :
«...En foi de quoi le présent jugement a été signé par le Président et le greffier ou en cas de collégialité par tous les magistrats et le greffier ou par les magistrats de la majorité et le greffier» ; que ce moyen est fondé dans la mesure où la Cour d'Appel de Yaoundé a confirmé un jugement rendu en violation de la loi ;
Attendu qu'il résulte des qualités du jugement entrepris que le Tribunal de Grande Instance du Mfoundi qui a statué à l'audience du 28 juin 1996 était composé de:
Madame Eloundou Virginie Elise...Présidente ;
Messieurs Mengang Salomon et Eyango René Lucien... Membres, tous juges audit Tribunal avec l'assistance de Maître Etoundi Pulchérie, greffier tenant la plume ;
Attendu que la participation de ces juges au prononcé du jugement s'est traduite par l'apposition de leurs signatures respectives sur la minute de cette décision outre celle du greffier qui a assisté la juridiction ainsi composée ;
Attendu que l'omission, dans le jugement rendu par une formation collégiale du Tribunal, de la mention relative à la signature de la décision par tous les juges ou ceux de la majorité et le greffier n'entraîne pas la nullité du jugement sur lequel sont apposées les signatures des magistrats qui ont effectivement siégé ;
Attendu qu'en confirmant le jugement entrepris régulièrement signé, l'arrêt attaqué n'a pas violé le texte visé au moyen ;
D'où il suit que celui-ci n'est pas fondé ;
Sur la première branche du deuxième moyen pris de la violation de la loi, violation de l'article 5 de l'ordonnance 72/4 du 26 août 1972, dénaturation des faits de la cause, contradiction entre les motifs ;
En ce que, au premier rôle, le Tribunal attribue la qualité de partie civile à Ngankeu Pierre, on peut lire à la fin du premier rôle (recto) : «...Entre le Procureur de la République près les Tribunaux de Première Instance de céans...et Monsieur Ngankeu Pierre, partie civile ;
Toujours au premier rôle (verso) le Tribunal de Grande Instance dont le jugement est confirmé fait état de ce qu'il y a trois accusés Mboudou Ahanda, Kyriakides, Mbongue Ekotto ;
Paradoxalement, au deuxième rôle, le même Tribunal affirme que cinq accusés ont été renvoyés devant lui ; il est dit ce qui suit : «Attendu que par ordonnance de Monsieur le Procureur de la République...en date du 29 octobre 1993, les nommés Bendogo, Mboudou Ahanda Guillaume Denis, Kyriakides Georges, Kingue Ngale Jacob, Mbongue Ekotto Otto Jacques sont renvoyés devant le Tribunal de Grande Instance de céans...» ;
Alors que la partie civile dans la présente cause s'appelle bien «la Société Civile Immobilière Ngankeu» ; cela se vérifie aux premier, deuxième et troisième rôles de l'arrêt ; s'agissant des accusés, trois ont été renvoyés et non cinq comme cela ressort du deuxième rôle, il s'agit de Mboudou Ahanda, Mbongue Ekotto, Kyriakides ; la contradiction et la dénaturation susrélevées exposent l'arrêt à l'annulation ; il a été jugé que :
- la dénaturation des faits de la cause équivaut à l'absence des motifs : CS arrêt du 23 juillet 1981 RCD série 2 n°s 21-22 page 118 ; CS arrêt nos69/P du 16 janvier 1986 Aff. Famer Adrien James C/MP et Tchuenkam ;
- l'arrêt confirmatif adopte implicitement les motifs de la décision confirmée : CS arrêt du 9 mars 1978, RCD série n°s 15 et 16 pages 114-121 ;
Cette branche est fondée la Cour ayant confirmé une décision qui n'est pas motivée ;
Attendu que l'indication erronée de la qualité d'une partie au litige ne constitue pas un motif contradictoire aux motifs réels de la décision attaquée ou confirmée ;
Attendu que la mention de la qualité de sieur Ngankeu Pierre comme partie civile dans le jugement au lieu de celle de la Société Civile Immobilière Ngankeu qu'il représentait ne vicie pas la décision confirmée par l'arrêt attaqué ; qu'au surplus dans l'acte de saisine du premier juge, sieur Ngankeu estime qu'il a autant que la Société subi un lourd préjudice dont la réparation est due aux parties civiles que sont la Société Civile Immobilière Ngankeu et lui-même ;
Attendu qu'il est par ailleurs constant que par ordonnance du 29 octobre 1993 du magistrat instructeur Mboudou Ahanda Guillaume Denis, Mbongue Ekotto Otto Jacques et Kyriakides Georges ont été renvoyés devant le Tribunal de Grande Instance de Yaoundé pour faux en écritures publiques et authentiques, faux dans un acte ; que les nommés Kingue Ngale Jacob et Bengodo Mendogo ont bénéficié d'un non-lieu par le même acte ;
Attendu que la mention erronée que ces derniers ont figuré parmi les accusés renvoyés en jugement n'altère pas la substance de la décision rendue qui n'a statué que dans les limites de sa saisine fixées par l'ordonnance de renvoi ;
Attendu qu'en confirmant le jugement sur le nombre des accusés jugés l'arrêt attaqué n'a pas dénaturé les faits de la cause et ne s'est pas contredit ;
D'où il suit que le moyen en sa première branche n'est pas fondé ;
Sur la deuxième branche du deuxième moyen pris de la violation de la loi, violation de l'article 5 de l'ordonnance n°72/4 du 26 août 1972, non réponse aux conclusions ;
En ce que, au quatrième rôle de l'arrêt, la Cour relève que l'appelant partie civile conclut à l'infirmation du jugement querellé et à la condamnation des accusés au paiement solidaire de la somme de 7 milliards ;
Au troisième rôle (verso), la Cour note que l'appelant a conclu le 29 décembre 1997 et le 8 janvier 1998 ; que la même Cour au cinquième rôle fait état de ce que les conclusions de Maître Tanyem épousent les thèses de Maître Nhanag ;
Dans les conclusions du 9 décembre et non du 29 décembre la S.C.I. Ngankeu demandait à la Cour :
- de constater que la copie du titre foncier que détient Kyriakides n'est pas conforme au livre foncier ;
- de constater qu'il a reconnu les faits ;
- de constater que Mboudou Ahanda n'a pas rectifié une erreur matérielle mais qu'il a modifié les rapports ;
- de constater qu'il a fait comparaître son clerc devant lui à cette fin ;
La Cour, dans le dispositif de son arrêt n'a répondu à aucune de ces démarches, alors qu'il est fait obligation aux Cours et Tribunaux de répondre à toutes les demandes formulées par les parties ; selon la Cour de céans, la non réponse aux conclusions équivaut à un défaut de motifs et justifie la cassation ; CS arrêt du 11 novembre 1977 RCD série 2 n's 15 et 16 pages 95 et suivantes ; constitue un moyen de cassation l'omission de répondre aux conclusions nouvelles en appel et acquises aux débats : CS arrêt n°188/P du 5 juin 1986 RCD série 2 n°s 31-32 année 1986, pages 239 et suivantes. Cette branche du deuxième moyen est également fondée ;
Attendu que les conclusions de Maître Nhanag datées du 29 décembre 1997 auxquelles il est prétendu que la Cour n'a pas apporté de réponse, visaient à établir la culpabilité des accusés Mboudou Ahanda Guillaume Denis, Mbongue Ekotto Jacques et Kyriakides Georges ;
Attenddu qu'à ces écritures aisnsi qu'à celles de Maître Tanyem, l'arrêt attaqué a répondu en ce qui concerne les faits reprochés à chacun des accusés ;
Attendu que cet arrêt énonce à cet effet :
«Sur le cas de Maître Mboudoou Ahanda Guillaume ;
«Considérant que le premier juge énonce que la transformation opérée par Mboudou Ahanda, notaire en remplaçant dans les statuts de la Société la phrase :
«14.000 parts d'intérêts de 1000 francs, toutes ces parts représentant des apports initiaux faits lors de la constitution de la Société ne constitue pas un abus de fonction, ni la création d'un être moral nouveau mais la rectification d'une erreur matérielle incluse dans les statuts ;
«Considérant que cette procédure est prévue par l'article 20 des statuts de la Société ; que par ailleurs la Société Immobilière du Centre n'a changé ni les actionnaires, ni son objet social, qu'il y a lieu de suivre le premier juge sur ce point ;
«Sur le cas de Mbongue Ekotto Jacques ;
«Considérant qu'il est reproché à ce dernier d'avoir frauduleusement altéré le montant de la valeur de l'immeuble objet du titre foncier n°5 et constituant le capital social de la Société Immobilière ;
«Considérant que le premier juge énonce que l'acte constitutif de la Société a été établi le 4 décembre 1962 par devant Maître Mongo Mbock, notaire à Yaoundé, que les associés ont à l'unanimité réévalué l'immeuble litigieux dont le prix est ainsi passé de 11 à 14 millions selon les pages 13, 14 et 15 des statuts dans les rubriques origine de propriété, propriété — jouissance, rémunération des apports ; que l'accusé n'a que rectifié une erreur matérielle commise par son prédécesseur ;
«Considérant que ces constatations matérielles suffisent pour suivre le premier juge ;
«Sur le cas de Kyriakides ;
«Considérant qu'il est fait grief à ce dernier d'être complice des actions faux (sic) pris par le notaire Mboudou Ahanda et le conservateur Mbongue Ekotto ;
«Considérant que la complicité prévue à l'article 97 du code pénal demande que le complice ait donné des ordres, aide à la préparation ou à la commission de l'infraction ;
«Que dans le cas d'espèce, le notaire et le conservateur n'ont agi que dans le cadre de la loi en exécution des différentes décisions judiciaires ou administratives prises en faveur de Kyriakides, les statuts modifiés de la Société Immobilière du Centre ;
«Qu'il y a lieu également de suivre le premier juge sur ce point ;
«Considérant que les conclusions de Maître Tanyem épouse les thèses de Maître Nhanag, il n'y a pas lieu à répondre spécialement ;
«Considérant ainsi que le premier juge a fait une saine interprétation des faits de cette cause et une exacte application de la loi, qu'en ajoutant aux présents motifs ceux du premier juge, il y a lieu de confirmer dans toutes ses dispositions» ;
Attendu que par ces énonciations pertinentes et suffisantes le juge d'appel a donné une réponse aux conclusions des conseils de la partie civile ;
D'où il suit qu'en sa seconde branche le moyen n'est pas fondé ;
PAR CES MOTIFS
REJETTE le pourvoi de la Société civile immobilière Ngankeu ;
CONDAMNE la demanderesse aux dépens ;
ORDONNE qu'à la diligence de Monsieur le Procureur Général près la Cour suprême, le présent arrêt sera imprimé et transmis pour être transcrit sur les registres du Greffe de la Cour d'Appel du Centre et que mention en sera faite en marge ou à la suite de la décision attaquée.",ARRET_N_298_P_DU_21_SEPTEMBRE_2000,0,arret,"{'Court': 'COUR SUPRÊME DU CAMEROUN', 'Chamber': 'Chambre Pénale', 'Section': '', 'Case': '', 'Appeal': '', 'Claimant': 'SOCIÉTÉ CIVILE IMMOBILIÈRE ET NGANKEU', 'Against': 'C/', 'Defendant': 'MINISTÈRE PUBLIC, KYRIAKIDES GEORGES, MBOUDOU AHANDA GUILLAUME DENIS ET MBONGUE EKOTTO OTTO JACQUES', 'Judgment': 'ARRET N°298/P DU 21 SEPTEMBRE 2000'}"
