URL,text,page_title,page_label,category,metadata
https://www.juriafrica.com/lex/arret-01-cc-14-octobre-1999-11369.htm,"ARRET N°01/CC DU 14 OCTOBRE 1999

LA COUR,
Vu le mémoire ampliatif déposé le 25 mars 1988 par Maîtres Viazzi - Aubriet - Battu - Nkom et Moutome, Avocats associés à Douala ;
Vu le mémoire en réponse déposé le 23 avril 1990 par Maîtres Ninine et Bonnard, Avocats associés à Douala ;
Sur l'exception tirée du principe de l'autorité de la chose jugée :
Attendu qu'au soutien de ladite exception, dame Caze Françoise Fernande épouse Alix expose dans son mémoire en réponse visé ci-dessus déposé par l'intermédiaire de ses conseils, Maîtres Ninine et Bonnard, Avocats associés à Douala, ce qui suit :
« L'ordonnance de non-conciliation et l'arrêt pris sur appel subséquent, statuant sur des mesures provisoires, celles-ci disparaissent de plein droit par la survenance du jugement définitif, dès lors que celui-ci acquiert autorité de la chose jugée, tel qu'en l'espèce, puisque ledit jugement n°222 du 18 mai 1987 prononçant le divorce d'entre les époux Alix et confiant la garde de l'enfant à Alix Franck a été signifié le 8 juillet 1988 sans qu'aucun appel n'ait été exercé contre lui» ;
Mais attendu que l'argument ainsi évoqué manque en fait, ce d'autant plus que la prétendue signification du jugement n°222 du 18 mai 1987 prononçant le divorce d'entre les époux Alix n'a été justifiée par aucune pièce ;
D'où il suit que l'exception évoquée est irrecevable ;
Sur le moyen unique de cassation pris de la violation de la loi, violation de l'article 5 de l'ordonnance n°72/4 du 26 août 1972, non-réponse aux conclusions, insuffisance de motifs, ensemble violation des articles 203, 208 et 209 du code civil ;
En ce que,
« L'arrêt a confirmé la pension alimentaire allouée à l'enfant et devant être versée à la mère alors que celle-ci a refusé d'assurer la garde de celui-ci qui, de nombreuses années, vit avec son père ;
« A l'appui du procès-verbal de constat du 22 avril 1985 de Maître Mbonjo Bebe Jean-Jacques, des attestations de MM Ginieys Luc, Toutou Claude, Docteur David Raoul et Soppo Paul Priso, confortés par l'attestation de scolarité délivrée par l'Ecole Française de Douala Dominique Savio, Monsieur Alix avait demandé à la Cour de constater que l'enfant ne vit plus avec sa mère, qu'il est avec lui et que partant la pension alimentaire qui avait été allouée à celle-ci pour faire face aux besoins en aliments de cet enfant, doit purement et simplement être reportée ;
« Non seulement il n'a pas répondu à cette demande expresse résultant des conclusions du 21 juin 1985, mais en plus en la reconduisant, l'arrêt a, à l'évidence, violé les dispositions des articles 203, 208 et 209 du code civil tant il est constant que l'article 209 dispose : « Lorsque celui qui fournit ou celui qui reçoit des aliments est replacé dans un état tel que l'un ne puisse plus en donner ou que l'autre n'en ait plus besoin en tout ou en partie, la décharge ou la réduction peut en être demandée » ;
« L'arrêt a confirmé le principe de la pension alimentaire allouée à l'épouse et a même porté le montant de celle-ci à 200.000 francs sans répondre aux conclusions du 21 juin 1985 » ;
Attendu que l'examen des pièces de la procédure révèle que le juge d'appel n'a pas répondu aux conclusions du 21 juin 1985 présentées par Maîtres Viazzi - Aubriet Battu - Nkom - Moutome pour le compte du sieur Alix Franck ;
Que par le biais desdites conclusions, le demandeur au pourvoi sollicitait l'examen du changement d'état, de dame Alix et ce surtout depuis l'abandon entre les mains du père du jeune Alix Roland qui lui avait été confié suivi de son départ en France ;
Que la non réponse aux conclusions est corroborée par la confirmation du principe de la pension alimentaire et surtout son relèvement au taux de 200.000 francs pour la mère en lieu et place de la somme de 120.000 francs allouée par le premier juge ;
Attendu que la non-réponse aux conclusions équivaut à une insuffisance de motifs alors qu'aux termes de l'article 5 de l'ordonnance n°72/4 du 26 août 1972, toute décision judiciaire doit être motivée en fait et en droit et par conséquent contenir les éléments propres à la justifier;
Que ce faisant, le juge d'appel n'a pas mis la Cour suprême en mesure d'exercer son contrôle sur le bien-fondé de la décision querellée ; que de surcroît, il s'en est suivi une fausse application de l'article 209 du code civil sus-mentionné ;
D'où il suit que le moyen est fondé et que l'arrêt encourt la cassation ;
PAR CES MOTIFS
Déclare irrecevable l'exception tirée de l'autorité de la chose jugée ;
CASSE ET ANNULE l'arrêt n°192/c rendu le 18 avril 1986 par la Cour d'Appel de Douala ;
REMET en conséquence la cause et les parties au même et semblable état où elles étaient avant ladite décision et, pour être fait droit, les renvoie devant la même Cour d'Appel autrement composée ;
RESERVE les dépens ;
ORDONNE qu'à la diligence de Monsieur le Procureur Général près la Cour suprême, le présent arrêt sera imprimé et transmis pour être transcrit sur les registres du Greffe de la Cour d'Appel de Douala et que mention en sera faite en marge ou à la suite de la décision attaquée.",ARRET_N_01_CC_DU_14_OCTOBRE_1999,0,arret,"{'Court': 'COUR SUPRÊME DU CAMEROUN', 'Chamber': 'Chambre Civile et Commerciale', 'Section': '', 'Case': '', 'Appeal': '', 'Claimant': 'ALIX FRANCK', 'Against': 'C/', 'Defendant': 'CAZE FRANÇOISE FERNANDE ANDRÉA ÉPOUSE ALIX', 'Judgment': 'ARRET N°01/CC DU 14 OCTOBRE 1999'}"
