URL,text,page_title,page_label,category,metadata
https://www.juriafrica.com/lex/arret-139-p-07-decembre-2000-10659.htm,"ARRET N°139/P DU 07 DECEMBRE 2000

LA COUR,
Vu le mémoire ampliatif déposé le 4 mai 1995 par Maître Siewe, Avocat à Nkongsamba ;
Sur le premier moyen de cassation pris de la violation de la loi, violation de l'article 5 de l'ordonnance n°72/4 du 26 août 1972 portant organisation judiciaire, défaut de motifs, violation de la loi, manque de base légale ;
Sur la première branche du moyen, « En ce que,
Attendu en effet que cet arrêt se contente de déclarer le prévenu coupable de blessures involontaires et de le condamner à payer des dommages-intérêts à la victime sans préciser les dispositions légales ou réglementaires dont il fait application ;
Que les blessures involontaires peuvent constituer un délit ou une contravention en référence aux articles 289 et R. 370 du code pénal ;
Qu'en ne précisant pas lequel des deux articles dont il fait application, cet arrêt est insuffisamment motivé et ne permet pas à la haute juridiction d'effectuer son contrôle ;
Que bien plus le défaut de permis retenu par la Cour d'Appel ne constitue pas un élément matériel caractérisant les blessures involontaires ;
Que cet arrêt n'a pas établi un lien de cause à effet entre ce défaut de permis et les blessures causées à la victime, ce d'autant plus qu'aucune faute de conduite, n'est reprochée au prévenu ;
Attendu qu'en cas d'accident de circulation, toute inobservation de règlement ne donne pas nécessairement lieu aux blessures involontaires lorsque les autres éléments de ces infractions sont réunis au regard des articles sus-visés » ;
Attendu que l'arrêt attaqué énonce dans son dispositif :
PAR CES MOTIFS
«Confirme pour le surplus ;
«Condamne le prévenu aux dépens... ;
«Avertissement a été donné aux parties de ce qu'elles disposent de dix jours à compter du lendemain du présent arrêt pour se pourvoir en cassation si elles le jugent utile, d'une part et, d'autre part au seul condamné de ce qu'il a deux mois à compter du jour où la présente décision sera devenue définitive pour s'acquitter volontairement des condamnations pécuniaires prononcées contre lui, faute de quoi il y sera contraint par corps conformément à la loi, le tout par application des articles 289 du code pénal, 194 du code d'instruction criminelle et 5 de la loi n°58/203 du 26 décembre 1958 »;
Attendu qu'il résulte de ce qui précède que le juge d'appel a bien indiqué les textes de la loi appliqués ;
Qu'il s'ensuit que le moyen en sa première branche n'est pas fondé ;
Sur la seconde branche du moyen ; En ce que,
« Attendu que les exposants ont déposé en date des 20 mars, 24 juillet, 20 novembre et 18 décembre 1990 des conclusions dans lesquelles ils développaient de sucroît des moyens de défense nouveaux, notamment ceux de défense au titre de préjudice scolaire (cf. conclusions produites à l'audience du 18 décembre 1990) ;
Que ce faisant l'arrêt critiqué qui adopte les motifs du premier juge n'a pas répondu aux conclusions à lui soumises et encourt cassation... » ;
Attendu que le moyen évoqué est sans intérêt pour le demandeur ;
D'où il suit qu'il est irrecevable ;
Sur le deuxième moyen de cassation pris de la violation de la loi, violation de l'article 210 du code d'instruction criminelle, manque de base légale ;
En ce que,
« L'arrêt critiqué ne fait pas état de l'audition du civilement responsable ;
Attendu qu'il est jugé en l'application de l'article 210 du code d'instruction criminelle que outre l'audition du prévenu, de la partie civile, du Ministère Public, il doit être procédé celle du ou des civilement responsables avant l'intervention de la décision de la juridiction saisie, que le prévenu soit condamné ou acquitté, que cette disposition est substantielle et que la Cour n'a pu y déroger sans violer le texte visé dès lors qu'elle était appelée à statuer sur les intérêts civils et qu'il existe un civilement responsable ;
Que l'arrêt critiqué qui ne fait pas mention de l'audition du civilement responsable a violé le texte visé au moyen et encourt cassation » ;
Attendu que le demandeur au pourvoi ne justifie pas de préjudice subi du fait de la violation alléguée encore et surtout que le civilement responsable n'a pas été appelé au procès ;
D'où il suit que le moye n'est pas fondé ;
Sur le troisième moyen de cassation pris de la violation de l'article 190 du code d'instruction criminelle, violation de la loi, manque de base légale ;
«En ce que,
« L'arrêt dont pourvoi se contente de constater la publicité de l'audience où il a été rendu sans porter une quelconque mention dont on peut déduire la publicité des audiences précédentes consacrées à l'instruction de l'affaire ;
« Qu'on relève en effet au premier rôle de cette décision « La Cour d'Appel de l'Ouest à Bafoussam siégeant comme chambre des appels correctionnels en son audience publique ordinaire tenue au palais de justice de ladite ville le mardi 3 mars 1991 » ;
« Que plus loin on peut noter « que les parties ont régulièrement été citées à comparaître par devant la Cour d'Appel de céans Chambre correctionnelle le 19 décembre 1989 à 7 heures 30 ; la cause sur ces citations inscrites au rôle de la Cour à l'audience sus-indiquée, fut appelée à son tour et après plusieurs renvois utiles, fut retenue à celle du 19 février 1991 » ;
« Qu'il ne ressort nulle part de ces énonciations la preuve de la publicité des audiences consacrées à l'instruction de l'affaire ;
« Attendu qu'est nul l'arrêt ou le jugement qui, en constatant la publicité de l'audience du jour où il a été rendu, ne comporte aucune mention dont on puisse déduire la preuve de la publicité des audiences précédentes consacrées à l'instruction de l'affaire » ;
Attendu que l'indication dans l'arrêt qu'il a été rendu en audience publique suffit à justifier la publicité des audiences ;
D'où il suit que ce moyen n'est pas fondé ;
PAR CES MOTIFS
REJETTE le pourvoi ;
CONDAMNE le demandeur aux dépens ;
ORDONNE qu'à la diligence de Monsieur le Procureur Général près la Cour suprême, le présent arrêt sera imprimé et transmis pour être transcrit sur les registres du Greffe de la Cour d'Appel de Bafoussam et que mention en sera faite en marge ou à la suite de la décision attaquée.",ARRET_N_139_P_DU_07_DECEMBRE_2000,0,arret,"{'Court': 'COUR SUPRÊME DU CAMEROUN', 'Chamber': 'Chambre Pénale', 'Section': '', 'Case': '', 'Appeal': '', 'Claimant': 'YETNGOUE ZACHÉE, NKUILAN DANIEL', 'Against': 'C/', 'Defendant': 'MINISTÈRE PUBLIC ET YAMENDJEU SAMUEL', 'Judgment': 'ARRET N°139/P DU 07 DECEMBRE 2000'}"
