URL,text,page_title,page_label,category,metadata
https://www.juriafrica.com/lex/arret-44-3-juin-1999-11705.htm,"ARRET N°44/L DU 3 JUIN 1999

LA COUR,
Vu le mémoire ampliatif déposé le 14 mars 1986 par Maîtres Ninine et Bonnard, Avocats associés à Douala ;
Sur le moyen unique de cassation amendé, pris de la violation de la loi, violation et fausse application des articles 32 et 34 du décret n°69/DF/544 du 19 décembre 1969 fixant la procédure devant les juridictions traditionnelles, ensemble violation de l'article 5 de l'ordonnance n°72/4 du 26 août 1972 ; dénaturation des faits de la cause — défaut de motifs ;
En ce que l'ordonnance critiquée pour prononcer la déchéance de l'appel pour défaut de consignation, se borne à énoncer que Komba Quan Thomas n'a pas consigné dans le délai de deux mois de la notification faite le 19 mai 1984 ;
Alors que l'exposant justifie par quittance du Trésor qu'il avait effectivement consigné le 12 juillet 1984, c'est-à-dire sept jours avant l'expiration du délai ;
Alors que l'article 32 dispose que l'avis qui fait courir le délai de déchéance est un acte du Greffier en Chef de la Cour d'Appel adressé par voie administrative et qui doit indiquer clairement :
Le montant de la somme à consigner ;
Le délai et la forme dans lesquels la consignation doit être faite ;
La déchéance qui sanctionne cette obligation ;
Il résulte de l'article 34 que la déchéance de l'appel court de la notification ;
Soit de l'avis du greffier prévu à l'article 32 ;
Soit du rejet de la demande de l'assistance judiciaire, et non d'une quelconque signification sibylline d'un huissier requis précisément pour entretenir la confusion dans l'esprit de la partie adverse ;
Il ressort du dossier dressé le 5 mai 1984 par le greffier en chef de la Cour d'Appel de Douala que l'acte d'appel a été notifié au demandeur au pourvoi le 12 mai 1984 ;
Il s'ensuit que le versement a été fait le 12 juillet 1984 de la consignation de 3000 francs par Komba Gaston dans le délai légal de deux mois ;
Attendu qu'aux termes de l'article 32 du texte visé au moyen, dès la réception de la déclaration d'appel, le Greffier en Chef de la Cour d'Appel adresse à l'appelant, par voie administrative un avis, lui indiquant non seulement son droit de demander l'assistance judiciaire, ainsi que le délai et les formes de ladite demande mais également l'obligation à laquelle il est tenu, s'il ne bénéficie pas de l'assistance judiciaire d'effectuer dans les délais et forme de la loi, la consignation prévue par l'article 34 du même décret ;
Attendu qu'en l'espèce, il ressort du dossier que la notification d'appel établie le 5 mai 1984 par le greffier en chef de la Cour d'Appel de Douala contrairement aux prescriptions de l'article 32 du texte susvisé a été notifié à l'appelant par l'exploit en date du 19 mai 1984 de Maître Mengue Ngando Etienne, huissier de justice à Douala, requis par dame Ngouma Komba Grâce ;
Attendu qu'il s'ensuit que ladite signification effectuée par l'huissier susnommé était manifestement illégale et que l'appelant restait dans le délai légal de la consignation même à la date de l'ordonnance critiquée ;
Attendu que c'était par conséquent, en méconnaissance des dispositions des textes visés au moyen, que le Président de la Cour d'Appel, en fondant sa conviction sur la notification faite le 19 mai 1984, par l'exploit d'huissier susnommé, a constaté la déchéance de l'appel dont s'agit au motif que l'appelant «n'a pas consigné dans le délai de deux mois imparti à peine de déchéance par l'alinéa 2 dudit article 34...»;
D'où il suit que le moyen est fondé et que l'ordonnance attaquée encourt l'annulation ;
PAR CES MOTIFS
CASSE ET ANNULE l'ordonnance n°23/83-84 rendue le 21 septembre 1984 par le Président de la Cour d'Appel de Douala;
REMET en conséquence la cause et les parties au même et semblable état où elles étaient avant ladite décision et, pour être fait droit, les renvoie devant la même juridiction autrement composée ;
RESERVE les dépens ;
ORDONNE qu'à la diligence de Monsieur le Procureur Général près la Cour Suprême, le présent arrêt sera imprimé et transmis pour être transcrit sur les registres du Greffe de la Cour d'Appel de Douala et que mention en sera faite en marge ou à la suite de la décision annulée.",ARRET_N_44_L_DU_3_JUIN_1999,0,arret,"{'Court': 'COUR SUPRÊME DU CAMEROUN', 'Chamber': 'Chambre Traditionnelle', 'Section': '', 'Case': '', 'Appeal': '', 'Claimant': 'KOMBA QUASI THOMAS', 'Against': 'C/', 'Defendant': 'NGOUMA KOMBA GRÂCE', 'Judgment': 'ARRET N°44/L DU 3 JUIN 1999'}"
