URL,text,page_title,page_label,category,metadata
https://www.juriafrica.com/lex/arret-311-p-21-septembre-2000-10508.htm,"ARRET N°311/P DU 21 SEPTEMBRE 2000

LA COUR,
Vu le mémoire ampliatif déposé le 31 juillet 1992 par Maître Siewe, Avocat à Nkongsarnba ;
Sur le premier moyen de cassation pris de la violation de l'article 190 du code d'instruction criminelle, sur la publicité des débats et autres jugements en matière correctionnelle ;
« En ce que l'arrêt critiqué se contente de constater la publicité de l'audience du jour où il a été rendu, et ne comporte aucune mention dont on puisse déduire la publicité des audiences précédentes consacrées à l'instruction de l'affaire ;
Attendu en effet que l'on relève dans cet arrêt ce qui suit : « La Cour d'Appel du Littoral siégeant comme chambre des appels correctionnels en son audience publique ordinaire tenue au palais de justice de ladite ville le mardi 16 janvier 1990... » ;
«Les parties ont été citées par exploit de Maître Luc Florent Somo, Huissier de justice à comparaître le mardi 18 octobre 1988 à 08 heures trente en l'audience et par devant la Cour d'Appel du Littoral jugeant en matière correctionnelle ;
La cause sur ces citations inscrite au rôle de la Cour à l'audience sus-énoncée fut appelée à son tour et renvoyée à celle de ce jour à laquelle elle a été retenue ;
Attendu en réalité que entre les deux audiences susmentionnées, la cause a été appelée et débattue à plusieurs autres audiences qui ne sont pas précisées dans l'arrêt ;
Que de tout ce qui précède, on ne peut déduire la preuve de la publicité de ces audiences qui ont été consacrées à l'instruction de l'affaire ;
Mais attendu que la règle de la publicité des débats et des jugements est réputée avoir été omise lorsqu'elle n'a pas été régulièrement constatée ;
Qu'est nul le jugement ou l'arrêt qui constate la publicité de l'audience du jour où il a été rendu, mais ne comporte aucune mention dont on puisse déduire la publicité des audiences précédentes consacrées à l'instruction de l'affaire ;
(C.S arrêt n°101 du 18/01/1979 ; Bull. n°30, P. 5974) ;
Que par suite le moyen est fondé » ;
Attendu qu'il ressort de l'arrêt attaqué que la Cour d'Appel a statué publiquement, ce qui est conforme au texte visé au moyen ;
Attendu au surplus que les mentions contenues dans les décisions judiciaires sont authentiques et font foi jusqu'à preuve de contraire, ce que le moyen ne rapporte pas ;
Que le moyen qui manque en fait est irrecevable ;
Sur le deuxième moyen pris de la violation de l'article 5 de l'ordonnance n°72/4 du 26 août 1972 portant organisation judiciaire, défaut de motifs — manque de base légale, ainsi développé :
« Attendu qu'aux termes du texte visé au moyen, toute décision de justice doit être motivée en fait et en droit ;
Attendu que l'arrêt critiqué statuant sur la demande de la partie civile relative aux frais funéraires, reconnaît l'absence de pièces justificatives, mais alloue cependant à celle-ci 250.000 francs sous le prétexte que la Cour use de son pouvoir d'appréciation pour le faire ;
Mais attendu que les frais funéraires comme tout autre préjudice matériel ne peut être réparé que sur la production des pièces justificatives, le but poursuivi étant de réparer intégralement le préjudice subi, et rien que le préjudice subi ;
Qu'en procédant à la réparation de ce chef de préjudice en l'absence de pièces justificatives, la Cour d'Appel n'a pas donné une base légale à sa décision ;
Que part suite ce moyen est également fondé » ;
Attendu que la Cour d'Appel, pour allouer les frais funéraires a motivé sa décision ainsi qu'elle énonce :
Sur les frais funéraires :
« Considérant qu'usant de son pouvoir d'appréciation, la Cour fixe à 500.000 francs /2=250.000 francs la réparation de ce poste de préjudice nonobstant l'absence des pièces justificatives desdites dépenses eu égard au contexte sociologique et aux divers impératifs qui rendent inévitables des dépenses de cette nature... » ;
Attendu que par cette énonciation, l'arrêt attaqué est suffisamment motivé et le texte visé n'est pas violé ;
D'où il suit que le pourvoi encourt le rejet ;
PAR CES MOTIFS
REJETTE le pourvoi ;
CONDAMNE les demandeurs aux dépens ;
ORDONNE qu'à la diligence de Monsieur le Procureur Général près la Cour suprême, le présent arrêt sera imprimé et transmis pour être transcrit sur les registres du Greffe de la Cour d'Appel du Littoral et que mention en sera faite en marge ou à la suite de la décision attaquée.",ARRET_N_311_P_DU_21_SEPTEMBRE_2000,0,arret,"{'Court': 'COUR SUPRÊME DU CAMEROUN', 'Chamber': 'Chambre Pénale', 'Section': '', 'Case': '', 'Appeal': '', 'Claimant': 'NGONGANG MATHIEU, YOUMESSI PHILLIPE', 'Against': 'C/', 'Defendant': 'MINISTÈRE PUBLIC ET FOM FIDÈLE', 'Judgment': 'ARRET N°311/P DU 21 SEPTEMBRE 2000'}"
