URL,text,page_title,page_label,category,metadata
https://www.juriafrica.com/lex/arret-71-civ-7-avril-2011-8774.htm,"ARRET N° 71/CIV DU 7 AVRIL 2011

L'an deux mille onze et le sept du mois d'avril ;
La Cour Suprême, Chambre Judiciaire, Section Civile, siégeant au Palais de Justice de Yaoundé ;
A rendu en audience publique ordinaire, l'arrêt dont la teneur suit :
ENTRE
HAPPI David, demandeur à la cassation, représenté par Maître NKONGHO, Avocat à Douala ;
D'UNE PART
ET
Succession YEMBE EYIDI Guillaume, défenderesse à la cassation, représentée par Me TOKOTO & autre, avocats Douala ;
D'AUTRE PART
En présence de Monsieur Martin Hilman EGBE ACHUO, Avocat Général près la Cour Suprême ,
Statuant sur le pourvoi formé par Me NKONGHO, Avocat à Douala, agissant au nom et pour le compte HAPPI David, par déclaration faite le 30 mai 2000 au Greffe de la Cour d'Appel du Littoral, en cassation de l'arrêt n° 150/CC rendu le 19 mai 2000 par la susdite Cour statuant en matière civile et commerciale, dans l'instance opposant son client à la succession YEMBE EYIDI Guillaume ,
LA COUR
Après avoir entendu en la lecture du rapport Monsieur André BELOMBE, Conseiller à la Cour Suprême, substituant Monsieur Saker MBAKOP, empêché ;
Vu les conclusions de Monsieur Martin RISSOUK à MOLTLONG, Procureur Général ;
Et après en avoir délibéré conformément à la loi ;
Vu le mémoire ampliatif déposé le 10 mai 2004 par Me NKONGHO, avocat à Douala ;
Sur le moyen unique de cassation pris en ses deux branches réunies ainsi présenté :
« Violation de la loi, violation de l'article 5 alinéas 1 et 2 de l'ordonnance n° 72/4 du 26 août 1972 portant organisation judiciaire modifiée ; non réponse aux dispositifs des conclusions des parties ou insuffisance des motifs et contradiction équivalent au défaut de motifs et violation du principe de l'équité et promotion du favoritisme tendant à l'enrichissement sans cause ;
« Première branche du moyen prise de la violation de la loi visée au moyen, contradiction et non réponse aux dispositifs des conclusions des parties,
« En ce que
« D'une part, le premier juge ayant reconnu le bien fondé en principe de la demande de HAPPI David en sa qualité de partie intervenante et lui a alloué le montant en principal de 1.985.000 FCFA versé à YEMBE, il ne pouvait plus rejeter implicitement mais nécessairement, la demande en dommages et intérêts en passant sous silence cette demande dont les dommages-intérêts sont chiffrés à et totalisant 8.800.000 FCFA, sans se contredire ;
« Il y a dès lors contradictoire entre motivation et le dispositif du jugement entrepris confirmé par simple adoption des motifs ;
« D'autre part, il est constant que la question de la violation de la loi n'a pas été soumise au premier juge qui ne pouvait donc pas l'apprécier, ce qui veut dire que le juge d'appel a tout simplement refusé de statuer sur cette question de violation de la loi ;
« Or, la Cour Suprême a toujours sanctionné la non-réponse aux dispositifs des écritures des parties, voir arrêt n° 16/CC du 16 février 1984 ; affaire LELE Grégoire C/ la Cie « La Fortune » ;
« Deuxième branche du moyen prise de la violation du principe de l'équité tendant à favoriser l'enrichissement sans cause ;
« En ce que :
« En rejetant la demande en dommages-intérêts de HAPPI David, le jugement entrepris et confirmé par adoption de motifs, permet à la succession de YEMBE EYIDI Guillaume de s'enrichir gratuitement en gardant par devers elle la différence entre 8.800.000 FCFA et 1.985.000 FCFA, soit 6.815.000 FCFA, s'agissant là d'une somme provenant du terrain de 2200 m2 acheté par HAPPI David qui en était déjà devenu propriétaire s'il n'y avait pas eu expropriation et cela au détriment de HAPPI David qui avait d'ailleurs exposé des frais pour la procédure de morcellement entamée par la famille YEMBE Guillaume » ;
Qu'outre que le moyen pris en ses deux branches réunies ne précise pas quels dispositifs des conclusions n'ont pas été reproduits ,
Qu'en vertu de l'article 13(2) de la loi n° 75/16 du 8 décembre 1975 fixant la procédure et le fonctionnement de la Cour Suprême, le moyen invoqué à l'appui du pourvoi doit, à peine d'irrecevabilité, être articulé et développé ;
Qu'il en résulte que non seulement le moyen doit contenir l'indication complète et non erronée du texte de loi ou du principe de droit prétendument violé ou faussement appliqué, les dispositions du texte visé, mais qu'il doit aussi montrer en quoi ledit texte ou ledit principe de droit a été violé ou faussement appliqué ;
Attendu que tel que présenté, le moyen soulevé en ses deux branches non seulement n'indique pas le contenu du texte visé, mais aussi ne montre pas en quoi le principe de droit invoqué a été violé ou faussement appliqué ,
Que ce faisant, il n'est pas conforme à l'article 13(2) ci-dessus spécifié
D'où il suit qu'il est irrecevable et que le pourvoi encourt le rejet ,
PAR CES MOTIFS
Rejette le pourvoi ,
Condamne le demandeur aux dépens ;
Ordonne qu'à la diligence du Greffier en chef de la Chambre Judiciaire de la Cour Suprême, une expédition du présent arrêt sera transmise au Procureur Général près la Cour d'Appel du Littoral et une autre au Greffier en chef de ladite Cour pour mention dans leurs registres respectifs ;
Ainsi jugé et prononcé par la Cour Suprême en son audience publique ordinaire les mêmes jour, mois et an que dessus, en la salle des audiences de la Cour où siégeaient :
MM.: Alexis DIPANDA MOUELLE, Premier Président de la Cour Suprême, Président
Frédéric MOCHE, Conseiller
André BELOMBE, Conseiller
En présence de Monsieur EGBE ACHUO Martin Hilman, Avocat Général occupant le banc du Ministère Public ;
Et avec l'assistance de Maître Edwige ESSAMA, Greffier ;
En foi de quoi le présent arrêt a été signé par le Président, les Conseillers et le Greffier ;
Approuvant mot rayé nul ,
LE PRESIDENT, LES CONSEILLERS, LE GREFFIER.-",ARRET_N_71_CIV_DU_7_AVRIL_2011,0,arret,"{'Court': 'COUR SUPREME DU CAMEROUN', 'Chamber': 'CHAMBRE JUDICIAIRE', 'Section': 'SECTION CIVILE', 'Case': 'Dossier n° 35/CC/00-01', 'Appeal': 'Pourvoi du 30 mai 2000', 'Claimant': 'HAPPI DAVID', 'Against': 'C/', 'Defendant': 'SUCCESSION YEMBE EYIDI GUILLAUME', 'Judgment': 'ARRET N° 71/CIV DU 7 AVRIL 2011'}"
