URL,text,page_title,page_label,category,metadata
https://www.juriafrica.com/lex/arret-8-cc-29-octobre-1998-11423.htm,"ARRET N°8/CC DU 29 OCTOBRE 1998

LA COUR,
Vu le mémoire ampliatif déposé le 7 juillet 1996 par Maîtres Nlembe et Nlembe, Avocats associés à Yaoundé ;
Sur les deux premiers moyens de cassation réunis, pris de la violation de la loi, violation de l'article 1384 alinéas 1er et 5;
En ce que d'une part, l'arrêt attaqué comme le jugement dont confirmation ont condamné Nessi Bigeault Schmitt sur le fondement de l'article 1384 alinéa le' alors que cette société avait perdu la garde de la chose cause du dommage des suites de vol perpétré par son commettant ;
Le véhicule de Soriloges Voyages loué à la B.B.S. s'est trouvé volé par son préposé et endommagé à la suite d'un accident de la circulation ;
La société Nessi Bigeault Schmitt qui n'en assurait plus les pouvoirs d'usage, de direction et de contrôle avait perdu sa garde ;
La société Nessi Bigeault Schmitt s'est offerte de ne payer à Soriloges Voyages que les frais de location de ce véhicule sur la base de leur contrat ;
Les décisions attaquées ont cru retenir sa responsabilité pour la condamner à payer les frais de réparation et d'immobilisation du véhicule qui lui avait été volé ;
La jurisprudence et la doctrine reconnaissent pourtant que la responsabilité d'une personne dont la voiture a été volée ne peut être recherchée sur le fondement de l'article 1384 alinéa ter du code civil ;
Alors que, d'autre part, sur le fondement de cette disposition les maîtres et commettants ne sont responsables du dommage causé par leurs domestiques et préposés que si celui-ci est commis dans les fonctions auxquelles ils les ont employés ;
Dès lors qu'il y a abus de fonction de la part du préposé la responsabilité du commettant est dégagée ;
La société Nessi Bigeault Schmitt ne pouvait plus être responsable des dommages causés par son préposé avec la chose à elle volée usurpée ;
Attendu que les deux moyens réunis tendent manifestement à remettre en cause les faits souverainement appréciés par les juges du fond ainsi que les éléments ayant entraîné leur conviction ;
Attendu en effet, s'agissant de l'exonération de responsabilité dont se prévaut la société Nessi Bigeault Schmitt du fait du vol du véhicule par son préposé, que l'arrêt attaqué doute de ce vol en énonçant :
« Considérant surabondamment que la responsabilité de l'appelante n'en serait pas moins établie ;
« Qu'il résulte des pièces du dossier que le 17 février 1982, le nommé Desplanques Pierre, représentant de la société appelante, locataire du véhicule accidenté, déclarait porter par son court écrit, plainte contre son employé Bouba Kona, pour vol de voiture ;
« Considérant qu'il ne spécifiait ni l'heure ni les circonstances de ce vol, il est loisible de déduire que cette plainte non suivie d'enquête avait été faite pour tenter de se dégager de sa responsabilité dans la survenance du sinistre ;
« Qu'il s'ensuit que le premier juge a bien apprécié le fondement de la responsabilité » ;
Attendu que par ces énonciations, l'arrêt attaqué, qui relève par ailleurs que le maître est responsable des fautes de son préposé quand celui-ci est sous sa direction, même s'il a enfreint les ordres, n'a nullement violé le texte visé aux moyens et a suffisamment motivé sa décision, lui donnant ainsi une base légale ;
D'où il suit que les moyens réunis sont autant irrecevables que non fondés ;
Sur le troisième de cassation, pris de la dénaturation des faits de la cause et développé comme suit :
« Il a été omis sciemment par le Tribunal de Grande instance et la Cour d'Appel de Yaoundé que Soriloges Voyages avait une assurance qu'elle a fait jouer dès la connaissance de l'accident ;
« C'est Soriloges Voyages qui a repris le véhicule accidenté et l'a placé chez son garagiste ;
«La société Nessi Bigeault Schmitt n'a pu contrôler ni les dégâts, ni les jours d'immobilisation ;
« L'assurance souscrite par le contrat de location couvrait ces risques ;
« Les décisions qui ignorent le rôle de l'assurance dans un accident survenu après un vol encourent cassation » ;
Attendu que par son développement le moyen au demeurant non articulé est ainsi irrecevable ;
D'où il suit que comme les deux premiers, le troisième moyen est autant irrecevable que non fondé ;
Et attendu que l'arrêt attaqué est régulier ;
PAR CES MOTIFS
REJETTE le pourvoi ;
CONDAMNE la demanderesse aux dépens ;
ORDONNE qu'à la diligence de Monsieur le Procureur Général près la Cour suprême, le présent arrêt sera imprimé et transmis pour être transcrit sur les registres du Greffe de la Cour d'Appel du Centre et que mention en sera faite en marge ou à la suite de la décision attaquée.",ARRET_N_8_CC_DU_29_OCTOBRE_1998,0,arret,"{'Court': 'COUR SUPRÊME DU CAMEROUN', 'Chamber': 'Chambre Civile et Commerciale', 'Section': '', 'Case': '', 'Appeal': '', 'Claimant': 'SOCIÉTÉ NESSI BIGEAULT SCHMITT', 'Against': 'C/', 'Defendant': 'SORILOGES VOYAGES', 'Judgment': 'ARRET N°8/CC DU 29 OCTOBRE 1998'}"
