URL,text,page_title,page_label,category,metadata
https://www.juriafrica.com/lex/arret-20-p-18-novembre-1999-9202.htm,"ARRET N°20/P DU 18 NOVEMBRE 1999

LA COUR,
Vu le mémoire ampliatif transmis au greffe de la Cour suprême le 7 septembre 1990 par Maître Dzeukou Barthélemy, Avocat à Bafoussam ;
Sur le moyen unique de cassation pris en ses deux branches de la violation de la loi, violation des articles 5 et 19 de l'ordonnance n°72/4 du 26 août 1972 ; insuffisance de motifs, manque de base légale, ensemble violation de l'article 155 du code d'instruction criminelle ;
En ce que premièrement,
«Il ressort des qualités de l'arrêt attaqué que la Cour d'Appel était ainsi composée :
«... Monsieur Deba Martin Ayuck, Vice-Président de la Cour d'Appel de Bafoussam, Président de la chambre correctionnelle ;
«En présence du Substitut Général près la Cour d'Appel de Bafoussam occupant le banc du Ministère Public ;
« Qu'on relève là une omission du nom du magistrat qui a occupé le banc du Ministère Public à l'audience du 4 mars 1988 alors que l'article 19 de l'ordonnance n°72/4 du 26 août 1972 rend obligatoire la présence d'un magistrat du Parquet en matière pénale, pour l'exercice de l'action publique et que d'autre part l'article 38 du code de procédure civile énonce ce qui suit :
« Les jugements sont rédigés en minute. Ils énonceront qu'ils ont été rendus en audience publique et indiqueront clairement la date à laquelle ils ont été rendus. Ils contiendront les noms des magistrats et du greffier qui auront siégé » ;
« L'arrêt ayant omis d'indiquer dans ses qualités le nom du magistrat ayant occupé le banc du Ministère Public à la date à laquelle il a été rendu et se bornant à indiquer la présence du Substitut Général près la Cour d'Appel, viole le texte visé au moyen ;
D'où il suit qu'il encourt la cassation » ;
Attendu que l'indication par un jugement ou un arrêt de la présence d'un magistrat du Parquet à l'audience au cours de laquelle décision est intervenue suffit à conférer sur ce point sa régularité à ladite décision, peu importe que le nom du magistrat n'y soit pas mentionné, les magistrats du Parquet étant indivisibles et ne participant pas à la formation du jugement ou de l'arrêt ;
En ce que deuxièmement :
« L'arrêt confirmatif attaqué, à la suite du jugement entrepris s'est basé sur les déclarations du témoin Njingam Soule entendu lors du transport judiciaire du 31 mars 1984 (cote PA/3) pour aboutir à la relaxe des prévenus alors que ce témoin n'avait pas prêté serment conformément à l'article 155 du code d'instruction criminelle ;
«Bien plus, il n'apparaît nulle part de l'arrêt attaqué, les indications relatives à l'identité, la profession ou la demeure du témoin ;
«Attendu que les dispositions de l'article 155 du code d'instruction criminelle sont prescrites à peine de nullité ;
«Que la Cour suprême a déjà rendu de nombreuses jurisprudences dans ce sens... ;
«Attendu que toute décision de justice doit contenir des motifs propres à la justifier ; que l'insuffisance de motifs est équivalente à un manque de motifs ;
«Qu'en statuant comme ils l'ont fait, les juges du fond n'ont pas donné de base légale à leur décision qu'ils exposent à la censure » ;
Attendu que le jugement avant dire droit n°825 du 29 mars 1985 auquel se réfère celui du fond, énonce en son second rôle que «Le témoin a été entendu en ses dépositions, serment préalablement prêté de dire toute la vérité, rien que la vérité » ;
Or l'unique témoin dans la cause est le nommé Njingam Soule identifié et entendu lors de la descente sur les lieux intervenue le 31 mars 1984 ;
Attendu que par ces énonciations suffisantes et pertinentes le premier juge et à sa suite celui d'appel ont donné une base légale à leurs décisions ;
D'où il suit que le moyen en ses deux branches n'est pas fondé et que le pourvoi encourt le rejet ;
PAR CES MOTIFS
REJETTE le pourvoi ;
CONDAMNE le demandeur aux dépens ;
ORDONNE qu'à la diligence de Monsieur le Procureur Général près la Cour suprême, le présent arrêt sera imprimé et transmis pour être transcrit sur les registres du Greffe de la Cour d'Appel de l'Ouest et que mention en sera faite en marge ou à la suite de la décision attaquée.",ARRET_N_20_P_DU_18_NOVEMBRE_1999,0,arret,"{'Court': 'COUR SUPRÊME DU CAMEROUN', 'Chamber': 'Chambre Pénale', 'Section': '', 'Case': '', 'Appeal': '', 'Claimant': 'NJILAKAGNAN NGOUMCHEME', 'Against': 'C/', 'Defendant': 'MINISTÈRE PUBLIC, MENCHAMO ABDOULAYE ET AUTRE', 'Judgment': 'ARRET N°20/P DU 18 NOVEMBRE 1999'}"
