URL,text,page_title,page_label,category,metadata
https://www.juriafrica.com/lex/arret-103-cc-17-septembre-1998-10777.htm,"ARRET N°103/CC DU 17 SEPTEMBRE 1998

LA COUR,
Vu le mémoire ampliatif déposé le 26 mai 1989 par Maître Pensy, Avocat à Douala ;
Sur le moyen soulevé d'office, pris de la violation de la loi, violation des articles 39 et 214 du code de procédure civile et commerciale, en ce que l'arrêt attaqué n'a repris ni dans ses qualités, ni dans ses motifs, le contenu de l'acte introductif d'instance, en l'espèce la requête d'appel;
Attendu qu'il résulte des dispositions combinées des textes visés au moyen que les jugements et arrêts doivent, soit dans leurs qualités, soit dans leurs motifs, reproduire entre autres éléments, le contenu de l'acte introductif d'instance, les motifs et le dispositif des conclusions ;
Qu'il s'agit d'une formalité substantielle destinée à permettre à la Cour suprême d'exercer son contrôle sur la régularité de la décision, notamment sur l'étendue de la demande et qui est liée à l'obligation faite aux juges de motiver leurs décisions ;
Attendu, en l'espèce, que l'arrêt se borne à indiquer dans ses qualités que :
« Par requête en date du 13 mai 1987, la Société Camerounaise de Banque, Agence de Douala déclarait relever appel du jugement sus-énoncé » ;
Que cette seule référence ne saurait répondre au voeu de la loi ;
D'où il suit que le moyen est fondé et que l'arrêt attaqué encourt la cassation ;
PAR CES MOTIFS
CASSE ET ANNULE l'arrêt n°185/c rendu le 17 juin 1988 par la Cour d'Appel de Douala ;
REMET en conséquence la cause et les parties au même et semblable état où elles étaient avant ladite décision et, pour être fait droit, les renvoie devant la Cour d'Appel de Bafoussam ;
RESERVE les dépens ;
ORDONNE qu'à la diligence de Monsieur le Procureur Général près la Cour suprême, le présent arrêt sera imprimé et transmis pour être transcrit sur les registres du Greffe de la Cour d'Appel de Douala et que mention en sera faite en marge ou à la suite de la décision annulée.",ARRET_N_103_CC_DU_17_SEPTEMBRE_1998,0,arret,"{'Court': 'COUR SUPRÊME DU CAMEROUN', 'Chamber': 'Chambre Civile et Commerciale', 'Section': '', 'Case': '', 'Appeal': '', 'Claimant': 'SCB', 'Against': 'C/', 'Defendant': 'SOCIÉTÉ LABEL 5', 'Judgment': 'ARRET N°103/CC DU 17 SEPTEMBRE 1998'}"
