URL,text,page_title,page_label,metadata
https://www.juriafrica.com/lex/arret-17-civ-15-juillet-2010-8832.htm,"L'an deux mille dix et le quinze du mois de juillet ;
La Cour Suprême statuant en matière de droit civil ;
En son audience publique de vacation a rendu l'arrêt dont la teneur suit :
ENTRE:
ENYOUGOU ADA Antoine, demandeur en cassation, représenté par Maître André Léonard NDEM, avocat à Yaoundé ;
D'UNE PART
E T,
La succession MANI Michel défenderesse à la cassation ;
D'AUTRE PART
En présence de Monsieur Raymond Landry BOUELET, Avocat Général près la Cour Suprême ;
Statuant sur le pourvoi formé par Maître André Léonard NDEM, avocat à Yaoundé, agissant au nom et pour le compte de ENYOUGOU ADA Antoine, par lettre enregistrée le 26 octobre 2005 au greffe de la Cour d'Appel du Centre, en cassation de l'arrêt n° 28/Civ rendu le 19 octobre 2005 par la Cour d'Appel du Centre, dans l'instance civile opposant son client à la succession MANI Michel ;
LA COUR
Après avoir entendu en la lecture du rapport, Monsieur Dagobert BISSECK, Conseiller à la Cour Suprême ;
Vu les conclusions de Monsieur Martin RISSOUK à MOULONG, Procureur Général près la Cour Suprême ;
Vu le mémoire ampliatif déposé le 21 août 2008 par Maître André Léonard NDEM, avocat à Yaoundé ;
Sur le moyen de cassation soulevé d'office pris de la violation de la loi, violation de l'article 5 de l'ordonnance n° 72/4 du 26 août 1972, insuffisance de motifs, défaut de motif :
En ce que l'arrêt attaqué qui a infirmé le jugement entrepris n'a pas apporté des motifs suffisants de nature à combattre ceux retenus par le premier juge ;
Alors qu'aux termes du texte susvisé « toute décision judiciaire doit être motivée en fait et en droit à peine de nullité » ;
Qu'il en résulte que le juge d'appel qui infirme la décision du premier juge doit discuter et anéantir les arguments de celui-ci par les siens qui doivent être plus convaincants ;
Attendu en l'espèce que pour aboutir au partage égal du terrain objet du titre foncier n° 28191/Mfoundi en indivision entre les parties au procès, le jugement entrepris énonce ce qui suit :
Il n'a été produit aux débats aucun document revêtu de la forme exigée et prouvant qu'une transaction immobilière avait été conclue entre MANI Michel et ENYOUGOU ADA ;
Qu'en outre aucune contestation n'a été faite dans le délai après la publication au journal du 15 octobre 1987 ;
Que la résolution du chef de 2e degré prise le 13 février 1988 en vue de revenir sur la superficie d'ENYOUGOU n'est pas une procédure régulière de contestation dans la procédure d'immatriculation ;
Qu'il convient de rejeter comme non fondées les prétentions de la succession susnommée pour ce qui est de la superficie revenant à ENYOUGOU ADA » ;
Attendu que pour infirmer ce jugement sur ce point, l'arrêt attaqué énonce à son tour que :
Considérant que la Cour est descendue sur le terrain à l'effet de vérifier la matérialité des faits allégués par les parties et procéder à l'audition des témoins ;
Que du résultat de cette mission il ressort que l'intimé n'a pas respecté les clauses de vente retenues pour l'obtention du terrain et qu'il ne fait pas partie de la collectivité ;
Considérant qu'au regard des productions devant la Cour, il convient d'infirmer partiellement le jugement attaqué sur les parts de chacune des parties, statuant à nouveau, attribué au sieur ENYOUGOU une superficie de 1513 m2 »
Attendu qu'en se contentant de ces énonciations qui n'apportent aucune précision ni sur la vente intervenue entre les parties ni sur la collectivité dont ne ferait pas partie le demandeur au pourvoi pourtant propriétaire indivis du terrain litigieux, le juge d'appel a insuffisamment motivé sa décision violant de ce fait le texte visé au moyen ;
D'où il suit que celui-ci est fondé et que l'arrêt attaqué encourt la cassation ;
Sur l'évocation
Attendu que l'affaire est en état au sens de l'article 67 de la loi n° 2006/016 du 29 décembre 2006 fixant l'organisation et le fonctionnement de la Cour Suprême ;
Qu'il y a lieu d'évoquer et de statuer ;
Attendu qu'eu égard aux motifs développés dans le jugement entrepris, il y a lieu de confirmer celui-ci en toutes ses dispositions ;
PAR CES MOTIFS
Casse et annule l'arrêt no 28/Civ rendu le 19 octobre 2005 par la Cour d'Appel du Centre ;
Evoquant et statuant à nouveau, confirme le jugement entrepris en toutes ses dispositions ;
Condamne le demandeur aux dépens ;
Ordonne qu'à la diligence du Greffier en chef de la Chambre Judiciaire de la Cour Suprême, une expédition du présent arrêt sera transmise à Monsieur le Procureur Général près la Cour d'Appel du Centre et au Greffier en Chef de ladite Cour pour mention dans leurs registres respectifs ;
Ainsi jugé et prononcé par la Cour Suprême en son audience publique de vacation du quinze juillet deux mille dix, en la salle des audiences de la Cour où siégeaient :
MM : Alexis DIPANDA MOUELLE, Premier Président de la Cour Suprême PRESIDENT
Dagobert BISSECK, Conseiller
André BELOMBE, Conseiller
En présence de Monsieur Raymond Landry BOUELET, Avocat Général, occupant le banc du Ministère Public ;
Et avec l'assistance de Maître Appolinaire KOE AMOUGOU, Greffier ;
En foi de quoi, le présent arrêt a été signé par le Président, les Conseillers et le Greffier ;
Approuvant mot rayé nul
LE PRESIDENT, LES CONSEILLERS, LE GREFFIER.-",ARRET_N_17_CIV_DU_15_JUILLET_2010,0,"{'Court': 'COUR SUPREME DU CAMEROUN', 'Chamber': 'CHAMBRE JUDICIAIRE', 'Section': 'SECTION CIVILE', 'Case': 'DOSSIER N° 045/Civ/05', 'Appeal': 'POURVOI N° 12 Du 26 octobre 2005', 'Claimant': 'ENYOUGOU ADA ANTOINE', 'Against': 'C/', 'Defendant': 'SUCCESSION MANI MICHEL', 'Judgment': 'ARRET N°17/CIV DU 15 JUILLET 2010'}"
