URL,text,page_title,page_label,category,metadata
https://www.juriafrica.com/lex/arret-348-civ-24-novembre-2011-8779.htm,"ARRET N° 348/CIV DU 24 NOVEMBRE 2011

L'an deux mille onze et le vingt-quatre du mois de novembre ;
La Cour Suprême, Chambre Judiciaire, Section Civile, siégeant au Palais de Justice de Yaoundé ;
A rendu en audience publique ordinaire, l'arrêt dont la teneur suit .
ENTRE
NGONO ONGUENE, demandeur à la cassation, représenté par Maître NDJODO Maurice, avocat à Yaoundé ,
D'UNE PART
ET
ENYEGUE MBALLA Pierre, défendeur à la cassation, représenté par Maître NDJANA NDJANA, avocat à Yaoundé ,
D'AUTRE PART
Statuant sur le pourvoi formé par Maître Maurice NDJODO,
avocat à Yaoundé, agissant au nom et pour le compte de NGONO ONGUENE, par déclaration faite le 14 avril 2008 au greffe de la Cour d' Apple du Centre, en cassation de l'arrêt n° 113/Civ rendu le 12 mars 2008 par la susdite juridiction statuant en matière civile dans l'instance opposant son client ENYEGUE MBALLA Pierre ;
LA COUR
Après avoir entendu en son rapport Monsieur André BELOMBE, Conseiller à la Cour Suprême ;
Vu les conclusions de Monsieur Martin RISSOUK à MOULONG, Procureur Général ,
Et après en avoir délibéré conformément à la loi ;
Vu les articles 53 (1) et 54 (2) de la loi n° 2006/016 du 29 décembre 2006 fixant l'organisation et le fonctionnement de la Cour Suprême ,
Attendu qu'il résulte des textes de loi susvisés que l'avocat constitué doit à peine de déchéance dans les trente (30) jours de la réception de l'avis qui lui est donné par le Greffier en chef de la Chambre, du dépôt du dossier à son greffe, lui faire parvenir un mémoire ampliatif articulant et développant les moyens de droit invoqués à l'appui du pourvoi, en autant d'exemplaires qu'il y a de parties au pourvoi plus cinq (5) ;
Attendu que par déclaration faite le 14 avril 2008 au greffe de la Cour d'Appel du Centre Me NDJODO Maurice, avocat à Yaoundé, conseil du demandeur au pourvoi, s'est pourvu en cassation contre l'arrêt n° 113/Civ rendu le 12 mars 2008 par cette même juridiction statuant en matière civile dans l'instance opposant son client à ENYEGUE MBALLA Pierre ;
Attendu que par lettre n° 1362/GCS/SCC/DL du 28 octobre 2010 du Greffier en chef de la Chambre judiciaire, Maître NDJODO Maurice a été avisé qu'il disposait d'un délai de trente (30) jours à compter de la date de réception de cette mise en demeure, à peine de déchéance, pour faire parvenir audit greffier un mémoire ampliatif articulant et développant les moyens de droit invoqués à l'appui du pourvoi, en autant d'exemplaires qu'il y a de parties au pourvoi plus cinq (5) ;
Attendu que la lettre susvisée a été notifiée à Maître NDJODO Maurice le 04 novembre 2010 le délai imparti a expiré le 03 décembre 2010 sans que le mémoire réclamé soit produit ;
Qu'en conséquence NGONO ONGUENE doit être déclaré déchu de son pourvoi pour défaut de mémoire ampliatif ;
PAR CES MOTIFS
Déclare NGONO ONGUENE déchu de son pourvoi pour défaut de mémoire ampliatif ;
Le condamne aux dépens ;
Vu l'article 55 (2) de la loi n° 2006/016 du 29 décembre 2006 fixant l'organisation et le fonctionnement de la Cour Suprême ;
Condamne Maître NDJODO Maurice à une amende civile de cinquante mille (50.000) francs ;
Ordonne qu'à la diligence du Greffier en chef de la Chambre Judiciaire de la Cour Suprême, une expédition du présent arrêt sera transmise à Monsieur le Procureur Général près la Cour d'Appel du Littoral et une autre au Greffier en chef de ladite Cour pour mention dans leurs registres respectifs.
Ainsi jugé et prononcé par la Cour Suprême en son audience publique ordinaire les mêmes jour, mois et an que dessus, en la salle des audiences de la Cour où siégeaient :
MM.: Dagobert BISSECK, Président de la Section Sociale, substituant Monsieur le Premier Président de la Cour Suprême, Président
Pius ANDY TAKAM, Conseiller
André BELOMBE, Conseiller
En présence de Monsieur EGBE ACHUO Martin Hilman, Avocat Général occupant le banc du Ministère Public ;
Et avec l'assistance de Maître Virginie ESSAMA, Greffier ;
En foi de quoi le présent arrêt a été signé par le Président, les Conseillers et le Greffier ;
Approuvant mot rayé nul ;
LE PRESIDENT, LES CONSEILLERS, LE GREFFIER.-",ARRET_N_348_CIV_DU_24_NOVEMBRE_2011,0,arret,"{'Court': 'COUR SUPREME DU CAMEROUN', 'Chamber': 'CHAMBRE JUDICIAIRE', 'Section': 'SECTION CIVILE', 'Case': 'Dossier n° 269/Civ/010', 'Appeal': 'Pourvoi n° 44 du 14 avril 2008', 'Claimant': 'NGONO ONGUENE', 'Against': 'C/', 'Defendant': 'ENYEGUE MBALLA PIERRE', 'Judgment': 'ARRET N° 348/CIV DU 24 NOVEMBRE 2011'}"
