URL,text,page_title,page_label,category,metadata
https://www.juriafrica.com/lex/arret-28-p-26-octobre-2000-10396.htm,"ARRET N°28/P DU 26 OCTOBRE 2000

LA COUR,
Vu le mémoire ampliatif déposé le 20 août 1997 par Maître Ntsamo Etienne, Avocat à Nkongsamba ;
Sur le second moyen de cassation pris de la violation de la loi, violation de l'article 5 de l'ordonnance n°72/4 du 26 août 1972, ensemble l'article 239 du code pénal ;
En ce que :
« A la suite du premier juge, le juge d'appel a retenu le prévenu dans les liens de la prévention de trouble de jouissance alors qu'il est ressorti des différentes dépositions des témoins devant la Cour d'Appel qu'au moment où le partage a eu lieu entre sieur Nguemedjio Simon et le prévenu, dame Ngueguim Jeanne n'occupait plus les lieux depuis plusieurs années à la suite l'abandon du foyer conjugal ;
« Attendu que l'article 239 du code pénal punit celui qui pénètre dans des conditions susceptibles de troubler l'ordre public, dans les terres occupées par autrui ;
« Que toute décision de justice devant être motivée en fait et en droit (article 5 de l'ordonnance n°72/4 du 26 août 1972), l'on ne comprend pas pourquoi les juges du fond ont retenu le prévenu dans les liens de troubles de jouissance ;
« Que bien plus, l'on ne comprend pas pourquoi les juges du fond ont alloué 100.000 francs à la partie civile, alors qu'elle n'a pas déploré des destructions ;
« Qu'en déclarant le prévenu coupable de trouble de jouissance et allouant 100.000 francs à la partie civile, les juges du fond n'ont pas motivé leur décision en fait et en droit » ;
Attendu que ce moyen sous le couvert de la violation de la loi tend à amener la Cour suprême, qui n'est pas un troisième degré de juridiction à procéder à un nouvel examen des faits et des éléments de preuve souverainement appréciés par les juges du fond ;
Attendu au demeurant que pour entrer en condamnation du prévenu, le jugement confirmé par l'arrêt, énonce successivement :
« Attendu que le prévenu reconnaît les faits ;
« Attendu que dame Ngueguim verse au dossier un procès-verbal de constat du 07 octobre 1991... qu'il ressort de cette pièce que la présence de plusieurs vivres et d'une clôture en bambous nouvellement édifiée a été relevée sur les lieux ;
« Que ces énonciations corroborent la déclaration de la partie civile de même que l'aveu circonstancié du prévenu et la déposition des témoins » ;
Puis ;
« Attendu que cette constitution de partie civile bien que recevable en la forme et fondée en son principe est exagérée en son montant...» ;
Attendu que par ces énonciations suffisantes et pertinentes le premier juge et à sa suite celui d'appel ont justifié leurs décisions ;
D'où il suit le moyen est autant irrecevable qu'il n'est pas fondé ;
Sur le second moyen de cassation pris de la violation de la loi, violation de l'article 5 de l'ordonnance n°72/4 du 26 août 1972 ;
En ce que :
Le juge d'appel n'a pas répondu aux conclusions, notamment à la note en délibéré déposée par le prévenu ;
« Attendu que dans sa note en délibéré datée du 22 novembre 1993, le prévenu rappelait au deuxième juge que le délit de trouble de jouissance n'est pas établi dans le cas d'espèce, dans la mesure où c'est la mari de la partie civile qui a cédé cette parcelle au prévenu pour le compte de son défunt père ;
« Que la Cour d'Appel n'a pas cru devoir répondre auxdites conclusions ;
« Que le défaut de réponse aux conclusions est un défaut de motifs (cf. arrêt n°96 du 10 mai 1973, bull n°28 P. 3924) ... » ;
Attendu que les juges du fond ne sont pas tenus de donner suite à une note en délibéré ;
Attendu au surplus qu'il ne ressort pas du dossier qu'une telle note ait été produite aux débats ;
D'où il suit que le moyen manque en fait et que le pourvoi encourt le rejet ;
Et attendu que l'arrêt est par ailleurs régulier ;
PAR CES MOTIFS
REJETTE le pourvoi ;
CONDAMNE le demandeur aux dépens ;
ORDONNE qu'à la diligence de Monsieur le Procureur Général près la Cour suprême, le présent arrêt sera imprimé et transmis pour être transcrit sur les registres du Greffe de la Cour d'Appel de l'Ouest et que mention en sera faite en marge ou à la suite de la décision annulée.",ARRET_N_28_P_DU_26_OCTOBRE_2000,0,arret,"{'Court': 'COUR SUPRÊME DU CAMEROUN', 'Chamber': 'Chambre Pénale', 'Section': '', 'Case': '', 'Appeal': '', 'Claimant': 'DONGMO DIT MOTSA PIERRE', 'Against': 'C/', 'Defendant': 'MINISTÈRE PUBLIC ET NGUEGUIM JEANNE', 'Judgment': 'ARRET N°28/P DU 26 OCTOBRE 2000'}"
