URL,text,page_title,page_label,metadata
https://www.juriafrica.com/lex/arret-62-civ-12-aout-2010-8836.htm,"L'an deux mille dix et le douze du mois d'août ;
La Cour Suprême statuant en matière de droit civil ;
En son audience publique de vacation a rendu l'arrêt dont la teneur suit :
ENTRE:
ETO'O David, demandeur en cassation, représenté par Maître Gabriel Parfait KALDJOB, avocat B.P 7626 Douala ;
D'UNE PART
E T,
Famille BONENDALE, représentée par BEBE ETONDE Moïse, défenderesse à la cassation ;
D'AUTRE PART
En présence de Monsieur Raymond Landry BOUELET, Avocat Général près la Cour Suprême ;
Statuant sur le pourvoi formé par Maître Gabriel Parfait KALDJOB, avocat à Douala, agissant au nom et pour le compte du sieur ETO'O David, par déclaration enregistrée le 30 juillet 2009 au greffe de la Cour d'Appel du Littoral, en cassation de l'arrêt n° 099/C rendu le 18 juillet 2008 en matière civile et commerciale par cette même juridiction dans l'affaire opposant son client à la famille BONENDALE représentée par BEBE ETONDE Moïse ;
LA COUR
Après avoir entendu en la lecture de son rapport, Monsieur Jean Jacques BIKOUE, Conseiller à la Cour Suprême ;
Vu les conclusions de Monsieur Martin RISSOUK à MOULONG, Procureur Général près la Cour Suprême ;
Et après en avoir délibéré conformément à la loi ;
Vu le mémoire ampliatif déposé par Maître KALDJOB le 26 janvier 2010 ;
Sur le premier moyen de cassation pris de la violation de la loi, violation de l'article 2 du code de procédure civile et commerciale ;
En ce que :
Attendu que selon ce texte, seulement une personne ayant qualité peut saisir le juge ;
Attendu que la qualité du demandeur en justice est appréciée au moment de l'introduction de l'action ;
Que la famille BONENDALE AKWA-NORD était légalement représentée par sieur EYIDI ETONDE Marcel, chef de famille et sieur BEBE ETONDE Moïse en vertu des pouvoirs à eux conférés suivant procès-verbal en date du 27 mai 1998 déposé en authentification chez le notaire ;
Que sieur BEBE ETONDE Moïse ne pouvait ester en justice sans le consentement, mieux contre le gré de sieur EYIDI ETONDE Marcel, chef de famille BONENDALE ; les deux devant toujours agir ensemble pour la validité de l'acte ;
Qu'il est aisé de constater que sieur EYIDI ETONDE Marcel, chef de famille a expressément dénoncé les manoeuvres frauduleuses de sieur BEBE ETONDE Moïse dans son courrier du 16 septembre 2003 dont ampliation a été faite à toutes les autorités et dont les termes suivent : (cf pièce n° 7)
Monsieur le Président,
Reconfirmant ma correspondance citée en marge et en ma qualité de chef de famille BONENDALE BONAMOUANG, propriétaire des titres fonciers précités, j'ai l'honneur de vous dire que les morcellements sur ces titres fonciers suite au protocole d'accord de partage passé chez Maître NKOUE, notaire de son état sous le n°1756 du 06 novembre ne sauraient être contestés pour quelques raisons que ce soit ;
Ces actes authentiques ont été passés d'une façon régulière et consensuelle : aucune action judiciaire contre ce protocole n'est acceptée. Je ne saurais être mêlé de près ou de loin pour tout acte contraire au droit revenant aux accords passés ;
Ceux qui les poseront assureront seuls la responsabilité et répondront seuls devant toute juridiction compétente ;
Les morcellements seront faits au profit de Monsieur SIMO, à ses ayants droit sur les titres fonciers n° 027215 et 27216 issus de ce protocole ;
Je me désolidarise de toute action visant à nuire aux droits de Monsieur SIMO ou à ses ayants droits allusions faites aux diverses assignations que pourrait recevoir Monsieur SIMO ou ses ayants droit ;
Tous droits réservés »
Que le courrier dont s'agit a été notifié par exploit d'huissier en dates des 24 et 25 septembre 2003, notification faite tant à Monsieur le Procureur de la République près les Tribunaux de Première et Grande Instance de Douala-Bonanjo, Monsieur le Procureur de la République près le Tribunal de Première Instance de Douala-Ndokoti, Monsieur le Chef de Service Provincial du Domaine du Littoral, Monsieur le Chef de Service Provincial du Cadastre du Littoral, Maître DJEMENI Joseph, conseil de la famille BONENDALE BONAMOUANG que les notaires, Maîtres NKOUE MAWAFO et MANDENGUE ;
« Qu'il appert de ce qui précède que sieur BEBE ETONDE Moïse ne saurait agir pour le compte de la famille BONENDALE AKWA-NORD contre le gré du chef de famille légalement habilité à cet effet ;
Que dès lors, sieur BEBE ETONDE Moïse n'avait point seul qualité pour assigner le requérant par-devant le premier juge au nom de la famille BONENDALE;
Que par ailleurs, aux termes des dispositions de l'article 1984 du code civil, le mandat ou procuration est un acte par lequel une personne donne à une autre le pouvoir de faire pour le mandant et en son nom ;
Que celui-ci ne peut se concevoir ad eternam, le mandat finissant par révocation du mandataire et la constitution d'un nouveau ;
Que par acte n° 3612 du 07 août 2007 du répertoire de Maître MANDENGUE, notaire à Douala, la famille BONENDALE a révoqué le mandat de représentation donné à sieur BEBE ETONDE Moïse suivant acte n° 621 du 27 mai 1998 du répertoire de Maître NKOUE MAWAFO FONKOUA, notaire à Douala ;(cf pièce n° 8)
Que dès lors que son mandat était révoqué le 07 août 2007 et notification à lui faite, sieur BEBE ETONDE Moïse était sans qualité pour continuer à agir au nom et pour le compte de la famille BONENDALE, tout acte par lui posé étant nul et de nul effet ;
Que sieur EYIDI ETONDE Marcel l'a d'ailleurs souligné en demandant le désistement d'instance de la famille BONENDALE représentée par lui ainsi que l'atteste ses écritures versées dans le dossier de la procédure de la Cour d'Appel du Littoral statuant en matière civile et commerciale en son audience du 18 janvier 2008 ; (cf pièce n° 9)
Qu'en confirmant par adoption des motifs la décision du premier juge alors même que sieur BEBE ETONDE Moïse n'avait plus qualité pour agir au nom et pour le compte de la famille BONENDALE, en ignorant la révocation du mandat de sieur BEBE ETONDE et la désignation de sieur EYIDI ETONDE Marcel comme seul représentant de la famille BONENDALE qui s'est d'ailleurs désisté en appel de la décision d'instance rendue contre le requérant, la Cour d'Appel du Littoral a délibérément violé les dispositions légales ;
Qu'au regard de ce qui précède, il échera à la juridiction de céans de dire fondé le moyen sus visé et d'annuler partant la décision querellée en ce point » ;
Attendu qu'aux termes de l'article 2 du code de procédure civile et commerciale :
« En matière civile et commerciale, les parties pourront, devant toutes les juridictions, agir et se défendre elles-mêmes, verbalement ou par le ministère des avocats-défenseurs... les parties pourront se faire représenter devant cette juridiction par un mandataire de leur choix, muni d'un pouvoir écrit et exprès et agréé par le juge... »
Qu'il en résulte que l'appartenance d'un individu à une collectivité coutumière ne peut à elle seule, lui conférer le droit de représenter le groupe en justice. Ladite appartenance ne pouvant être interprétée comme emportant mandat ;
Attendu qu'en l'espèce, par exploit en date du 15 septembre 2003, la famille BONENDALE représentée par le sieur BEBE ETONDE Moïse, prétendant agir au nom de celle-ci, a assigné le sieur ETO'O David et Maître NKOUE MAWAFO pour faire annuler l'acte de vente dressé par ce notaire le l' mars 2002, prétendument passé entre lui-même, EYIDI ETONDE Marcel et ETO'O David et portant sur une partie de l'immeuble objet du titre foncier n° 27215/Wouri ;
Que par le même acte, l'expulsion du sieur ETO'O David a été demandée au motif que l'acte de vente constitue un faux ;
Attendu que la Communauté BONENDALE AKWA-NORD représentée par le sieur EYIDI ETONDE Marcel, son chef, mandaté pour agir ensemble et de concert avec le sieur BEBE ETONDE Moïse a contesté l'initiative unilatérale de ce dernier et a finalement révoqué son mandat ;
Que par le jugement n° 592 du 25 mai 2005 du Tribunal de Grande Instance du Wouri l'acte de vente a été annulé alors que la demande d'expulsion a été rejetée ;
Attendu que par acte notarié n° 3612 du 07 août 2007 du répertoire de Maître Jean Pierre EYOUM MANDENGUE notaire à Douala, le mandat du sieur BEBE ETONDE Moïse a été révoqué par la famille BONENDALE ;
Attendu que sur appel du sieur ETO'O David, est intervenu l'arrêt contradictoire n° 099/C rendu le 18 juillet 2008 qui a cependant confirmé partiellement le jugement rendu sur l'annulation de la vente ;
Attendu pourtant qu'il ressort clairement des qualités de l'arrêt que le pouvoir dont se prévaut le sieur BEBE ETONDE Moïse pour ester en justice au nom de la famille BONENDALE est contesté en ces termes :
Constater que sieur BEBE ETONDE Moïse a été révoqué de son mandat de représentant de la famille BONENDALE par acte notarié n° 3612 du 07 août 2007 du répertoire de Maître Jean Pierre EYOUM MANDENGUE notaire à Douala ;
Dire et juger en application des articles 2003 et 2006 du Code Civil que sieur BEBE ETONDE n'est plus habileté à parler au nom de ladite famille ;
Constater que ceci étant que sieur BEBE ETONDE perd toute qualité pour ester en justice au nom de la famille BONENDALE ;
Attendu qu'en confirmant le jugement n° 592 rendu le 25 mai 2005 alors que le sieur BEBE ETONDE Moïse n'avait aucun pouvoir pour représenter seul la famille BONENDALE, l'arrêt attaqué a violé les dispositions légales sus évoquées ;
Qu'il s'ensuit que le moyen est fondé et que ledit arrêt encourt la cassation ;
Sur l'évocation :
Attendu qu'aux termes de l'article 67 alinéa 2 de la loi n° 2006/026 du 29 décembre 2006 :
« 2) Lorsque la Chambre casse et annule la décision qui lui est déférée, elle évoque et statue si l'affaire est en état d'être jugée au fond ;
« L'affaire est reconnue en état d'être jugée au fond lorsque les faits, souverainement constatés et appréciés par les juges du fond, permettent d'appliquer la règle de droit appropriée » ;
Que tel est le cas en la cause ;
Attendu que pour les mêmes raisons qui ont conduit à la cassation de l'arrêt, il convient de déclarer l'action du sieur BEBE ETONDE Moïse irrecevable pour défaut de qualité et de le condamner aux dépens ;
PAR CES MOTIFS
La Cour casse et annule l'arrêt n° 99/C rendu le 18 juillet 2008 par la Cour d'Appel du Littoral ;
Evoquant et statuant ;
Déclare l'action de BEBE ETONDE Moïse irrecevable pour défaut de qualité ;
le condamne aux dépens ;
Ordonne qu'à la diligence du Greffier en chef de la Chambre Judiciaire de la Cour Suprême, une expédition du présent arrêt sera transmise à Monsieur le Procureur Général près la Cour d'Appel du Littoral et une autre au Greffier en Chef de ladite Cour pour mention dans leurs registres respectifs ;
Ainsi jugé et prononcé par la Cour Suprême en son audience publique de vacation du douze août deux mille dix, en la salle des audiences de la Cour où siégeaient :
MM : Alexis DIPANDA MOUELLE, Premier Président de la Cour Suprême, Président de la Section Civile,
PRESIDENT
Pius ANDY TAKAM, Conseiller
Jean Jacques BIKOUE, Conseiller
En présence de Monsieur Raymond Landry BOUELET, Avocat Général, occupant le banc du Ministère Public ;
Et avec l'assistance de Maître Appolinaire KOE AMOUGOU, Greffier ;
En foi de quoi, le présent arrêt a été signé par le Président, les Conseillers et le Greffier ;
Approuvant mot rayé nul
LE PRESIDENT, LES CONSEILLERS, LE GREFFIER.-",ARRET_N_62_CIV_DU_12_AOUT_2010,0,"{'Court': 'COUR SUPREME DU CAMEROUN', 'Chamber': 'CHAMBRE JUDICIAIRE', 'Section': 'SECTION CIVILE', 'Case': 'DOSSIER N° 222/Civ/09', 'Appeal': 'POURVOI N° 120 du 30 juillet 2009', 'Claimant': ""ETO'O DAVID"", 'Against': 'C/', 'Defendant': 'FAMILLE BONENDALE, REPRÉSENTÉE PAR BEBE ETONDE MOÏSE', 'Judgment': 'ARRET N° 62/CIV DU 12 AOÛT 2010'}"
