URL,text,page_title,page_label,metadata
https://www.juriafrica.com/lex/arret-204-20-juillet-2000-37737.htm,"LA COUR,
Vu le mémoire ampliatif déposé le 29 octobre 1991 par Maître Djuikom-Mobi, Avocat à Bafoussam ;
Sur le moyen unique de cassation pris en sa première branche de la violation de la loi, violation des dispositions de l'article 5 de l'ordonnance n°72/4 du 26 août 1972, insuffisance de motifs, manque de base légale ;
« En ce que l'arrêt dont pourvoi a alloué 500.000 francs à Youmbi Michel à titre de dommages-intérêts sans relever ni la nature du préjudice (préjudice matériel, préjudice moral), sans relever l'importance et l'étendue de ce préjudice et sans procéder à la ventilation des sommes ainsi allouées ;
« Mais attendu qu'il est de jurisprudence constante de la Cour Suprême de céans que l'évaluation des dommage s-intérêts doit être faite avec indication du montant correspondant à chaque nature distincte de préjudice subi « (cf. CS arrêt n°217 du 23 juin 1970 Bull. 22 P. 2667 — CS arrêt n°4/Soc du 19 octobre 1965 Bull. 13 P. 1215...) » ;
Attendu qu'aux termes des dispositions légales visées au moyen, toute décision de justice doit, à peine de nullité d'ordre public, être motivée en fait et en droit ;
Qu'il en résulte que l'insuffisance de motifs équivaut à un défaut de motifs ;
Attendu en l'espèce que pour allouer entre autres la somme de 500.000 francs à Youmbi Michel à titre de dommages-intérêts, le jugement entrepris se borne à énoncer
« ...Attendu que la Société camerounaise de Diffusion et d'Exploitation cinématographique n'apporte aucune preuve établissant que le licenciement du demandeur est légitime ;
« ...Que l'action engagée par Youmbi Michel contre la Société camerounaise de Diffusion et d'Exploitation cinématographique apparaît donc fondée ;
« ...Qu'il échet d'y faire droit et d'accorder au demandeur les sommes ci-après...» ;
Attendu que par ces énonciations, par ailleurs sommaires qui ne spécifient ni la nature ni l'étendue du préjudice le juge d'instance n'a pas suffisamment motivé sa décision qui manque de ce fait de base légale ;
Qu'en confirmant purement et simplement le jugement par sa décision critiquée la Cour d'Appel a emprunté les irrégularités dont il est entaché ;
D'où il suit que le moyen est fondé et que l'arrêt attaqué encourt la cassation ;
PAR CES MOTIFS
CASSE ET ANNULE l'arrêt n°20/Soc rendu le 2 février 1989 par la Cour d'Appel de l'Ouest à Bafoussam ;
REMET en conséquence la cause et les parties au même et semblable état où elles étaient avant ladite décision et, pour être fait droit, les renvoie devant la même Cour autrement composée ;
ORDONNE qu'à la diligence de Monsieur le Procureur Général près la Cour Suprême, le présent arrêt sera imprimé et transmis pour être transcrit sur les registres du Greffe de la Cour d'Appel de l'Ouest et que mention en sera faite en marge ou à la suite de la décision annulée.",ARRET_N_204_S_DU_20_JUILLET_2000,0,"{'Court': 'COUR SUPRÊME DU CAMEROUN', 'Chamber': 'Chambre sociale', 'Section': '', 'Case': '', 'Appeal': '', 'Claimant': ""SOCIÉTÉ CAMEROUNAISE DE DIFFUSION ET D'EXPLOITATION CINÉMATOGRAPHIQUE"", 'Against': 'C/', 'Defendant': 'YOUMBI MICHEL', 'Judgment': 'ARRET N° 204/S DU 20 JUILLET 2000'}"
