URL,text,page_title,page_label,metadata
https://www.juriafrica.com/lex/arret-184-28-septembre-2006-32811.htm,"L'an deux mille six et le Vingt Huit Septembre ;
La Cour Suprême, statuant en matière de droit Social ;
En son audience publique de vacation a rendu l'arrêt dont la teneur suit :
ENTRE:
La S.N.I., représentée par Maître GUY NOAH,
Avocat à Yaoundé et AYISSI Benoît représenté par Maître NOMO BELLA Joachim, Avocat à Yaoundé, défendeurs en cassation ;
D'UNE PART
E T les mêmes parties, défenderesses à la cassation ;
D'AUTRE PART
En présence de Monsieur EJANGUE ERAMBI, Avocat Général près la Cour Suprême ;
Statuant sur le pourvoi formé par Maître NOMO BELLA, Avocat à Yaoundé, agissant au nom et pour le compte de AYISSI Benoît, suivant déclaration faite au Greffe de la Cour d'Appel du Centre et enregistrée le 19 novembre 2003, sous le n° 55, en cassation de l'arrêt n° 17/S du 04 novembre 2003 rendu en matière. Sociale par la susdite juridiction dans l'affaire opposant son client à la Société Nationale d'Investissement (SNI) ;
LA COUR
Après avoir entendu en la lecture de son rapport, Monsieur BIKOUE Jean Jacques, Conseiller à la Cour Suprême ;
Vu les conclusions de Monsieur Martin RISSOUK à MOULONG, Procureur Général près la Cour Suprême ;
Et après en avoir délibéré conformément à la loi ;
Vu le mémoire ampliatif déposé par Maître NOMO BELLA Joachim, Avocat à Yaoundé ;
Sur le moyen unique de cassation pris de la violation de la loi, violation des articles 20(1), 21(1) et (2) de l'ordonnance n° 72/4 du 26 août 1972 et ainsi présenté :
«Attendu qu'il résulte des dispositions de l'article 20(1) de l'ordonnance n°72/4 du 26 Août 1972 sus-visé que : «Toute affaire relevant de la Cour d'Appel est jugée par trois Magistrats du siège, membres de ladite Cour» ;
Que mieux encore, il ressort des dispositions impératives de l'article 21(1 et 2) que :
«Par dérogation aux dispositions de l'article 20(1), et sous réserve de celles de l'article 20(2), le Président de la Cour d'Appel ou un Magistrat de siège de ladite Cour, a compétence pour statuer sur les appels interjetés à l'encontre des décisions qui sont déférées ;
Lorsque la Cour composée ainsi qu'il est dit à l'alinéa 1er du présent article, statue en matière sociale, elle est complétée conformément à l'article 143 du code du travail et applique la procédure prévue dans ledit code» ;
Qu'à l'analyse succincte des dispositions textuelles qui précèdent, il découle qu'en matière sociale, la Cour d'Appel ne peut être composée que par trois Magistrats de siège ou par un Magistrat de siège assisté d'un assesseur employeur et d'un assesseur employé ;
« Qu'en l'espèce, l'arrêt attaqué a été rendu par la Cour d'Appel du Centre statuant en matière
sociale composée de trois magistrats de siège et de deux assesseurs ainsi qu'il suit :
« Madame SIEWE TCHOUATCHA Yvette, Vice Président de la Cour d'Appel du Centre, Président,
« Madame NGAKOU Anastasie, Conseiller à la Cour d'Appel du Centre, Membre,
« Monsieur MENGANG Salomon, Conseiller à la Cour d'Appel du Centre, Membre,
«MEDJO MEZENGUE Aloys, Assesseur employeur,
«AMOUGOU AMOUGOU Gallus, Assesseur employé ;
« Qu'il est donc clair qu'une telle composition de la Cour d'Appel statuant en matière sociale est aux antipodes des dispositions légales sus évoquéees ;
«Que c'est donc à bon droit que l'arrêt entrepris mérite cassation» ;
Attendu qu'aux termes du texte visé au moyen :
« Article 20(1) Toute affaire relevant de la Cour d'Appel est jugée par trois Magistrats du siège membres de ladite Cour» ;
«Article 21(1) par dérogation aux dispositions de l'article 20(1) et sous réserve de celles de l'article 20(2), le Président de la Cour d'Appel ou un magistrat du siège de ladite Cour, a compétence pour statuer sur les appels interjetés à l'encontre des décisions qui sont déférées ;
« (2) Lorsque la Cour composée ainsi qu'il est dit à l'alinéa 1 du présent article, statuent en matière sociale, elle est complétée conformément à l'article 143 du code du travail (devenu article 133 dans la loi n°92/7 du 14 août 1992) et applique la procédure prévue par ledit code» ;
Qu'il en résulte que statuant en matière sociale, la Cour d'Appel ne peut être composée que par trois magistrats ou par un magistrat et deux assesseurs employeur et employé ou encore, par un seul magistrat en cas de carence dûment constatée des assesseurs ;
Attendu en l'espèce qu'il ressort des qualités de l'arrêt attaqué que siégeant en la cause, la Cour d'Appel était composée outre du greffier audiencier, de Mesdames SIEWE TCHOUATCHA Yvette, NGAKOU Anastasie, Monsieur MENGANG Salomon, magistrats au siège de ladite Cour, MEDJOME ZENGUE Aloys, AMOUGOU AMOUGOU Gallus, assesseurs employeur et employé ;
Qu'en siègeant en une telle composition, l'arrêt attaqué a violé le texte de loi susvisé ;
Dès lors, le moyen est fondé et ledit arrêt encourt la cassation ;
PAR CES MOTIFS
Casse et annule l'arrêt n° 17/S rendu le 04 novembre 2003 par la Cour d'Appel du Centre ;
Remet la cause et les parties au même et semblable état où elles étaient avant ladite décision et, pour être fait droit, les renvoie devant la même Cour d'Appel autrement composée ;
Ordonne qu'à la diligence de Monsieur le Procureur Général près la Cour Suprême, le présent arrêt sera imprimé et transmis pour être transcrit sur les registres du greffe de la Cour d'Appel du Centre et que mention en sera faite en marge ou à la suite de la décision annulée;
Ainsi jugé et prononcé par la Cour Suprême, en son audience publique de vacation du vingt huit septembre deux mille six, en la salle des audiences de la Cour où siègeaient ;
MM. : Salomon BISSOMBI, Conseiller à la Cour Suprême PRESIDENT
Clément ATANGANA Conseiller
Jean Jacques BIKOUE Conseiller
En présence de Monsieur EJANGUE EKAMBI Adolphe, Avocat Général près la Cour Suprême ;
Et avec l'assistance de Madame EDJOA, Greffier ;
En foi de quoi le présent arrêt a été signé par le Président, les Conseillers et le Greffier ;",ARRET_N_184_S_DU_28_SEPTEMBRE_2006,0,"{'Court': 'COUR SUPREME DU CAMEROUN', 'Chamber': 'CHAMBRE JUDICIAIRE', 'Section': 'SECTION SOCIALE', 'Case': 'DOSSIER n° 27 et 27bis/S/04-05', 'Appeal': 'Pourvois DU 5/11/2003 et N° 11 DU 19/11/2003', 'Claimant': 'S.N.I.ET AYISSI BENOÎT', 'Against': 'C/', 'Defendant': 'AYISSI BENOÎT ET S.N.I', 'Judgment': 'ARRÊT N° 184/S DU 28 SEPTEMBRE 2006'}"
