URL,text,page_title,page_label,category,metadata
https://www.juriafrica.com/lex/arret-2-29-octobre-1998-11717.htm,"ARRET N°2/L DU 29 OCTOBRE 1998

LA COUR,
Vu le mémoire ampliatif déposé le 26 mars 1993 par Maître Dzeukou Barthélemy, Avocat à Bafoussam ;
Sur le moyen unique de cassation pris de la violation de la loi, violation des articles 5 de l'ordonnance n°72/4 du 26 août 1972 et 18 du décret n°69/DF/544 du 19 décembre 1969, insuffisance de motifs, défaut de motifs ;
«En ce que l'arrêt attaqué pour confirmer le jugement entrepris sur la paternité de Sintcheu Isaïe est ainsi motivé (9' page 12' ligne) : ""Que la coutume étant muette en matière de recherche de paternité il convient de se référer au droit écrit qui considère comme un aveu implicite le fait pour un homme de participer à l'entretien (fourniture de layette) de l'enfant non à titre de transaction ou par acte de bienfaisance envers la mère de l'enfant "";
«Alors que la paternité tout comme la filiation en général ne se présume pas, mais se prouve normalement par les moyens de droit prévus à cet effet ;
«Attendu que les jurisprudences de la Cour Suprême sont suffisamment éloquentes sur ce point (sic) ;
«Que la paternité ne peut avoir pour fondement que l'existence des liens de sang, à l'exclusion notamment de toutes considérations sur le versement d'une dot ou toute autre chose aux parents de la mère de l'enfant ; en ce sens Cour Suprême arrêt n°41 du 14 janvier 1964 Bull. 10 P. 789 ;
«Attendu qu'il ressort clairement de cette jurisprudence que c'est l'existence des liens de sang qui gouverne le fondement de la paternité ;
«Que le fait pour le juge d'appel d'avoir mentionné que Sintcheu reconnaît avoir donné de l'argent pour la layette de l'enfant, pour reconnaître par la suite que c'est lui le père de l'enfant dont s'agit, est une méconnaissance totale du principe jurisprudentiel précité ;
«Qu'il va sans dire que le juge d'appel a violé la jurisprudence, et partant, ne donne pas la base légale à sa décision ;
«Attendu par ailleurs que toute décision de justice doit être suffisamment motivée conformément à l'article 18 du décret n°69/DF/54-4 du 19 décembre 1969 ;
«Attendu surabondamment que la Cour d'Appel, en mentionnant au 3' paragraphe de la 8e page que ""Sintcheu Isaïe ne rapporte pas la preuve que Mafowa partageait son intimité avec d'autres personnes que lui en l'occurrence le père de son premier enfant"" reconnaît implicitement mais nécessairement que dame Mafowa avait un autre enfant issu d'un homme autre que le demandeur au pourvoi ;
«Attendu que la preuve de la filiation naturelle, que le législateur n'a pas réglementée, doit au moins résulter de présomptions graves, précises et concordantes ;
«Que les énonciations faites par le juge d'appel sont insuffisantes pour établir la filiation contestée alors et surtout qu'il ressort de l'arrêt déféré que dame Mafowa était une femme libre et avait un autre enfant issu des oeuvres d'un homme différent de Sintcheu ;
«Attendu qu'en décidant comme il l'a fait, le juge d'appel n'a pas suffisamment motivé sa décision qu'il expose à la cassation» ;
Attendu que pour déclarer que l'enfant Mekontso Lionel Franck a pour père le sieur Sintcheu Isaïe, le jugement entrepris dont l'arrêt attaqué a adopté les motifs, énonce entre autres :
«Attendu qu'il ressort clairement des débats à l'audience que la demanderesse et le défendeur ont vécu en concubinage de façon constante, comme l'atteste d'ailleurs leurs photos versées au dossier ;
«Attendu que contrairement à la croyance du défendeur il n'est pas nécessaire d'avoir des relations sexuelles pendant plusieurs mois ou années pour qu'il y ait une conception ;
«Que la vie commune, les photos et l'assistance (l'achat de la layette non à titre de transaction ou de bienfaisance envers la mère ou l'enfant) constituent les indices précis et concordants desquels se déduit la preuve que le défendeur est bien l'auteur de l'enfant Mekontso» ;
Attendu par ailleurs que pour confirmer ce jugement l'arrêt querellé énonce en plus «que la coutume des parties (Bamiléké) étant muette en matière de recherche de paternité, il convient de se référer au droit écrit qui considère comme un aveu tacite de paternité le fait pour un homme de participer à l'entretien (fourniture de la layette) de l'enfant non à titre de transaction ou par acte de bienfaisance envers la mère ou l'enfant » ;
Que tel est le cas de Sintcheu Isaïe qui tout en reconnaissant avoir donné l'argent pour la layette de l'enfant, ne dit ni ne prouve pas que c'était à titre de transaction ou de bienfaisance ;
Attendu que par ces énonciations suffisantes et pertinentes le juge d'appel a donné une base légale à sa décision et n'a nullement violé le texte visé au moyen ;
D'où il suit que celui-ci n'est pas fondé ;
PAR CES MOTIFS
REJETTE le pourvoi ;
CONDAMNE le demandeur aux dépens ;
ORDONNE qu'à la diligence de Monsieur le Procureur Général près la Cour Suprême, le présent arrêt sera imprimé et transmis pour être transcrit sur les registres du Greffe de la Cour d'Appel de Bafoussam et que mention en sera faite en marge ou à la suite de la décision attaquée.",ARRET_N_2_L_DU_29_OCTOBRE_1998,0,arret,"{'Court': 'COUR SUPRÊME DU CAMEROUN', 'Chamber': 'Chambre Traditionnelle', 'Section': '', 'Case': '', 'Appeal': '', 'Claimant': 'SINTCHEU ISAÏE', 'Against': 'C/', 'Defendant': 'MAFOWA CÉCILE', 'Judgment': 'ARRET N°2/L DU 29 OCTOBRE 1998'}"
