URL,text,page_title,page_label,category,metadata
https://www.juriafrica.com/lex/arret-180-p-6-mai-1999-9137.htm,"ARRET N°180/P DU 6 MAI 1999

LA COUR,
Vu l'article 542 du code d'instruction criminelle ;
Vu l'affaire Ministère Public contre Mahingue Daniel;
Attendu que Monsieur le Procureur Général près la Cour suprême a saisi ladite Cour par réquisitions en date du 31 mars 1994 dont la teneur suit :
«Attendu que par correspondance datée à Ebolowa le 3 février 1994 Monsieur le Procureur Général près la Cour d'Appel du Sud transmet à Monsieur le Procureur Général près la Cour suprême, le dossier de procédure de l'affaire contre Mahingue Daniel et autres aux fins de renvoi devant une autre Cour d'Appel ;
«Attendu qu'il relève que la décision frappée d'appel a été rendue par Monsieur Ndeby Pondy Jean Pierre, actuel Président de la Cour d'Appel du Sud, à l'époque magistrat du 4e grade ; qu'aucun magistrat en service au siège de ladite Cour n'a encore accédé au même grade ;
«Attendu qu'aux termes des dispositions de l'article 542 du code d'instruction criminelle en matière criminelle, correctionnelle, de police, la Cour de cassation peut sur la réquisition du Procureur Général près cette Cour, renvoyer la connaissance d'une affaire d'une Cour d'Appel ou d'assises à une autre pour cause de sûreté publique ou de suspicion ;
«Attendu que les raisons invoquées par le Président sont pertinentes ;
Qu'il y a lieu de faire droit à sa demande...» ;
Attendu qu'aux termes de l'article 159 (8) du code de procédure civile et commerciale, constitue une cause de récusation le fait par un magistrat d'avoir précédemment connu du différend comme juge ou comme arbitre ;
Que par ailleurs l'article 9 (4) du statut de la magistrature dispose qu'aucun magistrat ne peut connaître des voies de recours intentées à l'encontre d'une décision rendue par un magistrat hiérarchiquement supérieur ;
Attendu en l'espèce que le Tribunal de Grande instance a rendu sous la présidence de Monsieur Ndeby Pondy, alors magistrat du 4eme grade, le jugement n°6/crim du 28 décembre 1984 qui a été frappé d'appel ;
Que cet appel, au regard du texte susvisé, ne peut être jugé par la Cour d'Appel d'Ebolowa actuellement présidée par Monsieur Ndeby Pondy, les autres magistrats du siège de ladite Cour d'Appel étant par ailleurs du rang inférieur au 4e grade ;
Qu'il y a lieu d'ordonner le renvoi requis ;
PAR CES MOTIFS
ORDONNE le renvoi de la cause dont s'agit devant la Cour d'Appel de Ngaoundéré ;
ORDONNE qu'à la diligence de Monsieur le Procureur Général près la Cour suprême, le présent arrêt sera imprimé et transmis pour être transcrit sur les registres du Greffe de la Cour d'Appel d'Ebolowa ;",ARRET_N_180_P_DU_6_MAI_1999,0,arret,"{'Court': 'COUR SUPRÊME DU CAMEROUN', 'Chamber': 'Chambre Pénale', 'Section': '', 'Case': '', 'Appeal': '', 'Claimant': 'NKOLETAM MARTIN', 'Against': 'C/', 'Defendant': 'MAHINGUE DANIEL ET AUTRES', 'Judgment': 'ARRET N°180/P DU 6 MAI 1999'}"
