URL,text,page_title,page_label,category,metadata
https://www.juriafrica.com/lex/arret-11-18-novembre-1999-37717.htm,"ARRET N° 11/S DU 18 NOVEMBRE 1999

LA COUR,
Vu le mémoire ampliatif déposé le 12 juin 1987 par Maîtres Ninine et Bonnard, Avocats associés à Douala ;
Sur le moyen de cassation soulevé d'office, pris de la violation de la loi, violation de l'article 5 de l'ordonnance n°72/4 du 26 août 1972, insuffisance de motifs, manque de base légale ;
En ce que,
Alors qu'il résulte des pièces du dossier que Bisson Sadrac avait interjeté appel du jugement par requête enregistrée au Greffe du Tribunal de Première instance de Douala sous le n° 419 en date du 27 décembre 1984, le juge d'appel sans se prononcer sur la recevabilité de son recours, lui a alloué une provision de 300.000 francs non obtenue en premier ressort;
Attendu que toute décision de justice doit contenir les motifs propres à la justifier, l'insuffisance de motifs équivalant à un défaut de motifs ;
Attendu qu'en statuant ainsi qu'elle l'a fait, la Cour d'Appel du Littoral a insuffisamment justifié sa décision et violé le texte visé au moyen ;
D'où il suit que celui-ci est fondé et que l'arrêt attaqué a encourt cassation ;
PAR CES MOTIFS
CASSE ET ANNULE l'arrêt n°183/S rendu, le 06 juin 1986 par la Cour d'Appel Douala ;
REMET en conséquence la cause et les parties au même et semblable état où elles étaient avant ladite décision et, pour être fait droit, les renvoie devant la Cour d'Appel de Douala autrement composée ;
ORDONNE qu'a la diligence de Monsieur le Procureur Général près la Cour Suprême, le présent arrêt sera imprimé et transmis pour être transcrit sur les registres du Greffe de la Cour d'Appel de Douala et que mention en sera faite en marge ou à la suite de la décision annulée.",ARRET_N_11_S_DU_18_NOVEMBRE_1999,0,arret,"{'Court': 'COUR SUPRÊME DU CAMEROUN', 'Chamber': 'Chambre sociale', 'Section': '', 'Case': '', 'Appeal': '', 'Claimant': 'SOCIÉTÉ HOLLANDO-CAMEROUN', 'Against': 'C/', 'Defendant': 'BISSON SADRAC', 'Judgment': 'ARRET N° 11/S DU 18 NOVEMBRE 1999'}"
