URL,text,page_title,page_label,metadata
https://www.juriafrica.com/lex/arret-255-p-20-juillet-2000-10203.htm,"LA COUR,
Vu le mémoire ampliatif déposé le 29 juillet 1992 par Maître Tatsinda, Avocat à Bafoussam ;
Sur le deuxième moyen de cassation préalable, pris de la violation de l'article 5 de l'ordonnance n°72/4 du 26 août 1972, portant organisation judiciaire pour défaut ou insuffisance de motifs — manque de base légale — non réponse aux conclusions ;
«En ce que l'arrêt attaqué s'est borné pour confirmer le jugement entrepris qui condamnait Fokou Albert à énoncer :
«Sur l'action publique ;
«Considérant que s'agissant de la culpabilité, le premier juge a fait une saine appréciation des faits de la cause et une exacte application de la loi ;
«Qu'il y a lieu de confirmer sur ce plan ;
«Considérant par ailleurs s'agissant du quantum de la peine que la peine de 40.000 francs d'amende infligée au prévenu par le premier juge est sévère ;
«Que compte tenu du fait qu'il soit délinquant primaire, il y a lieu de lui accorder des circonstances atténuantes et de ramener sa peine à 5.000 francs d'amende assortie du sursis pendant trois ans » ;
Attendu que toute décision judiciaire doit contenir les motifs propres à la justifier ;
Attendu que le juge d'appel pour condamner le prévenu Fokou Albert Alain s'est borné à constater que le premier juge a fait une saine appréciation des faits de la cause et une exacte application de la loi ;
Qu'il y a lieu de confirmer sur ce plan » ;
Attendu que le juge d'appel n'a même pas dit qu'il adoptait les motifs du juge d'instance lesquels n'existaient pas ou étaient insuffisants ;
Attendu qu'en s'abstenant de relever les circonstances de fait d'où résultaient les éléments constitutifs du délit de blessures involontaires, l'arrêt attaqué ne permet pas à la Cour suprême d'exercer son contrôle ;
D'où il suit que la Cour d'Appel n'a pas donné une base légale à sa décision ;
Attendu que la Cour d'Appel de l'Ouest à Bafoussam, sans répondre aux conclusions des demandeurs au pourvoi, a confirmé le jugement non motivé en se bornant à affirmer : «Considérant que le premier juge a fait une saine appréciation des faits de la cause et une exacte application de la loi ;
Qu'il y a lieu de confirmer sur ce point » ;
Attendu qu'aux termes de l'article 5 de l'ordonnance n°72/4 du 26 août 1972 précitée, toute décision judiciaire doit être motivée en fait et en droit ; qu'il en résulte que le défaut de réponse aux conclusions des parties équivaut au défaut de motifs ;
Attendu qu'en l'espèce dans le dispositif de leurs conclusions formelles du 30 janvier 1990 déposées devant le premier juge, reprises nécessairement et complétées par celles du 28 février 1991 déposées régulièrement devant cette juridiction et qui mentionnent:
« Pour le reste, adjuger au concluant l'entier bénéfice de ses précédentes écritures» ; les demandeurs au pourvoi avaient formellement demandé au juge d'instance et d'appel de :
«1) Dire et juger que la partie civile s'est lancée en courant sur la chaussée de la route nationale n°6 pour y pratiquer le sport matinal ;
2) Dire et juger que la partie civile, en transformant la chaussée d'une route nationale en un terrain de sport a violé les dispositions du code de la route, notamment les articles 3 alinéa 1, 22 alinéa 1 et 26 alinéa 6 ;
3) Dire et juger que seules les violations de ces dispositions du code de la route ont contribué à la réalisation du sinistre du 08 octobre 1989 ;
4) Dire et juger que personne n'a le droit de transformer la chaussée en un terrain de sport ;
5) Dire et juger que la victime Soup Tassimo Richard est seule responsable de l'accident survenu le 8 octobre 1989 ;
6) Dire et juger que le véhicule du prévenu n'a joué qu'un rôle passif dans la survenance de l'accident dont s'agit ;
7) Relaxer purement et simplement le prévenu ;
8) Rejeter toutes les demandes de la partie civile car elle seule a provoqué l'accident ;
9) Dire et juger qu'il ne peut y avoir application de la loi du 26 décembre 1958 (article 10) que lorsque la victime n'a pas provoqué l'accident ;
10) Mettre hors de cause Mali Maurice et laisser les dépens à la charge du trésor » ;
Attendu que l'arrêt attaqué s'est borné à confirmer la décision non motivée du premier juge qui n'avait pas de surcroît répondu aux chefs précis des conclusions visées plus haut ; que ce faisant, il a violé l'article 5 de l'ordonnance n°72/4 du 26 août 1972 précitée ;
Attendu qu'en se bornant pour condamner le prévenu à 5.000 francs d'amende et à payer diverses sommes à la partie civile à titre de dommages-intérêts, à affirmer d'une part que sur l'action pénale le premier juge « a fait une saine appréciation des faits de la cause et une exacte application de la loi », d'autre part que « s'agissant du principe des réparations civiles, il y a lieu de confirmer en ce sens et que le premier juge en allouant la somme de 4.348.605 francs à la partie civile à titre des dommages-intérêts a sous-estimé le préjudice et que la Cour dispose d'éléments d'appréciation suffisants pour porter ceux-ci à 14.107.000 francs », sans analyser ni discuter les motifs du premier juge qu'il confirme et qui n'avait alloué à la partie civile que 4.348.605 francs et surtout que le principe même des réparations était contesté tant devant le juge d'instance que d'appel par le prévenu et le civilement responsable, ni répondre aux conclusions formelles des demandeurs au pourvoi déposées devant la premier juge et reprises expressément devant celui d'appel, l'arrêt n'a pas justifié sa décision ni mis la Cour suprême en mesure d'exercer son contrôle ;
Attendu que l'arrêt infirmatif attaqué a porté les dommages-intérêts alloués à la partie civile de 4.348.605 francs à une grosse somme globale 14.107.000 francs, sans constater la nature et l'étendue du préjudice subi par la partie civile ;
Attendu que le juge d'appel se devait de discuter les motifs du premier juge, analyser ou constater les éléments de chacune des demandes, éléments leur permettant d'infirmer et de porter pour :
1) Incapacité permanente partielle de 80% de 3.200.000 francs à 8.000.000 de francs ;
2) Pretium doloris de 500.000 francs à 1.000.000 de francs ;
3) Préjudice d'agrément de 300.000 francs à 2.000.000 de francs ;
4) Frais médicaux de 348.603 francs à 507.000 francs;
Attendu que ce faisant, cet arrêt qui infirme le jugement frappé d'appel sans répondre aux conclusions des intimés qui, en demandant de débouter la partie civile reprenait tous leurs moyens devant la Cour n'est pas motivé ;
Attendu que pour condamner le prévenu à payer les dommages-intérêts à la partie civile Soup Tassimo Richard l'arrêt se borne énoncer : « Considérant par ailleurs que le premier juge en allouant la somme de 4.348.605 francs à la partie civile à titre de dommages-intérêts a sous-estimé les préjudices par elle subis ; que la Cour dispose d'éléments d'appréciation suffisants pour porter ceux-ci à 14.170.000 francs » ;
Attendu qu'il ne résulte pas de ces énonciations la moindre motivation sur la nature des blessures reçues, la durée de l'incapacité et l'étendue du préjudice souffert par la partie civile qui, à 25 ans est élève-maçon dans un petit collège privé à Mbouda ;
Qu'en s'abstenant de justifier les dommages-intérêts alloués, l'arrêt attaqué ne permet pas à la Cour suprême d'exercer son droit de contrôle ;
Attendu que la répartition dans le dispositif de l'arrêt attaqué, de la grosse somme de 14.107.000 francs entre divers postes : incapacité permanente partielle, pretium doloris, préjudice esthétique, préjudice d'agrément, incapacité temporaire de travail et frais médicaux n'est nullement une motivation de la décision ;
Attendu que l'arrêt qui infirme le jugement doit avoir des motifs propres à justifier sa décision ;
Attendu que l'arrêt attaqué a infirmé la décision du premier juge pour porter les dommages-intérêts de 4.348.605 francs à une grosse somme de 14.107.000 francs en affirmant d'une façon laconique : « ...le premier juge a sous-estimé le préjudice subi par la partie civile « sans dire en quoi a consisté cette sous-estimation ni constater la nature et l'étendue du préjudice subi par la partie civile et qui l'auraient permis d'infirmer la décision du premier juge » ;
D'où il suit que le moyen est fondé et que l'arrêt attaqué encourt la cassation » ;
Attendu que pour porter le montant des dommages-intérêts accordés à la partie civile de 4.348.605 francs à 14.107.000 francs, le juge d'appel se borne à énoncer :
«Sur l'action civile :
«Considérant que s'agissant du principe des réparations civiles il y a lieu de confirmer en ce sens ;
«Considérant par ailleurs que le premier juge en allouant la somme de 4.348.605 francs à la partie civile à titre des dommages-intérêts a sous-estimé les préjudices par elle subis ;
Que la Cour dispose d'éléments d'appréciation suffisants pour porter ceux-ci à 14.107.000 francs» ;
Attendu qu'en statuant comme il l'a fait, le juge d'appel n'a pas justifié sa décision qui de ce fait manque de base légale ;
D'où il suit que le moyen est fondé et que l'arrêt attaqué encourt la cassation ;
PAR CES MOTIFS
CASSE ET ANNULE l'arrêt n°901/cor rendu le 13 mai 1991 par la Cour d'Appel de Bafoussam ;
REMET en conséquence la cause et les parties au même et semblable état où elles étaient avant ladite décision et, pour être fait droit, les renvoie devant la Cour d'Appel du Littoral ;
RESERVE les dépens ;
ORDONNE qu'à la diligence de Monsieur le Procureur Général près la Cour suprême, le présent arrêt sera imprimé et transmis pour être transcrit sur les registres du Greffe de la Cour d'Appel de l'Ouest et que mention en sera faite en marge ou à la suite de la décision annulée.",ARRET_N_255_P_DU_20_JUILLET_2000,0,"{'Court': 'COUR SUPRÊME DU CAMEROUN', 'Chamber': 'Chambre Pénale', 'Section': '', 'Case': '', 'Appeal': '', 'Claimant': 'MALI MAURICE, FOKOU ALBERT', 'Against': 'C/', 'Defendant': 'MINISTÈRE PUBLIC ET SOUP TASSIMO RICHARD', 'Judgment': 'ARRET N°255/P DU 20 JUILLET 2000'}"
