URL,text,page_title,page_label,category,metadata
https://www.juriafrica.com/lex/arret-46-cc-18-fevrier-1999-11043.htm,"ARRET N°46/CC DU 18 FEVRIER 1999

LA COUR,
Vu le mémoire ampliatif déposé le 16 avril 1987 par Maîtres Ninine et Bonnard, Avocats associés à Douala ;
Sur le deuxième moyen préalable, modifié et pris de la violation de la loi, violation des articles 39 et 214 du code de procédure civile et commerciale, en ce que l'arrêt attaqué n'a pas repris dans ses qualités, le contenu de l'acte introductif d'instance, en l'espèce la requête d'appel, alors que cette formalité est obligatoire en application des dispositions combinées des articles 39 et 214 du texte sus-cité ;
Attendu qu'il résulte des dispositions combinées des textes visés au moyen que les jugements et arrêts doivent soit dans leurs qualités, soit dans leurs motifs, reprendre entre autres éléments, le contenu de l'acte introductif d'instance et le dispositif des conclusions ;
Qu'il s'agit d'une formalité substantielle destinée à permettre à la Cour suprême d'exercer son contrôle sur l'étendue et la régularité des décisions judiciaires qui lui sont déférées quant à la détermination de la chose jugée ;
Que cette formalité est par ailleurs indissociable de l'obligation faite aux juges du fond, à peine de nullité, de leurs décisions, de les motiver conformément aux dispositions de l'article 5 de l'ordonnance n°72/4 du 26 août 1972, modifiée, portant organisation judiciaire, obligation dont découle celle de répondre à toutes les conclusions des parties ;
Attendu que l'arrêt attaqué se borne à indiquer dans ses qualités que « Par requête en date du 10 janvier 1984 le sieur Hajj Elias déclarait relever appel du jugement sus-énoncé » ;
Que cette seule référence ne saurait répondre au voeu de la loi ;
D'où il suit que le moyen est fondé et que l'arrêt attaqué encourt la cassation ;
PAR CES MOTIFS
CASSE ET ANNULE l'arrêt n°105/c rendu le 15 février 1985 par la Chambre civile et commerciale de la Cour d'Appel de Douala ;
REMET en conséquence la cause et les parties au même et semblable état où elles étaient avant ladite décision et, pour être fait droit, les renvoie devant la Cour d'Appel de l'Ouest ;
RESERVE les dépens ;
ORDONNE qu'à la diligence de Monsieur le Procureur Général près la Cour suprême, le présent arrêt sera imprimé et transmis pour être transcrit sur les registres du Greffe de la Cour d'Appel de Douala et que mention en sera faite en marge ou à la suite de la décision annulée.",ARRET_N_46_CC_DU_18_FEVRIER_1999,0,arret,"{'Court': 'COUR SUPRÊME DU CAMEROUN', 'Chamber': 'Chambre Civile et Commerciale', 'Section': '', 'Case': '', 'Appeal': '', 'Claimant': 'HAJJ ELIAS', 'Against': 'C/', 'Defendant': 'SOCIÉTÉ GÉNÉRALE DE BANQUES AU CAMEROUN', 'Judgment': 'ARRET N°46/CC DU 18 FEVRIER 1999'}"
