URL,text,page_title,page_label,metadata
https://www.juriafrica.com/lex/arret-347-civ-24-novembre-2011-8781.htm,"L'an deux mille onze et le vingt-quatre du mois de novembre ;
La Cour Suprême, Chambre Judiciaire, Section Civile, siégeant au Palais de Justice de Yaoundé ;
A rendu en audience publique ordinaire, l'arrêt dont la teneur suit ;
ENTRE :
NGUEYOU MOUSSA, demandeur à la cassation, représenté par Maître MUTLEN-LICKEN Aaron, avocat à Yaoundé ,
D'UNE PART
ET :
Société C.F.A.O. Agence de Nkongsamba, défenderesse à la cassation, représentée par Maître Anne SIEWE, avocat à Nkongsamba ;
D'AUTRE PART
En présence de Monsieur Martin Hilman EGBE ACHUO, Avocat Général près la Cour Suprême ,
Statuant sur le pourvoi formé par NGUEYOU MOUSSA, agissant en son nom et pour son propre compte, suivant lettre en date du 19 février 1985, enregistrée le même jour au greffe de la Cour d'Apple du Littoral, en cassation de l'arrêt n° 107/C rendu le 15 février 1985 par la susdite juridiction statuant en matière civile et commerciale dans l'instance l'opposant à la société CFAO, agence de Nkongsamba ;
LA COUR
Après avoir entendu en son rapport Monsieur Pius ANDY TAKAM, Conseiller à la Cour Suprême ,
Vu les conclusions de Monsieur Martin RISSOUK à MOULONG, Procureur Général ,
Et après en avoir délibéré conformément à la loi ;
Vu le mémoire ampliatif déposé le 29 janvier 1987 par Me MUTLEN-LICKEN Aaron, avocat à Yaoundé ;
Sur le moyen de cassation soulevé d'office, pris de la violation de la loi, violation des articles 39 et 214 du code de procédure civile et commerciale, non reproduction de l'acte introductif d'instance ,
En ce que l'arrêt attaqué n'a pas reproduit la requête d'appel de la CFAO, Agence de Centrale de Nkongsamba alors que l'article 39 du code de procédure civile et commerciale dispose que les jugements contiendront en outre les noms, profession, domicile des parties, l'acte introductif d'instance et le dispositif des conclusions les motifs et dispositif ;
Et que pour sa part, l'article 214 du même code dispose que
« Les autres règles concernant les Tribunaux d'instance seront observées devant la Cour d'Appel » ;
Attendu qu'il résulte des dispositions combinées des textes visés au moyen que les jugements et arrêts doivent soit dans leurs qualités, soit dans leurs motifs reproduire enter autres éléments le contenu de l'acte introductif d'instance, en l'espèce, la requête d'appel, les motifs et le dispositif des conclusions ,
Qu'il s'agit d'une formalité substantielle destinée à permettre à la Cour Suprême d'exercer son contrôle sur l'étendue de la demande et par ailleurs liée à l'obligation faite aux juges de motiver leurs décisions ;
Attendu en l'espèce que l'arrêt querellé se borne à énoncer ce qui suit dans ses qualités :
« Par requête en date du 28 décembre 1982, la CFAO, agence centrale de Nkongsamba, déclarait relever appel du jugement sus énoncé ;
« Par ordonnance n° 152/RG/8283 du 19 mai 1983, le Président de la juridiction saisie, donnait acte à l'Agence CFAO de Nkongsamba de la présentation de sa requête, disait qu'avis desdites requête et ordonnance sera donné aux parties par le Greffier en chef de la Cour » ;
Cette seule mention par l'arrêt attaqué ne saurait répondre au voeu de la loi ;
D'où il suit que le moyen est fondé et que l'arrêt critiqué encourt l'annulation ;
Sur l'évocation :
Attendu que l'affaire n'est cependant pas en état au sens de l'article 67 (2) de la loi n° 2006/016 du 29 décembre 2006 fixant l'organisation et le fonctionnement de la Cour Suprême ;
Qu'il y a donc lieu à renvoi ;
PAR CES MOTIFS
Casse et annule l'arrêt n° 107/C rendu le 15 février 1985 par la Cour d'Appel du Littoral ;
Remet en conséquence la cause et les parties au même et semblable état où elles étaient avant ladite décision et pour être fait droit, les renvoie devant la Cour d'Appel de l'Ouest ;
Réserve les dépens ;
Ordonne qu'à la diligence du Greffier en chef de la Chambre Judiciaire de la Cour Suprême, une expédition du présent arrêt sera notifiée au Procureur Général près la Cour d'Appel du Littoral et une autre au Greffier en chef de ladite Cour pour mention dans leurs registres respectifs
Ainsi jugé et prononcé par la Cour Suprême en son audience publique ordinaire les mêmes jour, mois et an que dessus, en la salle des audiences de la Cour où siégeaient : MM.: Dagobert BISSECK, Président de la Section Sociale, substituant Monsieur le Premier Président de la Cour Suprême, Président
Pius ANDY TAKAM, Conseiller
André BELOMBE, Conseiller
En présence de Monsieur EGBE ACHUO Martin Hilman, Avocat Général occupant le banc du Ministère Public ;
Et avec l'assistance de Maître Virginie ESSAMA, Greffier ,
En foi de quoi le présent arrêt a été signé par le Président, les Conseillers et le Greffier ;
Approuvant mot rayé nul ;
LE PRESIDENT, LES CONSEILLERS, LE GREFFIER.-",ARRET_N_347_CIV_DU_24_NOVEMBRE_2011,0,"{'Court': 'COUR SUPREME DU CAMEROUN', 'Chamber': 'CHAMBRE JUDICIAIRE', 'Section': 'SECTION CIVILE', 'Case': '', 'Appeal': 'Pourvoi n° 268/CC/85-86 du 19 février 1985', 'Claimant': 'NGUEYOU MOUSSA', 'Against': 'C/', 'Defendant': 'SOCIÉTÉ C.F.A.O. AGENCE DE NKONGSAMBA', 'Judgment': 'ARRET N° 347/CIV DU 24 NOVEMBRE 2011'}"
