URL,text,page_title,page_label,category,metadata
https://www.juriafrica.com/lex/arret-122-p-15-decembre-2011-8814.htm,"ARRET:N° 122/P DU 15 DÉCEMBRE 2011

L'an deux mille onze et le quinze du mois de décembre ;
La Cour Suprême statuant en matière de droit pénal ;
En son audience publique ordinaire a rendu l'arrêt dont la teneur suit :
ENTRE:
YOSSA Innocent et la Librairie de Papa, demandeurs en cassation, représentés par la SCPA Jus, avocats associés BP 15 380 Douala ;
D'UNE PART
Et,
Le Ministère Public et NGUIMOUTH ISSOUCK, défendeurs à la cassation, le dernier représenté par Maître BILLONG BI NDJONG Denis, avocat BP 129 53 Douala ;
D'AUTRE PART
En présence de Monsieur Adolphe EJANGUE EKAMBI, Avocat Général près la Cour Suprême ;
Statuant sur le pourvoi formé par Maître NGALIEMBOLL Alphonse, avocat à Douala, agissant au nom et pour le compte de YOSSA Innocent et la Librairie de Papa, par déclaration faite le 15 février 2005 au greffe de la Cour d'Appel du Littoral, en cassation de l'arrêt n° 341/P rendu le 03 février 2005 par cette même juridiction statuant en matière correctionnelle dans l'instance opposant ses clients au Ministère Public et à NGUIMOUTH ISSOUCK ;
LA COUR
Après avoir entendu en la lecture du rapport Monsieur Daniel NJOCK KOGLA, Conseiller à la Cour Suprême ;
Vu les conclusions de Monsieur Martin RISSOUK à MOULONG, Procureur Général près la Cour Suprême ;
Et après en avoir délibéré conformément à la loi ;
Vu le mémoire ampliatif déposé le 23 novembre 2006 par la SCPA jus judicium avocats associés BP 153 80 Douala ;
Sur le moyen unique de cassation pris en ses deux branches, présenté ainsi qu'il suit :
Sur le moyen de cassation tiré de la violation de l'article 5 de l'ordonnance n° 72/4 du 26 août 1972 portant organisation judiciaire ; défaut de motifs, manque de base légale ;
Ce moyen est divisé en deux branches :
Sur la première branche du moyen tiré de la non ventilation des dommages intérêts :
Le jugement n° 1032/Cor rendu le 09 janvier 2003 par le tribunal correctionnel de Douala fixant la répartition du prix de vente dudit ouvrage de lui allouer la somme de deux millions de francs en réparation du préjudice subi » ;
Ce jugement ne précise ni la nature, ni les différents chefs de préjudice dont il ordonne la réparation ;
L'arrêt critiqué, qui se borne à confirmer le jugement entrepris par adoption de motifs, ne précise non plus ni la nature, ni les différents chefs de préjudices dont il ordonne réparation ;
L'arrêt critiqué, qui se borne à confirmer le jugement entrepris par adoption de motifs, ne précise non plus ni la nature, ni les différents chefs de préjudices dont il ordonne réparation ;
Ce faisant, il ne justifie pas suffisamment sa décision et ne permet pas à la Cour Suprême d'exercer son contrôle ;
La jurisprudence de la Cour Suprême de céans qui casse et annule pareils arrêts est assez constante à ce sujet : (CS N° 205/P du 18 avril 1985 ; CS N° 249/P du 06 juin 1985) ;
Deuxième branche : non-reproduction et non réponse aux moyens de défense équivalent à l'absence de motifs ;
Le demandeur au pourvoi, pour sa défense, aussi bien devant le premier juge qu'à la Cour d'appel, avait soutenu que les livres en question avaient été laissés en dépôt vente dans sa librairie par les agents commerciaux de la partie civile et qu'il n'avait jamais reproduit ladite oeuvre ;
Il a ajouté qu'il n'y avait aucune différence entre le livre argué de reproduction par la partie civile et celui présenté comme l'original par lui ;
«Ni le premier juge, ni la Cour d'Appel n'a répondu à ces moyens de défenses présentés par Monsieur YOSSA Innocent ;
D'ailleurs, la Cour Suprême de céans cherchera en vain dans l'arrêt confirmatif attaqué les moyens de défense présentés par le demandeur au pourvoi ;
L'arrêt attaqué, en s'abstenant de reproduire les moyens de défense de Monsieur YOSSA Innocent et d'y répondre, s'expose indubitablement à la cassation pour insuffisance de motifs ;
C'est pourquoi l'exposant sollicitent la cassation de l'arrêt n° 341/P rendu le 03 février 2005 par la Cour d'Appel du Littoral avec toutes les conséquences de droit » ;
Attendu qu'aux termes de l'article 13 (2) de la loi n° 75/16 du 08 décembre 1975 fixant la procédure et le fonctionnement de la Cour Suprême, le moyen invoqué à l'appui du pourvoi doit, à peine d'irrecevabilité, être articulé et développé ;
Qu'il en résulte que non seulement le moyen de cassation doit contenir l'indication complète et non erronée du texte de loi ou du principe de droit prétendument violé ou faussement appliqué ;
Attendu que tel que présenté, le moyen soulevé en l'espèce n'indique pas le contenu du texte qu'il vise ;
Que ce faisant, il n'est pas conforme à l'article 13 (2) ci-dessus spécifié ;
D'où il suit qu'il est irrecevable ;
Attendu que par ailleurs l'arrêt est régulier ;
PAR CES MOTIFS
Rejette le pourvoi ;
Condamne les demandeurs aux dépens ;
Ordonne qu'à la diligence du Greffier en Chef de la Cour Suprême, le présent arrêt sera notifié à Monsieur le Procureur Général près la Cour Suprême, au Président de la Cour d'Appel du Littoral, au Procureur Général près ladite Cour, aux parties ou à leurs conseils ;
d'Appel du Centre et du Parquet près ladite Cour ;
Ainsi jugé et prononcé par la Cour Suprême en son audience publique ordinaire du quinze décembre deux mille onze ;
MM.: Pius ANDY TAKAM, Conseiller à la Cour Suprême,PRESIDENT
Daniel NJOCK KOGLA,Conseiller
Jean Jacques BIKOUE,Conseiller
En présence de Monsieur Adolphe EJANGUE EKAMBI, Avocat Général, occupant le banc du Ministère Public ;
Et avec l'assistance de Maître ESSOUMAM, Greffier ;
En foi de quoi, le présent arrêt a été signé par le Président, les Conseillers et le Greffier ;
Approuvant motrayénul
LE PRESIDENT, LES CONSEILLERS, LE GREFFIER.",ARRET_N_122_P_DU_15_DECEMBRE_2011,0,arret,"{'Court': 'COUR SUPREME DU CAMEROUN', 'Chamber': 'CHAMBRE JUDICIAIRE', 'Section': 'SECTION PENALE', 'Case': 'DOSSIER N° 295/P/05-06', 'Appeal': 'POURVOI N° 38 du 15 février 2005', 'Claimant': 'YOSSA INNOCENT-LIBRAIRIE PAPETERIE DE PAPA', 'Against': 'C/', 'Defendant': 'MINISTÈRE PUBLIC-NGUIMOUTH ISSOUCK', 'Judgment': 'ARRET:N° 122/P DU 15 DÉCEMBRE 2011'}"
