URL,text,page_title,page_label,category,metadata
https://www.juriafrica.com/lex/arret-7-cc-14-octobre-1999-11415.htm,"ARRET N°7/CC DU 14 OCTOBRE 1999

LA COUR,
Vu le mémoire ampliatif déposé le 19 avril 1991 par Maître Enonchong, Avocat à Douala ;
Sur le moyen de cassation soulevé d'office pris de la violation de la loi, violation des articles 39 et 214 du code de procédure civile et commerciale, non reprise des conclusions contenues dans l'acte introductif d'instance, en l'espèce, la requête d'appel ;
En ce que le juge d'appel ne reprend pas dans son arrêt attaqué, la requête d'appel de Tanko Jean en date du 19 juin 1986 ;
Alors qu'il résulte de l'article 39 du code de procédure civile et commerciale que les jugements contiendront entre autres mentions, l'acte introductif d'instance, en l'espèce, la requête d'appel, disposition légale applicable en appel en vertu de celle de l'article 214 du même code qui dispose que les autres règles concernant les tribunaux d'instance seront observées devant la Cour d'Appel ;
C'est en violation des termes des textes susvisés que la Cour d'Appel de Douala a omis de reproduire la requête d'appel dont s'agit dans son arrêt critiqué ;
Attendu qu'il résulte des dispositions combinées des textes visés au moyen que les jugements et arrêts doivent soit dans leurs qualités, soit dans leurs motifs, reproduire entre autres éléments le contenu de l'acte introductif d'instance, en l'espèce, la requête d'appel ;
Attendu qu'il ne ressort pas de l'arrêt critiqué que cette exigence ait été satisfaite ;
Alors qu'il s'agit d'une formalité substantielle destinée à permettre à la Cour suprême d'exercer son contrôle sur l'étendue et la régularité des décisions judiciaires qui lui sont déférées quant à la détermination de la chose jugée et par ailleurs indissociable de l'obligation faite aux juges du fond, à peine de nullité de leurs décisions, de les motiver conformément aux dispositions de l'article 5 de l'ordonnance n°72/4 du 26 août 1972 portant organisation judiciaire, obligation dont découle celle de répondre à toutes les conclusions des parties ;
D'où il suit que le moyen est fondé et que l'arrêt attaqué encourt la cassation ;
PAR CES MOTIFS
CASSE ET ANNULE l'arrêt n°181/c rendu le 17 juin 1988 par la Cour d'Appel de Douala ;
REMET en conséquence la cause et les parties au même et semblable état où elles étaient avant ladite décision et, pour être fait droit, les renvoie devant la Cour d'Appel d'Ebolowa ;
RESERVE les dépens ;
ORDONNE qu'à la diligence de Monsieur le Procureur Général près la Cour suprême, le présent arrêt sera imprimé et transmis pour être transcrit sur les registres du Greffe de la Cour d'Appel de Douala et que mention en sera faite en marge ou à la suite de la décision annulée.",ARRET_N_7_CC_DU_14_OCTOBRE_1999,0,arret,"{'Court': 'COUR SUPRÊME DU CAMEROUN', 'Chamber': 'Chambre Civile et Commerciale', 'Section': '', 'Case': '', 'Appeal': '', 'Claimant': 'AGBAI OKOJI', 'Against': 'C/', 'Defendant': 'ETS TANKO JEAN', 'Judgment': 'ARRET N°7/CC DU 14 OCTOBRE 1999'}"
