URL,text,page_title,page_label,metadata
https://www.juriafrica.com/lex/arret-60-16-mars-2000-37625.htm,"LA COUR,
Vu le mémoire ampliatif déposé le 7 octobre 1994 par Maîtres Viazzi et autres, Avocats associés à Douala ;
Sur le premier moyen de cassation amendé, pris de la violation de la loi, violation des articles 39 et 214 du Code de procédure civile et commerciale, ensemble, l'article 164-3 du Code du travail ;
En ce que,
« Le juge d'appel ne reprend pas dans son arrêt le dispositif des conclusions du 4 juin 1992 de Maîtres Viazzi et autres, avocats à Douala ;
«Alors qu'il résulte de l'article 39 du Code de procédure civile que « les jugements contiendront entre autres mentions, le dispositif des conclusions des parties, disposition légale applicable en appel et en matière sociale en vertu des articles 214 du même Code et 164-3 du Code du travail ;
En l'espèce par conclusions du 4 juin 1992 produites en cause d'appel, Maître Viazzi sollicitait de la Cour de :
« En la forme :
«Déclarer l'appel recevable pour avoir été fait dans les forme et délai de la loi ;
« Infirmer le jugement entrepris et statuant à nouveau ;
« Dire et juger la faute lourde, patente et caractérisée du fait de l'utilisation du matériel du travail à des fins personnelles sans autorisation préalable ;
« Dire et juger la faute lourde ce d'autant plus que Ngassa Bonaventure avait été sommé par le Directeur Général d'avoir à arrêter d'utiliser le matériel de la Société à des fins personnelles mais qu'il n'a pas crû devoir obtempérer ;
« Dire et juger la faute d'autant caractérisée que Ngassa avait déjà un fâcheux précédent disciplinaire ;
«Le débouter en conséquence de ses demandes en dommages-intérêts, indemnités de licenciement et préavis comme non fondées ;
« Dire et juger les demandes relatives aux congés et salaires non justifiées, l'en débouter également ;
« En ne reproduisant donc pas dans ses qualités ce dispositif, l'arrêt a violé les textes ci-dessus évoqués et encourt cassation conformément aune jurisprudence constante de la Cour Suprême ; arrêt du 11/8/1988 publié au Tpom n°734 du 2 avril 1990 P.151 » ;
Attendu qu'aux termes de l'article 39 du Code de procédure civile et commerciale, les jugements doivent contenir entre autres indications, le dispositif des conclusions ;
Que ces prescriptions étant valables en cas d'appel en vertu des dispositions de l'article 214 du même Code, l'arrêt d'une Cour d'Appel doit contenir le dispositif des conclusions ;
Que ces dispositions sont également applicables en matière sociale conformément à l'article 164 du Code du travail, texte aux termes duquel les dispositions en vigueur demeurent applicables en toutes matières de procédure non réglées par ledit Code ;
Attendu qu'il s'agit d'une formalité substantielle destinée à permettre à la Cour Suprême d'exercer son contrôle sur la régularité des décisions relatives a l'étendue de la demande et qui par ailleurs est liée à l'obligation faite aux juges de motiver leurs décisions ;
Attendu qu'en ne reproduisant pas dans ses qualités le dispositif des conclusions du 4 juin 1992 de Maître Viazzi, l'arrêt attaqué a violé les textes visés au moyen et encourt de ce fait la cassation ;
PAR CES MOTIFS
CASSE ET ANNULE l'arrêt n°283/S rendu en matière sociale le 24 février 1993 par la Cour d'Appel de Douala ;
REMET en conséquence la cause et les parties au même et semblable état où elles étaient avant ladite décision et, Pour être fait droit, les renvoie devant la Cour d'Appel d'Ebolowa;
ORDONNE qu'à la diligence de Monsieur le Procureur Général près la Cour Suprême, le présent arrêt sera imprimé et transmis pour être transcrit sur les registres du Greffe de la Cour d'Appel de Douala et que mention en sera faite en marge ou à la suite de la décision annulée.",ARRET_N_60_S_DU_16_MARS_2000,0,"{'Court': 'COUR SUPRÊME DU CAMEROUN', 'Chamber': 'Chambre sociale', 'Section': '', 'Case': '', 'Appeal': '', 'Claimant': 'TRANSCAP CAMEROUN', 'Against': 'C/', 'Defendant': 'NGASSA BONAVENTURE', 'Judgment': 'ARRET N° 60/S DU 16 MARS 2000'}"
