URL,text,page_title,page_label,metadata
https://www.juriafrica.com/lex/arret-91-30-juin-2011-32826.htm,"L'an deux mille onze et le trente juin ;
La Cour Suprême, statuant en matière de droit Social ;
En son audience publique ordinaire a rendu l'arrêt dont la teneur suit ;
ENTRE
Société ND Management Service Total, demanderesse en cassation, représentée par Maître Josette KADJI, Avocat à Douala, B.P 5317 ;
D'UNE PART
Et WOUELEDJI Jean Didier, défendeur à la cassation ;
D'AUTRE PART
En présence de Monsieur Martin Hilman EGBE ACHUO, Avocat Général près la Cour Suprême ;
Statuant sur le pourvoi formé par Maître Josette KADJI, avocat à Douala, agissant au nom et pour le compte de la Société ND Management Service Total, suivant lettre enregistrée le 21 mars 1994 au greffe de la Cour d'Appel de l'Ouest, en cassation de l'arrêt n° 17 /Soc rendu le 6 mars 1997 par cette même juridiction, dans l'instance sociale opposant sa cliente au nommé WOUELEDJI Jean;
LA COUR
Après avoir entendu en son rapport Monsieur Christophe YOSSA, Conseiller à la Cour Suprême ;
Vu les conclusions de Monsieur Martin RISSOUK à MOULONG, Procureur Général près la Cour Suprême ;
Et après en avoir délibéré conformément à la loi ;
Vu le mémoire ampliatif de Maître KADJI Josette, Avocat à Douala, déposé le 8 août 2003 ;
Sur le second moyen de cassation examiné à titre préalable, pris de la violation de la loi, violation de l'article 5 de l'ordonnance n° 72/4 du 26 août 1972 , insuffisance de motif, équivalant au défaut de motifs ;
En ce que :
« Aux termes du texte susvisé, toute décision de justice doit être motivée en droit et en fait ;
« Attendu que l'arrêt n° 17/S du 06 mars 1997 querellé se borne à adopter sur tous les points les motifs du premier juge sans exposer ni en rappeler aucun ;
« Attendu pourtant que le premier juge précisément pour ce qui est de la nature du licenciement n'avait pas apporté de motivation suffisante pour le qualifier d'abusif, alors même qu'il s'agissait d'un contrat de travail à durée déterminée arrivée à terme ;
« Attendu bien plus que le premier juge quant aux indemnités de licenciement et de préavis alloués à sieur WOUELEDJI n'avait pas apporté de motivation suffisante, justifiant leurs octroies à la hauteur par lui arrêtée à savoir : 13.200 FCFA pour l'une et 79.200 pour l'autre notamment dans le calcul du montant pour cette dernière ;
« Que la Cour d'Appel de Bafoussam en procédant par adoption des motifs à la confirmation partielle du jugement déféré devant elle, lequel jugement en soi a été insuffisamment motivé, ne permet pas à la Cour Suprême d'exercer la régularité du contrôle de la légalité des décisions de justice qui lui est dévolue ;
« Qu'à ce titre l'arrêt n° 17/S du 06 mars 1997 encours cassation « ;
Attendu qu'il résulte en effet de l'article 5 de l'ordonnance n° 72/4 du 26 août 1972 rappelé au moyen que toute décision est motivée en fait et en droit et que l'inobservation de ces dispositions entraîne la nullité d'ordre public ; l'insuffisance de motifs équivalant au défaut de motif ;
Attendu en l'espèce que pour qualifier le licenciement de WOUELADJI d'abusif et allouer à celui-ci des indemnités de licenciement et de préavis, le jugement n° 04/Soc du 8 mars 1990 du Tribunal de première instance de Bafoussam, confirmé par l'arrêt attaqué énonce :
« Attendu que l'opposante verse au dossier une demande d'emploi datée du 18 janvier 1994 à elle adressée par WOUELADJI Jean De Dieu, ainsi qu'un contrat de travail temporaire » une notification de la résiliation dudit contrat au demandeur le 28 juin 1994 et conclut que le contrat à durée déterminée est arrivé à terme le 30 juillet 1994 ;
« Mais attendu qu'aux termes de l'article 25 du code de travail, le contrat de travail à durée déterminée est celui dont le terme est fixé à l'avance par la volonté des deux parties ou par la survenance d'un événement futur et certain dont la réalisation ne dépend pas exclusivement de la volonté de l'une des parties, mais qui est indiqué avec précision ;
« Attendu qu'il est de jurisprudence constante (C.S arrêt n° 52/S du 14 mars 1985) que lorsque la date d'expiration du contrat ne peut être connue avec précision par les contractants lors de sa conclusion, le contrat est qualifié à durée indéterminée ;
« Attendu qu'en l'espèce, le contrat dont s'agit n'est pas daté, bien que titré contrat de travail temporaire et est imprécis dans sa durée et son terme ; que l'omission d'une formalité aussi substantielle est constitutive d'une fraude ;
« Qu'il y a lieu de restituer à ce contrat sa véritable justification de contrat, à durée indéterminée » ;
« Attendu qu'on chercherait vainement au dossier la preuve d'une faute lourde reprochée au demandeur ;
« Qu'en conséquence, il convient de déclarer le licenciement abusif et de condamner la société ND Management service total à payer la somme totale de 742 820 FCFA à WOUELADJI Jean De Dieu ventilée comme suit :
« - Indemnité de licenciement : 163.000 Frs
« -Préavis 79.200 Frs
« - Dommages et intérêts 500.000 Frs »
Attendu que si par ces énonciations le premier juge a bien motivé sa décision s'agissant du caractère abusif du licenciement, il n'en est pas de même, en ce qui concerne les indemnités dudit licenciement et les préavis ;
Mais attendu qu'en se contentant des dites énonciations qui, en violation des articles 36 et 37 du code du travail n'indiquent ni le délai de préavis, ni la rémunération et les avantages dont aurait bénéficié le travailleur durant la période de préavis d'une part et desquelles il ne ressort pas que le salarié a effectué au moins deux ans de travail continu dans la société, d'autre part, le juge d'instance n'a pas suffisamment motivé sa décision, sur les indemnités de licenciement et le préavis, violant de ce fait le texte visé au moyen ;
En la confirmant sur ces points, celui d'appel a emprunté le vice dont elle est entachée ;
D'où il suit que celui-ci est fondé et que l'arrêt attaqué encourt la cassation ;
Sur l'évocation
Attendu que l'affaire n'est pas en état d'être jugée au fond au sens de l'article 67(2) de la loi n° 2006/016 du 29 décembre 2006 fixant l'organisation et le fonctionnement de la Cour Suprême ;
Qu'il n'y a pas lieu à évocation ;
PAR CES MOTIFS
Sans qu'il soit besoin d'examiner le 1er moyen ;
Casse et annule l'arrêt n° 17/Soc rendu le 6 mars 1997 par la Cour d'Appel de l'Ouest ;
Remet et la cause et les parties au même et Semblable état où elles étaient avant ladite décision et pour être fait droit, les renvoie devant la même Cour d'Appel autrement composée ;
Ordonne qu'à la diligence du Greffier en Chef de la Chambre Judiciaire de la Cour Suprême, une expédition du présent arrêt sera transmise au Procureur Général près la Cour d'appel de l'Ouest et une autre au Greffier en Chef de ladite Cour pour mention dans leurs registres respectifs ;
Ainsi jugé et prononcé par la Cour Suprême en son audience publique ordinaire du 30 juin deux mille onze en la salle des audiences de la Cour où siégeaient ;
Mr. Dagobert BISSECK, Président de la Section Sociale, PRESIDENT
NJIEMOUNMAMA, CONSEILLER
Christophe YOSSA, CONSEILLER
En présence de Monsieur Martin Hilman EGBE ACHUO, Avocat Général occupant le banc du Ministère Public ;
Et avec l'assistance de Madame Margaret MUSONGO Greffier ;
En foi de quoi le présent arrêt a été signé par le Président, les Conseillers et le Greffier ;",ARRET_N_91_S_DU_30_JUIN_2011,0,"{'Court': 'COUR SUPREME DU CAMEROUN', 'Chamber': 'CHAMBRE JUDICIAIRE', 'Section': 'SECTION SOCIALE', 'Case': '', 'Appeal': 'Pourvoi n° 122/S/02-03 du 17 mars 1997', 'Claimant': 'SOCIÉTÉ ND MANAGEMENT SERVICE TOTAL', 'Against': 'C/', 'Defendant': 'WOUELEDJI JEAN DIDIER', 'Judgment': 'ARRÊT N° 91/S DU 30 JUIN 2011'}"
