URL,text,page_title,page_label,category,metadata
https://www.juriafrica.com/lex/arret-135-p-1er-avril-1999-9256.htm,"ARRET N°135/P DU 1ER AVRIL 1999

LA COUR,
Vu le mémoire ampliatif déposé le 19 février 1988 par Maître Ndengue, Avocat à Yaoundé ;
Sur le moyen unique de cassation pris de la violation de la loi, violation de l'article 5 de l'ordonnance n°72/4 du 26 août 1972, non réponse aux conclusions,
IL MANQUE DU TEXTE ICI
insuffisance et défaut de motifs, manque de base légale ;
«En ce que le juge d'appel n'a pas répondu aux conclusions du conseil des exposants produites à l'audience du 24 septembre 1984 et tendant notamment à la révision de l'allocation de la somme de 3.500.000 francs à la partie civile à titre de dommages-intérêts en réparation du préjudice par elle subi compte tenu de l'amélioration de son état de santé préconisée par le médecin traitant, lequel avait mentionné sur les pièces médicales qu'au bout de 2 ans il y aura amélioration et l'incapacité permanente partielle diminuera ;
«Qu'en tout état de cause, l'état de santé de la victime s'était nettement amélioré car le délai de deux ans avait expiré avant même la décision du juge d'appel, lequel a confirmé le montant de 3.500.000 francs alloué par le premier juge à la victime ;
« Alors que le juge d'appel dans le cas d'espèce se devait soit de tenir compte de ladite amélioration de l'état de santé de la victime en ordonnant une contre-expertise médicale à cette fin afin de ramener ces dommages-intérêts à un montant proportionnel à l'incapacité permanente partielle définitive, soit d'énoncer les motifs pour lesquels il entendait maintenir ce montant de 3.500.000 francs ;
« Cela dit, il est constant que le juge d'appel n'a pas suffisamment motivé sa décision ;
« D'où il suit que le moyen est fondé et l'arrêt encourt la cassation » ;
Attendu qu'il résulte de l'article 5 de l'ordonnance n°72/4 du 26 août 1972 portant organisation judiciaire que toute décision de justice est motivée en fait et en droit à peine de nullité d'ordre public ;
Que le défaut de répondre aux conclusions régulièrement déposées par les parties et acquises aux débats équivaut au défaut de motifs ;
Attendu que par conclusions du 20 septembre 1984, Maître Ndengue, Avocat des appelants, avait demandé à la Cour d'Appel de dire et juger qu'il ressort des pièces médicales versées au dossier que le taux d' incapacité permanente partielle de 40% alloué à la partie civile devait avoir nettement diminué dans un délai de deux ans après l'accident ;
Dire et juger que ce délai ayant expiré depuis le mois d'août 1983, il va de soi que le taux d' incapacité permanente partielle de 40% ne saurait plus être la base de l'allocation des dommages-intérêts dans la présente espèce, car il ne correspond plus à l'état actuel de santé de la victime ;
En conséquence, ramener le montant des dommages-intérêts à la somme de 1.000.000 de francs ;
Attendu que pour confirmer le jugement entrepris en ce qu'il a alloué 3.500.000 francs à la victime, l'arrêt querellé énonce : «Considérant que dans ses écritures du 20 septembre 1984 Maître Ndengue Thomas, conseil des appelants, demande à la Cour...de ramener le montant des dommages-intérêts à la somme de 1.000.000 de francs ;
«Considérant sur ce point que l'argumentation du conseil des appelants n'est pas admissible ; que c'est à bon droit que le premier juge a évalué à la somme de 3.500.000 francs le montant des dommages-intérêts, eu égard au préjudice matériel réellement subi, le certificat médical délivré à la victime faisant état d'une fracture en viseau avec fragment intencédiaire du fémur gauche, ayant nécessité une ostéosynthèse ayant entraîné une incapacité temporaire de travail globale de 6 mois (raccourcissement important dépassant 4 centimètres) et une incapacité permanente partielle de 40% révisable dans 2 ans ;
«Que ces lésions sont d'une gravité évidente ;
«Considérant que les faits ont été ainsi sainement appréciés ; qu'il y a lieu de confirmer le surplus du jugement dans toutes ses dispositions » ;
Attendu qu'il ressort de ce qui précède que l'arrêt critiqué ne comporte aucune réponse sur le chef de demande des conclusions, relatif à l'amélioration de l'état de santé de la victime dans les 2 ans suivant l'accident, ainsi que le prévoit le certificat médical provisoire, que ce faisant ledit arrêt comme l'indique le moyen est insuffisamment motivé ;
D'où il suit que le moyen est fondé et que l'arrêt attaqué encourt la cassation ;
PAR CES MOTIFS
CASSE ET ANNULE l'arrêt n°19 rendu le 8 octobre 1984 par la Cour d'Appel de Yaoundé ;
REMET en conséquence la cause et les parties au même et semblable état où elles étaient avant ladite décision et, pour être fait droit, les renvoie devant la Cour d'Appel de Douala ;
RESERVE les dépens ;
ORDONNE qu'a la diligence de Monsieur le Procureur Général près la Cour suprême, le présent arrêt sera imprimé et transmis pour être transcrit sur les registres du Greffe de la Cour d'Appel de Yaoundé et que mention en sera faite en marge ou à la suite de la décision annulée.",ARRET_N_135_P_DU_1ER_AVRIL_1999,0,arret,"{'Court': 'COUR SUPRÊME DU CAMEROUN', 'Chamber': 'Chambre Pénale', 'Section': '', 'Case': '', 'Appeal': '', 'Claimant': 'SIME PIERRE ET SOCAM', 'Against': 'C/', 'Defendant': 'MINISTÈRE PUBLIC ET OMBOLO DANIEL', 'Judgment': 'ARRET N°135/P DU 1ER AVRIL 1999'}"
