URL,text,page_title,page_label,category,metadata
https://www.juriafrica.com/lex/arret-124-18-mai-2000-37184.htm,"ARRET N° 124/S DU 18 MAI 2000

LA COUR,
Vu le mémoire ampliatif déposé le 21 octobre 1992 par Maîtres Viazzi et autres, Avocats à Douala ;
Sur le moyen unique de cassation pris en sa première branche de la violation des articles 140 et 141 du Code du travail ;
En ce qu'aux termes de l'article 140 du Code du travail, la juridiction sociale, que ce soit au Tribunal ou en appel en vertu de l'article 21 (2) de l'ordonnance n°72/4 du 26 août 1972, se compose d'un magistrat, d'un greffier et de deux assesseurs employeur et employé parmi ceux figurant sur les listes établies en conformité de l'article 141 ;
Aux termes de l'article 141, les assesseurs sont nommés par arrêté du Ministre de la Justice sur proposition du Ministre chargé des questions de travail et de la Prévoyance sociale ;
Dès lors que l'arrêt ne fait pas référence à l'arrêté de désignation des assesseurs, il met la Cour Suprême dans l'impossibilité d'exercer son contrôle sur la régularité de la composition de la Cour » ;
Attendu que la désignation des assesseurs pour compléter la composition d'une juridiction sociale, atteste tant la régularité de leur nomination que de leur prestation de serment alors et surtout que ces mentions ne sont pas prescrites sous la peine de nullité ;
Qu'en statuant comme il a fait, le juge d'appel n'a nullement violé les textes visés au moyen ;
D'où il suit que celui-ci pris en sa première branche n'est pas fondé ;
Sur la seconde branche du moyen unique de cassation prise de la violation des articles 43 du Code du travail et 5 de l'ordonnance 72/4 du 26 août 1972 ;
En ce que,
« La discussion du problème de droit aussi bien en première instance qu'en appel consistait à déterminer si une suppression de poste était assimilable à une rupture de contrat pour diminution d'activité de l'Entreprise ou une réorganisation intérieure ;
« Dans le jjugement confirmé, on chercherait vainement une réponse à cette question et le jugement s'est contenté de recopier l'article 43 du Code du travail et ce, dans les termes suivants :
« Attendu que conformément aux dispositions de l'article 43 alinéa 1er du Code du travail camerounais applicable en l'espèce tout licenciement individuel, collectif, motivé par une diminution de l'activité de l'établissement ou une réorganisation intérieure envisagée par l'employeur est soumise à la procédure ... fixée par cette loi, à savoir entre autres que l'employeur doit établir l'ordre de licenciement... et le communiquer par écrit aux délégués du personnel en vue de recueillir leurs suggestions ; qu'en contrevenant à ces dispositions, la Société Cimencam a commis une faute rendant abusive la rupture du contrat de travail par elle décidée» ;
«L'arrêt a donc pêché par défaut de motivation ; par fausse application de l'article 43 du Code du travail ; par omission de résoudre le problème qui lui avait été posé ;
«Il encourt donc la cassation » ;
Attendu que pour déclarer le licenciement de Jacotting Guy abusif, le premier juge a justifié sa décision par les énonciations ci-dessus reprises au moyen, d'où il ressort que la Société Cimencam avait procédé audit renvoi au mépris des dispositions dudit texte qui exige l'établissement de l'ordre de licenciement et sa communication par écrit aux délégués du personnel, alors et surtout qu'il ressort de la lettre de licenciement du susnommé du 29 mars 1983, que son renvoi résultait de la restructuration et de la réorganisation interne de la Société ;
Attendu qu'en confirmant par adoption des motifs du premier juge le jugement entrepris sur ce point la Cour d'Appel de Douala a implicitement mais nécessairement répondu auxdites conclusions dont les réponses se trouvent clairement énoncées dans les motifs du jugement d'instance ci-dessus repris au moyen ;
Qu'en statuant ainsi le juge d'appel a suffisamment justifié sa décision, lui donnant une base légale et n'a nullement violé les textes visés au moyen ;
D'où il suit que celui-ci pris en sa seconde branche n'est pas fondé ; Et attendu que l'arrêt attaqué est par ailleurs régulier ;
PAR CES MOTIFS
REJETTE le pourvoi ;
ORDONNE qu'à la diligence de Monsieur le Procureur Général près la Cour Suprême, le présent arrêt sera imprimé et transmis pour être transcrit sur les registres du Greffe de la Cour d'Appel de Douala et que mention en sera faite en marge ou à la suite de la décision attaquée.",ARRET_N_124_S_DU_18_MAI_2000,0,arret,"{'Court': 'COUR SUPRÊME DU CAMEROUN', 'Chamber': 'Chambre sociale', 'Section': '', 'Case': '', 'Appeal': '', 'Claimant': 'SOCIÉTÉ CIMENCAM', 'Against': 'C/', 'Defendant': 'JACOTTING GUY', 'Judgment': 'ARRET N° 124/S DU 18 MAI 2000'}"
