URL,text,page_title,page_label,metadata
https://www.juriafrica.com/lex/arret-92-soc-11-septembre-2014-32827.htm,"L'an deux mille quatorze et le onze du mois de septembre ;
La Cour Suprême Chambre Judiciaire, Section Sociale ;
A rendu en audience publique de vacation l'arrêt dont la teneur suit :
ENTRE
Sieur MBOZO'O MBALLA Salomon demandeur à la cassation, ayant pour conseil, Maitre YAPMI Jeanne Françoise Avocat à Yaoundé ;
D'UNE PART
ET
La Société CAMRAIL, défenderesse à la cassation, ayant pour conseil, Maître TCHONANG YAKAM Albertine, Avocat à Douala ;
D'AUTRE PART
En présence de Monsieur OUMAROU BAMANGA, Avocat Général près la Cour Suprême ;
Statuant sur le pourvoi formé par sieur MBOZO'O MBALLA Salomon, ayant pour conseil Maitre YAPMI Jeanne Françoise, Avocat à Yaoundé, suivant déclaration faite le 03 mars 2009 au Greffe de la Cour d'Appel du Littoral, en cassation de l'arrêt n° 36/5 rendu le 25 février 2009 par cette même juridiction statuant en matière sociale dans l'instance l'opposant à la Société CAMRAIL ;
LA COUR ;
Après avoir entendu en son rapport, Monsieur Christophe YOSSA, Conseiller à la Cour Suprême ;
Vu les conclusions de Monsieur Martin RISSOUK à MOULONG, Procureur Général près la Cour Suprême ; Après en avoir délibéré conformément à la loi ;
Vu le pourvoi formé le 03 mars 2009 par MBOZO'O MBALLA Salomon ;
Sur le moyen de cassation soulevé d'office, pris de la violation de la loi, violation de l'article 21 alinéa 1 de la loi n°2006/015 du 29 décembre 2006 portant organisation judiciaire ;
En ce que l'arrêt attaqué ayant constaté dans les qualités la carence des assesseurs dûment convoqués, a cru devoir siéger avec une composition d'un magistrat et d'un greffier ;
Alors qu'aux termes du texte visé au moyen « toute affaire relevant de la Cour d'Appel est jugée par trois magistrats du siège, membres de ladite Cour » ; qu'il en résulte qu'en matière sociale, lorsque la carence des assesseurs est constatée, la Cour d'Appel ne peut siéger qu'avec trois magistrats membres de ladite Cour ;
Attendu en l'espèce que l'arrêt attaqué indique dans ses qualités ce qui suit :
« La Cour d'Appel du Littoral siégeant comme chambre sociale conformément aux dispositions des articles 133, 138 et 154 de la loi n°92/007 du 14 août 1992 portant Code du Travail et l'article 21 alinéa 2 de l'Ordonnance n°72/4 du 26 août 1972 portant organisation judiciaire... en son audience publique tenue au Palais de Justice de ladite ville... le 25 février 2007... et en laquelle siégeaient :
Monsieur Ibrahim HALILOU BOUBA, vice-président de la Cour d'Appel du Littoral PRESIDENT ;
Assisté de Maître EYANGO NDEDI épouse NYOUMSI GREFFIER ;
En l'absence de sieur NJONKAM Joseph Aimé et BOKAGNE Joseph respectivement assesseurs employeur et employé dûment convoqués » ;
Attendu qu'en statuant en une telle composition, alors que les dispositions de l'article 21 alinéa 2 de l'Ordonnance n°72/4 du 26 août 1972 auxquelles l'arrêt attaqué se réfère ont été abrogées par la loi n°2006/015 du 29 décembre 2006 portant organisation judiciaire, la susdite Cour ne s'est pas conformée au texte visé au moyen ;
D'où il suit que celui-ci est fondé et que l'arrêt attaqué encourt la cassation ;
Sur l'évocation ;
Attendu que l'affaire n'est pas en état d'être jugée au fond au sens de l'article 67 de la loi n°2006/016 du 29 décembre 2006 fixant l'organisation et le fonctionnement de la Cour Suprême ;
Qu'il n'y a donc pas lieu à évocation ;
PAR CES MOTIFS
Casse et annule l'arrêt n° 38/S rendu le 25 janvier 2009 par la Cour d'Appel du Littoral ;
Remet en conséquence la cause et les parties au même et semblable état où elles étaient avant cette décision et pour être fait droit les renvoie devant la Cour d'Appel du Sud ;
Ordonne qu'à la diligence du Greffier en Chef de la Chambre Judiciaire de la Cour Suprême, une expédition du présent arrêt sera transmise au Procureur Général près la Cour d'appel du Centre et au Greffier en Chef de ladite Cour pour mention dans les registres respectifs.
MM.
Dagobert BISSECK, Président de la Section Sociale PRESIDENT ;
Toussaint ZIBI NSOE, Conseiller à la Cour Suprême CONSEILLER ;
Christophe YOS SA, Conseiller à la Cour Suprême CONSEILLER ;
En présence de Monsieur OUMAROU BAMANGA, Avocat Général, occupant le banc du Ministère public ;
Et avec l'assistance de Maître Margaret MUSONGO, Greffier ;
En foi de quoi le présent arrêt a été signé par le Président, les Conseillers et le Greffier ;",ARRET_N_92_SOC_DU_11_SEPTEMBRE_2014,0,"{'Court': 'COUR SUPREME DU CAMEROUN', 'Chamber': 'CHAMBRE JUDICIAIRE', 'Section': 'SECTION SOCIALE', 'Case': 'DOSSIER N° 80/S/10', 'Appeal': 'Pourvoi n° 19/GCA/Lit du 03 mars 2009', 'Claimant': ""MBOZO'O MBALLA SALOMON"", 'Against': 'C/', 'Defendant': 'SOCIÉTÉ CAMRAIL', 'Judgment': 'ARRÊT N° 92/SOC DU 11 SEPTEMBRE 2014'}"
