URL,text,page_title,page_label,category,metadata
https://www.juriafrica.com/lex/arret-82-cc-25-mai-2000-10983.htm,"ARRET N°82/CC DU 25 MAI 2000

LA COUR,
Vu le mémoire ampliatif déposé le 02 novembre 1995 par Maître Constantin Bell, Avocat à Yaoundé ;
Sur le moyen unique de cassation pris de la violation de la loi, violation des articles 62 et suivants du code de procédure civile et commerciale ;
«En ce que le jugement querellé a prononcé le jugement contradictoire à l'égard des parties (sic) ;
«Alors que ce jugement n'a prouvé nulle part que Yimga a comparu, ni même déposé mémoire ;
En faisant donc comme il a fait, le jugement querellé doit être annulé par la Cour suprême» ;
Attendu qu'il résulte des qualités du jugement querellé qu'il a été rendu entre la Bicic d'une part et Yimga Etienne d'autre part ;
Attendu que la comparution à l'audience et la participation des parties aux débats sont des questions de fait que les juges de fond constatent souverainement et qui échappent au contrôle de la Cour suprême ;
Qu'au surplus, les énonciations d'une décision de justice font foi jusqu'à inscription de faux ;
D'où il suit que le moyen manque en fait autant qu'il n'est pas fondé et que le pourvoi encourt le rejet ;
Et attendu que le jugement attaqué est par ailleurs régulier ;
PAR CES MOTIFS
REJETTE le pourvoi ;
CONDAMNE le demandeur aux dépens ;
ORDONNE qu'à la diligence de Monsieur le Procureur Général près la Cour suprême, le présent arrêt sera imprimé et transmis pour être transcrit sur les registres du Greffe du Tribunal de Grande Instance de Yaoundé et que mention en sera faite en marge ou à la suite de la décision attaquée.",ARRET_N_82_CC_DU_25_MAI_2000,0,arret,"{'Court': 'COUR SUPRÊME DU CAMEROUN', 'Chamber': 'Chambre Civile et Commerciale', 'Section': '', 'Case': '', 'Appeal': '', 'Claimant': 'YIMGA ETIENNE', 'Against': 'C/', 'Defendant': 'BICIC', 'Judgment': 'ARRET N°82/CC DU 25 MAI 2000'}"
