URL,text,page_title,page_label,category,metadata
https://www.juriafrica.com/lex/arret-46-07-decembre-2000-37453.htm,"ARRET N° 46/S DU 07 DECEMBRE 2000

LA COUR,
Vu le mémoire ampliatif déposé le 5 octobre 1993 pal-Maîtres Alix et Gisèle Betayene, Avocats associés à Yaoundé;
Sur les deux moyens de cassation réunis pris de la violation de la loi, violation des articles 133 et 39 nouveaux du Code du travail ;
En ce que d'une part l'arrêt attaqué a été rendu par une juridiction mal composée ;
« En effet le Code du travail exige la composition suivante : un magistrat, Président, un assesseur employeur et un assesseur travailleur ;
« Or l'arrêt du 14 janvier 1993 a été rendu par la Cour d'Appel de l'Extrême-Nord composée de trois magistrats Vices-Présidents de ladite Cour ;
«L'absence de tout assesseur est un vice d'ordre public; « En conséquence l'arrêt doit être cassé » ;
En ce que d'autre part, la Cour a déclaré le licenciement d'Eloundou abusif au motif que l'entreprise n'a pas respecté le licenciement pour compression ;
«Alors que l'intimée tout au long des instances avait plaidé qu'elle n'avait pas à respecter cette procédure spéciale sur la compression du personnel, parce qu'il s'agissait d'une suppression de poste pour fin de chantier ;
« Le motif allégué par la société Delmacam ne souffrait d'aucun doute puisque la Cour et même Eloundou ne l'ont pas contesté ;
« Mais pour la Cour, étant donné que la Société Delmacam n'avait pas respecté cette procédure, le licenciement qui était irrégulier comme elle l'a souligné, devenait abusif et c'est pour cette raison qu'elle a alloué à Eloundou des dommages-intérêts d'un montant de 995.440 francs soit un an de salaires ;
« Il y a de la part de la Cour une fausse interprétation de l'article 39 du Code du travail ;
«Dans cet article 39 du Code du travail, il est fait état de 2 cas de licenciement :
« 1°- si le licenciement est abusif, il donne droit à des dommages-intérêts (selon l'alinéa 4) ;
« 2°- si le licenciement est légitime, mais que les formalités prévues, en cas de licenciement pour motif économique par exemple, ne sont pas respectées par l'employeur, le licenciement est irrégulier et donne droit à des dommages-intérêts», selon l'alinéa 5 :
« Or, la Cour n'a pu faire cette distinction en rendant son arrêt ; on ne comprend pas sur quel texte elle s'est basée pour motiver sa condamnation ;
« Dans sa motivation, la Cour précise bien que le licenciement d'Eloundou est abusif pour avoir été fait irrégulièrement motif pris de ce que la société Delmacam n'a pas respecté la procédure ;
« En admettant même que le licenciement était abusif au sens large, le montant des dommages-intérêts, suivant le premier cas de figure analysé plus haut, ne pouvait excéder un mois de salaire par année d'ancienneté, tout en ne pouvant être inférieur à 3 mois ;
« Or, la Cour en allouant 12 mois de salaire à Eloundou a violé le texte. Eloundou avec son année d'ancienneté ne pouvait prétendre qu'à un mois de salaire ou tout au plus à 3 mois maximum à titre de dommages-intérêts ;
«Pour Delmacam, comme il s'agissait d'une suppression de poste, elle n'avait pas à respecter la procédure spéciale en cas de licenciement économique ;
« Mais la Cour en a décidé autrement en considérant que le licenciement était irrégulier donc abusif ;
« A partir du moment où elle admettait que le licenciement était irrégulier, elle aurait dû appliquer l'article 39 alinéa 5 dans son allocation du montant des dommages-intérêts ;
« Ce texte est bien clair ;
« Il est stipulé qu'en cas d'inobservation par l'employeur des formalités prévues et bien que le motif du licenciement ne soit pas contesté le- montant des dommages-intérêts ne peut excéder un mois de salaire ;
« La Cour, en fixant de sa propre initiative et contrairement aux limites fixées par la nouvelle législation, le montant des dommages-intérêts à un an, c'est-à-dire équivalant à son temps de service et uniquement en raison du caractère brusque du licenciement, motif non fondé puisque Eloundou savait pertinemment que le chantier touchait à sa fin, n'a pas dit le droit ;
« Il s'ensuit que cet arrêt ne pourra qu'être cassé pour violation de la loi » ;
Attendu que le licenciement litigieux étant intervenu le 8 avril 1991, sous l'empire du Code du travail de 1974, le juge d'appel n'a appliqué en l'espèce que ce dernier texte, et ne pouvait en ce faisant violer les textes visés aux moyens qu'il n'a pas eu à appliquer alors et surtout qu'aucune disposition du nouveau Code du travail n'a rendu l'application de ses dispositions rétroactives ;
D'où il suit que les moyens sont irrecevables ;
Attendu que l'arrêt attaqué est par ailleurs régulier ;
PAR CES MOTIFS
REJETTE le pourvoi ;
ORDONNE qu'à diligence de Monsieur le Procureur Général près la Cour Suprême, le présent arrêt sera imprimé et transmis pour être transcrit sur les registres du Greffe de la Cour d'Appel de l'Extrême-Nord et que mention en sera faite en marge ou à la suite de la décision attaquée.",ARRET_N_46_S_DU_07_DECEMBRE_2000,0,arret,"{'Court': 'COUR SUPRÊME DU CAMEROUN', 'Chamber': 'Chambre sociale', 'Section': '', 'Case': '', 'Appeal': '', 'Claimant': 'SOCIÉTÉ DELMACAM', 'Against': 'C/', 'Defendant': 'ELOUNDOU THOMAS SAMUEL', 'Judgment': 'ARRET N° 46/S DU 07 DECEMBRE 2000'}"
