URL,text,page_title,page_label,metadata
https://www.juriafrica.com/lex/arret-25-p-26-octobre-2000-9205.htm,"LA COUR,
Vu le mémoire ampliatif déposé le 27 septembre 1990 par Maître Dzeukou Barthélemy, Avocat à Bafoussam ;
Sur le moyen unique de cassation pris de la violation de la loi, violation de l'article 5 de l'ordonnance n°72/4 du 26 août 1972, non réponse aux conclusions, défaut et insuffisance de motifs, manque de base légale ;
«En ce que :
« L'arrêt déféré confirme par simple adoption de motifs, le jugement entrepris prétextant que les appelants n'apportent aucun élément nouveau au soutien de leurs appels susceptibles d'amener la Cour à reformer le jugement ;
« Mais attendu que les demandeurs au pourvoi ont pris devant la Cour d'Appel des conclusions écrites datées du 05 octobre 1988 et suffisamment détaillées dans lesquelles ils demandaient entre autres au juge d'appel de bien vouloir réexaminer les circonstances de l'accident s'il y a lieu, d'opérer un partage de responsabilité dans la proportion de 3/4 à la charge de la victime et 1/4 à celle de la prévenue en lui faisant une application bienveillante de la loi pénale ;
« Attendu que dans lesdites conclusions, les demandeurs au pourvoi ont également demandé que la demande de remboursement des frais funéraires soit rejetée comme non fondée en tout cas non justifiée ;
« Attendu que ces différents points soulevés dans les écrits supra versés et acquis en cause d'appel, lesquels n'ont jamais fait l'objet d'un débat devant le juge d'instance, constituaient des éléments nouveaux évoqués devant le juge d'appel ;
« Attendu que ces éléments nouveaux étaient susceptibles d'amener le juge d'appel à reformer sa décision ;
« Que loin d'analyser tous ces éléments avant d'aboutir à la confirmation du jugement entrepris (si cela était nécessaire), le juge d'appel s'est plutôt borné à énoncer que les appelants n'apportent aucun élément nouveau au soutien de leurs appels ;
« Attendu que les juges du fond sont tenus de répondre à toutes les demandes exprimées dans les conclusions des parties (en ce sens CS. arrêt n°116/P du 19 mars 1987) ;
« Qu'il a été jugé plusieurs fois par la haute juridiction que la non réponse aux conclusions est équipollente à un défaut ou à une insuffisance de motifs (arrêt n°37 du 18 novembre 1976 bul. 35 P. 5103) ;
« Attendu que toute décision de justice doit contenir des motifs propres à la justifier ;
« Qu'en statuant comme il l'a fait, le juge d'appel n'a pas donné de base légale à sa décision qu'il expose à la censure ;
Qu'il suit que le moyen est fondé » ;
Attendu qu'il ressort du jugement entrepris les indications suivantes :
« Attendu que la constitution de partie civile de darne veuve Takou, née Sime Anne est recevable comme régulière, que sa demande de dommages-intérêts est fondée en son principe... Que le Tribunal dispose d'éléments d'appréciation suffisants pour les fixer comme suit :
Frais funéraires... 500.000 francs ;
« Mais attendu que l'accident a également pour cause la vitesse excessive pratiquée par Takou Michel et attestée par les dégâts considérables constatés sur les engins... qu'il convient en conséquence de prononcer un partage de responsabilité dans les proportions de 2/5 à la charge de Noubissi Jacqueline et de 3/5 à la charge de Takou Michel » ;
Attendu qu'il ressort de ces énonciations que le premier juge a répondu aux conclusions dont s'agit ;
Attendu qu'en confirmant la décision querellée sur ce point, par adoption des motifs du premier juge, le juge d'appel a justifié la sienne ;
D'où il suit que le moyen n'est pas fondé ;
Attendu que l'arrêt attaqué est par ailleurs régulier ;
PAR CES MOTIFS
REJETTE le pourvoi ;
CONDAMNE les demandeurs aux dépens ;
ORDONNE qu'à la diligence de Monsieur le Procureur Général près la Cour suprême, le présent arrêt sera imprimé et transmis pour être transcrit sur les registres du Greffe de ta Cour d'Appel de l'Ouest et que mention en sera faite en marge ou à la suite de la décision attaquée.",ARRET_N_25_P_DU_26_OCTOBRE_2000,0,"{'Court': 'COUR SUPRÊME DU CAMEROUN', 'Chamber': 'Chambre Pénale', 'Section': '', 'Case': '', 'Appeal': '', 'Claimant': 'MADAME NOUBISSI NÉE MEGANG JACQUELINE ET NOUBISSI SAMUEL', 'Against': 'C/', 'Defendant': 'MINISTÈRE PUBLIC ET SIME ANNE ÉPOUSE TAKOU', 'Judgment': 'ARRET N°25/P DU 26 OCTOBRE 2000'}"
