URL,text,page_title,page_label,category,metadata
https://www.juriafrica.com/lex/arret-378-p-5-aout-1999-9481.htm,"ARRET N°378/P DU 5 AOUT 1999

LA COUR,
Vu le mémoire ampliatif déposé le 22 octobre 1990 par Maître Dzeukou, Avocat à Bafoussam ;
Sur le moyen unique de cassation pris en ses deux branches réunies de la violation des articles 5 et 6 de l'ordonnance n°72/4 du 26 août 1972, défaut et insuffisance de motifs, contradiction entre motifs et dispositif, ensemble violation de l'article 194 du code d'instruction criminelle, manque de base légale ;
Ainsi développé :
«Première branche : contradiction entre motifs et dispositif ;
«En ce qu'il ressort de l'arrêt déféré ( 3ème rôle avant dernier paragraphe), que le jugement confirmé par l'arrêt attaqué a condamné le prévenu seul aux dépens ;
«Attendu que l'arrêt attaqué mentionne dans son dispositif (6ème rôle rubrique «Au fond) «...condamne les appelants solidairement aux dépens...» ;
Attendu qu'en confirmant par adoption de motifs le jugement entrepris, lequel a condamné uniquement le prévenu aux dépens d'une part et d'autre part en relevant dans son dispositif que les appelants (demandeurs au pourvoi, prévenu et civilement responsable) sont condamnés solidairement aux dépens le juge d'appel s'est contredit ;
Attendu que la contradiction entre les motifs et le dispositif s'analyse en un défaut et une insuffisance de motifs ; en ce sens CS arrêt n°197/P du 20 mars 1980 ;
Qu'en statuant comme il l'a fait, le juge d'appel a violé l'article 5 du texte susvisé et n'a pas donné de base légale à sa décision qu'il expose à la censure ;
D'où il suit que le moyen est fondé en sa première branche ;
«Deuxième branche : violation des articles 6 de l'ordonnance n°72/4 et 194 du code d'instruction criminelle ;
«En ce qu'il résulte des énonciations des textes visés supra que les frais de justice criminelle doivent être mis à la charge de la partie qui succombe et que les règles relatives à la liquidation desdits frais sont d'ordre public ; (en ce sens CS arrêt n°202/P du 14 juillet 1988 Aff. Lappi Bernadette contre MP et Siake Brigitte) ;
«Attendu que l'arrêt confirmatif attaqué a condamné les appelants (Prévenu et civilement responsable, demandeurs au pourvoi) solidairement aux dépens, sans s'expliquer outre mesure sur la condamnation du civilement responsable ;
«Attendu qu'en statuant ainsi, le juge d'appel n'a nullement motivé sa décision, ce qui aurait permis à la haute juridiction d'exercer son pouvoir sur la légalité de la décision intervenue ;
«Que ce faisant, il a manifestement violé les textes visés au moyen et par voie de conséquence expose son arrêt à la censure ;
«Attendu que toute décision de justice doit contenir des motifs propres à la justifier ; qu'il a été jugé plusieurs fois que l'insuffisance de motifs est équivalente à un défaut de motifs, CS arrêt n°293/P du 16 août 1979 ;
Qu'il s'ensuit que le moyen est fondé en sa deuxième branche» ;
Attendu que l'article 194 alinéa 1 du code d'instruction criminelle repris par l'article 6 alinéa 2 de l'ordonnance n°72/4 du 26 août 1972 dispose :
«Tout jugement de condamnation rendu contre le prévenu et contre les personnes civilement responsables du délit ou contre la partie civile, les condamnera aux dépens même envers la partie publique » ;
Attendu que si devant le premier juge, le prévenu était la seule partie mise en cause, par contre en appel deux parties ont exercé ledit recours ;
Attendu qu'en les condamnant solidairement aux dépens comme parties ayant succombé en appel, le deuxième juge sans se contredire n'a fait qu'appliquer les textes visés ci-dessus ;
D'où il suit que le moyen en ses deux branches n'est pas fondé ;
Et attendu que l'arrêt est par ailleurs régulier ;
PAR CES MOTIFS
REJETTE le pourvoi ;
CONDAMNE les demandeurs aux dépens ;
ORDONNE qu'à la diligence de Monsieur le Procureur Général près la Cour suprême, le présent arrêt sera imprimé et transmis pour être transcrit sur les registres du Greffe de la Cour d'Appel de l'Ouest et que mention en sera faite en marge ou à la suite de la décision attaquée.",ARRET_N_378_P_DU_5_AOUT_1999,0,arret,"{'Court': 'COUR SUPRÊME DU CAMEROUN', 'Chamber': 'Chambre Pénale', 'Section': '', 'Case': '', 'Appeal': '', 'Claimant': 'FEUDJIO ANTOINE ET TCHINDA JEAN CLAUDE', 'Against': 'C/', 'Defendant': 'MINSITÈRE PUBLIC, TAMTCHEP . TENE ET TATSINKOU MÉDARD', 'Judgment': 'ARRET N°378/P DU 5 AOUT 1999'}"
