URL,text,page_title,page_label,category,metadata
https://www.juriafrica.com/lex/arret-350-p-22-juillet-1999-10385.htm,"ARRET N°350/P DU 22 JUILLET 1999

LA COUR,
Vu le mémoire ampliatif déposé le 28 avril 1989 par Maîtres Tang et Tang Ndombo, Avocats associés à Yaoundé ;
Sur le moyen unique de cassation pris de la violation de l'article 5 de l'ordonnance n°72/4 du 26 août 1972, défaut de motifs, manque de base légale ;
«En ce que le jugement confirmé s'est basé sur les dénégations du prévenu pour débouter Fotie pourtant il y a une contradiction flagrante entre les déclarations du témoin Fotso Samuel et le prévenu ;
«Pendant que le prévenu nie avoir vendu la parcelle à Fotso, ce dernier affirme mordicus que c'est bien le prévenu Tchounda qui lui a cédé le lot litigieux ;
«Dès lors les dénégations de Tchounda étant ébranlées par Fotso Samuel sa relaxe n'est pas justifiée ;
«En concluant que des débats et des pièces il ne résulte pas preuve de la culpabilité du prévenu malgré la déposition pourtant sans équivoque du témoin Fotso Samuel où il apparaît que Tchounda est au noeud du litige, le premier juge n'a pas motivé sa décision et par conséquent l'arrêt ne l'est non plus ;
Alors que toute décision de justice doit être motivée en fait et en droit » ;
Attendu que le moyen qui est de pur fait, sous le prétexte de violation de la loi, tend à inviter la Cour suprême qui n'est pas un troisième degré de juridiction à un nouvel examen des faits et des éléments de preuve souverainement appréciés par les juges du fond ;
Attendu au demeurant que le jugement confirmé par l'arrêt attaqué énonce :
«Attendu que ce qui précède prouve que c'est Maganche Job qui après avoir acheté le terrain a détruit avec une équipe de prisonniers la maison qui s'y trouvait ; que ce n'est pas le prévenu qui est l'auteur des faits de la prévention » ;
Attendu que par ces énonciations le premier juge et par suite celui d'appel ont suffisamment justifié leurs décisions ;
D'où il suit que le moyen n'est pas fondé et que le pourvoi encourt le rejet ;
PAR CES MOTIFS
REJETTE le pourvoi ;
CONDAMNE le demandeur aux dépens ;
ORDONNE qu'à la diligence de Monsieur le Procureur Général près la Cour suprême, le présent arrêt sera imprimé et transmis pour être transcrit sur les registres du Greffe de la Cour d'Appel de Bafoussam et que mention en sera faite en marge ou à la suite de la décision attaquée.",ARRET_N_350_P_DU_22_JUILLET_1999,0,arret,"{'Court': 'COUR SUPRÊME DU CAMEROUN', 'Chamber': 'Chambre Pénale', 'Section': '', 'Case': '', 'Appeal': '', 'Claimant': 'FOTIE ANTOINE', 'Against': 'C/', 'Defendant': 'MINISTÈRE PUBLIC ET TCHOUNDA JOSEPH DIT MEPE', 'Judgment': 'ARRET N°350/P DU 22 JUILLET 1999'}"
