URL,text,page_title,page_label,category,metadata
https://www.juriafrica.com/lex/arret-87-cc-17-juin-1999-11009.htm,"ARRET N°87/CC DU 17 JUIN 1999

LA COUR,
Vu le mémoire ampliatif déposé le 19 juillet 1986 par Maître Mong, Avocat à Yaoundé ;
Sur le premier moyen de cassation amendé pris de la violation de la loi, violation des articles 39 et 214 du code de procédure civile et commerciale ;
En ce que l'arrêt attaqué •n'a pas reproduit la requête d'appel ;
Alors qu'aux termes de l'article 39 du code de procédure. civile et commerciale, les jugements doivent contenir entre autres indications l'acte introductif d'instance ;
Ces prescriptions sont applicables en matière d'appel en vertu des dispositions de l'article 214 du même code et aux termes desquelles les autres règles concernant les tribunaux d'instance seront observées devant la Cour d'Appel ;
Attendu qu'il s'agit d'une formalité substantielle qui permet à la Cour suprême d'exercer son contrôle sur la régularité de la décision ;
Attendu en l'espèce que dans les qualités de l'arrêt attaqué, le juge d'appel se borne à énoncer que :
« Par requête en date du 1er juin 1981, le sieur Essounga Théodore déclarait interjeter appel du jugement sus-énoncé » ;
Attendu qu'en se contentant de ces indications sommaires, sans reproduire le contenu de la requête d'appel, ledit magistrat a méconnu les textes visés au moyen ;
D'où il suit que celui-ci est fondé ;
PAR CES MOTIFS
Et sans qu'il soit besoin d'examiner le second moyen proposé par le demandeur au pourvoi,
CASSE ET ANNULE l'arrêt n°118/c rendu le 17 juin 1983 par la Cour d'Appel de Douala ;
REMET en conséquence la cause et les parties au même et semblable état où elles étaient avant ladite décision et, pour être faire droit, les renvoie devant la Cour d'Appel de l'Ouest ;
RESERVE les dépens ;
ORDONNE qu'à la diligence de Monsieur le Procureur Général près la Cour suprême, le présent arrêt sera imprimé et transmis pour être transcrit sur les registres du Greffe de la Cour d'Appel de Douala et que mention en sera faite en marge ou à la suite de la décision annulée.",ARRET_N_87_CC_DU_17_JUIN_1999,0,arret,"{'Court': 'COUR SUPRÊME DU CAMEROUN', 'Chamber': 'Chambre Civile et Commerciale', 'Section': '', 'Case': '', 'Appeal': '', 'Claimant': 'ESSOUNGA THÉODORE', 'Against': 'C/', 'Defendant': 'ESSOUNGA JEAN', 'Judgment': 'ARRET N°87/CC DU 17 JUIN 1999'}"
