URL,text,page_title,page_label,category,metadata
https://www.juriafrica.com/lex/arret-118-23-juillet-1998-37816.htm,"ARRET N° 118/S DU 23 JUILLET 1998

LA COUR,
Vu le mémoire ampliatif déposé le 25 avril 1986 par Maîtres Simon et Betayene, Avocats à Yaoundé ;
Sur le premier moyen de cassation ainsi présenté :
«Violation de l'article 153-2 du Code du travail — défaut de motifs — contrariété entre motifs et dispositif ;
«En ce que dans ses motifs la Cour énonce : « Que dès (sic) jugement querellé en toutes ses dispositions» ;
«Alors que, dans le dispositif, la Cour «Confirme le jugement entrepris en toutes ses autres dispositions» ;
« Cette formulation laisse entendre que la Cour n'a pas confirmé le jugement, contrairement à ce qu'elle énonçait dans ses motifs, dans toutes ses dispositions, mais seulement dans une partie de celles-ci, l'autre partie non précisée par ailleurs, échappant à la confirmation ;
«D'où il suit que le dispositif de l'arrêt est contraire aux motifs, et que cette contrariété doit entraîner cassation» ;
Attendu que l'arrêt attaqué énonce dans son dispositif :
«Confirme le jugement entrepris dans toutes ses autres cd dispositions»
Attendu que s'agissant d'une confirmation pure et simple, et en absence de toute autre appréciation, il échet de déduire que c'est par une simple inadvertance dactylographique que l'arrêt querellé fait état «d'autres» dispositions, manifestement inexistantes ;
Qu'au surplus, cet adjectif surabondant, certes facteur de confusion et de discordance entre les motifs et le dispositif, ne saurait être cause de réelle contradiction ;
D'où il suit que le moyen n'est pas fondé ;
Sur le second moyen ainsi formulé :
«Violation de l'article 153-2° du Code du travail, violation des droits de la défense, non-réponse aux conclusions, défaut de motifs, manque de base légale ;
«En ce que, la Société Camerounaise de Banque avait conclu devant la Cour :
«Attendu que l'évolution de la carrière d'Etoga atteste à l'évidence que la concluante l'a toujours avancé quand il le méritait ;
«Attendu qu'Etoga ne peut nier avoir perçu tous les droits de rupture suivant la catégorie réclamée» ;
«Et ceci était repris dans le corps et le dispositif des conclusions du 25 juin 1985 reproduites dans les qualités de l'arrêt ;
«En effet, le procès-verbal de conciliation partielle fait état du règlement par la Société Camerounaise de Banque du montant du reclassement d'Etoga à la 8e catégorie pour le compte du 1er janvier 1981 (sic) avec rappel y afférent, soit 207.378 francs ;
«On ne peut que constater que dans sa motivation la Cour d'Appel n'a nullement répondu à cet argument qui faisait tomber le motif tiré du désir de la Société Camerounaise de Banque d'éviter, par le licenciement, d'avoir à reclasser un employé ;
«L'arrêt doit donc être cassé pour défaut de motifs résultant de non-réponse à des conclusions précises» ;
Attendu qu'il résulte explicitement des énonciations du moyen que la non-réponse critiquée, loin de concerner un moyen de défense, porte sur un simple argument, qui n'imposait aucune obligation aux juges du fond ;
Attendu au surplus que le moyen tend à contester devant la Cour Suprême, qui n'est pas un troisième degré de juridiction, l'appréciation des faits de la cause et des éléments de preuve souverainement opérée par les juges du fond ;
D'où il suit que le moyen est autant irrecevable qu'il n'est pas fondé ;
Et attendu par ailleurs que l'arrêt querellé est régulier ;
PAR CES MOTIFS
REJETTE le pourvoi ;
ORDONNE qu'à la diligence de Monsieur le Procureur Général près la Cour Suprême, le présent arrêt sera imprimé et transmis pour être transcrit sur les registres du Greffe de la Cour d'Appel de Yaoundé et que mention en sera faite en marge ou à la suite de la décision attaquée.",ARRET_N_118_S_DU_23_JUILLET_1998,0,arret,"{'Court': 'COUR SUPRÊME DU CAMEROUN', 'Chamber': 'Chambre sociale', 'Section': '', 'Case': '', 'Appeal': '', 'Claimant': 'SOCIÉTÉ CAMEROUNAISE DE BANQUE', 'Against': 'C/', 'Defendant': 'ETOGA ETIENNE', 'Judgment': 'ARRET N° 118/S DU 23 JUILLET 1998'}"
