URL,text,page_title,page_label,category,metadata
https://www.juriafrica.com/lex/arret-65-20-juillet-2000-11585.htm,"ARRET N°65/L DU 20 JUILLET 2000

LA COUR,
Vu le mémoire ampliatif déposé le 19 mars 1991 par Maître Mbodi Epee Gaston, Avocat à Douala ;
Sur le moyen unique de cassation pris en sa première branche de la violation de la loi, violation de l'article 11 (2) du décret n°79-448 du 5 novembre 1979 portant réglementation des fonctions et fixant le statut des huissiers ;
«En ce que... l'arrêt attaqué s'est borné à dire que les exploits d'huissiers font foi en justice jusqu'à inscription de faux pour tout ce que ceux-ci ont par eux-mêmes constaté ou accompli dans l'exercice de leurs fonctions...
«Alors que s'il est vrai que la signification porte le nom de «Maître Atangana Basile», huissier de justice à Douala, il n'en demeure pas moins que le jugement n°59 /TC relève incontestablement que ce n'est pas l'huissier lui-même qui avait servi cette signification mais plutôt son clerc, le nommé Tsoungui Elandi, lequel l'a reconnu à la barre lors des débats d'une part ;
«Que d'autre part, aux termes de l'article 11 (2) du décret n°79-448 du 5 novembre 1979 ... ceux-ci (les huissiers) peuvent se faire suppléer dans tous les actes de leur ministère par les clercs assermentés ... »;
«Que l'article 11 (1) du même texte fait la différence entre clercs assermentés et clercs non assermentés ;
«Que les clercs non assermentés n'ont pas qualité pour instrumenter»;
Attendu qu'il est de principe que les actes authentiques (exploits d'huissiers, actes notariés...) font foi jusqu'à inscription de faux ; que pour faire tomber la force probante qui s'attache aux énonciations d'iceux, il faut engager la procédure d'inscription en faux ;
Attendu que pour confirmer le jugement entrepris et dire définitif celui n°13/Cout du 09 novembre 1988 du Tribunal de Premier Degré de Douala-ville et Bonabéri l'arrêt attaqué énonce :
«Considérant que les exploits d'huissier font foi jusqu'à inscription de faux pour tout ce que ceux-ci ont par eux-mêmes constaté ou accompli dans l'exercice de leurs fonctions ; qu'ainsi tous les exploits possèdent cette force probante en ce qui concerne :
«1) leur date (Civ 7 juillet 1882, DP 83.1.350) ;
«2) la personne à laquelle ils sont signifiés et le domicile où la signification est faite ;
« 3) l'identité de la personne à laquelle L'huissier déclare avoir remis la copie... ;
«Considérant qu'il résulte des pièces du dossier que par exploit en date du 12 décembre 1988, Maître Atangana Basile, huissier de justice près la Cour d'Appel et les Tribunaux de Douala signifiait et laissait copie au sieur Dodo Youssouf demeurant à Douala, en son domicile où étant et parlant à «sa personne qui reçoit copie mais refuse de signer», de l'expédition certifiée conforme d'un jugement n°13/Cout rendu le 9 novembre 1988 par le Tribunal de Premier Degré de Douala-ville et Bonabéri ;
«Considérant que pour faire tomber la force probante qui s'attache aux énonciations de l'exploit susvisé, il revenait à l'intimé d'engager la procédure d'inscription de faux ; qu'il échet dès lors d'infirmer le jugement déféré qui a admis d'autres éléments de preuve ;
«Considérant que l'intimé avant relevé appel à l'encontre du jugement n°13/Cout du 9 novembre 1988 lequel, vu ce qui précède, lui a été signifié à sa personne le 12 décembre 1988, il échet de dire définitif ledit jugement...»;
Attendu que par ces énonciations abondantes et suffisantes, le juge d'appel a légalement justifié sa décision, et n'a nullement violé le texte visé au moyen ;
D'où il suit que celui-ci n'est pas fondé en cette branche ;
Sur la seconde branche du moyen prise de la non réponse aux conclusions équivalant à l'insuffisance de motifs ;
En ce que le juge d'appel n'a pas répondu à la question de savoir si Tsoungui Elandi, qui a servi la signification du 12 décembre 1988 était ou non un clerc assermenté, étant entendu que les clercs non assermentés n'ont pas qualité pour instrumenter ;
Attendu que les juges du fond ne sont tenus de répondre qu'au dispositif des conclusions et, dans un dispositif, qu'aux chefs précis de demande et non aux arguments présentés dans les motifs mais non formulés dans le dispositif ;
Attendu, en l'espèce, que ni dans les motifs, encore moins dans le dispositif des conclusions d'appel de Dodo Youssouf en date du 10 mai 1990 visées par l'arrêt attaqué, il n'est fait allusion à la qualité du clerc ayant servi la signification du 12 décembre 1988 ou à la signification elle-même, mais plutôt à la présumée absence de l'intéressé du Cameroun à la date de ladite signification et à la confirmation du jugement ;
Attendu qu'il ne saurait dès lors être reproché au juge d'appel de n'avoir pas répondu au chef de demande susvisé, icelui n'avant pas été saisi desdites conclusions ;
D'où il suit que le moyen n'est pas davantage fondé en sa deuxième branche ;
PAR CES MOTIFS
REJETTE le pourvoi de Dodo Youssouf ;
Confirme le demandeur aux dépens ;
ORDONNE qu'à la diligence de Monsieur le Procureur Général près la Cour Suprême, le présent arrêt sera imprimé et transmis pour être transcrit sur les registres du greffe de la Cour d'Appel du Littoral et que mention en sera faite en marge ou à la suite de la décision attaquée.",ARRET_N_65_L_DU_20_JUILLET_2000,0,arret,"{'Court': 'COUR SUPRÊME DU CAMEROUN', 'Chamber': 'Chambre Traditionnelle', 'Section': '', 'Case': '', 'Appeal': '', 'Claimant': 'DODO YOUSSOUF', 'Against': 'C/', 'Defendant': 'DODO ISSIAKA', 'Judgment': 'ARRET N°65/L DU 20 JUILLET 2000'}"
