URL,text,page_title,page_label,category,metadata
https://www.juriafrica.com/lex/arret-104-cc-22-juillet-1999-10783.htm,"ARRET N°104/CC DU 22 JUILLET 1999

LA COUR,
Vu le mémoire ampliatif déposé le 11 octobre 1991 par Maître N'thepe, Avocat à Douala ;
Sur le moyen de cassation substitué d'office au moyen proposé, et pris de la violation des articles 39 et 214 du code de procédure civile et commerciale ;
En ce qu'en évoquant la requête d'appel, l'arrêt attaqué se borne à énoncer dans ses qualités :
« Par requête en date du 02 mars 1987, Maître N'thepe, Avocat, agissant au nom et pour le compte de dame Ndome Kalla Catherine, déclarait interjeter appel contre le jugement sus-énoncé » ;
Alors qu'il résulte des dispositions de l'article 39 du code de procédure civile et commerciale, dont l'article 214 du même code étend l'application aux arrêts des Cours d'Appel, que les jugements doivent, entre autres indications, contenir l'acte introductif d'instance, dont l'acte d'appel tient lieu en cause d'appel ;
C'est en violation desdits textes que le juge d'appel s'est limité aux énonciations ci-dessus relevées alors que ces prescriptions portent sur l'intégralité dudit acte, contrairement au cas des conclusions des parties, dont seul le dispositif est requis ;
Attendu qu'il résulte des dispositions combinées des textes visés au moyen que les jugements et arrêts doivent, soit dans leurs qualités, soit dans leurs motifs, reproduire entre autres éléments le contenu de l'acte introductif d'instance, en l'espèce, la requête d'appel ;
Attendu qu'il ne ressort pas de l'arrêt critiqué que cette exigence a été satisfaite ;
Qu'il s'agit d'une formalité substantielle destinée à permettre à la Cour suprême d'exercer son contrôle sur la régularité des décisions judiciaires qui lui sont déférées quant à la détermination de la chose jugée et par ailleurs indissociable de l'obligation faite aux juges du fond, à peine de nullité de leurs décisions, de les motiver conformément aux dispositions de l'article 5 de l'ordonnance n°72/4 du 26 août 1972 portant organisation judiciaire, obligation dont découle celle de répondre à toutes les conclusions des parties ;
D'où il suit que le moyen est fondé et que l'arrêt attaqué encourt la cassation ;
PAR CES MOTIFS
Et sans qu'il soit besoin d'examiner le moyen proposé,
CASSE ET ANNULE l'arrêt n°331/c rendu le 21 juillet 1989 par la Chambre civile et commerciale de la Cour d'Appel de Douala ;
REMET en conséquence la cause et les parties au même et semblable état où elles étaient avant ladite décision et, pour être fait droit, les renvoie devant la Cour d'Appel d'Ebolowa ;
RESERVE les dépens ;
ORDONNE qu'à la diligence de Monsieur le Procureur Général près la Cour suprême, le présent arrêt sera imprimé et transmis pour être transcrit sur les registres du Greffe de la Cour d'Appel de Douala et que mention en sera faite en marge ou à la suite de la décision annulée.",ARRET_N_104_CC_DU_22_JUILLET_1999,0,arret,"{'Court': 'COUR SUPRÊME DU CAMEROUN', 'Chamber': 'Chambre Civile et Commerciale', 'Section': '', 'Case': '', 'Appeal': '', 'Claimant': 'NDOME KALLA CATHÉRINE ET AUTRES', 'Against': 'C/', 'Defendant': 'TCHAMBA', 'Judgment': 'ARRET N°104/CC DU 22 JUILLET 1999'}"
