URL,text,page_title,page_label,metadata
https://www.juriafrica.com/lex/arret-178-cc-21-septembre-2000-10590.htm,"LA COUR,
Vu le mémoire ampliatif déposé le 03 décembre 1986 par la société civile professionnelle d'Avocats Ninine et Bonnard, Avocats à Douala ;
Sur le premier moyen de cassation pris de la violation et fausse application de la loi, notamment des articles 550 et 555 du code civil — insuffisance de motifs — manque de base légale, ensemble violation de l'article premier du code civil et de l'article 5 de l'arrêté du 15 septembre 1921 portant organisation de la conservation de la propriété foncière ;
En ce que,
«I,e juge d'appel à la suite du premier juge, bien qu'y ayant été expressément invité ;
Par conclusions d'instance du 6 mai 1981 ;
Par requête d'appel 18 janvier 1983, se refuse à reconnaître la bonne foi de Nthumili Peter au sens de l'article 550 du code civil pour avoir cru à la validité d'un titre nul, et ce, au motif qu'il s'était permis de construire au mépris de l'arrêté préfectoral du 3 juin 1971 délivré à Tchande Daniel ;
«Alors que le juge ne fait aucune référence ni à la signification d'un tel arrêté à la personne de Nthumili Peter ;
«Ni de la publication dudit arrêté dans un journal d'annonces légales ;
«Alors que conformément aux dispositions d'ordre public de l'article premier du code civil, les lois ne sont exécutoires dans tout le territoire de la République qu'en vertu de la promulgation qui en est faite par le Président de la République ;
«Il en résulte que la Cour d'Appel à la suite du Tribunal de Première instance ne pouvait contester la bonne foi de Nthumili Peter uniquement en fonction d'une disposition réglementaire qui n'avait pas été portée à sa connaissance» ;
Attendu que sous le couvert de la violation de la loi le moyen tend en réalité à inviter la Cour suprême qui n'est pas un troisième degré de juridiction à un nouvel examen des faits de la cause et éléments de preuve dont l'appréciation souveraine réservée aux juges du fond échappe à son contrôle ;
D'où il suit que le moyen, est irrecevable ;
Sur le second moyen pris du défaut — insuffisance de motifs, violation de l'article 5 de l'ordonnance n°72/4 du 26 août 1972, ensemble violation de l'article 2 du code civil ;
En ce que,
«La Cour d'Appel ayant été saisie d'un nouveau moyen expressément indiqué dans ladite requête, se borne à confirmer par simple adoption de motifs, sans répondre au deuxième moyen évoqué ni discuté devant le premier juge ;
«Or, toute décision de justice doit à peine de nullité être motivée en fait et en droit ;
«Il en résulte que l'arrêt encourt la cassation pour ne pas avoir répondu à ce nouveau moyen développé pour la première fois dans la requête d'appel ;
«Ce point méritait d'autant plus d'être discuté que si la loi n'a pas d'effet rétroactif, à fortiori un simple titre de propriété, ne peut du jour de sa création remettre en cause et annuler tous les droits qu'un individu pouvait tenir antérieurement de son occupation paisible des lieux;
«C'est sous le bénéfice de ces observations et moyens ;
«Que l'exposant conclut à ce qu'il plaise à la Cour suprême ;
«Casser et annuler avec toutes les conséquences de droit, l'arrêt 27/c rendu le 16 novembre 1984 par la Chambre civile de la Cour d'Appel de Douala» ;
Attendu que le jugement entrepris énonce :
«Attendu que par jugement n°444 du 15 septembre 1976, le Tribunal déclarait irrecevable en l'état, la demande d'expulsion de Tchande Daniel ;
«Qu'en effet ce dernier avait présenté l'arrêté préfectoral lui attribuant le lot litigieux et Nthumili Peter produisait un acte d'acquisition sur le même immeuble sous seing privé ;
«Attendu qu'en dehors du titre foncier consacré comme seule source de droits réels immobiliers par l'ordonnance n°74/1 du 6 juillet 1974 aucun de ces deux titres ne pouvait en 1976, conférer la propriété de l'immeuble à une partie ;
«Que le titre foncier obtenu quelques années après cette décision donnait droit au requérant de poursuivre sans faille son action en expulsion, étant donné qu'aucune équivoque possible ne pouvait plus exister sur les droits des parties ; que la présente est donc recevable»;
Attendu que par ces énonciations suffisantes et pertinentes, le premier juge a répondu aux conclusions dont s'agit ;
Attendu qu'en confirmant ledit jugement par adoption de ses motifs le juge d'appel a suffisamment répondu auxdites conclusions ;
D'où il suit que le moyen n'est pas fondé ;
Et attendu par ailleurs que l'arrêt attaqué est régulier ;
PAR CES MOTIFS
REJETTE le pourvoi ;
CONDAMNE le demandeur aux dépens ;
ORDONNE qu'à la diligence de Monsieur le Procureur Général près la Cour suprême, le présent arrêt sera imprimé et transmis pour être transcrit sur les registres du Greffe de la Cour d'Appel de Douala et que mention en sera faite en marge ou à la suite de la décision attaquée.",ARRET_N_178_CC_DU_21_SEPTEMBRE_2000,0,"{'Court': 'COUR SUPRÊME DU CAMEROUN', 'Chamber': 'Chambre Civile et Commerciale', 'Section': '', 'Case': '', 'Appeal': '', 'Claimant': 'NTHUMILI PETER', 'Against': 'C/', 'Defendant': 'TCHANDE DANIEL', 'Judgment': 'ARRET N°178/CC DU 21 SEPTEMBRE 2000'}"
