URL,text,page_title,page_label,category,metadata
https://www.juriafrica.com/lex/arret-14-civ-15-juillet-2010-8826.htm,"ARRET N° 14/CIV DU 15 JUILLET 2010

L'an deux mille dix et le quinze du mois de juillet ;
La Cour Suprême statuant en matière de droit civil ;
En son audience publique de vacation a rendu l'arrêt dont la teneur suit :
ENTRE:
La Société Africaine d'Assurance et de Réassurances (SAAR) S.A, demanderesse en cassation, représentée par Maître EMTCHEU NGOUYAMSA Elise, avocat à Yaoundé ;
D'UNE PART
E T,
Les Ayants droit de NGOME David NJUME M., défendeurs à la cassation ;
D'AUTRE PART
En présence de Monsieur Raymond Landry BOUELET, Avocat Général près la Cour Suprême ;
Statuant sur le pourvoi formé par Maître EMTCHEU NGOUYAMSA Elise, avocat à Yaoundé, agissant au nom et pour le compte de la Société Africaine d'Assurance et de Réassurances (SAAR), par déclaration enregistrée le 22 novembre 2006 au greffe de la Cour d'Appel du Centre, en cassation de l'arrêt n° 03/Civ du 04 octobre 2006 rendu en matière civile et commerciale par la susdite juridiction dans l'affaire opposant sa cliente aux ayants droit de NGOME David NJAME ;
LA COUR
Après avoir entendu en la lecture du rapport, Monsieur Jean Jacques BIKOUE, Conseiller à la Cour Suprême ;
-Vu les conclusions de Monsieur Martin RISSOUK à MOULONG, Procureur Général près la Cour Suprême ;
Vu le mémoire ampliatif déposé le 21 août 2008 ; Sur le premier moyen de cassation ainsi présenté :
Sur le droit
Attendu qu'au soutien de son recours, la société demanderesse articule deux moyens : la non réponse aux conclusions et la violation de la loi ;
A — Sur le premier moyen pris de la non réponse aux conclusions
Attendu que devant le premier juge, la recourante a à l'audience du 12 juillet 2004 déposé des conclusions exceptionnelles tendant à l'irrecevabilité de l'action introduite ;
Que non seulement le premier juge s'est gardé de reproduire dans son jugement les motifs de l'exception soulevée, mais l'a simplement rejetée sans la moindre discussion ;
qu'il est de jurisprudence constante que tout jugement ou arrêt doit contenir les motifs propres à la justifier : CS/CO arrêt n° 20 du 13/01/1970, Bull. n° 22, P. 2738 ;
Que malheureusement, ce manquement dirimant a été avalisé par le juge d'appel ;
Que pour s'être mépris au respect de la norme ainsi édictée, l'arrêt querellé encourt cassation » ;
Attendu qu'en vertu de l'article 13 (2) de la loi N° 75/16 du 8 décembre 1975 fixant la procédure et le fonctionnement de la Cour Suprême le moyen invoqué à l'appui du pourvoi doit, à peine d'irrecevabilité, être articulé et développé ;
Qu'il en résulte que non seulement le moyen de cassation doit contenir l'indication complète et non erronée du texte de loi ou du principe de droit prétendument violé ou faussement appliqué, les dispositions du texte visé, mais qu'il doit aussi montrer en quoi ledit texte ou ledit principe de droit a été violé ou faussement appliqué ;
Attendu qu'en l'espèce, tel que présenté, le moyen ne vise aucun texte ;
Que ce faisant il n'est pas conforme à l'article 13 (2) ci-dessus spécifié ;
Qu'il s'ensuit que le moyen est irrecevable
Sur la première branche du second moyen de cassation prise de la violation de la loi, violation de l'article 233 du Code CIMA relatif aux indemnisations des victimes d'accident de circulation :
En ce que :
« ...l'arrêt querellé a confirmé la condamnation mise au passif de la recourante au titre des pénalités encourues au cas où l'offre de transaction est tardive ;
« Mais attendu que telle sanction n'est opposable à l'assureur en garantie que lorsque celui-ci dispose des éléments objectifs pour meubler la transaction ;
Que l'article 223 du code Cima dispose :
...cette pénalité est réduite ou annulée en raison des circonstances non imputables à l'assureur lorsqu'il ne dispose pas de l'adresse de la victime » ;
Attendu qu'il est constant que dans le cas d'espèce, qu'avant l'offre intervenue en 2002, la SAAR ne disposait d'aucune information relative aux ayants droit de la victime ;
Qu'après la première correspondance, elle a conseillé aux ayants droits du de cujus de se conformer au respect des dispositions de l'article 241 du Code sus évoqué ;
Qu'en effet, dans la demande de la transaction intervenue, plusieurs pièces décisives manquaient, notamment ; - le certificat de vie des ayants droit et leur identité, le jugement d'hérédité non frappé d'appel ;
Qu'en l'absence de ces pièces, l'assureur ne disposait d'aucun élément objectif pour fonder la base de l'indemnisation ;
Qu'au demeurant, le retard ainsi accusé était lié aux circonstances non imputables à l'assureur, toute chose qui le prédisposait de tirer bénéfice des dispositions in fine de l'article 233 précité ;
Qu'en se méprenant sur le respect de l'article 233, l'arrêt querellé mérite cassation ;
-Attendu que le moyen tel que formulé en cette branche est mélangé de fait et de droit ;
-Qu'il est par conséquent irrecevable ;
Sur la seconde branche du deuxième moyen de cassation prise de la violation de la loi, violation des dispositions de l'article 241 du Code CIMA relatif à l'indemnisation des victimes d'accident de la circulation ;
En ce que
Le premier juge suivi par celui d'appel a condamné la SSAR au paiement de la somme astronomique de 26 431 235 f CFA (vingt six millions quatre cent trente un mille deux cent trente cinq francs), en l'absence de toutes les pièces énumérées à l'article visé au soutien du moyen ;
Qu'en effet, le paragraphe 9 de la disposition susmentionnée édicte :
...A la demande de l'assureur, les mêmes personnes sont tenues de produire les documents suivants :
Certificat de décès de la victime,
Jugement d'hérédité non frappé d'appel,
certificat de vie des ayants droit,
certificat de genre de mort,
les actes civils des ayants droit et leur pièce d' identité. »
Qu'il demeure constant que la demande d'offre de transaction n'était pas accompagnée des pièces ci-dessus reprises ;
Que malheureusement l'arrêt déféré a entériné la décision d'instance, nonobstant l'absence de la production desdites pièces par les défendeurs ;
« Que telle production devait être préalable à l'examen au fond du litige, dès lors qu'elle permettait au juge de s'assurer de la qualité, de la capacité, de l'existence réelle et de la viabilité de tous les ayants droits ;
« Qu'il devient aisé au bénéfice de ce qui précède de dire et juger que le pourvoi introduit est fondé » ;
Attendu que le moyen en cette branche est nouveau comme soulevé pour la première fois devant la Cour Suprême ;
Qu'il est par conséquent irrecevable ;
PAR CES MOTIFS
Rejette le pourvoi ;
Condamne la demanderesse aux dépens ;
-Ordonne qu'à la diligence du Greffier en chef de la Chambre Judiciaire de la Cour Suprême, une expédition du présent arrêt sera transmise à Monsieur le Procureur Général près la Cour d'Appel du Littoral et au Greffier en Chef de ladite Cour pour mention dans leurs registres respectifs ;
Ainsi jugé et prononcé par la Cour Suprême en son audience publique de vacation du quinze juillet deux mille dix, en la salle des audiences de la Cour où siégeaient :
-MM : Alexis DIPANDA MOUELLE, Premier Président de la Cour Suprême PRESIDENT
Dagobert BISSECK, Conseiller
Jean Jaques BIKOUE, Conseiller
En présence de Monsieur Raymond Landry BOUELET, Avocat Général, occupant le banc du Ministère Public ;
Et avec l'assistance de Maître Appolinaire KOE AMOUGOU, Greffier ;
En foi de quoi, le présent arrêt a été signé par le Président, les Conseillers et le Greffier ;
-Approuvant mot rayé nul
LE PRESIDENT, LES CONSEILLERS, LE GREFFIER.-",ARRET_N_14_CIV_DU_15_JUILLET_2010,0,arret,"{'Court': 'COUR SUPREME DU CAMEROUN', 'Chamber': 'CHAMBRE JUDICIAIRE', 'Section': 'SECTION CIVILE', 'Case': 'DOSSIER N° 39/Civ/08', 'Appeal': 'POURVOI N° 32 du 22 novembre 2006', 'Claimant': ""SOCIÉTÉ AFRICAINE D'ASSURANCE ET DE RÉASSURANCES (SAAR) SA"", 'Against': 'C/', 'Defendant': 'AYANTS DROIT DE NGOME DAVID NJUME M', 'Judgment': 'ARRET N° 14/CIV DU 15 JUILLET 2010'}"
