URL,text,page_title,page_label,category,metadata
https://www.juriafrica.com/lex/arret-04-p-29-octobre-1998-10091.htm,"ARRET N°04/P DU 29 OCTOBRE 1998

LA COUR,
Vu le mémoire ampliatif déposé le 22 novembre 1989 par Maître Thomas Byll Ndengue, Avocat à Yaoundé ;
Sur le moyen unique de cassation pris de la violation de l'article 5 de l'ordonnance n°72/4 du 26 août 1972, défaut de motifs, manque de base légale ;
En ce que la Cour d'Appel de Yaoundé s'est bornée à confirmer le jugement entrepris au motif que le premier juge a fait une saine appréciation des faits de la cause et une exacte application de la loi pénale ;
Alors qu'aux termes de l'article 5 de l'ordonnance précitée il est fait obligation à chaque juge de motiver sa décision en fait et en droit, de développer ses moyens propres susceptibles de justifier sa décision ;
De jurisprudence constante, l'adoption des motifs du premier juge par le juge d'appel équivaut à une absence de motifs et ne permet pas à la Cour suprême d'exercer son pouvoir de contrôle sur la régularité de la décision ainsi rendue (arrêt n°144/P du 31 janvier 1980 Affaire Matip Etienne contre Ministère Public) ;
Le juge d'appel se devait donc de reprendre les motifs qu'il adopte et les développer pour permettre à la haute juridiction d'exercer son pouvoir de contrôle ;
«En omettant de le faire, le juge d'appel a violé les dispositions visées au moyen et sa décision encourt la cassation ;
Mais attendu que contrairement aux allégations du moyen, il n'est pas exact qu'il est de jurisprudence constante que l'adoption des motifs du premier juge par celui d'appel équivaut à une absence de motifs ou que le juge d'appel a l'obligation de reprendre et de développer les motifs qu'il adopte ;
Que par contre est suffisamment motivé, tout arrêt confirmatif qui adopte les motifs d'un jugement lui-même suffisamment motivé ;
Que l'adoption des motifs résulte nécessairement de la confirmation du jugement d'instance ;
Attendu que pour relaxer les prévenus, le premier juge énonce : « Attendu qu'il ne résulte pas de l'examen des pièces du dossier et des débats publics preuve de culpabilité contre les prévenus » ;
Attendu qu'en adoptant ces motifs suffisants, le juge d'appel a donné une base légale à sa décision, et n'a nullement violé le texte visé au moyen ;
D'où il suit que le moyen n'est pas fondé ;
Et attendu par ailleurs que l'arrêt est régulier ;
PAR CES MOTIFS
REJETTE le pourvoi ;
CONDAMNE le demandeur aux dépens ;
ORDONNE qu'à la diligence de Monsieur le Procureur Général près la Cour suprême, le présent arrêt sera imprimé et transmis pour être transcrit sur les registres du Greffe de la Cour d'Appel de Yaoundé et que mention en sera faite en marge ou à la suite de la décision attaquée.",ARRET_N_04_P_DU_29_OCTOBRE_1998,0,arret,"{'Court': 'COUR SUPRÊME DU CAMEROUN', 'Chamber': 'Chambre Pénale', 'Section': '', 'Case': '', 'Appeal': '', 'Claimant': 'NTANG BONAVENTURE', 'Against': 'C/', 'Defendant': 'MINISTÈRE PUBLIC, NKONO SANAMA ET AUTRES', 'Judgment': 'ARRET N°04/P DU 29 OCTOBRE 1998'}"
