URL,text,page_title,page_label,category,metadata
https://www.juriafrica.com/lex/arret-167-p-23-juillet-1998-9127.htm,"ARRET N°167/P DU 23 JUILLET 1998

LA COUR,
Vu le mémoire ampliatif déposé le 1er août 1988 par Maître Claude Mbome, Avocat à Douala ;
Sur le moyen unique de cassation pris de la violation de la loi, violation de l'article 48 de la loi n°58/203 du 26 décembre 1958 portant adaptation et simplification de la procédure pénale, modifiée par la loi n°77/04 du 13 juillet 1977, ensemble violation et fausse application de l'article 48 du décret n°47/2300 du 27 novembre 1947 ;
«En ce que pour déclarer irrecevables les appels interjetés conjointement par le prévenu Bengono et le civilement responsable l'arrêt attaqué énonce ce qui suit :
«Considérant que ces appels relevés le 16 janvier 1985 par le prévenu et le civilement responsable contre le jugement n°766/cor rendu le 10 novembre 1984, soit 46 jours après son prononcé alors qu'aux termes de l'article 48 du décret n°47/2300 du 27 novembre 1947 pour ce faire, outre les délais de distance, les délais sont de 10 jours à compter du prononcé jugement ; qu'il y a lieu de déclarer l'appel non valable ;
«Alors qu'aux termes de l'article 48 (loi n°77/04 du 13 juillet 1977 visée au moyen, il est précisé ce qui suit : «Outre les délais de distance en ce qui concerne les parties intéressées, l'appel est formé dans les 10 jours du prononcé du jugement et s'il est par défaut ou réputé contradictoire, dix jours après la signification qui en a été faite à personne ou à domicile ;
«Toutefois si le jugement est réputé contradictoire, l'article 187 paragraphe 3 du code d'instruction criminelle est applicable...» ;
«Or il ressort tant du dispositif du jugement n°766/cor appelé que de l'exploit de signification en date du 17 janvier 1985 qu'il s'agit d'un jugement ayant donné itératif défaut au prévenu qui n'avait pas comparu et ne s'était pas fait représenter non plus ;
«Un jugement rendu par itératif défaut a les mêmes qualifications qu'un jugement réputé contradictoire dont les délais d'appel ne courent qu'à compter de sa signification et non du jour de son prononcé ;
«La Cour avait d'autant plus la même conviction qu'elle avait elle-même exigé que signification de ce jugement fût faite tant au prévenu défaillant qu'aux autres parties civiles défaillantes devant le tribunal et ce, dans le but de faire courir les délais d'appel ;
«La computation des délais à partir de la signification du jugement déféré et non à compter du prononcé de ce jugement comme l'a, à tort déclaré l'arrêt, laisse apparaître que l'appel fait par le prévenu Bengono n'est pas tardif ;
«En le déclarant tardif comme il l'a fait, l'arrêt attaqué a violé les dispositions de l'article 48 de la loi n°77/04 du 13 juillet 1977 et faussement appliqué l'article 48 du décret n°47/2300 du 27 novembre 1947 ;
Cet arrêt encourt cassation» ;
Attendu que la loi n°58-203 du 26 décembre 1958 portant adaptation et simplification de la procédure pénale a, en son article 1er, expressément, en ce qui concerne le Cameroun, abrogé entre autres, l'article 48 du décret n°47/2300 du 27 novembre 1947 ;
Attendu qu'il en résulte qu'en fondant sa décision sur le texte qui n'était plus applicable, l'arrêt attaqué manque de base légale ;
Attendu par ailleurs qu'aux termes de l'article 48 (nouveau) alinéa le' de la loi n°77/04 du 13 juillet 1977 portant modification de certaines dispositions de la loi n°58-203 du 26 décembre 1958, «Outre les délais de distance en ce qui concerne les parties intéressées, l'appel est formé dans les 10 jours du prononcé jugement et, s'il est par défaut ou réputé contradictoire, dix jours après la signification qui en a été faite à personne ou à domicile. Toutefois si le jugement est réputé contradictoire, l'article 187 paragraphe 3 du code d'instruction criminelle est applicable» ;
Attendu que le jugement entrepris a été rendu par itératif défaut contre le prévenu ;
Que pareil jugement s'assimile à un jugement réputé contradictoire ;
Attendu qu'il résulte de tout ce qui précède qu'en computant le délai d'appel de 10 jours à compter du prononcé d'un jugement qui n'a pas été contradictoirement rendu contre l'appelant, la Cour d'Appel a violé l'article 48 (nouveau) alinéa 1er de la loi n°77/04 du 13 juillet 1977 ;
D'où il suit que le moyen est fondé et que l'arrêt attaqué encourt la cassation ;
PAR CES MOTIFS
CASSE ET ANNULE l'arrêt n°86/P rendu le 20 octobre 1987 par la Cour d'Appel de Douala ;
REMET en conséquence la cause et les parties au même et semblable état où elles étaient avant ladite décision et, pour être fait droit, les renvoie devant la Cour d'Appel de Bafoussam ;
RESERVE les dépens ;
ORDONNE qu'à la diligence de Monsieur le Procureur Général près la Cour suprême, le présent arrêt sera imprimé et transmis pour être transcrit sur les registres du Greffe de la Cour d'Appel de Douala et que mention en sera faite en marge ou à la suite de la décision annulée.",ARRET_N_167_P_DU_23_JUILLET_1998,0,arret,"{'Court': 'COUR SUPRÊME DU CAMEROUN', 'Chamber': 'Chambre Pénale', 'Section': '', 'Case': '', 'Appeal': '', 'Claimant': 'BENGONO GASTON', 'Against': 'C/', 'Defendant': 'MINISTÈRE PUBLIC ET EYIDI NTONE JEANNE, SEDAOUSSOU RENÉ, EBENYE CATHERINE', 'Judgment': 'ARRET N°167/P DU 23 JUILLET 1998'}"
