URL,text,page_title,page_label,category,metadata
https://www.juriafrica.com/lex/arret-3-p-14-octobre-1999-10090.htm,"ARRET N°3/P DU 14 OCTOBRE 1999

LA COUR,
Vu le mémoire ampliatif déposé le 15 juillet 1993 par Maîtres Ngnie Kamga et Kontchou, Avocats associés à Douala ;
Sur le moyen unique de cassation pris de la violation de la loi, violation de l'article 5 de l'ordonnance n°72/4 du 26 août 1972 portant organisation judiciaire, contrariété et insuffisance de motifs ;
En ce que l'arrêt attaqué n°720/P rendu le 17 mars 1992 par la Cour d'Appel de Douala contient des contradictions entre ses motifs et son dispositif ;
Attendu que le moyen est ainsi développé :
« Qu'après avoir énoncé dans les motifs de l'arrêt ceci :
« Considérant par ailleurs que les débats ont fermement établi que Mbouopda et Moudeffo Sadrack sont complètement étrangers à cette affaire » ;
« La Cour d'Appel a fini par relaxer ces deux prévenus au bénéfice du doute ;
« Attendu que la contrariété ainsi relevée entre les motifs et le dispositif de l'arrêt attaqué équivaut à un défaut de motifs ;
« Qu'en relaxant Mbouopda et Moudeffo Sadrack au bénéfice du doute, après avoir relevé (à tort au demeurant) qu'ils étaient complètement étrangers aux faits de la cause, l'arrêt s'est contredit ;
Que par suite il encourt cassation » ;
Attendu que le dispositif de l'arrêt querellé est ainsi conçu : « En la forme,
« Reçoit l'appel interjeté par Moudeffo Sadrack, Fosso Lucas, Saga Franciska, Mbouopda et Fokoua Norbert contre le jugement n°67/cor rendu le 9 octobre 1989 par le Tribunal de Première instance de Douala ;
« Au fond,
« Infirme le jugement entrepris, statuant à nouveau,
« DECLARE Moudeffo Sadrack, Saga Franciska, Fosso Lucas, Mbouopda et Fokoua Norbert, non coupables du délit de destruction ;
« Les relaxe au bénéfice du doute ;
« Se déclare incompétent pour statuer sur l'action civile de Ngawa Pierre Lenoir ;
Met les dépens à la charge du Trésor public » ;
Attendu que l'arrêt attaqué qui a énoncé de manière absolue dans ses motifs : « Que Mbouopda et Moudeffo sont complètement étrangers à cette affaire qui ne concerne que Saga Franciska, Fosso Lucas et Fokoua Norbert, ne pouvait prononcer que la mise hors de cause de ceux-là ;
Attendu dès lors que les deux prévenus Mbouopda et Moudeffo devaient logiquement être relaxés purement et simplement ;
Mais attendu que le dispositif de l'arrêt attaqué, après avoir nommément désigné tous les prévenus, mentionne ce qui suit :
« Les relaxe au bénéfice du doute », sans exclure de ce doute les deux prévenus déclarés plus haut non concernés par la cause ;
Attendu qu'aux termes du texte visé au moyen, toute décision de justice doit être motivée en fait et en droit, à peine de nullité d'ordre public ; qu'il en résulte que la contradiction entre les motifs et le dispositif équivaut à un défaut de motifs ;
Qu'en statuant comme il l'a fait le juge d'appel a violé les dispositions du texte susvisé ;
D'où il suit que le moyen est fondé et que l'arrêt attaqué encourt la cassation ;
PAR CES MOTIFS
CASSE ET ANNULE l'arrêt n°720/P rendu le 17 mars 1992 par la Cour d'Appel de Douala ;
REMET en conséquence la cause et les parties au même et semblable état où elles étaient avant ladite décision et, pour être fait droit, les renvoie devant la Cour d'Appel de Yaoundé ;
RESERVE les dépens ;
ORDONNE qu'à la diligence de Monsieur le Procureur Général près la Cour suprême, le présent arrêt sera imprimé et transmis pour être transcrit sur les registres du Greffe de la Cour d'Appel de Douala et que mention en sera faite en marge ou à la suite de la décision annulée.",ARRET_N_3_P_DU_14_OCTOBRE_1999,0,arret,"{'Court': 'COUR SUPRÊME DU CAMEROUN', 'Chamber': 'Chambre Pénale', 'Section': '', 'Case': '', 'Appeal': '', 'Claimant': 'NGAWA PIERRE LENOIR', 'Against': 'C/', 'Defendant': 'MINISTÈRE PUBLIC, MOUDEFFO SADRACK ET AUTRES', 'Judgment': 'ARRET N°3/P DU 14 OCTOBRE 1999'}"
