URL,text,page_title,page_label,metadata
https://www.juriafrica.com/lex/arret-141-p-07-decembre-2000-10660.htm,"LA COUR,
Vu le mémoire ampliatif, déposé le 04 décembre 1992 par Maître Pondi Pondi, Avocat à Yaoundé ;
Sur le moyen unique de cassation proposé pris de la violation de la loi, violation de l'article 5 de l'ordonnance n°72/4 du 26 août 1972, violation de l'article 140 (1) du code pénal, dénaturation des documents ;
En ce que :
« L'arrêt attaqué a fait une fausse application de l'article 140 (1) du code pénal, car en date du 17 mai 1984, Maître Maben a procédé à la saisie exécution des effets de sieur Mbamba à Ndoki dans l'affaire qui l'opposait à la Cami-Toyota ;
« Attendu que la vente des objets saisis a eu lieu le 25 mai 1984 c'est-à-dire 08 jours après la saisie et conformément à la loi pour permettre aux tiers toute revendication utile ;
« Attendu que de plus, sieur Tenjei Martin Zangha avait la possibilité de saisir les tribunaux par une requête civile conformément à l'article 343 du code de procédure civile ;
« Attendu que le délit d'abus de fonction ne saurait prospérer et il y a eu dénaturation des documents soumis au juge d'appel ;
« D'où la cassation de cet arrêt s'impose » ;
Attendu que le moyen tel que développé tend en réalité à inviter la Cour suprême qui n'est pas un troisième degré de juridiction à un nouvel examen des éléments de fait et de preuves laissés à l'appréciation souveraine des juges du fond ;
Attendu au demeurant que pour statuer comme il l'a fait, l'arrêt énonce :
« Considérant que contrairement à l'opinion du premier juge, il résulte des pièces du dossier de procédure preuve contre le sus-nommé, d'avoir à Bafia, le 17 mai 1984, en tout cas dans le temps légal des poursuites, saisi et vendu aux enchères les objets réclamés par Tenjei Martin Zangha, que ces faits sont prévus et réprimés par les articles 74 et 140 (1) du code pénal dont lecture a été donnée à l'audience par Monsieur le Président ; qu'il échet en conséquence d'infirmer le jugement entrepris et retenir le prévenu dans les liens de la prévention et de déclarer Maben à Mbassa Bernard coupable d'abus de fonction » ;
Attendu qu'en statuant comme il l'a fait le juge d'appel n'a pas dénaturé les documents et a ainsi légalement justifié sa décision ;
Qu'il s'ensuit que le moyen est irrecevable ;
Attendu que l'arrêt est par ailleurs régulier ;
PAR CES MOTIFS
REJETTE le pourvoi ;
CONDAMNE le demandeur aux dépens ;
ORDONNE qu'à la diligence de Monsieur le Procureur Général près la Cour suprême, le présent arrêt sera imprimé et transmis pour être transcrit sur les registres du Greffe la Cour d'Appel de Yaoundé et que mention en sera faite en marge ou à la suite de la décision attaquée.",ARRET_N_141_P_DU_07_DECEMBRE_2000,0,"{'Court': 'COUR SUPRÊME DU CAMEROUN', 'Chamber': 'Chambre Pénale', 'Section': '', 'Case': '', 'Appeal': '', 'Claimant': 'MABEN À MBASSA BERNARD', 'Against': 'C/', 'Defendant': 'MINISTÈRE PUBLIC ET TENJEI MARTIN ZANGHA', 'Judgment': 'ARRET N°141/P DU 07 DECEMBRE 2000'}"
