URL,text,page_title,page_label,category,metadata
https://www.juriafrica.com/lex/decision-004-041-mincult-cab-14-juil-2004-16687.htm,"DECISION N° 004/041/MINCULT/CAB DU 14 JUILLET 2004 FIXANT LE MONTANT DE LA REDEVANCE DUE AU TITRE DE L'EXPLOITATION DU FOLKLORE ET DES ŒUVRES DU DOMAINE PUBLIC.

LE MINISTRE D'ETAT CHARGEDE LA CULTURE,
Vu la constitution ;
Vu la loi n°2000/11 du 19 décembre 2000 relative au droit d'auteur et aux droits voisins
Vu le décret n°2001/956/PM du 1er novembre 2001 fixant les modalités d'application de la loi n° 2000/011 du 19 décembre 2000 relative au droit d'auteur et aux droits
Vu la décision n° 004/017/MINCULT/CAB du 03 juin 2004 portant création, organisation et fonctionnement de la Commission Permanente de Médiation et de Contrôle des Organismes de Gestion Collective;
Vu la décision n° 004/018/MINCULT/CAB du 03 juin 2004 portant nomination des membres de la Commission sus visée ;
Vu le procès verbal de la réunion de concertation et de négociation du 27 juin 2004 en vue de la fixation du montant de la redevance due au titre de l'exploitation du folklore et des oeuvres du domaine public présenté par la Commission Permanente de Médiation et de Contrôle des Organismes de Gestion Collective du droit d'auteur et des droits voisins ;
Vu les nécessités de service ;
DECIDE:
Art. 1er —  Le montant de la redevance due au titre de l'exploitation du folklore et des oeuvres du domaine public est fixé à un pour cent (1%) des droits perçus au titre du droit d'auteur et des droits voisins, à l'exception des rémunérations pour copie privée des oeuvres imprimées, des vidéogrammes et des phonogrammes.
Art. 2 —  La somme perçue est versée dans un compte de soutien à la politique culturelle.
Art. 4 —  La présente décision qui prend effet à compta de sa signature sera enregistrée, puis insérée au journal officiel en français et en anglais.",DECISION_N_004_041_MINCULT_CAB_DU_14_JUILLET_2004_FIXANT_LE_MONTANT_DE_LA_REDEVANCE_DUE_AU_TITRE_DE_L_EXPLOITATION_DU_FOLKLORE_ET_DES_ŒUVRES_DU_DOMAINE_PUBLIC,0,loi,
