URL,text,page_title,page_label,metadata
https://www.juriafrica.com/lex/loi-85-020-11-decembre-1985-17300.htm,"L'Assemblée Nationale a délibéré et adopté,
le Président de la République promulgue la
loi dont la teneur suit :
Art. 1er —  En application des dispositions de la loi n° 84/03 du 4 juillet 1984 portant Code des Investissements, le Gouvernement de la République du Cameroun est autorisé à conclure une Convention d'Etablissement avec l'Hôtel ARCADE-WUALA représenté par la Société SOFIGEHO B.P. 5375 DOUALA.
Art. 2 —  La présente loi sera enregistrée puis publiée au Journal Officiel en français et en anglais. /-",LOI_N_85_020_DU_11_DECEMBRE_1985_AUTORISANT_LE_GOUVERNEMENT_DE_LA_REPUBLIQUE_DU_CAMEROUN_A_CONCLURE_UNE_CONVENTION_D_ETABLISSEMENT_AVEC_L_HOTEL_ARCADE_DE_DOUALA_REPRESENTE_PAR_LA_SOCIETE_SOFIGEHO,0,
