URL,text,page_title,page_label,metadata
https://www.juriafrica.com/lex/loi-74-9-16-juillet-1974-17152.htm,"L'ASSEMBLEE NATIONALE a délibéré et adopté :
LE PRESIDENT DE LA REPUBLIQUE promulgue la loi dont la teneur suit :
Art. 1er —  1) Il est institué une Médaille d'Honneur du Travail destinée à récompenser l'ancienneté et la qualité des services rendus chez un même employeur par tout travailleur salarié ou assimilé, tirant de cette activité l'essentiel de ses ressources, conformément aux dispositions du Code du Travail.
2) Toutefois, l'ancienneté et la qualité des services rendus chez trois employeurs au plus peut également être prise en considé-ration pour l'attribution de la Médaille d'Honneur du Travail.
Art. 2 —  La Médaille d'Honneur du Travail comprend trois grades :
La Médaille d'Argent qui est accordée après 10 ans de service ;
La Médaille de Vermeil qui est accordée après 15 ans de service ;
La Médaille d'Or qui est accordée après 25 ans de service.
Art. 3 —  1) Une majoration d'un quart est appliquée au temps de services salariés effectifs assurés dans des professions particu-lièrement insalubres pour le calcul de l'ancienneté fixée à l'arti-cle 2 de la présente loi. La liste de ces emplois et professions sera établie par arrêté du Ministre de l'Emploi et de la Prévoyance Sociale.
2) La Médaille d'Honneur du Travail peut être décernée à tout travailleur atteint, du fait de son travail, d'une incapacité professionnelle permanente égale à 66 %.
Lorsque le taux de l'incapacité est inférieur à 66 % mais supérieur à 50 %, la durée des services exigée est réduite de moitié. Cette réduction ne peut se cumuler avec celle prévue au premier alinéa du présent article.
Cette Médaille d'Honneur du Travail est celle du grade auquel pouvait prétendre le travailleur dans des conditions normales au cas où il n'aurait pas été atteint d'une incapacité professionnelle permanente.
Art. 4 —  La Médaille d'Honneur du Travail peut également être décernée à titre posthume, à condition que la demande ait été for-mulée dans les deux ans suivant la date du décès.
1) aux travailleurs qui, au moment de leur décès, comptaient le nombre d'années requises en application des articles précédents ;
2) sans condition de durée de service aux travailleurs victimes d'un accident mortel dans l'exercice de leur profession.
Art. 5 —  Les insignes' de la Médaille d'Honneur du Travail sont du module 27 mm portant :
1°/- d'un côté (face A) tout autour du cadran, l'inscription ""République Unie du Cameroun"" en français et en anglais ;
Au centre, un travailleur légèrement habillé, portant une cognée et en position d'activité.
2°/- de l'autre côté (face B) sur le premier hémisphère, le Mont Cameroun dont le sommet pose entre deux étoiles.
Sur le second hémisphère, l'inscription ""Médaille, d'Honneur du Travail"" en français et en anglais.
Art. 6 —  1°) La Médaille d'Argent est suspendue à un ruban bico-lore, en satin (rouge à gauche et vert à droite), le tout disposé dans le sens vertical.
2°) La Médaille en Vermeil ne diffère de celle en Argent que par la rosette également bicolore et le métal lui-même.
3°) La Médaille en Or est suspendue par une bélière de 10 mm également en or, portant un ruban dont les couleurs (rouge - et vert) sont disposées dans le sens diagonal.
Art. 7 —  Les titulaires de la Médaille d'Honneur du Travail sont autorisés à porter à la boutonnière et sans l'insigne :
- un ruban bicolore pour la Médaille en Argent ;
- une rosette bicolore pour la Médaille en Vermeil ;
- une rosette bicolore posée sur un galon doré pour la Médaille en Or.
Art. 8 —  1°) Les titulaires de la Médaille d'Honneur du Travail reçoivent pour chaque grade un diplôme qui rappelle les services pour lesquels ils ont été récompensés.
2°) Un arrêté du Ministre de l'Emploi et de la Prévoyance Sociale déterminera les formes et les caractéristiques du diplôme de la Médaille d'Honneur du Travail, ainsi que celles dans lesquelles devra être sollicitée la Médaille elle-même conformément aux dispositions de la présente loi.
Art. 9 —  A l'occasion de la Fête Nationale du 20 Mai de chaque année, un arrêté du Ministre de l'Emploi et de la Prévoyance Sociale, qui est publié au Journal Officiel de la République Unie du Cameroun, décerne la Médaille d'Honneur du _Travail.
1°/- Les insignes peuvent être remis à l'occasion des cérémonie officielles, soit au sein de l'entreprise, soit dans un lieu public, par le Ministre de l'Emploi et de la Prévoyance Sociale ou son représentant ;
2°/- En cas d'empêchement-ou autre, ils peuvent être remis aux récipiendaires par les Chefs d'Unités Administratives terri-torialement compétentes.
Art. 10 —  Des arrêtés préciseront en tant que de besoin, les modalités d'application de la présente loi.
Art. 11 —  Est abrogée la loi n° 59/26 du 11 avril 1959 portant Institution de la Médaille d'Honneur du Travail au Cameroun ainsi que tous les textes pris pour son application.
Art. 12 —  La présente loi sera enregistrée, publiée selon la procédure d'urgence ainsi qu'au Journal Officiel de la République Unie du Cameroun en français et en anglais, et exécutée comme loi de l'Etat./-",LOI_N_74_9_DU_16_JUILLET_1974_PORTANT_INSTITUTION_DE_LA_MEDAILLE_D_HONNEUR_DU_TRAVAIL,0,
