URL,text,page_title,page_label,metadata
https://www.juriafrica.com/lex/loi-89-028-29-dec-1989-17438.htm,"L'Assemblée Nationale a délibéré et adopté.
Le Président de la République promulgue la loi dont la teneur suit :
Art. 1er —  Le Président Ce la République est autorisé à réviser par ordonnance, dans les douze (12) mois suivant la promulgation de la présente loi, la loi n° 84/03 du 04 Juillet portant Code des Investissements.
Art. 2 —  L'ordonnance ainsi prise sera déposée sur le Bureau de l'Assemblée Nationale aux fins de ratification à la plus prochaine session parlementaire suivant sa signature.
Art. 3 —  La présente loi sera enregistrée, publiée selon la procédure d'urgence, puis insérée au Journal Officiel en français et en anglais. /-",LOI_N_89_028_DU_29_DECEMBRE_1989_AUTORISANT_LE_PRESIDENT_DE_LA_REPUBLIQUE_A_REVISER_PAR_ORDONNANCE_LA_LOI_N_84_03_DU_04_JUILLET_1984_PORTANT_CODE_DES_INVESTISSEMENTS,0,
