URL,text,page_title,page_label,category,metadata
https://www.juriafrica.com/lex/loi-2004-023-24-decembre-2004-17722.htm,"LOI N°2004/023 24 DÉCEMBRE 2004 AUTORISANT LE PRÉSIDENT DE LA RÉPUBLIQUE À RATIFIER L'AVENANT N°2 À LA CONVENTION RELATIVE À LA CRÉATION D'UNE AGENCE CHARGÉE DE GÉRER LES INSTALLATIONS ET SERVICES DESTINÉS À ASSURER LA SÉCURITÉ DE LA NAVIGATION AÉRIENNE EN AFRIQUE ET À MADAGASCAR (ASECNA), AUX STATUTS ET AU CAHIER DES CHARGÉS SIGNÉS À DAKAR LE 25 OCTOBRE 1974

L'Assemblée nationale a délibéré et adopté,
Le Président de la République promulgue la loi dont la teneur suit :
Art. 1 —  Le président de la République est autorisé à ratifier l'avenant N° 2 à la convention relative à la création d'une agence chargée de gérer les installations et services destinés à assurer la sécurité de la navigation aérienne en Afrique et à Madagascar (ASECNA), aux statuts et au cahier des charges signés à Dakar le 25 octobre 1974.
Art. 2 —  La présente loi sera enregistrée et publiée suivant la procédure d'urgence, puis insérée au Journal Officiel en français et en anglais.",LOI_N_2004_023_24_DECEMBRE_2004_AUTORISANT_LE_PRESIDENT_DE_LA_REPUBLIQUE_A_RATIFIER_L_AVENANT_N_2_A_LA_CONVENTION_RELATIVE_A_LA_CREATION_D_UNE_AGENCE_CHARGEE_DE_GERER_LES_INSTALLATIONS_ET_SERVICES_DESTINES_A_ASSURER_LA_SECURITE_DE_LA_NAVIGATION_AERIENNE_EN_AFRIQUE_ET_A_MADAGASCAR_ASECNA_AUX_STATUTS_ET_AU_CAHIER_DES_CHARGES_SIGNES_A_DAKAR_LE_25_OCTOBRE_1974,0,loi,
