URL,text,page_title,page_label,metadata
https://www.juriafrica.com/lex/loi-95-017-08-aout-1995-17595.htm,"L'Assemblée Nationale a délibéré et adopté,
Le Président de la République promulgue la loi dont la teneur suit :
Art. 1er —  - (1) Est ratifiée l'Ordonnance n° 95/01 du 05 janvier 1995 modifiant certaines dispositions des législations fiscale et douanière.
(2) Toutefois, les taux du prélèvement institués par l'article 7 de la loi n° 94/002 du 1er juillet 1994 portant loi de finances de la République du Cameroun pour l'exercice 1994/1995, modifiée par l'Ordonnance susvisée sont modifiés pour certains produits ainsi qu'il suit :
15 % de la valeur FOB pour l'huile de palme;
15 % de la valeur FOB pour le café, pour compter de la campagne caféière 1995/1996;
3,5 % de la valeur FOB pour la banane, avec un minimum de perception de 6.500 F CFA la tonne.
(3) Les taux de prélèvement demeurent fixés à 15 % de la valeur FOB pour le cacao, le coton, le sucre, le caoutchouc et les plantes médicinales.
Art. 2 —  - La présente loi sera enregistrée, publiée selon la procédure d'urgence, puis insérée au Journal Officiel en anglais et en français./-",LOI_N_95_017_DU_08_AOUT_1995_PORTANT_RATIFICATION_DE_L_ORDONNANCE_N_95_01_DU_05_JANVIER_1995_MODIFIANT_CERTAINES_DISPOSITIONS_DES_LEGISLATIONS_FISCALE_ET_DOUANIERE,0,
