URL,text,page_title,page_label,category,metadata
https://www.juriafrica.com/lex/loi-79-08-30-juin-1979-17218.htm,"LOI N° 79/08 DU 30 JUIN 1979 PORTANT ORGANISATION DE L'EXERCICE DE LA MÉDECINE VÉTÉRINAIRE.

L'ASSEMBLEE NATIONALE A DELIBERE ET ADOPTE ;
LE PRESIDENT DE LA REPUBLIQUE PROMULGUE LA LOI DONT LA TENEUR SUIT':
CHAPITRE PREMIER
DE LA PRATIQUE DE LA MEDECINE VETERINAIRE
Art. 1er —  Nul ne peut exercer la profession de Médécin vétérinaire s'il ne remplit les conditions suivantes :
être citoyen camerounais ;
être titulaire d'un diplôme d'Etat ou d'Université de Docteur vétérinaire, reconnu parles textes en vigueur ;
être inscrit au Tableau de l'Ordre National ciels Médecins vétérinaires,
L'exercice de la chirurgie et de la pharmacie vétérinaires est réservé au Médecin vétérinaire.
Art. 2 —  Par dérogation aux dispositions de l'article 1er ci-dessus, peuvent exercer la profession à l'intérieur du territoire national :
les Médecins vétérinaires étrangers recrutés sur contrat ou en vertu d'accords de coopération pour le compte exclusif de l'Administration ;
les Médecins vétérinaires étrangers désireux de servir pour le compte d'entreprises privées et titulaires des diplômes visés à l'article 1er ci-dessus,
Art. 3 —  Les autorisations d'exercer sont accordées dans les conditions fixées par décret.
Art. 4 —  Les vétérinaires ayant bénéficié pour leur formation professionnelle d'une bourse d'études ou d'une aide financière de l'Etat ou d'organismes étrangers par l'intermédiaire de l'Etat, ne peuvent exercer à titre privé qu'au terme de l'engagement souscrit avec l'Administration ou, s'ils n'ont pas souscrit un engagement écrit, qu'après dix ans d'activité effective dans l'Administration. Toutefois, en cas de nécessité canent constatée, des dérogations peuvent être accordées par décret du Président de la République.
Art. 5 —  L'accomplissement d'actes professionnels à caractère administratif et judiciaire, la rédaction et la délivrance des documents y afférents sont assures par les vétérinaires soit dans l'exercice normal de leurs fonctions, soit en exécution d'une mission spéciale dont ils sont chargés. Ils sont tenus à cet égard de déférer à toutes réquisitions qui peuvent leur être décernées.
Art. 6 —  Les cadres auxiliaires, techniciens supérieurs de l'Elevage, infirmiers vétérinaires et infirmiers vétérinaires adjoints qui ne sont plus en activité au sein de l'Administration peuvent pratiquer la médecine vétérinaire s'ils sont seuls dans une région non pourvue d'infrastructure vétérinaire appropriée, dans les conditions fixées par décret.
Art. 7 —  Les vétérinaires en service dans l'Administration ou dans le secteur privé sont soumis :
au régime du secret professionnel ;
aux règles du Code de Déontologie de leur profession qui fera l'objet d'un texte particulier ;
aux dispositions statutaires de l'Ordre National des médecins vétérinaires,
CHAPITRE II
REGLES D'EXERCICE DE LA PROFESSION.
Art. 8 —  L'établissement des vétérinaires pour l'exercice de la médecine vétérinaire en clientèle privée, le changement de résidence professionnelle ou d'aire géographique d'activité, ainsi que la reprise d'activité après interruption à la suite d'une sanction disciplinaire sont soumis à une autorisation délivrée dans les conditions fixées par décret.
Art. 9 —  L'établissement ou l'exercice de la profession en clientèle privée consiste, pour les vétérinaires, à équiper et à utiliser pour leur compte personnel un cabinet de travail où ils procèdent à l'accueil des sujets malades aux fins d'accomplissement des prestations médicales.
Toutefois, l'ouverture des .cabinets secondaires peut être autorisée dans les conditions fixées par décret.
Art. 10 —  En cas de décès d'un praticien privé, l'autorité de tutelle désigne, sur avis du Conseil National de L'ordre, et après accord des répondants légaux du défunt, un praticien chargé de maintenir la clientèle, dans un délai d'un mois.
Art. 11 —  L'exercice de la médecine vétérinaire sous un pseudonyme est interdit.
Art. 12 —  Conformément aux dispositions de l'article 1er ci-dessus et en cas de détention de stock de produits pharmaceutiques ou de médicaments nécessaires à l'exercice ne leur profession, les praticiens sont tenus de se soumettre à la réglementation en vigueur en matière de détention de médicaments, spécialités et produits pharmaceutiques,
Art. 13 —  Les praticiens fonctionnaires, contractuels de l'Administration ou servant au titre de l'assistance technique ne peuvent exercer à titre privé, ni recevoir de clientèle privée à domicile ou dans les établissements techniques de service. De même, il leur est interdit d'exercer pour le compte ou par l'entremise d'établissements privés.
CHAPITRE III
DISPOSITIONS PENALES
Art. 14 —  Est passible des peines prévues à l'article 21 de la loi n° 67/LF/7 du 10 juin 1966, celui qui :
- sans remplir les conditions édictées aux articles 1, 3, 4 et 6 de la présente loi, par actes personnels, notamment consultations, prescriptions verbales ou écrites, ou par tous autres procédés, directement ou indirectement, même en présence d'un Docteur vétérinaire, procède :
à l'établissement d'un diagnostic, d'un traitement de maladies ou d'affections réelles ou supposées
à la pratique d'opérations, médicales, chirurgicales, esthétiques ou obstétricales, ou à toutes autres opérations rentrant dans le cadre des dispositions de la présente loi.
- se livre aux activités définies au paragraphe précédent sans en avoir obtenu préalablement l'autorisation requise.
Art. 15 —  1) Les peines prévues au présent chapitre ne sont pas exclusives des sanctions administratives ou disciplinaires auxquelles s'exposent les contrevenants.
2) Toute infraction prévue à l'article 14 ci-dessus entraîne, pour son auteur, la cessation immédiate de toute activité et la fermeture de son établissement.
Art. 16 —  Toutes les dispositions antérieures à la présente loi sont abrogées, notamment la loi n° 68/4/COR du 11.7.68. le chapitre 210, volume 6, de l'ordonnance des médecins vétérinaires de l'édition de 1958 des lois de la Fédération de Nigéria et Lagos, et l'article 3 de la loi n° 68/LF/8 du 11.6.68",LOI_N_79_08_DU_30_JUIN_1979_PORTANT_ORGANISATION_DE_L_EXERCICE_DE_LA_MEDECINE_VETERINAIRE,0,loi,
