URL,text,page_title,page_label,metadata
https://www.juriafrica.com/lex/loi-90-021-10-aout-1990-17467.htm,"L'Assemblée Nationale a délibéré et adopté,
Le Président de la République promulgue la loi dont la teneur suit :
Art. 1er —  Les dispositions de l'article 6 de la loi n° 76/14 du 8 Juillet 1976 fixant les taux et le mode de recouvrement des droits fixes d'exploitation des carrières sont modifiées et complétées ainsi qu'il suit :
Art. 6 (nouveau) —  Les droits fixes d'exploitation des carrières sont recouvrés par le régisseur des recettes territorialement compétent du Ministère chargé des Mines, qui délivre un reçu à la partie versante"".
Art. 2 —  La présente loi sera enregistrée, publiée suivant la procédure d'urgence, puis insérée au Journal Officiel en français et en anglais. /-",LOI_N_90_021_DU_10_AOUT_1990_MODIFIANT_ET_COMPLETANT_CERTAINES_DISPOSITIONS_DE_LA_LOI_N_76_14_DU_08_JUILLET_1976_FIXANT_LES_TAUX_ET_LE_MODE_DE_RECOUVREMENT_DES_DROITS_FIXES_D_EXPLOITATION_DES_CARRIERES,0,
