URL,text,page_title,page_label,category,metadata
https://www.juriafrica.com/lex/loi-79-13-30-juin-1979-17221.htm,"LOI N° 79/13 DU 30 JUIN 1979 ACCORDANT À LA SOCIÉTÉ NATIONALE DES EAUX DU CAMEROUN UN RÉGIME FISCAL PRIVILÉGIÉ

L'ASSEMBLÉE NATIONALE A DELIBERE ET ADOPTE ;
LE PRESIDENT DE LA REPUBLIQUE PROMULGUE LA LUI DONT LA TENEUR SUIT :
Art. 1 —  (1) il est accordé à la Société Nationale des Eaux du Cameroun, un régime fiscal privilégié défini par la présente loi.
(2) Ce régime comporte des exonérations sur :
l'impôt sue 1e chiffre d'affaires intérieur relatif, d'une part, à. ses activités de vente d'eau, ainsi que la location des appareils de comptage et aux travaux de raccordement des abonnés au réseau et, d'autre part, aux travaux
d'investissements portant sur les aménagements et l'amélioration des moyens de
production de stockage et de distribution d'eau exécutés par elle-même et/ou pour son compte par des tiers
les droits d'enregistrement des conventions de financement et d'aval d'emprunts pour la réalisation des installations de production, de transport, de stockage, et de distribution d'eau ;
les droits d'enregistrement des marchés passés par la Société
les droits et taxes perçus à l'importation sur les matériels, matériaux, machines, outillages et matières premières nécessaires à la réalisation de sa mission et dont la liste sera fixée par des textes particuliers.
Art. 2 —  La Société Nationale des Eaux du Cameroun bénéficie également de la stabilisation dans leurs taux et assiettes des impôts, droits et taxes auxquels elle est soumise à la date d'entrée en vigueur de la présente loi ; à cet effet, elle est exonérée de tout impôt nouveau.
Art. 3 —  Lés avantages fiscaux prévus aux articles 1 et 2 ci-dessus sont valables pour une durée de 25 ans,
Art. 4 —  La présente loi qui abroge toutes dispositions antérieures contraires sera enregistrée et publiée en français et en anglais.",LOI_N_79_13_DU_30_JUIN_1979_ACCORDANT_A_LA_SOCIETE_NATIONALE_DES_EAUX_DU_CAMEROUN_UN_REGIME_FISCAL_PRIVILEGIE,0,loi,
