URL,text,page_title,page_label,category,metadata
https://www.juriafrica.com/lex/loi-65-lf-12-22-mai-1965-17067.htm,"LOI N° 65-LF-12 DU 22 MAI 1965 - AUTORISANT LA CREATION AU CAMEROUN OCCIDENTAL D'UN GAGE SUR LES VEHICULES AUTOMOBILES

L'Assemblée Nationale fédérale a délibéré et adopté ;
Le Président de la République fédérale promulgue la loi dont la teneur suit :
Art. premier —  Un gage peut être créé sur tout véhicule automobile ou remorque sujet à immatriculation pour garantir le paiement total ou partiel du prix d'achat ou le remboursement d'un emprunt contracté pour son acquisition, même si ledit véhicule ou remorque n'est plus en la possession du vendeur ou du prêteur selon le cas.
Art. 2 —  Le gage prévu à l'article premier est inopposable aux tiers, sauf enregistrement dans les formes fixées par décret qui détermine également les preuves à fournir à l'autorité chargée de l'enregistrement tant lors dudit enregistrement qu'à l'occasion du transfert ou de l'extinction du gage, ainsi que les formes de renouvellement du gage et des extraits et certificats que doit délivrer l'autorité chargée de l'enregistrement.
Le registre tenu par l'autorité chargée de l'enregistrement du gage fait foi de ses mentions jusqu'à preuve contraire.
Art. 3 —  Sur requête du créancier accompagnée d'un extrait de l'enregistrement, toujours valable, du gage dont il dispose, la juridiction compétente pour ordonner le paiement de la dette ordonne la saisie du véhicule ou de la remorque gagés quelle que soit la personne en possession de laquelle ils se trouvent, et la vente sauf consignation de la dette auprès de ladite juridiction dans le délai d'un mois suivant la saisie.
Art. 4 —  La somme consignée auprès de la juridiction ou le produit de la vente sont distribués après vérification des droits des parties comme si le créancier avait conservé la possession du véhicule ou de la remorque.
Art. 5 —  Sous réserve des dispositions du présent article, la présente loi s'applique exclusivement au Cameroun occidental.
Les requêtes en application de l'article 3 ci-dessus peuvent être fondées soit sur un enregistrement du gage prévu par la présente loi, soit sur un enregistrement équivalent effectué au Cameroun oriental ou dans tout autre pays ayant une législation ou réglementation similaire.
Toute saisie ordonnée en application de l'article 3 ci-dessus ou des textes en vigueur au Cameroun oriental peut être mise en exécution sur l'ensemble du territoire fédéral.
Art. 6 —  La présente loi, qui sera publiée en français et en anglais au Journal officiel, sera exécutée comme loi de la République fédérale du Cameroun.
Yaoundé, le 22 mai 1965.
Ahmadou AHIDJO",LOI_N_65_LF_12_DU_22_MAI_1965_AUTORISANT_LA_CREATION_AU_CAMEROUN_OCCIDENTAL_D_UN_GAGE_SUR_LES_VEHICULES_AUTOMOBILES,0,loi,
