URL,text,page_title,page_label,metadata
https://www.juriafrica.com/lex/loi-2010-004-13-avril-2010-18203.htm,"L'Assemblée Nationale a délibéré et adopté,
Le président de la république promulgue la loi dont la teneur suit :
Art. 1er  —  Les dispositions des articles 9 et 15 de la loi n°2004/016 du 22 Juillet 2004 portant création, organisation et fonctionnement de la Commission nationale des Droits de l'Homme et des Libertés sont modifiées et complétées ainsi qu'il suit :
Article 9 (nouveau)Avant leur entrée en fonction, les membres de la Commission prêtent serment devant la Cour Suprême siégeant en Chambre Réunies.
Art. 15 —  (nouveau) : (1) La Commission ne peut valablement délibérer que si les 2/3 au moins de ses membres sont présents.
Lorsque le quorum n'est pas atteint après la première convocation, celui-ci est ramené à la moitié des membres de la Commission lors des convocations suivantes ayant le même objet.
(2) Les membres de la Commission participent aux votes avec voix délibérative.
Toutefois, les membres représentant les administrations publiques chargées respectivement des affaires sociales, de la justice, des affaires pénitentiaires, de la promotion et de la protection des droits de la femme ont voix consultative.
(3) Les décisions sont prises à la majorité simple des membres présents ayant voix délibérative. En cas de partage des voix, celle du président est prépondérante ».
Art. 2 —  La présente loi sera enregistrée, publiée suivant la procédure d'urgence, puis insérée au journal officiel en français et en anglais.",LOI_N_2010_004_DU_13_AVRIL_2010_MODIFIANT_ET_COMPLETANT_CERTAINES_DISPOSITIONS_DE_LA_LOI_2004_016_DU_22_JUILLET_2004_PORTANT_CREATION_ORGANISATION_ET_FONCTIONNEMENT_DE_LA_COMMISSION_NATIONALE_DES_DROITS_DE_L_HOMME_ET_DES_LIBERTES,0,
