URL,text,page_title,page_label,category,metadata
https://www.juriafrica.com/lex/loi-87-010-15-juil-1987-17372.htm,"LOI N° 87/010 DU 15 JUILLET 1987 AUTORISANT LE PRÉSIDENT DE LA RÉPUBLIQUE À RATIFIER L'ACCORD COMMERCIAL SIGNÉ LE 15 AVRIL 1987 À MARRAKECH ENTRE LE GOUVERNEMENT DU ROYAUME DU MAROC ET LE GOUVERNEMENT DE LA RÉPUBLIQUE DU CAMEROUN.

L'Assemblée Nationale a délibéré et adopté,
Le Président de la République promulgue la loi dont la teneur suit :
Art. 1er —  Le Président de la République est autorisé à ratifier l'Accord Commercial signé le 15 avril 1987 à MARRAKECH entre le Gouvernement du Royaume du Maroc et le Gouvernement de la République du Cameroun.
Art. 2 —  La présente loi sera enregistrée, promulguée puis publiée au Journal Officiel en français et en anglais. /-",LOI_N_87_010_DU_15_JUILLET_1987_AUTORISANT_LE_PRESIDENT_DE_LA_REPUBLIQUE_A_RATIFIER_L_ACCORD_COMMERCIAL_SIGNE_LE_15_AVRIL_1987_A_MARRAKECH_ENTRE_LE_GOUVERNEMENT_DU_ROYAUME_DU_MAROC_ET_LE_GOUVERNEMENT_DE_LA_REPUBLIQUE_DU_CAMEROUN,0,loi,
