URL,text,page_title,page_label,category,metadata
https://www.juriafrica.com/lex/loi-73-12-7-dec-1973-17140.htm,"LOI N°73/12 DU 07 DÉCEMBRE 1973 PORTANT ORGANISATION GÉNÉRALE DE LA PROTECTION CIVILE.

L'Assemblée Nationale a délibéré et adopté ;
Le Président de la République promulgue la loi dont la teneur suit :
TITRE PREMIER
DE L'OBJET DE LA PROTECTION CIVILE
Art. 1er —  La protection civile a pour objet d'assurer en permanence la protection des personnes et des biens.
Elle comporte :
des mesures de prévention,
des mesures de protection et de sécurité locale,
l'organisation des secours.
TITRE II
DE LA DIRECTION ET DE L'ORGANISATION TERRITORIALE LA PROTECTION CIVILE
Art. 2 —  Le Chef de l'Etat définit la politique générale en matière de protection civile.
Art. 3 —  Dans l'exercice de ses prérogatives, il est assis-té d'un Comité National de la Protection Civile dont les attributions sont fixées par décret.
Art. 4 —  Sont membres du Comité National de la Protection civile :
le ministre de l'Administration territoriale, - le ministre des Forces Armées
le ministre du Plan et de l'Aménagement du territoire,
le ministre des Finances,
le ministre du Développement industriel et commercial,
le ministre de la Santé et de l'Assistance publiques,
le ministre des Transports,
le ministre des Postes et Télécommunications,
le ministre de l'Equipement, de l'Habitat et des Do-maines,
le Secrétaire Permanent à la Défense Nationale,
le Délégué Général à la Sûreté: Nationale.
Art. 5 —  Il est institué dans chaque unité administrative ainsi que dans les agglomérations de plus de 5.000 habitants, un organisme de coordination dénommé suivant le cas :
Etat-Major Provincial de la Protection Civile, pour la Province,
Etat-Major Départemental de la Protection Civile, pour le Département,
Etat-Major d'Arrondissement de la Protection Civile,
Comité local de la Protection Civile,
TITRE III
DES RESPONSABILITES EN MATIERE DE PROTECTION CIVILE
Art. 6 —  Le Ministre de l'Administration territoriale est chargé de la préparation, de la mise en oeuvre et de la coor-dination des mesures de protection civile.
Les ministres et les responsables des administrations autonomes définissent, sur le plan technique, les modalités d'application desdites mesures.
Art. 7 —  Sous l'autorité du ministre de l'Administration territoriale,les chefs de circonscriptions administratives sont responsables de la protection civile.
TITRE IV
DES MOYENS DE LA PROTECTION CIVILE ET DE LEUR EMPLOI
Art. 8 —  Les moyens de la Protection Civile comprennent :
les moyens en personnels,
les moyens en matériels,
les constructions et installations diverses réser-vées aux organismes de protection civile.
Art. 9 —  Le ministre de l'Administration territoriale dis-pose d'un corps national permanent de la protection civile organisé en unités mobiles et territoriales dans les conditions fixées pie décret.
Art. 10 —  Les populations peuvent être astreintes par ré-quisition à des travaux de protection civile.
Art. 11 —  Les moyens matériels de la Protection Civile com-prennent tous les biens, équipement et ressources nécessaires à l'action des organismes de protection civile.
Art. 12 —  Toute mobilisation générale vaut ordre de mobilisation des organismes de protection civile.
La mobilisation des organismes de protection civile peut encore être décrétée en cas de mise en garde, de mo-bilisation partielle, d'état d'urgence ou d'exception.
Art. 13 —  L'emploi des moyens de la Protection Civile est laissé à l'appréciation des autorités administratives.
En cas de besoin, les organismes de protection civile sont soutenus par l'Armée, la Gendarmerie ou la Police, sur réquisition de l'autorité administrative compétente.
Art. 14 —  Dans les zones de commandement opérationnel, la protection civile peut être assurée par l'autorité mili-taire sur sa demande.
TITRE V
DISPOSITIONS PENALES
Art. 15 —  Les fautes et infractions commises par les personnels du Corps National Permanent de la Protection Civile dans l'exécution des tâches de protection civile relèvent en temps normal des organes disciplinaires des corps d'ori-gine de ces personnels et des juridictions de droit commun. En temps de mise en garde, d'état d'urgence ou d'exception, de mobilisation, les mêmes fautes et infractions ressortissent aux organismes disciplinaires et juridictions militaires.
Art. 16 —  1) Est puni d'un emprisonnement de 1 mois à 2 ans et d'une amende de 25.000 à 500.000 francs ou de l'une de ces-deux peines seulement, quiconque faisant l'ob-jet d'une réquisition régulière, refuse ou s'abstient, sans raison de santé, de remplir les tâches qui lui incombent en matière de protection civile.
2) Les peines sont doublées s'il s'agit d'un acte relevant normalement des fonctions de la personne requise ou si cette infraction a été commise en temps de guer-re.
3) Est punie également des peines prévues à l'alinéa 1 du présent article, toute personne qui, s'étant engagée volontairement à servir dans la Protection Civile, refuse de se soumettre aux obligations découlant de son engagement. Il en sera de même pour tout individu portant entrave à l'exécution des tâches de protection civile.
Art. 17 —  La loi n°68/LF/1 du 11 juin 1968 portant organisation de la Défense Passive est abrogée.
Art. 18 —  Des décrets détermineront, en tant que de besoin les modalités d'application de la présente loi.
Art. 19 —  La présente loi sera enregistrée, publiée au Journal Officiel de la République Unie du Cameroun en français et en anglais, et exécutée comme loi de l'Etat.",LOI_N_73_12_DU_07_DECEMBRE_1973_PORTANT_ORGANISATION_GENERALE_DE_LA_PROTECTION_CIVILE,0,loi,
