URL,text,page_title,page_label,category,metadata
https://www.juriafrica.com/lex/loi-88-023-16-dec-1988-17412.htm,"LOI N° 88/023 DU 16 DÉCEMBRE 1988 AUTORISANT LE PRÉSIDENT DE LA RÉPUBLIQUE À RATIFIER LA CONVENTION PORTANT CRÉATION DE L'AGENCE MULTILATÉRALE DE GARANTIE DES INVESTISSEMENTS (AGMI).

L'Assemblée Nationale a délibéré et adopté,
Le Président de la République promulgue la loi dont la teneur suit :
Art. 1er —  Le Président de la République est autorisé à ratifier la convention portant création de l'Agence Multilatérale de Garantie des Investissements signée le 27 Janvier 1988.
Art. 2 —  La présente loi sera enregistrée, promulguée suivant la procédure d'urgence, puis publiée au Journal Officiel en Français et en Anglais./.-",LOI_N_88_023_DU_16_DECEMBRE_1988_AUTORISANT_LE_PRESIDENT_DE_LA_REPUBLIQUE_A_RATIFIER_LA_CONVENTION_PORTANT_CREATION_DE_L_AGENCE_MULTILATERALE_DE_GARANTIE_DES_INVESTISSEMENTS_AGMI,0,loi,
