URL,text,page_title,page_label,category,metadata
https://www.juriafrica.com/lex/loi-75-11-2-juillet-1975-17173.htm,"LOI N° 75/11 DU 02 JUILLET 1975 PORTANT RATIFICATION DE L'ORDONNANCE N° 74/7 DU 27 DÉCEMBRE 1974 PORTANT RÈGLEMENT DE L'EXERCICE 1972/1973.-

L'ASSEMBLEE NATIONALE a délibéré et adopté :
LE PRESIDENT DE LA REPUBLIQUE PROMULGUE LA LOI DONT LA TENEUR SUIT :
Art. 1er —  Est ratifiée conformément à l'article 21 de la Constitution du 2 juin 1972, l'Ordonnance n° 74/7 du Z7 décembre 1974 portant règlement de l'exercice 1972/1973.-
Art. 2 —  La présente loi sera enregistrée, et publiée au Journal Officiel de la République Unie du Cameroun en français et en anglais. -",LOI_N_75_11_DU_02_JUILLET_1975_PORTANT_RATIFICATION_DE_L_ORDONNANCE_N_74_7_DU_27_DECEMBRE_1974_PORTANT_REGLEMENT_DE_L_EXERCICE_1972_1973,0,loi,
