URL,text,page_title,page_label,category,metadata
https://www.juriafrica.com/lex/loi-76-017-08-juillet-1976-17198.htm,"LOI N° 76/017 DU 8 JUIL 1976 MODIFIANT L'ARTICLE 27 DE L'ORDONNANCE N° 72/4 DU 26 AOÛT 1972 PORTANT ORGANISATION JUDICIAIRE.

L'ASSEMBLEE NATIONALE a délibéré et adopté ;
LE PRESIDENT DE LA REPUBLIQUE promulgue la loi dont la teneur suit :
Art. 1er —  L'article 27 de l'Ordonnance n° 72/4 du 26 août 1972 modifiée par l'Ordonnance n° 72/21 du 19 octobre 1972 et la loi n° 74/3 du 16 juillet 1974, est modifié comme suit :
Art. 27 (nouveau). -  —  1° En attendant que soit conduit à son terme le processus d'uniformisation des procédures judiciaires, les fonctions du Parquet, notamment en ce qui concerne l'information judiciaire et la poursuite en première et grande instance, peuvent être assurés, sous le contrôle et la direction du Procureur Général près la Cour d'Appel, par le Président du Tribunal de Première ou un Magistrat du siège délégué à cet effet.
2° Les dispositions de l'alinéa (1) ci-dessus sont' inapplicables dans les Provinces du Nord-Ouest et du Sud-Ouest, où le Procureur Général compétent peut confier l'information judiciaire et la poursuite des infractions devant les tribunaux de Première Instance à certains officiers de Police Judiciaire placés sous sa direction et son contrôle.
Art. 2 —  La présente loi sera enregistrée et publiée selon la procédure d'urgence, puis au Journal Officiel en français et en anglais.",LOI_N_76_017_DU_8_JUIL_1976_MODIFIANT_L_ARTICLE_27_DE_L_ORDONNANCE_N_72_4_DU_26_AOUT_1972_PORTANT_ORGANISATION_JUDICIAIRE,0,loi,
