URL,text,page_title,page_label,category,metadata
https://www.juriafrica.com/lex/loi-91-011-30-juil-1991-17528.htm,"LOI N° 91/011 DU 30 JUILLET 1991 PORTANT RATIFICATION DE L'ORDONNANCE N°91/001 DU 22 FÉVRIER 1991 MODIFIANT ET COMPLETANT LES DISPOSITIONS DE L'ARTICLE 9 DE LA LOI N°90/001 DU 29 JUIN 1990 PORTANT LOI DES FINANCES DE LA REPUBLIQUE DU CAMEROUN.

L'Assemblée Nationale a délibéré et adopté,
Le PRESIDENT DE LA REPUBLIQUE promulgue la Loi dont la teneur suit :
Art. 1er —  Est ratifiée l'ordonnance n°91/001 du 22 Février 1991 modifiant et complétant les dispositions de l'article 9 de la loi n°90/001 du 29 Juin 1990 portant Loi des Finances de la République du Cameroun.
Art. 2 —  La présente loi sera enregistrée, publiée selon la procédure d'urgence, puis insérée au Journal Officiel en français et en anglais./.",LOI_N_91_011_DU_30_JUILLET_1991_PORTANT_RATIFICATION_DE_L_ORDONNANCE_N_91_001_DU_22_FEVRIER_1991_MODIFIANT_ET_COMPLETANT_LES_DISPOSITIONS_DE_L_ARTICLE_9_DE_LA_LOI_N_90_001_DU_29_JUIN_1990_PORTANT_LOI_DES_FINANCES_DE_LA_REPUBLIQUE_DU_CAMEROUN,0,loi,
