URL,text,page_title,page_label,category,metadata
https://www.juriafrica.com/lex/loi-83-021-29-novembre-1983-17311.htm,"LOI N°83/021 DU 29 NOVEMBRE 1983 AUTORISANT LE PRESIDENT DE LA REPUBLIQUE A RATIFIER L'ACCORD COMMERCIAL SIGNE LE 29 AVRIL 1983 A MALABO ENTRE LE GOUVERNEMENT DE LA REPUBLIQUE UNIE DU CAMEROUN ET LE GOUVERNEMENT DE LA REPUBLIQUE DE GUINEE EQUATORIALE.

L'ASSEMBLEE NATIONALE A DELIBERE ET ADOPTE,
LE PRESIDENT DE LA REPUBLIQUE PROMULGUE LA LOI DONT LA TENEUR SUIT :
Art. 1er —  Le Président de la République Unie du Cameroun est autorisé à ratifier l'Accord commercial entre la République de Guinée Equatoriale et la République Unie du Cameroun signé à Malabo le 29 Avril 1983.
Art. 2 —  La présente loi sera enregistrée, promulguée puis publiée au Journal Officiel en français et en anglais./-",LOI_N_83_021_DU_29_NOVEMBRE_1983_AUTORISANT_LE_PRESIDENT_DE_LA_REPUBLIQUE_A_RATIFIER_L_ACCORD_COMMERCIAL_SIGNE_LE_29_AVRIL_1983_A_MALABO_ENTRE_LE_GOUVERNEMENT_DE_LA_REPUBLIQUE_UNIE_DU_CAMEROUN_ET_LE_GOUVERNEMENT_DE_LA_REPUBLIQUE_DE_GUINEE_EQUATORIALE,0,loi,
