URL,text,page_title,page_label,metadata
https://www.juriafrica.com/lex/loi-020-83-26-novembre-1983-17310.htm,"L'ASSEMBLEE NATIONALE A DELIBERE ET ADOPTE,
LE PRESIDENT DE LA REPUBLIQUE PROMULGUE LA LOI DONT LA TENEUR SUIT :
Art. 1 —  La production, le transport et la distribution de l'électricité sont soumis aux dispositions de lb présente loi et des textes pris pour son application.
TITRE I
GENERALITES
Art. 2 —  (1) L'électricité s'entend, aux termes de la présente loi, comme une énergie générée à partir des sources primaires (cours d'eau, lacs ou marées), des matières premières minérales (charbon, pétrole, substances nucléaires, sources géothermiques ou autres), ou des sources d'énergie renouvelables (rayonnement solaire, vent, biomasse, etc.).
(2) L'établissement et l'exploitation par les particuliers, les entreprises, les administrations ou les collectivités publiques pour leurs besoins propres, d'installations de production d'électricité, constituent la production autonome d'électricité.
Ne rentrent pas dans cette catégorie, les installations de production d'électricité établies sur le domaine fluvial ou maritime dont la puissance maximale est supérieure à 1.000 kilowatts (KW).
(3) Le transport de l'électricité consiste à établir et à exploiter des réseaux électriques de haute tension en vue de relier entre elles des usines de production d'énergie électrique ou d'alimenter à partir de celles-ci des distributions publiques. Il peut comporter la vente de l'énergie électrique à des usagers gros consommateurs,
(4) La distribution d'énergie électrique consiste à établir et à exploiter des réseaux électriques de moyenne et de basses tensions, en vue de la vente de l'énergie au public ou à un usager.
(5) Une ligne électrique est privée lorsque les installations qui y sont raccordées sont utilisées exclusivement par le propriétaire de la ligne.
Elle ne peut, en aucun cas, être utilisée pour la vente de l'énergie à des tiers.
Art. 3 —  (1) La production, le transport, la distribution, l'exportation et l'importation de l'électricité en vue de la vente de l'énergie au public constituent le service public de l'électricité.
(2) Le service public de l'électricité est assuré par l'Etat, ou sous son contrôle au cas où sa gestion est confie sur tout ou partie du territoire national à des concessionnaires de droit national,
TITRE II
DE LA PRODUCTION D'ELECTRICITE
Art. 4 —  (1) L'établissement et l'exploitation d'installations de production autonome d'électricité autres que les centrales hydro-électriques, et dont la puissance des machines génératrices est inférieure ou égale à 100 kw, ne sont soumises à aucune formalité administrative,
(2) Lorsque la puissante totale des installations est supérieure à 100 kilowatts (KW) et inférieure ou égale à 1.000 kilowatts (KW), les propriétaires sont tenus d'en faire préalablement la déclaration auprès de l'administration dans les conditions fixées par décret
Art. 5 —  (1) Sont placés sous le régime de l'autorisation dans les conditions fixées par décret :
l'établissement et l'exploitation d'installations de production autonome d'électricité de puissance totale supérieure à 1.000 kilowatts (KW) ;
les aménagements hydroélectriques dont la puissance maximale est inférieure ou égale à 1.000 kilowatts (Kw).
(2) L'autorisation ne peut être accordée que dans les cas où :
il y a carence du service public de l'électricité, en raison de l'inexistence ou de l'insuffisance dans la région concernée des moyens de production, de transport et de distribution d'énergie électrique ;
le particulier, client par ailleurs du service public, entend néanmoins disposer d'une source d'énergie de secours ;
les installations de production d'énergie électrique fonctionnent comme accessoires d'une activité principale par récupération d'énergie résiduaire ou par combustion de déchets.
(3) La durée de validité de l'autorisation ne peut excéder vingt ans. Elle est renouvelable par périodes de dix ans au maximum.
(4) L'autorisation peut être retirée sans indemnité dans les conditions fixées par décret.
Art. 6 —  En cas de nécessité, les installations de production autonome' d'énergie peuvent être réquisionnées moyennant le paiement d'une juste indemnité.,
Art. 7 —  Sont placés sous le régime de la concession :
Tous les aménagements hydro-électriques dont la puissance maximale est supérieure à 1.000 KW
Les installations de production d'électricité exploitées dans le cadre du service public de l'électricité.
Art. 8 —  La durée de validité de la concession de production d'électricité est de soixante-quinze ans renouvelable par périodes de vingt-cinq ans.
Art. 9 —  (1) Toute concession est soumise aux clauses d'un cahier des charges conforme au cahier des charges type approuvé par décret.
(2) Si l'acte de concession contient des dérogations au cahier des charges type, il ne redevient définitif qu'après avoir été approuvé par décret.
Art. 10 —  (1) La concession investit le concessionnaire, pour l'exécution des travaux résultant de la concession, de tous les droits que les lois et règlements confèrent à l'administration en matière de travaux publics ; en revanche, ce dernier est soumis à toutes obligations qui en découlent pour elle.
Elle lui confère notamment le droit :
d'occuper, à l'intérieur du périmètre défini par l'acte de concession, les terrains publics et privés nécessaires à l'établissement des ouvrages de retenue ou de prise et des canaux d'adduction ou de fuite souterrains ou à ciel ouvert ;
de submerger les berges par le relèvement du plan d'eau ;
d'occuper temporairement tous terrains et d'extraire tous matériaux nécessaires à l'exécution des ouvrages en se conformant à la législation minière en vigueur ;
d'exercer des servitudes d'appui, de passage, d'ébranchage et d'abattage pour 1' établissement et l'exploitation des ouvrages d'évacuation d'énergie dépendant de la concession.
(2) Les indemnités résultant de l'exécution des travaux ou de l'exercice des servitudes visées au paragraphe précédent sont réglées conformément à la législation en vigueur.
Art. 11 —  (1) L'exécution des travaux et l'exercice des servitudes prévus à l'article 10 doivent être précédés d'une déclaration d'utilité publique ; il y est procédé conformément à la législation en vigueur, aux frais du concessionnaire.
Art. 12 —  (1) L'exécution des travaux doit s'effectuer de manière à ne cas léser les riverains, ou porter atteinte à l'environnement.
(2) L'éviction des droits particuliers à l'usage de l'eau, exercés ou non, entraîne réparation si ces droits préexistaient à la concession.
Le montant de l'indemnité est fixé soit en accord avec les intéressés, soit à lire d'experts.
En cas de réputation en nature, le concessionnaire est tenu de restituer l'eau ou l'énergie utilisée et, le cas échéant, de supporter les frais de transformation des installations préexistantes.
En cas de désaccord sur la nature et le montant de l'indemnité due, la contestation est portée devant la juridiction compétente.
Art. 13 —  Les droits résultant du contrat de concession ou de l'arrêté d'autorisation sont susceptibles d'hypothèques.
Art. 14 —  Si le concessionnaire est une société, celle-ci doit être dirigée par des ressortissants camerounais. L'Etat doit détente au moins 35 % de son capital.
TITRE III
DU TRANSPORT ET DE LA DISTRIBUTION DE L'ENERGIE ELECTRIQUE.
Art. 15 —  L'établissement et l'exploitation d'une distribution d'énergie électrique en vue de fournir directement ou indirectement une puissance inférieure ou égale à 100 KW sont soumises à autorisation dans les conditions fixées par décret.
Art. 16 —  Les installations de distribution publique peuvent, en cas de besoin, être rachetées en totalité ou en partie par l'Etat ou le concessionnaire, notamment lorsque la puissance totale à fournir dépasse 100 KW.
Art. 17 —  (1) L'établissement des lignes électriques privées est libre lorsque les-ouvrages sont entièrement implantés sur des propriétés privées et sous la double condition que :
aucune voie publique ne soit utilisée par les lignes ;
les conducteurs ne soient en aucun point situés à moins de dix mètres de distance horizontale d'une ligne électrique, téléphonique ou télégraphique existante.
Dans le cas contraire l'établissement de ces lignes est soumis à autorisation dans les conditions fixées par décret.
(2) L'établissement de ces lignes doit satisfaire aux conditions techniques prévues par voie réglementaire.
Art. 18 —  Sauf dérogation accordée sous la forme de permission de voirie par l'autorité compétente, nul ne peut établir une ligne électrique privée sur le domaine public, même pour une traversée aérienne ou souterraine.
Art. 19 —  Le transport de l'énergie électrique est assuré exclusivement sous le régime de la concession dans les conditions fixées par décret.
Art. 20 —  L'établissement et l'exploitation d'une distribution d'énergie électrique de plus de 100 KW ne peuvent être assurés que sous le régime de la concession dans les conditions fixées par décret.
Art. 21 —  La durée de validité de la concession en vue de la distribution ou du transport de l'électricité est de soixante-quinze ans, renouvelable par période de vingt-cinq ans.
Art. 22 —  Les concessions de distribution ou de transport de l'électricité sont soumises aux clauses d'un cahier des charges conformément aux dispositions de l'article 9 ci-dessus.
Art. 23 —  La concession confère au concessionnaire le droit :
d'utiliser les voies publiques de toute nature et leurs dépendances dans les limites de la concession
d'utiliser, à l'intérieur de l'emprise des voies publiques et de leurs dépendances, les ouvrages de transport et de distribution, et d'exécuter dans les mêmes conditions tous travaux nécessaires à leur entretien dans le respect du cahier des charges et de la réglementation en vigueur.
Art. 24 —  (1) La concession investit le concessionnaire, pour l'exécution des travaux objet de la concession, de tous les droits que les lois et règlements confèrent à l'administration en matière de travaux publics. Ce dernier demeure en même temps soumis à toutes les obligations qui en découlent pour elle.
(2) Elle luit confère notamment, dans les conditions fixées par décret, le droit :
d'établir à demeure des support et ouvrages pour conducteurs aériens d'électricité, soit à l'extérieur des murs ou façades donnant sur la voie publique, soit sur les toits et terrasses des bâtiments, à la condition qu'on puisse y accéder de l'extérieur ;
de faire passer les conducteurs d'électricité au-dessus des propriétés privées ;
d'établir à demeure, sur des terrains privés non bâtis qui ne sont pas fermés de murs ou autres clôtures équivalentes, des canalisations souterraines ou des supports pour conducteurs aériens
de couper les arbres et branches d'arbres qui se trouvant à proximité des conducteurs aériens d'électricité, gênent leur pose ou pourraient par leurs mouvements ou chutes occasionner des courts-circuits ou des avaries aux ouvrages.
Art. 25 —  (1) L'exécution des travaux prévus à l'article 24 ci-dessus doit être précédée d'une notification directe aux intéressés. Elle n'entraîne aucune dépossession.
(2) La pose d'appuis sur les murs et façades ne peut faire obstacle au droit du propriétaire de les démolir, de les modifier ou de les surélever.
La pose des canalisations ou supports dans un terrain ouvert et non bâti ne fait pas non plus obstacle au droit du propriétaire de clore ou de bâtir. Dans ce cas, ce dernier devra, trois mois avant d'entreprendre les travaux, prévenir par lettre recommandée le concessionnaire qui sera tenu de déplacer les ouvrages à ses frais.
Art. 26 —  Les indemnités dues à raison des servitudes d'appui, d'ébranchage ou d'abattage, prévues à l'article 24 sont fixées conformément à la réglementation en vigueur.
TITRE IV
CONTROLE ET DISPOSITIONS PENALES
Art. 27 —  (1) Les modalités de contrôle de l'aménagement, de l'établissement ou de l'exploitation des ouvrages de production, de transport et de distribution d'énergie électrique sont fixées par décret.
(2) Les frais résultent de ce contrôle sont fixés par voie réglementaire et sont à la charge des exploitants.
Art. 28 —  Sans préjudice, le cas échéant, de la réparation du dommage causé, les infractions aux dispositions de la présente loi et des textes pris pour son application constituent-des contraventions de 4ème classe.
Il en est ainsi également de :
toute obstruction à l'exécution des travaux concédés, à l'entretien des ouvrages concédés ou à l'exercice par le concessionnaire des servitudes visées aux articles 9 et 24
toute atteinte portée aux installations de distribution publique ou de transport d'énergie électrique, ou à leur fonctionnement.
Art. 29 —  Les infractions visées à l'article 28 ci-dessus sont constatées par les Officiers de police judiciaire, les experts assermentés ou toute personne désignée et assermentée à cet effet.
TITRE V
DISPOSITIONS DIVERSES ET TRANSITOIRES.
Art. 30 —  (1) Des pénalités pourront être stipulées au pro- fit de l'Etat, à raison de l'inobservation des clauses du cahier des charges par le concessionnaire concernant notamment l'achèvement des travaux, l'entretien des ouvrages, la fourniture ou le transport de l'énergie électrique, ou les conditions de ce transport du de cette fourniture.
(2) Les cahiers des charges précisent, le cas échéant, les cas de force majeure que le concessionnaire sera admis à invoquer.
Art. 31 —  (1) Demeurent en vigueur jusqu'à leur expiration, les concessions accordées antérieurement à la présente loi. Toutefois, les avenants aux dites concessions devront obéir aux dispositions de la présente législation.
(2) Dans un délai d'un an à compter de la date de publication des nouveaux cahiers des charges type, l'autorité concédante ou le concessionnaire pourra demander la révision des cahiers des charges en vigueur.
(3) Les entreprises de distribution publiques non concédées actuellement en activité disposent d'un délai d'un an pour compter de la date de publication de la présente loi pour se conformer à ses dispositions.
Art. 32 —  Sont abrogées toutes les dispositions antérieures, notamment l'arrêté du 15 septembre 1921 relatif à l'utilisation des forces hydrauliques dans le territoire du Cameroun et le Décret du 24 septembre 1931 portant réglementation des distributions et des lignes de transport d'énergie électrique au Cameroun,
Art. 33 —  La 'présente loi sera enregistrée, promulguée puis publiée au Journal Officiel en Français et en Anglais.",LOI_N_020_83_DU_26_NOVEMBRE_1983_PORTANT_REGIME_DE_L_ELECTRICITE,0,
