URL,text,page_title,page_label,metadata
https://www.juriafrica.com/lex/loi-94-003-04-aout-1994-17571.htm,"L'Assemblée Nationale a délibéré et adopté,
Le Président de la République promulgue la loi dont la teneur suit :
Art. 1er —  - Le Président de la République est autorisé à proroger
à compter du 06 Mai 1994 et à titre exceptionnel, pour une période n'ex-cédant pas Dix-huit (18) mois, le mandat des Conseillers Municipaux élus lors du scrutin du 25 Octobre 1987.
Art. 2 —  - La présente loi sera enregistrée, publiée suivant la procé-dure d'urgence, puis insérée au Journal Officiel en Français et en Anglais./-",LOI_N_94_003_DU_04_AOUT_1994_AUTORISANT_LE_PRESIDENT_DE_LA_REPUBLIQUE_A_PROROGER_A_TITRE_EXCEPTIONNEL_LE_MANDAT_DES_CONSEILLERS_MUNICIPAUX_ELUS_LORS_DU_SCRUTIN_DU_25_OCTOBRE_1987,0,
