URL,text,page_title,page_label,category,metadata
https://www.juriafrica.com/lex/loi-83-007-21-juil-1983-17296.htm,"LOI N°83/007 DU 21 JUILLET 1983 MODIFIANT ET COMPLÉTANT LA LOI N° 79/21 DU 30 NOVEMBRE 1979 ACCORDANT À LA MISSION D'AMÉNAGEMENT ET D'EQUIPEMENT DES TERRAINS URBAINS ET RURAUX (MAETUR) UN RÉGIME FISCAL PRIVILÉGIÉ.

L'Assemblée Nationale a délibéré et adopté,
Le Président de la République promulgue la loi dont la teneur suit
Art. 1er —  L'article 1er de la loi n° 79/21 du 30 novembre 1979 est modifié et complété ainsi qu'il suit :
Art. 1 (nouveau) :  —  1) Il est accordé à la Mission d'Aménagement et d'Equipement des Terrains Urbains et Ruraux un régime fiscal privilégié défini par la présente loi.
2) Ce régime comporte des exonérations sur :
l'impôt sur le chiffre d'affaires intérieur et relatif :
aux études et travaux d'aménagement et d'équipement des lots sociaux exécutés par la MAETUR et ou pour son compte par les entrepreneurs généraux ;
et aux activités de vente des lots sociaux .
l'impôt minimum forfaitaire sur les sociétés et autres personnes morales ;
la taxe sur la distribution de crédit pour les emprunts contractés par elle ;
les droits d'enregistrement des conventions de financement et des marchés, relatifs aux opérations à caractère social ;
les droits progressifs d'enregistrement des actes de vente des lots sociaux ;
Art. 2 —  La présente loi sera enregistrée, promulguée puis publiée au Journal Officiel en français et en anglais./-",LOI_N_83_007_DU_21_JUILLET_1983_MODIFIANT_ET_COMPLETANT_LA_LOI_N_79_21_DU_30_NOVEMBRE_1979_ACCORDANT_A_LA_MISSION_D_AMENAGEMENT_ET_D_EQUIPEMENT_DES_TERRAINS_URBAINS_ET_RURAUX_MAETUR_UN_REGIME_FISCAL_PRIVILEGIE,0,loi,
