URL,text,page_title,page_label,category,metadata
https://www.juriafrica.com/lex/loi-83-006-21-juil-1983-17295.htm,"LOI N°83/006 DU 21 JUILLET 1983 AUTORISANT LE PRÉSIDENT DE LA RÉPUBLIQUE À RATIFIER L'ACCORD CONCLU ENTRE LA RÉPUBLIQUE UNIE DU CAMEROUN ET LA RÉPUBLIQUE POPULAIRE DU CONGO RELATIF AUX TRANS- PORTS AÉRIENS,

L'ASSEMBLEE NATIONALE A DÉLIBÉRÉ ET ADOPTÉ.
LE PRÉSIDENT DE LA RÉPUBLIQUE PROMULGUE LA LOI DONT LA TENEUR SUIT
ARTICLE ler.-
Le Président de la République est autorisé à ratifier l'Accord conclu à YAOUNDE le 26 août 1982 entre la République Unie du Cameroun et la République Populaire du Congo, relatif aux transports aériens.
Art. 2 —  La présente loi sera enregistrée, promulguée puis publiée au Journal Officiel en français et en anglais./-",LOI_N_83_006_DU_21_JUILLET_1983_AUTORISANT_LE_PRESIDENT_DE_LA_REPUBLIQUE_A_RATIFIER_L_ACCORD_CONCLU_ENTRE_LA_REPUBLIQUE_UNIE_DU_CAMEROUN_ET_LA_REPUBLIQUE_POPULAIRE_DU_CONGO_RELATIF_AUX_TRANS_PORTS_AERIENS,0,loi,
