URL,text,page_title,page_label,metadata
https://www.juriafrica.com/lex/loi-76-25-14-dec-1976-17206.htm,"L'ASSEMBLEE NATIONALE a délibéré et adopté ;
LE PRESIDENT DE LA REPUBLIQUE promulgue la loi dont la teneur suit:
TITRE I
DE LA CONFECTION DU CADASTRE
Art. 1er —  Les terrains sont, dans toute l'étendue du territoire de la République soumis à un dénombrement général et précis permettant l'établissement d'un cadastre parcellaire.
Art. 2 —  La confection du cadastre basée sur un arpentage parcellaire s'accompagne d'une délimitation des propriétés publiques et privées. Cette délimitation entraîne l'obligation du bornage et l'établissement d'un plan cadastral numérique.
Art. 3 —  Les opérations de confection du Cadastre ont pour objet :
la réalisation de canevas de base en vue du levé topographique;
la délimitation de la propriété, la délimitation de la contenance, la définition de l'affectation, le classement et l'évaluation de chaque immeuble (propriétés bâties et non bâties)
l'établissement des plans parcellaires aux échelles de:
1/500e, 1/1000e, 1/2000e, 1/5000e, ainsi que des problèmes d'assemblage aux échelles de 1/5000e et 1/10.000e
l'établissement des registres cadastraux: état de service, matrice cadastrale.
Art. 4 —  La confection du cadastre de la Commune s'effectue: soit au moyen d'une intégration des documents topographiques existants, soit au moyen des résultats d'un arpentage général, réalisée dans les conditions prévues par les instructions techniques et rattachées à une triangulation greffée sur le réseau géodésique national.
Art. 5 —  La confection du cadastre est effectuée aux frais de l'Etat.
Art. 6 —  La délimitation des propriétés s'effectue en présence d'une commission administrative dont la composition et les modalités de fonctionnement seront fixées par Décret.
Art. 7 —  La commission de délimitation a pour mission :
de fournir à l'agent chargé des opérations tous renseignements et indications de nature à faciliter la recherche et la connaissance des propriétaires et des limites de propriétés;
de constater s'il y'a lieu l'accord des intéressés sur les limites de leurs immeubles et, en cas de désaccord, de les concilier;
de matérialiser provisoirement des parcelles litigieuses dont les contestations n'ont pu être réglées à l'amiable.
Art. 8 —  La date d'ouverture des travaux de confection du Cadastre dans une commune est portée à la connaissance du public par voie de presse, de radio et d'affichage dans les locaux de la circonscription administrative et de la Mairie, deux (2) mois au moins à l'avance.
Art. 9 —  Les propriétaires, les détenteurs coutumiers, les exploitants, les autres détenteurs d'immeubles ou leurs représentants dûment mandatés doivent assister aux constatations sur le terrain et formuler leurs observations, ils sont tenus :
d'indiquer chacune des propriétés qu'ils détiennent;
de laisser pénétrer dans leurs propriétés y compris les jardins, cours et enclos attenant aux habitations, les agents et membres de la commission chargés des travaux;
de répondre à toute convocation sur le terrain ou au bureau du Cadastre et de fournir tous renseignements qui leur seront demandés, en produisant le cas échéant les titres qui sont en leur possession;
de matérialiser d'une manière durable au moyen des bornes les limites des propriétés.
Art. 10 —  La fourniture des bornes, leur mise en place et les frais éventuels de débroussaillement sont selon le cas, à la charge des propriétaires ou des collectivités locales.
Art. 11 —  Lorsque les travaux de terrain sont terminés dans une commune, il est établi d'après les résultats obtenus :
un procès-verbal de délimitation de la commune dans son ensemble;
des plans cadastraux conformes à la situation des lieux;
un état de section dans lequel les immeubles sont classés dans l'ordre topographique;
une matrice cadastrale qui fait apparaître pour chaque propriétaire la liste des immeubles qu'il possède dans la commune avec leur classement et leur évaluation.
Art. 12 —  Les nouveaux plans cadastraux et 1'état de section sont déposés pendant 02 mois au Bureau du Cadastre afin de permettre aux propriétaires d'en prendre connaissance et de formuler leurs observations.
A la suite de cette communication et des observations recueillies, les erreurs éventuellement commises sont corrigées sur les documents cadastraux.
Art. 13 —  A l'expiration du délai de communication visé à l'article 12 ci-dessus et après correction des erreurs, les nouveaux documents sont, sauf pour les parties en litige, réputés conformes à actuelle des propriétés.
La procédure d'homologation des résultats des travaux cadastraux est fixée par décret.
TITRE II
DE LA CONSERVATION CADASTRALE.
Art. 14 —  La conservation du Cadastre est l'ensemble des appréciations permettant d'actualiser les documents cadastraux. Elle est annuelle.
Art. 15 —  Les propriétaires, possesseurs, usufruitiers, exploitants et autres détenteurs d'immeubles sont tenus de répondre aux convocations faites par l'agent du Cadastre chargé de la conservation, afin de lui fournir des renseignements utiles pour la tenue à jour des documents cadastraux.
Art. 16 —  Dans tous les actes notariés, les décisions de justice, les actes administratifs, les immeubles sont identifiés conformément aux désignations cadastrales.
Si l'acte ou le jugement porte sur une partie de l'immeuble ou sur plusieurs immeubles (morcellement, lotissement, partage, co-propriété, fusion) il est procédé préalablement à la rédaction de l'acte, à la délimitation et au bornage de la partie concernée. L'acte où le jugement est rédigé au vue du plan d'arpentage visé par le Cadastre.
Art. 17 —  Pour permettre la mise à jour des documents cadastraux ainsi que la concordance entre le fichier immobilier et le cadastre, une copie des actes visés à l'article 16 ci-dessus doit être adressée au service du Cadastre compétent par leurs rédacteurs ou leurs signataires dans les 30 jours de leur enregistrement en ce qui concerne les actes notariés et les décisions de justice, ou de leur signature en ce qui concerne les actes administratifs.
Art. 18 —  Les Services du Cadastre sont habilités à constater d'office, pour 1a mise à jour des documents dont ils ont la charge les changements de toute nature n'affectant pas la situation juridique des immeubles.
Art. 19 —  Les plans cadastraux et le bornage d'immeubles, les procès-verbaux d'arpentage sont dressés par des agents assermentés du Cadastre ou par les Géomètres-Experts fonciers agrées par le Cadastre. Ces derniers doivent soumettre au préalable pour vérification et visa, leurs documents au Cadastre.
Art. 20 —  Les extraits cadastraux (plans, matrices, procès-verbaux d'arpentage), les tirages des plans cadastraux sont exclusivement délivrés par l'administration du cadastre contre paiement des droits qui sont fixés par la Loi des Finances.
Art. 21 —  Les agents du Cadastre sont habilités à exécuter sur les terrains privés, sur les terrains du domaine national ou du domaine de l'Etat, tous travaux de géodésie, d'arpentage ou tous autres travaux techniques pour le compte de l'Etat ou des Communes.
Les dommages causés aux propriétaires lors des opérations sont indemnisés conformément aux Articles 8 et suivants de l'Ordonnance n° 74/3 du 6 Juillet 1974 relative à la procédure d'expropriation pour cause d'utilité publique et aux modalités d'indemnisation.
Art. 22 —  En application de l'article 21 ci-dessus, les services du Cadastre peuvent installer des balises sur les immeubles. Ces signaux peuvent être temporaires ou permanents. Lorsqu'ils sont permanents, le propriétaire de l'immeuble en est informé.
Art. 23 —  Lorsque certaines parties d'édifices constituent des points de triangulation permanents, les propriétaires en sont informés. Ces derniers peuvent en modifier l'état qu'après en avoir averti l'administration du Cadastre au moins deux mois à l'avance. Il en est de même pour les repères scellés dans les mûrs des bâtiments,
TITRE III
DE LA COORDINATION, CENTRALISATION DES TRAVAUX GEODESIQUES, DES LEVES TOPOGRAPHIQUES, TOPOMETRIQUES ET PHOTOGRAMMETRIQUES.
Art. 24 —  Les orignaux des documents de tous travaux géodésiques, les levés topographiques et topométriques à toutes les échelles, les clichés des prises de vue verticale de toutes les agglomérations et des zones rurales entrepris pour le compte de 1'Etat, des collectivités locales, des établissements publics ainsi que des sociétés d'économie mixte doivent être déposés au Cadastre pour vérification et conservation.
Ces documents deviennent dès réception, propriété de l'Etat et l'administration du Cadastre est seule habilitée à faire reproductions en vue de cession sans que l'entrepreneur puisse réclamer une indemnité supplémentaire.
Art. 25 —  Les travaux géodésiques, les levés topographiques et topométriques à toutes les échelles, les photographies aériennes sont soumis au contrôle du Cadastre avant leur réception et leur liquidation. Les originaux des documents de terrain, les feuilles de calcul et les plans sont déposés au cadastre pour vérification. Si ce contrôle révèle des insuffisances ou erreurs non conformes aux instructions techniques en vigueur, les travaux sont refaits aux frais de l'entrepreneur.
TITRE IV
DISPOSITIONS PENALES
Art. 26 —  Sous réserve des dispositions prévues aux articles 188 et 317 du Code Pénal, relatives à l'opposition à travaux, au déplacement et à la destruction des bornes, toute autre infraction aux dispositions de la présente loi est punie d'un emprisonnement de 3 jours à 6 mois et d'une amende de 5.000 Francs à 500.000 Francs ou de l'une de ces deux peines seulement.
Art. 27 —  Les infractions aux dispositions de la présente Loi sont concurremment constatées par les agents assermentés du Cadastre et les officiers ou agents de Police Judiciaire.
Les procès-verbaux de leurs constatations qui font foi jusqu'à preuve contraire sont adressés au Procureur de la République du lieu de l'infraction.
TITRE V
DISPOSITIONS DIVERSES ET TRANSITOIRES
Art. 28 —  Avant d'entrer en fonction, les agents du Cadastre prêtent serment devant le tribunal de première instance du lieu de leur résidence. Ce serment n'est pas renouvelable en cas de mutation. Ils sont personnellement responsables de leurs travaux. Il leur est interdit, sauf autorisation spéciale de leur supérieur hiérarchique:
délivrer copies et extraits des travaux qu'ils exécutent dans l'exercice de leurs fonctions ;
donner communication des documents qu'ils détiennent.
Toutefois, les services du Cadastre peuvent délivrer des extraits et documents à la demande des ayants-droit ou sur réquisition administrative ou décision judiciaire.
Art. 29 —  Les entrepreneurs ayant effectués des travaux topographiques et topométriques, des prises de vue aérienne pour le compte de l'Etat, des collectivités locales, des établissements publics ou les sociétés d'économie mixte doivent, dans un délai de six mois à compter de la date de publication de la présente, les déposer au Service Provincial du Cadastre compétent.
Art. 30 —  Des décrets fixeront, en tant que de besoin, les modalités pratiques d'application de la présente loi.
Art. 31 —  La présente loi sera enregistrée, publiée selon la procédure d'urgence, puis au Journal Officiel en français et en anglais.-",LOI_N_76_25_DU_14_DECEMBRE_1976_PORTANT_ORGANISATION_CADASTRALE,0,
