URL,text,page_title,page_label,category,metadata
https://www.juriafrica.com/lex/loi-95-015-08-aout-1995-17594.htm,"LOI N° 95/015 DU 08 AOÛT 1995 APPROUVANT L'AVENANT N° 4 A LA CONVENTION D'ETABLISSEMENT CONCLUE LE 11 MARS 1982 ENTRE LA REPUBLIQUE DU CAMEROUN ET LA SOCIETE ""ELF DE RECHERCHES ET D'EXPLOITATION DES PETROLES DU CAMEROUN"" (ELF SEREPCA)

L'Assemblée Nationale a délibéré et adopté,
Le Président de la République promulgue la loi dont la teneur suit :
ARTICLE ler.- Est approuvé, l'Avenant n° 4 à la Convention d'établissement conclue le 11 Mars 1982 entre la République du Cameroun et la Société ""ELF de Recherches et d'Exploitation des Pétroles du Cameroun"" (ELP - SEREPCA).
Art. 2 —  - La présente loi sera enregistrée et publiée selon la procédure d'urgence, puis insérée au Journal Officiel en français et en anglais.-",LOI_N_95_015_DU_08_AOUT_1995_APPROUVANT_L_AVENANT_N_4_A_LA_CONVENTION_D_ETABLISSEMENT_CONCLUE_LE_11_MARS_1982_ENTRE_LA_REPUBLIQUE_DU_CAMEROUN_ET_LA_SOCIETE_ELF_DE_RECHERCHES_ET_D_EXPLOITATION_DES_PETROLES_DU_CAMEROUN_ELF_SEREPCA,0,loi,
