URL,text,page_title,page_label,category,metadata
https://www.juriafrica.com/lex/loi-75-018-8-decembre-1975-17180.htm,"LOI N° 75/018 DU 08 DÉCEMBRE 1975 RELATIVE À LA RECONNAISSANCE DES SENTENCES ARBITRALES.

L'ASSEMBLEE NATIONALE A DELIBERE ET ADOPTE
LE PRESIDENT DE LA REPUBLIQUE PROMULGUE LA LOI DONT La TENEUR SUIT :
Art. 1er —  (1) la Cour Suprême est habilitée à reconnaître par arrêt, les sentences rendues par les organes arbitraux de la Convention en date du 18 mars 1965, signée à WASHINGTON pour le règlement des différends relatifs aux investissements entre Etats et Ressortissants d'autres Etats.
(2) Cette reconnaissance emporte obligation pour le greffier en chef de la Cour Suprême d'apposer sur la sentence arbitrale reconnue la formule exécutoire.
Art. 2 —  La présente loi sera enregistrée, publiée selon la procédure d'urgence puis au Journal Officiel en français et en anglais.-",LOI_N_75_018_DU_08_DECEMBRE_1975_RELATIVE_A_LA_RECONNAISSANCE_DES_SENTENCES_ARBITRALES,0,loi,
