URL,text,page_title,page_label,metadata
https://www.juriafrica.com/lex/loi-79-021-30-novembre-1979-17229.htm,"L'ASSEMBLEE NATIONALE A DELIBERE ET ADOPTE ;
LE PRESIDENT DE LA REPUBLIQUE PROMULGUE LA LOI DONT LA TENEUR SUIT
Art. 1er —  Il est accordé, à la Mission d'Aménagement et d'équipement des Terrains .Urbains et Ruraux (MAETUR), établissement public créé par décret n° 77/193 du 23 juin 1977, les exonérations fiscales ci-après :
l'impôt sur le chiffre d'affaires intérieur
l'impôt minimum forfaitaire sur les sociétés et autres personnes morales ;
la taxe sur la distribution du crédit pour les emprunts contractés par elle ;
Les droits d'enregistrement de tous les actes passés par. elle, notamment les conventions de financement, l'aval des emprunts et les marchés.
Art. 2 —  La présente loi sera enregistrée et publiée au Journal Officiel en français et en anglais. /-",LOI_N_79_021_DU_30_NOVEMBRE_1979_ACCORDANT_A_LA_MISSION_D_AMENAGEMENT_ET_D_EQUIPEMENT_DES_TERRAINS_URBAINS_ET_RURAUX_MAETUR_UN_REGIME_FISCAL_PRIVILEGIE,0,
