URL,text,page_title,page_label,category,metadata
https://www.juriafrica.com/lex/loi-98-021-24-dec-1998-17613.htm,"LOI N°98/021 DU 24 DÉCEMBRE 1998 PORTANT ORGANISATION DU SECTEUR PORTUAIRE.-

L'Assemblée Nationale a délibéré et adopté,
Le Président de la République promulgue la loi dont la teneur suit :
CHAPITRE I
DES DISPOSITIONS GENERALES
Art. 1 —  La présente loi porte organisation du secteur portuaire au Cameroun.
Art. 2 —  L'Etat définit la politique portuaire nationale.
A ce titre, il :
détermine les sites portuaires ;
approuve les plans généraux d'aménagements portuaires ;
assure la coordination de l'activité portuaire avec les autres modes de transport ;
édicte les règles de protection de l'environnement et de la sécurité portuaires ;
veille à la contribution, par chaque organisme portuaire autonome visé à l'article 3 ci-dessous, à l'optimisation de l'ensemble de la chaîne de transport portuaire.
Art. 3 —  La mise en œuvre de la politique portuaire prévue à l'article 2 ci-dessus est, conformément aux dispositions de la présente loi, assurée par l'Administration chargée des affaires portuaires, et sous sa supervision, par les structures ci-après instituées par ladite loi :
l'Autorité Portuaire Nationale ;
les Organismes Portuaires Autonomes ,
les Comités Consultatifs d'Orientation.
CHAPITRE II
DE L'AUTORITE PORTUAIRE NATIONALE
Art. 4 —  La forme juridique, l'organisation et les modalités dé fonctionnement de l'Autorité Portuaire Nationale prévue à l'article 3 ci-dessus sont fixées par voie réglementaire.
Art. 5 —  L'Autorité Portuaire Nationale est investie des prérogatives de puissance publique.
A ce titre, elle est chargée, notamment :
de la planification du développement portuaire national ;
de l'élaboration et du contrôle de l'application des normes de sécurité et de police portuaires ;
de la participation, en tant que de besoin, aux négociations des accords signés par le Gouvernement dans le domaine portuaire ;
du suivi de l'application de la législation et de la réglementation en matière de protection de l'environnement portuaire ;
du suivi de l'application de la législation et de la réglementation, ainsi que des performances portuaires ;
du respect des règles de concurrence dans l'exercice des activités portuaires ;
de la supervision des activités portuaires ;
du suivi de la mise en œuvre du plan de réduction des coûts portuaires.
Art. 6 —  L'Autorité Portuaire Nationale définit le cadre des régimes de transfert et des conditions d'exercice des activités portuaires.
Art. 7 —  (1) Les ressources de l'Autorité Portuaire Nationale proviennent :
d'une redevance payée par chaque organisme portuaire autonome ;
des subventions éventuelles ;
des dons et legs ;
de toute autre ressource définie par la loi des Finances.
(2) Le taux et les modalités de recouvrement de la redevance sur les organismes portuaires prévues à l'alinéa (1) du présent article sont définies par des textes particuliers.
CHAPITRE III
DES ORGANISMES PORTUAIRES AUTONOMES
Art. 8 —  (1) La gestion, la promotion et le marketing de chaque port sont assurés par un organisme portuaire autonome.
(2) La création, la forme juridique, l'organisation et les modalités de fonctionnement de l'organisme portuaire autonome sont fixées par voie réglementaire.
Art. 9 —  (1) Les activités commerciales et industrielles s'exerçant au sein de chaque port autonome concernent, notamment :
l'entreposage ;
la manutention ;
le transit ;
le remorquage ;
la consignation ;
l'avitaillement des navires ;
le stockage ;
la gestion et l'entretien des terminaux ;
les installations industrielles ;
le pilotage.
(2) Les activités visées à l'alinéa (1) ci-dessus font l'objet, par l'organisme portuaire autonome concerné, de transfert au secteur privé.
(3) Toutefois, si le transfert au secteur privé d'une des activités visées à l'alinéa (1) ci-dessus s'avère infructueux, l'organisme portuaire autonome peut, à titre exceptionnel, en assurer la gestion directe, après avis du Comité Consultatif d'Orientation compétent. Dans ce cas, le Comité Consultatif d'Orientation émet un avis sur les modalités de gestion de l'activité considérée.
Art. 10 —  (1) La construction et la réparation navales font l'objet de concession ou, le cas échéant, de transfert au secteur privé.
(2) Les conditions et modalités de concession ou de transfert au secteur privé des activités prévues à l'alinéa (1) du présent article sont fixés par des textes particuliers.
Art. 11 —  (1) L'organisme portuaire autonome est chargé de la coordination des activités au sein de sa circonscription portuaire.
(2) A ce titre, et en sa qualité de gestionnaire du domaine portuaire, l'organisme portuaire autonome assure :
la protection de l'environnement portuaire ;
la sécurité des opérations d'exploitation ; - la sécurité et la police portuaires ;
la gestion, l'entretien et la maintenance des infrastructures et des équipements portuaires ;
le renouvellement des infrastructures portuaires.
Il assure, en outre, la maîtrise d'ouvrage des travaux confiés aux entreprises spécialisées, dans les conditions spécifiées à l'article 6 de la présente loi.
(3) Le programme d'investissement en vue du renouvellement des infrastructures portuaires est élaboré par l'organisme portuaire autonome. Ce programme, ainsi que les conditions de son exécution, font l'objet de concertation entre l'organisme portuaire autonome concerné, le Comité Consultatif d'Orientation compétent et l'Autorité Portuaire Nationale.
Art. 12 —  - (1) Les ressources de chaque organisme portuaire autonome proviennent :
de la redevance d'usage du patrimoine portuaire, tel que défini à l'alinéa (2) du présent article ;
le cas échéant, du produit des prestations de services fournis conformément aux dispositions de l'article 9 alinéa (3) ci-dessus ;
des dons et legs.
(2) Le patrimoine portuaire visé à l'alinéa (1) ci-dessus est constitué du domaine public et des infrastructures et équipements portuaires.
(3) Les taux et modalités de recouvrement de la redevance prévue à l'alinéa (1) du présent article sont déterminés par chaque organisme portuaire autonome, en liaison avec son Comité Consultatif d'Orientation.
CHAPITRE IV
DES COMITES CONSULTATIFS D'ORIENTATION
Art. 13 —  - (1) Il est créé au sein de chaque port autonome, conformément aux dispositions de l'article 3 de la présente loi, un Comité Consultatif d'Orientation.
(2) Le Comité Consultatif d'Orientation comprend majoritairement les opérateurs et usagers portuaires. Il est consulté sur toutes les questions relatives à la programmation des investissements, à l'organisation des opérations. à la tarification des prestations des intervenants portuaires, à la promotion du port et à l'échange d'informations.
(3) L'organisation et les modalités de fonctionnement des Comités Consultatifs d'Orientation sont fixées par voie réglementaire.
(4) Le budget de fonctionnement du Comité Consultatif d'Orientation est supporté par chaque organisme portuaire autonome.
CHAPITRE V
DES DISPOSITIONS TRANSITOIRES ET FINALES
Art. 14 —  - Les investissements portuaires peuvent bénéficier des dispositions du code des investissements.
Art. 15 —  - (1) Les mesures prévues par la présente loi feront l'objet d'un plan d'action arrêté par le Gouvernement et dont la mise en oeuvre ne saurait excéder un délai de deux (2) ans à compter de la date de promulgation de ladite loi.
(2) Le plan d'action visé à l'alinéa (1) ci-dessus déterminera notamment les modalités et le planning de la transition des structures actuelles de gestion des ports vers celles instituées par la présente loi.
Art. 16 —  - Nonobstant les dispositions de l'article 15 ci-dessus, la mise en place de l'Autorité Portuaire Nationale, des organismes portuaires autonomes et des Comités Consultatifs d'Orientation devra intervenir dans un délai maximum de six (6) mois à compter de la date de promulgation de la présente loi.
Art. 17 —  - (1) Pendant la mise en place de l'Autorité Portuaire Nationale et des organismes portuaires autonomes, et jusqu'à cette mise en place effective dans le délai prévu à l'article 16 ci-dessus, les structures actuelles de gestion des ports continuent de fonctionner à leurs statuts.
(2) Au terme du délai prévu à l'article 16 ci-dessus, les structures actuelles de gestion des ports sont dissoutes de plein droit.
Art. 18 —  - Des décrets précisent, en tant que de besoin, les modalités d'application de la présente loi.
Art. 19 —  - La présente loi sera promulguée, publiée suivant la procédure d'urgence, puis insérée au Journal Officiel en français et en anglais./-",LOI_N_98_021_DU_24_DECEMBRE_1998_PORTANT_ORGANISATION_DU_SECTEUR_PORTUAIRE,0,loi,
